,condition,date,description,engine hours (total),id,length overall (LOA),make / manufacturer,model name / number,price,propulsion type,region,title,url,year manufactured
227,new,2016-11-19 19:11,I have 2 Factory rebuilt Seadoo engines (short block) 1 is 587 and 1 is a 657 Call Joe @ show contact info 1000.00 each.I also so have a used 587 for sale,,5884389501,2,,,$800,power, (Lorton),Factory rebuilt seadoo motors and used 1,https://washingtondc.craigslist.org/nva/boa/5884389501.html,
228,,2016-11-19 19:10,I am selling my 1988- 19 ft Taurus with 70 HP Mercury outboard call show contact info,,5873274797,19,,,$3750,power, (Lorton),19 ft bow rider with 70 hp Merc,https://washingtondc.craigslist.org/nva/boa/5873274797.html,
229,,2016-11-19 19:09,I have a 1995 XP Seadoo for sale with trailer call if interested show contact info,,5873284588,9,,,$1500,power, (Lorton),1995 SEADOO XP with trailer,https://washingtondc.craigslist.org/nva/boa/5873284588.html,
230,,2016-11-19 19:09,I am selling a 14 ft aluminin fishing boat with a Johnson 35 hp with trailer for 2500 call if interested show contact info,,5873157027,14,,,$2500,power, (22079),Fishing boat 35 HP Johnson(low hours),https://washingtondc.craigslist.org/nva/boa/5873157027.html,
231,good,2016-11-19 19:06,"this boat runs smooth and is in good shape, new floor and carpet. new alternator and boots and steering. am fm bluetooth stereo. new captain chairs and bimini top, seats 6 comfortably, many extras. new brake drums for trailer, dont miss out. $4200 obo",,5884384274,17,four winns,horizon 170,$4200,power, (silver spring),1986 4 winns horizon 205 mercruizer,https://washingtondc.craigslist.org/mld/boa/5884384274.html,1986
232,excellent,2016-11-19 19:05,"2001 in very good shape, it has at 5.7 fuel injected  mercruser bravo 3, with 280 hours on it. The pic say it all porta potty never used!! Full cover, Bimini top, sink,dual batteries, AM/FM/iPod stereo, Venture trailer with 4 new tires, runs great just don't use enough to keep. $16,500  obo.",280,5853476938,23,Crownline,230 br,$16500,power, (Haymarket),2001 230 Crownline bow rider,https://washingtondc.craigslist.org/nva/boa/5853476938.html,2001
233,excellent,2016-11-19 18:39,"I'm  selling  my beautiful for f150 condition  very good                   tires  brand new  Michelin           motor v8                                     4#4.                                        miles170,000.                            fuel ⛽  recommended #93.         automatic transmission 8cylindres                               very  strong 💪                           ready for  used  for snow ⛄       for work 🏢 title clear                only  need  new owner 😊 price $9,200 ready for tease drive  no cash ✋not trades  not  dialer  chip no  need  help  for  selling not 🚬📞 show contact info Please call  o text  office hours        thanks 👌",8,5877857216,4,g,h,$9200,power,,for  lariat f150 spot,https://washingtondc.craigslist.org/nva/boa/5877857216.html,2016
234,good,2016-11-19 18:19,"1997 Rinker Fiesta vee 24ft with 2002 trailor cubby cab has about 380 hours on mercury cruise 350 motor with bravo 3 out drive with camper cover with screens bimi top cock pit cover GPS depth finder lot of extra $12,000 obo show contact info",350,5884316774,24,Rinker,Fiesta vee,$12000,power, (Capital heights),"24ft rinker fiesta,vee",https://washingtondc.craigslist.org/doc/boa/5884316774.html,
235,good,2016-11-19 18:09,"1997 Rinker Fiesta vee 24ft with 2002 trailor cubby cab has about 380 hours on mercury cruise 350 motor with bravo 3 out drive with camper cover with screens bimi top cock pit cover GPS depth finder lot of extra $12,000 obo show contact info",350,5884318510,24,Rinker,Fiesta vee,$12000,power, (Capital heights),"24ft rinker fiesta,vee",https://washingtondc.craigslist.org/doc/boa/5884318510.html,
236,excellent,2016-11-19 17:38,97 gsx sea doo great condition i dnt have space for it no more so i need it gone it also comes with the trailer and its good until december next year,120,5884279819,106,Sea Doo,Gsx,$2000,power,,1997 Sea Doo GSX,https://washingtondc.craigslist.org/mld/boa/5884279819.html,1997
237,,2016-11-19 17:34,Trinka 12 performance dinghy daysailer designed by Laser designer B Kirby. Built by High Quality Builder Johannsen Boatworks. Can be singlehanded or sailed by small family. $3999 FIRM,,5884275286,12,trinka,trinka 12,$3999,sail, (Bay),Bruce Kirby Trinka 12 Sailboat,https://washingtondc.craigslist.org/mld/boa/5884275286.html,
238,,2016-11-19 17:34,Trinka 12 performance dinghy daysailer designed by Laser designer B Kirby. Built by High Quality Builder Johannsen Boatworks. Can be singlehanded or sailed by small family. $3500 FIRM,,5884274597,12,trinka,trinka 12,$3500,sail, (Bay),Bruce Kirby Trinka 12 Sailboat,https://washingtondc.craigslist.org/mld/boa/5884274597.html,
239,like new,2016-11-19 17:20,"1986 Bayliner Cruiser sleeps 6 with excellent running 270 Volvo engine. 790 engine hours. Inboard/outboard. New Depth/Fish finder, dual batteries. Radio and antennae, swim ladder. All lights work. New top, new toilet, air conditioning/heater, refrigerator, microwave. drapes, dining table for 4, very comfortable. All interior has been reconditioned with indoor/outdoor carpet and in very good shape. Exterior looks new with constant care. Maintained well, had out many times last year and runs great. Boat is located in the water at a Marina in Edgewater. NEED TO SELL",,5884257044,26,Bayline Ciera Trophy,Ciera Trophy,$2500,power," (EDGEWATER, MD)","1986 25'6"" BAYLINER CIERA TROPHY ""BIG SALE""",https://washingtondc.craigslist.org/mld/boa/5884257044.html,1986
240,fair,2016-11-19 16:58,"Celebrity 18ft bowrider with trailer . 4.3 mercruiser , alpha 1 outdrive , stainless prop . Many new parts . Needs some engine work . Possible head gasket ? Call or text Paul at show contact info .",,5884226451,18,celeberty,hydroflow hull,$999,power, (fairfax),"Bow  Rider , 18 ft.",https://washingtondc.craigslist.org/nva/boa/5884226451.html,1988
241,,2016-11-19 16:23,Duck hunting from private duck blinds on the currituck sound NC and back Bay VA. Hunting takes place from Knotts Island. We also hunt from the marsh or float blinds depending on the type of hunt desired and species targeted. We usually shoot a mixed bag divers and puddle ducks. Very high sucess rate on killing a swan over open water during the duck hunt for people that have a swan permit. Hunts run $150/gun for 3 or 4 hunters and $180/gun for 2 hunters. Lodging is available. Call for questions and to reserve. Thanks,,5875975894,18,,,,power,,Duck Hunting,https://washingtondc.craigslist.org/nva/boa/5875975894.html,
242,like new,2016-11-19 16:02,"For sale is my 1448 Tracker Grizzly with a 25 HP Mercury. This thing is a beast and is able to take on any aquatic venture you throw in its path. Freshwater fishing, saltwater fishing, duck hunting, bow fishing, gigging, cruising, crabbing...you name it! Boat and motor are 2010 models. The motor was bought ""new"" (out of the box/never been used) by me in April 2015. It is still pretty much new with only 10 hours on it. Boat can run in very shallow water. Motor has also never been in the salt water, has always been kept in my garage and is well maintained. Boat and trailer come with clean title. This package comes with everything  need to get on the water ASAP, including: •	Trailer •	Trolling motor w/ battery •	Rod holders •	Gas tank •	Fuel line •	Life jacket •	Emergency paddle •	Bow and stern lights •	Boat cover -      Push Pole Email or text if you would like to see more pictures.",10,5884145042,14,Tracker/Mercury,Grizzly,$5500,power, (Gainesville),Tracker Grizzly w/ 25 HP Mercury,https://washingtondc.craigslist.org/nva/boa/5884145042.html,2010
243,,2016-11-19 16:01,"ONLY USED TWICE...  NO kidding.. Bought it then sold the boat... duh.... Solid state automatic charger has shutoff when battery is fully charged, then reduces to a maintenance level. Special circuit for maintenance-free, deep cycle, low maintenance and conventional batteries. Recharges automobile batteries in 3 to 7 hours and recreational deep cycle batteries in 8 to 11 hours Silicone control rectifier senses battery condition to prevent overcharge Two switches for versatility of uses and full automatic charging",,5884143566,1,Schumacher,40-MAP,$25,human, (Ashburn),Deep cycle marine battery charger,https://washingtondc.craigslist.org/nva/boa/5884143566.html,
244,good,2016-11-19 15:57,"This is an amazing playboat ideal for entry-level paddlers learning to do a roll, wanting maximum maneuverability and control. It retailed at over $700, so at $375 with the skirt, this is a great value! The skirt alone would go for $75+ It's ideal for someone between 90 and 165 lbs, no taller than 5'9 or it gets a bit tight. I'm 5'10 165, so and have managed to work with this kayak for a while now -- it's one of the best kayaks for perfecting the roll. It has a few scratches and gashes, here and there but nothing that would compromise the integrity of the hull. Should get many more years of enjoyment out of this and the time is finally about right to hit the rapids! For an additional $250 I will add life vest and helmet. Both have only been used once in the past. Practically new.",,5884137401,45,,,$300,human, (4608 Nottingham Drive),Pyranha S:6 190 Kayak (Playboat) and Skirt,https://washingtondc.craigslist.org/nva/boa/5884137401.html,
245,good,2016-11-19 14:52,"I love this ski, but I can't bring my kids out on it. So, I'm considering selling to upgrade to a small center console. 1996 Yamaha Wave Raider 1100. The ski runs strong and fast. This past summer I did a lot of work on the ski. It has a new battery, safety cut off switch, ecu, spark plugs, fuel primer, fuel filter, carb gaskets, oem starter, tilt and trim cable. Removed choke and replaced with the fuel primer. Removed oil pump and switched it over to premix oil gas, 40:1 ratio. Clean title for WaveRaider and 1999 single axle trailer. I have it listed at the NADA low retail value. With all the work I've done I'm pretty firm on the price. http://www.nadaguides.com/Boats/1996/Yamaha/WAVE-RAIDER-1100/10201821/values",,5880107942,9,,,$1765,power, (Woodbridge),1996 Yamaha WaveRiader 1100 Triple,https://washingtondc.craigslist.org/nva/boa/5880107942.html,1996
246,good,2016-11-19 14:44,"Single Volvo 5.7L gas engine, inboard/outboard duo-prop. New propellers installed - cost over $900. Garmin GPSMap441s and DSC/VHF set-up. Comfortable well-appointed interior. On the hard. Great for weekend floating condo. Price reduced!",,5883825530,28,Bayliner,Contessa 2850,$3495,power, (Deale),1986 Bayliner Contessa,https://washingtondc.craigslist.org/nva/boa/5883825530.html,1986
247,,2016-11-19 14:40,"ABOUT 20% DISCOUNTED large marina with about 500 slips; walk to west marina, safeway, starbucks and many other local places and nightlife no car needed many amenities including: parking, pool, laundry, bathhouse, free wifi, pumpouts, ice, etc daily, short term rental, monthly, annual seasonal rentals ok let me know what you need and I will try to help slip",,5853897153,40,,,,human,,"ANCHORAGE MARINA 40Ft boat slip;daily, monthly,annual;Fells Point",https://washingtondc.craigslist.org/mld/boa/5853897153.html,
248,good,2016-11-19 14:39,"for boat or rv combination water regulator, entry screen and check valve with protection from excessive water pressure good condition, like new, works fine; temporary use only, but never installed if interested, reply with: cell phone number and do you get texts? days and times available to pickup !!!!!!!!!!!!!",,5853920998,1,,,$40,human," (silver spring, vienna)",$40 flush mount water inlet/pressure regulator,https://washingtondc.craigslist.org/mld/boa/5853920998.html,
249,good,2016-11-19 14:39,"$60 for expired flares in red/orange cylinder plastic container(the plastic container cost $27 by itself); estimate new price would be about $120 similar to/looks like: http://www.westmarine.com/webapp/wcs/stores/servlet/ProductDisplay?productId=97598&catalogId=10001&langId=-1&storeId=11151&storeNum=10107&subdeptNum=10557&classNum=11074 $30 for expired flares in a small pouch(can also slip onto your belt/waist); estimate new price would be about $60-80 like the following, but different brand, also has marking dye used on ground/snow and some kind of signal flag? http://www.westmarine.com/webapp/wcs/stores/servlet/ProductDisplay?productId=163226&catalogId=10001&langId=-1&storeId=11151&storeNum=10107&subdeptNum=10557&classNum=10558 if interested, please respond with: your cell phone number? and do you get texts? days and times you are available to pickup in north silver spring/Aspen Hill/Rockville area, tysons corner",,5853917575,1,,,,human,,"BOATING stuff: life jackets, flares, etc",https://washingtondc.craigslist.org/mld/boa/5853917575.html,
250,,2016-11-19 14:11,Very nice red canoe with 2 oak oars.  $300obo,,5850234025,16,,,$300,human, (Bethesda),Red 2 Person 16FT Canoe - Nice - Located in Bethesda,https://washingtondc.craigslist.org/doc/boa/5850234025.html,
251,like new,2016-11-19 13:55,"Price reduced...go sailing today!  2005 Jeanneau 43 Deck Salon sailboat with upgraded 75hp Yanmar engine, 445 hours. AC (2), heat (2), bow thruster, bimini, dodger with connector panel, HDTV/AM/FM, blu-ray DVD, all electronics (E Series), solar panels (2), electric heads (2), roller mast, roller genoa, teak decks and cockpit, window covers, screens, galvanic isolator, sleeps 6, winter cover, and much more. $185,000. Call or leave message for broker: George @ show contact info with Integrity Yacht Sales or Dr. John @ show contact info See at Herrington Harbour North, on land in Front of West Marine store. Brokers welcomed.",445,5838455851,43,Jeanneau,DS-Deck Salon,$185000,sail," (Deale, MD)",43 foot Sailboat w/ Many Extra Options@ Low Engine Hours,https://washingtondc.craigslist.org/mld/bod/5838455851.html,2005
252,good,2016-11-19 13:50,Coleman 15' length canoe in good condition- needs cleaning. Forest green color.  Wonderful to take on lakes and canals during the Fall weather!,,5883930497,15,Coleman,Outfitter,$200,human, (Bethesda),Coleman Canoe 15',https://washingtondc.craigslist.org/mld/boa/5883930497.html,
253,excellent,2016-11-19 13:44,"Ciera 3055 EL with Very low hours! ! All systems have been tested and everything works great. Twin 5.7 liter Mercruiser engines have very low hours. Westerbeke generator with low hours. Fresh bottom paint and anodes. Bravo 2 outdrives w/Mercathode system. New props, Trim tabs, Windlass w/fortress anchor, new spot light. Brand new Bimini top with side curtains/eisenglass. Cockpit carpet, Awesome stereo system (loud and clear)! Cabin is super clean with 6.5' of head room. Spacious. Forward and aft berth, A/C and heat, head, refrigerator, range, microwave, new Flat screen TV and DVD, new hot water heater. To much to list! Just come see it and take it for a ride. Boat is fast and very stable! It will need some upholstery replaced. I was quoted $1500 for all new vinyl. Must sell, will be moving soon. Please make an offer! If your check NADA please don't forget to include the options. NADA average value is $35k for this boat with what they assume the hours would be (THEY FIGURE 100 HOURS PER YEAR). The hours on this boat represent 250 divided by 15= less than 20 hours per year. That's because it was in dry storage for so many years. All the mechanicals are in excellent condition! Boat has only been back on the water for less than a year. Mechanic owned and everything works great. Anything that was a problem due to sitting has been repaired or replaced. Must sell due to up coming move! Thank you Boat was pulled from the water for winterization and storage. Perfect time to inspect the hull and drives! Price has been reduced!",250,5869465709,32,Bayliner,Ciera 3055,$30000,power, (Lorton),Bayliner 3055 w/twin 5.7 Mercruiser,https://washingtondc.craigslist.org/nva/boa/5869465709.html,2001
254,like new,2016-11-19 13:44,"2001 Ciera 3055 EL with Very low hours! ! All systems have been tested and everything works great. Twin 5.7 liter Mercruiser engines have very low hours. Westerbeke generator with low hours. Fresh bottom paint and anodes. Bravo 2 outdrives w/Mercathode system. New props, Trim tabs, Windlass w/fortress anchor, new spot light. Brand new Bimini top with side curtains/eisenglass. Cockpit carpet, Awesome stereo system (loud and clear)! Cabin is super clean with 6.5' of head room. Spacious. Forward and aft berth, A/C and heat, head, refrigerator, range, microwave, new Flat screen TV and DVD, new hot water heater. To much to list! Just come see it and take it for a ride. Boat is fast and very stable! It will need some upholstery replaced. I was quoted  $1500 for all new vinyl. Must sell, will be moving soon. Please make an offer! If your check NADA please don't forget to include the options. NADA average value is $35k for this boat with what they assume the hours would be (THEY FIGURE 100 HOURS PER YEAR). The hours on this boat represent 250 divided by 15= less than 20 hours per year. That's because it was in dry storage for so many years. All the mechanicals are in excellent condition! Boat has only been back on the water for less than a year. Mechanic owned and everything works great. Anything that was a problem due to sitting has been repaired or replaced. Must sell due to up coming move! Thank you Boat was pulled from the water for winterization and storage. Perfect time to inspect the hull and drives! Price has been reduced!",250,5869316389,32,Bayliner,3055 sunbridge,$29500,power, (LORTON),Bayliner Ciera 3055 twin 5.7 mercruiser low hours,https://washingtondc.craigslist.org/doc/boa/5869316389.html,2001
255,good,2016-11-19 13:32,"87 Bass Tracker tournament V17,  no leaks, all aluminum construction.   Brand new front and rear seats, brackets and pedestal,  very nice seats never sat in!  Brand new 24 volt remote controlled 24V 70# Minn Kota trolling motor,  with the I-Pilot factory installed,  I-Pilot is fully remote control, hit a button and it keeps you in a specific location automatically, also has auto pilot.   all new upgrades wiring and 2 new 12 volt marine batteries.  New forward decking, carpet, cleats, running light recepticals, 12v power outlet, bilge area intake and exhaust vent.....   Large live well with aerator also works good,   Has a 50HP Johnson 2 stroke that recently had a couple grand worth of work done at Potomac Marine,  new water pump, new shift/throttle cables,  lower unit gone over and resealed, carb rebuilt, leak down and compression check also done with good results.   Also has a Garmin fish finder/GPS/Sounder mounted on a ram mount.  Will make a great boat for the river or resevior,  catfish or bass,   great all around machine Trolling motor alone was well over 1K,  and was only used once,  50HP motor was only used once as well after the work was done and runs good. Remote control Minn Kota trolling motor,   purchased 6/17/2015, cost of $1,125.13 Work done at Potomac Marine,  $1,677.60 Vents, ducting, decking, cleats, stainless hardware, etc,    completed 6/2015, @ $400-500 Ram mount for GPS @ $60-70 Garmon GPS fishfinder / sonar....  $500-600 with transducer 2 seats, pedestals and brackets, $350 Comes with a trailer and needs nothing,   includes new aluminum paddles as well",,5883900275,17,Bass Tracker,V17,$4000,power, (Herndon),Bass Tracker Tournament V17 trade,https://washingtondc.craigslist.org/nva/boa/5883900275.html,
256,good,2016-11-19 13:19,Call for more information Call with your best offer 150 Hour power - 2004 Engine Fish Finder Low mileage Additional Engine with 15 horsepower hablo espanol,,5883877476,21,Bayliner,,$14000,power, (Silver Spring),Boat for SALE,https://washingtondc.craigslist.org/doc/boa/5883877476.html,1999
257,good,2016-11-19 12:51,"Single Volvo 5.7L gas engine, inboard/outboard duo-prop. New propellers installed - cost over $900. Garmin GPSMap441s and DSC/VHF set-up. Comfortable well-appointed interior. On the hard. Great for weekend floating condo. Price reduced!",,5883827001,28,Bayliner,Contessa 2850,$3495,power, (Deale),1986 Bayliner Contessa,https://washingtondc.craigslist.org/nva/boa/5883827001.html,1986
258,good,2016-11-19 12:49,"1977 AMF Crestliner 16ft fiberglass boat with a 70 Johnson Seahorse outboard motor, with an 1976 EZLO (Easy Loader) trailer. In good shape.  Home kept clean and covered at all times.  Seldom used over the years mostly at Pohick Bay, Alexandria, VA., some times twice a month on weekends, only on summers. Has not been used in a couple of years because I don't own a van anymore to pull it. Worked great last time I used it! Might need to clean the motor since it has not been used in a couple of years, just to prevent any damage to the motor.  After that, it will be ready to take to the water. With two 6 gallons gas tanks, covers, lifejackets and a few extras, ready to enjoy this summer Asking $2,500 as is.",,5876351238,16,AMF Crestliner,1977,$2500,power," (Fairfax, VA)",AMF Crestliner 16ft fiberglass boat with 70 Johnson Seahorse outboard motor,https://washingtondc.craigslist.org/nva/boa/5876351238.html,1977
259,,2016-11-19 11:47,"This is a 14'-2"" vintage touring kayak with a bulkhead and a large dry storage compartment. It also comes with (not pictured): a spray skirt, a padded backrest cover, and a padded seat bottom cover. Since it is so long, it is easier to paddle than a shorter flat bottom kayak. It has the normal wear and tear scratches and a small flat spot on the bottom, but nothing that affects its performance or handling. It is in really good shape for a kayak that is at least 20 years old and has always been stored covered and protected from the sun. I have used it in class I to III rapids and out in the ocean. Lots of good reviews: http://www.paddling.net/Reviews/showReviews.html?prod=88 If this ad is up, I still have this kayak.",,5883711858,14,,,$350,human, (Silver Spring),Perception Aquaterra Spectrum,https://washingtondc.craigslist.org/mld/boa/5883711858.html,
260,,2016-11-19 11:46,"2013 Edgewater 245 center console twin Yamaha 150hp engines with only 105 hours on them, very well cared for and in great condition. Please contact me for additional info and photos",105,5883710133,24,Edgewater,245 center console,$79900,power,,2013 Edgewater 245 Center console Only 100 hours!,https://washingtondc.craigslist.org/doc/boa/5883710133.html,2013
261,,2016-11-19 11:38,Old 14' Jon boat. Has a hole but can be patched. Very light boat.  Was used on private ponds. No title. $75 obo.  You haul.,,5883695967,14,,,$75,human,,14' Jon boat $75,https://washingtondc.craigslist.org/nva/boa/5883695967.html,
262,excellent,2016-11-19 11:12,"Whitehall wineglass stern rowing boat with 8 ft Shaw & Tenney spoon blade oars. 14 feet long x 41"" wide. Solid fiberglass hull with mahogany trim. Maintained in excellent condition, looks almost new. Bronze and stainless steel hardware. Stainless rings fore and aft. Removable bronze oarlocks with retaining chains. Built by Dave Southard of Babylon, NY. Includes a titled trailer in excellent condition with new tires, a new coupling, new wheel bearings, and new lights. If you have your own trailer or will transport in a pickup truck, etc, I will take $300 off the price. The black trailer is the titled trailer that comes with it. The gray trailer in some of the photos was a storage and yard trailer. The trailer comes with straps that secure the boat to the trailer for transport. The spoon blade 8 ft oars were made in Maine by Shaw & Tenney and are lightweight and well balanced with protective leather buttons. There is an adjustable foot brace in the floor. 3 seats. This beautifully constructed classic rowing boat is ready for use. Unlike many modern 'rowboats', this boat was designed to slide through the water with ease and to respond to the oars crisply. Its lines are pleasing to the eye and do not have the mechanical, machine like appearance of some sculling boats. Enjoy healthy exercise in a time tested and proven design that connects you to a centuries-old nautical heritage and provides room for a companion. Located on the way to Ocean City, MD. Come take a look and visit the beach. Calls only please (unable to receive texts at this number) to 443 three five nine 52 13 Thanks very much for looking.",,5864935518,14,Southard,Whitehall,$2550,human,,Whitehall lapstrake fiberglass rowing boat w/ titled trailer,https://washingtondc.craigslist.org/mld/boa/5864935518.html,
263,good,2016-11-19 11:12,"MOVING SALE!   WHAT A DEAL!  $7,000.00  Similar boats sell for $15K. 2004 Bayliner 205 BR comes fully loaded with a 5.0 MPI V-8. LOW HOURS!   Very good condition! This boat has the bowrider layout, rated for 9 people, fold down seats at helm, 2 bucket seats, aft swim platform with ladder, navigation lights, anchor light, Boss stereo system, fire extinguisher at helm, and bimini top. Trailer included. Call Mr. Taylor at show contact info Pictures forthcoming.  Can email them to interested parties.",380,5883620726,20,Bayliner,205BR,$7000,power," (Washington, DC)",2004 Bayliner 205BR,https://washingtondc.craigslist.org/doc/boa/5883620726.html,2004
