,condition,date,description,engine hours (total),id,length overall (LOA),make / manufacturer,model name / number,price,propulsion type,region,title,url,year manufactured
360,,2016-11-17 15:37,"Lightweight fiberglass canoe with wooden seats and stays. The keel needs to be replaced, see pics.",,5881111656,15,,,$140,human, (Fairfax City),"15' fiberglass canoe,",https://washingtondc.craigslist.org/nva/boa/5881111656.html,
361,good,2016-11-17 15:22,"1998 23' Sea Swirl Striper Cuddy Cabin w/ventura trailer Has multiple fish wells along with a live bait well with aerator,  Large deck to fight fish and cuddy that sleeps two with a porta potty, sink and propane burner.    It has a bimini top for the summer sun and full Alaskan package that encloses the captain's area for extended fishing deep into the season.   It is powered by a 200 H.P Evinrude Ocean Pro and is ready to go.  Asking for $10,000 OBO.   Ihave a clear title in hand.  Boat is located at a marina in Mayo, MD.   Serious inquiries only,",,5880973488,23,Sea Swirl,Striper,$10000,power,,2300 Sea Swirl Striper,https://washingtondc.craigslist.org/mld/boa/5880973488.html,1999
362,like new,2016-11-17 15:11,"Process is simple, we do not require credit only: Valid DL Proof of income Proof of residence Full coverage insurance Simply send in an application on the vehicle you are interested in, once we receive that we will set up an appointment to see the car. A $100 deposit to hold and take off the market for 48 hours at which time you bring in those docs and insurance to pick up the car. We have been in business since 2006 and incorporated in 2014 with a long history of successful title payoffs. Year: 2007 Make: MONTEREY Model: 350 SPORTS YACHT Payoff: $158,500.00 Down Payment: $14000 Monthly Payment: $1850 Months remaining: 131 Number of Engines: 2 Engine Make: MERCURY Engine Type: Engine Hours: 38 Fuel: GAS Fuel Capacity: Hull Material: FIBERGLASS Horsepower: 425HP Overall Length: 37 Location: VA Trailer: NO Transport: YES IF SHIPPED (SELLER TO CONTRIBUTE $4000 TOWARDS TRANSPORT) Features: 2 Mercury motors 425 hp Generator All services performed before it came out water. Oil change, all the gaskets has been replaced, brand new batteries, etc... Central heat & air as well OWNER FINANCING MMP INC. LIC: NV20141044454 For your vehicle, motorcycle, RV and Boating needs 233 Technology Way #7 ROCKLIN, CA. 95765 MON - FRI 9AM TO 4:00PM SAT AND SUN (BY APPOINTMENT ONLY) show contact info Office show contact info Fax",38,5880989393,37,MONTEREY,350 SY,$1850,power, (rocklin),2007 MONTEREY 350 SPORTS YACHT 'TAKE OVER PAYMENTS' NO CREDIT NEEDED,https://washingtondc.craigslist.org/nva/bod/5880989393.html,2007
363,like new,2016-11-17 15:00,"2010 Sea Doo Challenger 210 SE with Tower with 37 hours. This boat is pretty much brand new. Boat has always been stored in doors during off season. Selling due to lack of time to use it, as you can see with the hours. I am the first and only owner. This boat has a 310 hp engine with minimal hours and is ready to be put in the water this season. The boat has a wake tower and bimini top. The buyer of this boat will get a wakeboard, skis, tow ropes, tube, and tons of vest with the purchase price. You will be ready to have fun on the water as soon as you get it. Please call or email with any questions.",37,5881050040,21,Sea Doo,Challenger 210 SE,$29000,power, (Warrenton),2010 Sea Doo Challenger 210 SE with Tower,https://washingtondc.craigslist.org/nva/boa/5881050040.html,2010
364,,2016-11-17 14:23,"Selling my 12ft 2011 Topper Tracker. Clean title for boat and trailer. $1,200 buys you the boat, trailer, four BPS rod holders, minn Kota 47lb trolling motor, and battery. Boat has a custom camo paint job that has five different leaves sprayed onto it. Also has two mounted fishing seats and a custom built cooler with O2 pump and battery compartment. Let me know if you have any questions.",,5880955190,12,,,$1200,power,,12' Topper Tracker Boat with Trailer,https://washingtondc.craigslist.org/mld/boa/5880955190.html,
365,,2016-11-17 13:36,EZ Loader boat trailer. 15-18 foot boat trailer. Lights may need work. Torsion axle. All galvanized. Max load is 2350 Lbs. I have title in hand..,,5880903589,18,,,$600,power, (Vienna),Boat Trailer,https://washingtondc.craigslist.org/nva/boa/5880903589.html,
366,like new,2016-11-17 13:28,"The AL-24 Wake Boat Introducing the new Pavati AL-24, the most innovative, powerful and durable wake boat available. Pavati wake boats are built from raw, natural aluminum. That means they'll never break down, shatter rot, rust, or emit harmful fumes. Pavati boats are built to last forever. 24 feet of pure excitement, ""Built Ford Tough™"" with Indmar Ford Raptor engines ( GM and diesel also available) to provide the thrust and on-demand torque every wake and surf enthusiast craves. Every aspect is engineered using the most advanced manufacturing technology available including our exclusive Rip Tide™ Surf System. More durable than fiberglass, the lighter weight and maintenance free properties of aluminum are more economical on -- and off the water. Indestructible, outstanding performances, innovative technology -- the Pavati AL-24, pure elements never die. Boat Length 	24'8″ (26′ 4″ with Removable platform) Maximum Width 	8'6″ Dry Weight 	4,200 LBS Fuel Capacity 	65 Gallons Height w/ Tower Erect 	10'4″ Height w/ Tower Folded 	6'10″ Seating 	18 People Capacity 	2,500 LBS Ballast 	4,200 -- 5,000 LBS Storage 	147 cu FT Gauge1″, .250″, .188″, .125″ Aluminum Thanks, Brody Shannon show contact info",126,5880890127,25,Pavati,AL 24s,$104700,power, (kelowna),2015 Pavati AL24 s SURF MACHINE!!,https://washingtondc.craigslist.org/doc/bod/5880890127.html,2015
367,,2016-11-17 13:27,"150 HP 4 Stroke engine Turbo charged No issues, runs great Priced for MSX only. used on Fresh water only (Lake Anna) 3-seaters. Very stable and powerful. Can pull tube, water skis, wake board.",,5880887533,11,Polaris,MSX,$3500,power, (Springfield VA),Polaris 2004 MSX 150 Turbo jet ski,https://washingtondc.craigslist.org/doc/boa/5880887533.html,2004
368,like new,2016-11-17 13:24,"2006 Chaparral 276 SSi/SSx bowrider with the upgraded 420HP Volvo Gxi 8.1 Duoprop (NOT THE COMPOSITE DRIVE) in pristine condition that will hit 50mph on GPS!!!  All freshwater use and only has 148 hours. I dare you to find a better condition boat of this model, with low hours and this well cared for, it is my baby.  Reason for selling is to move up to a larger boat.  Currently in the process of winterizing and shrink wrapping, so if you want to get a great off season deal let me know. Volvo 8.1GXi 420HP V8 will purr like a kitten in silent choice, or roar like a lion with the thru hull exhaust switched on.  Boat is equipped with blue LED cockpit lights.  The sound system has blue tooth and was upgraded to a 1200+ watt, 8 JBL speakers and a JBL marine subwoofer that sounds amazing.  There is also a radio control on the back of the swim platform, everything functions in perfect condition. >br> All maintenance has been done yearly, shrink wrapped and dry docked every winter. A comfortable double-wide helm seat is setup for stand up or sit down operation, the boat will comfortably hold 12+ adults.  There is also a video online seen here.  https://www.youtube.com/watch?v=8ZdVdfEwsNA Here are some features and Specs: LENGTH (LOA W/ SWIM PLATFORM) 28 ft. 10 in. (8.79 m) BEAM 9 ft. 0 in. (2.74 m) BRIDGE CLEARANCE With Arch: 8 ft. 9 in. (2.67 m) DRAFT (MAX) 35 in. (89 cm) DRAFT (DRIVE UP) 20 in. (51 cm) DEADRISE 22Â° WEIGHT 6,800 lbs. (3,084 kg) BODY HULL TYPE Deep Vee HULL MATERIAL Fiberglass ENGINE & DRIVETRAIN ENGINE Volvo 8.1L GXi DP 420 hp FUEL TYPE Gas FUEL TANK CAPACITY 105 gal. (397 l) DRIVE TYPE I/O OPERATIONAL WATER CAPACITY 13.5 gal. (51 l) HOLDING TANK CAPACITY 3.8 gal. (14 l) VacuFlush: 6.5 gal. (24.6 l) MAXIMUM PEOPLE Yacht certified KEY FEATURES: â€¢Dual-Wide Helm Seat with Individual Flip-Up Bases â€¢Reversible Sun lounge/Rear Bench Seat with Storage Tub â€¢Spacious Wraparound Cockpit Seating with Built-In Storage â€¢Duralife-Max Surface Protected Premium Expanded Vinyl â€¢(2) Stainless Steel Boarding Ladders (Bow and Stern) â€¢Enclosed Head with Maple Cabinet and Solid Surface Top â€¢Teak and Holly Flooring in Head Compartment â€¢CDS (Cockpit Drainage System) SBS (Self Bailing System)",148,5840683761,29,Chaparral,276 SSI,$48775,power, (alexandria),29ft - 2006 Chaparral 276SSI bowrider in pristine condition 148 hours,https://washingtondc.craigslist.org/nva/boa/5840683761.html,2006
369,good,2016-11-17 13:19,Normal scratches on bottom in good cond. Caneo only no accessories. Call me please and i can answer your ?'s. Thanks mike,,5880872788,15,Coleman,Ram x,$250,human, (Germantown),Coleman ram x 15 caneo,https://washingtondc.craigslist.org/mld/boa/5880872788.html,
370,good,2016-11-17 13:08,"For sale is a 1974 Anacapri Angler Deluxe center console . I placed a new in the crate 2006 Yamaha 90 TXR on the boat six years ago, using Yamaha's Command Link plug and play system. All electrical rigging is updated as well. The boat has a 33 gallon tank, the big Yamaha water separator filter,  dual batteries, Garmin sounder, operating on a transom transducer and a Garmin 492 GPS map and sounder, which operates on a thru hull transducer. Oil changed every year, there are less than 300 hours on the motor. It is a dry boat, currently in the water. I installed a new transom six years ago as well, and reshaped the cockpit. Included is a tandem Venture trailer with a torsion suspension, which has a recent disc brake system, new tires, bearings, fenders, and coupler, operating off a surge brake. The trailer has a long tongue, making loading and retrieval from shallow ramps trouble free. We've used this boat on most every body of water around the DC area, from the Chesapeake Bay, it's current home, to Lake Anna, the Potomac, and Deep Creek. It will get into 18 inches of water if needed, and will cruise at 25 knots comfortably. It is easy to run and has a comfortable ride. Clear title to the boat and trailer are in my name, in the state of Maryland. Please email your name and contact number, with best times to call. Thanks for looking.",280,5875224043,21,Anacapri/Angler,,$9500,power, (21661),Angler 21 Center Console with Yamaha power,https://washingtondc.craigslist.org/mld/boa/5875224043.html,
371,,2016-11-17 13:00,"I am parting out or selling my bass boat.  It is a 17 ft Pro Bass, 115 HP, Bass Boat with a Load Rite Trailer.  Boat is nice but has a soft deck. No rips or tears in seats and floor covering.  The boat has trolling motor, 2 rock filtration, airator  pump live wells, storage box, new hydraulic pump, rebuilt engine with low hours, 2 fish finders with depth finder. Beautiful metallic blue and silver, fiberglass hull. I will sell the 115 hp motor for $1500 The trailer for $1,000 all other items will go separately boat seats $35 each fish finders $50 each anchors $15 each 6 life vests$20 17ft cover $50 $2500 for everything This boat features: 1 2002 EZ loader trailer with solid oak salt treated carpeted bunks and rollers. 2. 6 life vests 3.1 Gallon of 2 stroke racing oil to mix with gas. 4. 1 Tube of Hydrallic fluid 5. Minn kota battery charger 6. 2 fish finder depth finders, 1 Lowarence, 1 Eagle. 7. 3 Marine batteries 8. Pro bass boat with duel live wells hydrallic trim  and trim lots of storage. 9. Foot controlled Minn Kota 55lb thrust trolling motor 10. New anchor 11. 1 Unopened gallon of marine wash. 12. All paperwork that goes with the boat including all paper work for the full rebuild of the engine, titles for both the trailer and boat. And other various receipts and info. 13. $300.00 dollar canvas blue boat cover 14. 115 hp Mercury motor with full rebuild Call Robyn show contact info",,5880838273,17,Astroglass,,$2500,power, (OBO FAIRFAX),"FAST BASS BOAT WITH GREAT TRAILER, parting out or sale",https://washingtondc.craigslist.org/nva/boa/5880838273.html,
372,,2016-11-17 12:22,"Jet skis and boats require maintenance at the end of the summer season, so that they will last longer. Winterizing these vessels prevents rust and damage to the engine. I am a professional mechanic and can do the work for $200.",,5871434138,11,,,$200,power, (Springfield VA),Jet ski winterize,https://washingtondc.craigslist.org/doc/boa/5871434138.html,
373,good,2016-11-17 12:21,"Engine and electronics swapped from GP1300R fuel ejection no carb. Have many performance parts installed Super Fast - top speed 65-70 Very powerful, approx 170HP. Can pull a wake board, tube or water ski. Has 87 hours on engine",87,5871987775,10,Yamaha,GP1200R,$2500,power, (Springfield VA),Yamaha GP1200R,https://washingtondc.craigslist.org/doc/boa/5871987775.html,2001
374,,2016-11-17 12:19,"150 HP 4 Stroke engine No issues, runs great Priced for MSX only. Will sell both for 7k I am a mechanic and do take care of my skis. It does not require much maintenance but it is crucial to do it right when necessary. My skis do not have any issues and work like supposed to. 3-seater jet skis are very rare and they are perfect for you if you have a big family, many friends, love deep sea fishing, tubing or wake boarding. If you live in VA or MD, you would need to register your Jet Ski with VA Department of Game and Inland Fisheries. A new Title will cost you $7. This ski has registration valid till 04/2017 so good until next year. No special license are required. They are easy to operate so do not worry if you do not have experience, even a child can ride it. Fresh water Use only (Lake Anna) 3-seater. Very stable and powerful. Can pull tube, water skis, wake board. Sea-doo , Waverunner , polaris , yamaha , kawasaki , jet ski.",,5872088228,11,Polaris,MSX 150,$3500,power, (Springfield),2004 Polaris MSX 150 Turbo jet ski,https://washingtondc.craigslist.org/doc/boa/5872088228.html,2004
375,,2016-11-17 12:19,Have a double trailer that can be used for 2 jet skis or modified to a utility trailer. See the original pictures for its conditions.,,5872089110,12,,,$500,human, (Springfield VA),Double trailer,https://washingtondc.craigslist.org/doc/boa/5872089110.html,
376,excellent,2016-11-17 12:19,"150 HP 4 Stroke engine No issues, runs great I also have double and single trailers available I am a mechanic and do take care of my skis. It does not require much maintenance but it is crucial to do it right when necessary. My skis do not have any issues and work like supposed to. 3-seater jet skis are very rare and they are perfect for you if you have a big family, many friends, love deep sea fishing, tubing or wake boarding. If you live in VA or MD, you would need to register your Jet Ski with VA Department of Game and Inland Fisheries. A new Title will cost you $7. This ski has registration valid till 04/2017 so good until next year. They are easy to operate so do not worry if you do not have experience, even a child can ride it. Used on Fresh water only (Lake Anna) 3-seater. Very stable and powerful. Can pull tube, water skis, wake board. Sea-doo , Waverunner , polaris , yamaha , kawasaki , jet ski.",,5872089683,11,Polaris,MSX 150 Turbo,$3500,power, (Springfield VA),2004 Polaris MSX 150 Turbo jet ski 4 stroke,https://washingtondc.craigslist.org/doc/boa/5872089683.html,2004
377,excellent,2016-11-17 11:00,"Harmony is in great condition, restored at one point by a previous owner. It is obvious she has been loved over the years. I am currently a live-aboard on her. I am sad to have to part with her, I am military and she is over my weight limit to move to my next duty station. She runs on a Perkins 4108 engine which starts up easily. She has plenty of room with a large, super comfortable V berth and aft berth. Over all she is 33 feet long, almost a 13 foot beam and 4 foot draft. Perks: Functioning AC/Heating unit that kept up with this summers heat.(3Yrs) Water filtration system. New hot water heater.(SEP16) (Kumo, stainless steel...almost impossible to replace the old one). She was recently painted 4 months ago, bottom looks great. She comes with everything needed for sailing, GPS's and coast guard requirements. Solid foundation. Thick fiberglass hull, over built and made for a beating. She is set up as a live aboard, with fridge, microwave, toaster oven. She has updated hydraulic steering(5Yrs). Working Head and Shower. ****Survey done in JAN 2016, results in hand**** Comes with countless extras. Magnum Propane Grill, Bimini. Short Comings: She is missing a stove, I made up for it with appliances. Can discuss installing stove or giving stove before buy. The hours on the engine are questionable, but I keep up with maintenance and she has never had an issue and runs great. The sails have seen some use, they should be good for a few more years if she isn't ran hard. Over all she is a simple boat with simple systems. She is probably one of the least temperamental boats I have seen. If you are looking for a spacious boat to sail and live aboard this is your boat.",,5876814244,33,Morgan,OI,$19900,sail,,1977 Morgan OI 33 Great Condition,https://washingtondc.craigslist.org/mld/boa/5876814244.html,1977
378,like new,2016-11-17 10:51,I'm for sale  my beautiful  family truck for f150 2006 it's in excellent condition rare beautiful  color.I am in no hurry  of selling  it so I will. Only  sell it at the  right  price.for more information call or text show contact info clean vehicle  4wheel drive  works  automatic transmission  new  tires                  just  VA  .inspected /emissions  done runs great  title clear thank you 😊,42,5836198335,150,for,f150,$8200,power, (mount Vernon hwy),sport for f150 4%4 2006,https://washingtondc.craigslist.org/nva/boa/5836198335.html,2006
379,,2016-11-17 10:05,"TRADE PROPERTY - MODERN SQUARE RIGGED SCHOONER - 70' Overall;  54' On Deck;  WORLD'S ONLY CT-54 Fiberglass Brigantine Staysail Schooner - A Modern Square-Rigged Schooner converted from a ketch rig circa 2007-2008 to a Modern Square Rig;  Fiberglass Decks;  All Teak Interior;  all aluminum masts, booms & bow sprit;  all stainless rigging;  2001 John Deere Diesel;  much more to tell ... some work required.  Owner expects to substantially discount $375,000 valuation to reflect work required. Willing to trade for acreage, mountain land, housing, warehouse, etc.;  tangible property like motorhome, houseboat, vehicles, etc. might be considered as partial trades;  NEGOTIABLE means don't be shy ... try me. Call Tom @ 954-five-four-three-3275",,5874691660,70,CT,CT-54,,sail,,"SCHOONER - TRADE, SALE, or PARTNERSHIP",https://washingtondc.craigslist.org/doc/boa/5874691660.html,1981
380,like new,2016-11-17 09:53,"Boat slip at Lake Anna Yacht Club with 6000lb lift and storage closet. Slip comes with 6,000lb electric lift to keep your boat out of the water. Yacht club has locker rooms as well as club house available to slip owners with more amenities to come. Slip is covered which keeps boat clean and cuts down on maintenance. There is also a storage closet which conveys with the slip to store all your water toys. This slip is in the most desirable location on the dock closest to shore and in front of stairs leading to storage closet. $25,000 Eight 0 four 61 five 7 three 80",,5880507207,40,Lake Anna Yacht Club,Lake Anna Yacht Club,$1,power, (Lake Anna Va),Lake Anna Boat Slip Price Reduced,https://washingtondc.craigslist.org/nva/boa/5880507207.html,
381,fair,2016-11-17 09:44,"I am selling an outboard motor 1987 225hp to be rebuilt with complete wire harnesses accessories - controls box /cables, etc. or for extra parts call show contact info for more information.",,5880493040,25,outboard motor,everu 225 HP,$750,power, (wilmington NC),Outboard motor 225hp evinrude,https://washingtondc.craigslist.org/nva/boa/5880493040.html,
382,excellent,2016-11-17 09:43,is in good conditiong and clean call show contact info for more inf.,,5880491643,45,,,$200,power, (carolina beach NC.),54 gal. plastic gas tank for boats,https://washingtondc.craigslist.org/nva/boa/5880491643.html,
383,good,2016-11-17 09:38,30 hours on new 454 start up video below new paint and decals new controls alfa 1 outdrive just serviced will do 5k cash and a 4k trade or 9000 cash obo https://www.facebook.com/mike.cheatham.58/videos/1128652227198982/,30,5857794813,25,donzi,z25,$9000,power, (seaford),1987 DONZI Z25,https://washingtondc.craigslist.org/nva/boa/5857794813.html,1987
384,good,2016-11-17 09:13,THIS F 36 WAS REPOWERED WITH TWIN 8.1 F/I MARINE POWER UNITS HAS 54 HRS ON THE MOTORS HAS A 2013 KHOLER 7.3 GEN SET WIT 15 HRS COLD AIR  WARM HEAT  THE BOAT HAS NEW CARPET TO BE INSTALLED AND A NEW FRIDGE NEW SHAFTS AND PACKINGS.  LOCATED IN EDGEWATER MD 21037 PICS SOON,54,5869854190,36,TROJAN,F36 SEDAN,$42800,human, (EDGEWATER MD),1980 F36 TROJAN SEDAN FLY BRIDGE,https://washingtondc.craigslist.org/doc/boa/5869854190.html,1980
385,excellent,2016-11-17 09:09,"$800 OBO Chesapeake Light Craft touring kayak for sale. Great for larger bodies of water. Straight tracking. Wood, fiberglass and epoxy construction. Has always been kept in a garage. Have a spray skirt, plastic paddle, adjustable foot pegs and back support. This price is many hundred dollars less than the kit. It takes about 80 -100 hours to construct one of these kits, save yourself time and money. Length: 17', Beam: 24"", Weight: 45 lbs.",0,5836810785,17,Home made,CLC17,$800,human, (Silver Spring),Chesapeake CLC 17 Wood Kayak,https://washingtondc.craigslist.org/mld/boa/5836810785.html,2007
386,excellent,2016-11-17 08:44,"THIS BOAT IS TRULY UNIQUE AND A BARGAIN ! AND A TOTAL STEAL !! 'ENDLESS SUMMER' VERY HARD TO FIND -- CLASSIC EUROPA MODEL TRAWLER WITH COVERED, WALK AROUND SIDE DECKS - BEAUTIFUL !! COVERED AFT DECK LEADING INTO SALON -- SIDE ENTRY DOOR NEXT TO LOWER HELM. ALMOST ENDLESS UPGRADES AND IMPROVEMENTS -- INCLUDING A TOTAL RECONFIGURATION OF THE FORWARD MASTER CABIN. SHE IS IN EXCELLENT CONDITION -- TURN KEY ! GO ANYWHERE AND GET BACK TOO ! VERY LARGE AND COVERED SUNDECK WITH COMPLETE WEATHER CANVASS AROUND THE SIDES FROM THE HANDRAILS DOWN -ENTIRE UPPER DECK WAS REGLASSED AND EPOXIED IN JANUARY 2014 SPACIOUS, BRIGHT SALON -- TEAK FLOORING -- 21"" FLAT SCREEN TV -- SOUNDBAR -- SHAKESPHERE DIGITAL TV ANTENNA ALL NEW ALUMINUM SIDE WINDOWS, PORTHOLES -- ALL WITH SCREENS , WINDSHIELDS INCLUDING A FOLD OUT CENTER WINDSHIELD COMPLETE NEW SET OF SUNBRELLA SNAP ON SUNCOVERS FOR ALL WINDOWS FULL GALLEY WITH MAGIC CHEF 4 BURNER PROPANE STOVE WITH OVEN / DOUBLE STAINLESS SINK / BUILT IN ISOTHERM REFRIGERATOR / FREEZER -- UNDER SINK WATER FILTER SIX GALLON MARINE HOT WATER HEATER PRIVATE HEAD WITH VANITY -- SHOWER -- MANUAL HEAD -- 40 GALLON HOLDING TANK WITH MACERATOR AND Y VALVE HERE IS THE REALLY NICE PART -- THE TWO FORWARD, SMALL CABINS WERE TOTALLY RECONFIGURED INTO A LARGE MASTER CABIN WITH CENTERLINE QUEEN BED -- EXCEPTIONAL STORAGE -- LIGHT AND AIRY 18,000 BTU FLAGSHIP REVERSE CYCLE AIR CONDITIONING SYSTEM -- DIGITAL CONTROLS -- VENTS IN SALON / MASTER STATEROOM AND HEAD NEW LED LIGHTS THROUGHOUT FULL LOWER AND UPPER HELMS -- SLIDING DOOR NEXT TO LOWER HELM -- COMPLETE ELECTRONICS -- LOWRANCE HDS10 MULTIFUNCTION GPS / RADAR / DEPTH / WATER TEMP -- ALL INTERFACED WITH IDENTICAL UNIT ON BRIDGE WITH NEMA 2000 INTERFACE / RITCHIE COMPASS / VETUS BOW THRUSTER WITH CONTROLS AT BOTH STATIONS / SEA RANGER 6000 VHF / PIONEER STEREO C/D PLAYER, ETC INCREDIBLE 'ELECTRONICS CLOSET/ROOM' -- MUST SEE PICTURE -- ALL ON BOARD WIRING GOES THROUGH THIS 'ROOM' FOR COMPLETE ACCESS -- VERY NICE AND UNUSUAL CUSTOM FEATURE LEHMAN 120 HP 2715E - 6 CYLINDER IN LINE FWC DIESEL / 1,200 HOURS SINCE REBUILD / 160 AMP ALTERNATOR + STANDARD 65 AMP ALTERNATOR / NEW FUEL LINES / RACOR / REBUILT HYDRAULIC STEERING PUMP / NEW EXHAUST SYSTEM FUEL CONSUMPTION IS 2.5 GPH @ 1,800 RPM -- 6-7 KNOTS CROSSOVER FUEL LINES -- CROSSOVER FROM ENGINE FUEL PUMP TO SEPARATE ELECTRIC FUEL PUMP -- RACOR FILTERS DRIPLESS WATER COOLED SHAFT LOG NEW PROPELLER 3 8D BATTERYS -- 2 HOUSE / 1 STARTING 2000 WATT SINE WAVE INVERTER 40 AMP CHARLES BATTERY CHARGER HYDRO SLAVE POWER ASSISTED STEERING WITH REBUILT PUMP FOUR NEW STAINLESS 50 GALLON WATER TANKS IN REAR LAZARETTE -- TOTAL 200 GALLONS TWO 150 GALLON FUEL TANKS -- TOTAL 300 GALLONS GENERATOR IS A MASE 6KW DIESEL GENERATOR WITH A YANMAR ENGINE -- ENGINE IS NON OPERATIONAL AND WILL NEED REPLACING GROUND TACKLE IS 33 LB PLOW ANCHOR / 25' CHAIN -- 200+' OF ANCHOR LINE -- MANUAL WINDLASS + EXTRA DANFORTH ANCHOR IN REAL LAZARETTE WHAT MORE COULD ASK FOR IN A LONG DISTANCE TRAWLER -- IN THIS PRICE RANGE BELIEVE ME THIS IS AS GOOD AS IT GETS !! PLEASE CALL TONY FOUR 1 OH -- THREE 5 THREE -- FIFTY FIFTY THANKS",,5877220443,36,MARINE TRADER,EUROPA TRAWLER,$24500,power, (ANNAPOLIS / EDGEWATER),1978 MARINE TRADER EUROPA - CUSTOMIZED - BEAUTIFUL !! A STEAL !,https://washingtondc.craigslist.org/nva/bod/5877220443.html,1978
387,new,2016-11-17 08:43,"NEW 2016 MODEL **REDUCED** JC 23TT NEPTOON WITH OPEN STERN AND MERCURY 150 4-STROKE, SUNDECK W/ CHANGING ROOM, SEA GRASS FLOOR, 10' BIMINI TOP, LOUNGERS W/ UPRIGHT COOLER, TRASH CAN AND STORAGE. HYDRAULIC STEERING W/ LIFTING FINS AND MOORING COVER, COURTESY LIGHTING, SST CUP HOLDER AND BIMINI FITTINGS W/QR, FREE STANDING TABLE W/ COOLER, CLARION W/ BLUE TOOTH AND JL 7.7"" SPEAKER UPGRADE, DELUXE INSTRUMENTS W/ DEPTH GUAGE. TRAILER NOT INCLUDED IN PRICE BUT AVAILABLE FOR PURCHASE",,5869972793,23,,,$40583,power, (LAKE ANNA),2016 J C TRITOON JC 23TT BLU NEPTOON(PONTOON SERIES),https://washingtondc.craigslist.org/nva/bod/5869972793.html,
