,condition,date,description,engine hours (total),id,length overall (LOA),make / manufacturer,model name / number,price,propulsion type,region,title,url,year manufactured
0,like new,2016-11-21 22:20,"Hey there! I have a 2000 wellcraft Martinique 2600. It has a 7.4 liter mercruiser in it with dual props. One of the nicest engines I've ever owned. It has super low hours, about 210 hours! I have kicker speaker that glow up, aftermarket radio system, and a sub that can be included for the right price. I also have led lighting under the seats etc. This boat does have bed space, microwave, sink, stove, bathroom, ac and all that! Every winter I had it shrink wrapped and winterized. After the winter I had the boat detailed every year I have owned it. The previous owners had the boat on a lift its whole life they barely took it out. I then bought it and continued to keep it on a lift and then moved to school where they don't allow lifts. I now have the boat painted and detailed frequently. This season I replaced the steering wheel and switches and some other stuff to enhance the performance. This boat has a canvas option, the half cover, and the full cover. I always put the full cover on when I left. The boat is missing a rear seat back rest. I am a bit negotiable so call or text me and we will work it out show contact info",210,5880115793,30,Wellcraft,Martinique,$13000,power," (Washington, D.C.)",2000 wellcraft Martinique 2600,https://washingtondc.craigslist.org/doc/boa/5880115793.html,2000
1,excellent,2016-11-21 21:39,"2002 2855 BAYLINER CIERRA MID CABIN EXPRESS  -- VERY CLEAN / LOW HOURS / AIR / GEN / LIFT KEPT $22,500 - TRULY A BARGAIN FOR SUCH A NICE BOAT - A REAL END OF SEASON STEAL !! BEAUTIFUL BOAT -- TRULY IS EQUIPPED WITH EVERYTHING YOU CAN GET -- SALE BY ORIGINAL OWNERS -- ALWAYS LIFT KEPT IN FRONT OF OWNER'S WATERFRONT  HOME AND HARDLEY USED !! -- BUT ALWAYS MAINTAINED AND CARED FOR -- VERY CLEAN AND TRULY TURNKEY LARGE COCKPIT  -  LOTS OF COMFORTABLE GUEST SEATING -- TABLE BIMINI AND FULL ENCLOSURE FULL HELM -- STANDARD DIGITAL DEPTH FINDER -- RAYTHEON VHF -- COMPASS -- GARMIN 76 GPS -- TRIM TABS -- GUEST 10 AMP CHARGER -- HOT AND COLD PRESSURE WATER -- 6 GALLON WATER HEATER LARGE, OPEN, BRIGHT CABIN -- QUEEN BED FORWARD, DINETTE THAT CONVERTS INTO A BED -- NICE MID CABIN -- FULL GALLEY -- 2 BURNER ALCHOHOL / ELECTRIC STOVE -- 12V REFRIGERATOR -- MICROWAVE -- LOTS OF STORAGE PRIVATE, ENCLOSED HEAD WITH SHOWER 7,000 BTU MARINEAAIRR REVERSE CYCLE AIR CONDITINING AND HEAT MERCRUISER 350 MAG MPI V8 -- LESS THAN 200 HOURS TOTAL !! BRAVO 3 OUTDRIVE -- DUAL PROP -- ALWAYS KEPT OUT OF WATER ON THE LIFT KOHLER 5KW GENERATOR WITH KESS THAN 2 HOURS TOTAL !! ENTIRE BOAT JUST CLEANED, WAXED AND DETAILED. BOTTOM AND OUTDRIVE JUST FRESHLY PAINTED -- BEAUTIFUL !! WHAT MORE COULD YOU WANT IN THIS SIZE, TURNKEY, VERY LIGHTLY USED, FULLY OPTIONED - ORIGINAL OWNER  -- GO ANYWHERE EXPRESS CRUISER PLEASE CALL TONY - FOUR 1 OH -- THREE 5 THREE -- FIFTY FIFTY THANK YOU",,5887268806,30,BAYLINER,2855 CERRA,$22500,power," (COLONIAL BEACH, VIRGINIA)",2002 2855 BAYLINER CIERRA MID CABIN EXPRESS - AIR / GEN - A STEAL !,https://washingtondc.craigslist.org/mld/bod/5887268806.html,2002
2,new,2016-11-21 21:09,"Custom Canvas boat cover's / interior and exterior cushion's/ curtain's/ repairs.  Fabric Awning's,Porch enclosure's, custom canvas product's. Check out our face book webpage ... Hampton Canvas Please call or email for free estimate. Diana show contact info",,5879803448,50,Hampton Canvas,Any,,power,,Custom Canvas/ Awning's/Porch Enclosure's,https://washingtondc.craigslist.org/mld/boa/5879803448.html,
3,new,2016-11-21 21:09,"Custom Canvas boat cover's / interior and exterior cushion's/ curtain's/ repairs.  Fabric Awning's,Porch enclosure's, custom canvas product's. Check out our face book webpage ... Hampton Canvas Please call or email for free estimate. Diana show contact info",,5879805176,50,Hampton Canvas,Any,,power,,Custom Canvas/ Awning's/Porch Enclosure's,https://washingtondc.craigslist.org/mld/boa/5879805176.html,
4,,2016-11-21 20:59,"Boat jacket  (coat?)real nice coat,   medium it's a boats work jacket. That's the brand name for those who aren't familiar with the brand. Please text or call no emails please",,5879323421,12,Boats work,Nice,$30,sail, (Alex.),Boat jacket  (coat ?),https://washingtondc.craigslist.org/nva/boa/5879323421.html,2015
5,good,2016-11-21 20:57,"Will swap free use of our Catalina 30' for free use of your dock with water, electric and 6'MLW  -- In West, Rhode, South, Severn or Magothy rivers.   Tall rig, with very low hours on a Moyer rebuilt Atomic 4 gasoline engine, roller furling, bimini, ""Lazy Dutchman"" mainsail lowering system, re-furbished upholstery, wheel steering, VHF, GPS, Depth Sounder, Sony Stereo, and all safety equipment.  If you have some sailing experience, this may be the right boat for you. Looking for a minimum one year commitment.   ""Pop's Dream"" is currently docked on the Rhode River, about ten miles south of Annapolis, at the Holiday Hill Marina (Slip A-24), off of RT 214. Call Bill Kidd on show contact info or show contact info to discuss.",100,5856327921,30,Catalina,Mark I,,sail,,Catalina 30' - Free Use - Dock Swap,https://washingtondc.craigslist.org/mld/boa/5856327921.html,1978
6,good,2016-11-21 20:56,"Catalina 30' tall rig, with very low hours on a Moyer rebuilt Atomic 4 gasoline engine, roller furling, bimini, ""Lazy Dutchman"" mainsail lowering system, re-furbished upolstery, wheel steering, VHF, GPS, Depth Sounder, Sony Stereo, and all safety equipment. Enjoy a one-sixth lifetime equity share in this nicely equipped and seaworthy pocket cruiser. Join this on-going, fun-loving partnership of five other professionals, for a very low cost opportunity to share almost unlimited Chesapeake sailing on this popular cruiser. If you have some sailing experience, this may be the right boat for you. The price includes a pro rata share of dock fees, insurance and maintenance for the rest of the year. ""Pop's Dream"" is docked on the Rhode River, about ten miles south of Annapolis, at the Holiday Hill Marina (Slip A-24), off of RT 214. Call Bill Kidd on show contact info or show contact info to discuss.",100,5856333410,30,Catalina,Mark I,$2500,sail," (Edgewater, MD)",Catalina 30' - Equity Share Ownership,https://washingtondc.craigslist.org/mld/boa/5856333410.html,1978
7,excellent,2016-11-21 20:54,"Beautifully restored 1980 25' Catalina docked in Annapolis, MD. Rare pop top cabin swing keel with tall rig. Turnkey and fully loaded. NOT a project boat! Includes 4 (main and 3 head sails) gently used to new condition sails. New 2015 motor and batteries with less than 24 hours of use. All new top and bottom paint. All new 2016 interior cushions from Catalina. 2 berths;  sleeps 4. New full head. Interior and exterior teak in excellent condition. Must see! $27K OBO. For more information, additional pictures, and to schedule a tour, please contact us.",24,5887325025,25,Catalina,C-25,$27000,sail," (Annapolis, MD)","Beautifully Restored 1980 25ft Catalina ""Pop Top""",https://washingtondc.craigslist.org/mld/boa/5887325025.html,1980
8,,2016-11-21 20:34,"Priced low to get them out of my storage space!! I have two Kayaks that are identical and come with Bildge Pump, splash skirt, paddles rudder, adjustable foot rests,rear storage. ~13ft Been kept indoors and in great condition.  $215 each  I could sell these for $500-600 if I wait until spring but I need them gone.  My loss is your gain!",,5860687376,13,,,$215,human, (Warrenton),Two Kayaks in Great Condition - 13',https://washingtondc.craigslist.org/nva/boa/5860687376.html,
9,excellent,2016-11-21 20:26,"This is a  Beautiful 38 Express Cruiser, loaded with twin Yanmar Diesal engines that push you to speeds in excess of 70 mph with a cruising speed of 55 mph, These fuel efficient diesel engines will give you added dependability and extend your range to 500 miles due to a  highly efficient hull design. Down below you will find a forward cabin with V-berth bed, dresser, cedar lined locker, full head with vacuflush toilet, sink, shower, galley with sink, microwave oven, refrigerator with freezer compartment, and cabin sleeper. The spacious cockpit boasts seating for 10 with an electric drop-down side by side bolster seat at the helm, U-shaped entertainment seating, and wet bar with ice maker. The standard full canvas with camper enclosure combined with a Mase 3500 watt generator, 1500 watt inverter system and air conditioning/heat enables you to enjoy boating in all types of weather. She also comes equipped with Mercury Racing Props, and a full set of electronics including weather radard, Gps and a fish finder.  As you can see she has been very well taken care of inside and out. A trailer is also available!",,5887295246,38,Fountain,38 Express,$129000,power,,38' Fountain Express 2002,https://washingtondc.craigslist.org/mld/boa/5887295246.html,2002
10,excellent,2016-11-21 20:20,"Prijon Performance kayak in very good condition. The kayak is located in Fredericksburg but I occasionally paddle on the Potomac putting in at Angler's and Lock 5 and can arrange to meet someone at either of these locations. Call, text, or email if you are interested. I can send additional full resolution photos that you can zoom in and examine to see the kayak's condition.",,5887288236,85,Prijon,Performance,$300,human, (Fredericksburg),Prijon Performance Kayak,https://washingtondc.craigslist.org/nva/boa/5887288236.html,
11,excellent,2016-11-21 20:17,"Prijon Cross kayak in very good condition. Specs Length 246 cms / 8'0.9"" Width 63 cms / 24.8"" Weight 18.5 kg / 41 lbs Volume 255 ltr / 67.4 gal Cockpit Length 86 cms / 33.9"" Cockpit Width 49 cms / 19.3"" Minimum Paddler Weight 50 kg / 110 lbs Maximum Paddler Weight 105 kg / 231 lbs The kayak is located in Fredericksburg but I occasionally paddle on the Potomac putting in at Angler's and Lock 5 and can arrange to meet someone at either of these locations. Call, text, or email if you are interested. I can send additional full resolution photos that you can zoom in and examine to see the kayak's condition.",,5887284591,8,Prijon,Cross,$350,human, (Fredericksburg),Prijon Cross Kayak,https://washingtondc.craigslist.org/nva/boa/5887284591.html,
12,good,2016-11-21 20:13,"This slalom kayak is suitable for paddlers between 120-160 lbs with 140 lbs being the ideal weight. It is located in Fredericksburg but I occasionally paddle on the Potomac putting in at Angler's and Lock 5 and can arrange to meet someone at either of these locations. Call, text, or email if you are interested. I can send additional full resolution photos that you can zoom in and examine to see the kayak's condition.",,5887280753,35,,,$400,human, (Fredericksburg),Slalom Kayak 3.5 meter,https://washingtondc.craigslist.org/nva/boa/5887280753.html,
13,fair,2016-11-21 20:10,240 Bently Pontoon 90 HP Mercury low hours Only used in fresh water,,5887276988,24,Bently,240Fish,$8500,power,,24FT Pontoon,https://washingtondc.craigslist.org/nva/boa/5887276988.html,2007
14,excellent,2016-11-21 20:06,"PRICE JUST REDUCED - THIS BOAT IS A STEAL ! OWNERS HAVE MOVED OUT OF STATE AND THIS BOAT MUST BE SOLD IMMEDIATELY ! PRIME SLIP AT THE WORLD CLASS HERRINGTON HARBOR NORTH MARINA HAS BEEN PAID IN ADVANCE TO 4/17 ! - TRULY A BARGAIN ! ' MISS ELLIE' - 1978 32' MARINETTE CABIN CRUISER - BEAUTIFUL - BEAUTIFULLY DECORATED - EXCEPTIONALLY WELL MAINTAINED - MADE BY MARINETTE IN TENNESSEE WITH AIRCRAFT QUALITY ALUMINUM - EXCELLENT PAINT EXCELLENT BOAT FOR BOTH CRUISING AND OR LIVING ABOARD - BEAUTIFULLY DECORATED - ALL AMENITIES AS CLEAN AS IT CAN GET - TWIN 7.9 360 CU CHRYSLERS (FWC) - ONLY 1290 HOURS TWIN - UPPER AND LOWER HELM STATIONS LARGE FLYBRIDGE WITH UPPER HELM AND EXCELLENT GUEST SEATING LARGE AFT DECK - FULL BIMINI COVER WITH FULL SCREEN ENCLOSURES BEAUTIFUL, BRIGHT SALON WITH SETTEE, GUEST SEATING AND FULL LOWER HELM FULLY EQUIPPED, OPEN GALLEY - FULL DINETTE THAT CONVERTS INTO A BED NEW WOOD FLOORS PRIVATE HEAD WITH SHOWER STALL / VANITY - NEW COMPOSTING TOILET SYSTEM - NO HOLDING TANK REQUIRED - NO SMELL - THE BEST YOU CAN GET AND EXPENSIVE - GOOGLE 'NATURES HEAD' AND SEE FOR YOURSELF FULL MASTER CABIN FORWARD WITH QUEEN BED - EXCELLENT STORAGE ROOFTOP AIR CONDITIONING FRESH BOTTOM PAINT AND ZINCS LAST SEASON SHE WILL PASS A STRINGENT SURVEY PLEASE CALL TONY FOUR 1 OH - THREE 5 THREE - FIFTY FIFTY - FOR DETAILS AND AN APPOINTMENT TO SEE THIS FINE MARINETTE THANK YOU",1290,5871137128,32,MARINETTE,CABIN CRUISER,$12500,power, (ANNAPOLIS / DEALE),1978 32' MARINETTE SEDAN CRUISER - BEAUTIFUL - SLIP PAID TO 4/17 !,https://washingtondc.craigslist.org/mld/bod/5871137128.html,1978
15,,2016-11-21 20:06,"Loudoun Motorsports & Power Equipment Ask for: Harold Taylor ☎ show contact info 212 Catoctin Circle SE  Leesburg, VA 20175 Enter this link to see more images plus all other inventory we have available: http://lyv.cc/PBBF 2016 Honda HS720AMA Price: $599.00 Year: 2016 Make: Honda Model: HS720AMA Stock Number: SB6667 VIN: SAAA1036667 Condition: New Loudoun Motorsports & Power Equipment 212 Catoctin Circle SE Leesburg, VA 20175 Ask for: Harold Taylor Primary Phone: show contact info A27FBAFAEA464DBBB650D168074EE06C 15326640 3783809",,5884440023,0,Honda,HS720AMA,$599,, (Leesburg),2016 Honda HS720AMA,https://washingtondc.craigslist.org/nva/bod/5884440023.html,2016
16,excellent,2016-11-21 20:06,"1986 26' LAGUNA SLOOP - BEAUTIFULLY CLEAN AND MAINTAINED - OWNED BY ENGINEERS AMAZING AMOUNT OF INTERIOR SPACE FOR A 26' BOAT - ACTUALLY CAN SLEEP 6 PERFECT FOR CRUISING AND OR LIVING ABOARD - SIX FOOT HEADROOM MADE IN CALIFORNIA - ONLY A FEW WERE MADE - STARTED OUT AS LAGUNA - LATER CHANGED TO WINDROSE - SOLID FIBERGLAS CONSTRUCTION - NO CORING - SOLID AS A ROCK - BEAUTIFUL GELCOAT COMPLETELY DRY BOAT - NO LEAKS OR MILDEW / MOLD - 8 OPENING PORTHOLES / FRONT HATCH - FOR EXCELLENT VENTILATION LARGE COCKPIT WITH CUSTOM COCKPIT CUSHIONS - CUSTOM BIMINI - TILLER STEERING - VERY LARGE, RESPONSIVE RUDDER - STORAGE LOCKER MAIN SAIL - ROLLER FURLING JIB - REPLACED SEASON BEFORE LAST - BEAUTIFUL, CRISPY AND WHITE ! SPACIOUS, BRIGHT SALON - DINETTE THAT MAKES INTO A BED - V BERTH FORWARD - WITH FOLDING PRIVACY CURTAIN - EXTREMELY LARGE AFT BUNKS ALL CUSHIONS ARE EXCEPTIONALLY CLEAN AND JUST ABOUT PERFECT - HANGING / STORAGE LOCKER GALLEY WITH S/S/ SINK WITH HAND PUMP - POLY WATER TANK UNDER V BERTH / DEEP COLD BOX / ORIGIO 2 BURNER ALCOHOL STOVE (NOT THE PRESSURIZED KIND - THEY ARE UNSAFE) NAV STATION WITH FOLD UP DESK - ICOM VHF - SONY STEREO WITH CD PLAYER - EXCELLENT SPEAKERS - DIGITAL DEPTH FINDER AND COMPASS ON COCKPIT BULKHEAD PRIVATE, MANUAL HEAD WITH FOLDING PRIVACY CURTAIN - POLY HOLDING TANK - DECK PUMP OUT - OVERBOARD DISCHARGE WITH Y VALVE AUTOMATIC BILGE PUMP - WHALE GUSHER PUMP COMPLETE 115 VOLT 30 AMP SHORE POWER SYSTEM - WITH DEDICATED PANEL AND OUTLETS COMPLETE 12V SYSTEM WITH DEDICATED PANEL ALWAYS BEEN AN OUTBOARD POWERED BOAT WITH A HEFTY BRACKET ON THE TRANSOM - DO NOT HAVE A OUTBOARD ENGINE - YOU WILL HAVE TO PROVIDE YOUR OWN OR WE CAN OBTAIN ONE FOR YOU (NO OLD STINKY, SHOT INBOARD IN BILGE) SPECS ARE - LOA 26' / BEAM 8.3' / DRAFT 3.8 FEET - FIXED KEEL - DISPLACEMENT 3,900 LBS - BALLAST 1,500 LBS THIS BOAT IS EXCEPTIONAL AND HARD TO FIND IN CONSTRUCTION - QUALITY - CLEANLINESS - SPACIOUSNESS - CONDITION, ETC - NEEDS NOTHING - NO EXCUSES PLEASE CALL TONY FOUR 1 OH - THREE 5 THREE - FIFTY FIFTY OR CALL MIKE - FOUR 1 OH - NINE NINE ONE - FIFTY FIFTY THANK YOU Key on Catalina O'Day Hunter C&C",,5883826999,26,LAGUNA,SAILBOAT SLOOP,$3250,sail, (ANNAPOLIS / EDGEWATER),1986 26' LAGUNA SLOOP - BEAUTIFUL - SAIL AWAY CONDITION,https://washingtondc.craigslist.org/nva/bod/5883826999.html,1986
17,,2016-11-21 19:48,"1988 28' SeaRay 270 Sundancer *Motivated Seller: All offers considered.* SELLING AS IS: Starboard engine needs work. Surveyed at $15k last summer. Currently in-slip in Washington, DC. Twin 4.3 Liter V6 Mercruisers (replaced in 2002 and 2006) Alpha 1 Drives Triple batteries with charger 120 gallon fuel tank 40 gallon water tank Halon Fire System Bennett Trim Tabs Full canvas enclosure 6 gallon water heater Shower power with cord Windless VHF Radio 25 watt Garmin fixed mount GPS 2.5 gallon waste tank AM/FM/CD Sleeps 4-6 New bottom paint summer 2015 Portable generator included",,5887157430,28,SeaRay,Sundancer 270,$2500,power, (Washington DC),Searay 270 Sundancer  - 28 ft,https://washingtondc.craigslist.org/doc/boa/5887157430.html,1988
18,good,2016-11-21 19:22,"17 ft Cajun Sport. Repowered in 2015 with a brand new 115 HP Mercury 4 stroke with a stainless steel prop. New steering cables and control box installed. Tank cleaned and water separator installed. New bilge and aerator pumps. 55 LB 24v trolling motor (two batteries) New bow control switches and timers. Boat runs great starts right up always washed down after use. Sips gas, has a 25 gallon tank that I've never had to put more then 7 gallons in after being out all day. Trailer has two new tires on it and LED lighting. Turn key boat had it out last weekend and several times this summer. Stored in garage. Seats are in ok shape no tears. Bench seats need to have the bottom straps reattached. Floor is solid. Everything works as it should. Several accessories included. Let me know if you have any questions. Title for trailer and boat in hand. $7000..OBO No trades. I'm not in a rush to sell it.",90,5864997277,17,Mastercraft,Ragin Cajun Sport,$7000,power, (Gainesville),17' Cajun (Mastercraft) Ragin Sport Fish and Ski Bass boat,https://washingtondc.craigslist.org/nva/boa/5864997277.html,1991
19,good,2016-11-21 17:53,"I have for sale a 2003 maxum 2400 cabin cruiser on a 2004 venture trailer. Has a mercruiser 5.0,  runs great. Boat has everything you need to spend the weekend out on the water. It has heat/ac, hot water heater, two sinks, microwave, toilet, shower, tv/dvd, refrigerator, two beds, two tables, remote spotlight, GPS, trim tabs, full enclosure, etc. $13900",,5883620790,25,Maxum,,$13900,power, (Fredericksburg va),2003 Maxum 2400 Cabin Cruiser,https://washingtondc.craigslist.org/nva/boa/5883620790.html,2003
20,excellent,2016-11-21 17:36,"Beautiful, Clean inside and out, Shiny and FAST 1999 Polaris 1050 SLX, 2 Passenger.  So much done to make it so, is capable of 65 mph.  Had to replace for Ignition , the Engines Stator and CDI with latest upgrade versions,  $650+.... also rebuilt the top end with New Piston, Rings, Pins, Pin Bearings and Gaskets, $300+.... Cleaned the fuel system and rebuilt the Carbs and added a primer system, Replaced the Multi Function Display and AGM Battery. Finished it up Cleaning and Polishing this Fast Little Jet Ski... Clear Title in hand and ready to go, Comes with a Good Valu-line Trailer with New Lights and Tie down strap......      Rebuilt over Winter, ran last weekend out of Spa Creek to Breakin, now ready to go , runs great..... pulled carbs again and replaced stuck Nylon Idle speed screw, now can adjust Idle easily.... CASH and CARRY, NO B.S.  Price is  $2,495................ Call Pete @ show contact info to Get direction, come see, hear and Buy................",,5870753113,9,Polaris,SLX 1050CC,$2495,power," (Mitchellville, Md.)",Seadoo-1999 Polaris 1050CC SLX,https://washingtondc.craigslist.org/mld/boa/5870753113.html,1999
21,excellent,2016-11-21 17:36,"Nice Clean, rebuilt 1998 Kawasaki 750+CC , Nice 10'2"" Stable 3 Passenger Jet ski with reverser,  Bored the Cylinders .020 Oversize with New Pistons, Rings, Pins, Pin Bearings and Gaskets, cleaned fuel system and Rebuilt the Carbs and installed a primer system. Brand NEW Battery and Reupholstered.... Starts and runs Great, Clear title in hand and Ready to go... Comes with a Water-Bug trailer with all new wheels , tires, lights, wench, fenders and tie down strap.....   Rebuilt over Winter, ran last weekend out of Spa Creek to Breakin, now ready to go , runs great..... CASH and CARRY, NO B.S.  Price is  $1,995................ Call Pete @ show contact info to Get direction, come see, hear and Buy................",,5870752231,10,Kawasaki,3 Passenger PWC,$1995,power," (Mitchellville, Md.)",Seadoo-1998 Kawasaki 750+CC  Jet Ski,https://washingtondc.craigslist.org/mld/boa/5870752231.html,1998
22,,2016-11-21 16:58,"-1995 Tigershark 640 -Rebuilt motor (runs, good compression, new pistons, new gaskets, new crank, new spark plugs) -Full hull intact with no damage -Trailer included -Project or parts ski -Must sell asap -Buyer must pick up from location -Title included -Serious inquiries only, sold as is. Contact me for more information. -Asking $500 ski all parts and trailer",,5887018525,9,Polaris,Tigershark,$500,power, (Manassas),1995 Tigershark Jet Ski newly rebuilt motor and trailer,https://washingtondc.craigslist.org/nva/boa/5887018525.html,1995
23,excellent,2016-11-21 16:50,"2008 Sea Doo 230 Wake. With room for 12 passengers, you can bring the entire family on the river/lake for hours of entertainment. Whether you just want to cruise in luxury or take advantage of the wake and ski capabilities this boat is sure to please. The 230 Wake is powered by twin jet propulsion engines that crank out 430 hp. Not to mention the fuel tank holds 53 gallons, which means the fun can last for hours! Some of the unique features of this boat include a retractable windshield system, wake tower with racks and speakers, PerfectPass WakeboardPro speed control, cockpit controlled dual ballast tanks, snap-in carpet, and plenty of storage! The boat comes with a trailer and a custom snap cover too. The boat has been properly winterized and spring-prepped each season. Other than traditional wear and tear or docking and loading the boat is in great condition!",342,5865518057,23,Sea Doo,230 Wake,$19500,power, (Alexandria),2008 Sea Doo 230 Wake,https://washingtondc.craigslist.org/mld/boa/5865518057.html,2008
24,,2016-11-21 16:29,"Used Dagger Blast Great River kayak for a big kid or small adult. Long, narrow kayak goes fast and is fun to learn in. PFD's, paddles, helmets, float bags and skirts also available. Swing by the store to try it out! Or email for more info. We buy, trade and sell all types of used paddling gear. We are located at 9812 Falls Rd. Ste 121, Potomac, Md 20854",,5886972298,9,Dagger,Blast,$399,human, (9812 Falls Rd),Used Dagger Blast,https://washingtondc.craigslist.org/mld/bod/5886972298.html,
25,like new,2016-11-21 16:21,"Perfect for waterfowl hunters and fishermen! This boat is in like new condition, it has never been in the water - has been stored indoors since purchase. It is a shallow draft boat and highly maneuverable - perfect for getting into hard to access areas. The motor (also in unused condition) is a 52lb thrust electric motor connected to a gunwale-mounted control panel for forward/reverse control.  Directional control of the boat is via floor-mounted foot pedals connected to the motor head, allowing hands-free steering! Additionally, it is equipped with a cushioned seat, live well (currently not drilled allowing dry storage), steering pedals, transom plate, and drain plug. I am providing 2 wooden paddles and a new battery. Will entertain reasonable offers.",,5886958783,10,Creek,One Man,$900,power, (Manassas),1-man Fishing/Hunting Boat,https://washingtondc.craigslist.org/nva/boa/5886958783.html,2001
26,,2016-11-21 16:12,"Time to thin out the stable (again). Boats that are for sale are as follows: Slalom K1 (center of kayaks leaning on the house) $400 Dagger RPM (red on to the right leaning on the house, VERY GOOD CONDITION, bottom is in wonderful shape) $450) Dagger Dynamo (not in photo but the same as the one to the far right leaning on the house) $300 Prijon Performance (red to the right of the green Kendo) $300 Prijon Cross (green boat on the left, very good condition) $350",,5886944818,0,,,,human,,White Water Kayaks,https://washingtondc.craigslist.org/nva/boa/5886944818.html,
27,,2016-11-21 15:53,"Used Wavesport Score This boat is in fantastic condition. Learn to throw ends in this cartwheel machine. PFD's, paddles, helmets, float bags and skirts also available Swing by the store to try it out! Or email for more info. We buy, trade and sell all types of used paddling gear. We are located at 9812 Falls Rd. Ste 121, Potomac, Md 20854",,5886895285,8,Wavesport,Score,$349,human, (Potomac),Wavesport Score Whitewater Kayak,https://washingtondc.craigslist.org/mld/bod/5886895285.html,
28,,2016-11-21 15:52,"Used Lifetime Arrow These boats have been used for out flatwater trips this season, stable and easy to control. The boats come with a paddle holder, adjustable footpegs and a built in Skeg wheel to help transport your boat from the parking lot to the river. Color choice of green or orange. PFD's, paddles and carts also available . We are located at 9812 Falls Rd. Ste 121, Potomac, Md 20854",,5886888333,10,Lifetime,Arrow,$199,human, (Potomac),Used Lifetime Arrow flatwater Kayak,https://washingtondc.craigslist.org/mld/bod/5886888333.html,
29,,2016-11-21 15:50,"Used but still in great condition. Very stable and easy to use. Comes with a skeg. Ample storage capacity, yet light enough to handle with ease. Helmets, Paddles, PFD's and Skirts also available. Swing by the store to try it out! Or email for more info. We buy, trade and sell all types of used paddling gear. We are located at 9812 Falls Rd. Ste 121, Potomac, Md 20854",,5886908253,10,Dagger,Axis 10.5,$499,human, (Potomac),Dagger Axis 10.5 Kayak,https://washingtondc.craigslist.org/mld/bod/5886908253.html,
