,condition,coord_pair,date,description,engine hours (total),id,lat,length overall (LOA),long,make / manufacturer,map_URL,model name / number,price,propulsion type,region,title,url,year manufactured
34,excellent,[],2016-12-20 11:29,2007 12 foot long Apex Dinghy with fiberglass hull and 25 HP Yamaha Engine. New bottom paint and recent service. Runs great. Upgraded padded drivers seat. Comes with full waterproof cover. Seats 4 comfortably. Super clean and has always been covered. You won't find a cleaner dinghy.   No trailer. Will consider all reasonable offers.,300,5927148437,,12,,Apex,https://maps.google.com/?q=loc%3A+Kingfisher+CT+at+Bellflower+Long+Beach+CA+US,12 Foot,$7200,power, (Long Beach),2007 Apex Dinghy,https://losangeles.craigslist.org/lgb/boa/5927148437.html,2007
35,,,2016-12-20 11:27,"1999 Yamaha GP 800 power valve Waverunner QST  Squickshift trim system 2 stroke More info coming soon, trades welcome, se habla espanol. Please Call us @ show contact info or stop by, 8719 Pearblossom Hwy. Littlerock, CA 93543. You can also visit our website.www.BadAssRidez.com for more photos, we have lots to see! ALL PRICES SUBJECT TO CHANGE. Information deemed reliable, but not guaranteed. Interested parties should confirm all data before relying on it to make a purchase decision. All prices and specifications are subject to change without notice. Prices may or may not include additional local, state or federal fees. Please verify all costs with the seller before making a purchase decision. Print and Bring in Ad for Specific Listed Pricing. All prices and specifications are subject to change without notice. Must Bring In Ad For Specific Listed Pricing.",,5899286922,,1,,,,,,power,,1999 Yamaha   GP 800 power valve  Waverunner 2 stroke Purple/White,https://losangeles.craigslist.org/ant/boa/5899286922.html,
36,,"['34.023815', '-118.403488']",2016-12-20 11:19,"Mariner boat for sale. Almost identical to this: https://www.amazon.com/Mariner-4-Person-Inflatable-Aluminum-Output/dp/B00CMBTCHW Its a little under-inflated in the pictures but its in great condition since it was only used once. No air leaks or cracks. Just some shoe prints on the floor slats. Comes with 3 oars and 2 life jackets, but the air pump is missing.",,5923459121,34.023815,11,-118.403488,,"https://maps.google.com/maps/preview/@34.023815,-118.403488,16z",,$200,human, (Culver City),Mariner boat + life jackets,https://losangeles.craigslist.org/wst/boa/5923459121.html,
37,like new,"['33.144400', '-117.169700']",2016-12-20 11:16,"2009 Striper 2305, Center Console, 24'2"", Yamaha 250hp ELETRIC, only 115 Hours original hours on motor, Brand new ELETRONICS, Garmin 7610 fish finder, Garmin 18x Radar, Garmin 51 transducer, fresh water wash down, large bait tank, 16 extra fishing pole holders. Great boat in immaculate condition. For more information call show contact info Keywords: Boston whaler, Striper, seafox, Parker, MAKKO, Grady white, center console, CUDDY cabin, sport, fishing.",115,5920646654,33.144400,24,-117.169700,Striper,"https://maps.google.com/maps/preview/@33.144400,-117.169700,16z",2305 center console,$49000,power, (San Marcos),2009 Striper 2305 Center Console/Yamaha 250/115 Hours only,https://losangeles.craigslist.org/lgb/boa/5920646654.html,2009
38,,"['35.393500', '-119.120500']",2016-12-20 11:16,"24 foot, twin omc 165 HP inboard/outboard, is a project boat, engines ran when last parked, needs a little external parts work, such as water pumps and one water manifold, have the parts with the boat, trailer is in good shapes just needs lights, has new tires text six six one 667-7889 rosedale is a suburb of bakersfield $3500 obo",,5908532580,35.393500,24,-119.120500,,"https://maps.google.com/maps/preview/@35.393500,-119.120500,16z",,$3500,power, (rosedale),1972 fiberform,https://losangeles.craigslist.org/lgb/boa/5908532580.html,
39,like new,"['33.144400', '-117.169700']",2016-12-20 11:16,"2009 Striper 2305, Center Console, 24'2"", Yamaha 250hp ELETRIC, only 115 Hours original hours on motor, Brand new ELETRONICS, Garmin 7610 fish finder, Garmin 18x Radar, Garmin 51 transducer, fresh water wash down, large bait tank, 16 extra fishing pole holders. Great boat in immaculate condition. For more information call show contact info Keywords: Boston whaler, Striper, seafox, Parker, MAKKO, Grady white, center console, CUDDY cabin, sport, fishing.",115,5895284647,33.144400,24,-117.169700,Striper,"https://maps.google.com/maps/preview/@33.144400,-117.169700,16z",2305 center console,$49000,power, (San Marcos),2009 Striper 2305 Center Console/Yamaha 250/115 Hours only,https://losangeles.craigslist.org/lgb/boa/5895284647.html,2009
40,excellent,,2016-12-20 11:14,"This deal is too good to pass up! $1,500 buys you 1/2 share in the corporation, which entitles you up to two permanent weeks on the boat annually. Average maintenance fees run about $1,250 per year.  Many choice weeks are currently available for 2016, 2017 seasons.  This is an excellent buy for newbies not yet ready for a 75-footer or for those looking to downsize from larger, more costly houseboats. Compare with rentals starting at $5,000 per week. We are looking for six new time-share members to replace recent retirees from the Skipper's Dream, located at slip M-18 at Bullfrog Marina, Lake Powell, Utah. The current members of the Skipper's Dream feel our houseboat appeals to a very distinct houseboat user.  We DO NOT want to take everything with us on the lake.  We are okay with no TV, no A/C, and no slide, and we are very happy with just enough amenities to keep us comfortable and relaxed for a leisurely week on Lake Powell on a dependable houseboat. We offer sleeping for at least eight (10-14 sleeping under the stars using top deck), 1 full bath with shower, and 1/4 bathroom, hot water and heater, complete kitchen with oven, stove, refrigerator/freezer, BBQ Grill, an additional deep chest freezer on the front deck and a generator for power. She has enough storage to keep you from tripping over everyone's gear. Compact at 47 feet, the houseboat is easy to maneuver, can fit many of the best (and tightest) campsites on the lake and can be handled by two people who know what they are doing.  Powered by twin 140-hp Mercruiser I/O gasoline engines, Skippers Dream was one of the plushest and fastest private houseboat when launched at Lake Powell in 1983.  She is still faster than any pontoon boat and is easier to drive and moor than a 75-footer.  We have even added additional gas tanks for extended range.",,5908189639,,47,,Skipperliner,,,$1500,power, (Lake Powell Utah),LakePowell Time Share $1500 = 2 weeks,https://losangeles.craigslist.org/sfv/boa/5908189639.html,1983
41,excellent,"['33.729285', '-118.074501']",2016-12-20 11:14,"We have dropped the Price $5000.00 for a Quick and Sale and a Lucky Someone... Newly Serviced, Our 1998 28' Ciera is super clean and in excellent condition. It sports a 300 HP 7.4 Mercruiser engine that runs well and only a few Hrs on new outdrive. It's roomy cabin can sleep 6 (V-berth, Dinette and forward Bed) with plenty of storage. The kitchenette has a sink, 2-burner stove, microwave, refrigerator, also a deck side BBQ. The Enclosed Marine Head has a toilet, sink and shower (2nd shower spray on deck) It has a Garmin GPS Map 235 Sounder and Raytheon Pathfinder Radar system, JVC AM/FM Cassette player w/ ipod capability, Shore Power Cord, Bait Tank, 4 docking Fenders, and assorted Life Vests. Has been kept in Dry Storage on a Triple Axel Trailer (2009) and has 2 Running Canopies and 2011 Storage Cover. Phone Calls preferred to Russ show contact info Serious CASH Buyers Only  **Also Available '06 Achilles Inflatable w/outboard motor $1500.00",658,5927098282,33.729285,28,-118.074501,Ciera Bayliner,"https://maps.google.com/maps/preview/@33.729285,-118.074501,16z",Sunbridge 2855,$23000,power, (Huntington Harbor),**BAYLINER 2855 Ciera Sunbridge**PRICE REDUCED!,https://losangeles.craigslist.org/wst/boa/5927098282.html,1998
42,excellent,"['33.089500', '-117.112800']",2016-12-20 11:12,"2005 Yamaha VX Deluxe with only 81hrs of use. In excellent condition, fresh water used only. Cost $9,000 new only asking $3,800 with the trailer or $3,500 without. Firm final and fair. Call show contact info Keywords: Yamaha, Wave Runner, WaveRunner, Jet Ski, Boat, SeaDoo, Sea Doo, Sea-Doo, Kawasaki, Honda, Polaris",81,5917703979,33.089500,11,-117.112800,WaveRunner / Yamaha,"https://maps.google.com/maps/preview/@33.089500,-117.112800,16z",VX Deluxe,$3800,power, (Escondido),2005 Yamaha VX Deluxe,https://losangeles.craigslist.org/lac/boa/5917703979.html,2005
43,excellent,"['33.977900', '-118.452500']",2016-12-20 11:06,"Asking $325,000 (obo) Beautiful 2007 Cruisers 447 Yacht, professionally maintained, low hours, low usage, upgraded custom canvas enclosures with premium materials. New electronics, dual screens with all the bells and whistles. Sound system inside and out... Way too much to list in this ad. This video was done by BoatTest dot com, it is not the actual boat for sale but it is the exact same model, here's a link to the video review: https://www.youtube.com/watch?v=a1TLh1ckC98",,5927110609,33.977900,48,-118.452500,Cruisers,"https://maps.google.com/maps/preview/@33.977900,-118.452500,16z",447 Sport Sedan,$325000,power, (Marina Del Rey),2007 Cruisers 447 - Pristine / Low Hours,https://losangeles.craigslist.org/wst/boa/5927110609.html,2007
44,good,"['34.429600', '-119.861200']",2016-12-20 11:01,"""RUNNING, RUNNING, RUNNNING, RUNNING"" 1973 KONA MAKAI PLEASURE  w/OLDS 350cid-360hp, jet-drive, $4k OBO-GOLETA,CA $4k OR BEST OFFER-GOLETA,CA 93117 ""RUNNING, RUNNING, RUNNNING, RUNNING""",,5927103626,34.429600,18,-119.861200,,"https://maps.google.com/maps/preview/@34.429600,-119.861200,16z",,$4000,power," (GOLETA, CA)","1973 KONA MAKAI PLEASURE w/OLDS 350cid-360hp,jet-drive, $4k OBO 'RUNS'",https://losangeles.craigslist.org/sfv/boa/5927103626.html,1973
45,,"['33.842903', '-84.444351']",2016-12-20 10:59,"Sailboat ,  San Juan  24 foot , Sloop    Has Spinaker, Main,  Blade, etc.  4 Stroke long shaft outboard. Have paint but no time to do bottom  so I figure it's time to sell   We're in a fresh water marina.    San Juans are very popular and many clubs have Regattas regularly to race these.   They are great for weekenders.  SLeeps 4 good friends.  Look up on Wikipedia.         Water tight, new running rigging etc.   Call jake show contact info Pix to follow next week but needed to get this started while it;s raining.",,5919580116,33.842903,24,-84.444351,,"https://maps.google.com/maps/preview/@33.842903,-84.444351,16z",,$4500,sail, (Fresh Water),San Juan 24 Sailboat,https://losangeles.craigslist.org/lgb/boa/5919580116.html,
46,good,"['34.168458', '-119.226122']",2016-12-20 10:49,"new top deck paint non skid,Large cabin for size, working head, sleeps 4, fresh bottom paint, hull paint, lettering, and boot stripes. Rolling Furling, Good sails and rigging. 2 new batteries, Freedom 10 Inverter, West Marine combiner, Danforth anchor, some chain and rode. Engine runs great, 4 cylinder universal diesel m4-30, new raw water pump and exhaust riser, all new hoses, fresh tune up. 2 newer bilge pumps and switches. Ground tackle will need some finishing touches, working refrigerator.Dripless will need to be changed next time out of water. lots of love put into this boat, Good for all sailing levels . Email me or call A steal at $4,000 only contact if you want to buy$$,good sails,rigging,  great Engine , paint all around and  electrical system great price ill try to get more/better pics, will deliver to la.",120,5927044183,34.168458,27,-119.226122,Newport,"https://maps.google.com/maps/preview/@34.168458,-119.226122,16z",hull 72,$4000,sail, (Channel island harbor),1970 Newport Sailboat,https://losangeles.craigslist.org/lgb/boa/5927044183.html,1970
47,good,"['33.777221', '-118.145685']",2016-12-20 10:44,"13' Pirateer Sailboat made by Chysler circa 1970's Good condition sailboat with everything you need to sail. Paint is faded, some dings and scratches here and there but structurally sound. Newer sails in good shape, no rips. See specification here: http://sailboatdata.com/viewrecord.asp?class_id=4308 Registration for boat and trailer are current.",,5888717296,33.777221,13,-118.145685,,"https://maps.google.com/maps/preview/@33.777221,-118.145685,16z",,$700,sail, (Termino/8th St),13' Pirateer Sailboat with Trailer,https://losangeles.craigslist.org/lgb/boa/5888717296.html,
48,new,"['34.003000', '-118.429800']",2016-12-20 10:32,Almost new. Goes for $4 a foot new   Even at $1 a foot that's $150 See my other post for Danfoth Anchor. 31O 422 5 7 8 6,,5893606144,34.003000,150,-118.429800,,"https://maps.google.com/maps/preview/@34.003000,-118.429800,16z",,$140,power, (Marina Huntington Newport),150 ft. 3/4 nylon Hi-Grade 3-strand rope near new pre-sliced,https://losangeles.craigslist.org/wst/boa/5893606144.html,
49,excellent,,2016-12-20 10:23,"Get the Biggest Boat that fits into an affordable 30 foot slip. This is a small yacht that is fully loaded and tuned up.  She is nimble and responsive.  A great vessel to Cruise, Fish, and Dive.  Best deal $/foot/usability on the market.  Affordable to run even at 17 knots.  She is ready to take you and your family to enjoy long weekends at Catalina Island etc. Cruise speed is 17 knots.  Troll all day at 7 knots.  Hull speed is 8.5 for longest range.  Top out at 20 knots.  The Uniflite hull is one of the best ever made.  Used dependably for years by many of the most knowledgeable boaters out there.  This one is a 1983 make.  One of the last years that they were made.  So this is Post-Blister construction and as dependable as you can hope to find.  They used good care in the lay up of the fiberglass and quality care in the interior wood fit and finishes.  This one is one of the rare Diesel powered ones.   ( No, not all Uniflite's are gas powered.  Do not price compare to gas boats! ) In 1999 she was re-powered her with super fuel efficient Cummins Diamond Series engines . A big step up from the Yanmars she did have.  Now at 220 HP on each side she gets up and scoots along cruising at 16 to 17 knots with ease, while using a frugal 1 GPM on average.  She carries 200 gallons of diesel and that makes most islands off of southern California your playground. Over the first 4 years I owned her I repainted and upgraded much of the boat.  Recently I re-did the non-skid decks and some touch up paint.  She is in bristol condition.  No wood outside to varnish.  Lots of beautiful woodwork inside for a classy yacht feel. If you like fishing or diving this boat is great.  She carries plenty of bait in two bait bags served by separate bait pumps.  If you SCUBA dive then you will love how she will carry 10 Scuba tanks in the two side racks designed to hold them securely while underway.  In any case you and your guests will enjoy a big roomy back deck to suit up or to fish from.  There is big deep diver friendly boarding ladder too. This big boat feel is best noted when you see the sizes of the back deck and upper deck.  You have room to work and play!  The back deck is your picnic area when in the harbor or on a mooring at Catalina Island.  A big Sun Shade is included at this price.  Recently I upgraded the boat with underwater lights.  One down and two aft. The super bright one down facing light is great for attracting fish or squid.  It gives off 4,000 lumen and only uses 2.8 amps of draw.  Or just use the aft facing pair of lights for mood lighting when entertaining at the docks or at a concert in the park with friends. The generator and toilet systems have been upgraded.  The front master's cabin was upgraded with a real mattress that is custom fitted to give you the most room and the most comfort.  You'll sleep like a baby on the mooring at the island.  Your main salon will sleep two in fold up bunk beds and 2 more in a settee table that folds down into a big double bed.  More sleeping area could be made up on the upper deck with it's two small fold down seats or with an inflatable mattress. The Bridge is very roomy for cocktail cruising in the harbor or for scoping out whales or marlin while at sea.  It is fully enclosed with isinglass.  It was enlarged, making a big, warm, protected space to drive with great views.  Room enough for 5 to sit and enjoy a cruise.  This raised helm area has very good views.  Much better than an express where you will not see the water directly in front of the boat.  This is a important safety feature, BTW. The controls are very responsive and laid out well.  Radar, Color GPS, ChartPlotter, Autopilot (connected to GPS for tracking), top of the line Fish Finder (new updated transducer May 2016), VHS radio with MSSI emergency coding, FM radio, cigarette lighter plug (for cell phone charging) and extra electrical available.  New Bottom paint just done in May 2016!  New Underwater Lights on the Bottom installed May 2016 that will attract bait.  Props and shafts out and tuned up at Wilmington Prop Shop in May**. The anchoring system is a big plus. 36 feet of big chain and almost 300 feet of rode for secure hold in most anchorages no mater the weather. 10:1 in 33 foot of water (Storm set).  7:1 in 47 feet for overnights or high winds.  5:1 for day anchorage or dive spots up to 66 feet.  Fishing stop or lunch stop in up to 100 foot of water at 3:1.  That is a lot of options.  She holds well and does not have a bad roll on the anchor.  Balanced load with wide fuel tanks and aft deisel engines will be appreciated by all your guests. So she runs great and will be a dream to own. Gotta see to appreciate.  If you are moving up from a gas boat or a trailer boat you will be really happy that you got into this one.  Not to be compared with a Bayliner hull or any of the gas boats in this category of 28 to 36 foot boats.  Quality holds it's value. Documented vessel.  All serious inquiries welcome.  If a qualified boater, I'll take you out for a quick little demo ride.  Please bring your wife/partner if married. She will like it too! Call me.  3 1 0 - 4 3 7 - 0 6 7 7 ** Wilmington Prop Shop is a big deal. The Shafts are perfect now and the Props are refreshed and cupped for the most efficient thrust etc.  This is indicative of how I have cared for the boat for the last 8 years. With love and full commitment to the best boat I can make her into.  I intended to keep her when I was out of the water in May.  My loss is your gain.  You get the extras and the fresh bottom and new shaft logs and tuned props and new lights and new transducer etc. etc. Sorry... Most of the photos I have of the cockpit (Aft Deck) are with people in it and the many fish we have caught. Note in the photos the upgraded House Battery Switch system too.  The Ramblin will be great for long weekends at the islands with plenty of power. 3 big house batteries.  1 starter in the engine compartment.  And 1 small one set aside just for the generator.  You have all the electrical needs covered.",,5927040762,,32,,Uniflite,,32SS,$65500,power, (Los Angeles),Uniflite 32 SS - 1999 Cummins Diesels,https://losangeles.craigslist.org/wst/boa/5927040762.html,1983
50,good,"['34.107600', '-118.602300']",2016-12-20 10:20,This is a nice boat in good condition. Price reduced 2k as it may need bottom paint and an after winter cleaning. The last long trip was to Mexico. Everything works. Microwave and mini fridge for dock side use. Alcohol stove for Catalina. Rigged for single handing. Slip not assumable Great boat for the money.,,5927035255,34.107600,29,-118.602300,Ericson,"https://maps.google.com/maps/preview/@34.107600,-118.602300,16z",29,$7000,sail, (MDR),Ericson 29 '73,https://losangeles.craigslist.org/wst/boa/5927035255.html,1973
51,good,,2016-12-20 10:12,"Selling a 1996 Yamaha Wave Raider 760 with a heavy duty trailer. Runs great, Sold as is.",50,5927022093,,50,,Yamaha,,Wave Raider 760,$1500,power, (la crescenta),Yamaha Waveraider 760 Jet Ski + Trailer,https://losangeles.craigslist.org/sfv/boa/5927022093.html,1996
52,,"['33.977900', '-118.452500']",2016-12-20 10:06,I'm selling my apex dinghy- with Nissan motor- want to get rid of ASAP- $200 pick up yourself.,,5927012924,33.977900,10,-118.452500,,"https://maps.google.com/maps/preview/@33.977900,-118.452500,16z",,$200,power, (Marina Del Rey),Dinghy for sale- pick up yourself,https://losangeles.craigslist.org/wst/boa/5927012924.html,
53,excellent,"['33.977900', '-118.452500']",2016-12-20 10:06,"Evinrude 15hp. 2 stroke Electric start!!! Long shaft full cock pit controls 2 stroke starts great!! Runs great!! and is in good condition, Turn key condition!. and tiller! With alternator to charge your betties when your out at sea or  on Catalina long shaft 21"" This motor is fully loaded This is a very good motor and will run forever Will start and run for you!!!!! perfect for larger sailboat Come have a look $750 Must Sell offers",,5926982270,33.977900,21,-118.452500,,"https://maps.google.com/maps/preview/@33.977900,-118.452500,16z",,,power,,Evinrude 15hp. 2 stroke Electric start!!! Long shaft full cock pit con,https://losangeles.craigslist.org/wst/boa/5926982270.html,
54,good,,2016-12-20 10:03,I am selling my cobra fish n dive kayak. Its in good condition. Only used a couple times. Trailer included.,,5927007849,,150,,,,,$1000,human,,cobra fish n dive kayak,https://losangeles.craigslist.org/lac/boa/5927007849.html,
55,new,"['34.261800', '-118.337100']",2016-12-20 10:00,"Great side console fishing boat that is totally compliant for use in any and all lakes in California. It's a very stable and safe fishing platform that is so easy to launch and retrieve, can be towed by any vehicle and will fit in most any garage. It's in new condition with Nautolex marine vinyl covered floorboards & new camo seats. The trailer is a new factory matched Tracker Trailstar set up by Bass Pro Marine. The Honda 25 four stroke with remote control is not brand new but it runs perfectly and it's appearance is like a new one. Honda is considered by most everyone as the very best outboard motors built. It's whisper quiet, clean burning and economical to operate. The cost of this motor new is around $4500.00. This package is bargain priced and will not disappoint any buyer. I won't look at offers by email so don't bother throwing something at me. Come take a look and compare with other boats that are out there. You'll see a great little package at a fair price. show contact info",,5923139317,34.261800,15,-118.337100,Tracker,"https://maps.google.com/maps/preview/@34.261800,-118.337100,16z",1548 Jon,$5500,power,,TRACKER 1548 JON w/ SIDE CONSOLE & 25 HONDA FOUR STROKE,https://losangeles.craigslist.org/sfv/boa/5923139317.html,2016
56,like new,"['34.259061', '-118.341122']",2016-12-20 09:59,"This aluminum boat will score a nine out of a possible 10 and has a nearly new 4 stroke motor. You'll see a good quality boat at a fair price. You can fish any lake or river in California with this very nice, ultra clean burning 2014 Suzuki 4 stroke with fuel injection. The NADA book value of this motor is $2450.00. No other manufacturer makes a fuel injected motor in this horsepower rating. No more hard starts, no more gunked up carburetors that need cleaning, just hassle free reliability and great responsive power. It's a perfect match on this all welded, no leaks 13'-6"" Western aluminum boat that has been upgraded with all new decking covered with Nautolex marine vinyl flooring, nice quality seating and a new burgundy bimini top. It's wide for stability and deep for safety on bigger waters and it has built in factory floatation, too. It's easy to launch and retrieve, can be towed with most any vehicle and will easily fit in any garage. The trailer is in very good condition. Registration is current & titles are in hand. Asking price is $3500.00. Come see it run and make an offer. I won't respond to email offers. Call me at show contact info",,5916195906,34.259061,14,-118.341122,Western,"https://maps.google.com/maps/preview/@34.259061,-118.341122,16z",All Welded,,power,,WELDED ALUMINUM SKIFF w/ FUEL INJECTED SUZUKI 4 STROKE,https://losangeles.craigslist.org/sfv/boa/5916195906.html,
57,good,[],2016-12-20 09:59,I have 2 1998 seadoos for sale asking $1500. Obo  including trailer and vests going thru divor e need to sale  asap pinks in hand run great,,5918896468,,0,,Seadoo,https://maps.google.com/?q=loc%3A+%34%35%35%30+s+DeLand+ave+Pico+rivera+CA+US,Jetsky,$1500,power, (Pico rivera),2 98 seadoos for sale,https://losangeles.craigslist.org/sgv/boa/5918896468.html,1998
58,,"['33.865400', '-118.073100']",2016-12-20 09:57,"Double truck bed carrier. Use for seadoo, jetski, waverunner.  Works great can bring your skies while you tow a boat or Trailer. Yamaha, seadoo, stand up, ford, chevy, toyota, dodge, 4x4, lake, ocean, boat,  deck boat, malibu, tahoe, paddle, wakeboard",,5926970728,33.865400,8,-118.073100,,"https://maps.google.com/maps/preview/@33.865400,-118.073100,16z",,$1500,power, (Artesia),Jettrax double seadoo/jetski carrier,https://losangeles.craigslist.org/lgb/boa/5926970728.html,
59,,"['34.205700', '-118.400100']",2016-12-20 09:55,"Hi,my name is Frank of,FRANKS MOBILE SERVICE,I am a one man operation with low overhead that means I can give you a good price on labor for inboard and outboard maintenance,shift cables,steering cables,fresh water pumps,per-co switch,tune up,oil change(MTR.AND OR DRIVE) gimbal bearing,u-joint and much more. With over 20 years in automotive and 16 years on inborad and outboard boats I can help get you back on the water.CALL show contact info E-mail show contact info THANK YOU.",,5911087130,34.205700,13,-118.400100,,"https://maps.google.com/maps/preview/@34.205700,-118.400100,16z",,$65,power, (ALL SOCAL),####FRANKS MOBILE BOAT SERVICE####,https://losangeles.craigslist.org/sfv/boa/5911087130.html,
