,condition,coord_pair,date,description,engine hours (total),id,lat,length overall (LOA),long,make / manufacturer,map_URL,model name / number,price,propulsion type,region,title,url,year manufactured
87,like new,"['34.426200', '-118.449000']",2016-12-20 08:57,"I KEEP LOWERING MY PRICE BUT I DON'T KNOW HOW MUCH LOWER I CAN GO. REALLY I'M AT A POINT WHERE I WILL HAVE TO TAKE IT AND SALE IT WHERE I'M MOVING TOO!!!!! MOVING BOAT MUST BE SOLD RUNNING OUT OF TIME!!!!!!!!! THIS BOAT IS AT A BOAT DEALER THEY ARE SELLING IT FOR ME AT THIS TIME. YOU CAN ASK ME FOR MORE INFO ON BOAT DEALER. (BUT THEY HAVE IT UP FOR $14,000) NOTE: IF YOU GO THRU ME I WILL TAKE $10,500 FOR THE BOAT. HERE IS THE HISTORY OF THIS BOAT. I got this boat from this guys widow (HE WAS A MECHANICAL ENGINEER) and he did a lot of work to this boat.  I (Did a lot of up grade's too) But most of my work was on the trailer. I took the boat out to long beach harbor and a little bit out side the channel and stayed on it for 3 days that's it. The bottom line is I don't know a lot about this boat. Its a real nice boat and if I wasn't moving I would keep it but where I'm going the ocean is 6 to 7 hours away. NOTE: I WOULD BE WILLING TO MAKE A TRADE FOR A BALL TYPE LONG ENCLOSED TRAILER HIT ME UP IF YOU HAVE A TRADE!! NOTE: Lot of extra come with this boat 1972 Maurader 24ft very clean 427 big block Chevy with a lot of power. NOTE: Trailer has new rims and tires new leaf spring, U bolts, bearings and seals, All new disk brake system with master cylinder brake line ect, rewire trailer put led light on it show contact info ASK FOR JOE.",,5890178841,34.426200,24,-118.449000,Autocoast,"https://maps.google.com/maps/preview/@34.426200,-118.449000,16z",Maurader,$10500,power, (Elizabeth lake),1972 Maurader/In Santa Clarita- MUST SALE MOVING,https://losangeles.craigslist.org/ant/boa/5890178841.html,1972
88,like new,"['33.801688', '-118.388329']",2016-12-20 08:56,Practically Brand New - used 4-5 times.  Not a single scratch on it. All white; Orange Ama.  At Redondo Harbor.  Kamanu Factory Covers.  Light Fast setup. $4500 Firm.,,5919844093,33.801688,22,-118.388329,Kamanu,"https://maps.google.com/maps/preview/@33.801688,-118.388329,16z",Pueo,$4500,human, (Palos Verdes Estates),OC1 Kamanu Pueo,https://losangeles.craigslist.org/wst/boa/5919844093.html,2016
89,excellent,"['33.847300', '-118.111500']",2016-12-20 08:52,"25,500 2004 sport nautique 216 274hrs New tires on trailer Stereo amp Bimmini",274,5926888776,33.847300,21,-118.111500,nautique,"https://maps.google.com/maps/preview/@33.847300,-118.111500,16z",sport nautique 216,$25500,power, (lakewood),2004 sport nautique,https://losangeles.craigslist.org/lgb/boa/5926888776.html,2004
90,excellent,,2016-12-20 08:49,This is a very stable kayak that comes complete with a built in seat and an upgraded Cobra Powerflex paddle. It has 2 flush mounted pole / rod holders as well as a fishing crate with 2 more holders on it as well. It is 10ft long and 31 inches wide which makes it very easy to transport and maneuver around for 1 person yet super stable and hard to tip over. There are 2 hatches one in the center and one in the rear. The center hatch has a removable gear bag to store your valuables. It will make a great gift! Ready to use now! Priced to sell $275 First come first served. I will delete this ad as soon as its gone! PLEASE LEAVE YOUR PHONE NUMBER WITH ANY INQUIRIES SO I KNOW YOU ARE A SERIOUS BUYER!,,5926884269,,10,,,,,$275,human, (simi valley),AWESOME Fishing Dive Fun Kayak Stable Complete Ocean Lake River Harbor,https://losangeles.craigslist.org/sfv/boa/5926884269.html,
91,excellent,,2016-12-20 08:48,"1997 Sea Pro 190 DC.  140 HP outboard Suzuki , 2 bait tanks,fish finder,radio,GPS Map ,new seats      ,new gauges,new canvas, full cover ,and  half cover .many extras with purchase ..only $9,500.00     call for info, or offers",,5911542463,,20,,Sea Pro,,190DC,$9500,power, (Santa Monica),Sea Pro boat 4 $ALE,https://losangeles.craigslist.org/wst/boa/5911542463.html,1997
92,excellent,"['33.721000', '-118.003300']",2016-12-20 08:48,"This boat is in excellent condition and well maintained with only 171 hrs. It comes with a 25 ft tandem trailer with brand new hydraulic brakes, 5.7 liter engine, 300 hp, fuel injected, stainless steel twin props, open bow, swim step w/ ladders in front and back, sink, transom shower, porta potty, dual batteries with switch, battery charger, 2 covers, 2 Bimini tops, fresh water tank, brand new Fusion stereo with 4 speakers and snap in carpet.",171,5926882732,33.721000,25,-118.003300,Larson,"https://maps.google.com/maps/preview/@33.721000,-118.003300,16z",Tom Waterman,$21500,power, (Huntington Beach),Larson LXI 248,https://losangeles.craigslist.org/lgb/boa/5926882732.html,2005
93,,"['33.931500', '-117.411900']",2016-12-20 08:41,"06 triton tr 176 in like new conditions in and out ,water ready now powered by a 08 evinrude 115 hp e-tec ultra low emission legal on all lakes controlled by a minn kota 24v trolling motor 70 lbs , 2 lowrance fish finders one with color and gps, live wells and all the instruments work , new cranking battery ,new tires on trailer, gel coat shine s like new , carpet in great shape and planty of storage. this is a very stable bass boat and a pure pleasure to handle and fish with. must see to appreciate. for more info please call or text show contact info asking 14500 obo. thank you.",,5902662019,33.931500,18,-117.411900,,"https://maps.google.com/maps/preview/@33.931500,-117.411900,16z",,$14500,power, (riverside),06 triton tr176 bass boat,https://losangeles.craigslist.org/lac/boa/5902662019.html,
94,good,"['33.716344', '-118.277092']",2016-12-20 08:40,"Nice clean  boat  that is ready to sail.  Fresh varnish,  paint job and bottom in good condition. Sails in good condition.  Roller furling jib, needs a new engine, auto helm, solar,  refrigeration, propane stove/oven, VHF, stero, depth finder, 11'6 Avon dinghy with 15 hp merc $7,000",270,5904259579,33.716344,35,-118.277092,Morgan,"https://maps.google.com/maps/preview/@33.716344,-118.277092,16z",Mark II Sloop,$7000,sail, (San Pedro),MORGAN 35 SLOOP,https://losangeles.craigslist.org/lgb/boa/5904259579.html,
95,good,"['33.977900', '-118.452500']",2016-12-20 08:33,"Motor Runs, Issue with Gear Cables.  Interior in excellent shape. Slip transferrable upon approval from Marina. $454 monthly Firm on price. In no rush to sell.",,5926857805,33.977900,31,-118.452500,bayliner,"https://maps.google.com/maps/preview/@33.977900,-118.452500,16z",contessa,$4000,power, (Marina Del Rey),1986 Bayliner Contessa 2855 Power Boat,https://losangeles.craigslist.org/wst/boa/5926857805.html,
96,good,"['33.886700', '-118.126500']",2016-12-20 08:29,"2005 fuel injected Seadoo for one person to ride standing and sitting, I don't have the bucket seat just the comes with the one under the handle, still a fun to ride alone stand or ride like a dirt bike with one seat. let me know i'm also interested on trade for a quad let me know what you have. NO TRAILER INCLUDED Pink slip on hand and tags paid until 2017 txt only 562-nine-000-six 00-one",,5926851506,33.886700,11,-118.126500,SEADOO,"https://maps.google.com/maps/preview/@33.886700,-118.126500,16z",3D,$2500,power, (bellflower),3D SeaDoo,https://losangeles.craigslist.org/lgb/boa/5926851506.html,2005
97,excellent,"['33.723918', '-118.284304']",2016-12-20 08:28,"Call owner for information or call Shoreline Yacht Group, Capt. George Miller show contact info to see this Offshore 48 aft cabin yacht, Cat engines with low hours (1290). Spacious comfortable interior, enclosed upper deck and fly bridge, great live-a-board or extended stay Catalina yacht. Twin staterooms and heads with walk in shower, office or pantry space off galley, large salon, upper deck and Fly Bridge. Support systems include 350 gallon water capacity, 50 gallon holding tank and Northern Lights Generator. NEW Fuel Tanks, NEW stainless exhaust systems, dripless PPS shaft seals, NEW water tank, canvas and cushions, forced air marine heater, NEW  engine intake seacock's, NEW start and house batteries, oversize Rocna 40 (88lb) anchor, 400 feet high test chain. Custom stainless anchor pulpit, upgraded Dingy Davit, 2004 Zodiac Yacht Line Rib with 30HP Honda outboard. (Bottom done Nov. 2014).",1290,5911092217,33.723918,48,-118.284304,Offshore,"https://maps.google.com/maps/preview/@33.723918,-118.284304,16z",Cockpit Yacht Fisher,$119500,power, (San Pedro),Boats - by owner,https://losangeles.craigslist.org/lgb/boa/5911092217.html,1985
98,new,[],2016-12-20 08:25,GLM HGE OSCO BARR Exhaust manifolds risers OMC VOLVO PENTA MERCRUISER CRUSADER Sm BIG Blk GM Ford Crysler GLM manifolds & risers come with EXCLUSIVE 3 YEAR MANUFACTURES WARRANTY and NOW GALVANIZE COATED WITH A BLACK CORROSION RESISTANT PAINT FINISH   LEARN HOW TO DO IT YOURSELF    I'm Bruce Kawazoye call for more information show contact info Venice Beach/Marina Del Rey,,5920082706,,20,,,https://maps.google.com/?q=loc%3A+PALMS+BL%2E+VENICE+CA+US,,$560,power, (Venice Beach/Marina Del Rey),GLM HGE OSCO BARR Exhaust manifolds risers,https://losangeles.craigslist.org/wst/boa/5920082706.html,
99,,"['33.889600', '-118.399600']",2016-12-20 08:21,"New trailer lights, water skis, 1998 Dodge ram 1500 air filter. Boat transom or outboard support stern drive and outboard support , and other boating stuff. Call for info show contact info cell show contact info",,5913474224,33.889600,1,-118.399600,,"https://maps.google.com/maps/preview/@33.889600,-118.399600,16z",,$25,power, (manhattan Beach),Dodge Ram 1998 Sterndrive or outboard support Beer float Boat stuff,https://losangeles.craigslist.org/wst/boa/5913474224.html,
