,condition,coord_pair,date,description,engine hours (total),id,lat,length overall (LOA),long,make / manufacturer,map_URL,model name / number,price,propulsion type,region,title,url,year manufactured
0,good,,2016-12-20 14:29,for sale : 15 foot Super Sport Boston Whaler ****** everything you see inside the boat is brand new and the pacific trailer****** (no motor) price: $ 5000 obo 323 224 121O,,5921655120,,15,,Boston whaler,,Super sport,$5000,power, (El sereno),Boston Whaler super sport,https://losangeles.craigslist.org/lac/boa/5921655120.html,
1,good,"['34.690900', '-118.149100']",2016-12-20 14:29,Valco 14 ft.,,5927407057,34.690900,014,-118.149100,Valco,"https://maps.google.com/maps/preview/@34.690900,-118.149100,16z",,$1000,power, (Lancaster),Aluminum boat,https://losangeles.craigslist.org/ant/boa/5927407057.html,
2,,"['33.823000', '-118.268400']",2016-12-20 14:25,Nice boat just needs to be put together. New motor and outdrive show contact info,,5910406653,33.823000,19,-118.268400,,"https://maps.google.com/maps/preview/@33.823000,-118.268400,16z",,$1600,power,,19 ft bayliner,https://losangeles.craigslist.org/wst/boa/5910406653.html,
3,good,,2016-12-20 14:13,bbc runs great needs interior hull in great shape almost no stress cracks full redone stringers,,5905554069,,21,,continent,,,$7000,power, (simi valley),V-drive day cruser boat,https://losangeles.craigslist.org/sfv/boa/5905554069.html,1977
4,like new,"['33.922800', '-117.486700']",2016-12-20 13:53,"selling a refurbished jet ski trailer. Its a 4-stroke model mad by zieman and now it looks like new again. model J-2B is a 2004 year model witth all new paint. Yes it has been sanded down primered and painted with two coats of polyureathane quality paint. it looks great. It has great tires and bunks. All lights work, storage box. All white with channel construstiion. No rust on this baby. all service including repack of buddy bearings. all grounds checked and no issues. have pink and bill of sale no issues there either. if u want a like new trailer that needs nothing looks new needs nothing aand is ready to go call me Dave show contact info firm on price. May consider trade of single 4-stroke trailer. do NOT contact me with unsolicited services or offers",,5894591779,33.922800,16,-117.486700,zieman,"https://maps.google.com/maps/preview/@33.922800,-117.486700,16z",j-2B 4-stroke,$1295,human, (riverside),2004 Zieman white double jet ski trailer 4-stroke like new. must see,https://losangeles.craigslist.org/sgv/boa/5894591779.html,2004
5,like new,"['33.922800', '-117.486700']",2016-12-20 13:52,Must see custom jet ski trailer. Set up to carry two full size 3 seater 4-stroke plus a two seater and a stand up. or two 4-strokes a two 2 seaters. This is a full custom trailer all black with chrome wheels including a matching spare. new lights on rear and all side markers work. Has the large locking storage box and a 4 ft square by 1 ft storage container to carry whatever including chairs canopy parts or whater u may have. has 4 can gas rack double axle holds 3500 lbs. more than enough for 4 skis. trailer needs nothing and is ready to load nd go. Have clean title and bill of sale. No issues. If interested call dave at show contact info thanks dave,,5906861411,33.922800,20,-117.486700,longrun,"https://maps.google.com/maps/preview/@33.922800,-117.486700,16z",custom double axle,$1899,human, (riverside),jet ski trailer four 3 or 4 skis like new custom black 4-stroke clean,https://losangeles.craigslist.org/sgv/boa/5906861411.html,
6,like new,"['33.922800', '-117.486700']",2016-12-20 13:51,"selling a refurbished jet ski trailer. Its a 4-stroke model mad by zieman and now it looks like new again. model J-2B is a 2004 year model witth all new paint. Yes it has been sanded down primered and painted with two coats of polyureathane quality paint. it looks great. It has great tires and bunks. All lights work, storage box. All white with channel construstiion. No rust on this baby. all service including repack of buddy bearings. all grounds checked and no issues. have pink and bill of sale no issues there either. if u want a like new trailer that needs nothing looks new needs nothing aand is ready to go call me Dave show contact info firm on price. May consider trade of single 4-stroke trailer. do NOT contact me with unsolicited services or offers",,5894592394,33.922800,16,-117.486700,zieman,"https://maps.google.com/maps/preview/@33.922800,-117.486700,16z",j-2B 4-stroke,$1295,human, (riverside),2004 Zieman white double jet ski trailer 4-stroke like new. must see,https://losangeles.craigslist.org/sgv/boa/5894592394.html,2004
7,new,,2016-12-20 13:42,1999 25ft Nordic power boat this boat is like new interior is like new nice sound system trim tabs open bow this boat runs great 454 mag 300 hr wake board pole new bimini top trailer has new paint and tires runs 65 mph clean boat show contact info,,5927254300,,25,,,,,$28500,power, (reseda),25ft nordic power boat like new we use the boat all the time turn key,https://losangeles.craigslist.org/sgv/boa/5927254300.html,
8,like new,,2016-12-20 13:40,"Why buy a boat with all the hassle and headaches? For way less than a quarter of the price you can have access to a number of boats. Boats ranging from 35' power boats, fishing boats, all the way to electric duffy's. Locations in California and Arizona. Scroll through my pictures and message me for any info you may need. This is the time to purchase my packages. Prices will only increase the closer we get to boat season. Cheers and happy holiday's :)",,5905810692,,35,,,,,$1,power, (Long Beach),Thinking Of Buying A Boat?,https://losangeles.craigslist.org/lgb/boa/5905810692.html,
9,good,"['34.169346', '-119.226551']",2016-12-20 13:38,"new top deck paint non skid,Large cabin for size, working head, sleeps 4, fresh bottom paint, hull paint, lettering, and boot stripes. Rolling Furling, Good sails and rigging. 2 new batteries, Freedom 10 Inverter, West Marine combiner, Danforth anchor, some chain and rode. Engine runs great, 4 cylinder universal diesel m4-30, new raw water pump and exhaust riser, all new hoses, fresh tune up. 2 newer bilge pumps and switches. Ground tackle will need some finishing touches, working refrigerator.Dripless will need to be changed next time out of water. lots of love put into this boat, Good for all sailing levels . Email me or call A steal at $4,000 only contact if you want to buy$$,good sails,rigging,  great Engine , paint all around and  electrical system great price ill try to get more/better pics, will deliver to la.",120,5927280312,34.169346,27,-119.226551,Newport,"https://maps.google.com/maps/preview/@34.169346,-119.226551,16z",hull 72,$4000,sail, (Channel Islands Harbor),1970 Newport Sailboat,https://losangeles.craigslist.org/lgb/boa/5927280312.html,1970
10,,,2016-12-20 13:33,!! Ill be honest with you!! 818 554 291zero :) Seadoo yamaha kawasaki honda From service to a complete engine rebuild 4stroke 2stroke Jetski shop jetski mechanic seadoo mechanic waverunner yamaha xlt xl kawasaki stx honda aquatrax valencia santa clarita antelope valley stevenson ranch encino san fernando,,5927318277,,16,,,,,$1,power, (Sfv),Jetski watercraft Mechanic,https://losangeles.craigslist.org/sfv/boa/5927318277.html,
11,good,"['34.423900', '-117.407500']",2016-12-20 13:26,"83' Ebbtide Bassboat combo.  wrap around walk through windshield.  18' open bow, seats 4. Evenrude 235hp outboard. Single axle welded trailer. Options:  Motor guide 24 volt troll motor. 2 deep cycle batteries, 1 starting battery.   Outboard jack plate, Hot foot throttle, trim and tilt. Spare tire, front wheel jack. Nada low $3050 high 3560. Sell $2500 Low price fun/fishing boat! For more information call or Tex. Thank you.",,5927302210,34.423900,18,-117.407500,Ebbtide,"https://maps.google.com/maps/preview/@34.423900,-117.407500,16z",Dynatrack fish/ski,$2500,power, (HESPERIA),BASS BOAT FISH / SKI,https://losangeles.craigslist.org/sgv/boa/5927302210.html,1983
12,excellent,"['34.236700', '-118.546600']",2016-12-20 13:26,"I have a Super Clean 2001 Sea Doo XP 2 Seater with a new rebuilt 951....Engine was just rebuilt a week ago ..... asking $ 3,100.00 OBO...... Comes with a 2001 trailer This a Carburetor engine super Clean title in Hand.......818-428-96 NINE FIVE",1,5901166175,34.236700,10,-118.546600,Sea Doo,"https://maps.google.com/maps/preview/@34.236700,-118.546600,16z",XP/ 951cc,$3100,power, (Northridge),2001 SeaDoo XP New Engine,https://losangeles.craigslist.org/sfv/boa/5901166175.html,2001
13,good,,2016-12-20 13:25,I am offering a boat for sale.  The body of this boat is in great condition.  Needs a new engine.  We have all the paper work for this boat.  If you should have any questions or just want to come and take a look at the boat feel free to contact at any time. My name is Ashley and my phone number is show contact info,,5927321286,,15,,,,,$900,power, (Reseda),BOAT FOR SALE!,https://losangeles.craigslist.org/sfv/boa/5927321286.html,
14,excellent,"['34.236700', '-118.546600']",2016-12-20 13:25,"I Have a Super Clean 2014 Sea Doo GTI 130 with 20 Hours comes with the New Intelligent Brake & Reverse System comes with 2 Keys fast and Slow..just serviced and ready to go 2004 Sea Doo RXP Supercharged with 91.5 Hours just serviced and ready for the water... 2014 Sea Doo Move Trailer The whole package for $ 11,500.00 OBO...... titles in Hand 818-428-969 FIVE Willing To Separate Make Offer....",20,5888163385,34.236700,11,-118.546600,Sea Doo,"https://maps.google.com/maps/preview/@34.236700,-118.546600,16z",GTI - 130,$11500,power, (Northridge),2014 Sea Doo GTI 130 & 2004 Sea Doo RXP,https://losangeles.craigslist.org/sfv/boa/5888163385.html,2014
15,good,"['33.977900', '-118.452500']",2016-12-20 13:22,"$6,000 or best offer Ready to sail Recently rebuilt Atomic 4 engine New stuffing box Good sails, Jib and Genoa with roller furling Newer interior cushions (in black) Deck cushions in good condition (in white) Magellan color GPS Wheel steering Interior wood could use some TLC Galley stove has been replaced by a microwave Traditional interior with the fold up table Routinely maintained and cleaned",,5920001152,33.977900,27,-118.452500,Catalina,"https://maps.google.com/maps/preview/@33.977900,-118.452500,16z",27,$6000,sail, (Marina Del Rey),Catalina 27 1976,https://losangeles.craigslist.org/wst/boa/5920001152.html,1976
16,,"['34.129426', '-117.847252']",2016-12-20 13:13,"I have a 1972 Southwind with a 1969 Mercury 1250 (125hp) outboard. The transom of the hull has been rebuilt/re-fiberglassed and fitted with aluminum mounting plates to upgrade to a bigger engine. New heavy gauge aluminum saddle bag fuel tanks were installed w a fuel gauge. New steering column, linkage, steering wheel and cables. New wiring harness for the engine. I have all receipts from recent services and upgrades. Boat ran at the end of last year when I parked it. Boat needs new interior. Trailer needs new bunks, and tires are good to get it home but I'd probably replace them before going on a long trip. I have the pink slip and current registration for both the boat and the trailer. Asking 2000 obo, or willing to trade for a 1947-1958 or 1967-1975 Chevrolet project truck.",,5927303357,34.129426,19,-117.847252,Southwind,"https://maps.google.com/maps/preview/@34.129426,-117.847252,16z",,$2000,power, (Glendora),1972 19ft Southwind w/ outboard,https://losangeles.craigslist.org/sgv/boa/5927303357.html,1972
17,excellent,"['34.773768', '-118.479996']",2016-12-20 13:03,No engine but good body and fuel tank was project 17 ft comes with trailer 700$ obo With trailer show contact info,,5904985782,34.773768,17,-118.479996,,"https://maps.google.com/maps/preview/@34.773768,-118.479996,16z",,$500,human, (West Lancaster),Boat and trailer for sale,https://losangeles.craigslist.org/ant/boa/5904985782.html,
18,,,2016-12-20 13:00,2 Kawasaki jet ski with trailer for sell 14900 obo Low hours. Good condition email me if you're a serious buyer,,5902066471,,19,,2005 Kawasaki,,,$14900,power, (San Fernando),2 Kawasaki Jet ski,https://losangeles.craigslist.org/wst/boa/5902066471.html,2005
19,,"['34.658300', '-120.450600']",2016-12-20 12:58,"Open to possible trade looking for a family vehicle for my family. 2003 Tahoe in good running condition that's safe for my family. Or let me know what you got for trade. Really need a reliable family car....1990 gregor welded aluminum boat, These boat has a transom well. a lot of aluminum boats don't come with this accessory. Witch is a good thing because rogue waves hit the back transom and water goes back out by the motor and not in your boat. I'm sure that it's manufactured that way. Comes with a beautiful galvanized steel trailer no rust at all. Boat has 25hp mercury 2stroke outboard electric start. Marine battery Optima gel battery. Two 5 gallon gas tanks. I only use one tank cause 5 gallons last about two or three trips. 25hp mercury runs strong and fast on the ocean the boat is rated for a 25hp. Also bunch of extra accessories like flair gun emergency kit. First aid kit. Two wood pattles,  big net. Two attwood Trolling rod holders Lowrance fish finder with gps. Extra kicker motor as a back up motor never use it. But it runs good its like new. 4hp 2stroke Evinrude Light weight, But most of all just installed seamax 4x4 Deluxe telescopic 4stage beach launching wheels 600lbs max capacity... Not your normal cheap wheels I reinforced the Transom with aluminum plate for the beach wheels. And added a lot of new stainless steel hardware. New stainless eyebolts reinforced for slings for hoist. And trailer dolly comes with trailer. 805-406-583seven.",,5924252866,34.658300,14,-120.450600,,"https://maps.google.com/maps/preview/@34.658300,-120.450600,16z",,$3500,power, (Lompoc),14 gregor 25hp mercury electric start 2stroke,https://losangeles.craigslist.org/ant/boa/5924252866.html,1990
20,excellent,,2016-12-20 12:53,"2900 SE boasts a roomy cockpit with twin rotating forward seats and a three-position rear seat that converts to a sun pad. A transom door, removable table, and shower were standard, and a cockpit grill was a popular option. Below, the decidedly Spartan interior includes an offset double berth forward with privacy curtain, convertible dinette to starboard, standup head with shower, and fully equipped galley with microwave, stove and refrigerator. The teak-and-holly cabin sole is a nice touch. In 2009, the 2900 SE became the first Maxum model to have Mercury's new Axius sterndrive system with joystick controls. Twin 300hp MerCruiser I/Os cruise at 25 knots (low 30s top). Later models with the 260hp MerCruiser/Axius package reach up to 35 knots.",,5927225457,,30,,Maxum,,2900 se Axius,$59000,power, (Marina Del Rey),2009   Maxum   2900 se Axius Technology Joystick Controller,https://losangeles.craigslist.org/wst/boa/5927225457.html,2009
21,,[],2016-12-20 12:39,"We have a few spots left available for boat storage at the bottom of the hill from San Vicente on a secured private lot. Easy 24/7 access. If you pay for 12 months up front, $75 per space per month with first month free. ($825) Otherwise: $100 per space per month paid in advance quarterly. First month is free so only $200 moves you in instead of $300. Though there is plenty of turnaround space, we would prefer nothing too large. Just let us know what you have. Text, email or call if interested. Mike",,5895010425,,25,,,https://maps.google.com/?q=loc%3A+Moreno+Ave+at+San+Vicente+Reservoir+Lakeside+CA+US,,$75,human, (Lakeside),SAN VICENTE Reservoir Boat Storage FIRST MONTH FREE!!!!!!!!!!!!!!!,https://losangeles.craigslist.org/wst/boa/5895010425.html,
22,like new,"['32.709300', '-114.490500']",2016-12-20 12:36,"WAKEBOARD BOAT SANGER V237LTZ , 2014 TOP OF THE LINE , ORIGINAL OWNER BACK SURGERY ENDS MY WAKEBOARDING ! MY LOSS...YOUR GAIN !! LIKE NEW 76 HOURS ONLY FRESH WATER, ALWAYS GARAGED. TOO MANY OPTIONS TO LIST, INDMAR DTS CAT6.0 L, FULLY LOADED, TOWER, RACKS, LIGHTS, SPEAKERS, CLAIRON WET SOUNDS STEREO, ZERO OFF GPS, LIVORSI, 3 HARD BALAST TANKS. V/M TANDEM AXEL, DETACHABLE TONGUE, DISK BRAKES, CHROME FENDERS, SPARE TIRE. NOT ANOTHER BOAT LIKE IT. CUSTOM GRAPHICS. CLEAR TITLE IN MY NAME PRICED TO SELL FOR CHRISTMAS",76,5927250155,32.709300,23,-114.490500,SANGER,"https://maps.google.com/maps/preview/@32.709300,-114.490500,16z",V23LTZ,$67900,power, (Martinez Lake),WAKEBOARD BOAT   SANGER,https://losangeles.craigslist.org/wst/boa/5927250155.html,2014
23,,"['32.745400', '-117.127200']",2016-12-20 12:32,"Just Like a Deep V Boston Whaler, Designed by the same engineer, Foam Filled center console, Chrysler Hull, Upgraded 150 HP Evinrude, INstalled and serviced by sunset marine 1 year ago. Computer and injection heads replaced on engine Runs GREAT 32 gallon tank. fish finder and gps including tracking, depth, transducer separate oil tank , regular gas in the gas tank Full gauge engine alarms, oil and heat 45 gallon thru hole bait tank, keeps all the bait alive hull is designed by engineer who left chrysler and went to start Boston Whaler. Same boat, foam filled honeycomb fiberglass construction really strong boat. hull has the tri hull shape like a boston whaler deep v boat and rides incredibly smooth in even shorter period large swell foam filled will prevent it from ever sinking 24mph at 3200 rpm 37 mph at 5k really smooth, great boat for up to 40 miles offshore . It has been to san clemente island, coronado islands, rock pile etc. tuna yellowtail and dorado. need to sell because Im moving to east coast make offer but priced to sell",,5918263486,32.745400,21,-117.127200,,"https://maps.google.com/maps/preview/@32.745400,-117.127200,16z",,$7500,power, (San Diego),"21 center console, 150 HP Evinrude, T Top 45 gallon Bait Tank",https://losangeles.craigslist.org/wst/boa/5918263486.html,
24,,"['33.977900', '-118.452500']",2016-12-20 12:23,"I have answered most questions below, so please read the entire ad. Live aboard is not available. The name of the boat is gold mine Slip may be included upon approval at the dock office.  Monthly slip fee is $340 per month. Boat is located at 13575 Mindanao Way, Marina del Rey, CA 90292, dock 2000.  Feel free to come and take a look.  Due to flakers, I am not making any appointments to show the boat.  If you would like to let me know when you are coming that is fine and I will do my best.  If you come and look at it, and then you like it, I will make an appointment. We are not open to taking payments. Good sails. Needs a main an jib halyard and some paint. Thanks. Please email  Mike",,5893652603,33.977900,26,-118.452500,,"https://maps.google.com/maps/preview/@33.977900,-118.452500,16z",,$1999,sail, (Marina Del rey),1969 COLUMBIA 26' SAILBOAT sail boat yacht,https://losangeles.craigslist.org/wst/boa/5893652603.html,1969
25,good,"['33.763594', '-118.178558']",2016-12-20 12:19,"Must sell 30ft marina clipper sail boat. Has a couple sails, fridge, micro, oven. Needs a new out board motor and batteries. I lived on it.  Fast sale for $999.00",,5927226152,33.763594,30,-118.178558,Marina clipper,"https://maps.google.com/maps/preview/@33.763594,-118.178558,16z",,$999,sail, (Shoreline),30ft must sell 2 boat owner,https://losangeles.craigslist.org/lgb/boa/5927226152.html,1979
26,good,"['33.764450', '-118.262157']",2016-12-20 12:07,"Price drastically reduced. Its time for a new owner. Motor Yacht is in good condition, had an Awlgrip facelift a few years ago, is a comfortable flushdeck cruiser and excellent liveaboard, sleeping six comfortably. She could sleep more, but I have had no need to. She holds 1500 gals of diesel 500 gals water , has a water maker, and has cruised extensively in the North West. Her electronics need to be updated, which is relatively inexpensive nowadays and is a prudent personal choice. The engines are twin Detroit 871s, which have been meticulously maintained and start right up and dont smoke. There are three bathrooms with showers, two with Vacuflush, I dont remember the size of the holding tanks, but there are three. If you want a serious cruising Motor Yacht she is well worth your time to inspect and is way under market price for similar cruisers. Please contact me for more info/questions. Clive show contact info",800,5927207758,33.764450,65,-118.262157,Detroit 871v,"https://maps.google.com/maps/preview/@33.764450,-118.262157,16z",Aluminum Cruiser,$149000,power, (wilmington),65 Feet Stephens Flybridge Motoryacht,https://losangeles.craigslist.org/lgb/boa/5927207758.html,1970
27,like new,"['36.241600', '-86.611700']",2016-12-20 11:40,"Twin Yanmar 200 hp diesels, 4 blade props, A/C, 9 KW Diesel Gen. set, beautiful fast shore boat, Washer/dryer, Fruno Navnet and auto pilot, floscan engine monitor, camera monitors, Hydraulic steering,dual pane thermal windows, Jen-air, microwave, refer w/ice maker, Built with Airex foam core construction composite with Vinylester resin. 27,000 lbs and does over 21 mph and draws 2' 6"". Way to much to list here, but I have a ton of pictures and more info and you can contact the builder directly if you are interested in my toy, which I really hate to part with, but at my age, its time. The Cat is now on the Cumberland River in Nashville Tn.   https://www.youtube.com/watch?v=CyNjSZfmo5g&app=desktop",,5916078576,36.241600,53,-86.611700,Pedigree Catamarans Inc.,"https://maps.google.com/maps/preview/@36.241600,-86.611700,16z",PC53,$899000,power, (Tenn.),52' Power Catamaran,https://losangeles.craigslist.org/lgb/boa/5916078576.html,2007
28,,,2016-12-20 11:39,Searching for a boat with live a board permission from dockmaster... must be in the water in a transferable slip. What do you have?,,5891731337,,28,,,,,$20000,sail, (marina del rey),SAILBOAT or POWER BOAT LIVE-A-BOARD,https://losangeles.craigslist.org/wst/boa/5891731337.html,
29,excellent,"['34.236700', '-118.546600']",2016-12-20 11:37,"I have a Super Clean 2001 Sea Doo XP 2 Seater with a new rebuilt 951....Engine was just rebuilt a week ago ..... asking $ 3,100.00 OBO...... Comes with a 2001 trailer This a Carburetor engine super Clean title in Hand.......818-428-96 NINE FIVE",1,5886649345,34.236700,10,-118.546600,Sea Doo,"https://maps.google.com/maps/preview/@34.236700,-118.546600,16z",XP/ 951cc,$3100,power, (Northridge),2001 SeaDoo XP New Engine,https://losangeles.craigslist.org/sfv/boa/5886649345.html,2001
30,excellent,"['34.236700', '-118.546600']",2016-12-20 11:32,"I Have 2- 2015 Sea Doo GTI 130SE They are Super Clean with 24 Hours they are 3 Seaters They come with a 2015 Zieman Trailer Black with the Diamond Package these Skis have the IBR system..They come with New OEM Covers they where just serviced still under warranty ...... Asking $ 16,250.00 OBO... 818-428-969 FIVE... More Pics upon request",24,5900053376,34.236700,12,-118.546600,Sea Doo,"https://maps.google.com/maps/preview/@34.236700,-118.546600,16z",GTI 130SE,$16250,power, (Northridge),2-***2015 Sea Doo GTI 130SE,https://losangeles.craigslist.org/sfv/boa/5900053376.html,2015
31,,,2016-12-20 11:30,SeaSwirl Striper 21 Cuddy Cabin Walk Around The best fishing boat on the market .new marine upholstery and fully service 175 HP outboard motor low hours For Sale contact for more information,,5927150159,,21,,SeaSwirl,,Striper,$15500,power, (pacoima),SeaSwirl Striper 21 Cuddy Cabin  fishing boat ******see*****see***,https://losangeles.craigslist.org/lac/boa/5927150159.html,1998
32,excellent,"['37.661673', '-122.376709']",2016-12-20 11:30,"1973 Formosa 41' Ketch displacement 29,600lbs. $62,500 Or Best Offer Haul out completed: August 2016 -All new thru-hulls and 1/4 turn ball-valves -Zincs -3 coats self polishing bottom paint -Topside sprayed with Awl-Craft Cloud White Epoxy Paint -Masts/Bowsprit and Booms refinished/painted -Teak Decks replaced with fiberglass (except back deck) Separate stand up shower 5 births with new memory foam mattresses -two 75 gallon stainless water tanks -50 gallon stainless diesel tank -10 gallon holding tank (room for much larger) -pressurized water -hot water (from shore power or engine) -Propane 3 burner oven/stove -Wood burning fireplace -All new marine grade tinned electrical wire -Led White/Red Cabin lights -Led Running Lights -Led Foredeck/Steaming light -Beautifully refinished mahogany interior -7 Foot headroom throughout -New Horizon VHF radio -Furuno Color display with world charts -Furuno Radar (24 mile) -Garmin GPS -Furuno Tri-ducer (depth sounder, water temperature, speed through water) -Isuzu diesel engine (fresh water cooled) -New batteries -battery charger -New 55 amp alternator -Self steering wind vane -Electric Windlass -New sail covers -3/4 inch fiberglass hull -Fully encapsulated full-keel Many more features not listed here! This is a huge blue-water cruising sailboat. She is sturdy and comfortable with large amounts of storage space. Would make a great live-aboard. -Seller financing available for the right buyers. -Will move the boat to any location in the greater sf bay area. Contact Tyler @ show contact info",,5895317095,37.661673,50,-122.376709,Formosa,"https://maps.google.com/maps/preview/@37.661673,-122.376709,16z",Sea Tiger,$62500,sail, (South san francisco),1973 Formosa 41' Ketch Sail Boat(OBO),https://losangeles.craigslist.org/lgb/boa/5895317095.html,1973
33,,"['34.176700', '-118.615900']",2016-12-20 11:30,These jet skis dont work because they were involved in an accident one of them looks like a very easy fix and both have compressions and engine and everything any questions call or text show contact info,,5923584113,34.176700,1,-118.615900,,"https://maps.google.com/maps/preview/@34.176700,-118.615900,16z",,$1900,power,,Two JET SKI AND TRAILER,https://losangeles.craigslist.org/sfv/boa/5923584113.html,
