,condition,coord_pair,date,description,engine hours (total),id,lat,length overall (LOA),long,make / manufacturer,map_URL,model name / number,price,propulsion type,region,title,url,year manufactured
60,,"['33.823000', '-118.268400']",2016-12-20 09:55,Nice boat just needs to be put together. New motor and outdrive show contact info,,5911809772,33.823000,19,-118.268400,,"https://maps.google.com/maps/preview/@33.823000,-118.268400,16z",,$1600,power,,19 ft bayliner,https://losangeles.craigslist.org/wst/boa/5911809772.html,
61,,,2016-12-20 09:54,"Center Console T- Top Boat Cover brand new. $150 cash on local pick up NO BS. If this ad is up, still available. Contact via email. keywords; Mercury, Evinrude, Johnson, Yamaha, Suzuki, Tohatsu, Honda, 9.9hp,15hp,25hp,30hp,50hp,2 stroke, 4 stroke, efi, caburetor, ourboard, zodiac, achilles,avon,inflatable,boston whaler,mako,grady white,bayliner,parker,center console,fishing boat,diving,spearfishing,skip,bayrunner,13', 14', 15' ,20', 22', 24', 25', Triton, Sea Pro, Parker, Seaswirl, center console,",,5926992065,,1,,,,,$120,sail, (Redondo Beach),Center Console T- Top Boat Cover brand new,https://losangeles.craigslist.org/wst/boa/5926992065.html,
62,good,"['34.757016', '-114.386096']",2016-12-20 09:53,"1990 Ski Centurion Tru Track III Centurion boats are relentlessly innovated World Championship water sports vessels of dominant performance, ambitious design and inspired craftsmanship. Those with an ambition to really Water Ski.. This is your type of boat. It is also a blast to wake board behind, tube behind, barefoot or just take on a Sunday stroll. . . PCM 351 (Ford Windsor) with New High Output GT40 heads, (recent rebuild) 4 Barrel Holly Carburetor, Velvet direct drive with two props available. (3 and 4 blade) New Pertronix electronic ignition conversion. Ski Pylon, Full instrumentation, Bimini top,  AM/FM Satellite radio, beautiful teak swim deck and hood scoop. 3 New tires on matching single axle trailer with all new LED lights. (pull with small SUV) Full boat cover (trailer-able) Boat is in very good shape for being 26 years old (around 400 total hours) It is very frugal on fuel and real dependable. We do not need help selling this boat. We are looking for to step into something larger. Our grandchildren are getting too big  Boat is in AZ but I can meet in Valencia",400,5926990521,34.757016,21,-114.386096,Ski Centurion,"https://maps.google.com/maps/preview/@34.757016,-114.386096,16z",Tru Trak,$7700,power, (Havasu),"Ski Centurion, World Class Ski Boat",https://losangeles.craigslist.org/sfv/boa/5926990521.html,1990
63,excellent,"['34.461758', '-114.288669']",2016-12-20 09:49,"2000 DCB Mach 26, Open Bow, Twin 2.5 Mercury outboards 280 hp each, Big Stereo (4-6x9's, 4-6"", 2-12"" subs, 2 amps, alpine deck), dual batteries w/switch, full cover, tandem axle trailer, Great condition. $62,000 call or text Dan @ show contact info No emails, No scammers. Located in Lake Havasu City. Possibly trade for Magic/Conquest deck boat or similar",20,5899393620,34.461758,26,-114.288669,DCB,"https://maps.google.com/maps/preview/@34.461758,-114.288669,16z",Mach 26,$62000,power, (Lake Havasu City),"DCB Mach 26 Open Bow, Twin 2.5 Merc's",https://losangeles.craigslist.org/sfv/boa/5899393620.html,2000
64,excellent,"['34.489100', '-117.970800']",2016-12-20 09:42,"I have 1978 24 foot walk around cuddy cabin for sale, running and current tags. Last trip was in September to Catalina Island. Outboard engine ( 250 mercury ) runs like a champ. Bait tank, Holsters for fishing rods, T-top with rockets launchers holsters. fish finder and radio as well Asking 3,000 OBO call show contact info or show contact info ask for nelson thank you.",,5926972153,34.489100,24,-117.970800,wellcraft,"https://maps.google.com/maps/preview/@34.489100,-117.970800,16z",Airsult,$3000,power,,1978 well craft walk around cuddy cabin,https://losangeles.craigslist.org/ant/boa/5926972153.html,
65,,,2016-12-20 09:38,"Exellent condition 2002 Zodiac F470 Navy Seals inflatable boat with a Evinrude military E-Tec 40hp high torque outboard motor and a custom built Aluminum Trailer with Cargo Rack. This Zodiac F470 Navy Seals inflatable boat is 4.7 meter long(15.5 feet), 2006 model and is like new, in excellent condition. It comes with two sets of floor systems that 4 pcs Zodiac Aluminum Hard-Deck Floor and brand new Zodiac F470 Roll-Up Floor. This Military Evinrude E-Tec 40hp is 2010 model, has only 104 hours of used, high torque outboard motor that generates about 50 hp and is in excellent running condition. The motor starts every first or second pull and purrs and has been serviced by E-Tec technician. This custom built Aluminum trailer has a built-in removable Cargo Rack that can carries Boating/Diving/Fishing/Camping equipment. The trailer also has large Galvanized wheels/tires and has a spare tire. F470 is rated for single 40HP to 60 HP or twin 30hp outboards depends on the application and it has 10 persons capacity. Pink Slips on both F470 and trailer. The Mercury 25hp outboard on the pictures is not included so, please don't ask. The cost of these equipment is well over $30,000 new. This is rare opportunity to get a complete late model special ops set-up like this. If you see this ad, it's available. $10,000 cash or trade for equal value Harley Heritage Softtail. Lowballers, tirekickers, morons will be ignored. Do not contact if you are not ready to buy and pick it up. Contact via email with your name and number. Emails without name and number will be deleted. key words: inflatable, boat, Zodiac, F470, F530, Wings, Avon, Achilles, military, evinrude, yamaha, johnson, suzuki, tohatsu, mercury, navy seals, special force, sog, navy,fishing, expedition, outboard, scuba, diving, speargun, spearfishing, snorkel.",,5926935361,,16,,,,,$10000,power, (Hermosa Beach),"2002 Zodiac F470, Military E-Tec 40hp, Aluminum Trailer, for trade",https://losangeles.craigslist.org/wst/boa/5926935361.html,
66,,,2016-12-20 09:37,"Hello, I'm taking a survey on which colors people like better of this boat. Let me know if you like Blue or White.  Thanks.",,5926964125,,80,,,,,,power,,Blue boat or White boat,https://losangeles.craigslist.org/lac/boa/5926964125.html,
67,good,"['33.977900', '-118.452500']",2016-12-20 09:36,Raytheon Electronics Pathfinder radar Dome 2kw with cable Original  long cable solid uncut Serial number 0400258 $50,,5902929832,33.977900,10,-118.452500,,"https://maps.google.com/maps/preview/@33.977900,-118.452500,16z",,$50,human, (marina del rey),now now $$$50$$$ Raytheon Electronics,https://losangeles.craigslist.org/wst/boa/5902929832.html,
68,good,"['33.977900', '-118.452500']",2016-12-20 09:35,"32 Bayliner 1986 Sun Bridge Ready to live but needs motor TLC PROJECT BOAT !! This 1986 cruiser with classic good looks is the perfect live aboard / office / family cruiser that you will find. Sporty Profile and Accommodating Mid-Cabin Layout So I'm trying to find her a new home, someone who can appreciate this boat. Superstructure is Great !!!! And motors need tlc Great boat to sit and relax in the slip and enjoy the world This Bayliner is vey clean and well maintained with everything in working order in the inside The salon is a spacious living area that is standup thought the boat. roomy interior with the Best headroom The galley is very workable, large stainless steel sink and lots of storage. 110V fridge. Large head. and a private aft cabin, and v-berth with solid privacy door Outside has a boat arch with elevated cockpit that accommodates a pilot seat with a half around bench seat. And to the back an other aft deck with bench seat and storage. This is like  having an other room, on the boat Swim Platform The engine need some help Dose not work !!!!! 2 Volvo penta 350 chev Sold as is Not running And my mechanic says them will run tlc No trailer This boat is located in Marina Del Rey And is a lot of boat for the money for some one that can appreciate her!! And give her the tlc that she needs. Come have a look, in the water, Marina Del Rey Slip Transferable (upon qualification) or Just take the boat away to another marina Priced to sell now $3800 This boat is a handmans dream with some TLC and a repower",,5918623289,33.977900,14,-118.452500,,"https://maps.google.com/maps/preview/@33.977900,-118.452500,16z",,,human,,32 Bayliner 1986 Sun Bridge Ready to live but needs motor TLC  PROJECT,https://losangeles.craigslist.org/wst/boa/5918623289.html,
69,excellent,"['33.977900', '-118.452500']",2016-12-20 09:35,"Outboard,DockSteps,Inflatables Trans and more new stuff. 4Sale or Barter Please Email for any photos you would like to see! MAX PROP AUTOMATIC FEATHERING PROPELLER IN LIKE NEW CONDITION 31"" DIAMETER PROPELLER FOR 2"" SHAFT COSTS $8,600, SAVE AT LEAST $2,600 Under sail the MAX PROP will increase sailing speed by about 15% and provides 80% greater reverse power than a comparable fixed blade propeller. MAX PROP uses a ""differential"" type design so all blades open in unison in forward or reverse. The extraordinary reliability of MAX PROP has made it the overwhelming choice of long range cruisers Asking $4200 and a good OFFER! 6'.5"" Inflatable Very Small Like NEW! In Bag & Ready Baltik The most compact and rigid dingy ever made! Stored out of the SUN. Like new shape Holds air and Water GREAT!!! Baltik inflatable made of PVC 5-layer Thick Two main air chambers Aluminum Inside and Outside motor pads for better transom protection. high pressure Air Deck Floor. Set of oars. And comes with sun and rain cover! And Storage bag. $1000! Flame Arrester for a Marine 4 Barrel Carb Coast Guard approved fame arrester for 4 barrel Carb Good condition $35 VINTAGE ANTIQUE BENSON'S BOAT ANCHOR 12 POUNDS 18 x 18"" Galvanized boat Anchor Painted white From 1958 SYRACUSE NY IN VERY GOOD CONDITION 18"" high 18"" wide RARE VINTAGE FIND Asking $150 OMC All New . . . Hour Meters 2 OMC Hour meters. . ..$20 Dock Step Polyethylene 1 step Make climbing aboard easier! 16x11 Durable, UV-resistant, white polyethylene steps Washable surface cleans easily with soap and water. With storage space inside Just needs a cleaning $75 WINCHS Maxwell 22 two speed self tailing winches WINCHS Maxwell 22 two speed self tailing winches matching pair In great working condition work like new comparable to the lewmar 44 They came off a 30' footer 800.00 asking easy install Raytheon Electronics Pathfinder radar Dome 2kw with cable Original  long cable solid uncut Serial number 0400258 $50 Borg Warner Transmission Velvet drive 72C Velvet drive marine transmission never used It is a 1:1 ratio Model number ASI-71C Frim at $1000 Sail 4sale used twice 9ft 6 foot Host 27 3 Made for J 24 but will fit a 27 standard rig like new only used twice Asking $100 Novurania MX400 RIB rigid inflatable with 40 HP Yamaha 1993 14 feet RIB inflatable Motor starts and runs fine Boat needs some TLC Boat has very small micro air leeks . . . very fixable!!! Holds air ok Boat needs new battery Boat needs fuel line  Molded-in Fiberglass Console with Steering System  Lifting Eyes heavy duty (2 Point Lift system)  Underdeck Fuel Tank with 8 gallon Capacity  Molded-in helm seat with cushioned backrest and storage space  Fabric Type: Hypalon Bow Storage Compartment / Anchor Locker  Capacity: (6) Persons  Separate Air Chambers: (3)  Automatic Bilge Pump  Heavy-Duty, Double Rub Strake  Courtesy Deck Lights Motor starts and runs great!!! Need to sell NO TRAILER !!! Will drop off to launch ramp in mdr Asking $3800 open to offers now NOW stainless steel dodger.... 120 inches by 50 inches one inch tubing can be modified to fit custom scheme... $200",,5891050011,33.977900,10,-118.452500,,"https://maps.google.com/maps/preview/@33.977900,-118.452500,16z",,$100,human, (marina del rey),"new   Outboard,DockSteps,Inflatables Trans more 4Sale or Barter Please",https://losangeles.craigslist.org/wst/boa/5891050011.html,
70,excellent,"['33.977900', '-118.452500']",2016-12-20 09:35,Volvo md7a 2cyl 16hp Complete ready to install Working panel plug in and go 2 cyl diesel runs great. Perfect for 27-36ft boat Will run for you $2500,,5921277489,33.977900,10,-118.452500,,"https://maps.google.com/maps/preview/@33.977900,-118.452500,16z",,,human,,Volvo md7a 2cyl 16hp Complete ready to install  Working panel plug in,https://losangeles.craigslist.org/wst/boa/5921277489.html,
71,,,2016-12-20 09:32,"Zodiac Futura H2P High Pressure Floor for 12' Inflatable boat in excellent condition, no stain nor discoloration Size: 94"" long x 31"" wide when fully inflated. $300 cash on local pick up. If you see this ad, it's still available. Do not contact if you are not ready to pick it up. Contact via email with your NAME and NUMBER. Any emails without NAME and NUMBER will be deleted. key words: inflatable boat, Zodiac, Avon, Achilles, Mercury, military, outboard, scuba, diving, speargun, spearfishing, snorkel. tactical, fishing, special ops, boat, fishing.",,5926956078,,1,,,,,$200,human, (Redondo Beach),Zodiac Futura H2P high pressure Floor for 12' Inflatable boat,https://losangeles.craigslist.org/wst/boa/5926956078.html,
72,,[],2016-12-20 09:28,1981 Aluminum fishing boat    1550            OBO or trade for small truck. Excellent condition. Comes with trailer and fish finder. 14 feet. Motor like new. Ready to go fishing.   Este varco  estalisto para ir a pescar o pasear  esta en perfertas con disiones placas  asta 2017 olo cambio por una troca o  carro  este  es mi numero  310 963 75 69,,5918421393,,14,,,https://maps.google.com/?q=loc%3A+%31%35%37%31%34+S+Frailey+Ave+Compton+CA+US,,$1550,power, (Compton),1981 Aluminum fishing boat    or trade,https://losangeles.craigslist.org/lgb/boa/5918421393.html,
73,,"['33.213100', '-117.224300']",2016-12-20 09:27,"1991 Bayliner 2556 command Bridge, $10,700 boat only. 454 Chevy MerCruiser. Closed Cooling motor has been rebuilt 2 or 3 hours on it. Interior was redone three years ago. No trailer, no trailer, no trailer, the one it's it's on is not mine. It belongs to a friend of mine who will sell it with the boat or after the boat sells. Price with the trailer is $13,700 or without the trailer $10,700. I put 6 new tires on the trailer when I borrowed it from her. Boat has new manifold risers Bellows gimbal bearings and so on. What is located in Vista California $10,700 boat only.",,5926946659,33.213100,26,-117.224300,,"https://maps.google.com/maps/preview/@33.213100,-117.224300,16z",,$10700,power, (Vista CA),1991 2556 Bayliner command Bridge 454 MerCruiser,https://losangeles.craigslist.org/lgb/boa/5926946659.html,
74,,"['34.229960', '-118.536165']",2016-12-20 09:27,1992 Correct boat 19'  with 06 pacific trailer  custom deck speakers and satelite radio excellent condition reg up to date clean title show contact info,,5926946512,34.229960,19,-118.536165,Correct,"https://maps.google.com/maps/preview/@34.229960,-118.536165,16z",,$6500,power, (Northridge),1992 Correct boat 19'  with 06 pacific trailer  custom deck speakers and radio s,https://losangeles.craigslist.org/sfv/boa/5926946512.html,1992
75,,"['33.977900', '-118.452500']",2016-12-20 09:26,I am looking for a Boat Captain for my charters. You need to handle a 55ft Irwin sailboat. Only local trips. Minimum $250 for 5 hours. Must have sailing experience. Mostly Saturdays and Sundays. www.charters2000.com,,5911353054,33.977900,55,-118.452500,,"https://maps.google.com/maps/preview/@33.977900,-118.452500,16z",,$250,sail, (Marina del Rey),BOAT CAPTAIN NEEDED,https://losangeles.craigslist.org/wst/boa/5911353054.html,
76,,,2016-12-20 09:26,"www.charters2000.com CELEBRATE A BIRTHDAY OR JUST HAVE A GREAT TIME WITH A GROUP OF FRIENDS OF FAMILY Prices are for the whole group so it becomes very affordable. 1-ONE DAY CHARTER TO MALIBU OR PALOS VERDES. 2-THREE DAYS TO CATALINA ISLAND. 3- FIVE DAYS TO CATALINA ISLAND. 4-SUNSET CRUISE. http://www.charters2000.com Go snorkelling, kayaking, swimming or relax on your Yacht. USCG Captain with over 20 years experience. Three bedrooms, three bathrooms, fantastic yacht. $595 per day $1975 3 days weekend to Catalina $2375 5 days to Catalina $475 Sunset cruise, Monday through Thursday PLEASE VISIT OUR WEBSITE AND CHECK THE VIDEOS AND PICTURES www.charters2000.com There is no better deal! Other charters and cruises available.",,5911346308,,55,,Irwin,,55,$475,sail, (MARINA DEL REY),CHARTER 54 FT SAIL BOAT WITH CAPTAIN TO CATALINA ISLAND MALIBU cruise,https://losangeles.craigslist.org/wst/boa/5911346308.html,
77,,"['33.810600', '-118.350700']",2016-12-20 09:24,"I have 1991 Achilles center console, NOT a hard bottom. Inflateable keel good shape. No leaks what so ever. 50 HP Yamaha 2 stroke, starts and runs but need gasket kit for one of the carbs- it leaks. Probably should get new impeller too. Comes with trailer.",,5926942596,33.810600,16,-118.350700,Achilles,"https://maps.google.com/maps/preview/@33.810600,-118.350700,16z",,$1500,power,,1991 Achilles 16' inflateable,https://losangeles.craigslist.org/wst/boa/5926942596.html,1991
78,,"['39.338500', '-120.172900']",2016-12-20 09:20,"PreWar Garwood 20' double cockpit with trailer After some seeing the pics, they have decided it is not a Garwood due to the construction of the bottom. A quick rundown on this. The boat itself is in good condition.  The previous owner took a few planks off to start the bottom many many years ago and had since lost a couple of them. The hardware is in great shape and does not need replating. The upholstery is in great shape as well. The engine is a very rare Lincoln Zephyr V12. It will need to be rebuilt. I will sell boat without if needed, but it should go with The boat is titled as a 1939. I cannot find the Garwood stamp on the boat, however it is an almost 80 years old boat. Wood could have been replaced along the way. That being said, I cannot guarantee that it is a Garwood even though the hardware is correct and looks exactly like a 39 Gar. $8000 for everything Email me for more info and pics Chris Craft hacker wood wooden gar wood riva",,5926899748,39.338500,20,-120.172900,,"https://maps.google.com/maps/preview/@39.338500,-120.172900,16z",,$7500,power, (Truckee),"1939 Prewar Garwood ""tribute boat"" with trailer",https://losangeles.craigslist.org/lgb/boa/5926899748.html,1939
79,,,2016-12-20 09:15,"Four Winns open bow ski boat with AirBoom Tower and racks. Stereo CD /Aux, stainless steel prop and custom cover as well as bimini top.New tires on trailer ,new battery and tag good through 6/2017 including mussel tag for local lakes.Please call or text only show contact info",,5917495031,,19,,Four Winns,,190 Horizon,$7500,power, (La Crescenta /Glendale),1994 Four Winns 190 Horizon open bow wakeboard tower,https://losangeles.craigslist.org/sgv/boa/5917495031.html,1994
80,like new,"['34.081800', '-118.175300']",2016-12-20 09:14,"Ocean Kayak 12-Ft... Like New!!! Only been used a hand full of times. Includes seat, padle, and water proof bag. Actual value is over $650 I am asking $320 Or Best Offer! No trades. Cash only. Must pick up! I am 10 minutes driving distance of Dodger Stadium. If interested please contact Jay at show contact info",,5926924912,34.081800,12,-118.175300,,"https://maps.google.com/maps/preview/@34.081800,-118.175300,16z",,$320,human, (El Sereno),Ocean Kayak 12-Ft... Like New!,https://losangeles.craigslist.org/lac/boa/5926924912.html,
81,,"['33.887300', '-117.894600']",2016-12-20 09:13,Attention Boat owners Protect  your investment. Now in the rain season. Some steps you can do to make  sure rain won't damage your boat. 1.Make sure that the drain plug is removed  and check for any debris in the bilge  area won't  stop  water from running out of boat true the drain hole. 2. Lift the trailer as high  as possible  from the front  it will  drain  water  much  isier. 3. Cover your boat  . Hope  you have a boat cover. Sumbrella material preferred. Do this and your boat will be safe from the damage  that rain  water can couse. Check  your insurance  policy  to make sure it covers rain  water  damage. And if you need help  with a cover or have any  questions  hope  we can help  if you give us  a chance. We are a boat shop  that works  in all areas of the boat and we make custom  boat  covers . And we have a mobile  services. So we can come to.you that  way  you don't  have to. Tow  you boat anywhere. Thank you very much  for reading  and be safe. You can call to show contact info Www a1mareneservices.com,,5906840319,33.887300,21,-117.894600,,"https://maps.google.com/maps/preview/@33.887300,-117.894600,16z",,,power,,HAVE A COVER MADE AND PROTECT YOUR INVESTMENT.,https://losangeles.craigslist.org/lgb/boa/5906840319.html,
82,,"['33.887300', '-117.894600']",2016-12-20 09:11,If you need  a boat cover to protect your investment  . We can make you. One . Or if you just  need to repair  your  old  one we can do it. Our covers come with 3 years  warranty on the stitching  and 5 years in fabric  . It will take 3 days  to fabricate and we need  the boat  in our  shop. Thank  you  and have a bless day. show contact info Www.a1marineservices.com,,5901682738,33.887300,18,-117.894600,,"https://maps.google.com/maps/preview/@33.887300,-117.894600,16z",,,power,,Boat cover,https://losangeles.craigslist.org/wst/boa/5901682738.html,
83,new,"['33.887300', '-117.894600']",2016-12-20 09:11,"COMPLEAT BOAT INTERIORS AND WOOD WORK FABRICATION AND CUSTOM DESING. 20 YEARS OF EXPIRIENCE TOP OF THE LINE MATERI PRODUCTION WELCOME THIS ARE SOME PICTURES OF SOME HIGT END BOATS THAT WE WORK . commanders,esex,eliminators,force,cobras,avantages,we work in all the mayor brands and a lots of ski boats. . THANKS AND GOD BLESS YOU show contact info 1301 E. ORANGETHORPE FULLERTON CA 92831 WWW.a1marineservices.com",,5897660384,33.887300,19,-117.894600,,"https://maps.google.com/maps/preview/@33.887300,-117.894600,16z",,,power,,BOAT INTERIORS,https://losangeles.craigslist.org/lgb/boa/5897660384.html,
84,like new,"['33.864300', '-118.395500']",2016-12-20 09:03,"Revere Offshore Ocean Life Raft with 8-person capacity.  Manufactured in 2005.  Never used.  Stored in cool, dry garage when not on the boat.  Needs updated inspection.  Last serviced in 2010.",,5908848417,33.864300,8,-118.395500,Revere,"https://maps.google.com/maps/preview/@33.864300,-118.395500,16z",Offshore Ocean,$1500,human, (Hermosa Beach),Revere Offshore Ocean Life Raft,https://losangeles.craigslist.org/wst/boa/5908848417.html,2005
85,excellent,"['34.182200', '-119.216000']",2016-12-20 09:03,"!!! ULTIMATE FISHING MACHINE !!! 2005 Pursuit 2670 Center Console Dual Yamaha 225HP Please call Bill for details 818 261-3zero9four Clean Title on hand Pursuit got it right with the 2670 Center Console, a rock-solid fishing machine from one of the country's top builders of offshore center consoles. Offered in open-bow or cuddy configurations, the 2670 is a good-looking fishboat with a large cockpit and an impressive array of high-end features. Her well-designed helm offers a wealth of digital information arranged for maximum visibility, and the standard leaning post includes a four-rod rocket launcher, tackle trays, and stowage. The 2670's factory T-top comes with a lifejacket storage area sewn into the underside, and a wraparound acrylic windshield protects the helm. Note that the sub-console compartment does not contain a head. In cuddy models, the cabin contains a double berth, marine head, storage, and rod racks. Aft, the transom has a deep 49-gallon livewell and bait prep station in addition to bilge access. There's a large fishbox in the floor, and rod storage under each of the padded gunnels. Built on a traditional deep-V hull with a wide 9-foot, 3-inch beam, the 2670 tracks well and handles rough water with confidence. Expect a top speed of close to 45+ knots with twin 225hp Yamaha outboards. Length w/Pulpit.................. 28'5"" Hull Length ........................ 26'5"" Beam.................................... 9'3"" Hull Draft.............................. 1'8"" Dry Weight...................... 5,800 Fuel ..............................188 gals. Water .............................18 gals. Max HP ................................ 450 Hull Type .........................Deep-V Deadrise Aft ..........................21 Please call Bill for details 818 261-3zero9four Clean Title on hand",770,5903100087,34.182200,28,-119.216000,Pursuit,"https://maps.google.com/maps/preview/@34.182200,-119.216000,16z",2670,$49995,power," (Oxnard, CA)",!!! ULTIMATE FISHING MACHINE !!! 2005 Pursuit 2670 CC Dual Yamaha 225,https://losangeles.craigslist.org/sfv/boa/5903100087.html,2005
86,new,"['34.684700', '-118.544200']",2016-12-20 08:57,Ignition key switch for johnson or Evinrude boats brand new never used or hooked up or tryout. show contact info Joe.,,5890172959,34.684700,2,-118.544200,,"https://maps.google.com/maps/preview/@34.684700,-118.544200,16z",,$20,power, (Elizabeth Lake),ignition key switch/By Palmdale,https://losangeles.craigslist.org/ant/boa/5890172959.html,
