,condition,coord_pair,date,description,engine hours (total),id,lat,length overall (LOA),long,make / manufacturer,map_URL,model name / number,price,propulsion type,region,title,url,year manufactured
93,,,2016-11-19 04:55,For sale is a small plywood sailboat Handmade and donated to the maritime museum. Perfect for around the bay Trailer not included,,5883395080,,15,,,,,$500,sail,,Small green sail boat,https://humboldt.craigslist.org/boa/5883395080.html,
94,,,2016-11-18 13:44,I am looking for a trailer for my wave runner.,,5849752973,,14,,,,,,power,,Wave Runner Jet Ski Trailer Wanted,https://humboldt.craigslist.org/boa/5849752973.html,
95,good,"['40.571184', '-124.126625']",2016-11-18 08:50,"If you are interested PLEASE CALL ME on the phone ok, Thanks. Hi my name is Mikey and I am selling a 17' Corsain. Works great, I have two boats and no longer have use for it. The big motor is a (1988) 90HP Evinrude and the small one is a 9.9HP Johnson with Co-Pilot steerting. Both work great. Very stable and lot's of fun. If add is still up it is still for sale. Thanks. CALL ME Mikey @ (707) 725-95o8 (NO 215 PLEASE) Hope to hear from you soon...",,5882215503,40.571184,17,-124.126625,Corsain,"https://maps.google.com/maps/preview/@40.571184,-124.126625,16z",,$2500,power, (Fortuna),1964 Corsain 17',https://humboldt.craigslist.org/boa/5882215503.html,1964
96,,"['40.874200', '-124.076500']",2016-11-18 08:26,"Just in time for Crab season! 4.3 liter V6 Blue Water boat. Cuddy  cabin to get out of the weather! New jack, wheel bearings and tires! runs great. Good on gas.",,5855622282,40.874200,19,-124.076500,,"https://maps.google.com/maps/preview/@40.874200,-124.076500,16z",,$2700,power, (Arcata),Blue Water 19 ft cuddy cabin,https://humboldt.craigslist.org/boa/5855622282.html,
97,,"['43.354877', '-124.146166']",2016-11-18 01:00,"Looking for both frozen and live boats to harvest Hag-Fish.  We are located in Charleston, OR and can now hold 100 thousand lbs of live and 100 thousand lbs frozen.  We are willing to travel to ports in OR, WA and California if we are able to unload 10 thousand lbs per delivery.  This could be a combination of smaller boats or one large boat.  We could currently handle about 5 smaller boats or 2 large producers on live.  On Frozen we could handle any amount.  Payment is weekly not monthly. We are willing to the right party to help setup gear and catch methods.  Please give us a call at show contact info or show contact info",,5881774755,43.354877,50,-124.146166,,"https://maps.google.com/maps/preview/@43.354877,-124.146166,16z",,,power,,Looking for both frozen and live boats to harvest Hag-Fish.,https://humboldt.craigslist.org/boa/5881774755.html,
98,excellent,"['41.781700', '-124.133200']",2016-11-17 21:26,Skull boat for sale,,5881704161,41.781700,14,-124.133200,,"https://maps.google.com/maps/preview/@41.781700,-124.133200,16z",,$1000,human, (Crescent City),Boat,https://humboldt.craigslist.org/boa/5881704161.html,
99,excellent,,2016-11-17 09:43,"Very Nice condition fiberglass Impex Currituck kayak. 17 foot 3 inch in length and 21 and a 1/2 inch wide. Weighs approximately 55lbs. Skeg Custom closed cell hand formed foam seat, Very comfortable for those long crossings. Stock fiberglass seat also comes with it. Deck Compass installed. This is a great kayak to trip out of . The large hatches make packing for a week long trip easy. Life Jackets Paddles etc. also available to interested persons as a separate transaction.",,5880808987,,17,,Impex,,Currituck,$1500,human," (Crescent City, Ca)",Impex Currituck,https://humboldt.craigslist.org/boa/5880808987.html,
