,condition,coord_pair,date,description,engine hours (total),id,lat,length overall (LOA),long,make / manufacturer,map_URL,model name / number,price,propulsion type,region,title,url,year manufactured
36,excellent,"['29.254638', '-81.041997']",2016-12-19 10:05,"Low Low Hrs. 135 Mercruiser (3.0L) AM/FM Stereo Trailer has swing tongue for Garage storage. 6 life jackets, anchor,lines, throw cushion, hook pole and paddle, boat cover. trailer straps & life jacket for your medium size dog. Seven people (capacity)",,5895725510,29.254638,17,-81.041997,BAYLINER,"https://maps.google.com/maps/preview/@29.254638,-81.041997,16z",175,$7200,power, (Holly Hill),07 BAYLINER 175,https://staugustine.craigslist.org/boa/5895725510.html,2007
37,excellent,"['27.241047', '-80.296154']",2016-12-19 09:27,"70 HP 4 stroke motor, fishing seats, live well, changing room, safety equipment, life vests, Bimini top, Snap on cover, radio with cd---kept on a lift-only in the water when being used-fenders-new battery-Great boat---$19,900",285,5925269582,27.241047,20,-80.296154,Bennington,"https://maps.google.com/maps/preview/@27.241047,-80.296154,16z",Pontoon,$19900,power, (port st lucie),2013 20 Ft. Bennington Saltwater Series pontoon Boat,https://staugustine.craigslist.org/boa/5925269582.html,2013
38,good,"['29.500200', '-81.591500']",2016-12-19 09:27,trying to make Christmas happen here,,5910734886,29.500200,14,-81.591500,Princess,"https://maps.google.com/maps/preview/@29.500200,-81.591500,16z",14' vhull,$400,human, (Putnam),14' vhull trailer and trolling motor,https://staugustine.craigslist.org/boa/5910734886.html,
39,excellent,"['32.699633', '-80.003986']",2016-12-19 09:20,"2006 48 BD Exp Fisherman is ideal for fishing and cruising the the waters of SE Atlantic.  Loaded with up to date electronics, climate controlled flybridge and a nice interior. All trades considered as partial payment. Hurry, price is just reduced from $750,000",1250,5925279318,32.699633,48,-80.003986,Buddy Davis,"https://maps.google.com/maps/preview/@32.699633,-80.003986,16z",Exp Fisherman,$675000,power," (Charleston, SC)",2006 48 Buddy Davis Express Fisherman,https://staugustine.craigslist.org/boa/5925279318.html,2006
40,excellent,[],2016-12-19 08:30,"I have a beautiful 36 foot 333 Mako attack for sale.Everything on this boat has been updated.New cushions inside the cabin and on the deck.Auto retract trim tabs,Every cable fuel or water line batteries,pumps oil tanks and everything else is new.Killer Fusion stereo and touch screen fish finder/gps also new.This boat belonged to the Marina owner until I bought it 3 months(He re did the entire boat) ago and is in perfect condition.The power heads (250EFIs) are still under warranty and both lower units are new.If you want a big boat for a small price with many years of trouble free use this is it.Bottom paint was applied new in August before a trip over to the Bahama's. Since it was finished it has been to the Bahama's once ,to the sand bar 3 times and out for the air show.Although there is no hour meter based on use the motors have less than 50 hours since finished.(probably closer to 30).10 1/2 foot beam makes for a great fishing platform.Heavy and safe boat.Cruise at 25 MPH at 3800 rpms and will top out WOT 33 MPH.Huge fiberglass top,Led lights,extended stern canvas and much much more.Barn kept at in and out storage unit in Palm City Florida,which would be available for rent if bought local,at a fantastic marina with Stuller service and a very fair price.Fiberglass shines like new. I really hate to sell it ,but Bad back and knees are stopping me from using her and since I have decided to have many up coming surgeries to fix the knees and back,I can't just see letting her sit.. This is the best deal out there without a doubt.Buy a yacht for the price of a run about!",50,5917381595,,36,,Mako,https://maps.google.com/?q=loc%3A+Mapp+Road+Palm+City+FL+US,333 Attack,$40000,power, (Palm City),333 Mako Attack,https://staugustine.craigslist.org/boa/5917381595.html,1997
41,,"['32.207700', '-80.747600']",2016-12-19 07:16,"1967 31 Bertram Sportfish. Updated in 2007 (rewired, repainted, new outriggers and top). Dayboat layout. Freshly rebuilt (2015/2016) 3208N Caterpillar diesels (500 Hours Stbd / 300 Hours Port after rebuild). 3208N's are very reliable and efficient and are known to make 10,000+ hours of service. That's a lifetime of fishing with proper maintenance and care. Almost every component on these motors have been replaced and they run great. No smoke on start up. All electronics, eisenglass, and 8D Batteries were new in 2015. Honest 18 Knot cruise at 2000 RPMS. 20 knots at 2200rpms. 26 knots at WOT. Needs nothing to fish or cruise today. Crank it up and take it wherever you want. Needs some awlgrip to pretty it up after being fished hard for the past two years. This is not a show boat, but has not sat idle for years and is mechanically very strong.  I don't know about you, but I'd rather be out there and need paint than tied to the dock needing engine work.  Give me a call with any questions. Serious inquiries please. If you don't have the cash don't waste my time.",,5909007822,32.207700,31,-80.747600,Bertram,"https://maps.google.com/maps/preview/@32.207700,-80.747600,16z",31,$25000,power," (Hilton Head, SC)",1967 31 Bertram (Diesel Power),https://staugustine.craigslist.org/boa/5909007822.html,
42,like new,"['30.154800', '-81.630000']",2016-12-19 07:01,"~2016 TIDEWATER 1910 BAYMAX/4 STROKE MERCURY 150 XL/2016 TRAILER $$$ 29,000.00 Serious inquiries only call show contact info SPECIFICATIONS Color:: White Centerline :: 19' 2"" Beam :: 96"" Weight :: 1850 lbs. Fuel Capacity :: 56 gal. Max HP :: 150 HP Rec. HP :: 115 HP Transom Height :: 25"" Deadrise at Transom :: 15° Appox. Draft :: 10"" Cockpit Depth :: 19.5"" STANDARD FEATURES: No Wood Construction 10-year Transferable Hull Warranty Hand-Laid Fiberglass Hull Foam Flotation Fiberglass Stringer System Self-Bailing Cock Pit Automatic Bilge Pump Aluminum Backing Plates Navigational Lighting Horn Pull up cleats Gunwale rod storage Flip Flop cooler seat Baystar Hydraulic Steering (2) aerated livewells Trolling Motor Plug Driftwood tan interior OPTIONS WE ADDED ON: **150 HP MERCURY** Dual Battery Switch Bimini top GARMIN echoMap 70/90 Series Navagation system Interior LED Package Blue LED Underwater lights 13 Extra Rod Holders Tilt steering Compass Swim Platform with ladder Raw water wash down Fuel water separator",,5907508630,30.154800,19,-81.630000,,"https://maps.google.com/maps/preview/@30.154800,-81.630000,16z",,,power,,19' CENTER CONSOLE WITH TRAILER,https://staugustine.craigslist.org/boa/5907508630.html,
43,,"['29.937700', '-81.420600']",2016-12-18 23:46,"1978 Wooden Schooner -  PROJECT BOAT LOA: 64.8 Beam: 20.4 Draft: 7.4 Gross Ton. 62 This project is not for the faint of heart. She's a good ship, with a long beautiful history.  We came upon her with the intention of finishing her conversion into a Pirate ship, but our backers left us high and dry. Frame is made from White Oak, Outer planking is Mohogony. Inside is Cypress. She's in dire need of some TLC, as the owners previous to the ones we bought her from left her to rot. Previous owners did some repairs and sailed her from Jacksonville to St. Augustine. Frame is solid, but she is in need of a refit.  Keel was replaced previous to our purchase of her, and Original construction plans, our refit plans, pictures (digital) of when she was built at Mystic Seaport back in 1977-78, all noted and historical data, as well as our survey report (7/2016) are included in this sale. Other items included in the sale are mohogany planks of various sizes (under tarps below her), a GM Detroit Diesel 4-71 (original engine to the ship), spare gearbox, new 3"" shaft (installed, packed, and sealed previous to purchase). She has been in Drydock for the past 2 years at the SAMC, previously was known as ""Voyager"" and now known as ""Pursuit"" (Re-named by previous owners). Asking what we paid for her ($45,000) Or Best Offer, and we are still taking a loss at the asking price.  Lowball offers will be completely ignored. Questions: E-mail me at the address included in this ad",,5906169985,29.937700,65,-81.420600,,"https://maps.google.com/maps/preview/@29.937700,-81.420600,16z",Schooner,$45000,sail, (St.Augustine),65' Twin Mast Wood Schooner,https://staugustine.craigslist.org/boa/5906169985.html,1978
44,excellent,[],2016-12-18 22:32,"Old Town 17' 4"" Canoe in Excellent Cond. It is the Discovery 174 that sells new for $1300 plus tax. Asking just $600. Credit cards OK. Our house is about 10 miles south of the Avenues Mall down US 1. At the Gate station go east on 210 for 1 mile and enter Austin Park. We are #46 Kenmore Av 32081. Call show contact info (anytime).",,5904071861,,17,,,https://maps.google.com/?q=loc%3A+%34%36+Kenmore+Ave+Ponte+Vedra+FL+US,,$600,human," (Ponte Vedra, Nocatee)","Old Town 17' 4"" Canoe in Excellent Cond.",https://staugustine.craigslist.org/boa/5904071861.html,
45,excellent,"['29.828500', '-81.323700']",2016-12-18 20:38,"Bayliner Trophy walk around boat with the trailer included, new disc breaks. Mercury 175 hp outboard. Excellent condition.",,5924881972,29.828500,24,-81.323700,Bayliner Trophy,"https://maps.google.com/maps/preview/@29.828500,-81.323700,16z",,$13000,power, (st augustine),2001 Trophy Boat 24 ft with trailer,https://staugustine.craigslist.org/boa/5924881972.html,2001
46,,"['29.559400', '-81.640600']",2016-12-18 18:38,I have an old retired wooden lobster trap. This is a real trap and has concrete ballast in the bottom. It weighs about 70 lbs. It would make a great table.,,5902601988,29.559400,32,-81.640600,hand made in USA,"https://maps.google.com/maps/preview/@29.559400,-81.640600,16z",,$60,human, (Satsuma),Retired Wooden Lobster Trap,https://staugustine.craigslist.org/boa/5902601988.html,
47,good,"['29.559400', '-81.640600']",2016-12-18 18:38,8FT inflatable boat by West Marine zodiac Mercury Saturn Avon Tender Dinghy Dingy Dink Raft Caribe Achilles Sea Eagle R&B,,5902553653,29.559400,8,-81.640600,west marine,"https://maps.google.com/maps/preview/@29.559400,-81.640600,16z",,$200,power, (Satsuma),inflatable boat,https://staugustine.craigslist.org/boa/5902553653.html,
48,good,"['30.011000', '-81.410800']",2016-12-18 18:28,"Powerquest 26 foot super fast go fast boat. It has a redone 454 mercruiser with a supercharger. This boat can run 70 miles per hour it has a cuddly cabin with a toilet ....loud raidio, with amp and pioneer speakers. Will also consider trades. It also comes with tandem axle aluminum trailer",100,5924759975,30.011000,26,-81.410800,Powerquest,"https://maps.google.com/maps/preview/@30.011000,-81.410800,16z",260 ledgend,$17000,power, (St Augustine),1996 powerquest 260 ledgend,https://staugustine.craigslist.org/boa/5924759975.html,1996
49,,,2016-12-18 17:58,"Gorgeous 14' Wood Boat for SALE!  Includes a restored Sea-Horse JOHNSON 10 HP Engine and gas tank with galvanized Trailer.  Asking $1,550.00.  Please call show contact info don't text or email.  Thank you.",,5924728046,,14,,,,,$1550,power," (Saint Augustine Beach, FL)",Wood Boat with Sea-Horse JOHNSON 10 HP Engine and Trailer,https://staugustine.craigslist.org/boa/5924728046.html,
50,good,,2016-12-18 17:18,"Hurricane deck boat 21 ft. Head, on board battery charger, garmin, stereo, new bimini top and frame. Bow chair or table. Bow chair or table. 150 Yamaha fully serviced. Trailer with new brakes, new upgraded 14"" wheels and  tires, chains, etc. New no hassle hitch. Plenty of personal life floatation devices, 2 floating rings, tube and cover etc. Scammers save your time.",460,5924683248,,21,,Godfrey hurricane,,Sun deck 210,$15000,power, (St augustine),2006 Hurricane 210 Deck Boat,https://staugustine.craigslist.org/boa/5924683248.html,
51,,,2016-12-18 15:16,Nice ski runs great have trailer that's in good shape.. title in hand. Trade or 2000$,,5924533925,,150,,,,,$2000,power,,2001 stx1100,https://staugustine.craigslist.org/boa/5924533925.html,
52,good,"['29.828500', '-81.323700']",2016-12-18 14:09,Two turn key jetskis in good condition.  Both start right up and are ready for the water.  Each ski also includes a bilge pump already installed.  Only bad is that trims no longer work on skis.  Double trailer included also in good condition.,,5924446441,29.828500,10,-81.323700,ZX1 900 / Kawasaki,"https://maps.google.com/maps/preview/@29.828500,-81.323700,16z",,$3000,power,,Two 1996 ZX1 900 jetskis,https://staugustine.craigslist.org/boa/5924446441.html,1996
53,,"['29.853300', '-81.368694']",2016-12-18 13:16,"Small boat good for creeks, river, or Giggin. No time for me to gig anymore. Not pretty but gets it done. Has sat since spring. Will need carb clean but starts on spray. May take partial trade for lever action and cash. Price is firm. Have title. Can throw in some LED LIGHS IF YOU WANT EM.",,5924376194,29.853300,13,-81.368694,,"https://maps.google.com/maps/preview/@29.853300,-81.368694,16z",,$800,power, (St. Aug),Creek / Giggin Boat. 13ft,https://staugustine.craigslist.org/boa/5924376194.html,
54,good,"['29.556500', '-81.219000']",2016-12-18 12:45,"1989 Cobia Monte Carlo 189XL - Mercury 115 o/b Low gas consumption with this 115 HP Mercury outboard and it is very light weight (348lbs) comes with trailer! Starts right up and runs... pretty good shape! AM/FM MP3 stereo book value $3150 Reduced to $1850 - I don't need two boats! Will consider trade / trades for motorcycle or car or truck or van! Please make sure it has same book value or at least close! I included a pic of the NADA value! No I don't want your $300 go cart or $1000 250cc girls motorcycle. I can also take credit, debit or paypal... but NO SCAMS! Calls only! Private Seller! show contact info",,5910949899,29.556500,19,-81.219000,Cobia,"https://maps.google.com/maps/preview/@29.556500,-81.219000,16z",Monte Carlo 189xl,$1850,power, (Palm Coast),1989 Cobia Monte Carlo 189XL with 115 Mercury,https://staugustine.craigslist.org/boa/5910949899.html,1989
55,,"['29.917500', '-81.366800']",2016-12-18 11:55,"1973 MORGAN 36T A unique racing design built by MORGAN Yachts to race within the IOR specifications in the 70ies.  This boat has been in my family since 1979 and has been well taken care of and never in the water for more than 2 years at a time.  The boat has a rebuilt Westerbeke 4107 38 hp engine.  The hull is in great shape as well as the deck.  The hull is made in solid fiberglass. The keel is lead. The sails are also in great shape.  All the sails are made by HOOD. The boat comes with 5 genoas.  Reacher Drifter, #1 ""180"", 2, 3, 4, and a spinnaker.  The main is weathered but recently had all the seems restitched.  Late fall 2014 the boat was sailed to Key West from Boston and since been to St. Petersburg and now here in St. Augustine. Prior to the trip I replaced large sections of soft core in the deck and got a new 2 bladed folding Gori propeller.  I also have a brand new 9' hypalon aluminum floor board dinghy with a 2002 great condition Honda 5 hp outboard for sale separately. This boat can still win races and she has a comfortable and roomy interior. The headroom is about 6 foot.  She sleeps 8 and all bunks are 6 Ft and 6 Inches long. Please call show contact info or show contact info",,5924270190,29.917500,36,-81.366800,Morgan,"https://maps.google.com/maps/preview/@29.917500,-81.366800,16z",,$18000,sail, (st. augustine),Morgan 36,https://staugustine.craigslist.org/boa/5924270190.html,1973
56,,,2016-12-18 11:45,"Awesome ladder. If you have any boat work you plan on doing on land ,this is your answer. Makes life much,much easier. Then sell it at the end of your job. 12 feet high,same one that you see at home depot. Will fit in a 12 foot trailer that you can rent from uhaul for $30/day. These don't come around often.",,5911011632,,12,,,,,$150,human, (green cove springs),Work Yard Ladder,https://staugustine.craigslist.org/boa/5911011632.html,
57,excellent,"['29.427200', '-81.557900']",2016-12-18 11:42,"$5,000 OBO........I'M SELLING MY 1994 RINKER FLOTILLA III PONTOON/DECK BOAT, WITH TRAILER $8,500.00 or BEST OFFER (NO LESS THEN $8,000) DONT EVEN CALL IF YOU GOING LOWER THEN $8,000 !!!! I PAID MORE FOR IT & IT HAS NEW STRINGERS ALL THROUGH IT, NEW BULGE PUMP, NEW WIRING. IT HAS A 200 HP 4.3 LT ENGINE. WEIGHT IS 3,760 LBS, ALL FIBERGLASS TRI-HULL. (I/O). BATHROOM, LIGHT'S, CD/STEREO W/ 4 SPEAKER'S. DEPTH/FISH FINDER. BUILT IN STORAGE WITH BUILT IN COOLER UNDER CAPTAIN'S SEAT. FULL COVER FOR BOAT, FULL BIMINI TOP WITH COVER. POWER POLE & ANCHOR. THIS BOAT WOULD BE GREAT FOR A FAMILY WITH KID'S & OR GRANDKID'S, IF YOU WANT TO DO SHRIMPING OR CRABING .......JUST TAKE THE SEATING OUT........FULL DECK FOR NET'S OR PODS.  I JUST DONT HAVE TIME FOR IT ANYMORE AND HEALTH ISSUES HAVE BEEN STOPPING ME FROM TAKING IT OUT. I DON'T WANT IT JUST FALLING APART WHEN SOMEONE ELSE COULD BE USING IT. THIS THING WILL GET ON A GOOD PLANE AND RUN 50 - 56 MPH, DEPENDING ON THE WATER AND WIND. YES, IT'S A OLDER BOAT, BUT THIS OLD GIRL RUN'S LIKE HELL..................LIKE I SAID, TAKE THE SEAT'S OUT, YOU HAVE ONE GREAT SHRIMP & OR CRAB BOAT. WORK/COMP IS A JOKE, THAT'S THE OTHER REASON I NEED TO SELL IT & IT'S KILLING ME, BUT I NEED THE MONEY TO TAKE CARE OF MY FAMILY. I'M HAVING NECK SURGERY IN 2 WEEKS, I NEED THIS GONE BEFORE HAND.......THANKS.",5000,5924236357,29.427200,24,-81.557900,Rinker,"https://maps.google.com/maps/preview/@29.427200,-81.557900,16z",Floatilla,$5000,power," (Cresent City,Fl.)",PONTOON DECK BOAT,https://staugustine.craigslist.org/boa/5924236357.html,1994
58,,"['29.881974', '-81.299820']",2016-12-18 11:27,"40 ft, live aboard, 3 berths, plenty of room Large gas engines, Indmar, originally 250k, sold for 35k few years ago galley w fridge microwave, 2 heads, shower, hot water heater Plenty storage.  Water and working electric. Price negotiable.  Make offer, moving, boat near Marineland",,5887006996,29.881974,40,-81.299820,,"https://maps.google.com/maps/preview/@29.881974,-81.299820,16z",,$29000,power, (St Augustine),Bayliner,https://staugustine.craigslist.org/boa/5887006996.html,1977
59,,,2016-12-18 10:23,Sea Ray Bowrider 23 ft 1992 model  454 chevy mercruiser wirh Bravo 1 outdrive.....boat did 60 mph  in her day... Ive been sick and was forced to store my boat and it needs some help....  a makeover as its said... she needs a new floor and some rear upholstery... If you are handy and wanna fix her up  shes cheap and a good strong boat    included in the price is a heavy duty aluminum trailer with surge brakes... I paid 2400 just for the trailer... if i dont answer call my cell show contact info thanks   pics sent upon request,,5912810914,,23,,,,,$2400,power, (ORMOND BEACH),SEA RAY 23 FT bowrider,https://staugustine.craigslist.org/boa/5912810914.html,
60,,,2016-12-18 10:17,15' in length. Main motor is a 2006 40hp Honda. This boat has been garage kept and very well maintained. The interior of boat was recently re-gel coated. Trolling motor runs great! Plenty of storage no leaks. $3000 obo  Motivated seller no time to enjoy anymore. Open to offers but please do not waste my time. Would make someone a GREAT Christmas gift!,,5924159722,,15,,,,,$3000,power, (Keystone),CLEAN CLEAN Fiberglass boat w/motor,https://staugustine.craigslist.org/boa/5924159722.html,
61,excellent,"['29.628682', '-82.393684']",2016-12-18 09:21,"13' Boston Whaler '85 Super Sport, rare model to include seat backs and large aft storage compartment, stainless bow/side rails, 12 gal. fiberglass built in under seat Boston Whaler fuel tank, rod holders, Bimini top with cover. 48 HP Johnson '87, power tilt, SS prop, just had check up and service to include new water pump impeller, new lower unit fluid, lower unit preasure test and new water separator fuel filter, 150 PSI on both cylinders. Runs Good Full storage cover to include sides and engine. Galvanized trailer with new lights, wheels, tires, bearings, hub and Bearing Buddies. Tows good. Boat just had buff and wax detailed and all mahogany stripped and refinished with UV protected satin varnish. Whaler is in OUTSTANDING CONDITION and must be seen. TRADES CONSIDERED. REDUCED $7900.00 MAKE OFFER Gary show contact info",,5910521062,29.628682,13,-82.393684,Boston Whaler,"https://maps.google.com/maps/preview/@29.628682,-82.393684,16z",Super Sport,$7900,power, (Gainesville),13' Boston Whaler '85 Super Sport*GREAT CONDITION*REDUCED*MAKE OFFER*,https://staugustine.craigslist.org/boa/5910521062.html,1985
62,,"['29.613200', '-82.387300']",2016-12-18 09:20,C Map Bimini and the Bahamas  $25.00 show contact info,,5884782226,29.613200,1,-82.387300,,"https://maps.google.com/maps/preview/@29.613200,-82.387300,16z",,$25,human, (Gainesville),C-Map Bimini and the Bahamas,https://staugustine.craigslist.org/boa/5884782226.html,
63,new,"['30.145900', '-81.573900']",2016-12-18 03:13,REALLY SIT ON THE DOCK AND CATCH FISH FOR THE OWLS--SEE PICS---HAS WELL ELEC---SEPTIC AND 50FT DOCK-GREAT LOCATION DEEP WATER -BUILD A HOUSE GARAGE-POOL ON PROPERT--EXTEND THE DOCK ANOTHE 70FT ALONG SEA WALL-RENT BOAT SLIPS ALSO-PROPERTY IS 131FT ON THE WATER-AND 92FT DEEP--- AND IS HIGH AND DRY--SEE DEER-TURKEYS-MANATEE-EGRETS FROM ACROSS OUT OF THE NATURE PRESERVE---1 MILE FROM CLARKS FISH CAMP  AND PUBLIX SHOPPING-MANDARIN MIGHT LOOK AT SMALL TRADES TOO------ CALL 904 THEN 571 THEN 1350  THXS,,5887160614,30.145900,130,-81.573900,,"https://maps.google.com/maps/preview/@30.145900,-81.573900,16z",,$169900,human, (JACKSONVILLE),FEED OWLS- OWNR FIN WTR FRNT LOT ELC,https://staugustine.craigslist.org/boa/5887160614.html,
64,,"['29.998300', '-81.764700']",2016-12-18 01:10,"S & K Construction is your #1 choice! We are licensed & insured! Providing all phases of construction! (Interior & exterior ) Docks, decks, boat houses, boat lifts, marinas, pile driving, piling wraps, seawalls /bulk heads, stone revetments, pressure washing/sealing, walkways, remodel, fencing, garages, concrete, additions, & more Our reputation for experience, quality workmanship, & customer satisfaction is unmatched in the northern Florida area Other past projects include the Funky Pelican Restaurant on the Flagler Beach Pier & River Grille Cafe in Ormond Beach, FL Professional & reliable Customer satisfaction guaranteed! Our customers love us! Free estimates! Call Today! show contact info Scott Uptagrafft skmarineconstruction.com Visit us on Facebook for a chance to win a free Dewalt cordless drill! https://m.facebook.com/marineconstruction",,5905539968,29.998300,1,-81.764700,,"https://maps.google.com/maps/preview/@29.998300,-81.764700,16z",,,human,,"S & K Marine Residential Construction, LLC",https://staugustine.craigslist.org/boa/5905539968.html,
65,,,2016-12-18 00:12,"I have x2 2016 SeaGhosts, Homemade trailer, elite 3x fish finder, and Vibe 20 qt cooler for TRADE ONLY. In the market for a Hobie PA 14 (with vantage seat) w/ preferably a Hobie cart. NO CASH IN HAND! Outright trade. If interested contact by email. Click REPLY @ the top of the page.",,5923889448,,13,,,,,,human,,ISO Hobie PA 14 2for1 TRADE only,https://staugustine.craigslist.org/boa/5923889448.html,
66,fair,"['29.999246', '-81.679058']",2016-12-17 21:05,"8' - 6"" AB RIB Fiberglass Dinghy with chaps. Can take up to 10hp motor. Useable but needs a little TLC. Located @ Green Cove Springs Marina.",,5923769033,29.999246,9,-81.679058,,"https://maps.google.com/maps/preview/@29.999246,-81.679058,16z",,$200,human, (Green Cove Springs),AB RIB DINGHY,https://staugustine.craigslist.org/boa/5923769033.html,
67,good,[],2016-12-17 17:10,Boat is water ready outside interior is faded that's it everything else is 100% my loss ur gain,50,5923542129,,28,,Mark twain,https://maps.google.com/?q=loc%3A+%34%31%36%37+old+jendings+Rd+Middleburg+FL+US,,$1800,power, (Middleburg fl),1990 mark Twain cuddy cabin,https://staugustine.craigslist.org/boa/5923542129.html,1990
68,,,2016-12-17 16:34,"🐟 READY FOR FISHING 🐟 WATER READY GREAT COND. BOAT & TRAILER 🐟 This is a Great Fishing Boat 🐟 The Boat and Motor are in great conditions! Classic Evenrude Johnson 18hp outboard Motor Runs Excellent!! Ready to start fishing 🐟 Plenty of room inside with 3 compartments so you can load all those fishes on there! Measures 13'6"" Trailer Included as well as accessories seen in picture Life Jackets, Fire extinguisher, Motor Oil, Horn Very easy cleaning and maintenance and convenient for in and out of the water easy access. All Ready for the Water & Fishing 🐟🐟🐟 So what are you waiting for? Come and see it..... Selling for $2,500 Cash 🐟🐟 Call or Text show contact info",,5909171215,,13,,,,,$2500,power, (Ponte Vedra Beach),🐟 READY FOR FISHING 🐟 WATER READY GREAT COND. BOAT & TRAILER,https://staugustine.craigslist.org/boa/5909171215.html,
69,,,2016-12-17 15:41,"12'5"",  Yamaha PWC Wave Runner Model SUV 1200, 135hp, 4 passenger, 114 cubic ft of storage, 13 gallon tank, fast, powerful, adult run & maintained, ONE OWNER, always garage kept or stored with cover, includes trailer.  $ 4550. OBO They don't make them like this anymore! Under 100 hrs! Ready now for summer fun.  Call Ron",,5923426420,,12,,,,,$4550,power, (South Daytona),Personal Watercraft-Yamaha Wave Runner,https://staugustine.craigslist.org/boa/5923426420.html,
70,,,2016-12-17 15:12,"Really nice 9' Boat / Dinghy for SALE!  Includes a 2 HP HONDA Engine Motor.  Motor stand NOT included.  Asking $1,299.00.  Please call show contact info don't text or email.  Thank you.",,5916122398,,9,,,,,$1299,power," (Saint Augustine Beach, FL)",Small 9' Boat Dinghy w/ 2 HP HONDA Engine Motor,https://staugustine.craigslist.org/boa/5916122398.html,
