,condition,coord_pair,date,description,engine hours (total),id,lat,length overall (LOA),long,make / manufacturer,map_URL,model name / number,price,propulsion type,region,title,url,year manufactured
0,excellent,,2016-12-11 19:16,1999 16 ft Palm Beach Center Console $5300.00 50 hp Evinrude Minkota trolling motor..new Bimini top magic tilt split tongue trailer live well depth finder fish finder nice stereo with speakers garage kept and runs great,150,5915456407,,16,,Palm Beach,,160,$5300,power, (Rockledge),16 ft Center Console,https://spacecoast.craigslist.org/boa/5915456407.html,1999
1,excellent,,2016-12-11 18:51,"New Helm, new Bottom job Dec 2015 check the PICs last time it got One coat I 2013 this time 3-4 coats only had one blister on the bow all fixed. Garmin 498 Chart plotter, 10' Walker Bay tender 2.2 Mercury outboard. Great Boat for week or week end trips with the family. easy to sail, shallow draft great for getting close to the spoil Islands. New rigging in 09 engine has low hours runs like a champ. Had it for three years put in lots of extras, dodger, slid out bunk for sleeping 2500watt inverter etc, runs all the coffee makers and TVs for the week end with three new house batteries. lots of extra parts. Catalina makes a fine boat I  Want to move up to a bigger Catalina so don't need two but if you are looking to find a fast reliable boat ready to sail call me at show contact info If we are not out sailing it I'd be happy to answer any questions I am open to real offers or the only trade I'd consider is for a 36-40ft Trawler Specs Hull Shape: 1980 Monohull Keel: Fin Dimensions LOA: 26 ft 10 in Beam: 8 ft 6 in LWL: 21 ft 9 in Maximum Draft: 4 ft 0 in Ballast: 2700 lbs Bridge Clearance: 38 ft 3 in Dry Weight: 6850 lbs Engines Engine 1: New 55amp Alt Engine Brand: Universal Year Built: 1996 Engine Model: M-20 Engine Type: Inboard Engine/Fuel Type: Diesel Tanks Fresh Water Tanks: (20 Gallons) Holding tank 25 Gallons Fuel Tanks: (20 Gallons) Accommodations Number of single berths: 3 Number of twin berths: 2 Number of cabins: 2 Number of heads: 1 Electrical Equipment Electrical Circuit: 12V 120v outlets 30amp service 2500 watt inverter 55 watt solar panel Features AM/FM MP3 Stero w/ 6 speakers Digital Depth / Knot meter 23"" TV Garmin 498 Chart Plotter VHF 2ea Richie Steering Compass PFDs 2 Danforth Anchors 3 New Batteries (2012) 3 Fire Extinguishers Two Burner Stove Deep Ice Chest Roller Furling Double Lifelines Barlow #20 Primary Winches Halyard Winch Fenders Manual Flush Head Cockpit Cushions Mainsail With Cover 130% Furling Genoa",,5894553147,,27,,Catalina,,,$10900,sail, (Melbourne),27' Catalina SailBoat /W 10 Tender,https://spacecoast.craigslist.org/boa/5894553147.html,1980
2,good,"['28.133100', '-80.711200']",2016-12-11 18:41,"1978 Aquasport 24 foot cuddy cabin with Volvo Penta 350 CID inboard/outboard.  Closed Loop cooling system.  No salt water circulated in engine block.  Awesome hardtop with rod holder tower.  Great hull for offshore.  Aluminum dual axle trailer in excellent condition.  Lorance Elite-7 GPS/Chart Recorder, VHF radio, FM stereo, new Holly fuel pump, dual batteries with battery charging relay system, 100 gallon gas tank, complete set of Lee outriggers, comes with all safety equipment and rigging.  Everything works.  This is a great off shore fishing boat.  Asking $7,500.00.",655,5904959873,28.133100,24,-80.711200,Aquasport,"https://maps.google.com/maps/preview/@28.133100,-80.711200,16z",,$7500,power, (Melbourne),24 Ft Aquasport Cuddy Cabin,https://spacecoast.craigslist.org/boa/5904959873.html,1978
3,,,2016-12-11 18:27,"82 Holiday Cruiser 25' Has stove, refrigerator, sink, bathroom with shower, beds, table and new motor Trailer with rollers $3500 Calls only Pete show contact info",,5905547550,,25,,,,,$3500,power,,82 Holiday Cruiser 25',https://spacecoast.craigslist.org/boa/5905547550.html,
4,good,"['28.178000', '-80.602000']",2016-12-11 18:09,"Selling my 340 Sundancer, 8.1L Mercruisers (505hrs) and a 4.5K Westerbeke generator (194hrs).  The boat is ready to go and turn key ready.  Boat washed and bottom diver cleaned monthly.  Recent maintenance:   New risers and manifolds (May 14), Fresh bottom paint (2015), all new raw water coolers (oil, fuel, and heat exchangers) on engines and transmissions (Feb 15), regular oil changes every year.  Boat is in great shape and ready to go.",505,5915383370,28.178000,36,-80.602000,Sea Ray,"https://maps.google.com/maps/preview/@28.178000,-80.602000,16z",340 Sundancer,$55000,power, (Melbourne),2001 SEA RAY 340 SUNDANCER,https://spacecoast.craigslist.org/boa/5915383370.html,2001
5,like new,[],2016-12-11 17:38,"2015 Model- 1754 Grizzly Metal Boat with 40hp Mercury Motor.  Has Minn kota trolling motor. Everything works and the boat is like brand new, I just don't use it because I have another Boat.",,5915347207,,18,,Mercury,https://maps.google.com/?q=loc%3A+pina+vista+at+lake+washington+melbourne+FL+US,40HP,$10200,power," (Melbourne, FL)",2015- 1754 Grizzly Jon Boat Side Console,https://spacecoast.craigslist.org/boa/5915347207.html,2015
6,,,2016-12-11 17:28,"17ft key west boat, great shape, looking for something bigger. 2004 YamAha 115 4 stroke with 165psi compression in all cylinder. Just changed oil and ran through all the test for the new season. Great on gas, can run all day and still have half a tank. Does have hummingbird 757 sonar/gps that comes with it. Bigger unit can be purchased separate $500.00 Serious offers only. Will test ride with cash in hand. Trailer is good to go, and tires are in good condition. 7000obo",,5915335486,,17,,Key west,,17cc,$7000,power, (Davenport/Orlando),17 ft key west with 2004 Yamaha 115 4stroke,https://spacecoast.craigslist.org/boa/5915335486.html,
7,good,"['27.857138', '-80.495968']",2016-12-11 17:12,Lots and Lots of snorkle gear< different sizes!!!,,5885040166,27.857138,0,-80.495968,,"https://maps.google.com/maps/preview/@27.857138,-80.495968,16z",,$20,human, (barefoot bay area),Snorkle gear,https://spacecoast.craigslist.org/boa/5885040166.html,
8,excellent,,2016-12-11 16:49,1997 Sea Doo GTS (3 seater) Jet Ski 717/720 engine/gas-oil mixed. Run's great. Has reverse. Trailer included. $2200.00 OBO Awesome Jet Ski Great for the family too.,,5907165931,,10,,Sea Doo,,GTS,$2200,power,,Sea Doo GTS 1997 (3 Seater) (Jet Ski) + Trailer,https://spacecoast.craigslist.org/boa/5907165931.html,1997
9,excellent,,2016-12-11 16:46,"2016 Ankona Shadowcast 17 2016 Suzuki 30 (electric start, manual trim/tilt) 2016 Float On trailer Options: Manual jack plate SS prop Electrical package (nav lights, under gunnel and under deck lights, bilge pump, Optima battery) Front casting and rear poling platforms Rod holders for up to 4 fly rods or 6 spinning rods 55lb Riptide Micro Power Pole Moonlighter 21' push pole V Marine push pole holders 8 gallon aluminum fuel cell up front All were bought new in May. This is the first 17' non tunnel Shadowcast out of the mold. Runs about 30 with just me, 27-28 with another angler. The SS prop is a tad too big so with one size smaller it would probably run a tad better. I also have the stock one. Everything works as it should. 35 hours on it. It is surprisingly stable and runs dry for the type of boat and size. Handles a chop well too. Poles great too. $14000 obo. Text or call show contact info Im available to talk or text after 5 during the week and anytime on weekends. If i don't answer leave a voicemail and Ill call you back.",35,5896826845,,17,,Ankona,,Shadowcast,$14000,power, (Cocoa),2016 Ankona Shadowcast Flats Boat,https://spacecoast.craigslist.org/boa/5896826845.html,2016
10,excellent,,2016-12-11 16:33,1997 Sea Doo GTS (3 seater) Jet Ski 717/720 engine/gas-oil mixed. Run's great. Has reverse. Trailer included. $2200.00 OBO Awesome Jet Ski Great for the family too.,,5907164628,,10,,Sea Doo,,GTS,$2200,power,,Sea Doo GTS 1997 (3 Seater) (Jet Ski) + Trailer,https://spacecoast.craigslist.org/boa/5907164628.html,1997
11,,,2016-12-11 16:30,"Selling a brand new 2016 Hurricane 2400, Powered by a 250 Yamaha 4 stroke Equipped with: telescoping tow ski bar, elite fish and depth finder in dash, livewell, stainless steel pull up cleats, custom boat cover, preferred package, underwater lights, electric flush pump out toilet, vinyl zephyr upgrade, snap in bamboo, bimini top, hydraulic steering, and more Easy Financing Available Please call show contact info if you have any questions www.CastawayMarine.com",,5904002531,,24,,,,,,power,,2016 HURRICANE 2400!,https://spacecoast.craigslist.org/boa/5904002531.html,
12,fair,,2016-12-11 16:19,"85 HP Perkins runs velvet trans   ft 14.5 wide great liveaboard tons of extras needs complete redo but is worth every penny there's more than 10 grand in sails .let me know call show contact info to discuss further thanks asking $8000 11 north sail, 7 bomar hatches 6 Lewmar 1 and 2 speed winches working head, shower extra pumps huge v berth huge aft cabin this is a perfect live aboard a floating condo if your handy this is for you dock fee in Merritt isl is 300 two 80 watt solar panels wind generator all kinds of goodies I have all material to put into ship I don't know what else to say .  Asking 12k or 6,000 down and monthly payments for a year show contact info",,5911975027,,52,,"Starky,Cape Town africa",,ferro cement,$8000,sail,,1975 52 ft ferro ketch,https://spacecoast.craigslist.org/boa/5911975027.html,1975
13,excellent,"['29.466100', '-81.282800']",2016-12-11 16:18,In excellent shape,,5910768853,29.466100,16,-81.282800,Ghenoe,"https://maps.google.com/maps/preview/@29.466100,-81.282800,16z",16 ft ghenoe,$700,human, (Merritt isl),16 ft ghenoe,https://spacecoast.craigslist.org/boa/5910768853.html,
14,excellent,"['28.049270', '-80.634835']",2016-12-11 16:14,"1994 Sea Ray  Bow Rider  19ft.  1994 175 hp. Mercury EFI outboard motor Fish/ Depth Finder (Hummingbird) dual batteries,  with a EZ LOADER Shorelander Trailer  Excellent Condition. $6500 call show contact info",,5915242353,28.049270,19,-80.634835,Sea Ray,"https://maps.google.com/maps/preview/@28.049270,-80.634835,16z",SkiRay,$6500,power, (melbourne),1994 Sea Ray,https://spacecoast.craigslist.org/boa/5915242353.html,1994
15,fair,"['28.069100', '-80.620000']",2016-12-11 16:02,"I have a 22 foot sail boat for sale. It needs attention on the inside and comes with the trailer. The boat is easy to sail, come with a 27 foot mast and sails. I will consider trades, calls only, show contact info",,5883467185,28.069100,22,-80.620000,Bayliner,"https://maps.google.com/maps/preview/@28.069100,-80.620000,16z",,$900,sail, (melbourne fl.),SAIL BOAT 22FT needs attention/will trade,https://spacecoast.craigslist.org/boa/5883467185.html,1981
16,like new,"['28.138400', '-80.652400']",2016-12-11 16:02,"2 nice kayaks for sale! Great for Christmas time. Asking $375 for pink D10 Kayak(Loaded) and $500 for the FS10(Fishing Loaded). Both include paddle, life vest, anchor and Kayak car carrier kit. Will take off $50 for both together and include the storage rack. $850 for all!! Great deal! Ready for the water! Cash only",,5903445465,28.138400,10,-80.652400,Bass pro shop,"https://maps.google.com/maps/preview/@28.138400,-80.652400,16z",D10 and FS10,$375,human, (Windover Farms),Ascend D10 & FS10 Kayaks sit inside bundle!,https://spacecoast.craigslist.org/boa/5903445465.html,2015
17,,"['28.178000', '-80.602000']",2016-12-11 15:42,Fun Christmas present!! Be on the water in 5 minutes.  Pump and paddle included.,,5911178434,28.178000,72,-80.602000,,"https://maps.google.com/maps/preview/@28.178000,-80.602000,16z",,$75,human, (INDIAN HARBOUR BEACH),BLOW UP 2-MAN KAYAK WITH PADDLE AND PUMP,https://spacecoast.craigslist.org/boa/5911178434.html,
18,,"['28.276400', '-80.656800']",2016-12-11 15:16,"8' hypolon Achilles with wood floors, inflatable keel, oars, foot pump, and all in one carrying bag. This is an older inflatable that was used for two years and then stored for the last 6 years. It has a lot of life left in it.  $400 obo.",,5915167351,28.276400,8,-80.656800,Achilles,"https://maps.google.com/maps/preview/@28.276400,-80.656800,16z",inflatable,$400,human, (Merritt Island),8' hypolon Achilles,https://spacecoast.craigslist.org/boa/5915167351.html,
19,,,2016-12-11 15:01,"Please don't flag this ad I have a 2004 Jeep Rubicon with small lift and big tires ( approximate 35"" ) Has swing out tire carrier and front bumper with stinger. Warn 8000 # winch. Has 4.0 6 cylinder with a 5 speed manual transmission. The jeep has 180000 miles on it but does not use oil and runs great. Looking to trade for a decent size ( prefer nothing smaller than 20' ) fishing/dive boat and trailer show contact info text ONLY No junkers please, mine runs and drives and looks pretty good so looking for the same. I WILL NOT PAY ANY MONEY OUT ON TRADE. Best to text because emails go to spam folder. No brokers or any other kind of assistance wanted. I will not ship the jeep and will not take Pay",,5909002098,,20,,,,,,power,,Trade for dive/fishing boat,https://spacecoast.craigslist.org/boa/5909002098.html,
20,,,2016-12-11 14:57,5 Kayaks + Trailer for sale. 4 Single 11.5' Perception Pescador fishing sit on top kayaks 1 Perception Tandem Kayak 14' 1 Trailer Also includes: 5 Paddles 6 Life Vests 4 Rod holders All kayaks are in good condition. One single has a rod holder that needs to be put back in (I have the holder). Some of the bungees are a little stretched. One carrying handle broken. They just need a little love but are all fully functioning as is. I am pretty firm on price so please no low ball offers. I will entertain fair offers.,,5915141156,,12,,,,,$3000,human," (Melbourne Beach, FL)",5 Kayaks + Trailer,https://spacecoast.craigslist.org/boa/5915141156.html,
21,good,[],2016-12-11 14:29,"22 Ft Grady White W/A Cuddy 1986 with T-Top and Tandem Axle Trailer. Anchor Windlass, VHF Radio, Fish Finder, Rod holders and More!!(No Motor) We have used motors available to purchase. Asking Only $6,995 for The Boat &Trailer. Contact Chuck For More info. show contact info Cell #",,5878041911,,22,,Grady White,https://maps.google.com/?q=loc%3A+%33%33%35%35+SE+Dixie+Hwy+Stuart+FL+US,22 Seafarer,$6995,power," (Stuart, Fl)",22 Ft Grady White Walk -A -Round Cuddy 1986 with Trailer,https://spacecoast.craigslist.org/boa/5878041911.html,1986
22,like new,"['27.155088', '-80.205517']",2016-12-11 14:29,"34 Ft Mirage Center Console 2004 (Sleeps 4 in Air Conditioning) Twin 250 HP Suzuki 4-Strokes (2014) with Only 179 Hours and Factory Warranties. This Mirage has been Completely refitted in 2014 at a cost of over $90,000. Everything New Including Complete Awlgrip  Paint Job Other Features Include: Folding Half Tower with Controls & Buggy Top, Fiberglass Hardtop, Frigid Rigid Box in Bow with Cushion, 72 Mile Radar, Color Chart Plotter, Auto Pilot, Fishfinder, Vhf Radio, Infinity Bluetooth Stereo System, Vacuflush Head, LED Underwater Lights & Spreader Lights, Power Helm Seat, Anchor Windlass, Lenco Auto Trim Tabs, Taco Outriggers, Baitwell, Fish Boxes, Washdowns, Electric Cockpit Hatch an So Much More!! Why pay over $300,000 for a new boat when you can buy this Beautiful Mirage. Asking $149,000. Contact Chuck for more info. show contact info Cell #",179,5878055120,27.155088,37,-80.205517,Mirage,"https://maps.google.com/maps/preview/@27.155088,-80.205517,16z",34 CC,$149000,power," (Stuart, Fl)","34 Ft Mirage Center Console ""04"" Complete Rehab in 2014, T-250 Suzuki",https://spacecoast.craigslist.org/boa/5878055120.html,2004
23,,,2016-12-11 14:23,"2015 Carolina Skiff JVX18CC Has a 70hp 4 stroke Yamaha, gray hullsides, matching bimini top, 2 bait wells (bait well in console has a light, rod holders, front deck padded swivel pedestal seat with backrest, swim step and ladder, trolling motor outlet for plug, smart tabs, hour meter, and aluminum trailer. Of all the Carolina Skiff series, the JVX is considered the king of versatility. 100 hours on clock. Was properly services at 20 hours and at 100 hours. Properly washed after every use. No trades please. show contact info",120,5915093108,,18,,,,,$20000,power, (Palm Bay),2015 Carolina Skiff JVX18CC,https://spacecoast.craigslist.org/boa/5915093108.html,
24,,"['28.480461', '-81.378822']",2016-12-11 14:09,"good functional sailboat, has good sails, mahogany rudder, harken mainsheet system, retractable rudder, new sheets and halyards, come get it out of my yard,  nice galv. roller trailer for $450 extra.",,5915073871,28.480461,18,-81.378822,pearson,"https://maps.google.com/maps/preview/@28.480461,-81.378822,16z",triton,$450,sail, (orlando),pearson 18 sailboat-everything included to sail,https://spacecoast.craigslist.org/boa/5915073871.html,1986
25,good,"['27.790100', '-80.478400']",2016-12-11 13:59,Have a nice 16 bass boat only selling to buy a pontoon will sell without the motor and controls. The price is firm phone calls only please Thanks Richard show contact info,,5915060107,27.790100,16,-80.478400,omc javlin,"https://maps.google.com/maps/preview/@27.790100,-80.478400,16z",350A,$1650,power, (sebastian),16 bass boat and trailor,https://spacecoast.craigslist.org/boa/5915060107.html,1994
26,good,"['28.391000', '-80.787000']",2016-12-11 13:59,"16' two seat canoe, good shape, great for a Christmas present for only $115. Call and ask for Cecil after 9am. 631two two nine five",,5915059189,28.391000,16,-80.787000,,"https://maps.google.com/maps/preview/@28.391000,-80.787000,16z",,$115,human, (Cocoa off 524),16' Canoe,https://spacecoast.craigslist.org/boa/5915059189.html,
27,,"['27.637200', '-80.479400']",2016-12-11 13:51,"13'4"" Gheenoe, 2 trolling motors, 1999 Nissan 9.9HP 4 stroke motor (low operating hours), motor stand, trailer, humminbird fish finder, push pole, life jackets and spare trailer tires.  Clean title.  Ready to Fish!  Always garage-kept.  Location:  Vero Beach, FL.  $3000 OBO.",,5915049273,27.637200,13,-80.479400,Gheenoe,"https://maps.google.com/maps/preview/@27.637200,-80.479400,16z",,$3000,power," (Vero Beach, FL)",Gheenoe,https://spacecoast.craigslist.org/boa/5915049273.html,1988
28,excellent,"['28.021900', '-80.538900']",2016-12-11 13:38,"2000 12ft. Dakota flat bottom boat and 2011  galvanize trailer, boat in great shape no leaks, has battery box and rod holder, with 2 seats . Trailer also in great shape, all lights work. Have boat title and trailer registration  $ 650.00 call or text 405 nine nine 0 9333",,5915030681,28.021900,12,-80.538900,Dakota,"https://maps.google.com/maps/preview/@28.021900,-80.538900,16z",,$650,power, (Melbourne beach),12 ft flat bottom & trailer,https://spacecoast.craigslist.org/boa/5915030681.html,2000
29,,"['28.109100', '-80.578700']",2016-12-11 13:25,1 Old Town Predator and 1 Ocean Malibu 2XL Angler. Both barely used and in great condition. Always garage kept. Come with paddles and flow through live well with battery for the Predator. Paid 2200.00Will take 1500.00 for both.,,5915011833,28.109100,13,-80.578700,,"https://maps.google.com/maps/preview/@28.109100,-80.578700,16z",,,human,,2 kayaks Old Town Predator and Ocean Malibu 2XL Angler Tandem,https://spacecoast.craigslist.org/boa/5915011833.html,
30,,,2016-12-11 13:22,"I have a nice boat yard with office to sell 40 boats on busy Highway 1 in Grant. I'm looking a boat, RV or trailer dealer with own inventory. All permits there, ready to open tomorrow. Call for details",,5887659525,,100,,,,,$1,human, (GRANT),BOAT RV DEALER-BROKER WANTED WITH INVENTORY,https://spacecoast.craigslist.org/boa/5887659525.html,
31,good,,2016-12-11 13:22,"New deck, new fuel tank, new fuel pump, new wiring, new gunnel lighting, new 8ft bimini top, carbs just cleaned. Compression checked and good to go. Engine is 115 hp OMC. New tires, new springs and new lights on trailer.  Magic tilt trailer alone is worth 1500. Text Philip.",,5914980100,,21,,leisure craft,,,$2000,power,,JUST REDUCED! 20 ft Leisure Craft Ski-Bay Boat MAKE OFFER,https://spacecoast.craigslist.org/boa/5914980100.html,
32,excellent,"['26.216000', '-80.220500']",2016-12-11 13:22,"For sale a very nice mid 90s DT 9.9C Suzuki 20"" long shaft. Oil injected engine. Tiller steering/pull start. High thrust prop in new condition. Built in rectifier runs night lights. Steering lock. Lightly used and well lubed. Looks new under the hood. Runs great and new water pump installed. Auxiliary sailboat or trolling motor or deep transom skiff. These are the best engines built in their category. I obtain them whenever possible in good condition. Rugged quality workmanship. I will run it for you. Call or text me at show contact info anytime. Also have other nice clean kickers(4-25hp) in my arsenal for sale. Key words: sailboat 20"" inflatable dingy john boat 8Hp 15Hp 6Hp 9.8Hp long shaft high thrust propeller Yamaha Tohatsu Nissan Mercury Suzuki Johnson Evinrude Honda outboard motor bracket tiller t Avon Zodiak West Marine outboard Westerbeke Yanmar Volvo penta yacht Carolina skiff Boston Whaler boat part",,5877480286,26.216000,20,-80.220500,SUZUKI,"https://maps.google.com/maps/preview/@26.216000,-80.220500,16z",DT 9.9C,$800,power, (FT. LAUDERDALE),"9.9Hp SUZUKI 2 STRK OIL INJECTED 20"" TILLER OUTBOARD MOTOR",https://spacecoast.craigslist.org/boa/5877480286.html,1995
33,,,2016-12-11 13:21,"2000 18'6"" boat, Yamaha 90 outboard motor, Garmin fishfinder-GPS combo, new cushions",,5906019476,,19,,,,,$5500,power, (GRANT),19' CENTER CONSOLE FISHING BOAT,https://spacecoast.craigslist.org/boa/5906019476.html,
34,,,2016-12-11 13:19,"I'm interested to buy a hurricane damaged boat, any size or condition",,5915003630,,16,,,,,$1,human, (GRANT),HURRICANE DAMAGED BOAT WANTED,https://spacecoast.craigslist.org/boa/5915003630.html,
35,,,2016-12-11 13:16,"I have about 0.25 acre huge Australian Pine trees have to remove with roots (NOT TO CUT) I'm looking someone with large backhoe, excavator or front end loader. I have many different size boats, also outboard engines, boat trailers, depend what  you can do I can even offer a nice 2003 22' center console offshore fishing boat value $15000 for trade but for that need to clear a larger area, bring some dirt and do some leveling. Also I have a small buildable lot in Grant on Old Dixie Hwy I can offer trade for land clearing.",,5892302293,,22,,,,,$1,power, (GRANT),BOAT TRADE FOR LAND CLEARING,https://spacecoast.craigslist.org/boa/5892302293.html,
36,,,2016-12-11 13:13,"Good condition boat, engine out of boat. Trailer not comes with.",,5883424166,,26,,,,,$1600,power, (Grant),1984 Chris Craft Catalina,https://spacecoast.craigslist.org/boa/5883424166.html,
37,excellent,[],2016-12-11 13:05,"All Space Coast Dustless Blasting offers the newest technology for paint stripping & surface preparation. It is the fastest, cheapest, cleanest, greenest, safest way to strip paint & prepare your surface and we come to you with our fully self contained mobile unit. Residential & Industrial, automotive stripping, marine anti fouling paint removal, graffiti removal, masonry stripping, antique restoration, road stripe removal, swimming pool resurfacing, wood restoration, mold remediation, roofs, driveways, sidewalks, decks, restaurant equipment, heavy equipment, among many other applications. No mess, just results. We are licensed and insured. We service All of the Space Coast & beyond. Call us for a free estimate for all your paint stripping & surface preparation needs show contact info Visit our website at allspacecoastdustlessblasting.com like us on facebook & check out our videos on youtube.",10,5880777750,,17,,Dustless Blaster,https://maps.google.com/?q=loc%3A+S+Park+Ave+at+South+St+Titusville+FL+US,Blaster,$100,power," (Titusville, Fl)",All Space Coast Dustless Blasting-Mobile Paint Stripping/Surface Prep.,https://spacecoast.craigslist.org/boa/5880777750.html,2015
38,,"['34.561300', '-79.433500']",2016-12-11 13:04,"2002 StingRay Power Speed Boat, Very very low hours, 110....Only been out a couple of times a year since new..Always professionally serviced each and every year, Powered by a Volvo Penta 5.0 GXI fuel injected v8 rated @ 290 HP..! That was new for that year, previous was 270 HP, A very clean, beautiful boat stored all its life in doors, Only fresh water use only...! The Original vinyl is as soft, supple, silky as a new born babys butt...!..Porta potty, mini pump sink, mini gas stove..! Bucket seats, depth finder, am-fm plus much more, Also included, Is a brand new 2016 , 22-24 ft Aluminum trailer with stainless steel hardware, dual axle, and disc brakes , with torsion suspension included..And also has a cuddy cabin to keep all your goodies dry, with a very nice size sun deck as well. Bimini top with a clear vinyl windscreen.. A very dry ocean worthy boat... Due to scammers, Soliciting , I will not be posting my phone number, : If interested, Please E mail me, All E mail will be answered .. Abtw, the price is firm,. its extreamly allot of boat for the money.. Thanks for viewing Les",110,5880222828,34.561300,22,-79.433500,StingRay,"https://maps.google.com/maps/preview/@34.561300,-79.433500,16z",220CX,$17500,power, (little river SC),"2002 StingRay power speed boat, Near New",https://spacecoast.craigslist.org/boa/5880222828.html,2002
39,good,,2016-12-11 12:55,"Installed New deck, new fuel tank, new fuel pump, new wiring, new gunnel lighting, new 8ft bimini top, carbs just cleaned. Compression checked and good to go. Engine is 115 hp OMC. New tires, new springs and new lights on trailer. Needs shift cable ran. Runs strong. $1995 or best offer.......Text Philip 321-216 one 4 two 2",,5909168826,,21,,leisure craft,,,,power,,MAKE OFFER RUNS STRONG 20 ft Leisure Craft Ski-Bay Boat,https://spacecoast.craigslist.org/boa/5909168826.html,
