,condition,coord_pair,date,description,engine hours (total),id,lat,length overall (LOA),long,make / manufacturer,map_URL,model name / number,price,propulsion type,region,title,url,year manufactured
95,,"['28.388800', '-80.730100']",2016-12-10 22:45,"Dont want to wait weeks to have your boat done? We are a mobile service that will offer quality work at a very reasonable price. Dont want to spend time and money bringing your boat somewhere to get done? We come to you, serving all of Brevard county. We do wash(waterline removal), Decal removal & replacement, Wet-Sanding(Hull & Outboards), Oxidation removal, Compound buffing, Hand waxing, Polishing brightwork, Windows, Vinyl, Canvas repair, Gel-coat and Fiberglass repairs,(chips & deep scratches) Full detailing, Bottom painting and trailer work(Paint & Maintance). We are licensed and insured and have a great reputation in Brevard county for quality work..prices are very competitve usually 10-20$ a foot depending on what your boat needs. We use top of the line tools and products. Just bought a boat? Selling a boat? We can make your boat look like it did when you first bought it, brand new or getting it looking great to get the most money out of it when you sell it...Guaranteed to have the lowest prices in town! We will make sure you are 100% satisfied. Give me a call if you have any questions or for a quote. For more pics www.facebook.com/marineonedetailing Thanks for looking... Rob- show contact info",,5908037891,28.388800,60,-80.730100,,"https://maps.google.com/maps/preview/@28.388800,-80.730100,16z",,$1,power, (Brevard County),Mobile Marine Detailing,https://spacecoast.craigslist.org/boa/5908037891.html,
96,,"['28.354579', '-80.669524']",2016-12-10 21:22,"1999 sea doo gsx ROTAX FUEL INJECTION  787/800 cc 2 stroke motor. 2 seater jet ski. Freshly rebuilt engine. Very clean ski. Was garage kept. Comes with a single trailer. 50+mph. Also has HYDRO TURF MAT. Very easy to handle ski. $2600obo. Avaliable to show Monday 12/12.  Call text or email 24/7. If I'm up I'll respond. Thanks Seadoo GSX GTX RFI rxp rxdi rx-di GS GTI Kawasaki, Yamaha GP 1200, Polaris virage,  Honda aquatrax. Jet skis jet ski. 4tech",,5908490337,28.354579,94,-80.669524,,"https://maps.google.com/maps/preview/@28.354579,-80.669524,16z",,$2600,power, (Merritt Island),99 SEADOO GSX RFI 2 STROKE ENGINE FRESHLY REBUILT 1HR. Garage kept,https://spacecoast.craigslist.org/boa/5908490337.html,
97,excellent,,2016-12-10 20:36,"Well maintained 2011 Edgewater 220IS bought new in January of 2013. Mercury Verado 250 just serviced. Features Edgewater SPI hull design and full flotation (unsinkable).Everything has been upgraded. Simrad electronics package with custom carbon fiber dashboard. Simrad marine radio with handheld radio. Boat has 3 live wells, wash down pump (just replaced), I pilot GPS trolling motor, new batteries(2 engine,2 trolling) upper helm station with electronics, custom cover for upper and lower and the motor. Trailer just rebuilt in June new brakes and tires. One of a kind Edgewater with Mercury Power. Mint condition and meticulously maintained. Motor has 500 hours on it.Serious inquiries only. Call to schedule a showing. Contact Dan @ show contact info",500,5914337991,,22,,Edgewater,,220IS,$70000,power, (Melbourne Beach),2011 Edgewater 220IS,https://spacecoast.craigslist.org/boa/5914337991.html,2011
98,,"['28.456600', '-80.797800']",2016-12-10 20:05,"This is a boat, motor & trailer pkg. The pontoons have pin holes throughout and deck needs replaced. The trailer is a dual axle galvanized in great shape. Not sure of the year on the DT75 Suzuki outboard. The motor has 135 psi in all 3-cylinders and fires right up with no issues. Power tilt and trim work fine and prop in great shape. Would like to sell complete pkg, but willing to part out. Priced as follows: Motor w/controls and stainless wheel= $2250 Trailer= $1,000 Free scrap aluminum (surely worth $500)",,5893179653,28.456600,24,-80.797800,,"https://maps.google.com/maps/preview/@28.456600,-80.797800,16z",,$3250,power, (PSJ),Free 1998 Grumman 24' pontoon with purchase of motor and trailer!,https://spacecoast.craigslist.org/boa/5893179653.html,
99,new,,2016-12-10 19:39,all types of marine canvas and upholstery. 17 yrs in local buisiness. small with minumal overhead which leads to great discounted prices. we have a full mobil service and in shop location in central brevard . call for quotes any time. show contact info,,5871174827,,20,,,,,,power,,ALL BOAT UPHOLSTERY AND CANVAS,https://spacecoast.craigslist.org/boa/5871174827.html,
