,condition,coord_pair,date,description,engine hours (total),id,lat,length overall (LOA),long,make / manufacturer,map_URL,model name / number,price,propulsion type,region,title,url,year manufactured
28,excellent,,2016-12-20 14:14,"Probably the nicest early-2000s Dancer you'll find anywhere. Features the highly-sought hydraulic swim platform to make launching your dinghy or jetski a breeze. Everything works perfectly and the boat is pristine. Twin CAT3126 350HP Diesels with 750 hrs. Underwater lights at stern New canvas 2012 New AGM Batteries 2014 Hydraulic swim platform with remote control keyfobs -- all hydraulics replaced 2014 All interior and cockpit lighting converted to LED Custom LED cockpit underseat lighting New hull accent striping 2014 New bottom paint 2014 New Vitrofrigo refrigerator 2014 (4) LCD TVS including 32"" cockpit Smart TV new 2016 Custom starboard bow chaise loungers/cushions new 2014 Custom transom speakers and amplifier new 2014 New cockpit speakers 2014 All-chain anchor rode New fresh water pump 2015 Rebuilt waste holding tank unit 2014 Rebuilt vacuflush heads 2016 For more info, pics and videos visit www.soniquest.com/sundancer",750,5887850369,,41,,Sea Ray,,410 Sundancer,$119000,power, (Clearwater),2001 410 Searay Sundancer,https://orlando.craigslist.org/boa/5887850369.html,2001
29,,"['28.484682', '-81.479794']",2016-12-20 13:53,I have a 7'6 heavy kdvert danali rod. text for pictures,,5927089272,28.484682,7,-81.479794,,"https://maps.google.com/maps/preview/@28.484682,-81.479794,16z",,$50,human, (orlando),danali rod today only,https://orlando.craigslist.org/boa/5927089272.html,
30,good,"['28.006800', '-82.556000']",2016-12-20 13:50,19 ft wellcraft center console powered by great running evinrude 112 hp. boat is solid and water ready with no soft spots anywhere.comes with trailer. asking $5800.call or text show contact info,,5915216686,28.006800,192,-82.556000,,"https://maps.google.com/maps/preview/@28.006800,-82.556000,16z",,,power,,19 ft wellcraft center console,https://orlando.craigslist.org/boa/5915216686.html,1996
31,good,"['28.597200', '-81.679400']",2016-12-20 13:42,1995 Boston Whaler 15.5 rage with a 115 Johnson jet drive. Boat runs good and looks good. Seats are in great shape. Has depth finder. Fire extinguisher. Comes on a really nice Performance brand trailer. Has new tires with spare. New bunks.,,5896726734,28.597200,16,-81.679400,Boston Whaler,"https://maps.google.com/maps/preview/@28.597200,-81.679400,16z",Rage,$3000,power, (Montverde),1995 15.5' Boston Whaler,https://orlando.craigslist.org/boa/5896726734.html,1995
32,good,,2016-12-20 13:25,"Selling 2014 Yamaha VX110 Cruiser waverunner, 3 seater, 110HP, four stroke, Ski features, reverse, mirrors, folding rear step, anti theft alarm, and remote learning modes. Super reliable, fresh water ski,, Retail is $8900 Wholesale $4400 trailer not included, ski was used as a guide ski at rental operation, professionally maintained perfect for Christmas!! Unit does have some scratches on port side. Ready to ride today! Ski shows 89 hours on gauges Call show contact info",89,5927044934,,13,,Yamaha,,Vx110 cruiser,$4400,power, (Narcoosee rd),2014 Yamaha VX1100 Cruiser WaveRunner 3 seater 4strokes 110HP,https://orlando.craigslist.org/boa/5927044934.html,2014
33,,[],2016-12-20 13:18,"2016 Bimini 239 Honda BF115 (twins) This is a very wide 23' center console with a 9'6"" beam. It is also rare because there are not many 23' center consoles with twins. Financing is available and payments are as low as $369/mo. Call or text me today if you are interested. Please refer to Bimini 239 Brian at show contact info",,5927032969,,23,,,https://maps.google.com/?q=loc%3A+%36%30%30%30+N%2E+US+%31+Melbourne+FL+US,,$58990,power," (Melbourne, FL)",2016 Bimini Boat 239 w/ Twin Honda BF115,https://orlando.craigslist.org/boa/5927032969.html,
34,like new,"['28.797268', '-82.599764']",2016-12-20 13:16,"2016 ROBALO R180 POWER BOAT YAMAHA F115XB LOWRANCE 7TI DUAL BATTERY WITH SWITCH VHF PACKAGE COAST GUARD KIT BIMINI TOP POTTI FACTORY OPTIONS: SOUND SYSTEM, CUSTOM ANCHOR, RAW WATER WASHDOWN, LEANING POST WITH ROD HOLDERS, FOOT REST **MUST SEE - ROBALO.COM-R180 VIDEO LOCATED IN MARINA ON HOMOSASSA RIVER (PRICE NEGOTIABLE)",22,5927028967,28.797268,18,-82.599764,ROBALO,"https://maps.google.com/maps/preview/@28.797268,-82.599764,16z",R180,$29995,power, (lecanto),2016 ROBALO R180 POWER BOAT,https://orlando.craigslist.org/boa/5927028967.html,2016
35,good,"['28.551500', '-81.305100']",2016-12-20 13:15,Call for any new or used parts for 2 stroke and 4 stroke seadoo or yamaha. show contact info,,5917515187,28.551500,8,-81.305100,,"https://maps.google.com/maps/preview/@28.551500,-81.305100,16z",,$1,power, (orlando),seadoo jetski watercraft parts used and new available,https://orlando.craigslist.org/boa/5917515187.html,
36,good,"['28.551500', '-81.305100']",2016-12-20 13:15,Seadoo cover fits 2006 to 2010 gti gti-se original oem seadoo,,5886298141,28.551500,10,-81.305100,,"https://maps.google.com/maps/preview/@28.551500,-81.305100,16z",,$150,power, (ORLANDO),seadoo gti gti-se 2006 2010 jetski cover oem,https://orlando.craigslist.org/boa/5886298141.html,
37,new,"['28.551500', '-81.305100']",2016-12-20 13:15,"REPLACE YOUR WORN OUT CERAMIC CLUTCHES ON YOU SEADOO SUPERCHARGER FOR METAL CLUTCHES BEFORE ANY DAMAGE TO YOUR ENGINE , 200.00 PARTS AND LABOR . Cal for info show contact info .  Many other services for seadoo yamaha kawasaki 2stroke220 and 4 stroke .",,5886299476,28.551500,7,-81.305100,,"https://maps.google.com/maps/preview/@28.551500,-81.305100,16z",,$200,power, (orlando),seadoo 4 stroke jetski rxp rxt supercharger clutches washers replace,https://orlando.craigslist.org/boa/5886299476.html,
38,good,"['28.551500', '-81.305100']",2016-12-20 13:14,Engine bottom end  complete good crank and cases  for yamaha 1200 non pv good conditions.,,5911159377,28.551500,10,-81.305100,,"https://maps.google.com/maps/preview/@28.551500,-81.305100,16z",,$450,power, (orlando),yamaha waverunner jetski 1200 no pv engine bottom end,https://orlando.craigslist.org/boa/5911159377.html,
39,new,"['28.551500', '-81.305100']",2016-12-20 13:14,"Any wear ring for seadoo or yamaha prices from  125.00 replaced parts and labor  also SEADOO  OR YAMAHA SERVICE  MAINTENANCE , INCLUDES , OIL CHANGE , SPARK PLUGS, COMPUTER DIAG , CLEAR MAINTENANCE LIGHT, COMPRESSION CHECK , COMPLETE CHECK OF THE JET SKI . PARTS AND LABOR INCLUDED 180.00 call for details show contact info",,5889499036,28.551500,7,-81.305100,,"https://maps.google.com/maps/preview/@28.551500,-81.305100,16z",,$125,power, (ORLANDO),SEADOO OR YAMAHA  4 STROKE 4 TEC JETSKI WEAR RING SERVICE MAINTENANCE,https://orlando.craigslist.org/boa/5889499036.html,
40,new,"['28.551500', '-81.305100']",2016-12-20 13:13,"Any wear ring for seadoo or yamaha prices from  125.00 replaced parts and labor  also SEADOO  OR YAMAHA SERVICE  MAINTENANCE , INCLUDES , OIL CHANGE , SPARK PLUGS, COMPUTER DIAG , CLEAR MAINTENANCE LIGHT, COMPRESSION CHECK , COMPLETE CHECK OF THE JET SKI . PARTS AND LABOR INCLUDED 180.00 call for details show contact info",,5917516799,28.551500,7,-81.305100,,"https://maps.google.com/maps/preview/@28.551500,-81.305100,16z",,$125,power, (ORLANDO),SEADOO OR YAMAHA  4 STROKE 4 TEC JETSKI WEAR RING SERVICE MAINTENANCE,https://orlando.craigslist.org/boa/5917516799.html,
41,excellent,,2016-12-20 13:06,"This Is A 19FT 2006 TRITON TR186 bass boat fisherman's dream! With 2006 MERCURY OPTIMAX  150HP. 3 NEW batterys. Equipped With A Two aerated live wells. Trolling Motor MotorGuide DIGITAL TOUR 24 volt motor with 70 lbs. TWO LOWRANCE GPS Fishfinder. Single axle Triton Boats trailer. Bow & stern seating. Plenty of rod storage. Is perfect as a home base while floating in the water. Interior and Exterior of boat are in EXCELLENT condition. Nice affordable Boat. Priced fair to sell, please call or text show contact info or show contact info with any questions. No emails. Thanks for looking.",,5890936862,,19,,triton,,tr186,$11800,power, (Orlando),2006 TRITON TR186. With 2006 MERCURY OPTIMAX 150HP. MUST SEE,https://orlando.craigslist.org/boa/5890936862.html,2006
42,,"['28.467100', '-81.241700']",2016-12-20 13:04,Looking to trade my PS4 plus games for a Kayak,,5927010020,28.467100,1,-81.241700,,"https://maps.google.com/maps/preview/@28.467100,-81.241700,16z",,$1,human, (orlando),PS4 TRADE FOR KAYAK,https://orlando.craigslist.org/boa/5927010020.html,
43,good,,2016-12-20 12:57,"waver runner GP 1200      Runs great! with trailer; new rim  tire , clean title. $2000.00",,5924063956,,10,,,,,$2000,power,,Wave runner GP  1200,https://orlando.craigslist.org/boa/5924063956.html,
44,excellent,,2016-12-20 12:44,"14' Southern skiff flat bottom boat ready for water.Has a 2002 25hp/4 stroke Suzuki tiller motor that runs great newer prop,had carb cleaned last year and new impeller.solid bottom/hull.Grab bar with new deck in back,also has large front deck.trailer is in good condition as well with new leaf springs and 2000lb axle.top speed is close to 30mph with two people,and can hold 4 people.call/text 407-287-2five58",,5915266744,,14,,Southern skimmer,,,$3300,power, (East Orlando),Southern Skiff Flats boat,https://orlando.craigslist.org/boa/5915266744.html,
45,,"['25.859400', '-80.272500']",2016-12-20 12:23,"17.6ft hull made by skeeter boats. boat has been fully restored have before and after pictures. everything is new, has all new gauges, wires, pumps, led lights all around, brand new upholstery, 2 bait wells, a cooler, washdown pump, bilge pump, bait pump, a brand new push platform was also added to it and is powered by a 150hp mercury outboard. this boat is running perfect and is ready to hit those beautiful key west flats. for more info call me at show contact info $4,700 obo",,5896766472,25.859400,17,-80.272500,,"https://maps.google.com/maps/preview/@25.859400,-80.272500,16z",,$4700,power, (miami),17.6 Skeeter,https://orlando.craigslist.org/boa/5896766472.html,
46,excellent,"['29.582074', '-81.190973']",2016-12-20 12:14,"* TWIN 8.1L GAS VOLVO PENTA ENGINES, V DRIVE * VERY WELL MAINTAINED, LOW HOURS, ORIGINAL OWNER * LOADED WITH OPTIONS *CUSTOM CANVAS * MOORING COVER * SLEEPS 8 * YOU WON'T FIND A CLEANER BOAT FOR THIS PRICE",300,5926925050,29.582074,37,-81.190973,WELLCRAFT,"https://maps.google.com/maps/preview/@29.582074,-81.190973,16z",MARTINIQUE,$64900,power, (PALM COAST),2003 33 WELLCRAFT MARTINIQUE,https://orlando.craigslist.org/boa/5926925050.html,2003
47,like new,"['27.940800', '-82.242000']",2016-12-20 12:12,Selling my great condition All Stock Yamaha waverunner 2015 FZR with 53 hrs and Yamaha Y.E.S. warranty until 2019. Has continental aluminum trailer included in sale aswell.  call show contact info,53,5890230969,27.940800,11,-82.242000,Yamaha,"https://maps.google.com/maps/preview/@27.940800,-82.242000,16z",FzR,$11500,power, (Tampa),Fzr Yamaha waveruner with Y.E.S. Warranty until May/ 2019,https://orlando.craigslist.org/boa/5890230969.html,2015
48,excellent,,2016-12-20 12:07,"1999 larson 186 with new everything ($3500) spent... Newer trailer with new jack new hubs new tires new winch and more. boat will come with depth/fish finder, stereo,canopy, full cover,safety equipment and trailer. clean title in hand will trade for jet skies,truck,suv or ????? $7500 obo please serious buyers call show contact info",,5919984260,,18,,larson,,186,,power,,SUPER CLEAN BOAT ????? NEW EVERYTHING ????? TAKE A LOOK,https://orlando.craigslist.org/boa/5919984260.html,1999
49,,"['28.898900', '-81.247300']",2016-12-20 11:53,90HP YAMAHA 2 STROKE..YEARLY MAINT JUST DONE...COMPRESSION CHECK  125...125...125.. WATER PUMP..SPARK PLUGS...SEATS ALL IN REAL NICE SHAPE..2 BIMINI TOPS..BOARDING LADDER..STEREO...TRAILER IN GOOD SHAPE ALSO...THIS 90HP PUSHES THIS BOAT REAL GOOD...BOAT/MOTOR AND TRAILER READY TO PLUNK IN WATER... show contact info,,5926874594,28.898900,22,-81.247300,,"https://maps.google.com/maps/preview/@28.898900,-81.247300,16z",,,power,,"CLEAN 2006 22FT SUNCHASER PONTOON BOAT  10,500.00",https://orlando.craigslist.org/boa/5926874594.html,2006
50,,,2016-12-20 11:47,"1997 BAYLINER CABIN CRUISER WITH A 235 EVENDURE MOTOR RUNS GREAT $4000 OBO (make me an offer, I might say yes) TRY ALSO - 3 five-two-2-one-o-nine-3-o-nine",,5922928324,,20,,,,,$4000,power, (OCKLAWAHA),1997 BAYLINER CABIN CRUISER,https://orlando.craigslist.org/boa/5922928324.html,
51,good,[],2016-12-20 11:36,"WE ARE SELLING OUR 2006 (WITH LOW HOURS) FOR ONLY $9,500.00 DUE TO OUR MOVE. PLEASE CALL US AT show contact info WITH NAY QUESTIONS. SERIOUS INQUIRIES ONLY",0,5917464172,,19,,MAXIUM,https://maps.google.com/?q=loc%3A+%31%32%33+ABC+WINDERMERE+FL+US,1800 MX,$9500,power, (WINDERMERE - WINTER GARDEN),"BEAUTIFUL 2006 MAXIUM 1800 MX, MUST SELL!!!",https://orlando.craigslist.org/boa/5917464172.html,
52,like new,"['29.105796', '-81.028032']",2016-12-20 11:34,*********** CHRISTMAS SPECIAL ********* 2015 Gheenoe*2015 Tohatsu Motor *TITLE IN HAND *NEVER BEEN IN SALT WATER * just test driven *ONLY $5000 ACTIVE WARRANTY Call or Text Anytime For Details & more pics show contact info NEED CHRISTMAS MONEY MOTIVATED SELLER!,,5926858781,29.105796,15,-81.028032,,"https://maps.google.com/maps/preview/@29.105796,-81.028032,16z",,$5000,power, (Port Orange FL),2015 Gheenoe*2015 Tohatsu Motor*NEED CHRISTMAS MONEY MOTIVATED SELLER!,https://orlando.craigslist.org/boa/5926858781.html,
53,excellent,[],2016-12-20 11:33,"All white with red accents, this low profile beauty is perfect for barefoot and slalom skiing or just cruising around!  It has a new carb and starter, a tinted screen and a mint 3 blade prop. *CALLS ONLY* PLEASE NO TEXTS OR EMAILS DUE TO SPAM 3five2-2five8-49nine9 outlawmarinefl.com",,5922905508,,19,,Aztec Marine,https://maps.google.com/?q=loc%3A+%33%30%38+state+road+%32%36+Melrose+FL+US,Coyote,$5500,power, (MELROSE),1997 Aztec Coyote w/ 351 Windsor - Classic water Hot Rod,https://orlando.craigslist.org/boa/5922905508.html,1997
54,,,2016-12-20 11:31,Boat trailer winch. In good condition.,,5908478066,,20,,,,,$19,power, (Orlando),Boat Trailer Winch,https://orlando.craigslist.org/boa/5908478066.html,
55,,,2016-12-20 11:30,PWC cover. In good condition. Cosmetic wear only. Was used on a Waverunner but should fit most sit down skis up to 9' in length. Includes storage case.,,5918397233,,9,,,,,$40,power, (Orlando),PWC Cover,https://orlando.craigslist.org/boa/5918397233.html,
56,excellent,"['28.808000', '-81.885800']",2016-12-20 11:16,"SpaceCraft 25 ft Center console off-shore boat for sale,  2006 350 Chevy engine includes Raymarine fish finder,  sonar and satellite chart porter,  split screen display. 100 gallon fuel tank. , new VHF radio and Boss stereo New gumbal bear,  outdrive water pump engine water pump and distributor all new,  trailer included,  asking 6500.00 please call after 4.30 M-F , weekends anytime show contact info Please only contact by Phone,  thank you.",,5926831513,28.808000,25,-81.885800,,"https://maps.google.com/maps/preview/@28.808000,-81.885800,16z",,$6500,power, (Leesburg),SpaceCraft 25 ft,https://orlando.craigslist.org/boa/5926831513.html,2006
57,good,"['28.575400', '-81.395500']",2016-12-20 11:15,"2001 Chaparral 216 SSi 21' Bowrider Boat This is the perfect bowrider for you and your family! Chaparral builds one of the best boats, noted for its styling, appointments and quality. This is just the right boat for your water sports like skiing and tubing! The boat is extremely smooth riding thanks to Chaparral's Deep-V hull.  Plenty of horsepower with the Mercruiser 5.7 EFI Fresh Water Cooled engine with the Mercruiser Alpha 1 drive. It features a comfortable seating layout and will accommodate a small crowd! In dash depth finder, compass, docking lights and user friendly helm area with a full compliment of gauges to monitor all your engine functions. The integrated swim platform comes complete with a boarding ladder and a ski tow eye with grab rail is built into the transom. The package is complete with a tandem axle trailer with 4 new tires and spare mounted to the trailer. This boat is ready for the water!! Engine: -2001 Mercruiser 5.7 EFI -58 Gallon Fuel Tank -Outdrive: Mercruiser Alpha 1 -Trailer: Magictilt Tandem Axle Accessories Included: -Bimini Top in great condition -Snap in carpet in great condition -Bow anchor in storage compartment -Stern Anchor -Boat Cover -4 - 15 ft dock lines -Stern Drive Flush Kit -Automatic Bilge Pump -Dual batteries with Blue Sea Systems Automatic Charging Relay. No more having to switch between batteries!!! All Coast Guard required items: Throw Cushion, 4 Life Jackets, Automatic fire suppression system in engine compartment, fire     extinguisher, whistle Will water test for serious buyers only, $13,000 or best reasonable offer. Not interested in trades. Call/Text (321) Two Seven Seven - Two Zero Nine Six NADA Value with Trailer - $16,320",305,5926807654,28.575400,21,-81.395500,Chaparral,"https://maps.google.com/maps/preview/@28.575400,-81.395500,16z",216 SSi,$13000,power, (Orlando),2001 Chaparral 216 SSi Boat,https://orlando.craigslist.org/boa/5926807654.html,2001
58,good,"['27.741000', '-82.694805']",2016-12-20 11:07,"Price just Reduced. This fully Coast Guard Documented 1978 sloop rigged Irwin citation 39.9' plus her 6' bow sprint has had many updates and upgrades by the knowledgeable owners in the past 4 years and is ready to cruise. Sleeps 6 comfortably. Very fast vessel with her 4'4"" shoal draft she goes well in shallow water and points very well into the wind, also a swing keel fully operational and  professionally refitted with new cable by previous owner.(currently pined for lack of need in the gulf coast waters,but ready to go if needed for blue water sailing)  The wide 12'2"" beam makes it a spacious live aboard or capable cruiser.All of the amenities of home while on the water. If you have done any research on hull design, you already know these 70s models have hand laid fiberglass which provides for superior strength and thickness and for more hull to deck strength well beyond  the newer models.  The transom mounted telescoping swim latter makes for easy dinghy boarding, diving and swimming.The ballast is 6500 lbs. with a displacement of 16,890 lbs. Masthead to waterline is 56 ft.8 inches.Powered by the dependable 3HM35F  Yanmar 34 hp.  30 gal. aluminum fuel tank just inspected,cleaned and fuel polished 11/27/16 with dual fuel filter system, Primary (Top of the line Racor FG 500 with secondary standard Yanmar engine mounted fuel filter).The engine runs like a top,cranks every time,sips fuel at approx 1/2 gal per hr at 2200 rpms. Most desirable compost Head, New portable refrigerator/freezer 11/15/16 with low power draw. 110 volt with shore power or powered by way of marine inverter which powers all AC receptacles when away from shore power, sailing. Inverter power supply are 4 battery, house battery bank, and charged by 400 watts of  solar panels with controller and visible gauges  House batteries 2 New & 2 one yr old, Also a 12 v Ray Marine battery charger on those less sunny days. New 12-volt  cranking battery , group size 31. 50 ft. 30 Amp electric shore power cord, New LED spreader lights 12/1/16. Complete nav. station with battery test indicators, ele breaker panel and  Xentrex battery indicator light gauges with an array of functions. Solar panels mounted over  well insulated hardtop cockpit roof in place of Bimini. All HD aluminum frame work supporting roof. Aluminum propane tank feeds a stainless gas grill stern mounted. Canvas shade covers for every hatch , grab rail,windless,and cockpit wheel.With matching Dodger, side windows and sail covers. Large Genoa on roller furling and all sails in good shape.mast fitted with retractable steps for easy going aloft.Upgraded with large 2 way winches. About 1 yr.new instrumentation in cockpit. (speed, depth and wind indicators) Standard Horizon 175C GPS and chart plotter with slide off cockpit mount. Standard Horizon 150C GPS and chart plotter mounted at nav station, Garmin handheld GPS map 76C,  Standard Horizon Quest VHF radio,spare handheld waterproof VHF.Ray Marine Auto pilot(needs some attention for proper function) am/fm, mp stereo with cabin and cockpit waterproof speakers, Wide screen TV with DVD player. 4 fully charged fire extinguishers with complete up to date coast guard approved safety equipment, HD aluminum frame  davits with block and tackle.All running rigging and standing rigging in good shape.Screens for every hatch,Companion way Door has pins for removal when not needed. Bottom and zincs all in good shape (have professional hull cleaning service dive on boat every month changing zincs when needed with full report.Two burner gimbal stove with oven. Double stainless sinks. Microwave. 6 Gal. marine hot water heater. Settee upholstery in very nice shape matching color scheme of entire vessel. Anchor rode consist of 45 lb. CQR plow anchor, 31'x 3/8s chian with 150' x 3/4"" line. see http://sailboatdata.com/viewrecord.asp?class_id=2433 for additional specs. If interested call Joe at show contact info serious buyers only.",,5917338954,27.741000,40,-82.694805,Irwin,"https://maps.google.com/maps/preview/@27.741000,-82.694805,16z",Citation,$42000,sail, (Gulfport Fl.),Irwin Citation 39.9' Sloop Coast Guard Documented,https://orlando.craigslist.org/boa/5917338954.html,1978
59,good,[],2016-12-20 11:01,"Nice older row boat. Hull has about a 4"" crack that needs repair.  Otherwise in good condition over all. Free deliver between Orlando to Tampa off I4",,5897265191,,12,,Sea King,https://maps.google.com/?q=loc%3A+%31%32%33+Broadway+Blvd+SE+Polk+City+FL+US,,$450,human, (Polk City),12' aluminum boat,https://orlando.craigslist.org/boa/5897265191.html,
60,,"['28.556782', '-81.838703']",2016-12-20 11:00,"We have 10x20 open out side spaces for your rv.camper,boat. 45 a month   ? Larger space up to 40' Call now show contact info",,5902018922,28.556782,26,-81.838703,,"https://maps.google.com/maps/preview/@28.556782,-81.838703,16z",,,human,,RV and Boat Storage,https://orlando.craigslist.org/boa/5902018922.html,
61,excellent,[],2016-12-20 10:49,"2005 24' Vectra 241 powered by a Yamaha 225 4 stroke engine with only 331 hours. Has NEW interior, NEW porti potty, fully serviced, detailed, hydraulic steering, swim platform with ladder, front ladder, bimini top and trailer.",,5909323404,,24,,Vectra,https://maps.google.com/?q=loc%3A+%35%30%30%30+Calienta+St+Hernando+Beach+FL+US,241,$26995,power,,24' Vectra 241,https://orlando.craigslist.org/boa/5909323404.html,2005
62,excellent,[],2016-12-20 10:48,"This 2014 19' Hurricane is powered by a 150 Mercury 4 stroke engine. Newly detailed. Has GPS, stereo, fresh water system, sink, swim ladder - front and back, anchor storage, bimini top and trailer.",,5913403819,,19,,Hurricane,https://maps.google.com/?q=loc%3A+%35%30%30%30+Calienta+St+Hernando+Beach+FL+US,,$24995,power,,19' Hurricane,https://orlando.craigslist.org/boa/5913403819.html,2014
63,good,[],2016-12-20 10:48,"2001 19' Key West 1900 Sportsmen center console powered by a Mercury 125 engine. Has radio, cooler seat, live well, bimini top and trailer.",,5913515217,,19,,Key West,https://maps.google.com/?q=loc%3A+%35%30%30%30+Calienta+St+Hernando+Beach+FL+US,1900 Sportsmen,$10900,power,,19' Key West 1900 Sportsmen,https://orlando.craigslist.org/boa/5913515217.html,2001
64,excellent,[],2016-12-20 10:48,"2013 19' Hurricane 188 bow rider is powered by a Yamaha 150 engine. Newly detailed. Has new bimini top, live well, ski tow bar, front and rear swim ladder and swim platform. Must see!!",,5920326769,,19,,Hurricane,https://maps.google.com/?q=loc%3A+%35%30%30%30+Calienta+St+Hernando+Beach+FL+US,188,$24995,power,,19' Hurricane 188,https://orlando.craigslist.org/boa/5920326769.html,2013
65,good,[],2016-12-20 10:48,"2005 24' Bently 240 fish pontoon powered by a 2016 Mercury 60hp engine with3 year warranty. Has new flooring, new interior, stereo, live well, 2 batteries with switch, bimini top and trailer. Also has new bottom paint.",,5919477058,,24,,Bently,https://maps.google.com/?q=loc%3A+%35%30%30%30+Calienta+St+Hernando+Beach+FL+US,240 Fish,$16500,power,,24' Bently 240 fish,https://orlando.craigslist.org/boa/5919477058.html,2005
66,,,2016-12-20 10:40,I have this beautiful boat for sell. Title in hand. Also come with the trailer. Has radio in there everything has been tuned up. The boat has a mercury motor 4 cyclinder 170 horse power. You can easily do 40 with the boat. Please call me at show contact info,,5926734043,,18,,,,,$5300,power,,1999 bayliner biy vs 19 inch - $5300,https://orlando.craigslist.org/boa/5926734043.html,
67,,,2016-12-20 10:32,"WAVE RUNNER IS LOCATED IN CITRUS COUNTY,FL.Yamaha wave blaster b1 jetski with 1200 cc 3 cylinder conversion.quicker than any supercharged 4 stroke.lots of new parts.fl title.$5000 WITHOUT trailer.CASH,NO TRADES,NO OFFERS,NO TEXTS.double seadoo jet skis trailer available Keywords: waverunner eme rickter SXR 800, Super Jet, Superjet, Sea Doo, Sea-Doo, seadoo, FX1, FX-1, Hydrospace, Jet Ski, Kawasaki, Yamaha, Stand up, Race, X2, X-2, JS550, Sxi 750, SXipro750, sx650, Laser Jet, WaveBlaster, RXP, XP, HX, 3d, Supercharged, Turbo, Honda, RIVA, Performance, Ultra, 1300R, 1200r, GP, 4 stroke, 2 stroke, Wet Bike, Sea Doo HX, SeaDoo, Bombardier, XP, 3D, waveblaster. Aquatrax Waveraider, waveventure, waverunner octane 300 260 255 250x 250 4stroke supercharge supercharged turbo vx gtx gti spi spx x2 X2 X-2 750 1000 blaster fzr vxr fzo vx",,5895054305,,8,,,,,$5000,power, (central fl),Yamaha Wave Blaster 1 jet ski with 1200cc,https://orlando.craigslist.org/boa/5895054305.html,
68,good,,2016-12-20 10:14,15 HP JOHNSON ''SHORT SHAFT' 'CARB CLEANED AND MOTOR RUNNING AND PUMPS WATER''NO GAS TANK OR HOSE'''LOOK AT PRICE'''CALL ME,111,5926738139,,14,,JOHNSON,,JONSON,$475,power, (LONGWOOD),JOHNSON 15 HP''PRIVATE SALE,https://orlando.craigslist.org/boa/5926738139.html,1990
