,condition,coord_pair,date,description,engine hours (total),id,lat,length overall (LOA),long,make / manufacturer,map_URL,model name / number,price,propulsion type,region,title,url,year manufactured
0,good,"['29.966500', '-83.659400']",2016-12-11 16:53,14 ' vhull with deck. WILL SEPARATE OR TRADE . HAVE TITLE. Has trailer  Motor don't run.,,5915271638,29.966500,14,-83.659400,,"https://maps.google.com/maps/preview/@29.966500,-83.659400,16z",,$300,power, (perry),"14' aluminum boat w/deck,motor,",https://tallahassee.craigslist.org/boa/5915271638.html,
1,,"['30.166800', '-83.616000']",2016-12-11 16:05,04 good shape needs new plywood for deck/floor. Has removable duck blind frame. Extended trailer for easy launch. Working lights. Will need a tire soon,,5915231061,30.166800,14,-83.616000,Lowe,"https://maps.google.com/maps/preview/@30.166800,-83.616000,16z",sea nymph,$650,human, (Perry),14' aluminum  sea nymph by lowe,https://tallahassee.craigslist.org/boa/5915231061.html,2004
2,,"['30.447800', '-84.321100']",2016-12-11 14:52,Tea Clipper ship.  Mint condition. 25.00 obo,,5915133380,30.447800,6,-84.321100,,"https://maps.google.com/maps/preview/@30.447800,-84.321100,16z",,$25,human,,tea clipper ship.,https://tallahassee.craigslist.org/boa/5915133380.html,
3,good,,2016-12-11 14:25,21 foot Shamrock keel Drive boat with a 302 Ford pleasure-craft engine aluminum dual axle trailer spare prop spare anchor downrigger and miscellaneous equipment. just had recent carburetor rebuild by reputable mechanic in Crawfordville also some wiring replaced .very good running boat very stable handles rough water like a 25-footer. Anymore questions please call,,5915095300,,21,,Shamrock,,Cuddy cabin,$7000,power, (sopchoppy),Shamrock,https://tallahassee.craigslist.org/boa/5915095300.html,1988
4,good,"['30.465100', '-84.112800']",2016-12-11 14:11,"Very nice 2006 SeaFox 236 CC for sale.  Tandem Axle with new tires.  Mercury Verado 175xl with only 273 hours. Features and Equipment *  Mercury Verado 175xl outboard oil, water pump and maintenance at 259 hours. *  Brand new boat cover *  T-Top (1 year old) *  All vinyl on sitting areas and knee boards replaced 1 year ago. *  New bottom paint March 2015 *  Raw water wash down *  Fresh water wash down (12 gallons) *  101 gallon gas tank *  Hydraulic trim tabs *  Gunwale rod storage *  Front anchor storage *  Large front storage or fish storage box. *  Tilt hydraulic steering *  Dual batteries with switch *  MercMonitor digital gauge *  TBag with 6 life vests *  Raymarine Wi-Fish Chirp Sonar *  Brand New Garmin Striker 7sv Fish finder with CHIRP Sidevu, CHIRP Downvu and CHIRP Sonar (not installed) *  ICOM VHF Radio *  Twin USB charging port Great boat at a great price!",273,5915076222,30.465100,24,-84.112800,Sea Fox,"https://maps.google.com/maps/preview/@30.465100,-84.112800,16z",236 CC,$19500,power,,2006 SeaFox 236 CC For Sale  *MUST GO*,https://tallahassee.craigslist.org/boa/5915076222.html,2006
5,good,,2016-12-11 14:08,"16 foot boat with trailer and 35 force motor, runs but has been sitting got to go $600 OBO call or text show contact info",,5915072319,,16,,,,,$600,power, (Tallahassee Ft Braden),16 ' Boat and Trailer 35 Motor,https://tallahassee.craigslist.org/boa/5915072319.html,
6,fair,"['30.064674', '-84.289727']",2016-12-11 09:52,"1969 Cheoy Lee Luders 30' as is where is 30 minutes outside Tallahassee at Shell Point. Boat has good bones but can use some work. First photos is an example of that make and year boat, not the actual boat. The rest of the photos are actual photos. A great inexpensive boat for someone. Have the title in hand. Contact for exact location etc. $3,500 or OBO",,5875225865,30.064674,30,-84.289727,Cheoy Lee,"https://maps.google.com/maps/preview/@30.064674,-84.289727,16z",Luders,$3500,sail," (Shell Point, FL)",1969 Cheoy Lee Luders 30 ft,https://tallahassee.craigslist.org/boa/5875225865.html,
7,,"['30.064958', '-84.290929']",2016-12-11 09:52,"1969 25' 3"" Catalina Sailboat. Great 1st time or weekend fun boat. Call for directions and info. First photos is just an example of that year and make boat, the rest of the photos are of the actual boat. Or Best Offer",,5875228086,30.064958,25,-84.290929,Catalina,"https://maps.google.com/maps/preview/@30.064958,-84.290929,16z",,$2500,sail," (Shell Point, FL)",1969 25ft 3 in Catalina Sailboat,https://tallahassee.craigslist.org/boa/5875228086.html,1969
8,,"['30.674900', '-85.212200']",2016-12-11 09:51,Want to buy a canoe or Gheenoe in good condition.  From 12' to 17' in length.  Reasonably priced.  Will pay cash.  Call me if you have anything.  See reply.,,5914742540,30.674900,17,-85.212200,,"https://maps.google.com/maps/preview/@30.674900,-85.212200,16z",,,human,,Want to buy canoe or Gheenoe,https://tallahassee.craigslist.org/boa/5914742540.html,
9,,"['29.673900', '-83.372300']",2016-12-11 09:20,"1975 bayliner, 19 foot 4 cylinder Volvo gas in board Volvo pena out drive, very nice trailer, needs work. call show contact info for more info.",,5896478888,29.673900,19,-83.372300,,"https://maps.google.com/maps/preview/@29.673900,-83.372300,16z",,$1800,power," (tennille, fl)",1975 Bayliner,https://tallahassee.craigslist.org/boa/5896478888.html,
10,good,,2016-12-11 09:17,Forsale all or separate,100,5914712149,,14,,Cherokee,,Evinrude,$1600,power, (Tallahassee),14ft riverboat25hp evinrude$1600,https://tallahassee.craigslist.org/boa/5914712149.html,
11,good,,2016-12-11 09:07,$1600,50,5914703350,,14,,Cherokee,,,,power,,Boat. Motor. Trailer. Trolling motor,https://tallahassee.craigslist.org/boa/5914703350.html,
12,good,"['30.593334', '-84.230697']",2016-12-11 08:46,"Selling used 10' John Boat, with Minn Kota 5 speed trolling motor, battery and charger. Boat floats great, motor works wonders. I just don't use it as much as I thought I would. No title on boat; only used on private lakes or without motor.",,5914687558,30.593334,10,-84.230697,,"https://maps.google.com/maps/preview/@30.593334,-84.230697,16z",,$500,human, (Killearn Lakes),"10' John Boat, Electric Trolling Motor, Battery and Charger",https://tallahassee.craigslist.org/boa/5914687558.html,
13,,"['30.210800', '-84.320500']",2016-12-11 07:54,Nice 14' river boat. 35 hp motor.,,5914653938,30.210800,14,-84.320500,,"https://maps.google.com/maps/preview/@30.210800,-84.320500,16z",,$2000,power,,Nice fishing boat,https://tallahassee.craigslist.org/boa/5914653938.html,
14,,,2016-12-11 06:36,"2005 Winnebago Minnie, 31 Ft, Class C, 1 Slide, Sleeps 8, 38500 Miles, AM/FM Radio/CD,Cruise Control,Power Windows,Power Locks,4Burner Stove,3Way Refrigerato/Freezer,Furnace/Gas,Range,Fresh Water Tank 37 gallons,Heated Waste Water Tanks,Water Heater/Gas,Microwave,Dinette/Sofa Slide-out,Electric Hook-Up,Converter/ Time Shades,Battery Discommect,Outside Entertainment Center,Rear Ladder, Vanity,Power/Heated Mirrors,Air-Bags,Oven,Dual Sink,Table/Bed 67""x42"",Sofa/Bed 67""x40"",Rear Bed 75""x60"",Upper Bed 80""x57"",Toilet,Shower,Screen Door&Windows,4000Watt ONAN Generator,Ducted Roof AC,Alu Ruuning Boards,Electric Step,Outside Shower,Trailer Hitch,Awning,CALL show contact info",,5905985951,,31,,,,,$32500,power,,2005 winnebago minnie,https://tallahassee.craigslist.org/boa/5905985951.html,
15,good,,2016-12-10 21:16,"Hi everybody i have a combination of boating fun here....First up is 14ft tri hull fiberglass river\lake boat has two seats and a live well $250 obo smooth on the water. Ive had it a couple miles out of saint marks light house with a 2.5hp nissan motor runs great $375obo ,very solid and imma a bigger guy. Just went on a 24hr river fishing trip with 2 people and at least 400lbs of gear and a generator.possibly have trailer for it.$150firm. No title for either. Second up is a 16.5ft check mate ski boat with trailer and 70hp evinrude. 'my current project' trailer needs lil work..motor runs needs fuel pump, good tilt and trim included..boat needs floor. already started.Title in hand obo 1500 Or $2000 for everything. pics available upon demand.",,5874068282,,16,,,,,,power,,READY TO GO FISHING?,https://tallahassee.craigslist.org/boa/5874068282.html,
16,,,2016-12-10 21:15,"Have a great pontoon boat in good condition all the way around new upholstery, new trailer wiring and boat has just been serviced.. Yamaha 55 outboard. This boat was kept and maintained with care.$4200 obo",,5874067530,,20,,,,,$3500,power, (Tallahassee),1994 Pontoon boat,https://tallahassee.craigslist.org/boa/5874067530.html,
17,excellent,,2016-12-10 21:02,"Minn Kota 12 volt foot control motor, lightly used.  I bought from a gentleman on Craigslist thinking I needed 48 inch shaft when I really needed 36 inch shaft.  Trade for equal 36 inch or $200.  Thanks",,5914360399,,48,,Minn Kota,,All Terrain,$200,power," (Enterprise, Al)",Motor,https://tallahassee.craigslist.org/boa/5914360399.html,
18,like new,,2016-12-10 20:45,25 HP Tohatsu two stroke 15 inch (short) shaft with electric and pull start  This 2004 motor operates and runs as new and is very powerful and quick for its size   Tiller steer,,5914346525,,15,,Tohatsu,,,$2100,power," (Enterprise, Al)",Outboard Motor,https://tallahassee.craigslist.org/boa/5914346525.html,2004
19,good,"['30.194900', '-85.672700']",2016-12-10 16:35,"2014 Ocean Kayak Trident 13 for sale, massive storage inside, easily holds 7-8' rods, gear, fish bags, etc. Color is sand/camo. Lightly used, normal wear from launching/loading. Can deliver within 2hr radius, tally/pensacola areas. Included : Paddle Paddle leash cannon rod holder yakattack mighty mount installed, for visicarbon etc. Crate with 3 rod holders 3lb grapple anchor qty 2 scupper check valve for under seat scuppers Bike lock (lock thru scuppers) and ratchet straps Also have HB Helix 5 DI w/GPS mounted, $999 if you want that, or will sell without. Transducer mounted through transducer scupper",,5914071724,30.194900,13,-85.672700,Ocean Kayak,"https://maps.google.com/maps/preview/@30.194900,-85.672700,16z",Trident,$750,human, (Panama City),Ocean Kayak Trident 13,https://tallahassee.craigslist.org/boa/5914071724.html,2014
20,excellent,,2016-12-10 16:34,"Very nice 2001 Sea Hunt Triton 172 with great running 2001Yamaha 90 2 stroke. Custom t top with rod holders and life vest storage, matching custom leaning post with rod holders and foot rest. Garmin GPS and Garmin color fish finder. Stereo with phone hookup and remote.  Brand new 72 qt cooler with cushion. Dual batteries with switch. Live well, anchor with rope. Folding swim ladder. All gauges, switches and pumps work.  Plenty of storage. Custom canvas full cover.  Sitting on an aluminum Ez Loader trailer in great shape. Awesome family and fishing boat! $7800. 229-five63-7919.",,5905331990,,17,,Sea Hunt,,Triton 172,$7800,power, (Valdosta Ga),Sea Hunt Triton 172 with T top and Yamaha,https://tallahassee.craigslist.org/boa/5905331990.html,2001
21,excellent,"['30.363900', '-84.805400']",2016-12-10 15:39,THIS IS A EASY RIDER 14 FT STICK STEERING WITH FOOT CONTROL MOTOR ALL IN GREAT SHAPE READY TO GO CALL show contact info OR 850 THREE 79 8410 CALL ONLY,1,5910219619,30.363900,14,-84.805400,EASY RIDER,"https://maps.google.com/maps/preview/@30.363900,-84.805400,16z",,$1500,power, (hosford),14 FT EASY RIDER WITH STICK STEERING,https://tallahassee.craigslist.org/boa/5910219619.html,1999
22,good,"['30.605512', '-84.228930']",2016-12-10 15:07,2013 16' Gheenoe Low Tide 25 -15HP Suzuki 4 Stroke Tiller -Lowrance Fish Finder -Custom Poling Platform w/ TBAG -Deck lights and Shark Eye Nav Lights -Magic Tilt Trailer -Minn Kota Trolling Motor,,5899343523,30.605512,16,-84.228930,Gheenoe,"https://maps.google.com/maps/preview/@30.605512,-84.228930,16z",Low Tide 25,$7000,power, (Tallahassee),2013 16' Gheenoe Low Tide 25,https://tallahassee.craigslist.org/boa/5899343523.html,2013
23,like new,"['30.140495', '-84.311056']",2016-12-10 14:41,"Come make me an offer Unique from its offshore cousins, this shallow draft 22' inshore 220 IS is the first model from the Edgewater Power Boats Inshore Series. This top of the line fishing craft has been stored inside and covered since first purchased and the tip-top condition verifies how well this boat has been maintained. Simply put, this boat is beautiful! You will not be disappointed! Equipped with a 2011 Yamaha 250F that is still under warranty for the next 3 years! Get to those hard to reach fishing spots in no time! Listed below is everything that I have on this bad boy. Boat Features: -2011 Aluminum Road King Trailer -8' Power Pole -Atlas Hydraulic Jack Plate with Step -Lenco Trim Tab's -4 LED Deck Lights -Garmin Maps 740 GPS -Stainless Steel Binimi Top -Top of the line Minnkota Trolling Motor -4 Batteries with On-Board Charger (3 Bank) -Clarion CMD6 Radio with 4 Speakers -3 Bait Wells -2 Dry Boxes -2 Rod Boxes (Holding up to 6 Poles) -Command Link Plus -Motor Under Warranty from Yamaha until 8/29/2018 -$49,000.00 This is priced WAY under what it should sell for. Let me know if you have any questions!",,5913850354,30.140495,22,-84.311056,Edgewater,"https://maps.google.com/maps/preview/@30.140495,-84.311056,16z",220 IS,$49000,power, (Crawfordville),NEED GONE Edgewater 22' inshore,https://tallahassee.craigslist.org/boa/5913850354.html,
24,excellent,,2016-12-10 14:05,"This was my dad's boat. He died in June. I am trying to help my mom by selling it. The hull is in excellent condition. However, overall the boat is in good condition, because the seat cushions. They need replacing. We would like to sell it at is, but will work with best offer. There is an outboard motor on the boat but it blew a rod the second time out after getting it checked out by a local boat shop. There are also other electronics on the console. The last I knew they all worked. We have no use for them. Just want it to be enjoyed like my dad did.",0,5913847554,,19,,Century,,1900,$4200,power, (Crawfordville),1998 Century 1900 19' Center Console,https://tallahassee.craigslist.org/boa/5913847554.html,1998
25,like new,[],2016-12-10 13:31,For sale is a 2000 Boston Whaler 23 Conquest with a 2002 Mercury 225 and 2004 tandem axle trailer. This cuddy cabin has plenty of room for those long fishing trips with the crew. Also perfect for your winter fishing trips. This boat is in excellent condition and is waiting to get wet. Stainless Prop Hydraulic Steering Garmin GPSmap 172c Furno Depth Finder Cd Player VHF Trim Tabs Remote Spotlight Windlass Compass Spreader Lights Porta Pottie Insulated Fish Box Livewells (2) Telescoping Ladder Rod holders in Gunnels & Rear Transom Driver Side Windshield Wiper Fresh & Salt Water Wash-down Seat Footrest Storable Rear Bench Seat Hard Top W/ Rocket Launchers & Electronic's Box Side Curtains,,5913794142,,23,,Boston Whaler,https://maps.google.com/?q=loc%3A+%34%38%31%35+Coastal+Hwy+Crawfordville+FL+US,Conquest 23,$24900,power, (Crawfordville),2000 Conquest 23,https://tallahassee.craigslist.org/boa/5913794142.html,2000
26,,"['30.448378', '-84.316978']",2016-12-10 13:15,"Brand New 12ft Sundolphin Kayak. Never been in the water. Has tow behind compartment, fishing rod holder and water tight compartment. First $350 gets it. You must be able to move it.",,5913767769,30.448378,12,-84.316978,,"https://maps.google.com/maps/preview/@30.448378,-84.316978,16z",,$350,human, (TALLAHASSEE),Brand New Kayak 12ft Sundolphin,https://tallahassee.craigslist.org/boa/5913767769.html,
27,like new,,2016-12-10 12:30,"This is an almost new 2015 Wake Pro 215 jet ski.  The price includes a new $1,100 trailer all for the price of $11,950.  It has very low hours  and has been treated with care.  It is 215 HP and very, very fast and is perfect for wakeboarding, water skiers and pulling a raft.  I have more pictures just ask.  I am anxious to sell so only serious buyers please.  I am not a boat dealer !",,5913693491,,12,,Sea Doo,,Wake Pro 215,$11950,power,,2015 Wake Pro 215 Jet Ski,https://tallahassee.craigslist.org/boa/5913693491.html,2015
28,excellent,"['30.357100', '-87.163900']",2016-12-10 11:41,"2000 Sea Ray 290 Sundancer with twin 5.0 efi mercruisers the port engine has 10 hours and the starboard engine has 600 hours. Kholer 6.5 kw generator, 16,000 btu marine air conditioner, dual stove, microwave oven, refrigerator, vac u flush system, full bathroom, interior lighting, interior radio, 37"" flat screen tv with sat system sleep 6 . Outside has GPS system, all gauges, Bluetooth radio and 4 speakers, dual controls, spot light, windlass anchor, ice box and water sink, plenty of sitting, extended swim plat form. trim tabs, bravo 2 outdrives, comes with triple axle trailor magic tilt. Boat is Loaded and Ready to go we use it every weekend. 36,500 OBO.",600,5880261048,30.357100,32,-87.163900,Sea Ray,"https://maps.google.com/maps/preview/@30.357100,-87.163900,16z",Sundancer 290,$36500,power, (gulf breeze),Sea Ray 290,https://tallahassee.craigslist.org/boa/5880261048.html,2000
29,good,[],2016-12-10 10:36,"I have a 1978 13 foot Belle Craft with a Johnson 48 horsepower outboard mounted on back.  This is an Alumn boat with tilt and trim, 2 benches with swivel seats.  This is a good heaver Alumn boat. The motor has a tremendous power mounted on the back of this boat, transom is good, no holes, semi V bottom, steering is in good condition. Call Tom at show contact info $800.00 or best offer. P.S. I work Mon thru Friday an get home just before dark",,5904023927,,13,,Bell Craft,https://maps.google.com/?q=loc%3A+%34%36%35%36+N%2EW%2E+County+rd+%31%37%34+Altha+FL+US,,$800,power, (Altha),1978 13 foot Belle Craft,https://tallahassee.craigslist.org/boa/5904023927.html,1978
30,good,,2016-12-10 10:34,"13ft used canoe with a paddle, Runs straight and smooth, just dont have way to transport anymore.",,5913511276,,13,,,,,$200,human, (Tallahassee),Canoe,https://tallahassee.craigslist.org/boa/5913511276.html,
31,like new,,2016-12-10 10:30,"Fairly new Kayak and paddle, great condition, light weight OBO",,5913505319,,10,,,,,$200,human, (Tallahassee),Fishing Kayak,https://tallahassee.craigslist.org/boa/5913505319.html,
32,,,2016-12-10 10:10,Boat is in good condition no soft spots.  Yamaha f60 is an excellent condition just service at sunshine boats in Tallahassee.eight50eght6eight00eight3,80,5894921373,,16,,,,,$5000,power,,16 foot Cobia center console  Yamaha 60 4-stroke,https://tallahassee.craigslist.org/boa/5894921373.html,1995
33,,[],2016-12-10 09:49,"20' Wellcraft project boat, custom pro-built t-top, no motor, no trailer.  Needs a little TLC.  Would make a great fishing boat.  $1,500 or best offer.  NO emails!",,5913452496,,20,,,https://maps.google.com/?q=loc%3A+Rock+Landing+Rd%2E+Panacea+FL+US,,$1500,human, (Panacea),20 Foot Wellcraft Project Boat,https://tallahassee.craigslist.org/boa/5913452496.html,
34,good,"['30.395206', '-84.298525']",2016-12-10 09:13,"Selling a 19 foot Archer Craft flats boat. Boat is a 1997 with a 98 Mercury 115hp on the back with a hydraulic jack plate. No hours available for the motor but it has been serviced every spring and runs strong. Rebuilt lower unit this past spring as well as brand new throttle cables. Every inch of wiring (including main power and perko switch) has been replaced this past spring, sparing no money on all marine grade components. Aluminum trailer is good shape with new tires. Trailer lights have been replaced this past spring. As you can read a lot of work went into it within the past 6 months. Boat comes with a 2014 lowrance elite 7 GPS/Fish finder with a Southeast Fishing Hotspot's chip, aluminum push pole, canvas cover. It's a 1997 boat so it comes with the wear and tear of the age, but I've treated her well and spared nothing when it needed to be replaced. It has a clean title in hand. Please don't bother with any trades. Price is negotiable but to the right person. I'm selling her at 6500 OBO, I think she's worth every penny. Give me a ring if you want to know more. Thanks (386) 2 eight eight- 7 zero 4 six",,5874984363,30.395206,19,-84.298525,Archer craft,"https://maps.google.com/maps/preview/@30.395206,-84.298525,16z",,$6500,power,,19 foot flats boat,https://tallahassee.craigslist.org/boa/5874984363.html,1997
35,fair,"['28.910200', '-81.523500']",2016-12-10 09:12,Sea Nimph 1991 Pontoon boat 20' Evinrude 48 hp. 2 cycle strong motor TNT new seals no trailer project boat,,5913411379,28.910200,20,-81.523500,Sea nymph,"https://maps.google.com/maps/preview/@28.910200,-81.523500,16z",,$700,power, (Eustis),Pontoon boat,https://tallahassee.craigslist.org/boa/5913411379.html,1991
36,good,[],2016-12-10 07:53,Fabulous fun on land or sea,,5896009499,,8,,"Argos, 6 wheel",https://maps.google.com/?q=loc%3A+%36%30%38+Fulton+Rd+Tallahassee+FL+US,amphibious,$2400,power, (Tallahassee),Land or Sea Argos,https://tallahassee.craigslist.org/boa/5896009499.html,1989
37,,[],2016-12-10 07:53,"2 person kayak or one with camping gear. 2 seats and paddles, very good shape. over $800 new without seats or paddles",,5896001953,,10,,Hobie,https://maps.google.com/?q=loc%3A+%36%30%38+Fulton+Rd+Tallahassee+FL+US,two person,$470,human, (Tallahassee),Hobie 2 person kayak,https://tallahassee.craigslist.org/boa/5896001953.html,2009
38,,"['30.165300', '-85.576300']",2016-12-10 07:24,for sale. 1998 G3 17' aluminum boat no engine. boat great shape no leak. with mini top. trailer no rust. new tires nothing wrong with the boat just need engine. asking $1500 obo call or text 8506282six09. no scammers please,,5887102719,30.165300,17,-85.576300,G3,"https://maps.google.com/maps/preview/@30.165300,-85.576300,16z",,$1500,power, (panamacity),1998 17' G3 aluminum boat with trailer,https://tallahassee.craigslist.org/boa/5887102719.html,1998
39,excellent,,2016-12-10 07:18,"I'm selling my hardly used 1900 Bay Max.  I'm guessing less than 100 hours.  This boat is in excellent condition and I hate to see it go but it doesn't get used enough. Features include the following: 115 Yamaha four stroke engine New Garmin echomap 54DV GPS new VHF radio fish finder stereo No Wood Construction 10-year Transferable Hull Warranty Hand-Laid Fiberglass Hull Foam Flotation Automatic Bilge Pump Navigational Lighting Horn 56 Gallon Built-In Gas Tank Forward Casting deck Rear Casting Deck 2 Aerated Live Wells Insulated Fish Box & Livewells Center Console includes: Plexiglas Windscreen Gauge Panel (Yamaha) Drink Holders Lockable Electronics Box Stainless Steel Rub Rail Stainless Steel Steering Wheel w/knob Stainless Steel Hardware Stainless Steel Bow Rail Stainless Steel Rod Holders Recessed Rod Holders Vertical Rod Holders Trolling Motor Plug Anchor Storage Navigational Lighting Forward Console Seat Boat cover The Price is $16,500 and I don't need help selling and no low ball offers.  No joy rides and all serious offers will be considered.  Thanks for looking.  8 five 0 - three 2 one - 7 zero 9 seven",100,5903441771,,19,,Tidewater,,1900 Bay Max,$16500,power, (Killearn Lakes),2007 Tidewater 1900 Bay Max,https://tallahassee.craigslist.org/boa/5903441771.html,2007
40,,"['30.447800', '-84.321100']",2016-12-10 04:05,Hobie 16 port hull has a soft top has two sets of sails in good condition has a double trapeze and two harnesses.ibe had this boat several years and haven't used it in two. I have other Sailboats and don't make the time anymore for this boat. It has no trailer but I can deliver it to you I'm turning the trailer into a kayak/canoe trailer. Willing to sell whole or part out. Feel free to text or call with any questions.,,5913270629,30.447800,16,-84.321100,Hobie,"https://maps.google.com/maps/preview/@30.447800,-84.321100,16z",Hobie 16,$1,sail, (Tallahassee),Hobie 16,https://tallahassee.craigslist.org/boa/5913270629.html,
41,excellent,"['30.210800', '-84.320500']",2016-12-10 04:00,"1985 Hunter 23 for sale. Boat is in good shape and includes: Good main sail and roller furling jib (both with covers) 6hp Outboard motor- Low Hours! All new wiring Solar charger for battery Interior Cushions in Excellent Shape Boom checker Built in removable cooler Amp and Jack for music/radio.  (This may need some work - I havent really used it) Depth Sounder Emergency Radio LED lighting throughout Solar Fan in V-birth Boat will need a bottom job its about 800$ to have it done (I will deduct this from the price).  I am willing to deliver it almost anywhere; I brought it up from St Pete in April. It is in a private slip located in a gated community.  There is 24 hour access, but no power or water available.  Slip rental is transferable - $125/month $4000 obo Willing to sell with or without motor. I prefer text messages. I dont answer emails unless you send me a phone number. Please leave a message and I will call or text you back.",,5895433940,30.210800,23,-84.320500,hunter,"https://maps.google.com/maps/preview/@30.210800,-84.320500,16z",23,$1,sail," (Shell Point, Fl)",1985 Hunter 23 sailboat,https://tallahassee.craigslist.org/boa/5895433940.html,1985
42,,,2016-12-09 22:00,"12' Johnny B Jon Boat, 30# thrust motor, 2 removable seats, anchor, Clear title. $ 500.00 Firm !  Cash only !  Call / text show contact info",,5913084544,,12,,,,,$500,power, (Quincy),12' Jon Boat,https://tallahassee.craigslist.org/boa/5913084544.html,
43,excellent,"['30.163100', '-84.208300']",2016-12-09 20:58,"This is a beautiful well maintained two owner only classic vessel for more information contact me at 850 6948 707 appointment only Priced at $200,000.00this boat is offered for just under $200,000.00 I have been taking care of this Motor yacht for over 2 years I know it inside and out call Randy for more information I have hundreds of pictures be glad to inform you on anything you need to know about the vessel",1600,5903309821,30.163100,58,-84.208300,Hatteras motor yachts,"https://maps.google.com/maps/preview/@30.163100,-84.208300,16z",Mad Hatter,$199000,power, (St marks),58 ft. Hatteras,https://tallahassee.craigslist.org/boa/5903309821.html,1973
