,condition,coord_pair,date,description,engine hours (total),id,lat,length overall (LOA),long,make / manufacturer,map_URL,model name / number,price,propulsion type,region,title,url,year manufactured
44,,,2016-12-09 20:05,Bennett's Boat Repair & Restoration Transoms Stringers Floors Decks Gelcoat repairs Paint Custom work Pool step restoration Just about anything boat related other than the outboards Call or text show contact info,,5882907927,,100,,,,,,human,,FIBERGLASS REPAIR,https://tallahassee.craigslist.org/boa/5882907927.html,
45,like new,,2016-12-09 19:59,"2004 Seadoo GTX 4 TEC Supercharged with only 76.3 hours with fuel injection.  This has an EXTREMELY CLEAN 4 stroke motor that looks and runs like new, covered at all times and is flawless.  No modifications were ever done to this ski... It's bone stock because stock is fast enough.  The inside of the hull is immaculate/looks like new because there has never been any leaks or issues with the engine or pump.  There are 2 keys: one Learner key that keeps the RPM at 5500 max which equals 35mph and one full power key.  There are a few small nicks from being tied to a dock but only cosmetic. Purchased in 2007 in TN and only run on FRESH WATER.  The hours are low because of deployments and assignment locations while in the Army.  I prepped and stored in shrink wrap from 2008-2014 until my retirement and it fired up the first time after long term storage. This ski is in great condition and must be seen to be appreciated and comes with the cover shown and two neoprene vests.  Knee board and rope were sold separately so not included. Will deliver within reason or meet halfway. Advertised on other sites as well.  Contact me directly at 931-FiveFour2-8onefour4.",76,5877352627,,10,,Seadoo,,GTX 4 TEC,$4200,power, (Panama City),2004 Seadoo GTX Supercharged - 76hrs - FRESH WATER ONLY,https://tallahassee.craigslist.org/boa/5877352627.html,2004
46,,"['31.085500', '-83.682100']",2016-12-09 19:23,"Clean runs great , new hummingbird helix  Gps,sonar ,new vhf radio, CD player ,Bimini top ,boat cover ,new  led lights , live well, cooler seat, alum trailer. Saltwater Mercury 115 . Text only show contact info .do not need help selling.",,5874441860,31.085500,19,-83.682100,,"https://maps.google.com/maps/preview/@31.085500,-83.682100,16z",,$13500,power, (Moultrie),2005 Aquasport 185 center console,https://tallahassee.craigslist.org/boa/5874441860.html,
47,excellent,[],2016-12-09 16:48,"2015 Hobie Oasis Tandem Kayak with Mirage pedal drive includes std. upgraded features on the 2015 models, such as the new Vantage Seats and the GT Mirage drives.  Also includes the Mirage Drive Plugs for paddling, Hobie Gear Bucket, Hobie Paddle, Hobie Fishfinder Kit so you can just plug in a fishfinder (installed wiring, transducer, battery holder and battery - battery may or may not be good, I haven't checked it, plus 4"" YakAttack GearTrac and Ball for mounting fishfinder,) Anchor Trolley, YakAttack 6' Stake Out Pole and a No Limits Satori Stand Up Paddle.  Kayak has typical bottom scratches, but overall is in excellent condition.  These are the best Tandem Kayaks on the market, and are also great solo.  Kayak alone was $3495 new, selling this one for $2850.  No trades, cash only and if this ad is still posted, then it's still for sale.",,5912735412,,14,,Hobie,https://maps.google.com/?q=loc%3A+%33%36%37%37+Slaughter+Rd%2E+PERRY+FL+US,Oasis Tandem,$2850,human," (Perry, FL)",2015 Hobie Oasis Tandem Kayak Pedal Drive,https://tallahassee.craigslist.org/boa/5912735412.html,2015
48,excellent,[],2016-12-09 14:52,Almost new 60 hours on boat and moter It is 18 feet center console 90 hp evinrude Take over payments,60,5912558651,,18,,Carolina skiff,https://maps.google.com/?q=loc%3A+%35%31%34%33+sw+us+%32%32%31+GREENVILLE+FL+US,178 dlv,$23800,power, (Greenville),Carolina skiff,https://tallahassee.craigslist.org/boa/5912558651.html,2015
49,like new,,2016-12-09 14:44,"Check out 2016 Yellow Fin 26 Offshore 28 ft. Twin Yamaha 200's Fiberglass haul with an aluminum gas tank 98 engine hours Plenty of rod holders and extras! 4 tackle centers, large bait wells and fish boxes, rear seating, offshore radio, cupholders, twin outboards... Aluminum Yellow Fin trailer included $139,000.00 OBO",98,5871703935,,28,,Yellow Fin,,26 Offshore,$139000,power,,Beautiful 2016 Yellow Fin 26 Offshore,https://tallahassee.craigslist.org/boa/5871703935.html,2016
50,,,2016-12-09 14:26,"2007 Basstracker 175 Pro Crappie with a 40hp four stroke Mercury and a really nice trailer.  Everything looks and runs great.  This boat is water ready and comes with some extras including a 46lb foot control trolling motor, Bimini top, fishing chairs, fish finder, lots of storage, life vests and safety equipment.  Price $6800 OBO...call show contact info",,5912368911,,18,,,,,$6800,power, (Ocala),2007 Basstracker 175 Pro Crappie,https://tallahassee.craigslist.org/boa/5912368911.html,
51,excellent,"['30.522242', '-84.681819']",2016-12-09 14:24,"99 Auquasport 20ft center console 2004 Mercury Optimax - compression perfect - New power trim - New water pump - New fuel filter and water seperator - New spark plugs - New oil in lower unit - runs perfect. Trailor has new axils, springs, bearings, hubs,  tires & rims. New Lowrance GPS - Fishfinder - bottom machine $700.00. Marine radio / AM-FM CD player. 75 Gallon fuel tank - baitwell fishbox and storage - bimini top. Seatow in place till next year on boat and trailor. Purchased this rig last spring and spared no expense bringing everything back to excellent condition. Have been out 25+ miles several times with no issues. Deep boat handles rough water like a dream. Call show contact info ask for Robert.  Don't have to sell so no lowballers and I don't need help selling it. Asking $8,500 obo or partial trade.",,5899626879,30.522242,20,-84.681819,Auquasport,"https://maps.google.com/maps/preview/@30.522242,-84.681819,16z",,$8500,power, (Quincy),99 Auquasport,https://tallahassee.craigslist.org/boa/5899626879.html,1999
52,,"['30.518500', '-84.262700']",2016-12-09 12:45,"1988 Mako 171 with 1994 Evinrude 112 SPL premix 2 stroke motor.  Boat is mostly stock and does not have a lot of instrumentation. I do have the original compass but did not reinstall it after giving it a new paint job because I never used it.  It could use some new gauges, the ones in it are getting pretty old. I do have a new fuel gauge that I never got around to installing that I will include.  It could use some bottom paint after a few more seasons.  It has a custom Mako logo on the side and the motor has custom ""updated"" graphics on it that I designed. I would also be willing to design and install a name on the boat for free for the buyer. As you can see in the pics there is some paint missing on the foot of the motor, the gray you see is primer and for some reason the paint did not stick to well. The teak wood in the boat looks good but could use refinishing.  My dad and I did a lot of work on the over the years but I am now finding myself using it less and not wanting to do the upkeep that is needed on a boat like this. I would love to see it in the right hands of someone who would appreciate it and be willing to do what is needed to make it just right. The motor runs extremely well and has been serviced at Shields Marina, with records.  It runs about 40 mph and is very efficient on fuel.  Thanks for looking. Mike 85O-59l-l657 Call or text. Can be seen at Shields Marina in St Marks",,5876051708,30.518500,17,-84.262700,,"https://maps.google.com/maps/preview/@30.518500,-84.262700,16z",,$6995,power,,1988 - MAKO - 171,https://tallahassee.craigslist.org/boa/5876051708.html,
53,,"['30.876800', '-84.209100']",2016-12-09 12:41,I have a cobra boat for sale $2000.00 obo runs great willing to trade for something equal value please call show contact info ben,,5895128323,30.876800,15,-84.209100,,"https://maps.google.com/maps/preview/@30.876800,-84.209100,16z",,$2000,power,,Cobra boat,https://tallahassee.craigslist.org/boa/5895128323.html,
54,,"['26.502500', '-81.927600']",2016-12-09 12:11,"I bought this boat at a auction.  The boat is 50 feet long and almost 13 feet wide.  It is on a steel trailer.  The trailer has a flat on one of the tires. It needs a 18 wheeler to move this beast.   The boat was 100 % stripped. It is 100 % aluminum .  It has 4 engine compartments.  It has a 2008 Florida registration still on it.  The boat and trailer will be sold with a bill of sale since it was bought at a auction.  There was a photo of the POPEYES race boat with the file i got. Call me and see if we can make a deal Im asking $15,000... show contact info . Might also look for a good trade text me what you have .... show contact info Jeep motorcycle flats boat harley or something of equal value.....",,5912279964,26.502500,50,-81.927600,,"https://maps.google.com/maps/preview/@26.502500,-81.927600,16z",,$15000,human, (FORT MYERS),50' cougar RACE BOAT Trade Go Fast,https://tallahassee.craigslist.org/boa/5912279964.html,
55,,,2016-12-09 11:57,"THIS IS PRETTY GOOD SIZED FLATS BOAT! BOAT NEEDS A LITTLE TLC AS IT HAS BEEN SITTING BUT THE ENGINE HAS BEEN SERVICED. TRAILER NEEDS SOME TLC AS WELL. 1995 HEWES 20' LIGHT TACKLE FLATS BOAT. 150 MERCURY/MARINER THAT HAS BEEN FULLY SERVICED. CALL OR TEXT AT show contact info ANYTIME ASKING PRICES: WITH ENGINE: $ 14,000 WITHOUT ENGINE: $ 11,500 BOAT IS LOADED OUT WITH POWER POLE, HYDRAULIC STEERING, TROLLING MOTOR, TRIM TABS, LOWRANCE ELECTRONICS, ETC. BOAT HAS BEEN SITTING AND I JUST SERVICED THE ENGINE INCLUDING CARBS, IMPELLER, GEAR OIL, SPARK PLUGS, ANODES, FUEL FILTER, ETC. AS I HAVE THE ENGINE LISTED FOR SALE SEPERATELY.",,5895346996,,20,,,,,,power,,"20 FOOT HEWES LIGHT TACKLE FLATS BOAT, 1995, WITH OR WITHOUT POWER",https://tallahassee.craigslist.org/boa/5895346996.html,1995
56,good,,2016-12-09 10:39,"Motor runs great!  We just started it up this week.  Also, new tires on trailer.  14' Fiberglass boat, 15 horsepower Johnson motor and galvanized trailer for sale.  $2000.00.  Cooler weather means better fishing.  Call today!",,5891830292,,14,,,,,$2000,power,,"Boat, Motor, Trailer -runs great!",https://tallahassee.craigslist.org/boa/5891830292.html,
57,,"['30.357699', '-83.988587']",2016-12-09 10:38,"2006 16' Cobra Bass Boat with stick steering, rebuilt 40hp Johnson outboard and galvanized trailer.  $3,800 OBO.",,5876438801,30.357699,16,-83.988587,,"https://maps.google.com/maps/preview/@30.357699,-83.988587,16z",,$3800,power, (Tallahassee),16' Cobra Bass Boat,https://tallahassee.craigslist.org/boa/5876438801.html,
58,excellent,,2016-12-09 09:29,....I bought this motor from the original ownr who went to a bigger motor....I went out on his boat to test motor....it is in perfect running condition there are some small scratches on the cowling ........any trade must be in like condition...or will sale for $3200.....give me a call anytime....,,5886195635,,20,,,,,$2800,power,,reduced...05 50 hp yamaha 4 stroke,https://tallahassee.craigslist.org/boa/5886195635.html,
59,excellent,,2016-12-09 08:35,"Houseboat - Floating Home - Great Fishing-Beautiful Sunsets-Lake Seminole - 55' by 15.5' plus 4' dock to tie up your fishing boat. $59,000    A true paradise. Fully furnished 2 bedrooms, 1 and ½ baths, shower, flat stove top, oven, refrigerator, wet bar, under counter refrigerator/freezer, sleeper sofa, recliner, dining table, three wall mounted TVs, ceiling fans inside and out on screened porch. Central Heat and Air, plus 12,000 BTU window A/C. Sleeps 6. Energy efficient -- Reflective rubberized roof coating along with mirrored film on windows and doors. Screened porch has an extended 4' dock with rails & boat bumpers. Relax at the beautiful ""Cove"" a gated Houseboat Community located at Trails End Marina and Resort, Donalsonville, GA. Enjoy the Club House, swim in the pool or play pool. Free use of a washer and dryer. Abundant wildlife and waterways to discover both in GA and FL along the Chattahoochee River with great fishing. Only a ten-minute boat ride south on the Chattahoochee River to Lake Seminole. Lake Seminole is a very popular fishing lake. Bass Pro holds tournaments on Lake Seminole. The houseboat is located just off the Chattahoochee River in a protected cove. (The Cove is about 1 hour North West of Tallahassee, FL. or 30 minutes due west of Bainbridge, GA.) We have great fishing for perch, bluegill, sunfish, large mouth bass, hybrid bass, striped bass, catfish, etc. right in front of our houseboat. Lake Seminole is a reservoir located in the southwest corner of Georgia along its border with Florida, maintained by the U.S. Army Corps of Engineers. The Chattahoochee and Flint rivers join in the lake, before flowing from the Jim Woodruff Lock and Dam, which impounds the lake, as the Apalachicola River. The lake contains 37,500 acres of water, and has a shoreline of 376 mi. Appreciate your interest in our houseboat. Please call if you have any questions or for an appointment.",,5871111375,,55,,Harbor Homes,,Savannah,$59000,human," (3371 Ga Hwy 253S Donalsonville, GA)",Undiscovered Paradise - Houseboat -Great Fishing - Lake Seminole,https://tallahassee.craigslist.org/boa/5871111375.html,2008
60,,"['27.738846', '-82.639332']",2016-12-09 06:17,"Beautiful 1980 30' S2 9.2A aft cockpit great sailing boat. She has 6'3 headroom, dual vhf radios, wind generator, auto pilot,garmin 182C, sport dual battery charger, alcohol stove, newer cushions, great running Yanmar 2QM15 15hp diesel, Bimini top with full enclosure with screens, 4'11 draft, main and roller furling jib. SHE IS A FAST SLEEK SAILOR! show contact info phone calls only",,5908342351,27.738846,30,-82.639332,,"https://maps.google.com/maps/preview/@27.738846,-82.639332,16z",,$13900,sail, (St Pete),1980  30' S2  Aft cockpit,https://tallahassee.craigslist.org/boa/5908342351.html,
61,,,2016-12-09 04:03,Minn kota (2) trolling motors  need gone this weekend. 50/Piece 75/both,,5911852374,,1,,,,,$50,power,,Minn Kota (2),https://tallahassee.craigslist.org/boa/5911852374.html,
62,fair,,2016-12-09 00:02,"Selling AS IS....16 ft, 1995 Sea Ray Jet Boat HULL ONLY.  Clear title in hand. Has built in gas tank.  Gauges and switches. Was going to build a gil bracket on it and hang an outboard, would make a good fun boat, but have to may projects going on. I will remove listing when sold. NO.. Motor or pump drive. NO..Trailer  (may help with local delivery) $ 300.00 Will not reply to emails...Not interested in trades....No on pay pal or mail me a check scams! Call/Text 8five0 56seven two7nine1",0,5911757195,,16,,Sea Ray,,F 16,$300,power, (Crawfordville),1995 Sea Ray F 16 Jet Boat * Project*,https://tallahassee.craigslist.org/boa/5911757195.html,1995
63,good,,2016-12-08 21:55,"Selling a nice Hydra Sport split console bay boat boat.  It is a 1993 powered by a 1994 75 horse power yamaha 2 stroke.  Motor runs great and boat rides smooth and dry.  Motor has had the impeller, water pump and lower unit serviced re-sealed (1 year ago).  Also new power tilt and trim assembly and relay for trim.  Trailer is in great shape, newish bunk boards (2 years), new hubs, new leaf springs and just put on new tires. Boat has bilge, speaker system, rod holders, blue LED accent lights, and bimini top.  Captains chair cushions need to be replaced but still feel good.  A great fishing boat that is family friendly for just cruising.  E-mail with any other questions.",,5907237551,,17,,Hydra sport,,,$3600,power, (Tallahassee),16 ft Bay Boat,https://tallahassee.craigslist.org/boa/5907237551.html,1993
64,excellent,"['29.852158', '-84.674377']",2016-12-08 20:59,"1969 Morgan Sloop, Length 25, Beam 8' 3"", Depth 4', Yamaha 8.4 stroke engine. In a slip at the Moorings of Carrabelle in Carrabelle, FL  Recent sails, new sail cover, new engine cover, new life lines, new halyards, etc.",,5911610315,29.852158,25,-84.674377,Morgan Sloop,"https://maps.google.com/maps/preview/@29.852158,-84.674377,16z",,$2700,sail," (Carrabelle, FL)",Morgan Sloop,https://tallahassee.craigslist.org/boa/5911610315.html,1969
65,,"['29.725500', '-85.006300']",2016-12-08 20:54,"Houseboat located on the St. Marks river, branch of the Apalachicola. Hb is 10'x16' sitting on a 12'x18' float with an attached dock of 8'x18'. Floatation is foam block and poly floats. Wired for 120 volts, no indoor plumbing, gas heater, gas stove top, a/c unit, Houseboat does not have to be moved, large cleared picnic area. Houseboat is turnkey, bed, table, chairs, pots and pans if you want them. The houseboat is sitting in a great hog and deer hunting area and all the fish you want. $6500.00 or will consider all offers and trades.",,5911605316,29.725500,18,-85.006300,,"https://maps.google.com/maps/preview/@29.725500,-85.006300,16z",,$6500,human, (Apalachicola),Houseboat,https://tallahassee.craigslist.org/boa/5911605316.html,
66,like new,"['30.487400', '-84.318900']",2016-12-08 20:30,"This mud motor was used  built and used last duck season 5 times. It doesn't even have 10 hrs on it. I need this motor gone. Every works never an issue. I am needing the money to put into my boat. I have a 23 hp go devil now, so I don't have much use for this anymore. Make an Offer. Realistic offers only.",10,5911582083,30.487400,8,-84.318900,,"https://maps.google.com/maps/preview/@30.487400,-84.318900,16z",,,power,,6.5 Predator Long Tail mud motor Need Gone,https://tallahassee.craigslist.org/boa/5911582083.html,
67,good,[],2016-12-08 17:19,"18'-6"" hydra sport boat with evinrude ocean pro 150 and trailer. Runs good just needs throttle cable.",,5911357167,,18,,Hydra sport,https://maps.google.com/?q=loc%3A+%36%30%34%39+richloam+rd+Perry+FL+US,,$4500,power," (Perry, fl)",18' hydra sport,https://tallahassee.craigslist.org/boa/5911357167.html,1993
68,good,,2016-12-08 14:47,Great boat just not used enough. Runs smooth. Nothing wrong with it.,,5911128162,,12,,383 Chrysler,,,$5000,power, (Perry Florida),Air boat,https://tallahassee.craigslist.org/boa/5911128162.html,
69,,,2016-12-08 14:46,All new floors redone interior ect,,5911126618,,19,,,,,$2500,power,,Fiberglass boat,https://tallahassee.craigslist.org/boa/5911126618.html,
70,,[],2016-12-08 14:18,"Athens Marine- Boat Sales & Service ""We Sell Family Fun"" Visit Us At: www.athensmarine.com We service marine engines such as: -Evinrude -Johnson -Some Mercury (Not A Mercury Dealer) -Honda -Yamaha -Suzuki We Sell: - Stingray Boats - Xpress Boats - Manitou Pontoon Boats - SilverWave Pontoon Boats - Evinrude - Suzuki - Yamaha - Honda",,5911036666,,0,,,https://maps.google.com/?q=loc%3A+%31%33%35+Trade+St%2E+Bogart+FL+US,,,power,,Athens Marine - Boat Sales & Service,https://tallahassee.craigslist.org/boa/5911036666.html,
71,,"['30.428600', '-84.259300']",2016-12-08 10:37,"wilderness Systems a Ride 135 kayak, $700, can be seen at Folmars new location, 400 Capital Circle SE , between Auto Zone and Dollar General, across from Tom Brown park, show contact info",,5899638430,30.428600,13,-84.259300,,"https://maps.google.com/maps/preview/@30.428600,-84.259300,16z",,$700,human, (Tallahassee),Wilderness Systems Ride 135,https://tallahassee.craigslist.org/boa/5899638430.html,
72,good,"['30.198776', '-84.178362']",2016-12-08 10:33,good shape with sails and sail covers some electronics. Tiller steering and room for three to four sleeps comfortable. In the Water now. South of newport first boat on the right. Blue and white.,,5910703779,30.198776,23,-84.178362,O'Day,"https://maps.google.com/maps/preview/@30.198776,-84.178362,16z",,$3500,sail, (Newport),23' O'Day sailboat,https://tallahassee.craigslist.org/boa/5910703779.html,1979
73,,"['25.956308', '-81.724123']",2016-12-08 10:18,"2003 Monterey 245 Cruiser One year engine warranty from date of purchase Marine long block only 12 months/unlimited hours for pleasure craft use only. Clear title in hand For more information feel free to call show contact info Payment: direct deposit / cash location: 960 Chalmer Dr. unit 108 Marco island FL 34145 No Trailer 3 Videos: See it run on youtube copy link and drag to your serch eng youtube.com/watch?v=QOgBW9-Jpzk youtube.com/watch?v=cFZwbfOJRZM youtube.com/watch?v=bCnqilZXGAQ&t=17s History of boat. This boat was purchased by us from one of our customers that called us out because the engine would not run. The technician diagnosed that risers and manifolds were not maintained properly and that seawater got into the engine. We replace the engine with a brand-new long block . We made other minor repairs lights, pumps, updated stereo. The boat interior looks as though it has never been used or used very lightly. Here's a list of factory options: Volvo 5.7 GI/DP: 280 HP NEW long block AME 5000 resin Bimini top with boot stainless steel bows with fittings Cockpit cover Cockpit isinglass enclosure Trim tabs Fire suppression system and monitor Extended swim platform with stainless steel ladder AM/FM Bluetooth stereo with repeater in cockpit six-inch speakers NEW Cockpit wet bar with sink and icebox Transom shower with hot and cold water Transom dunnage box Shore power with shore cord and battery charger NEW Galley: microwave oven, AC/DC refrigerator, stove and sink Head: toilet with holding tank and macerator Hot-water heater Inlet water pressure Depth sounder NEW Dual prop stainless steel Spotlight with remote control Power winless road and chain/anchor Trim indicator",,5897370804,25.956308,27,-81.724123,,"https://maps.google.com/maps/preview/@25.956308,-81.724123,16z",,$29500,power, (marco island),"2003 Monterey 245 Cruiser,12 months engine warranty",https://tallahassee.craigslist.org/boa/5897370804.html,
74,,"['30.487400', '-84.318900']",2016-12-08 09:18,"This one owner Mastercraft consignment boat is like new inside and out. It has every option including a V8 engine, folding tower with speakers, Fusion stereo with boarding remote, wakeboard racks, surf system, complete deck pads, upgraded ski pole, full cover, and a trailer. Boat has only 84 hours and under full factory warranty.",,5910602227,30.487400,20,-84.318900,,"https://maps.google.com/maps/preview/@30.487400,-84.318900,16z",,$59904,power, (Tallahassee),2016 Mastercraft NXT 20,https://tallahassee.craigslist.org/boa/5910602227.html,
75,excellent,"['30.188464', '-84.394398']",2016-12-08 08:20,"Mud Buddy Long Tail with the very reliable Honda 6 Horse Motor. This is not a long tail tai kit or some knock off frame. It's a genuine Mud Buddy frame. Built with quality seals and bearings, and durable factory powder coat finish. Thanks for looking!",,5910547075,30.188464,5,-84.394398,Mud Buddy/ Honda,"https://maps.google.com/maps/preview/@30.188464,-84.394398,16z",,$1000,power,,Long Tail Mud Buddy 6 HP Honda,https://tallahassee.craigslist.org/boa/5910547075.html,
76,,"['30.013220', '-84.383240']",2016-12-08 07:39,I have a 77 Hunter on the hook in Dickerson bay for sale. She is very sea worthy. She has been neglected for a while so there is cosmetic work and some fiberglass workvto be done. I have a few sets of good sails. No power. She is a inboard boat but also has o/b bracket. Don't have time to take her on so call or text me to check hervout for yourself. Thanks Steven show contact info I live in Panacea just south if Tallahassee.,,5910518209,30.013220,30,-84.383240,,"https://maps.google.com/maps/preview/@30.013220,-84.383240,16z",,$800,sail, (Panacea),1977 Hunter 30' sailboat,https://tallahassee.craigslist.org/boa/5910518209.html,
77,,"['30.362329', '-87.340794']",2016-12-08 06:29,"Great sailing and live aboard dual marine ac units,dual electric fireplaces,hot shower,2 hanging lockers,full enclosure,great running kubota 24 hp diesel,bottom painted last October many extras. Serious calls only text will be deleted$16,500.",,5886068552,30.362329,40,-87.340794,,"https://maps.google.com/maps/preview/@30.362329,-87.340794,16z",,$16500,sail,,1974 Irwin 32.5 center cockpit cutter,https://tallahassee.craigslist.org/boa/5886068552.html,
78,good,"['30.210800', '-84.320500']",2016-12-08 03:22,"Hull only.  Needs TLC but is solid all around. Solid transom,floor, and stringers. Nothing major need to be done to this  boat.",,5910431943,30.210800,24,-84.320500,Sportcraft,"https://maps.google.com/maps/preview/@30.210800,-84.320500,16z",,$1700,power, (Wakulla),(1991)Sportcraft 24 Walk Around,https://tallahassee.craigslist.org/boa/5910431943.html,1991
79,good,"['30.341769', '-83.074493']",2016-12-07 21:46,"Hobie 18 Ready to Sale Buy It Today - Sail It Today 1979 Hobie 18 in better than average condition for a boat this age. Trailer - good condition with new lights, new tires, wheel beerings just repacked, new winch rope Hulls show typical signs of age with some fading, dings, scratches and repairs. Despite this, the hulls still have a shine to them. 1 set of sails in good condition - 1 jib & 1 main sail with all batons in good shape Jib roller furler Dagger boards Tiller extension rod Trapeze harnesses and attachments - NOTE: needs new trapeze wires",,5910242357,30.341769,18,-83.074493,Hobie Cat,"https://maps.google.com/maps/preview/@30.341769,-83.074493,16z",,$2200,sail, (Live Oak),Hobie Cat 18 Sailboat - Rigged and Ready to Sale,https://tallahassee.craigslist.org/boa/5910242357.html,1979
80,,,2016-12-07 20:25,1980s 15 hp short shaft.  Have two covers. One is unmarked for duck hunting.,,5910162021,,0,,,,,$650,power, (tallahassee),15 hp Evinrude,https://tallahassee.craigslist.org/boa/5910162021.html,
81,,,2016-12-07 18:39,"Excellent condition with less than 100 hours total. Well maintained 200 hp yamaha hpdi 2 stroke. 51 mph top speed. S/S Prop, Power pole, bow mounted trolling motor, maps, depth, nav, 2 live wells. Always under cover. Ranger aluminum trailer. Face to face transactions only. No BS. Private seller. Call or text Ray show contact info",100,5910041496,,22,,Ranger,,Bay 22,$32000,power,,Ranger 22 Price Reduced.,https://tallahassee.craigslist.org/boa/5910041496.html,2008
