,condition,coord_pair,date,description,engine hours (total),id,lat,length overall (LOA),long,make / manufacturer,map_URL,model name / number,price,propulsion type,region,title,url,year manufactured
69,excellent,"['28.699020', '-81.429634']",2016-12-20 10:11,"2006 Tahoe Q8i Ski and Wakeboard Family Boat  in excellent condition. Freshly detailed Boat has original interior in excellent condition and includes an onboard sink. All fluids (synthetic), filters, kept up. Everything works. Sony CD/Radio player with new Sony high output speakers, 600watt amplifier. Has 2 Ultra Deep Cycle (31M) marine batteries with on and off controls. 5.0 Mercruiser Alpha 1 I/O, Bimini Top, Sunbrella custom Boat Cover, Cockpit Cover, Depth finder,  Pressure Water System, Swim Step w/Fold Down Ladder, Forward Entry Ladder, Trim Indicator, Driver and Passenger Captain Seats w/Boosters, L-Shape Rear Seating w/Transom Entry, Ski Locker, Pop Up Cleats; 2006 Tahoe Tandem Axle, Trailer, Custom Wheels and Disc Brakes-Per Axle. Includes Trailer Must See $18950 or OBO",110,5905332423,28.699020,22,-81.429634,Tahoe,"https://maps.google.com/maps/preview/@28.699020,-81.429634,16z",Q8,$18950,power, (Longwood),"2006 Q8 Tahoe excellent condition, Low Hours",https://orlando.craigslist.org/boa/5905332423.html,2006
70,good,,2016-12-20 10:09,"Up for sale a 2003 seadoo gtx supercharged garage keep it all service done. Continental single trailer included. Seadoo, jet ski, watercraft, Yamaha,  sea doo",105,5926600941,,13,,seadoo,,gtx,$3500,power, (kissimmee),2003 seadoo gtx,https://orlando.craigslist.org/boa/5926600941.html,2003
71,,,2016-12-20 10:07,Small Mouse Boat. Originally had a 9.9 now has a 25 Merc. Will run about 30 mph on the water. Comes with trailer. Call Ron for more details. 4 zero 7- 900-9090,,5897336538,,8,,,,,$2195,power, (Apopka),"Christmas Special,  Mouse Boat 8ft",https://orlando.craigslist.org/boa/5897336538.html,
72,like new,,2016-12-20 10:07,"This is a rare Jet kayak. I'm the second owner. First owner never put it in the water. I have only had 2 hrs of time on it. Manual suggests 10 hrs to break it in properly. Also has the upgraded stainless impeller Cost $600 and Rock Grate $100 plus $200 for Boat dealer to install. Call Ron for more info, 4 Zero 7- 900- 9 Zero 9 Zero. Due to the overwhelming calls here is the differences between Surfango and Mokai Surfango is a Fiberglass hull and runs 28 Mph and MSRP is $4,500 Mokai is a Plastic hull and runs 15 Mph and MSRP is $6,500 Surfango is more of a Touring type Kayak where as the Mokai is like a River Rat that you can beat on because of it being Plastic. I hope this has helped. Manufacture Description below, also watch short video at https://www.youtube.com/watch?v=6Fim2KGP0LE The Adventurer GT is Surfango's take on the evolution of the Kayak. Both can be paddled, but that's hardly the point -- fire up the electric-start 9.5hp 4-stroke engine and open the hand-held throttle and you're off like a shot on your way to the 28mph top speed, which will feel very quick indeed when you're sitting low in the waves. The joystick steering is quick and responsive enough to throw you if you're not on your guard. The kayaks feature waterproof storage compartments, fishing rod holders and an on-board digital dashboard telling you your engine RPM, battery level, coolant temperature and a petrol gauge. The 2-gallon fuel tank is enough for two hours at full throttle on either version of the kayak. The Adventurer can be fitted with a skirt to keep the rider's legs reasonably dry in colder climates. The jet pump is fitted with an innovative ""weedcutter"" device to ensure no vegetation gets curled up around the shafts -- so there's no problem with using it in sea-weedy water. The engine has been selected for its smooth, quiet drive so you can take it up a quiet river without making a nuisance of yourself to other campers. Weighing in at around 130 pounds, the Adventurer GT is easy enough to transport and there's an optional beach cart if you need to move it around solo.",2,5917375826,,10,,Surfango,,Adventure,$2495,power, (Apopka),"Christmas Special, Surfango Adventurer GT Jet Kayak",https://orlando.craigslist.org/boa/5917375826.html,
73,good,,2016-12-20 10:06,"2003 bass tracker pro team 17.5 all welded revolution hull 2003 mercury 50 h.p oil injected 2 stroke with tilt and trim that runs great 2006 galvanized trailer trolling motor, humminbird gps fish depth finder, livewell, bimini top not shown in pictures and custom boat cover included all in great shape and everything works $6000 firm. if interested call at 407 4one4 9482",,5926726971,,17,,,,,,power,,pro team 175 bass boat,https://orlando.craigslist.org/boa/5926726971.html,
74,like new,[],2016-12-20 10:03,"REDUCED TO $ 18,500.....2004 Seaswirl Striper 1851 Dual Console with Matching 2004 Dual Axle Trailer with Surge Brakes, Never in Salt Water Boat is from Lake Powell Utah, Transported to Florida and used in Central Florida Lakes Boat and Trailer are Turn Key and Water Ready. Boat Features : Bimini Top Bow Cover Bridge Cockpit Cover On Board Battery Charger Depth Sounder Lowrance Color GPS VHF Ship to Shore Radio w/ Antenna Todd Swivel Seats Rod Storage Gunnels Bait Tank Live Well Storage Tackle Center Transom Live Well w/Aerator Pump Fresh Water Wash Down Dual Batteries on Perko Switch Hydraulic Power Steering Fire Extinguisher Anchor Close Water Cooling System (Antifreeze) Tilt and Trim with Trim Indicator Swim Step with Fold Down Ladder Plenty of Storage. All Switches Pumps Lights and Gauges Function as They Should. Setting on a 2004 DHM Dual Axle Trailer with Surge Brakes Four New Tires and Rims This was made Especially for Seaswirl Boats with Removable Trailer Guides for Cleaning No Rust Good Bearings with a 2"" Ball. Boat is Located in Deland Florida Clear Title in Hand and Registration Call show contact info Thank You.",234,5894162234,,19,,Seaswirl,https://maps.google.com/?q=loc%3A+%34%32%31%30%37+Dogwood+Avenue+Deland+FL+US,Striper 1851 DC,$18500,power, (DELAND),Seaswirl Striper 1851 4.3 Liter Volvo Penta w/Trailer Like New Cond,https://orlando.craigslist.org/boa/5894162234.html,2004
75,,"['28.364800', '-82.675700']",2016-12-20 09:58,"2013 Stingray with Evinrude 135HO with SS  Prop and Warranty, VHF Icom, GPS, Bimini Top , Covers, Fresh Water Shower, Trailer,, Excellent  Condition almost new",,5907636508,28.364800,19,-82.675700,,"https://maps.google.com/maps/preview/@28.364800,-82.675700,16z",,$23000,power," (West Coast, florida)",2013 Stingray 194LX with Evinrude 135HO,https://orlando.craigslist.org/boa/5907636508.html,
76,excellent,"['28.553679', '-81.295716']",2016-12-20 09:53,"I have a boat and trailer for sale. It is for boats 20 foot' long. Good tires and trailer is also in good condition. I have title for it too. Call Hai at show contact info The Boat is at 6721 Heather Rd., Orlando, FL. 32807 The engine is good, have been maintenance for engine $1800 The boat run very good, ready to go 200 hp mercury Or you can trade a (good) small boat that's 16F or 17F- (Must be in Good Condition!) Or we can trade a (good) small boat 16F or 17F - (Remember must be in good condition)",,5919332106,28.553679,20,-81.295716,Horizon,"https://maps.google.com/maps/preview/@28.553679,-81.295716,16z",,$4550,power, (ORLANDO),Aluminum Trailer and Boat,https://orlando.craigslist.org/boa/5919332106.html,1993
77,,"['28.572500', '-81.121900']",2016-12-20 09:52,I have a 1977 17 foot Lucraft-Labray with a 50 horse mercury. This is a project boat with very minimal work to be done. In rear of boat the floor is ripped up just needs 2 pieces of plywood fiberglassed down. Asking 1100 OBO,,5910718653,28.572500,16,-81.121900,,"https://maps.google.com/maps/preview/@28.572500,-81.121900,16z",,$1100,power, (Ucf/orlando),17 foot Lucraft 1977,https://orlando.craigslist.org/boa/5910718653.html,
78,excellent,"['28.751557', '-81.592712']",2016-12-20 09:46,"You won't see another one of these on the water, and if you know what you're looking at, you know this is one of the most dependable little jet boats ever built! Also, it has seating for three, a compartment storage as well as a built in ice chest! It came with a speedometer, tachometer, volt meter, and fuel gauge as well, and it has a stereo with a protective sliding cover. There is a fold up ladder on the back for swimming, or skiing too. The boat is equipped with a bilge blower and bilge pump also. The engine is a 798 CC Suzuki two cylinder two stroke with twin Mikuni carbs, and it provides 450 lbs thrust through the axial flow single stage jet pump, jet drive, with stainless steel impeller! It has forward and reverse. This little boat scoots!  The boat itself is only 12'6"" long x 5'9"" wide, and dry weight is 650 lbs. It has a nice trailer that it came with when new, and it is in great shape. This boat has paper work with it, including repair bills, where work has been done, such as carbs being rebuilt, new steering cable, etc........It fires right up every time, and is very dependable, ready to provide hours of fun, and it sips the gas! It has a 12 gallon gas tank, so one tank will last all day!It also comes with a shop manual with all the part numbers and diagrams of how every thing goes together on the boat! As far as trades, I am into antique vehicles, prefer pre 1972, but may consider an inboard antique boat, or a muscle car, rat rod, hot rod, street rod, semi truck, muscle car, Harley (no Sportsters) but I will consider anything that runs and drives that is street legal, or water ready, However, CASH IS KING !! Lol. Feel free to call, text, or e mail with any questions, or trade pics and a description of your trade. 35two 5five1 seven four92",,5890441379,28.751557,12,-81.592712,Ultranautics,"https://maps.google.com/maps/preview/@28.751557,-81.592712,16z",Jetstar 1250,$3375,power," (Central, Fl)",New Pics!! 1989 Ultranautics Jetstar 1250 Jet Boat Sell or Trade,https://orlando.craigslist.org/boa/5890441379.html,1989
79,good,"['27.373597', '-80.326195']",2016-12-20 09:44,1984 10' Mercury Cougar Cub very rare boat with an 1988 Even rude 25HP. Boat is from Michigan and has not been in salt water before this year. Boat runs about 30 mph and I am 220lbs. Very cool and very fun. will consider trades. Bitcoin payments accepted. here is a video https://www.youtube.com/watch?v=U4fsKy3PSlU,,5898739765,27.373597,10,-80.326195,Cougar,"https://maps.google.com/maps/preview/@27.373597,-80.326195,16z",Cub,$2900,power, (Ft Pierce),Clasic Mercury Cougar Cub Mini Hydro-plane,https://orlando.craigslist.org/boa/5898739765.html,1984
80,,"['28.681513', '-81.351039']",2016-12-20 09:41,"1984 Larson deltaconic with mercruiser 228 SBC 305 with thru hull exhaust. Will be an awesome boat when complete, hull in great shape, just needs a little polish. Boat floor has rotted from sitting too long outside. Perfect time to start and be on the water begining of boat season. At very least a lot of good parts that are not cheap! Stainless steel prop also Asking 600 or best offer. Hate to get rid of it but need the money and space. Comes with trailer. No title at this time but might be found",,5926696532,28.681513,19,-81.351039,,"https://maps.google.com/maps/preview/@28.681513,-81.351039,16z",,$600,power, (Altamonte springs),Cheap project 19ft boat! SBC mercruiser 228 inboard,https://orlando.craigslist.org/boa/5926696532.html,
81,like new,,2016-12-20 09:33,"This brand new boat will be in the keys for use of the owner for his vacation after Christmas to Feb 7 th . He will be leaving the 10 th to head home to Pa..PRICE is REDUCED dramatically so he doesn't have to haul it back . Boat is fully loaded and all factory warranties apply. PRICE includes trailer can be purchased without FOR $3500 less. Take advantage of this great deal if looking for a new boat ! Boat is available no sooner than Feb 7 Boat has: twin 200's,ultima HT, power coated,4 bank charger,colored hull,electric toilet ,g with overboard discharge, Garmin 7610 GPS/fishfinder,back up battery,pro pkg,leaning post w/ dlx seats,under side paint on HT,windlass, VHF radio, SS props, alum. Trailer..",,5926657696,,26,,SEA FOX,,266,$99594,power, (MARATHON),2017 SEA FOX 266 LOADED AT PRICE TO SELL,https://orlando.craigslist.org/boa/5926657696.html,2017
82,,"['28.774000', '-81.643900']",2016-12-20 09:27,"12 foot john boat and trailer I have the title for the boat and bill of sale for the trailer $400 WILL TRADE FOR PRESSURE WASHER CAR DOLLY GENERATOR HOME DEFENCE ATV BLACK/CHROME RIMS 20"" OR BIGGER FOR MARQUIS NICE CAR AUDIO TRAXXAS SLASH  EREVO SUMMIT",,5909539701,28.774000,12,-81.643900,,"https://maps.google.com/maps/preview/@28.774000,-81.643900,16z",,$400,power, (mount dora),12ft Jon boat with trailer,https://orlando.craigslist.org/boa/5909539701.html,
83,like new,"['26.679233', '-80.166321']",2016-12-20 09:26,"Absolutely a """"10"".....2005 Gambler 22' Dual Console loaded to the max...FLAWLESS! 2005 MERCURY 250 Opti-Max XS, low hours......70 mph! Custom Trailer! Garaged kept and with a full cover........as NEW as you can get! Comes with: 2 Lowrance COLOR depth/gps, Stereo, Hot Foot, Hyd Jack Plate, 4 Blade Trophy Plus Prop Trim tabs, 2 Live Wells, HUGE rod storage......FLAWLESS MULTI-COLORED GEL COAT!!....70 MPH!...........ONE OWNER..........Located in West Palm Beach, Fl Minn Kota Fortress, 3 New Batterys, on board charger, Custom tandem axle trailer with MAG wheels MORE, MORE, MORE.......................CLEAR TITLE......NO DISAPPOINTMENTS Only qualified buyers need call, NO tire kickers, this is NOT over described! The best of the BEST! PRICE: $24,500 - will consider reasonable offers..........no low balls SERIOUSLY FOR SALE CALL show contact info only $24,500 including all accessories, sea trial with approved offer and deposit",200,5903458448,26.679233,22,-80.166321,Gambler 22' XS Pro,"https://maps.google.com/maps/preview/@26.679233,-80.166321,16z",CREAM PUFF,$24500,power, (WPB),2005 Gambler 2200DC Bass Boat/250 Opti..loaded to the max..IMMACULATE,https://orlando.craigslist.org/boa/5903458448.html,2005
84,,,2016-12-20 09:25,"Why would you spend Hours or Days trying to clean and wax that Boat, Motorhome or Fifth Wheel if it is fiberglass or gel coat. You need to Poli Glow it yes I said Poli Glow this $75.00 kit will make a world of difference in the looks of you vessel.  See Video Demo www.poliglowproducts.com then come see me for your Poli Glow kit.  Pick your kit up at American Pressure Washer & Detail Supplies Inc. 3038 N John Young Pkwy #19 Orlando FL 32804 show contact info THANKS   BOB",,5906582204,,1,,,,,$75,power, (Orlando),Poli Glow,https://orlando.craigslist.org/boa/5906582204.html,
85,new,[],2016-12-20 09:19,"NEW ARRIVAL! 2016 23' Sylvan Mirage 8522 LZ pontoon powered by a Mercury 150 hp 4 stroke engine. This boat is loaded. USB aux. input, mood lights, Infinity Bluetooth stereo, high back helm chair, RPT's, hydraulic steering, ski tow bar, changing room, bimini top and shark hyde pontoons. This is a must see!",,5909113528,,23,,Sylvan,https://maps.google.com/?q=loc%3A+%35%30%30%30+Calienta+St+Hernando+Beach+FL+US,Mirage 8522LZ,$34950,power,,23' Mirage 8522LZ,https://orlando.craigslist.org/boa/5909113528.html,2016
86,good,[],2016-12-20 09:18,We have the boat for you! This 2001 20' Voyager pontoon has plenty of room. Powered by a Suzuki 50 hp 4 stroke engine. GPS and new stereo w/ 4 speakers.,,5909073330,,20,,Voyager,https://maps.google.com/?q=loc%3A+%35%30%30%30+Calienta+St+Hernando+Beach+FL+US,,$6995,power,,20' Voyager Pontoon,https://orlando.craigslist.org/boa/5909073330.html,2001
87,good,[],2016-12-20 09:18,"2008 16' Carolina Skiff 16JVX powered by a 2007 Yamaha 50. This center console is a clean boat with GPS, compass, live well, trolling motor and trailer. Great for a first boat.",,5913366583,,16,,Carolina Skiff,https://maps.google.com/?q=loc%3A+%35%30%30%30+Calienta+St+Hernando+Beach+FL+US,16 JVX,$9995,power,,16' Carolina Skiff 16 JVX,https://orlando.craigslist.org/boa/5913366583.html,2008
88,,,2016-12-20 09:17,"2 stroke PWC repair specialist. Lowest prices and fast service. We have ethanol proof carb kits! Stainless steel Sea Doo wear rings with life time guarantee. New or used parts for all PWC's. All repairs water tested! We do it right the first time, guaranteed. Over 30 years experience. Please call Patrick at show contact info",,5926648120,,9,,,,,,power,,PWC Service,https://orlando.craigslist.org/boa/5926648120.html,
89,excellent,[],2016-12-20 09:17,"2005 22' Carolina Skiff SeaChaser center console is powered by a 2008 Yamaha 250 4 stroke engine. This boat has everything you need to do some serious fishing! GPS-Garmin, VHF, stereo, T-top, fly by wire shift, hydraulic jack plate, 4 batteries with switch, Minkota 80# thrust trolling motor, bait wells, swim ladder, hydraulic trim tabs, stainless prop, hydraulic steering and trailer.",,5913381642,,22,,Carolina Skiff,https://maps.google.com/?q=loc%3A+%35%30%30%30+Calienta+St+Hernando+Beach+FL+US,SeaChaser,$27500,power,,22' Carolina Skiff SeaChaser,https://orlando.craigslist.org/boa/5913381642.html,2005
90,good,[],2016-12-20 09:17,"1973 22' Hiliner powered by a Mercruiser. This boat is a classic rare model. In great condition. Comes with GPS, VHF, compass, anchor, swim ladder, bimini top and trailer.",,5913409101,,22,,HiLiner,https://maps.google.com/?q=loc%3A+%35%30%30%30+Calienta+St+Hernando+Beach+FL+US,,$4995,power,,22' HiLiner,https://orlando.craigslist.org/boa/5913409101.html,1973
91,good,[],2016-12-20 09:17,"This is a great boat for a first timer.  It is a 2005 16' Key Largo powered by a Yamaha 60 hp engine. Perfect to learn with. Also has a GPS(Hummingbird), compass, radio, live well, bimini top and trailer.",,5902603557,,16,,Key Largo,https://maps.google.com/?q=loc%3A+%35%30%30%30+Calienta+St+Hernando+Beach+FL+US,,$8995,power,,16' Key Largo,https://orlando.craigslist.org/boa/5902603557.html,2005
92,good,[],2016-12-20 09:16,"This is a 2003 19' Larson 190 SEI bowrider. Powered by a Mercury 150 outboard engine. Has fish set up, bimini top, swim ladder and a trailer in great condition.",,5902612938,,19,,Larson,https://maps.google.com/?q=loc%3A+%35%30%30%30+Calienta+St+Hernando+Beach+FL+US,190SEI,$8995,power,,19' Larson 190SEI,https://orlando.craigslist.org/boa/5902612938.html,2003
93,excellent,[],2016-12-20 09:16,"This is a beautiful vessel. Looks almost new! This 2010 Sea Ray is a bow rider powered by a Mercruiser 4.3 TKS. Has Garmin, stereo, wakeboard tower, tow hook, bimini top and trailer.",,5900786164,,18,,Sea Ray,https://maps.google.com/?q=loc%3A+%35%30%30%30+Calienta+St+Hernando+Beach+FL+US,185 Sport,$17500,power,,18' Sea Ray 185 Sport,https://orlando.craigslist.org/boa/5900786164.html,2010
94,good,[],2016-12-20 09:15,"1996 24' Bayliner 2355 Cierra cudy cabin powered by a Mercruiser 5.7 I/O engine.  This boat has lots of nice features like GPS, VHF, stereo, refrig, water heater, fresh water system, stove, microwave, sink manual head, battery charger, hydraulic trim tabs and bimini top. Has new transom and seal, new gimball and boots, all services done and carbs rebuilt.",,5910627805,,24,,Bayliner,https://maps.google.com/?q=loc%3A+%35%30%30%30+Calienta+St+Hernando+Beach+FL+US,2355 Cierra,$8500,power,,24' Bayliner 2355 Cierra,https://orlando.craigslist.org/boa/5910627805.html,1996
95,new,[],2016-12-20 09:15,"NEW ARRIVAL!  2016 23' Sylvan Mirage 8522 LZ powered by a Mercury 150 hp 4 stroke engine.  This boat is loaded. USB aux. input, mood lights, Infinity Bluetooth stereo, high back helm chair, RPT's, hydraulic steering, ski tow bar, changing room, bimini top and shark hyde pontoons. This is a must see!",,5917677435,,23,,Sylvan,https://maps.google.com/?q=loc%3A+%35%30%30%30+Calienta+St+Hernando+Beach+FL+US,Mirage 8522LZ,$34950,power,,23' Mirage 8522LZ,https://orlando.craigslist.org/boa/5917677435.html,2016
96,,,2016-12-20 09:11,Pontoon boats 20' with trailer solid floor no leaks no motor trailer is good just needs finishing (needs runners) comes with rope and anchor Boat has clear Fl title call show contact info or show contact info (no emails or texts),,5926649572,,20,,,,,$900,power, (Mims),PONTOON BOAT 20' with trailer,https://orlando.craigslist.org/boa/5926649572.html,
97,excellent,,2016-12-20 09:07,"Boat in excellent, like-new condition with only 115 hours and always stored on lift under covered dock. Original owner. Volvo Penta 4.3L V6 engine and sterndrive, stainless steel prop, Regal FastTrac hull, bimini top, AM/FM 4-speaker stereo with USB/SD inputs, depth transducer, Raytheon fish finder, porta-potty. Shorelander tandem axle trailer included (recently reconditioned, new brake system, axle hubs, coupler, winch).",115,5910601087,,19,,Regal,,1950 LSC,$9950,power, (Orlando),2001 Regal 1950 LSC Cuddy Cabin,https://orlando.craigslist.org/boa/5910601087.html,2001
98,,"['29.024700', '-80.958400']",2016-12-20 09:07,"Are you into Fishing or do you just want to enjoy the best that Central Florida has to offer? Have you ever wanted to paddle up to Manatees or Dolphins? It is easier than you think. I have been Renting and Selling Canoes and Kayaks for over 10 years. The enduring look of joy on peoples faces when they take an eco tour is amazing. There are many differences between  kayaks and canoes and it is helpful for those who wish to start these water-sports to understand which is which. Before deciding which one you want, have a try in both kayak and canoe and then decide.As an experienced paddler I can show you the differences. We can find the right one for you and have a great time doing it. "" Love Many, Trust a Few, But Always Paddle Your Own Canoe"" Call me today and Lets Get Started. Jay show contact info http://greenways.simdif.com/",,5907571780,29.024700,1,-80.958400,,"https://maps.google.com/maps/preview/@29.024700,-80.958400,16z",,,human,,Kayaks and Canoes for Sale or Rent many to choose from,https://orlando.craigslist.org/boa/5907571780.html,
99,new,,2016-12-20 09:07,I have a Mercury 50 hp that I am Parting out. If you are interested please put Parts in your subject line so I know you are not spam thanks.,,5907571257,,1,,,,,$250,power, (Geneva),Mercury 50 hp Lower Unit and Parts,https://orlando.craigslist.org/boa/5907571257.html,
