,condition,coord_pair,date,description,engine hours (total),id,lat,length overall (LOA),long,make / manufacturer,map_URL,model name / number,price,propulsion type,region,title,url,year manufactured
0,,"['34.106200', '-83.570800']",2016-12-20 19:55,I have a 1993 Bass tracker pro 17 all original. Great condition. Call or txt show contact info,,5927570420,34.106200,17,-83.570800,,"https://maps.google.com/maps/preview/@34.106200,-83.570800,16z",,$5200,power, (Jefferson),1993 Bass Tracker pro 17 aluminum boat,https://athensga.craigslist.org/boa/5927570420.html,
1,like new,"['34.057068', '-83.906708']",2016-12-20 18:15,"This was purchased less than a month ago for duck hunting and only used 3 times. It is listed for $649.99 on Ascend's website (http://www.ascend-kayaks.com/detail.cfm?boatID=4081) which is not including paddle or cart. I am asking $550 for everything because it is practically brand new. Below is a description of each item found on Ascend's website and Bass Pro Shops Website. Ascend FS12T Kayak - Rotomolded, custom-crafted tunnel hull w/wide transom & flared bow sections for excellent durability, standing-and-fishing stability & solid tracking - Recessed bow storage area w/flush-mounted bungees - Flat casting deck w/non-skid foam mat - 10.91"" x 14.84"" (27.71 cm x 37.69 cm) midship hatch - Midship deep molded drink holder/storage & weathertight storage - Port & starboard accessory-mounting rails - Port flush-mounted paddle holders - Deluxe removable, adjustable seating system w/3-position seat landings & adjustable foot braces - Dual flush-mounted rod holders w/rod leash eyelets (leash sold separately) - Large stern tankwell w/D-rings & recessed stern storage area w/flush-mounted bungees - 6 scupper drains throughout w/6 plugs - Bow & stern carrying handles - To create the new 12T, ASCEND® designers took our most-popular sit-on-top model and redesigned it to be even more stable, functional and comfortable. For stability, this features our advanced tunnel design with a wide transom and flared bow sections. It's so stable you can stand up and cast from it. That design also results in solid tracking and easy paddling. Ascend Tournament Kayak Paddle the Ascend® Tournament Kayak Paddle puts lightweight paddling performance in your hands with handy angler-specific features. The Ascend Tournament Kayak Paddle features a lightweight fiberglass shaft with right and left oval hand grips for great control out on the water. 18.2"" x 6.9"" fiberglass-reinforced nylon blades sport a convenient tail-fin lure-recovery hook. Shaft of paddle features a tape measure to measure fish. Feather angle: 60º -0º -60º. Weight: 2.5 lbs. Performance paddle design that's great for kayak anglers Lightweight fiberglass shaft Tape measure along shaft of paddle to easily measure fish Right and left hand oval grips--great control 18.2"" x 6.9"" fiberglass-reinforced nylon blades Convenient tail-fin lure-recovery hook built into blades Feather angle: 60º-0º-60º Ascend Sit On Top Kayak Cart Make the trip from your vehicle to or from the water with your sit on top kayak easier with the Sit On Top Kayak Cart from Ascend™. Made of steel, this cart features a heavy-duty frame with an adjustable-width, twin post design that fits into the scupper holes of your sit on top for secure hauling. Designed to fit a variety of models, the cart also features 10'' inflatable tires with a rugged tread to keep rolling along easily. The Sit On Top Kayak Cart sets up and breaks down quickly and easily for hassle-free transport and storage. Weight: 4 lbs. Dimensions: 21'' x 27.5'' x 11''. Maximum weight capacity: 175 lbs. Easy-to-use cart specially designed for sit on top kayaks Adjustable-width, heavy-duty steel frame - fits a variety of models Intelligent, twin post design fits in kayak's scupper holes for secure hauling 10'' inflatable wheels for easy rolling",,5927463584,34.057068,12,-83.906708,,"https://maps.google.com/maps/preview/@34.057068,-83.906708,16z",,$550,human, (Dacula),Ascend FS12T Sit-on-Top Kayak with tournament paddle and cart,https://athensga.craigslist.org/boa/5927463584.html,
2,,"['34.289700', '-84.179600']",2016-12-20 17:00,Comes with -Johnson 30hp Outboard Motor -Trolling motor -Gas Tank -Trailer (registered),,5927368149,34.289700,17,-84.179600,,"https://maps.google.com/maps/preview/@34.289700,-84.179600,16z",,$2500,power, (Cumming),Jon Boat with Outboard Motor,https://athensga.craigslist.org/boa/5927368149.html,
3,,,2016-12-20 16:48,"10' aluminum boat and motor , boat is not fancy but floats , no leaks , motor is like new , runs perfect ,have 2 padded seats (not installed) i'll throw in 70six8onesix6one75 $350 FIRM!",,5927353280,,10,,,,,,power,,10' jon boat w/ motor,https://athensga.craigslist.org/boa/5927353280.html,
4,excellent,"['34.170800', '-83.275800']",2016-12-20 15:18,Great stable fishing kayak comes with two kayak paddles and life vest and anchor Two flush rod holders and paddle keepers Also dry storage in dash for phone keys etc. Also a Scotty mount rod holder Very few scratches on bottom Call Doug at (706)362 nine four six seven 400 cash or trade for old town next canoe,,5921164498,34.170800,10,-83.275800,,"https://maps.google.com/maps/preview/@34.170800,-83.275800,16z",,$400,human, (Ila GA.),Accend fishing kayak,https://athensga.craigslist.org/boa/5921164498.html,
5,good,"['33.998500', '-83.711500']",2016-12-20 14:48,Fishing out of it all summer nothing wrong with it just time for a bigger one 1800 or obo,,5904736611,33.998500,16,-83.711500,Windstrim,"https://maps.google.com/maps/preview/@33.998500,-83.711500,16z",,$1800,power, (Winder),Boat,https://athensga.craigslist.org/boa/5904736611.html,1975
6,,"['34.088800', '-83.122000']",2016-12-20 13:21,good condition 16ft john boat and Johnson seahorse 4.5hp outboard recently refurbished runs well 800 both or 500 for one cash only open to offers or trades,,5927037139,34.088800,16,-83.122000,,"https://maps.google.com/maps/preview/@34.088800,-83.122000,16z",,,power,,john boat and outboard motor,https://athensga.craigslist.org/boa/5927037139.html,
7,new,[],2016-12-20 10:43,"Come see us at Clemson Marina to buy your new or pre-owned boat today! 2017 Xpress XP180 Bass Boat with a Yamaha F90LA four stroke motor. This is a great all purpose fishing boat and comes with everything you need to get out on the water today. The Hydro-Dynamic hull coupled with the big Yamaha F90 four stroke motor makes this a great riding boat. Quick and smooth on the water. It also comes with an all aluminum BackTrack trailer with upgraded wheels and tires. Please see below for some options that have already been added to the package. Unlike many marine dealers our sales office is ON the water. Take advantage of South Carolina's max sales tax of $300! And most importantly OUR PRICES WON'T BE BEAT!! ADDED OPTIONS: *X Series Sportsmen Package w/ Helix 5 upgrade and MinnKota 70lb Trolling motor *Proseries Console and Steering wheel *Trim on Bow *3 Bank Battery Charger *Stainless Prop *Aluminum Wheel upgrade on the Trailer *Spare Tire Mounting Kit on the Trailer STANDARD FEATURES: *Hydro-Dynamic Hull *Xpress Camo Paint and Xtreme Coat Liner *All Welded Construction *Longitudinal Rib Construction *Unibody Foam Injected Construction *NEW Recessed Throttle Bracket *NEW Rear Deck Storage Boxes *Fold Down Driver & Passenger Seats w/Storage Box *NEW Fiberglass Console & Tinted Windshield *2 Fold Down Fishing Seats w/13"" Extensions *3 Front Deck Seat Bases *Lockable Front Deck Storage *Lockable Side Rod Box *Aerated Livewell in Rear Deck *Bilge Pump *Speed, Fuel, & Tach Gauges *Running Lights *8 Gauge Trolling Motor Harness *BackTrack Single Axle Aluminum Trailer Stock # 10123 See ""more ads by us"" or check out our ever changing inventory at www.clemsonmarinaboatsales.com",0,5926780369,,18,,Xpress,https://maps.google.com/?q=loc%3A+%31%35%30+Clemson+Marina+Dr+Seneca+GA+US,XP180,,power,,2017 Xpress XP180 w/ 90 Yamaha!,https://athensga.craigslist.org/bod/5926780369.html,2017
8,like new,"['34.522600', '-82.896300']",2016-12-19 20:38,hello I have a 4.5 hp mercury original paint and decals has some scratches from setting in the building this motor is a one owner almost no hours has new water pump gear oil carb cleaned new spark plug runs like new shifts perfect the prop is not on the motor in the pics but I do have the prop and is perfect tiller handle in perfect condition has forward neutral and reverse condition as you can see how clean the motor is under the cover very low hours always been kept inside thanks call show contact info 864-556-5898,,5921280939,34.522600,20,-82.896300,,"https://maps.google.com/maps/preview/@34.522600,-82.896300,16z",,$500,power, (townville),4.5 5 hp mercury outboard forward neutral reverse near mint condition,https://athensga.craigslist.org/boa/5921280939.html,
9,,,2016-12-19 17:18,16 foot canoe floats no leaks has had repair work on bottom. Call or text show contact info,,5893693109,,16,,,,,$200,human, (Statham ga),16 ft Mohawk Canoe,https://athensga.craigslist.org/boa/5893693109.html,
10,good,"['33.876900', '-83.896800']",2016-12-19 15:47,"Up for sale is a great multipurpose boat. I have a 1648 Alumacraft that would make a great duck boat, reservoir boat or tackle the big lakes your choice! The boat comes with a very clean and great running 25 horse Mercury that had new impeller and carbs cleaned in March. The boat also has 46 lb thrust trolling motor on the bow as well as two 55's for the rear when you go to the reservoirs. •onboard chargers, bilge with auto float, 4 batteries, HDS 7 on bow and old garmin in the back, paddle, battery trays etc. I even have the lss1 module for sides an but you would need to buy the transducer. More pics to come!!!",,5906790709,33.876900,16,-83.896800,Alumacraft,"https://maps.google.com/maps/preview/@33.876900,-83.896800,16z",1648,$4000,power, (Loganvile),1648 Alumacraft,https://athensga.craigslist.org/boa/5906790709.html,
11,,"['34.088800', '-83.122000']",2016-12-19 12:29,650$ I will include a trolling motor,,5925567275,34.088800,0,-83.122000,,"https://maps.google.com/maps/preview/@34.088800,-83.122000,16z",,$650,power,,Jon boat 12ft V bottom,https://athensga.craigslist.org/boa/5925567275.html,
12,,"['33.926100', '-83.728200']",2016-12-19 09:32,1994 Aquatron 1800. Mercruiser 3.0 Litre 135 HP. Includes the trailer. Engine and outdrive Works Perfect! Tested before sale .Needs interior works . PLEASE NO EMAIL .CALL @ show contact info,,5902133773,33.926100,18,-83.728200,,"https://maps.google.com/maps/preview/@33.926100,-83.728200,16z",,$1100,power,,1994 Aquatron,https://athensga.craigslist.org/boa/5902133773.html,
13,excellent,"['33.529300', '-83.849600']",2016-12-19 06:47,Lowe 14/36 duck hunting. Brand new camo paint job. Trailer is in perfect shape. Electric start 14HP Mud Motor with only 4 hours on. New diamond plate flooring and lots of new storage. Price reduced $3300 OBO,4,5925170077,33.529300,14,-83.849600,Lowe,"https://maps.google.com/maps/preview/@33.529300,-83.849600,16z",14/36,$3300,power, (Coivngton),Lowe 1436 Jon Boat Duck,https://athensga.craigslist.org/boa/5925170077.html,
14,,"['34.168300', '-83.402200']",2016-12-19 02:52,"I have a basstender / bass hound / sun dolphin its a 10ft 2 person jon boat floats great with no leaks or problems. Ive had up to 3 people on the boat at one time me and a buddy at over 200 pounds each and 120 pound women plus gear battery trolling motor etc, so it holds weight very well. The boat comes with 2 seats 2 pedistals a 35 pound thrust trolling motor a good battery 2 oars lights up front and also in the rear, live well battery compartment plugs on front and back to plug in trolling motor and switches to control the aerator on the live well and the front and rear lights. The boat is very nice and in good shape (could use a bath) and questions text or call.",,5925104585,34.168300,10,-83.402200,,"https://maps.google.com/maps/preview/@34.168300,-83.402200,16z",,$650,power," (Commerce, ga)",Bass hound fishing boat,https://athensga.craigslist.org/boa/5925104585.html,
15,excellent,"['34.168300', '-83.402200']",2016-12-19 02:49,I Have over $3500 invested need to sell asap! Motivated seller. $2000 cash takes it. I have for sale a nice 14ft Feather Craft Jon boat. It is a vhull all welded alluminum with no rivets and no leaks. It has been modified for comfortable fishing with a full casting deck up front very stable on the water. It has a nice trailer with good tires all lights and wiring work properly. Theres lots of storage up front with room to put all lifejackets oars ancor tackle etc. It seats 3 people comfortable with 3 chairs theres a rear hand controlled trolling motor on the back and also a larger foot controlled trolling motor on the front both work great it comes with a 20hp 2 stroke mercury motor which runs great with no issues and also comes with a 9.9 horsepower mercury motor that needs a driveshaft and it will be 100 % it has all been freshly serviced and well taken care of and is lake or pond ready also registered until 2018. The boat also comes with 2 batteries a gas tank in the back rod holders led lights between the seats nice lighting up front and rear a bilge pump a fish finder 2 anchors padles 6 pole holders as well as other things. Im asking $2000 for everything obo(was asking 3500) my name is Daryl and my number is under contact info up top. Motivated seller may split motors and boat if you only want the boat and trailor.,,5917435971,34.168300,14,-83.402200,,"https://maps.google.com/maps/preview/@34.168300,-83.402200,16z",,$2000,power," (Commerce, Ga)",Jon boat package,https://athensga.craigslist.org/boa/5917435971.html,
16,,"['34.168300', '-83.402200']",2016-12-19 02:49,"Small light weight 12ft fiberglass jon boat can be carried with 1 too 2 people very light weight and the only 12ft your gonna find with 3 bench seats perfect little boat for 1, 2, or 3 people to go fishing and throw in the back of a pick up truck. Have a few trolling motors, seats and things that can be sold seperatley.",,5922685218,34.168300,12,-83.402200,,"https://maps.google.com/maps/preview/@34.168300,-83.402200,16z",,$350,human," (Commerce, ga)",Lightweight jon boat,https://athensga.craigslist.org/boa/5922685218.html,
17,good,"['33.840907', '-83.488369']",2016-12-18 23:50,26' Crest 3 pontoon 40 hp Johnson Hoosier trailer Call for more info,,5915448428,33.840907,26,-83.488369,Crest 3 pontoon,"https://maps.google.com/maps/preview/@33.840907,-83.488369,16z",Hoosier trailer,$3800,power, (Bishop),Pontoon Boat,https://athensga.craigslist.org/boa/5915448428.html,
18,,"['34.108200', '-82.844800']",2016-12-18 19:10,Great running boat! Runs and starts just fine. Perfect little boat to go on fishing trips on the lake.,,5924801527,34.108200,15,-82.844800,,"https://maps.google.com/maps/preview/@34.108200,-82.844800,16z",,,power,,Bass boat $1500,https://athensga.craigslist.org/boa/5924801527.html,
19,good,[],2016-12-18 16:50,1990 16ft shadow bass boat 80 hrs motor in good shape and runs real good . Comes with tree batterys and two chrome wheels for the trailer. Text me if you have any questions. 706 nine 88 o three three 1.,90,5924650492,,16,,Shadow,https://maps.google.com/?q=loc%3A+%35%30+Edward+street+Bowersville+GA+US,Bassboat,$3000,power, (Hartwell),1990 shadow boat,https://athensga.craigslist.org/boa/5924650492.html,1990
20,,"['34.510093', '-82.930984']",2016-12-18 16:38,"Don't wait till spring for your boat repairs. I am semi retired and take boats now on a first come first serve bases. Former owner of JS Marine and Custom Canvas in Hartwell, GA, so many of you know the quality of my work. I have now moved to Townville, SC, Exit 4 on I 85 North in SC. Just across the GA border. 15 minutes from the Reed Creek area. Still making and repairing marine interiors and boat covers. Quality interiors, bimini tops, enclosures, boat covers and more. Recover outdoor furniture and camper interiors. The phone number is still the same, show contact info Call or text",,5917558017,34.510093,111,-82.930984,,"https://maps.google.com/maps/preview/@34.510093,-82.930984,16z",,$1111111,human," (Townville, SC)",Boat interiors and canvas,https://athensga.craigslist.org/boa/5917558017.html,
21,good,,2016-12-18 10:32,"Good boat no leaks  ,no motor ,we used trolling motor fishing a lot  . As is. It's old and it floats great , interior is decent . Trailer is good , Has both seats,  took them out for more room with 4 year old . 2 built in seats in the back .  Plenty of storage . Current til 2018 . Does the job . Text show contact info $600 Or trade . Guns ,go cart, lawn mower ,green metal roofing, building materials , new tv, tires, trailer, driveway gravel,",,5924174952,,15,,Imperial,,,$600,human, (Toccoa Ga),Imperial boat,https://athensga.craigslist.org/boa/5924174952.html,
22,,,2016-12-18 05:20,"1987 Sumerset Houseboat. 14x60. Aluminum Hull, Two bedroom, one bath, fully furnished, fully equipped. Twin Volvo V-8s. Volvo outdrives. Westerbeke 8 KW Generator. Double Bimini top. show contact info Features: 2 AC/Heat units Ice Machine Full size refrigerator Microwave 47 in flat screen TV New Pioneer Bluetooth audio Wet Bar Interior as well as exterior dining area Queen in Master Queen and Twin bunk in second bedroom Washer/Dryer 200 gal fuel tanks 120 gal water tanks 150 gal waste tanks",650,5923997835,,60,,Sumerset,,Sumerset,$59900,power, (Port Royale Marina. Lake Lanier),Sumerset Houseboat,https://athensga.craigslist.org/boa/5923997835.html,1987
23,,,2016-12-18 05:20,"1987 Sumerset Houseboat. 14x60. Aluminum Hull, Two bedroom, one bath, fully furnished, fully equipped. Twin Volvo V-8s. Volvo outdrives. Westerbeke 8 KW Generator. Double Bimini top. show contact info Features: 2 AC/Heat units Ice Machine Full size refrigerator Microwave 47 in flat screen TV New Pioneer Bluetooth audio Wet Bar Interior as well as exterior dining area Queen in Master Queen and Twin bunk in second bedroom Washer/Dryer 200 gal fuel tanks 120 gal water tanks 150 gal waste tanks",650,5923997682,,60,,Sumerset,,Sumerset,$59900,power, (Port Royale Marina. Lake Lanier),Sumerset Houseboat,https://athensga.craigslist.org/boa/5923997682.html,1987
24,,,2016-12-18 05:19,"1987 Sumerset Houseboat. 14x60. Aluminum Hull, Two bedroom, one bath, fully furnished, fully equipped. Twin Volvo V-8s. Volvo outdrives. Westerbeke 8 KW Generator. Double Bimini top. show contact info Features: 2 AC/Heat units Ice Machine Full size refrigerator Microwave 47 in flat screen TV New Pioneer Bluetooth audio Wet Bar Interior as well as exterior dining area Queen in Master Queen and Twin bunk in second bedroom Washer/Dryer 200 gal fuel tanks 120 gal water tanks 150 gal waste tanks",650,5923997572,,60,,Sumerset,,Sumerset,$59900,power, (Port Royale Marina. Lake Lanier),Sumerset Houseboat,https://athensga.craigslist.org/boa/5923997572.html,1987
25,,,2016-12-17 22:32,"I have a 1986 glastron boat. It has an inboard outdrive motor, runs great! It has radio and speakers, life jackets, lots of storage. Registration is good til April 2017. If interested call show contact info",,5885093934,,16,,,,,$1500,power, (Elberton),Glastron boat,https://athensga.craigslist.org/boa/5885093934.html,
26,good,"['33.406906', '-82.663236']",2016-12-17 14:35,"For sale no trades Willing to talk price Two owners 3.0 L v6 mercruiser engine Brand new starting cables New batteries New trailer hitch attachment Trailer is in good clean condition with working lights Upholstery is good with some signs of wear but for age of boat they are very nice Great on gas mileage Pulls small tunes all the way up to 4 person tunes Pulls ski's, wake boards, knee boards very well. Rides very smooth on water even with tougher conditions. Cooler in passenger seat compartment. Includes: generic orange life jackets if needed. Two single tunes All ropes A pair of skis Any questions please feel free to contact me. I am going to be winterizing very soon. So if you call soon I can start the engine for you without messing up winterization. Call or text of would be preference but you can email if you have too. Thanks Phil L.",,5923282894,33.406906,19,-82.663236,Caravelle,"https://maps.google.com/maps/preview/@33.406906,-82.663236,16z",FS 188,$5200,power, (Warrenton),1998 Caravelle FS 188,https://athensga.craigslist.org/boa/5923282894.html,1998
27,excellent,[],2016-12-17 11:04,"This canoe has been great to me over the years but I no longer use it.  The canoe itself is worth over $1000, but I'd like to sell it with the 3.5hp Nissan outboard motor that I have.  The motor ran great last time I used it, but has been in storage for a while--will need a tune up.  I estimate it probably only has 75hrs on it.  Comes with owners manual.  I bought the motor for almost 1k, so this is a great deal. The canoe is in great shape, all aluminum.  1100# capacity  Comes with 4 nice paddles. Give me a call or text show contact info to set up a time to come look at it.  Make offer. Justin",75,5908628889,,18,,Grumman,https://maps.google.com/?q=loc%3A+Lea+Court+Athens+GA+US,,$1500,power, (Athens),"18"" Grumman Aircraft Company Canoe",https://athensga.craigslist.org/boa/5908628889.html,
28,good,,2016-12-17 09:37,"1987 Grumman Pontoon 22'ft with a 50hp Mercury Outboard. **NO Trailer is offered with purchase of boat. Completely refurbished pontoon with New Carpet, New seats, New Marine Radio AM/FM w/Remote Bluetooth, New horn, all new wiring. New Gas tank & Fuel line. 50hp Mercury 2-stroke, annual service completed w/new spark plugs, new impeller, lower gear oil. Serviced and Lake ready. Aluminum Hard-Top. Boat is currently at dock on Lake Hartwell & may be lake tested. Please call Mike at show contact info to Lake test. ** Private Sale, NO Georgia Tax ** No trades ** No scammers!! ** No soliciting to sell on boat trader! **Serious inquires only PLEASE. Very nice boat, please call or text Mike at show contact info A1 Marine 4450 Gumlog Rd. Lavonia GA 30553 Thank you for viewing this Post.",,5922844771,,22,,Grumman,,Pontoon,$5500,power," (Lake Hartwell, GA)",Grumman Pontoon w/50hp Mercury Outboard,https://athensga.craigslist.org/boa/5922844771.html,1987
29,excellent,"['34.564930', '-83.180151']",2016-12-17 09:29,"2001 GTX Seadoo 1 minute to boat ramp and test ride only if you have the Money to buy!!!!!!!!!! 951cc New (New) Rebuilt New Seadoo Cylinder,Piston Rings Bearings, Gaskets Ski Has 137 hours Yellow and Black Sharp Ski Engine has been correctly broken in and is one of the smoothest Running Skis New Battery Digital Readout Gauges Works, Great Running !!! Come with a great trailer, or If you bring your trailer will discount some gtx seadoo  sea doo gti xp yamaha jetski",137,5922888775,34.564930,10,-83.180151,Seadoo,"https://maps.google.com/maps/preview/@34.564930,-83.180151,16z",GTX,$2800,power, (Toccoa),Great Christmas gift Seadoo GTX 2001  Yellow / Black,https://athensga.craigslist.org/boa/5922888775.html,2001
30,,,2016-12-17 08:49,"Perception Proline whitewater 9 ft kayak, ""Whip it "" model, in good condition. This model was used in Olympic competition years ago (maybe still is) Thick foam side supports around seat and in the body for extra stability and protection. 2 blow up chambers to be used in the front on either side for added bouyancy and a neoprene skirt are included. Will possibly swap for a tandem kayak or canoe or?? Call for more info and photos",,5892727742,,9,,Perception,,ProLine Whip it,$320,human, (NE GA),Perception Pro line whitewater kayak,https://athensga.craigslist.org/boa/5892727742.html,
31,,"['33.312700', '-83.362800']",2016-12-16 15:47,new winch ..new tires..new lights..new wiring ..strong Eng all metal transom..trolling get motor..new battery..runs great and floats with no Leaks..am-fm Sony cd..comes with orrs..life jackets..fire ext..3 live wells .great boat..ready to go,,5922141838,33.312700,17,-83.362800,,"https://maps.google.com/maps/preview/@33.312700,-83.362800,16z",,$2200,power, (Lake Oconee),hurst 17 ft Bass boat 110 jhonson with trailer ready to fish,https://athensga.craigslist.org/boa/5922141838.html,
32,,"['34.307300', '-83.825600']",2016-12-16 13:53,"USED ALUMINUM JON BOAT FOR SALE. INCLUDES DECK BOARDS, BATTERY BOX, MUCHROOM ANCHOR, ADJUSTABLE SWIVEL AND SEAT, & BOAT COVER. SEAT AND SWIVEL LKE NEW. GREAT LITTLE BOAT. CARPETS WILL BE CLEANED BEFORE SOLD. $650.00 OBO",,5916108538,34.307300,14,-83.825600,,"https://maps.google.com/maps/preview/@34.307300,-83.825600,16z",,$650,human, (Gainesville),Used Jon Boat,https://athensga.craigslist.org/boa/5916108538.html,
33,excellent,"['33.941800', '-84.070600']",2016-12-16 11:26,"12ft. jon boat with strong 15hp 2stroke johnson. I don't need help selling, cash only try shooting some offers it doesn't hurt to try show contact info",,5909217435,33.941800,12,-84.070600,sears,"https://maps.google.com/maps/preview/@33.941800,-84.070600,16z",,$2250,power, (lawrenceville),jon boat,https://athensga.craigslist.org/boa/5909217435.html,
34,,,2016-12-16 09:50,V hull Jon boat with 9hp motor on trailer. Comes with trolling motor and battery.,,5921592538,,14,,,,,$1500,power, (Monroe),14 Jon boat with 9hp motor,https://athensga.craigslist.org/boa/5921592538.html,
35,,"['33.788300', '-83.701300']",2016-12-15 23:31,89 bass boat great boat I have had it for 11 years it's been good to me just had the transem replaced on it last year $800  trolling motor iv used it twice 3 good batteries no driver or passenger seat live well works all lights on trailer work  gauges work  except  Mph there is a soft spot in the floor but doesn't seem that bad never really looked at it call or text for any questions cash only,,5916956038,33.788300,18,-83.701300,MerCruiser,"https://maps.google.com/maps/preview/@33.788300,-83.701300,16z",Pro craft,$1800,power,,1989 pro craft bass boat 150 18ft,https://athensga.craigslist.org/boa/5916956038.html,1989
