,condition,coord_pair,date,description,engine hours (total),id,lat,length overall (LOA),long,make / manufacturer,map_URL,model name / number,price,propulsion type,region,title,url,year manufactured
40,,,2016-12-20 15:06,"I will be leaving from St Pete Fl on Dec 23rd and going to Columbus Ohio. Leaving Ohio on Dec 29 back to Fl.  If you have a boat or trailer that needs transported anywhere in between during that time period, give me a call. Special discounts for the Christmas Season. Call or text Mark @ show contact info",,5927206231,,22,,,,,,power,,CHRISTMAS HAULING FROM TAMPA TO COLUMBUS OHIO,https://atlanta.craigslist.org/atl/boa/5927206231.html,
41,,"['34.106000', '-84.511700']",2016-12-20 14:38,"1986 Yamaha 40 HP, long shaft, remote steer. Motor has very little hours on it, oil injection, manual tilt, comes with controls. Needs nothing, come over to hear it run. I will trade it for short shaft 30 or 40 HP. Must be Yamaha or Yamaha made Mariner tiller or remote steer. Otherwise will take $2500.",,5927141024,34.106000,20,-84.511700,,"https://maps.google.com/maps/preview/@34.106000,-84.511700,16z",,,power,,Yamaha outboard motor. Will trade for short shaft.,https://atlanta.craigslist.org/nat/boa/5927141024.html,1986
42,good,"['34.266533', '-83.895251']",2016-12-20 14:32,"1973 Coleman Steel Hull Houseboat/ Engine is a CHRYSLER 440 Rocket that runs great. Potentially, could sleep 6. Living room Bedroom Full Bathroom Sun Deck on It's come a long way, but is still a work in progress. We have really enjoyed it over the last couple years, We just haven't had the time to commit to it that we once thought would. I will post more pics soon",,5927152716,34.266533,42,-83.895251,,"https://maps.google.com/maps/preview/@34.266533,-83.895251,16z",,$4500,power, (Oakwood),42  ft. Coleman HOUSEBOAT /Living Abroad,https://atlanta.craigslist.org/nat/boa/5927152716.html,1973
43,,"['33.862700', '-84.420000']",2016-12-20 14:02,"Selling my Perception Sport sit on top fishing kayak. It is 12.5 ft long and 65 lbs so it can be handled easily by one person. This is a great kayak that tracts well in the water and can get you places regular boats can't. The kayak is only 2 years old and only has about 15 hours of use. Nothing wrong with the boat I am just looking to upgrade to something a little bigger. Also, I have added an outrigger setup to the kayak (see picture) to stabilize the kayak when I stand and fly fish from it. The outrigger setup will be included with the boat as well as the paddle, seats, and anchor. Call or Text with offers or trade for a Gheenoe if possible",,5927103813,33.862700,12,-84.420000,,"https://maps.google.com/maps/preview/@33.862700,-84.420000,16z",,$450,human, (Sandy Springs),Perception Sport Caster 12.5 Kayak for Sale,https://atlanta.craigslist.org/atl/boa/5927103813.html,
44,,"['34.181900', '-83.902400']",2016-12-20 13:43,"1978 Tanzer 7.5 . Located on Lake Lanier in Flowery Branch Ga. has mainsail only No Trailer, no motor.",,5893921434,34.181900,24,-83.902400,,"https://maps.google.com/maps/preview/@34.181900,-83.902400,16z",,$1100,sail, (Flowery Branch),1978 Tanzer 7.5 Sailboat,https://atlanta.craigslist.org/nat/boa/5893921434.html,
45,new,"['33.765500', '-84.646900']",2016-12-20 13:36,-Before the Boat Show Price -310 Horsepower / Supercharged - Intercooled - Cruise Control - Adjustable Trim - Deep V Hull / Very stable high speed boat - 5-way adjustable handle **Financing available / Contact RYAN MULLER show contact info * - Text for faster response,0,5927015645,33.765500,1,-84.646900,Kawasaki,"https://maps.google.com/maps/preview/@33.765500,-84.646900,16z",Ultra 310X,$11500,power, (Lithia Springs),2016 Kawasaki Ultra 310X,https://atlanta.craigslist.org/nat/boa/5927015645.html,2016
46,,"['33.792916', '-84.893895']",2016-12-20 13:34,"EARLY 70's MODEL TED WILLIAMS OUTBOARD MOTOR, ORIGINAL OWNER, STARTED EARLY LAST YEAR, HAVENT TRIED SINCE, NEEDS A NEW HOME COMPRESSION SOUNDS GOOD MAY NEED CARB CLEANED OUT ? unit looks almost new. always stored in side..COME SEE IT...",,5917494239,33.792916,9,-84.893895,,"https://maps.google.com/maps/preview/@33.792916,-84.893895,16z",,$300,power, (VILLA RICA),7.5 HP Ted Williams Outboard Motor,https://atlanta.craigslist.org/wat/boa/5917494239.html,
47,,"['34.106000', '-84.511700']",2016-12-20 13:21,"1976 motor, it has new impeller, carburetor was cleaned, points were resetted and it runs like new now. It is a good little motor, starts effortlessly cold or warm and idles perfect. Please see video on bottom. Asking $750. Comes with gas tank. Video:  https://youtu.be/c-R_tEaYyrU",,5927037066,34.106000,15,-84.511700,,"https://maps.google.com/maps/preview/@34.106000,-84.511700,16z",,$750,power, (woodstock),"Evinrude 9.9 HP, short shaft.",https://atlanta.craigslist.org/nat/boa/5927037066.html,
48,excellent,"['34.075600', '-84.647700']",2016-12-20 13:14,"look look look 1st. $4000 firm best boat on the list after xmas back to $6500 this boat will go up after new years was just used in lil yachty video ""loso boat"" https://www.youtube.com/watch?v=1jkz9bSrnxU This is the BIG SHOW! It gets no better than this. Be the big dawg on the lake and watch all your friends waning to be on your boat not theirs. This is the best 4th of July special on the list! Light up the 4th of July in this awesome Ebbtide Dyna-Trak Fish n Ski Features include: Two working live wells Air filtration system 55lb thrust Motorguide Wireless Trolling Motor Powered with 150 Horses Mercury Black Max Lots of storage Tilt and Trim All gauges working Bilge pump and aerators Special Amenities included as follows: 1200 underwater green leds Three 7in Tvs Tv1 features touchscreen, dvd player, navigation system, usb/sd card reader, tv tuner giving you local broadcast channels Tv2 and Tv3 Mounted in head rest (This strong 150 will always keep someone behind you, give them something to see!) 1500 watt amp powering a massive 12in Bazooka Tube (Knocks like a nightclub!) 900 Remote control LED Lights with 24 different colors and 10 different progressions A convenience table with 300 remote control lights Valid Registration until July 2019, I am the second owner Making this the ultimate boat for recreation and fishing! Pictures taken on Lake Allatoona 12/12/2016 $6750 obo 678-437-50six four show up & show out on the lake. with this one",,5926925973,34.075600,18,-84.647700,ebbtide,"https://maps.google.com/maps/preview/@34.075600,-84.647700,16z",180ss dyna-trak fish & ski,$4000,power, (acworth),1st.$4000 get this 1 of a kind fish & ski used in lil yachty video,https://atlanta.craigslist.org/atl/boa/5926925973.html,
49,like new,"['33.851300', '-84.287000']",2016-12-20 13:10,"this is a 3 year old Carbon Kevlar  Sea//Lake Kayak ""RED"". P&H Flagship boat. Mint Condition has been on the water around 10-12 times only.  Bought it June 2011 for $3850 with taxes . thats an $850 discount for a brand new boat. I must say that i'm not very excited to get rid of this boat but I need the Cash....",,5927019766,33.851300,17,-84.287000,,"https://maps.google.com/maps/preview/@33.851300,-84.287000,16z",,$2800,human, (Midtown),P&H Cetus MV touring Kayak,https://atlanta.craigslist.org/atl/boa/5927019766.html,
50,new,"['33.765500', '-84.646900']",2016-12-20 13:07,-Before the Boat Show Price -310 Horsepower / Supercharged - Intercooled - Cruise Control - Adjustable Trim - Deep V Hull / Very stable high speed boat - 5-way adjustable handle - Full Factory Warranty **Financing available / Contact RYAN MULLER show contact info * - Text for faster response,0,5927013485,33.765500,1,-84.646900,Kawasaki,"https://maps.google.com/maps/preview/@33.765500,-84.646900,16z",Ultra 310X,$11500,power, (Lithia Springs),2016 Kawasaki Ultra 310X,https://atlanta.craigslist.org/wat/boa/5927013485.html,2016
51,,"['34.452800', '-83.113000']",2016-12-20 13:01,1967  needs to be finished all the hard stuff is done needs paint fished carb & gas tank cleaned seats call for details nice easy finish before spring show contact info,,5926980133,34.452800,17,-83.113000,,"https://maps.google.com/maps/preview/@34.452800,-83.113000,16z",,$2800,power, (exit 173 I-85),jetboat,https://atlanta.craigslist.org/eat/boa/5926980133.html,
52,,"['33.467900', '-84.480600']",2016-12-20 12:51,2015 SEADOO SPARK STILL UNDER WARRANTY 3 SEATER 90 HP STARTS RIGHT UP CALL show contact info $4500,,5926988337,33.467900,10,-84.480600,,"https://maps.google.com/maps/preview/@33.467900,-84.480600,16z",,,power,,2015 SEADOO SPARK STILL UNDER WARRANTY,https://atlanta.craigslist.org/wat/boa/5926988337.html,
53,good,"['33.282000', '-83.978400']",2016-12-20 12:35,"I have a27 Fountain I would like to sell .  Stainless Marine headers,msd,Mallory fuel pump and regulator,Bluetooth stereo,2 amps and 4 subs. Carbureted 502 with about 10 hours sense rebuild. I set up for a 871 blower with scoop.",1000,5926947878,33.282000,27,-83.978400,Fountain,"https://maps.google.com/maps/preview/@33.282000,-83.978400,16z",Fever 27,$22000,power, (Jackson Lake),96 Fountain Fever 27,https://atlanta.craigslist.org/atl/boa/5926947878.html,1996
54,,"['34.101579', '-84.494339']",2016-12-20 12:26,Metzeler Inflatable Boat Needs some work. Does inflate and hold air. $300.00 or best offer. Call or text Great parts boat if you already have one show contact info,,5926945291,34.101579,10,-84.494339,,"https://maps.google.com/maps/preview/@34.101579,-84.494339,16z",,$300,human, (Woodstock),Metzeler Inflatable Boat,https://atlanta.craigslist.org/nat/boa/5926945291.html,
55,,"['33.848200', '-84.429300']",2016-12-20 12:17,High Craigslist my name is Dave I am an auto body technician affordable and reliable I can save you a lot of money and most of all a lot of time most of my work is done the same day but all depends on the job too.. okay that being said this is the type of work that I do... I remove and press out and pull out all types of dents.. I do some PDR work that's paintless dent remover.. minor framework back and front.. all types of rust such as surface rust holes.. and minor rust... if your bumper is off track need to be realigned if you have a hole in it scratches or any kind of dent in it I repair it.. I take care of all types of scratches deep surface scratch key scratches.. replace any type of parts doors hoods fenders bumpers headlight tail light. Pretty cheap.. I have a body work license.. that's why I get parts cheaper.. but my work is guaranteed all the material that I use is high quality and paint I use is by-color code.. buy the vehicle for more info you can contact me at. show contact info,,5926878175,33.848200,0,-84.429300,,"https://maps.google.com/maps/preview/@33.848200,-84.429300,16z",,$1,power, (Atlanta),Daves. Mobile auto body work,https://atlanta.craigslist.org/nat/boa/5926878175.html,
56,like new,,2016-12-20 12:09,"Very lightly used 2016 Com-Fab single PWC trailer. I used it about 3 times and put about 60 miles total on it. Bought new in august 2016. Galvanized so no rust to worry about, still under 1 year warranty and kept in carport. Bought a double trailer is why I'm selling. 404-732two-four217 PWC Waverunner comfab jet ski trailer",,5926916614,,14,,Com-Fab,,Trailer,$680,power, (Lawrenceville),2016 Comfab single jet ski trailer,https://atlanta.craigslist.org/atl/boa/5926916614.html,2016
57,,,2016-12-20 12:07,1992        18 ft sea ray 4.3 v6 mercruiser .. Needs ....Carpet .. &  interior  installed .. 2500.00,,5926912876,,18,,,,,$2500,power, (Alto),Sea ray,https://atlanta.craigslist.org/nat/boa/5926912876.html,
58,like new,"['33.841613', '-84.305630']",2016-12-20 12:02,"I have an outboard 7.5hp long shaft boat motor that was recently serviced at Dekalb marine. the pull cord was replaced, water pump replaced and carburetor was cleaned...you get a good motor good for years on small lakes with restrictions! call me 678xx6636928",,5889490430,33.841613,35,-84.305630,mercury,"https://maps.google.com/maps/preview/@33.841613,-84.305630,16z",mercury,$699,power, (Atlanta),outboard motor,https://atlanta.craigslist.org/atl/boa/5889490430.html,
59,,"['33.995100', '-84.654400']",2016-12-20 11:43,"Excellent condition, less than 40 hours. Trailer also included. Get ready to have tons of fun and make some memories with family and friends. Wont last long so jump on this awesome deal! Financing also available with saving you up to 60% off of your scheduled maintenance!! From the Barrage front end to the Battle Prep transom area, Supra's brand-new SA350 is the culmination of everything Supra learned from building boats taken to a whole new level. This Supra has all-new fiberglass floor technology, which allows you to get low-maintenance snap-out carpet, but the construction process means the boat has an unmistakable solid feel in even the roughest water. The bow is as wide and deep as anything we've ever seen, and the SA's wakes are at pro level straight off the showroom floor for both wakeboarding and wakesurfing. Standard features like the Roswell Pro Edge tower, 10-speaker stereo system and the Touch Vision 2 screen mean Supra didn't forget about the luxury amenities you know and love. Beam: 100″ People: 10 Load capacity: 1,400 lb. Fuel: 50 gal. Dry weight: 4,300 lb. Standard ballast: 900 lb. Max ballast: 2,200 lb. Standard engines: Electronic fuel injection 345 HP (SA350), 450 HP (SA450), 550 HP (SA550)",,5926820543,33.995100,22,-84.654400,,"https://maps.google.com/maps/preview/@33.995100,-84.654400,16z",,$70999,power, (kennesaw),2013 Supra SA 350,https://atlanta.craigslist.org/atl/boa/5926820543.html,
60,,"['34.106000', '-84.511700']",2016-12-20 11:41,"I have nice looking motor with very low usage, nothing on it is missing or broken. It starts on first pull cold or warm and purrs like a kitten. Needs no carburetor cleaning or tune up. $1200. For extra $250 I can turn into true 15 HP motor.",,5926870456,34.106000,20,-84.511700,,"https://maps.google.com/maps/preview/@34.106000,-84.511700,16z",,,power,,1997 Johnson 9.9 HP . Long shaft.,https://atlanta.craigslist.org/nat/boa/5926870456.html,
61,like new,"['34.112400', '-83.996500']",2016-12-20 11:30,"Multiport EFI 350 Mag Bravo III Anchor Pull Up Cleats (Forward) Pull Up Cleats (Aft) Rub Rail (Stainless Steel) Swim Platform (Fiberglass) Battery Switch Depth Finder Dual Batteries AM/FM with MP3 Capable CD Player Ipod Adapter Ipod Input Speakers (6) Stereo Amplifier Sub Woofer Tower Speakers (2) Bimini Top Mooring Cover Tandem Axle Trailer with Brakes (Both Axles) Hydraulic Surge Brakes Aluminum Wheels Anchor, And Seadek Lid Covers Shows Like New..  Only 82 Hours",82,5926852671,34.112400,23,-83.996500,Bryant,"https://maps.google.com/maps/preview/@34.112400,-83.996500,16z",233 X,$46500,power, (Buford),2013 Bryant 233 X SweetWater Edition,https://atlanta.craigslist.org/nat/boa/5926852671.html,2013
62,good,"['26.718934', '-80.048275']",2016-12-20 11:28,"O'DAY 23' classic fiberglass sailboat. Terrific cheap live A board or sail Cuba, Bahamas & Key West. Rent to own $500 down $100 week for three months.  TRADE 4 TOYS,   pre 2004 car or truck. Anderia [561] 635 9 four four seven.   pictures   www.palmbeachtidemuseum.com",,5923458473,26.718934,23,-80.048275,o'day,"https://maps.google.com/maps/preview/@26.718934,-80.048275,16z",pop top sailboat,$1400,sail, (palm beach Yacht Club),"O'Day 23 sailboat, LIVE a BOARD",https://atlanta.craigslist.org/atl/boa/5923458473.html,
63,,"['33.265700', '-84.299000']",2016-12-20 11:09,"this trailer is 16 ft long from tip to tip , the frame is 48 in wide, a good winch w/steel cable . this had a 16 ft boat on it. this should carry a 12 to16 jon ft boat with no trouble . this has 12 in tires w/bearing buddies on the axle. lights are almost new and do work. this is also a tilt trailer. every thing is adjustable, bunks, winch, axle. the tires hold air. this is a well built trailer with only surface rust. no serious rust. tow it home , only 250 cash NO TEXTS calls only 678--572--7 4 3 6,,,,,, NO TEXTS 9 am to 9 pm only please ONLY $ 250 CASH",,5926820176,33.265700,16,-84.299000,,"https://maps.google.com/maps/preview/@33.265700,-84.299000,16z",,$250,power, (GRIFFIN  GA),JON  BOAT  TRAILER,https://atlanta.craigslist.org/sat/boa/5926820176.html,
64,good,,2016-12-20 11:06,"I have a 1969 House Boat 35ft in length that I am selling or trade. Has an outboard motor that works along with all hook ups for slip and is current on permit stickers. Has bunk beds, gas hook ups for for heat, kitchen and toilet. Lounge area and front covered porch, pine cabinets and plenty of room. It is on my goose neck trailer that does not come with it but once purchased able to transport it to new location. Bad has a quarter size hole on rear but it is steel bottom so easy to fix. While out of water could use new fresh coat of marine sealent on the steel bottom. I am selling it for $2000 OBO or possible trade. Make an offer or send me what u have for trade at show contact info name is Jonathan.",,5919663462,,35,,,,,$2000,power, (snellville),1969 House Boat 35ft,https://atlanta.craigslist.org/eat/boa/5919663462.html,1969
65,good,"['33.282000', '-83.978400']",2016-12-20 11:00,"27 foot tri toon with yamaha 250SHO with ss prop,",150,5904909931,33.282000,27,-83.978400,tahoe,"https://maps.google.com/maps/preview/@33.282000,-83.978400,16z",deco,$25000,power,,27 Tahoe tri toon with hp kit,https://atlanta.craigslist.org/atl/boa/5904909931.html,
66,good,"['33.282000', '-83.978400']",2016-12-20 10:59,"pontoon has new vinyl floor and runs good, needs to be finished up with seats and its ready for a great summer.",,5920523677,33.282000,20,-83.978400,Princecraft,"https://maps.google.com/maps/preview/@33.282000,-83.978400,16z",Vectra 200,$3000,power,,20 ft Princecraft Vectra/70 hp,https://atlanta.craigslist.org/atl/boa/5920523677.html,2000
67,good,"['33.282000', '-83.978400']",2016-12-20 10:59,"1998 Yamaha GP 800, runs great and looks good,",,5920531473,33.282000,11,-83.978400,Yamaha,"https://maps.google.com/maps/preview/@33.282000,-83.978400,16z",GP 800,$3000,power,,1998 Yamaha GP 800 w/ trailer,https://atlanta.craigslist.org/atl/boa/5920531473.html,1998
68,good,"['33.282000', '-83.978400']",2016-12-20 10:59,"Yamaha XLT 1200 with new motor with 0 hours, new seat cover  and trailer.",,5920542196,33.282000,11,-83.978400,yamaha,"https://maps.google.com/maps/preview/@33.282000,-83.978400,16z",XLT 1200,$5000,power,,2005 Yamaha XLT 1200,https://atlanta.craigslist.org/atl/boa/5920542196.html,2005
69,new,"['33.282000', '-83.978400']",2016-12-20 10:59,"This is a brand new left over from 08, get this for a steal at this price",,5920553264,33.282000,0,-83.978400,honda,"https://maps.google.com/maps/preview/@33.282000,-83.978400,16z",9.9 4stk,$2500,power,,Honda 9.9 20 in shaft 4 stk new,https://atlanta.craigslist.org/atl/boa/5920553264.html,2008
70,,"['34.106000', '-84.511700']",2016-12-20 10:56,"Nice boat, 2010, 48"" wide bottom, live well, front and back Cree lights bars controlled from the back, duck blinds. Motor is perfectly running 1990 Evinrude 15 HP, short shaft with pull start and you can see it running in video on very bottom of this ad. Boat sits on very nice trailer and comes with 55lb transom mount trolling motor and deep cycle battery. Boat and trailer registered. Asking $3700. Will separate. Boat with no Evinrude motor -$2800. Motor - $1200. Video:   https://youtu.be/JBugkFGrMeU",,5926760800,34.106000,16,-84.511700,,"https://maps.google.com/maps/preview/@34.106000,-84.511700,16z",,,power,,"16' Alumacraft with duck blinds, motor & trailer.",https://atlanta.craigslist.org/nat/boa/5926760800.html,
71,,,2016-12-20 10:52,"I will be leaving from St Pete Fl on Dec 23rd and going to Columbus Ohio. Leaving Ohio on Dec 29 back to Fl.  If you have a boat or trailer that needs transported anywhere in between during that time period, give me a call. Special discounts for the Christmas Season. Call or text Mark @ show contact info",,5926793843,,22,,,,,,power,,CHRISTMAS HAULING FROM TAMPA TO COLUMBUS OHIO,https://atlanta.craigslist.org/atl/boa/5926793843.html,
72,,"['34.958800', '-83.868800']",2016-12-20 10:37,Fresh Water Pump New 12 Pitch Propeller 115 Compression Sealed and Shifting Properly Oil Cap out of cowl at time of video See Her run https://youtu.be/eKNJQsSFoDU https://youtu.be/uW4No00RmaU?t=2,,5923684276,34.958800,6,-83.868800,,"https://maps.google.com/maps/preview/@34.958800,-83.868800,16z",,$2000,power, (blairsville),Mariner Mercury 40 Hp. Engine,https://atlanta.craigslist.org/nat/boa/5923684276.html,
73,,,2016-12-20 10:23,"Wanted 15hp or 25hp outboard 2 stroke motor I'm looking for a boat motor, mercury, yamaha, johnson, evinrude or mariner, from 1996- 2008 Short shaft Will pay cash No texts or emails 15ft 14ft 25 hp Lowe Alumacraft G3 Tracker john jon 8 6 16 bass 9.9hp",,5926751491,,10,,,,,$1,power, (Roswell),Looking For a 15hp or 25hp Motor,https://atlanta.craigslist.org/nat/boa/5926751491.html,
74,good,[],2016-12-20 10:22,Sea Ray V 207 Bowrider. 228 Hp Mercrusser V8 Boat is in very good condition for it s age. Includes matching trailer. New bimini top. Just serviced. Newer stereo. Runs great ! Steal it for 2999.00 Call or text 678 four 0 nine 9 four 2 one If ad is up boat is still for sale,328,5922368965,,21,,Sea Ray,https://maps.google.com/?q=loc%3A+%35%38%32%35+Lanier+Islands+Parkway+suite+C+Buford+GA+US,V 207,$2999,power, (Buford),1982 Sea Ray V 207 bowrider V8,https://atlanta.craigslist.org/nat/boa/5922368965.html,1982
75,good,[],2016-12-20 10:22,1997 Monterey 180 BR 3.0 mercruiser Includes trailer. Boat is in good condition. 678 four 0 nine 9 four 2 one If ad is up boat is still for sale.,,5922834004,,18,,Monterey,https://maps.google.com/?q=loc%3A+%35%38%32%35+Lanier+Islands+Parkway+suite+C+Buford+GA+US,180,$2999,power, (Buford),Monterey 180 bow rider,https://atlanta.craigslist.org/nat/boa/5922834004.html,1997
76,excellent,[],2016-12-20 10:22,Super nice Sea Ray 210 Signature. 5.0 Fuel injected Mercruiser with Alpha drive. Comes with matching trailer. Bimini top. Cover. Stainless prop. Boat is in fantastic condition. Must see.            PRICE IS FIRM ! Call or text 678 four 0 nine 9 four 2 one. If ad is up boat is still for sale. 5825 Lanier islands pkwy Buford,,5922354775,,21,,Sea Ray,https://maps.google.com/?q=loc%3A+%35%38%32%35+Lanier+Islands+Parkway+suite+C+Buford+GA+US,210 Select,$9999,power, (Buford),1999 Sea Ray 210 Signature bow rider V8,https://atlanta.craigslist.org/nat/boa/5922354775.html,1999
77,good,[],2016-12-20 10:22,Nice 2000 Parti Kraft 18 foot pontoon. Mercury 40 with good compression. Includes matching trailer. Bimini top. Live well. Boat is in very good condition for its age. Fish off the front or back ! Check out pics. Call or text 678 four 0 nine 9 four 2 one. Price is firm. If ad is up boat is still for sale.,,5919455278,,18,,Parti Kraft,https://maps.google.com/?q=loc%3A+%35%38%32%35+Lanier+Islands+Parkway+suite+C+Buford+GA+US,180FC,$4999,power, (Buford),2000 Parti Kraft 180 Fish and cruise pontoon,https://atlanta.craigslist.org/nat/boa/5919455278.html,2000
78,,"['34.106000', '-84.511700']",2016-12-20 10:10,"This post is for the motor with console only. No boat. Have perfectly running 1985 Mercury 25 XD, short shaft, electric start. It still has factory compression at 125 psi on both cylinders.Comes with complete console, with everything attached to it but boat. Console is extra wide and once installed on boat driver can sit in the middle of the boat and have steering wheel in front of him. It was on 1648 jon boat, but it will fit any Jon boat with sides at least 18"" tall. Here is video how motor runs on 1648 Jon boat:  https://m.youtube.com/watch?v=ZxyBn0890Jw $2000.",,5926669694,34.106000,16,-84.511700,,"https://maps.google.com/maps/preview/@34.106000,-84.511700,16z",,,power,,Mercury 25 XD with complete side console. Video.,https://atlanta.craigslist.org/nat/boa/5926669694.html,
79,like new,,2016-12-20 10:03,"2006 Seadoo GTI 4tec 4 Stroke Engine ski New Parts: Brand New SBT Engine w/ no fault warranty til end of next season Brand new starter and spark plugs Brand new starter solenoid Brand new battery Brand new Custom Blacktip traction top fabric seat cover Brand new metal jet pump with new bearings, impeller shaft, and seals Brand new drive shaft 145 hours on ski, 6 hours on brand new engine, water tight front storage box and very large glovebox, registration paid for til 2019 just needs to be transfered to new owner, asking $4450.00 for ski with single trailer (not pictured) or would prefer to sell ski by itself without trailer for $4150.00. Call Josh if interested show contact info I do not need any trades so please don't ask. This is a great ski at a great price. Don't wait, CALL NOW!!JUST DROPPED PRICE ADDITIONAL $200.00, PRICED TO SELL!!! Keywords: seadoo, watercraft, jetski, yamaha, kawasaki, polaris, tigershark, waverunner, lake, fun, fast.",145,5905404495,,12,,Seadoo,,GTI,$4150,power," (Dallas, GA)",2006 Seadoo GTI 4tec Brand New 4 Stroke Engine Fast Ski!!!,https://atlanta.craigslist.org/wat/boa/5905404495.html,2006
80,fair,[],2016-12-20 09:57,"14 foot aluminum boat reposted due to scammer in Florida. Had 2 swivel folding seats ,,25 h.p. Johnson motor Will turn 3/4 round and stop 3/4 backward then stop ,,,,,,? That turning by hand with plugs out needs repair has trailer needs wheel bearings that I I know it needs got it from girl who let it sit up ,4 years since her divorce selling as is has brand name trolling motor I will sell also a think it's 3 speed priced right $650 everything gotta fish storage tank also",,5926715810,,14,,Unknown,https://maps.google.com/?q=loc%3A+%31%37%36%39+crevice+rd+Austell+GA+US,25 HP jonhnsom,$650,power, (Austell),14 foot aluminum boat/trailer 25 johnson,https://atlanta.craigslist.org/wat/boa/5926715810.html,1985
