,condition,coord_pair,date,description,engine hours (total),id,lat,length overall (LOA),long,make / manufacturer,map_URL,model name / number,price,propulsion type,region,title,url,year manufactured
0,,,2016-12-20 20:37,"Free service to you, huge blessing to me! In and around douglasville area: Please read entire post. Do you have any non running, or even running for that matter, lawn mowers, push or pull, that you just need out of the way? Perhaps you have weedeaters, blowers, or maybe a chainsaw that no longer works and they are taking up space? While I'm there, I'd also love to pick up those old wheelbarrows, working electric blowers, working electric weedeaters and those working electric edgers that you just no longer use. I would also be love to pick up any of those broken down Go karts, scooters, atvs's, anything that has a small engine on in it that is taking up space and you want someone to get it out of your way, all while knowing you are truly blessing a family by allowing me to help you get back that space? Well here is a chance for us to help each other!! Honestly, I know in most cases it will be helping me much more than it is you and for that, I will be and I am very grateful and appreciative for that blessing. Condition of the items is of no importance because I am constantly in need of parts. Having parts is what's most important so it doesn't matter if motor is locked up, still a blessing to me, right now parts is my biggest need to make this keep working. Pm me if you have something you would like me to pick up and we can set up a convenient time. I will note, during the hours of 11am-2:30pm is my most convenient time due to the kids, bus and all, but that doesn't mean I can never pick up outside those hours. Also as a side note, if I'm there picking up a mower or something, it would be my pleasure to haul off any non working flat panel tvs, laptops, desktop computer towers, old cell phones, anything mostly copper, aluminum, or brass items, even that collection of old keys, which are brass, old car and truck batteries. NOW, If you want to know more about me, and why I ask am doing this,  please read on. What's going on in my family's life, A little over 2 years ago I injured my shoulder and had to have surgery, during my recovery and rehab I began picking up scrap metal and any small engines I was blessed with, I honed my skills as a small engine mechanic and sold them. I did this so that I could still do my part to help provide for my family. Fast forward 2 years, I have recovered and am ready to start the career that I graduated from college for right before my surgery. However, as I readied for my job search, we were blessed with the opportunity to take guardianship  of my 4 nephews for an undetermined amount of time.That makes 7 kids in our home since January of 2016. Well, with daycare expenses and everything else, it just makes sense for me to continue to repair small engines such as mowers and weedeaters etc for resell to do my part because it allows me to be at home most of the time. I'm not afraid to say that God has blessed us and we are not going hungry, we have clothes on all our backs, and a roof over our head, and much of the blessing has come from the kindness of others that have allowed me to pick up from them in the past! If you are someone who has blessed me, thank you so much for being a blessing to us. So This is where I am, what I've been doing and that's why it is a blessing to have you allow me to get them out of your way. Sorry for the lengthy post, but thank you for reading this far and have a truly wonderful and blessed day. Keywords: junk removal haul off scrap mower mowers pick up trash moving mover old lawn equipment",,5927518605,,12,,,,,,human,,Need to make space for that new boat ? Please take a moment to read,https://atlanta.craigslist.org/wat/boa/5927518605.html,
1,,"['34.159403', '-83.932457']",2016-12-20 20:36,"Water ski slalom course for sale. This is a portable slalom course with a nylon mainline on a reel, all the pvc stabilizer tubing and all of the buoys to lay out a 4 buoy practice course. Install in lake in 20 minutes.  Give me a text. $550.00 david 7703six15952",,5927609406,34.159403,01,-83.932457,,"https://maps.google.com/maps/preview/@34.159403,-83.932457,16z",,$550,human, (lake lanier),slalom course - water ski,https://atlanta.craigslist.org/nat/boa/5927609406.html,
2,,,2016-12-20 20:31,"RVs Campers Boats Pontoon Boats Outboard motors Jet skies If your not using it turn it into cash you can use! Please send pics and include a description of what you want to sell, be specific and include your asking price. J.R.",,5927536948,,1,,,,,,power,,Cash for Campers travel trailers and boats,https://atlanta.craigslist.org/atl/boa/5927536948.html,
3,excellent,"['30.394900', '-86.469200']",2016-12-20 20:23,Mercruiser 330hp Most of its life spent in fresh water (spent 2 months in Florida) DRY STORED CURRENTLY Trailer with spare GPS CD Stereo Stainless Steel 3-blade prop New cockpit vinyl just like original Awesome boat! Call 850-31six-6162 for more info,,5887418890,30.394900,22,-86.469200,Sea Ray,"https://maps.google.com/maps/preview/@30.394900,-86.469200,16z",22 Pachanga,$12970,power,,1988 Sea Ray 22 Pachanga,https://atlanta.craigslist.org/atl/boa/5887418890.html,1988
4,,"['33.769900', '-84.295000']",2016-12-20 20:20,"Weather enclosure(also called camping enclosure, bimini enclosure) from 2003 SeaRay 220 Sundeck. Eisenglass surround, with black Sunbrella trim. Attaches to existing zippers on your original bimini. This is original Sea Ray enclosure from Great Lakes Boat Top Company. Very nice condition. Includes visor set, side curtains, aft curtain. It is not on boat. Enclosure only, no boat. Looks like the attached photo, but black, not green. Actual front and side curtain shown.Original cost $1800.00",,5920753151,33.769900,22,-84.295000,,"https://maps.google.com/maps/preview/@33.769900,-84.295000,16z",,$500,power, (Decatur),Bimini enclosure for 220 SeaRay Sundeck,https://atlanta.craigslist.org/atl/boa/5920753151.html,
5,,,2016-12-20 20:10,Two experienced painters with tools available for day rate. We can 3 to 4 rooms in a day. If you would like to see pictures of our work please go to ....... https://www.facebook.com/joshthepainter/ $300 a day for 2 painters. Or price by the job.,,5927554479,,1,,,,,$300,power,,2 PAINTERS- DAY RATE,https://atlanta.craigslist.org/wat/boa/5927554479.html,
6,,,2016-12-20 19:58,"We are Mco Trailers. Our business is pontoon boat trailers. Listed here is our 18 to 22ft HD pontoon trailer. Features include: *Powder Coat Finish. If you have ever spray painted something then you know spray paint just does not last. Powder coat is a more expensive process but is much more resistant to rust. It also keeps your trailer looking new for years to come. *One piece out side frames made from 4 inch box steel. Our trailers are unique in this manufacturing process. Most trailers use several welded pieces to achieve their shape. Ours are cut to length, then shaped creating a much stronger, cleaner looking trailer. The trailer listed here has a ""weight carrying capacity of 3920 lbs. *3 front stairs leading to a platform with a curved hand rail for safety. *9 lights with LED lights in the fenders. Lights make an object much more visible than reflective tape. *New, 13 inch, 6 ply trailer tires. *Acculube brand hubs featuring rubber unbreakable caps. *1500lb tongue jack with 2 wheels. *4 heavy duty drive on guides. *Rear heavy duty welded tie down eyelets. *Wide frame. This insures that no matter how wide your pontoon boat is, it will ride in the middle of the trailer for a much safer ride. Our wider frame also greatly reduces the risk of roll over while towing. *Written one year warranty. This gives our customers piece of mind in the purchase of their trailer. *Fully adjustable bunks, and stairs. We will even adjust the trailer to your boats specs to take the headache out of sizing. Compare our trailers and see why we earn such high praises from our customers. We would appreciate the opportunity to earn your business as well. If there are any questions we could answer for you please let us know. We can also be seen on our web site mcotrailers.com Special limited time pricing. Thank you, Lee M-co Trailers",,5927573064,,27,,,,,$1695,power, (West GA),18 / 22 ft HD Pontoon Boat Trailer,https://atlanta.craigslist.org/wat/bod/5927573064.html,
7,,"['33.679100', '-83.683500']",2016-12-20 19:49,"I have a 16 foot Jon boat. Very stable, decked half way back. I just don't use it anymore and want it gone. It needs nothing   Great duck/reservoir boat. $2500 Obo. Please call or text if you have questions. show contact info my name is Mitch.....No trades. I will remove the ad when sold.",,5927563873,33.679100,16,-83.683500,,"https://maps.google.com/maps/preview/@33.679100,-83.683500,16z",,$2500,human, (Monroe),16 FOOT JON BOAT!!!!,https://atlanta.craigslist.org/eat/boa/5927563873.html,
8,fair,"['33.391500', '-84.563500']",2016-12-20 19:15,"Boat, motor, and trailer. Boat late 80s Renken 17ft Motor late 80s Evinrude 88hp, engine spins, good compression, BUT NOT RUNNING Trailer nice galvanized w good tires",,5927528979,33.391500,17,-84.563500,Johnson,"https://maps.google.com/maps/preview/@33.391500,-84.563500,16z",Evinrude,$750,power, (Peachtree City),17' Renken 88Hp Evinrude,https://atlanta.craigslist.org/sat/boa/5927528979.html,1988
9,excellent,[],2016-12-20 19:10,"Selling my 2011 Crestliner Sportsman 14.5' all aluminum deep-V boat. Comes with a 2008 15 HP Mercury 4 stroke outboard and an EZ-Loader galvanized trailer with a folding tongue. Everything is in like-new condition, stored in carport always and also covered. This Crestliner boat is welded aluminum, no rivets, no dents, no leaks. It has the optional factory rubberized coated interior and floor. Boat engine has less than 15 hours on it and runs great.  This is a tiller model, manual start, with a 20"" long shaft. Motor and carburetor have been serviced recently. It comes with a 6 gallon tank and hose and a large Bimini top (not shown). The trailer is an EZ-Loader, galvanized, with 12"" tires, has spare tire and oiled hubs. This boat is ready for the lakes! Never been in salt water, always used in the Northeast GA lakes. It is in EXCELLENT CONDITION. Price is firm. Sorry, no joy rides. I can start the engine for you.  CASH ONLY. Thanks for looking. Angelo",15,5889773510,,14,,Crestliner,https://maps.google.com/?q=loc%3A+Loving+Rd%2E+at+Beavers+Rd%2E+Morganton+GA+US,Sportsman 14.5',$4599,power, (Morganton/Blue Ridge GA),Crestliner Sportsman 14.5' Aluminum Boat with 15 HP 4 Stroke Mercury,https://atlanta.craigslist.org/nat/boa/5889773510.html,2011
10,,,2016-12-20 18:42,"Titled 2016 Tennessee Trailers, 15' kayak / camping model. Comes with 2 sets of racks for either 2 or 4 boats and cargo area for coolers, tents or other gear. Triple leaf springs and Vortex hubs. LED lighting, non skid steps and LESS THAN 2000 miles. Can be stripped down to cargo / utility or bolted out to hold up to 6 canoes and kayaks (see below) We are upgrading in 2017 to a different design so here's a chance to grab the YakAddicts main hauler from this year and save about $500!! Still has nipples on the tires and has been awesome for us all year. $1800 obo Contact via call, Text or Email above in link do NOT contact me with unsolicited services or offers",,5927493742,,16,,,,,$1800,power, (Concord),"Kayak / Canoe Trailer, Like New",https://atlanta.craigslist.org/sat/boa/5927493742.html,
11,excellent,"['34.112400', '-84.302000']",2016-12-20 18:39,"It has the factory 454 Magnum 375 horsepower. Just spent $12,000 had it rebuild balanced and blueprinted.  Buy Twisted Motors Bill Grimes. It now has 500hp. The boat has original interior that still a solid 8.5 this boat has been miraculously taken care of its whole life I'm a 57 year old man and anal as the day is long. Willing to trade for a 98 or newer corvette,  Truck 2005 or newer, OR something nice and no JUNK what u got or H2 hummer. Thanks Tom show contact info",12,5888644323,34.112400,27,-84.302000,Baja,"https://maps.google.com/maps/preview/@34.112400,-84.302000,16z",272,$15500,power, (Alpharetta),1989 Baja 27ft,https://atlanta.craigslist.org/nat/boa/5888644323.html,1989
12,,,2016-12-20 18:39,Selling a bass tracker and trailer for 3300.  Has 40hp tracker motor that starts right up and runs perfect.  Carpet is worn.  Has fish finder and trolling motor. No trades.,,5927479922,,16,,,,,$3300,power, (Mcdonough),1997 bass tracker bass boat. 40hp tracker,https://atlanta.craigslist.org/sat/boa/5927479922.html,
13,excellent,"['34.112400', '-84.302000']",2016-12-20 18:39,"It has the factory 454 Magnum 375 horsepower. Just spent $12,000 had it rebuild balanced and blueprinted.  Buy Twisted Motors Bill Grimes. It now has 500hp. The boat has original interior that still a solid 8.5 this boat has been miraculously taken care of its whole life I'm a 57 year old man and anal as the day is long. Willing to trade for a 98 or newer corvette,  Trucks 2005 or newer,  H2 hummer. Let me no what you have and no Junk. Thanks Tom show contact info",12,5888645319,34.112400,27,-84.302000,Baja,"https://maps.google.com/maps/preview/@34.112400,-84.302000,16z",272,$15500,power, (Alpharetta),1989 Baja 27ft,https://atlanta.craigslist.org/nat/boa/5888645319.html,1989
14,excellent,"['33.674981', '-85.022208']",2016-12-20 18:28,I have a royalex tandem Blue Hole canoe for sale. In very good condition. Been kept in a garage it's whole life. Normal scratches on the bottom. Original Seats are cracked but would be an easy fix to replace the plastic seat with wood. Pics coming tomorrow along with measurements.  A great river running canoe!  $800 cash only.,,5919913599,33.674981,16,-85.022208,,"https://maps.google.com/maps/preview/@33.674981,-85.022208,16z",Blue hole,$800,human, (Temple),Blue hole canoe,https://atlanta.craigslist.org/wat/boa/5919913599.html,
15,like new,"['36.685700', '-85.140700']",2016-12-20 18:11,2004 Monterey Explorer Low hours 25 foot Volvo duoprop 260hp Call or text show contact info Financing available!,240,5918082437,36.685700,25,-85.140700,Monterey,"https://maps.google.com/maps/preview/@36.685700,-85.140700,16z",,$21000,power," (Albany, Ky)",2004 Monterey Explorer,https://atlanta.craigslist.org/eat/boa/5918082437.html,2004
16,,,2016-12-20 17:56,Single axle trailer recently sanded and painted. Bunks are in great condition and tires are almost new. This trailer will haul an 18 foot boat with no problem. I had my 18 ft. Sea Ray on it. Wanting to take a look at it call or text only.,,5888139500,,22,,,,,$700,power, (Gainesville Ga),Boat trailer,https://atlanta.craigslist.org/nat/boa/5888139500.html,
17,,,2016-12-20 17:49,14ft fiberglass john boat and trailer for sale. 2.2 hp mercury engine. Its taking up space and i just want it gone. $400 firm,,5924594460,,14,,,,,$400,power, (Newnan),14ft John Boat,https://atlanta.craigslist.org/sat/boa/5924594460.html,
18,fair,"['33.882439', '-84.679826']",2016-12-20 17:44,Am selling two Jet skies for $1500. Have not been used bit once in 13 years. Used this summer.  Fuel systems andotherparts fully replaced 2012. Both run great. If interested please text.,,5927407607,33.882439,10,-84.679826,Yamaha 93 and kawasaki 94,"https://maps.google.com/maps/preview/@33.882439,-84.679826,16z",,$1500,power, (Powder Springs),Jet Skies for sale $1500.,https://atlanta.craigslist.org/wat/boa/5927407607.html,1994
19,good,"['33.941800', '-84.070600']",2016-12-20 17:21,GLASTRON TRIAHILL  80HP MERCURY OUTBOARD TRIM-TILL ENGINE UP& DOWN . THE BOAT RIVE 30 MPH TRAILER WITH TIRE&RIM +ROLLER +BEARING .BOAT & TRAILER HAVE PAPER WORK IN HANG CURRENT REGISTER UNTIL 2017...CALL show contact info AK JOHN. NO NEED HELP TO SALE.,,5927396544,33.941800,15,-84.070600,,"https://maps.google.com/maps/preview/@33.941800,-84.070600,16z",,$1995,power, (GEORGIA),GLASTRON TRIHULL 1979 15'0 80 MERCURY OUT BOARD,https://atlanta.craigslist.org/atl/boa/5927396544.html,1979
20,good,"['33.941800', '-84.070600']",2016-12-20 17:19,GLASTRON TRIAHILL  80HP MERCURY OUTBOARD TRIM-TILL ENGINE UP& DOWN . THE BOAT RIVE 30 MPH TRAILER WITH TIRE&RIM +ROLLER +BEARING .BOAT & TRAILER HAVE PAPER WORK IN HANG CURRENT REGISTER UNTIL 2017...CALL show contact info AK JOHN. NO NEED HELP TO SALE.,,5927394400,33.941800,15,-84.070600,,"https://maps.google.com/maps/preview/@33.941800,-84.070600,16z",,$1995,power, (GEORGIA),GLASTRON TRIHULL 1979 15'0 80 MERCURY OUT BOARD,https://atlanta.craigslist.org/atl/boa/5927394400.html,1979
21,,"['34.170766', '-84.058800']",2016-12-20 17:19,"Jon boat great for duck hunting or fishing. No leaks Brand new 25hp professionally built surface drive mud motor with under 10 hours 24 inch light bar with toggle switch 14 foot This boat will get you in the tough spots where the ducks or bass are. Boat, trailer, motor $6000 or best offer..make me an offer worst ill say is no! Interested in guns for trade.",10,5920664525,34.170766,14,-84.058800,,"https://maps.google.com/maps/preview/@34.170766,-84.058800,16z",,$6000,power, (Forsyth County),Jon Boat with 25hp Surface Drive,https://atlanta.craigslist.org/atl/boa/5920664525.html,
22,,"['34.186814', '-84.045410']",2016-12-20 17:19,"Awesome duck or fishing boat 24inch LED lightbar Brand new 25hp surface drive outboard with less than 10 hours Camo paint job No leaks whatsoever very sound boat in great condition $6000 obo for boat, trailer, and motor",10,5921949178,34.186814,15,-84.045410,,"https://maps.google.com/maps/preview/@34.186814,-84.045410,16z",,$6000,power, (Forsyth County),Duck hunting/fishing john boat with surface drive mud motor,https://atlanta.craigslist.org/atl/boa/5921949178.html,
23,,"['34.203700', '-84.103100']",2016-12-20 17:17,Outboard transom brace in very good condition  Please call show contact info No emails or text  Phone calls only.,,5895087309,34.203700,1,-84.103100,,"https://maps.google.com/maps/preview/@34.203700,-84.103100,16z",,$25,power," (Cumming, GA)",Outboard / Outdrive Transom Brace,https://atlanta.craigslist.org/nat/boa/5895087309.html,
24,excellent,[],2016-12-20 17:13,"This 2005 Formula 400 SS has Twin Merc 496 Mag HO Duoprops 425 h.p. each, Kohler 7.3 KW 1003 hours, Marine heat and air, Windlass, Remote spotlight, Cockpit table and refrigerator, Cockpit filler cushions, Electric engine hatch, Dual battery switch, Battery charger, Depth finder and compass, Single disc c/d with i-pod connection, Central vac, Vacuflush head, Cabin TV, Microwave, Refrigerator For more information call 918-691-8823",,5927385482,,40,,Formula,https://maps.google.com/?q=loc%3A+%32%34%33+N+Beach+Drive+Disney+GA+US,400 SS,$149900,power," (Cedar Port Marina, Disney, OK)",2005 Formula 400 SS,https://atlanta.craigslist.org/atl/bod/5927385482.html,2005
25,like new,"['33.240400', '-84.273400']",2016-12-20 17:06,"Boat is in great shape always been covered it has a 90 hp mercury that runs great .Boat comes with all kind of extras including low rance,life jackets ,nets and batteries. It must sell will take any reasonable offer call Wes show contact info",,5927323320,33.240400,19,-84.273400,Carolina skiff,"https://maps.google.com/maps/preview/@33.240400,-84.273400,16z",198 elite series,$10500,power, (Griffin/macon),2008 Carolina skiff 198 elite series,https://atlanta.craigslist.org/sat/boa/5927323320.html,2008
26,new,[],2016-12-20 16:57,We're Crestliner's New Lake Lanier Dealer!  We have boats IN STOCK and Rolling In Daily!  Crestliner Dominated The FLW Tour This Year In An Aluminum Bass Boat!  Don't Overspend On Your Hobby For Overpriced Fiberglass!  Come and see our Mossy Oaks Editions - Bay Boats - Tiller Boats And More!  Mercury Engines - Made In USA! www.piedmonttractor.com www.crestliner.com 770-560-3747 text anytime,,5927364615,,20,,Crestliner,https://maps.google.com/?q=loc%3A+%39%31%30+West+Ridge+Road+Gainesville+GA+US,,,power,,Lake Lanier Crestliner Dealer In Stock,https://atlanta.craigslist.org/nat/bod/5927364615.html,
27,good,"['34.183180', '-84.785035']",2016-12-20 16:53,"2010 SeaDoo GTX Limited iS 260. Local Trade, 67 hours, good condition, just serviced. $7900.00 Call 770-386-9430 ask for Sue",67,5927359853,34.183180,11,-84.785035,SeaDoo,"https://maps.google.com/maps/preview/@34.183180,-84.785035,16z",GTX Limited iS 260,$7900,power, (Cartersville GA),2010 SeaDoo GTX Limited iS 260,https://atlanta.craigslist.org/nat/bod/5927359853.html,2010
28,excellent,"['34.183251', '-84.785163']",2016-12-20 16:50,"Two 2002 SeaDoo GTX 155's with double trailer. Local trade, just serviced, new gauges and batteries. Clean boats 123 hours on one 105 hours on the other. Please call 770-386-9430 and ask for Sue.",123,5927355215,34.183251,11,-84.785163,SeaDoo,"https://maps.google.com/maps/preview/@34.183251,-84.785163,16z",GTX 155,$6900,power, (Cartersville GA),Two 2002 SeaDoo GTX 155's,https://atlanta.craigslist.org/nat/bod/5927355215.html,2002
29,,"['33.467900', '-84.480600']",2016-12-20 16:38,2015 SEADOO SPARK STILL UNDER WARRANTY 3 SEATER STARTS RIGHT UP CALL $4500 CALL show contact info,,5927339139,33.467900,10,-84.480600,,"https://maps.google.com/maps/preview/@33.467900,-84.480600,16z",,$4500,power,,2015 SEADOO SPARK STILL UNDER WARRANTY,https://atlanta.craigslist.org/wat/boa/5927339139.html,
30,good,"['33.553100', '-84.400300']",2016-12-20 16:36,2015 SEADOO JET SKI 24 HOURS RUNS PERFECTLY STILL UNDER WARRANTY SUPER FAST $4500 show contact info,,5927336036,33.553100,10,-84.400300,,"https://maps.google.com/maps/preview/@33.553100,-84.400300,16z",,$4500,power, (30274),2015 SEADOO JET SKI,https://atlanta.craigslist.org/sat/boa/5927336036.html,
31,good,"['34.462000', '-84.475900']",2016-12-20 16:34,"Mercury 40 hp outboard  motor is a 20 inch shaft,run in fresh water only. Has had recent major service to include carbs rebuild,new fuel filter,spark plugs. lower unit pulled and water pump impeller and gear lube changed. Asking $1475.00 call 4zero48956795",,5902249837,34.462000,10,-84.475900,mercury,"https://maps.google.com/maps/preview/@34.462000,-84.475900,16z",40 hp,$1475,power, (jasper),Mercury 40 hp outboard,https://atlanta.craigslist.org/atl/boa/5902249837.html,
32,good,,2016-12-20 16:11,"1994 Chaparral Sunesta 220,Chaparral Sunesta 220, 5.7 Litre Chevy engine V-8, MerCruiser Alpha One inboard/outboard. Forward/Rear Sundecks. sink with pressure water, insulated ice chest with overboard drain. Bimini top. Trailer included",,5912845989,,22,,chaparral,,sunesta 220,$5500,power, (Flowery branch),94 chaparral sunesta 220,https://atlanta.craigslist.org/nat/boa/5912845989.html,1994
33,,,2016-12-20 15:58,"16ft Long and 60 inches wide. Great boat, does not leak, solid floor and transom, has 50hp Evinrude without power tilt/trim. motor runs great, starts right up and runs smooth. Comes with fish finder and optima battery. Has CD player and speakers. Boat is water ready. Would make a great hunting or fishing boat it's very stable.  $1700.00",,5927281884,,16,,,,,$1700,power, (Hogansville),1983 Kenner Center Console,https://atlanta.craigslist.org/sat/boa/5927281884.html,
34,excellent,"['33.934300', '-84.607600']",2016-12-20 15:32,2012 crownline E4 350 with bravo 3 dual prop drive. Loaded with options. Matching Heritage trailer. Red and white around 80 hours. Call for more details. 44k obo Jeff show contact info,80,5891374370,33.934300,26,-84.607600,Crownline,"https://maps.google.com/maps/preview/@33.934300,-84.607600,16z",E4,$44000,power, (Marietta),2012 crownline E4,https://atlanta.craigslist.org/nat/boa/5891374370.html,2012
35,excellent,"['34.465200', '-84.766900']",2016-12-20 15:30,"Boa,t 4HP motor, electric motor and oars. Small but very stable.",,5904161404,34.465200,15,-84.766900,Grumman,"https://maps.google.com/maps/preview/@34.465200,-84.766900,16z",,$975,power,,"15.8 Boat Boa,t 4HP motor, trol motor &o",https://atlanta.craigslist.org/nat/boa/5904161404.html,
36,,"['33.394300', '-84.473800']",2016-12-20 15:30,"Brand new. No sales tax. Perfect for your Jon, Bow Fishing, Duck or Sail boat. Great kicker or trolling motor too for your bigger boat. $1,600 Possible firearms or truck trades considered. Call show contact info boat parts",,5920210718,33.394300,12,-84.473800,,"https://maps.google.com/maps/preview/@33.394300,-84.473800,16z",,$1600,power, (Fayetteville),Mercury 5 horsepower 4 stroke 2016 model NEW outboard,https://atlanta.craigslist.org/sat/boa/5920210718.html,
37,good,"['34.075600', '-84.647700']",2016-12-20 15:23,cyber monday only $900 this is a great money maker for the right person ready for you to restore will go up after new years will need new key switch & seats great haul $1500 obo or trade what u got man stuff AR-15 ect. 120 psi on all 3 cylinder show contact info,,5922964476,34.075600,18,-84.647700,dynasty,"https://maps.google.com/maps/preview/@34.075600,-84.647700,16z",jet boat,$800,power, (acworth),1st.today only $800 1st.$800 get it now,https://atlanta.craigslist.org/atl/boa/5922964476.html,
38,,"['33.394300', '-84.473800']",2016-12-20 15:20,"Brand new. No sales tax. Perfect for your Jon, Bow Fishing, Duck or Sail boat. Great kicker or trolling motor too for your bigger boat. $1,600 Possible firearms or truck trades considered. Call show contact info boat parts",,5915986588,33.394300,12,-84.473800,,"https://maps.google.com/maps/preview/@33.394300,-84.473800,16z",,$1600,power, (Fayetteville),Mercury 5 horsepower 4 stroke 2016 model NEW outboard,https://atlanta.craigslist.org/sat/boa/5915986588.html,
39,,"['33.837342', '-83.766632']",2016-12-20 15:19,"Alumacraft 14 foot by 57"" wide fishing Boat set up like a Bass boat. Trailer, livewell, Minnkota, trolling motor, Hummingbird depth finder, battery, paddle, ready to fish.",,5897300020,33.837342,14,-83.766632,alumacraft,"https://maps.google.com/maps/preview/@33.837342,-83.766632,16z",,$2500,power,,Duck boat,https://atlanta.craigslist.org/eat/boa/5897300020.html,
