,condition,coord_pair,date,description,engine hours (total),id,lat,length overall (LOA),long,make / manufacturer,map_URL,model name / number,price,propulsion type,region,title,url,year manufactured
72,good,,2016-12-07 14:16,I think boat needs starter.I don't have the money to fix it.I need cash fast!!my loss your gain.1500$obo. Nice nice trailer.and comes with cover.,,5871288060,,16,,yamaha,,Exciter 135se,$1500,power,,1998 excited 135,https://athensga.craigslist.org/boa/5871288060.html,1998
73,excellent,"['34.168300', '-83.402200']",2016-12-07 13:28,Green hard plastic canoe for sale... No dents. No holes.... Very stable .... Buy it today for only $200 .... Can fit in a pickup bed. About 10-12 feet long..... EMAIL ME and I will RESPOND ASAP.,,5909562373,34.168300,10,-83.402200,,"https://maps.google.com/maps/preview/@34.168300,-83.402200,16z",,$200,human," (Commerce, GA)",2 person plastic Canoe for Sale,https://athensga.craigslist.org/boa/5909562373.html,
74,,"['33.080000', '-83.237900']",2016-12-07 00:32,Mastercraft super clean Aerial pro tower W/ aerial Bimini top Speakers Amp cd player 1 tear in seat is fixed Kept in dry storage at marina Well taken care of Wake board boat ski boat,,5888614686,33.080000,16,-83.237900,,"https://maps.google.com/maps/preview/@33.080000,-83.237900,16z",,$9500,power, (Milledgeville),91 Mastercraft Tristar 205,https://athensga.craigslist.org/boa/5888614686.html,
75,,"['33.788300', '-83.701300']",2016-12-06 21:39,"Here I have a 2003 Yamaha xlt1200 and trailer for sale, with LOTS of extras. This is a lake ready deal! Comes with quicksilver knee board, liquid force wake board(liquid force boots), o'brien vortex skis, two life jackets, and two towing ropes. This is a very powerful ski, with a brand new top end. Parts are listed in the picture. It is s 2003 model, these are play toys so it does have you average wear.",,5908752504,33.788300,124,-83.701300,,"https://maps.google.com/maps/preview/@33.788300,-83.701300,16z",,$3000,power,,XLT 1200 new top end w/ lots of extras,https://athensga.craigslist.org/boa/5908752504.html,
76,good,,2016-12-05 17:53,"Stored in basement for last 6 years.  Was running great last time used it 6 years ago.  SN 10018 06503.  $700 cash, FIRM.",,5906974155,,1,,Evinrude,,Sportwin,$700,power, (Maysville),Evinrude Sportwin 10hp Boat Motor,https://athensga.craigslist.org/boa/5906974155.html,
77,,,2016-12-04 17:48,"I have a 2016, 14' tracker John boat with new trailer. Only been in the water a few times. Has trolling motor included too. Both boat and trailer are in great shape and brand new. I traded for it from the original owner but have had no time to use it at all and would rather have the money. Has rod holders and I will also include the life vests. Original cost was about $2500, but will sell boat and trailer for $1500. Contact me with any questions you might have, text is preferred and thank you! show contact info",,5905470441,,14,,,,,$1500,power,,2016 John Boat and Trailer,https://athensga.craigslist.org/boa/5905470441.html,
78,,"['34.503700', '-83.258700']",2016-12-04 13:41,2008 19 foot princecraft Pontoon with mercury 40 hp big foot!!,,5905126881,34.503700,19,-83.258700,,"https://maps.google.com/maps/preview/@34.503700,-83.258700,16z",,$7000,power, (Eastanollee),2008 19 foot princecraft Pontoon,https://athensga.craigslist.org/boa/5905126881.html,
79,good,"['34.381291', '-82.918378']",2016-12-04 11:39,50 ft Stardust Cruiser houseboat. Steel hull in good condition. Interior floor needs some repair. V8 Mercruiser not currently running but ran up until 1 year ago. Needs tune-up. 45 ft covered slip/dock available at Hartwell Marina.,,5904949487,34.381291,50,-82.918378,Stardust Cruiser,"https://maps.google.com/maps/preview/@34.381291,-82.918378,16z",,$3500,power, (Hartwell),50 ft Stardust Cruiser Houseboat,https://athensga.craigslist.org/boa/5904949487.html,
80,excellent,,2016-12-03 17:40,"Up for sale is my jon boat.its 14 ft. Comes with trailer(with brand new lights), brand new battery, and electric motor. I just repacked the wheel bearings. The boat is registered through 2017. If you have any questions please call or text me. show contact info Price is firm. It's a nice boat. Not junk.",,5904201450,,14,,Unknown,,Unknown,$850,power, (Winder),14 ft aluminum v hull,https://athensga.craigslist.org/boa/5904201450.html,
81,good,,2016-12-03 16:15,"I have my 16""4 1993 hydra sport bass boat (60 hp Johnson which is a 1986) for sell nothing wrong with it besides the driver seat and the other seat needs recovering I have two sets of seats on poles to go with it also just had a fuel pump put on not even a month old boat cranks up and runs good do have to let it warm up good but after that runs great has a trolling motor with two battery's both live wells work fish finder works also have stuff to go with it for tournament fishing I'll let go with it the boat is water ready!! Only reason I'm selling it is because I wanna get a boat I can use for waterfowl hunting! Trailer tires are in great shape has a spare and all nothing wrong with either of them. I also glued some of the carpet down as you see in some of the pics is was coming up other than its a great boat $2,500 obo also have title for boat and motor!! Thanks and have a great day Welcome to all trades!! Make offer need gone",,5896672803,,16,,Hydra sport,,,$2500,power, (Hartwell),1993 hydra sport bass boat!,https://athensga.craigslist.org/boa/5896672803.html,1993
82,excellent,"['34.527100', '-82.708700']",2016-12-03 16:11,"Comes with gas and electric motors. Trolling motor is new. It is a minn Kota. Does not leak. Excellent condition. Will not vary from price, or best offer. Has Evinrude 6 horse motor. Great and legal for rivers.",20,5904078964,34.527100,14,-82.708700,alumacraft,"https://maps.google.com/maps/preview/@34.527100,-82.708700,16z",john boat,$2000,power," (Anderson,SC)",Alumacraft boat,https://athensga.craigslist.org/boa/5904078964.html,1991
83,good,"['34.647613', '-83.450712']",2016-12-03 14:30,"1989 Spectrum bass boat aluminum 17 foot new galvanized trailer 2 inch ball brand new tires the boat has a 50 horsepower motor to live in front and back fish / depth finder trolling motor 3 batteries 1 battery charger couple life jackets paddles and I have the title, it has been sitting since Aug was the last time has it in the water everything was working fine then not one problem, I tried to crank it when I took the pic and it wanted to start but was getting to much gas... had need to be cleaned out and new out in and the carbs need to be cleaned... all lights on trailer and boat work, trolling motor works find like I said if the carb where cleaned out from where it's been sitting it fire right up...had no problems last time on water and fished all day. Trades welcome in need of a truck",,5903919764,34.647613,17,-83.450712,,"https://maps.google.com/maps/preview/@34.647613,-83.450712,16z",,$2000,power,,1989 Spectrum Aluminum Bass Boat,https://athensga.craigslist.org/boa/5903919764.html,1989
84,excellent,"['33.311800', '-83.714000']",2016-12-03 11:17,2008 basscat cougar.in great shape.this is a sharp boat.have new humminbird helix 10 so not even installed yet.has 08 optimax 225 runs great.asking 28.500 obo.call or text tim at show contact info thank you,115,5903590591,33.311800,205,-83.714000,basscat,"https://maps.google.com/maps/preview/@33.311800,-83.714000,16z",cougar,$28,power, (monticello ga),2008 basscat cougar 28.500,https://athensga.craigslist.org/boa/5903590591.html,2008
85,,"['34.580853', '-83.318682']",2016-12-03 09:28,"This is a 16' 1978 Starcraft Super Sport project. Hull is in great shape. It has dual consoles and I have a windshield for it. It needs the floor replaced, a motor and some TLC to be water ready again. Trailer is included. The motor in the pic is already sold. This will make a great winter project to get ready for the spring. Asking $600 obo Will trade for a Stack On double door gun security cabinet + cash, hunting/fishing man stuff etc. Reloading equipment, upper receiver and such, Cash is king of course. Call or text 706-491-nine four seven one",,5862256103,34.580853,16,-83.318682,Starcraft,"https://maps.google.com/maps/preview/@34.580853,-83.318682,16z",Super Sport,$600,power, (Toccoa),1978 16' Starcraft Super Sport Hull and Trailer,https://athensga.craigslist.org/boa/5862256103.html,1978
86,new,[],2016-12-02 14:29,"These shelters start at 12w x 20l x 6'h and go up from there to any size you need.  The one pictured in this ad is a 20 x 20 x 8'h with box truss roof, end gables, 2 extra side panels all for $1776.00.  Come by or call today and let us design one for you.  Financing is available for qualified buyers.",,5902486833,,21,,Steel Buildings & Structures,https://maps.google.com/?q=loc%3A+%31%32%33+Outlet+Dr+Commerce+GA+US,Steel Structures,$1776,human," (Commerce, GA)",Boat Storage Shelters RTO Financing,https://athensga.craigslist.org/boa/5902486833.html,2016
87,,"['34.191900', '-83.028400']",2016-12-02 11:29,14 foot Alumacraft boat with 15 horse Evinrude runs great no problems no leaks for more information call John show contact info dog not included,,5878080770,34.191900,14,-83.028400,,"https://maps.google.com/maps/preview/@34.191900,-83.028400,16z",,$1800,power, (Bowman),14 foot Alumacraft boat,https://athensga.craigslist.org/boa/5878080770.html,
88,,[],2016-12-02 11:11,"Boat is in excellent condition. Great for inshore and has been taken as far as 11 miles off St. George Island. Comes with trailer, Lowrance depth/fish finder, Motorguide trolling motor, 115 HP Suzuki, 3 batteries, 5 brand new life jackets, anchor, Shurhold polisher and polish kit. Floor and hatch covers had been painted black by previous owner (see photos), but have been painted over with white Interlux Interdeck Polyurethane Non Skid Boat Coating. The black floor was hot in full sun. No cracks dings, or holes. Motor cranks on first try. The only issue whatsoever is that the t-top canvas had not been tied tight, so when driving from Athens to St. George Island, Fl., the wind and looseness caused it to rip. It needs to be replaced. Selling because we are not using it as much as I'd hoped. Going to outfit a fishing kayak instead. Please call or text 7 zero 6 - 4 2 four - 4 one two 1",,5863856283,,19,,,https://maps.google.com/?q=loc%3A+Magnolia+Blossom+Way+Athens+GA+US,,$17000,power, (Athens),1996 Carolina Skiff 198 DLV Boat,https://athensga.craigslist.org/boa/5863856283.html,
89,excellent,"['34.181900', '-83.902400']",2016-12-02 10:16,"008 Skeeter SL210 2008 Skeeter SL210. This is a boat that is extremely hard to find with only a few for sale nationwide. 2 owner boat in great condition for a lot of family fun or a serious day of fishing. Has been garage kept. 200 Hp HDPI Series 2. recently had a full service and has only approx. 122 hours. New 3 blade SS Prop.Very fast and strong with top speed around 68mph.Pulls a skier with no problem. Folding trailer tongue for those tight garages.New Minn Kota 65lb trolling motor with foot control. new 3 bank battery charger, new impeller, spare tire and wheel, upgraded 4 speaker kenwood stereo, Rod Locker, boarding ladder, Bow and dash Lowrance. Ski pole. New Bimini top. New boat cover. Trailer bearings with bearing buddies serviced 6 months ago. Has minor stitch stretching in the seats with a couple of small separations and will eventually need upholstery attention. Ready to sell at $22,900.00 OBO. show contact info (NOW $21900.00 need to sell)",122,5902052899,34.181900,20,-83.902400,skeeter,"https://maps.google.com/maps/preview/@34.181900,-83.902400,16z",sl210,$21900,power,,2008 Skeeter SL210 (JUST REDUCED),https://athensga.craigslist.org/boa/5902052899.html,2008
90,,"['33.854200', '-83.408000']",2016-12-02 06:49,"16ft bomber bass boat been converted to all electric ,has a 24v 74lb thrust foot operated trolling motor on the front .The decks were done a year and half ago ,also has year old live well and also has two new batteries . 800 obo",,5901860864,33.854200,16,-83.408000,,"https://maps.google.com/maps/preview/@33.854200,-83.408000,16z",,$800,power, (Watkinsville),16ft bomber bass boat,https://athensga.craigslist.org/boa/5901860864.html,
91,,,2016-12-01 23:14,12ft aluminum boat. Front and back decked off has three storage lockers. Have a trolling motor and battery. The bottom of the boat has been pained and bed lines but has come off in a few spots because the boat has been used. For any more details call me whenever show contact info price is negotiable,,5901680574,,12,,,,,$350,power,,12 ft Jon boat,https://athensga.craigslist.org/boa/5901680574.html,
92,good,[],2016-12-01 18:46,"Sea Doo 1997 (3 seater) Bombadier GTX with trailer. Just serviced runs great, has new upholstered seats New Sea Doo cover New battery, plugs. Great fun on the water",,5894839863,,12,,Sea Doo,https://maps.google.com/?q=loc%3A+Possum+Point+Drive+at+Pea+Ridge+Eatonon+GA+US,,$2500,power, (Eatonton GA),Sea Doo 1997 Bombadier,https://athensga.craigslist.org/boa/5894839863.html,1997
93,excellent,,2016-12-01 09:05,"Houseboat -- Floating Home - Great Fishing-Beautiful Sunsets-Lake Seminole - 55' by 15.5' plus 4' dock to tie up your fishing boat. $59,000 Fully furnished 2 bedrooms, 1 and ½ baths, shower, flat stove top, oven, refrigerator, wet bar, under counter refrigerator/freezer, sleeper sofa, recliner, dining table, three wall mounted TVs, ceiling fans inside and out on screened porch. Central Heat and Air, plus 12,000 BTU window A/C. Sleeps 6. Energy efficient -- Reflective rubberized roof coating along with mirrored film on windows and doors. Screened porch has an extended 4' dock with rails & boat bumpers. Relax at the beautiful ""Cove"" a gated Houseboat Community located at Trails End Marina and Resort, Donalsonville, GA. Enjoy the Club House, swim in the pool or play pool. Free use of a washer and dryer. Abundant wildlife and waterways to discover both in GA and FL along the Chattahoochee River with great fishing. Only a ten-minute boat ride south on the Chattahoochee River to Lake Seminole. Lake Seminole is a very popular fishing lake. Bass Pro holds tournaments on Lake Seminole. The houseboat is located just off the Chattahoochee River in a protected cove. (The Cove is about 1 hour North West of Tallahassee, FL. or 30 minutes due west of Bainbridge, GA.) We have great fishing for perch, bluegill, sunfish, large mouth bass, hybrid bass, striped bass, catfish, etc. right in front of our houseboat. Lake Seminole is a reservoir located in the southwest corner of Georgia along its border with Florida, maintained by the U.S. Army Corps of Engineers. The Chattahoochee and Flint rivers join in the lake, before flowing from the Jim Woodruff Lock and Dam, which impounds the lake, as the Apalachicola River. The lake contains 37,500 acres of water, and has a shoreline of 376 mi. Appreciate your interest in our houseboat. Please call if you have any questions or for an appointment.",,5856046814,,55,,Harbor Homes,,Savannah,$59000,human," (3371 Ga Hwy 253S Donalsonville, GA)",Undiscovered Paradise -  Houseboat -Great Fishing - Lake Seminole,https://athensga.craigslist.org/boa/5856046814.html,2008
94,excellent,[],2016-11-30 23:40,"This 2000 Sea Ray 245 Weekender 24' w/ MerCruiser 5.0L EFI with SS dual props provides style, comfort and every convenience imaginable in a sport boat, both on deck and below. At the helm, gorgeous burl wood accents and a premium stereo with cockpit remote control and four waterproof speakers, evoke the feeling of piloting a luxury craft. The standard seating plan, which includes starboard helm seat with flip-up bolsters and fiberglass storage base & the port helm seat with an adjustable back-to-back lounger, as well as a removable aft jump seat that forms a spacious sun lounger, provides comfortable seating for everyone. Sea Ray has outfitted the 245 Weekender a 12-volt receptacle for a cell phone, cockpit side panel compartments with ski racks and rod storage, generous floor storage, and dedicated fender storage in the aft transom wall. The standard power plant, the spirited 5.0L, 220 horsepower Bravo II stern drive, means the 245 Weekender has all the get-up-and-go needed to enjoy every waterborne activity to the maximum. The foredeck is easily accessed by way of integral fiberglass steps (built right into the sliding cabin door) and a walk-through tempered curved glass windshield. Below, a spacious, lighted cabin awaits with a comfortable V-berth and table that stows neatly away so that dining space quickly becomes sleeping space when the upholstered filler cushions are added. The galley comes complete with a sink and faucet as well as storage above and below the countertop. And of course, there's also a portable head compartment with a privacy curtain. A pressurized water system comes standard. Technical features on the Sea Ray 245 Weekender are designed to provide the utmost confidence for an extended outing. The long list of standard equipment includes audible engine alarms, automatic bilge pump, electric bilge blower, weatherproof electronic switch pad, depth finder, compass, plus Sea Ray's backlit low-glare, anti-fog, night-lighted instrumentation. There's even a carbon monoxide monitor in the cabin, a safety standard on all Sea Ray models. There are also amenities like power steering, power tilt and trim, hydraulic trim tabs. Updated & well maintained with this shop checklist: 1. Shore power installed 12/14. Has AC panel in cabin, shore power inlet on rear and shore power cable in storage compartment. 2. Two-bank battery charger installed 12/14. 3. 300 Watt bilge heater installed 12/14 4. Bottom painted. 12/14 5. Batteries replaced 5/15 6. Oil Changed in engine and drive 3/16 7. New impeller installed 3/16. 8. Detailed and waxed 8/16. 9. Lake checked and ready to go! 8/16 NOTE: Price does not include trailer. Happy Boaters Cartersville, GA (north of Atlanta off I75) 77zero-nine66-nine878",,5900245343,,24,,Sea Ray,https://maps.google.com/?q=loc%3A+%31%34%36%33+Hwy+%34%31%31+NE+Cartersville+GA+US,245 Weekender,$15995,power, (Cartersville),2000 Sea Ray 245 Weekender w/MerCruiser 5.0L EFI,https://athensga.craigslist.org/bod/5900245343.html,2000
95,excellent,"['34.088800', '-83.122000']",2016-11-30 20:41,"60 hp mercury 4 stroke. Great running boat, has walk through windshield 2 new battries for starting and trolling. Rod storage box, 1 storage compartment,1 live well. The boat has been garage kept.. Serious inquiries only... Any other questions feel free to contact me thanks.. Need to sale $4500 obo",,5859944383,34.088800,17,-83.122000,Tracker,"https://maps.google.com/maps/preview/@34.088800,-83.122000,16z",,$4500,power,,1989 tracker magna 17ft convertible. Price reduced,https://athensga.craigslist.org/boa/5859944383.html,1989
96,good,"['33.998500', '-83.711500']",2016-11-30 19:53,"1994 four winns 230 horizon with custom trailer. Overall good condition, interior does need a little work. Motor runs well. 6000 obo. Contact for details",375,5900020193,33.998500,24,-83.711500,Four winns,"https://maps.google.com/maps/preview/@33.998500,-83.711500,16z",230 horizon,$6000,power,,1994 Four Winns 230 Horizon,https://athensga.craigslist.org/boa/5900020193.html,1994
97,new,[],2016-11-30 18:01,BRAND NEW BOAT WITH A 60HP MERCURY MOTOR & A FREE TRAILER WILLIAM ASHLEY COLUMBUS CAMPER CENTER 1781 BOX RD COLUMBUS GA 31907 TEL = show contact info FAX = show contact info Ashley's Boat & Rv 621 COLUMBUS PKWY OPELIKA ALABAMA 36801 TEL = show contact info FAX = show contact info WWW.COLUMBUSCAMPERCENTER.COM,,5855524449,,17,,SUNDANCE,https://maps.google.com/?q=loc%3A+%36%32%31+COLUMBUS+PKWY+OPELIKA+GA+US,F17CC,$16995,power," (OPELIKA,AL)",NEW 2016 SUNDANCE F17 CCR BAY BOAT - $16995,https://athensga.craigslist.org/bod/5855524449.html,2016
98,new,[],2016-11-30 18:00,BRAND NEW BOAT WITH A 90HP MERCURY MOTOR & A FREE TRAILER WILLIAM ASHLEY COLUMBUS CAMPER CENTER 1781 BOX RD COLUMBUS GA 31907 TEL = show contact info FAX = show contact info Ashley's Boat & Rv 621 COLUMBUS PKWY OPELIKA ALABAMA 36801 TEL = show contact info FAX = show contact info WWW.COLUMBUSCAMPERCENTER.COM,,5855533223,,19,,SUNDANCE,https://maps.google.com/?q=loc%3A+%36%32%31+COLUMBUS+PKWY+OPELIKA+GA+US,F19CC,$18995,power," (OPELIKA,AL)",2016 SUNDANCE F19CC WITH A 90HP YAMAHA ( NO DEALER FEE'S ),https://athensga.craigslist.org/bod/5855533223.html,2016
99,new,[],2016-11-30 18:00,2016 Xpress Hyper-Lift H18B YAMAHA 90HP  YAMAHA ( NO DEALER FEE'S ) WILLIAM ASHLEY COLUMBUS CAMPER CENTER 1781 BOX RD COLUMBUS GA 31907 TEL = show contact info FAX = show contact info Ashley's Boat & Rv 621 COLUMBUS PKWY OPELIKA ALABAMA 36801 TEL = show contact info WWW.COLUMBUSCAMPERCENTER.COM,,5855496597,,18,,XPRESS,https://maps.google.com/?q=loc%3A+%36%32%31+COLUMBUS+PKWY+OPELIKA+GA+US,H18B,$21995,power," (OPELIKA,AL)",2016 Xpress Hyper-Lift H18B YAMAHA 90HP ( NO DEALER FEE'S ),https://athensga.craigslist.org/bod/5855496597.html,2016
