,condition,coord_pair,date,description,engine hours (total),id,lat,length overall (LOA),long,make / manufacturer,map_URL,model name / number,price,propulsion type,region,title,url,year manufactured
81,good,,2016-12-20 09:42,boat runs great solid dreck with a 1988 mercury 35 posing it carburetor was rebuilt last year with new starter boat well maintained. it's at a friend of mines house I need heads up if you wanna check it out so I can meet you there,,5926696914,,14,,bumblebee,,,$1200,power, (newnan),1974 bumblebee bass boat,https://atlanta.craigslist.org/wat/boa/5926696914.html,1974
82,new,,2016-12-20 09:36,"I have this boat seat that needs to be used for a boat, we have no use for out here.The seat bolts to this and it bolts to the floor ofthe boat.",,5920678552,,25,,,,,$15,human, (SMYRNA),BOAT SEAT PEDESTAL,https://atlanta.craigslist.org/atl/boa/5920678552.html,
83,,"['34.106000', '-84.511700']",2016-12-20 09:29,"I have just like brand new aluminum Jon boat, it has new casting deck and floor, with all aluminum support welded and riveted. Boat has no dents, no patches and it is straight as an arrow.  Doesn't leak a drop. Motor is healthy and quite fast 1984 evinrude 9.9 HP, short shaft with electric and pull start, needs absolutely nothing, very easy to start cold or warm, has a shallow drive feature which makes this boat perfect for river fishing. Comes with nice Sureride galvanized trailer and everything pictured.$3300. If you want to see how motor runs in the lake please see this video:  https://m.youtube.com/watch?v=BbviuB66K5Q Will separate. Boat and trailer with no gas motor - $2400. Motor with gas tank $900.",,5926649266,34.106000,14,-84.511700,,"https://maps.google.com/maps/preview/@34.106000,-84.511700,16z",,,power,,14 ft river Jon boat. Evinrude 9.9 HP .,https://atlanta.craigslist.org/nat/boa/5926649266.html,
84,,,2016-12-20 09:27,"A NICE OFFSHORE PROJECT BOAT. IT IS A 1972 FORMULA 233 THAT HAS BEEN PROPERLY CONVERTED WITH A STINGER BRACKET AND TWIN SUZUKI DT 140 ENGINES, ALSO HAS AN ALUMINUM TOWER THAT NEEDS TO BE MOUNTED STILL. HAS A CUDDY CABIN UP FRONT FOR THE LONG TRIPS OFFSHORE. I BOUGHT THIS BOAT WITH INTENTIONS OF FIXING IT UP AND USING IT BUT THAT HASNT HAPPENED. WHEN I BOUGHT IT THE ENGINES DID RUN AND WHEN I STORED IT I PUT STABIL IN THE GAS TANK AND PUT THE FOAM LUBE IN THE ENGINES SO WITH SOME MINOR EFFORT THEY SHOULD RUN AGAIN. THE BRACKET PIVOT PINS NEED TO BE REPLACED FROM RUST BUT I DO HAVE THE REPLACEMENTS. THE FLOOR HAS SOME SOFT SPOTS IN IT. I MIGHT PART IT OUT IF SOMEONE WANTS SOME BIGGER STUFF FIRST OR WILL TRADE.  CALL OR TEXT ONLY JASON show contact info $1800 firm ENGINES    $600 each or $1000 for pair ALUMINUM TOWER  $350 STINGER BRACKET $800 BOAT HULL (GREAT SHAPE)  $400 ANY OTHER PARTS MAKE OFFERS TRAILER DOES NOT COME WITH BUT I CAN DELIVER.   MAY TRADE ALSO",,5895280271,,23,,,,,$1800,power, (ACWORTH),72 1972 FORMULA 233 DEEP HULL OFFSHORE PROJECT TWINS SALE PART OUT,https://atlanta.craigslist.org/nat/boa/5895280271.html,
85,,"['33.379638', '-84.738407']",2016-12-20 09:22,"1970's Sears 12' aluminum v-hull jon boat - Registered with the GA DNR - can provide a clean bill of sale - Solid trailer with lights, guide posts, and new tires - tagged clean title - 40 lb thrust Minn Kota Endura trolling motor with 2 batteries and a charger - Humminbird 110 fish finder - Two folding seats, two paddles, flotation throw cushions, and anchor - No leaks - Prefect setup for small lakes & private ponds; ready to fish Asking 1200 or best offer call or text, 4o44two8nine84four if you see the add I still have it, no trades, cash only",,5895823575,33.379638,12,-84.738407,,"https://maps.google.com/maps/preview/@33.379638,-84.738407,16z",,$1200,power, (Newnan),Sears 12' aluminum v-hull john boat / jon boat,https://atlanta.craigslist.org/sat/boa/5895823575.html,
86,good,"['33.537300', '-85.253300']",2016-12-20 09:22,87 bass tracker with a 50 hp Johnson motor it has new decks and carpet pics coming,,5926673791,33.537300,17,-85.253300,,"https://maps.google.com/maps/preview/@33.537300,-85.253300,16z",,$2800,power, (Bowdon),Bass tracker pro 17,https://atlanta.craigslist.org/wat/boa/5926673791.html,
87,,"['33.439463', '-84.656010']",2016-12-20 09:22,"Well... I really don't want to sell this but the time has come to move up to something bigger, we have had so much fun with this boat, it has fit us perfectly and done everything we wanted it to do. This is a 1998 ShuttleCraft (DOMILY addition) in awesome condition, I have not seen one as nice as this one... well, I've never seen another one on the water period... I have done nothing but make it better over the past 3 years, keel guard, buff & wax, led lighting, new radio equipped with aux / USB inputs and Pandora ready, solar panel to recharge battery, I made three boards that go over the ski so you can lay out and stow nicely in the side compartments. Boat also has a bimini top (does have small rip) bilge pump, anchor, navigation lights so you can have this out after dark. There are two trailers that come with the boat, one for the ski and one for the Shuttle craft (if you need to separate) and ski together, the main trailer has new tires and bearing buddies. The wave runner is a 1997 Polaris SLTX 1050 w/reverse, it's oil injection, has had new top end and carbs installed, it has never given me one ounce of trouble, will do 50+ MPH alone and about 30 MPH in the Shuttle craft. I have not gone to the gas station or boat ramp without questions... photos being taken... or people just asking.. WTH is that? I'm asking $5500 but open to offers. Thanks for looking! 4o4four28nine8four4 If you see the add I still have it, no trades, cash only, no I don't need help selling it. https://www.youtube.com/watch?v=uN1S4DXGoZk",,5906455829,33.439463,15,-84.656010,,"https://maps.google.com/maps/preview/@33.439463,-84.656010,16z",,$5500,power, (Sharpsburg),Shuttlecraft / SLTX 1050,https://atlanta.craigslist.org/sat/boa/5906455829.html,
88,salvage,,2016-12-20 09:19,"Looking for any and all broken or unwanted jet skis, pwcs, jet boats. Kawasaki Yamaha Seadoo Polaris Tiger craft Etc",,5917394778,,7,,,,,$1,power, (Atlanta),WANTED-Broken or Unwanted Jet Skis,https://atlanta.craigslist.org/atl/boa/5917394778.html,
89,good,"['30.394900', '-86.469200']",2016-12-20 09:13,Have the boat in top shape. Clean and ready to Cruise. 500 hrs on 8.1 Volvo. New Garmin GPS and freshly serviced and ran through by local dealer.,500,5926663049,30.394900,36,-86.469200,Carver,"https://maps.google.com/maps/preview/@30.394900,-86.469200,16z",360 SB,$89900,power, (Destin Fl.),36 Carver Sedan Bridge,https://atlanta.craigslist.org/atl/boa/5926663049.html,2003
90,,"['33.080000', '-83.237900']",2016-12-20 08:59,"2003 Skeeter ZX225, 225HP Yamaha HPDI. Power pole 8' blade with wireless foot switches, ethernet-linked Lowrance HDS 10 gen 2's at console and bow, structure scan at console, hotfoot, pro trim at console, hydraulic steering, lock r bar, 3 bank onboard charger, recessed trolling motor tray, 80lb Minn Kota trolling motor, lighted compartments, livewell pump-out, swing away tongue on trailer, trailer brakes, red canvas cover for boat and motor, 2 skeeter life jackets. New power head with less than 20 hours on it; outboard has around 280 hours in total. $20000 Ranger, stratos, triton, basscat, tracker, nitro, charger, mercury, evinrude, motorguide, lowrance, humminbird",,5923203429,33.080000,20,-83.237900,,"https://maps.google.com/maps/preview/@33.080000,-83.237900,16z",,$19995,power, (Milledgeville),Skeeter ZX225,https://atlanta.craigslist.org/eat/boa/5923203429.html,
91,,"['34.106000', '-84.511700']",2016-12-20 08:35,"Great little motor, 1989, short shaft, remote steer, pull start and electric start. This motor was made in Japan by Yamaha. Runs excellent, needs no carburetor cleaning or tune up. Motor has very low hours on it and is like brand new under the hood. Yamaha control box included. $2400.",,5926626542,34.106000,15,-84.511700,,"https://maps.google.com/maps/preview/@34.106000,-84.511700,16z",,,power,,40 HP Mariner.,https://atlanta.craigslist.org/nat/boa/5926626542.html,
92,new,"['36.471000', '-83.555200']",2016-12-20 08:31,"ONE OWNER. BOUGHT NEW 8-25-2014 (35,240.000) OVER FIVE THOUSAND DOLLARS OF FACTORY OPTIONS. NEVER SAT IN WATER OVER NIGHT. DETAILED INSIDE AND OUT AFTER EVERY USE (8 TIMES) STORED IN A AIR CLIMATE CONTROLLED GARAGE. COMES WITH A CUSTOM MATCHING TRAILER, WITH SWING AWAY TOUNGE. ALL SAFTEY EQUIPMENT NEVER USED, STILL IN PLASTIC. IF YOU ARE LOOKING FOR A NEW BOAT, A WANT TO SAVE OVER 11,000.00 YOU OWE IT TO YOUR SELF TO LOOK AT THIS BOAT. NOT A BLEMISH ON IT ANYWHERE !! MUST SELL  FIRST 24,000 BUYS IT ! show contact info",55,5905060247,36.471000,20,-83.555200,STINGRAY,"https://maps.google.com/maps/preview/@36.471000,-83.555200,16z",198LXI,,power,,MINT SHOWROOM CONDITION 2014 STINGRAY 198LX WITH ONLY 55 HOURS,https://atlanta.craigslist.org/nat/boa/5905060247.html,2014
93,excellent,"['35.078100', '-85.063500']",2016-12-20 08:29,MUST SELL- MOVING - WILL accept reasonable offer- 21 ft Donzi cuddy I/O 350 magnum engine New Mercruiser outdrive installed 2016 still under warranty 3 years New Gimble Bearing installed at same time All work done by Erwin Marina 2 stainless steel props comes with - High end trailer with rollers less than 2 yrs old Will sell with or without trailer 7200 or best offer We are moving otherwise would not even sell - excellent boat - was kept at dry storage island cove - This excellent boat and offer won't last long -Message us,,5926621011,35.078100,21,-85.063500,Donzi,"https://maps.google.com/maps/preview/@35.078100,-85.063500,16z",,$7200,power,,21 ft Donzi - will accept reasonable offer,https://atlanta.craigslist.org/nat/boa/5926621011.html,
94,good,,2016-12-20 08:21,"For sale is a 1987 Carver Voyager Flybridge Extremely well taken care off for the year with many upgrades. Serviced twin Mercruisers 305 with only 700+ hr Runs and sail great Dual controls (in the cabin and on the flybridge) Sleeps up to 6. Equipped with kitchenette, granite counter tops, bath, shower, water heater, A/C (not running at the moment/bad compressor), nice sound system with Bluetooth, new LED blue and white lightning trough-out, SS barbecue, swim platform, new Bimini top, and more. Dual gas tanks 75 gal each. Fresh water tank 75 gal. Waste water tank 50 gal. Docked in Holiday marina on Lake Lanier. Own this yacht for only $11999. Serious buyers contact Sam show contact info Keywords: carver, yacht, sea ray, bayliner, regal, center console, sea, lake, sleeper, weekender, luxury",700,5894506840,,28,,Carver,,Voyager,$11999,power, (Buford),1987 Carver Voyager 28,https://atlanta.craigslist.org/atl/boa/5894506840.html,
95,,"['34.106000', '-84.511700']",2016-12-20 08:20,"Like new boat, always in garage, 1988, 16 ft long, 50"" wide floor, 15"" tall transom, 22"" tall sides. Boat has no dents, no holes, no patches, no silicone on rivets, it doesn't leak a drop. Two large storage compartments under the front deck, lights for night fishing, Comes with really nice trailer with new full size tires, perfectly running 9.9 HP Evinrude motor with electric and pull start, transom mount trolling motor, anchor and anchor mate, rood holders and paddle. Asking $3300. Will separate, boat and trailer $2800. Motor $900.",,5926614235,34.106000,16,-84.511700,,"https://maps.google.com/maps/preview/@34.106000,-84.511700,16z",,,power,,16 ft V hull aluminum Jon boat.,https://atlanta.craigslist.org/nat/boa/5926614235.html,
96,good,[],2016-12-20 08:11,"Nice little fishing boat. Has a 75 horsepower Chrysler on it that runs good. Also has a working trolling motor that is foot controlled. It has a live well and some extra storage. Comes with a really nice trailer with new tires. The boat is 15 feet long. I will throw in some life jackets, fire-extinguisher & a deep cell marine battery. $2000 obo. Trades welcome-4 wheeler, dirt bikes, dune buggy, truck, etc. send pics. Email, call/text show contact info Thank you Fishing boat bass boats cimmarron 75 horsepower hp live well trade barter",,5907343986,,15,,Cimmarron,https://maps.google.com/?q=loc%3A+Old+%34%31+Kennesaw+GA+US,Bass boat,$2000,power, (Kennesaw),Fishing Bass Boat Cimmarron,https://atlanta.craigslist.org/nat/boa/5907343986.html,1977
97,excellent,,2016-12-20 08:04,Awesome Lowe 14/36 Jon duck hunting. Brand new camo paint job. Trailer is in perfect shape. Electric start 14HP Mud Motor with only 4 hours on. New diamond plate flooring and lots of new storage. Price reduced to $3300 OBO,4,5923854617,,14,,,,Lowe 14/36,$3300,power, (Covington),Duck hunting and fishing boat.,https://atlanta.craigslist.org/atl/boa/5923854617.html,
98,,"['33.863500', '-84.008100']",2016-12-20 07:37,Used all summer registered till 19 very stable pulled wakeboard with ease double trailer included text please,,5905573041,33.863500,8,-84.008100,,"https://maps.google.com/maps/preview/@33.863500,-84.008100,16z",,$1100,power, (Snellville),Sea doo gti 96,https://atlanta.craigslist.org/atl/boa/5905573041.html,
99,excellent,,2016-12-20 07:27,Minncota 40lb trust transome mount asking 150 in great shape has new 3 blade perperler call or txt show contact info,,5926579245,,144,,,,,$150,power, (Locust Grove),Minncota 40lb trust,https://atlanta.craigslist.org/sat/boa/5926579245.html,
