,condition,coord_pair,date,description,engine hours (total),id,lat,length overall (LOA),long,make / manufacturer,map_URL,model name / number,price,propulsion type,region,title,url,year manufactured
0,good,,2016-12-20 18:56,"16' flatbottom boat 6' wide with 4' bottom. Has motor, trolling motor, oars , batteries,  life jackets, anchors , tailer with a flip stand, etc.. make a reasonable offer and it is yours. Must go child is sick and the money is needed.",,5927570731,,16,,,,,,power,,Lost Title Great Deal,https://decatur.craigslist.org/boa/5927570731.html,
1,good,"['39.770500', '-88.865900']",2016-12-19 23:38,24' pontoonboat with 75HP out board motor.  New seats and console. nice boat.  NO trailer call show contact info for info,,5926436258,39.770500,24,-88.865900,,"https://maps.google.com/maps/preview/@39.770500,-88.865900,16z",suntracker,$1800,power, (mt. Zion),pontoon boat,https://decatur.craigslist.org/boa/5926436258.html,
2,like new,,2016-12-18 11:16,"I bought this in 2008 brand new with a 25 hp merc, but upgraded to the max HP for the hull which is a 2 stroke 75 HP merc. it has 2 brand new batteries, a brand new butt seat, and will come with a motorguide trolling motor. Everything works great, and has no problems. I want a family boat because the aluminum is very hot for a 3 year old. I have barely used this boat since I bought it (maybe 3 trips to the lake a year) prop is great, no dings, and the hull is the same. NO TRADES, I DON'T NEED HELP SELLING, NO SPAM/SCAMS, NO TEXTS WITH YOUR E MAIL! IF YOU DON'T HAVE THE BALLS TO DEAL WITH ME BY A PHONE CALL, DO NOT BOTHER! My boat is not a cheap piece of shit, so no lowball offers! if you don't have the cash, simple DO NOT REPLY! GO BUY YOUR BROKE ASS A CANOE! NO JOYRIDES! The only way I will take this to the lake is you have a stack of $100 bills with you! NO CHECKS, NO BANK DRAFTS, NO BULLSHIT! If you are financing great! I will only take 95 $100 bills 217-four 33- five 1 zero 6",,5924297199,,17,,,,,$9500,power, (Bethany),"2007, 1754 Fisher blind duck edition",https://decatur.craigslist.org/boa/5924297199.html,
3,excellent,"['39.950200', '-88.445100']",2016-12-17 21:09,"© craigslist - Map data © OpenStreetMap (google map) length overall (LOA): 18 make / manufacturer: Ranger model name / number: 354XT propulsion type: power year manufactured: 1994 1994 Ranger 354XT Mercury XR6 150HP 2 Owner boat, I bought from the original owner in 2010. New carpet New seats Optional 3rd gas tank under seats Humminbird 998C SI on console. Minn Kota trolling motor Motor Mate motor transom saver 24P Predator 4 blade (reworked by Mark Croxton in 2013) 1994 Ranger Trail trailer Newer tires Complete new brake actuator New bearings New calipers and pads Completely rewired and LED lights installed New Fulton winch New Bow and Stern rollers Extras: 2 Spare props ( PowerTech TRO4 24P 4 blade and a 25P Tempest Plus 3 blade) Flow-torq hub kit Humminbird 798C (update to down imaging software version) Several bottles of Mercury Quickclean and Mercury Quickstor Several gallons of Mercury Premium Plus 2 stroke oil One of first 354XTs, built in late 1993. No Paypal or checks, cash deal.",,5920635869,39.950200,18,-88.445100,Ranger,"https://maps.google.com/maps/preview/@39.950200,-88.445100,16z",354 XT,$7500,power," (Ivesdale, IL)",1994 Ranger 354 XT,https://decatur.craigslist.org/boa/5920635869.html,
4,excellent,"['39.839500', '-88.946500']",2016-12-17 10:21,THIS IS A VERY NICE 17' BASS BOAT. HAS 2 LIVE WELLS AND BAIT WELLS. HAS TWO DEPTH FINDERS. ALL CARPET IS IN VERY GOOD SHAPE..HAS 150 HP JOHNSON MOTOR WITH STAINLESS STEEL PROP AND ALSO POWER TRIM.. RUNS LIKE A SEWING MACHINE AND IS SCARY FAST = 75 MPH + TO GET YOU TO YOUR FAVORITE FISHING SPOT BEFORE SOME ONE GETS THERE.. HAS A VERY STRONG DECK MOUNTED FOOT CONTROLLED TROLLING MOTOR.. BOUGHT THIS BOAT A COUPLE OF YRS AGO. USED IT FIVE TIMES WINTERIZED IT LAST YR AND NOT USED IT THIS YEAR YET..SO HEAR YOU ARE ANGLERS A VERY NICE BOAT FOR THE RIGHT PERSON TO OWN..DONT MISS OUT ON THIS ONE..ASKING $8500 BUT EVERYTHING IS NEGOTIABLE...THANK YOU AND HAVE A NICE DAY...,,5923031220,39.839500,17,-88.946500,HYDRO-SPORTS,"https://maps.google.com/maps/preview/@39.839500,-88.946500,16z",,$6000,power, (Mt. Zion),1997 17' 150hp HYDRO-SPORTS BASS BOAT,https://decatur.craigslist.org/boa/5923031220.html,1997
5,good,[],2016-12-16 02:26,"1991 Sea Doo gt Jet Ski and 1993 Galvanized Karavan Trailer Does Not Run, it stopped running while going down the lake. It has Not been checked out. 3 Seater, seat is in good condition. Garaged until 3 mos ago. Very nice Galvanized trailer. Just needed room in the garage. Both titles in hand. I think it is a 650cc Asking $550 obo within reason.  Cash only Please call if interested. No room in the garage. Shelbyville",,5900357307,,10,,Sea Doo gt,https://maps.google.com/?q=loc%3A+%34%32%32+W+South+%34th+St+Shelbyville+IL+US,Bombadier 5811,$550,power, (Shelbyville),3 Seater Sea Doo gt Jet Ski and Trailer,https://decatur.craigslist.org/boa/5900357307.html,1991
6,good,"['39.934000', '-88.805200']",2016-12-15 14:54,For sale is a 1980 sunbird sail boat in great condition. at clinton lake so you can see it. 1800.00 obo Comes with lots of goodies Solar battery charger electric trolling motor and more Only selling because we are going to get a motor boat next season..just wanted to try sailing..great starter boat. Includes boat trailer. TITLE IN HAND 1800. OR BEST OFFER. Had been covered for winter ..,,5914667644,39.934000,17,-88.805200,,"https://maps.google.com/maps/preview/@39.934000,-88.805200,16z",,$1800,sail, (argenta),1980 sunbird sail boat,https://decatur.craigslist.org/boa/5914667644.html,
7,,"['39.390000', '-88.959700']",2016-12-13 09:08,"1975 Mercury 65HP Motor, I bought this new in 1975 on a Sea Star Boat, Transom on the boat went bad two years ago, so I took it off. Was planning to put it on another boat but have decided to sell it. Throttle/Shifter control comes with it. I don't have the steering wheel or cable. These are just pics of the motor cover, the motor is laying inside.",,5917492971,39.390000,0,-88.959700,Mercury,"https://maps.google.com/maps/preview/@39.390000,-88.959700,16z",,$125,power, (Tower Hill),Mercury 65HP Motor,https://decatur.craigslist.org/boa/5917492971.html,1975
8,good,,2016-12-12 12:58,1978 venture bass boat!!comes with the below listed- evinrude 60 hp(runs perfect) 2 retractable anchors 3 life vests 2 fish finders(pictures provided) 2 oars bilge pump(works great) aireydor(works great) all lights work lockable rod storage 4 rod holders for drifting minn kota trolling motor 2 360 degree bass seats 2 deep cycle marine batteries 1500$ obo 217-820-914 eight winterized but will atart for serious buyer,,5916420198,,16,,venture,,bass,$1500,power, (moweaqua),1978 venture bassboat,https://decatur.craigslist.org/boa/5916420198.html,1978
9,good,,2016-12-11 13:11,"I have pictures on my phone if interested in rig I have a 16 foot Fisher marine 45# thrust minakota trolling motor and a 9,9 kitted to 15 hp johnson has 2 Iive wells 5 gallon gas tank storage in front with heavy duty larger wheel trailer.$ 1,850 the bad is  the tittles are lost on the boat and trailer I have all the paper work to get it legal in your name.make a good hunting or fishing rig. show contact info text is better for pics or questions.might consider trades for trucks or motorcycles.or other boats rigs.",,5893021531,,16,,Fisher marine silver,,,$1850,power, (Johnston city il),16'Fisher marine boat motor trailer,https://decatur.craigslist.org/boa/5893021531.html,
10,good,"['39.770500', '-88.865900']",2016-12-08 12:59,1999 ranger bass boat. Downsizing toys to create other opportunities. 175hp outboard that runs strong. live wells and plenty of storage. pics posted soon,,5911049923,39.770500,18,-88.865900,Ranger,"https://maps.google.com/maps/preview/@39.770500,-88.865900,16z",180,$10000,power, (Decatur),1999 Ranger bass boat,https://decatur.craigslist.org/boa/5911049923.html,1999
11,,,2016-12-08 08:56,"1991 Rinker Captiva 21 foot cuddy cabin ski boat. This is a great and fun family boat. 350 Chevy motor 5.7l. New interior. New stereo with amp, subs, deck, and marine speakers. Dual batteries. New prop. Boat cover. Tandem axel trailer with new bearings and newer tires. Boat has been professionally serviced and maintained. Great looking and running boat. Ready for the water. $8800obo",,5903460875,,21,,,,,$8800,power," (Decatur,il)",1991 Rinker Captiva,https://decatur.craigslist.org/boa/5903460875.html,
12,excellent,"['39.839500', '-88.946500']",2016-12-05 19:02,"2007 Baja Performance 275, 2007 Baja 275 Performance in pristine condition with only 113 hours!  This performance boat provides seating for six of your family and friends. The cuddy cabin comfortably sleeps two. The driver and passenger seats have drop down bolsters which gives you the flexibility to stand or sit while cruising.  Equipped with a Mercury 425hp that can run quiet or loud with flow-through exhaust (make it rumble). Also includes: bimini top, clarion stereo with SiriusXM, Garmin GPS, and depth finder.  Includes travel cover and separate cockpit cover.  Everything you need!  Call now for more information and to schedule a showing.",120,5907096515,39.839500,27,-88.946500,Baja,"https://maps.google.com/maps/preview/@39.839500,-88.946500,16z",Performance 275,$41900,power," (Decatur, IL)",2007 Baja Performance 275,https://decatur.craigslist.org/boa/5907096515.html,2007
13,,"['39.458000', '-88.805800']",2016-12-04 16:03,"2014 Hydro Hoist Boat Lift (5800 lbs) in slip at Lithia Spings Marina, Lake Shelbyville.  Purchased new 2 years ago.  I am purchasing larger boat and need larger slip and lift.  Lift can remain in the current slip if you rent it from Lithia. If not you are responsible for moving lift.  Excellent Shape.  Currently set up for tri toon (28' Bennington).  Slip is 28' X 12'.  Call or text with questions.",,5905413362,39.458000,14,-88.805800,,"https://maps.google.com/maps/preview/@39.458000,-88.805800,16z",,$5900,power, (Lake Shelbyville),"Hydro Hoist, Boat Lift",https://decatur.craigslist.org/boa/5905413362.html,
14,good,,2016-12-03 19:33,14 foot Lowe Big Jon. Wide stable boat with no leaks. Has mid 90's 25hp electric start Evinrude. . Always starts and runs great. $1500 OBO call or text. Text preferred due to work.,200,5875962307,,14,,Lowe,,Big Jon,$1500,power, (Lincoln),14 ft Lowe Big Jon,https://decatur.craigslist.org/boa/5875962307.html,1993
15,,,2016-12-03 08:40,"15' triton fishing boat in pretty good condition,has a 1992 Nissan NS60A outboard that runs good. Comes with trolling motor,depth finder and brand new prop for motor.",,5895753020,,15,,,,,$2500,power,,Triton,https://decatur.craigslist.org/boa/5895753020.html,
16,excellent,,2016-12-02 06:33,"2006 Evinrude 200hp Saltwater Series, approximately 185hrs Hull Excellent condition, Depth Finder, Bimini Top, Camper Canvas and Full weatherproof Cover, New Batteries 2016 FULL DISCLOSURE: Last boat trip of season Engine FAILED, broken piston. E-Tec Dealer estimate to repair $5,500. Cox Galvanized Trailer, New Axles (2009), Bearings repacked 2016 Been in family since 1995.  Winter stored heated shop.  Very clean Illinois fresh water boat. Make me an offer.",185,5901883621,,20,,Grady White,,206 Overnighter,$6500,power, (Moweaqua),Grady White 206 Overnighter,https://decatur.craigslist.org/boa/5901883621.html,1990
17,like new,"['39.711900', '-88.797500']",2016-11-30 20:54,"Selling my 2015 Triton 17CTX with a 60 hp Mercury Fourstroke. Has a lowrance elite 3x depth finder on the console. Been garage kept most of its life, original owner. Been well taken care of and has low hours. Asking $18000 obo. Any questions call or txt Garrett @ 2one7nine7two0eight4three",,5900152134,39.711900,18,-88.797500,Triton,"https://maps.google.com/maps/preview/@39.711900,-88.797500,16z",17CTX,$18000,power, (Dalton City),2015 Triton 17CTX,https://decatur.craigslist.org/boa/5900152134.html,2015
18,excellent,[],2016-11-30 16:32,"Looking for a great starter boat under ten grand? The previously enjoyed 1992 Rinker 181BR has just arrived, and is ready for you to take it on the water! This bowrider is in great shape. The previous owner must have taken good care of it, because it's hard to find any dings or scratches in the hull! Bowriders are often sought after, because of their versatility. You can take a leisurely cruise around the lake with the friends and family. Plus, you can tow tubers and skiers. Or you can tie up at the party cove for an afternoon of fun! There is practically no end to the possibilities. You owe to yourself to come give this Rinker a closer look. It comes equipped with the following: - Stock Heritage Trailer - Mercury Mercruiser AlphaOne 3.0 Litre Inboard/Outboard Motor - Stern Swimming Platform with Ladder - Floorboard Storage Compartment For more information, please visit - http://pls.boats.com/pls-webapp/search/pls.tracker/boat/details.html?id=10015940941&t=boat&rev_srh=N%3d show contact info 26currencyid%3d100%26trkdealer%3d show contact info",,5899807173,,18,,Rinker,https://maps.google.com/?q=loc%3A+%34%36%30%30+Rising+Moon+Road+Springfield+IL+US,181 Bowrider,$7895,power," (The Boat Dock - Springfield, Illinois)",1992 Rinker 181 Bowrider,https://decatur.craigslist.org/bod/5899807173.html,1992
19,,,2016-11-30 12:53,Super clean Fridge Lots of seating Lots of storage Swim platform Bathroom Great family boat Feel free to ask for more information or pictures,,5882792862,,30,,,,,$42900,power,,2004 Crownline 288-boat-bow rider,https://decatur.craigslist.org/bod/5882792862.html,
20,new,"['39.770500', '-88.865900']",2016-11-30 11:19,"We are offering a new 15 hp Four Stroke MAPI outboard motor. Light weight, reliable and  affordably priced. Short shaft Tiller steer Electric and manual start remote 6 gal fuel tank and hose 107 lbs rpm 4500/5500 CDI ignition See a running video at this Rod Poland you tube link   https://youtu.be/XA5jJtBp_wE This motor starts Quickly and runs great. The motor was used as a demonstrator and only has 4 hours on it. Trade ins are welcome. See: projectoutboards.com  for a running video and more on MAPI outboards. Thanks!",1,5878021155,39.770500,15,-88.865900,MAPI,"https://maps.google.com/maps/preview/@39.770500,-88.865900,16z",15 hp 4 stroke,$1550,power," (Dalton City, Il)",MAPI Four Stroke 15 hp Outboard Motor Short Shaft Tiller El Start,https://decatur.craigslist.org/bod/5878021155.html,
21,new,"['39.711900', '-88.797500']",2016-11-30 11:18,We are selling a 9.9 hp 4 stroke Marine Advanced Products Innovations or MAPI outboard motor. This motor is carry over 2013 model. It has only been used as a demonstrator with maybe 2 hrs of total run time on it.  See: Project Outboards .com for more info We are making room for new models! Don't miss out on this great deal! It has the following features.        6 Gal gas tank/ fuel line included Tiller steering electric start low oil warning light electric key start manual start manual tilt long shaft CDI ignition SOHC F/N/R  lever shaft twist grip throttle control emergency lanyard cut off switch. 2 year standard factory warranty from the date of purchase. extended warranty optional.,2,5858588650,39.711900,20,-88.797500,,"https://maps.google.com/maps/preview/@39.711900,-88.797500,16z",,$1550,power," (Dalton City, Il)","9.9 hp MAPI 4 stroke outboard motor, tiller, electric start",https://decatur.craigslist.org/bod/5858588650.html,
22,excellent,[],2016-11-28 10:39,"With its 60"" hull, the Stinger 175 is 6"" wider than the leading competitor, making it one of the most stable, best performing boats in the mid-size class. Its super-sized, 85"" wide deck offers 70 sq ft of open fishing space combined with 11.75 cu ft of storage - both 50% more than the leading competitor. For crappie setups, they feature a massive 36 sq.ft. bow deck to accommodate 2-across seating and 4-place T-bar rod holders. The wider hull also delivers an extra-large 9'6?port-side rod locker, two pro-level 44"", 23 gallon aerated & divided bow livewell/baitwell combos with timers and super-reliable Flow-Rite® plumbing for superior fish & bait keeping, plus massive bow-deck storage compartments and two aft storage boxes. The pre-rigged package includes: your choice of Mercury® outboard* (up to 75 hp), MotorGuide® FW46FB trolling motor, Lowrance® X50DS fishfinder with temp, rotomolded console with soft-grip wheel and anti-feedback steering, full Teleflex® instrumentation, driver, center & passenger seats with under-seat storage, two movable pedestal fishing seats with four seat bases, (three in bow deck) 13 gallon built-in gas tank with in-dash gauge and a painted bunk trailer w/ roller guides, diamond plate steps, metal fenders and a swing tongue. Maximum performance is ensured with a ProTrac? modified-V hull design that tapers from an 8? shallow V at the transom to a progressively deeper V at the bow for a smoother, drier ride. For lasting durability, Stingers feature: PowerGrid? rib & stringer construction, TufDeck? aluminum decks and floor liners, 16 oz. stain resistant carpet throughout and baked-on polyurethane paint. For more information, please visit - http://pls.boats.com/pls-webapp/search/pls.tracker/boat/details.html?id=10015990635&t=boat&rev_srh=N%3d show contact info 26currencyid%3d100%26trkdealer%3d show contact info",,5856543587,,17,,Lowe,https://maps.google.com/?q=loc%3A+%34%36%30%30+Rising+Moon+Road+Springfield+IL+US,Stinger 175,$9980,power," (The Boat Dock - Springfield, Illinois)",2011 Lowe Stinger 175,https://decatur.craigslist.org/bod/5856543587.html,2011
23,good,"['39.634800', '-88.754300']",2016-11-24 17:22,Great boat but looking to go bigger.,,5890988839,39.634800,12,-88.754300,,"https://maps.google.com/maps/preview/@39.634800,-88.754300,16z",,$1200,power, (Bethany),Starcraft Boat,https://decatur.craigslist.org/boa/5890988839.html,
24,,"['39.843200', '-88.986100']",2016-11-24 13:08,"12 foot v-bottom fishing boat with trailor has nice treated wood floor and blue carpet and two fishing seats.great little boat for ponds.i don't have titles for boat or trailor.300.00 obo also I have a 6hp mercury boat engine for sale too.call or text if need pics show contact info may trade, what do you have?",,5856556366,39.843200,12,-88.986100,,"https://maps.google.com/maps/preview/@39.843200,-88.986100,16z",,,human,,12 ft v-bottom aluminum fishing boat,https://decatur.craigslist.org/boa/5856556366.html,
25,good,"['39.770500', '-88.865900']",2016-11-24 04:44,24' pontoonboat with 75HP out board motor.  New seats and console. nice boat.  NO trailer call show contact info for info,,5890390796,39.770500,24,-88.865900,,"https://maps.google.com/maps/preview/@39.770500,-88.865900,16z",suntracker,$2200,power, (mt. Zion),pontoon boat,https://decatur.craigslist.org/boa/5890390796.html,
26,,"['39.487216', '-88.180363']",2016-11-22 18:45,1995 formula 271 sr1 455 hours comes with a heritage trailer It has a 502 mercruiser mag 4 blade 21p prop runs high 50s It has two new interstate batteries 4 total with a power switch and on board charger New fuel pump New alternator It has a brand new $1000 amp and two new JL speakers and new led lighting that comes with a remote with multiple color options and displays It sits on a 1996 heritage trailer that has new tires and bearings If you have any questions give me a call or text show contact info,,5888700396,39.487216,27,-88.180363,Formula,"https://maps.google.com/maps/preview/@39.487216,-88.180363,16z",Sr1 271,$21000,power, (Shelbyville IL),1995 formula sr1 271,https://decatur.craigslist.org/boa/5888700396.html,1995
27,,,2016-11-21 09:13,This a project boat love to work with u on. Bought as a running boat but have not ran it. I just want trailer. Boat has  title . Give me a text 217 eight nine8 six three 3 one.,,5886289108,,2,,,,,$400,power, (Monticello illinois),Boat61857,https://decatur.craigslist.org/boa/5886289108.html,
28,excellent,"['40.512400', '-88.988300']",2016-11-20 18:05,"I am selling my 1996 Rinker Captiva 209 open bow pleasure/ski boat. This boat is in excellent condition inside and out and runs great. 20.5 inches long, with a 4.3 V6 mercruiser engine. Very well maintained and stored indoors. 6 interior speakers, clarion cd/mp3/aux stereo, after marker underwater blue LED lights under rear deck by out drive look amazing (can see in the picture). Lots of storage space. Tandem axle trailer w/ spare tire. New wheel jack and pull crank for trailer. Have the standard 3 blade prop that came with the boat, and also an extra 4 blade stainless steel prop that was purchased last year and retail was $400. Comes with anchor, bumpers, and rope, fire extinguisher. I love this boat and it is very reliable and runs great, haven't had any issues I am 3rd owner just looking to upgrade. Boat is at a storage unit in Dewitt right near the lake. Title in hand. Asking $6,000 obo. You will not be disappointed. Boat is currently winterized. Please call or text no emails no scams. 3zero9 8two4 58six3",,5885664686,40.512400,21,-88.988300,Rinker,"https://maps.google.com/maps/preview/@40.512400,-88.988300,16z",Captiva 209,$6000,power, (Normal),1996 Rinker Captiva 209 Great Condition,https://decatur.craigslist.org/boa/5885664686.html,1996
29,,,2016-11-19 10:05,"17 ft.  10 inch Aluminum Starcraft fishing boat like new 2009 50 hp Yamaha is Lake ready 1985 boat is 76 1/2 inch wide fish or bass boat, is stable not tippy on the water. All decking has been redone with new carpet all in great condition has all storage under new front & back deck all solid. has rod storage live-well, bumpers on back corners & front to protect boat, Have front seat & pedistol not shown in picture seats all in good condition  oar, anchor, boat cover with bows to hold boat cover. Has 12 gallon gas tank with water filter seperator, 2 like new batteries in front one in back. New hummingbird 688 D I down imaging with GPS & color display. Minkoto Maxxum 5416 long shaft Trolling motor, running lights all work on boat & trailer. 1985 Shorelander  roller trailer, great condition with drive on guides & fairly new tires. 2009 50 horse Yamaha with power tilt &  trim switch on shifter & on motor,  looks like new 2 stroke with only about 5 hours running time or less than 10 hours running time. The boat, trailor and accesories are worth $3000.00 and the motor is worth $4000.00 Make someone a great fishing boat.  consider offers.   was asking $ 5500.00 or best reasonable offer. now $4995.00  I do not respond to E-mails or texts if interested",,5883637144,,17,,,,,$4995,power, (Decatur),Fall Special 18 ft Starcraft like new 2009 50 hp Yamaha,https://decatur.craigslist.org/boa/5883637144.html,
30,,,2016-11-19 10:01,"Price reduced   $1375.00  16 foot long  62 1/2 inches  wide inside  26 inches deep at deepest point. very straight boat for a 1969 model, had only 2 owners,  have rowing oars, Trailer very good condition new working lights, wheel bearings repacked, with marine bearing grease,  new tires last year, spare on trailer, have 2 spare tires with no rims. battery & battery box , life jackets , gas tank & hose. Motor is a 9.9 Johnson , 1983 electric start, tiller handle , 120 pounds compression both cylinders, new water pump impeller, new lower unit gear oil motor starts easy with pull rope or electric start & runs great,this motor can be changed to a 15 horse with a fifteen horse carbureator installed.  I will sell the boat & trailer together for $ 700.00 or best offer and keep the motor or sell boat, motor & trailer all together was $1550.00  now 1375.00or best reasonable offer choice of motors Also have a 6 hp johnson runs good would sell with boat and trailer and accesories for $1050.00  consider, offer or partial trade. I do not respond to E-mails or texts call Jerry show contact info",,5883631748,,16,,,,,,power,,16 ft Starcraft 9.9 johnson electric start tiller,https://decatur.craigslist.org/boa/5883631748.html,
31,,,2016-11-18 03:28,"This motor has good even compression, rebuilt carb, rebuilt fuel pump, new fuel line, including fuel connector on motor redone, Rebuilt Starter, replaced starter cylnoid.  wiring in good condition. New water pump impeller. Pressure tested lower unit. new lower unit gear oil, prop is in good shape. Have run this motor over a week in a barrel numerous times to make sure it does everything it is supposed to do. Make somebody a good dependable motor.  Might consider partial trade Asking 1375.00 or best reasonable offer   Also have 1987 Mercury 45hp  Classic 50 tiller handle with power trim long shaft on craigslist both motors are lake ready    I do not respond to E-mails or texts                                                             If interested call Jerry show contact info thanks",,5881792667,,1,,,,,,sail,,1985 Mercury 35hp tiller handle electric start long shaft,https://decatur.craigslist.org/boa/5881792667.html,
32,,,2016-11-18 03:23,"Runs & looks great. motor has good even compression, rebuilt carbs & fuel pump, new fuel lines, new water pump impeller, lower unit pressure tested with new gear oil, stainless steel prop, with plaining finn. Electric start. It has had a new recent new ignition stater & switch box. Everything on this motor including power trim works like it is supposed to. This motor does not have a lot of hours on it. it is a fairly low hours motor & has been well maintained. The pictures are not real clear This motor has very few scratches or scuff marks. It looks much better than the pictures. If interested I have references. I do not respond to E-mails or texts might consider partial trade. prefer cash was asking $1800.00 fall special now $1650.00 or best reasonable offer interested call Jerry show contact info thanks",,5881791474,,14,,,,,$1650,power, (Decaturl),1987 Mercury 45 hp Tiller handle  Classic 50 w/ power trim,https://decatur.craigslist.org/boa/5881791474.html,
