,condition,coord_pair,date,description,engine hours (total),id,lat,length overall (LOA),long,make / manufacturer,map_URL,model name / number,price,propulsion type,region,title,url,year manufactured
87,like new,,2016-12-01 07:04,"The Great Escape. You have been counting on this weekend for a while. And you want nothing but smooth sailing so you can enjoy your time off. The 2007 TAHOE Q4 F/S was made just for you. Plan your escape today with the TAHOE. With room on board for 7 people, you can take all of your friends to have fun for the weekend.",,5900420398,,20,,Tahoe,,Q4 SKI AND FISH,$8300,power," (Rockford,IL)",Nice '07 Tahoe Q4 Fish and Ski with 150HP Mercrury EFI Motor,https://rockford.craigslist.org/boa/5900420398.html,2007
88,like new,"['42.098100', '-88.690800']",2016-11-30 23:38,"Like brand new.Used less then 100 hours includes trailer. Call Frank show show contact info DON'T call to sell! The Kawasaki Jet Ski STX-15F is equipped with the strongest engine in its class, so you can expect to mind-blowing performances combined with a great agility and perfect stability at high speeds. Talking about the engine, the STX-15F is propelled by a four-stroke, four-cylinder inline unit with a displacement of 1,498 cc. The engine develops an impressive output of 160 hp and apart from being strong it is also pretty efficient. It even managed to earn a Three-Star Ultra-Low Emsissions rating from the California Air Resources Board and meets the Environmental Protection Agency's strictest standards. It is also worthy of being mentioned that the hull size is optimized for a sporty ride, while the injection-molded sponsons deliver a great turning.",100,5862472493,42.098100,15,-88.690800,Kawasaki,"https://maps.google.com/maps/preview/@42.098100,-88.690800,16z",STX15-F,$8500,power,,2013 Kawasaki jet ski STX15-F/trailor - $8500 (Geona),https://rockford.craigslist.org/boa/5862472493.html,2013
89,new,"['43.387460', '-88.635635']",2016-11-30 15:43,"2017 SeaArk MV2072 20' Jon boat with a 72"" Bottom, 92"" Beam and 1/8"" Hull. This boat has an 1/8"" Floor, and removable bowfishing deck. This deck has a door for your trolling motor, and is easily removable. Also comes with an Aluminum flat top center console with forward box, that can be installed where you want, or use the boat as a tiller. We can rig the boat for you with your choice of outboards as well. We deal with Mercury, Suzuki, and Evinrude. Financing is available with as little as Zero Down!  Contact Tanner with any questions",,5860926575,43.387460,20,-88.635635,SeaArk,"https://maps.google.com/maps/preview/@43.387460,-88.635635,16z",MV2072,,power,,SeaArk MV2072 Bowfishing Boat,https://rockford.craigslist.org/bod/5860926575.html,2017
90,good,,2016-11-30 11:53,"Up for sale is my prize 16.5 ft Backtroller. Good condition, everything works. Trailer needs wheel bearings. has been stored inside heated garage since i bought her. Life has got in the way, I no longer have the time to use her, or the space to store her. I added a canvas canopy last year. 25hp tiller in good working order. Livewell, rod locker, all keys to locking bins. bow mount trolling motor. A few scuffs on the paint, but a great reliable boat. Cash or trade for CNC lathe/ F350/F450 Ford Truck preferably a flat bed. Price will go up in the spring. Thanks for looking. No. I don't need help selling.",1000,5899337471,,16,,Sea Nymph,,Backtroller 16.5,$3000,power, (Dekalb),1992 Sea Nymph Backtroller,https://rockford.craigslist.org/boa/5899337471.html,1992
91,good,"['42.097713', '-90.156212']",2016-11-30 11:29,1979 BASS TRACKER HOMEMADE TRAILER (HAS REGISTRATION) 1998 40HP FORCE -3 SEATS -RUNNING LIGHTS -POWER TRIM -ELECTRIC START -LOTS OF STORAGE GREAT STARTER FISHING BOAT READY TO HIT THE WATER TODAY -M&M MARINE FOR MORE USED BOATS CHECK OUT OUR WEBSITE http://mmmarineinc.com/,,5868932107,42.097713,16,-90.156212,BASS TRACKER,"https://maps.google.com/maps/preview/@42.097713,-90.156212,16z",16' BASS,$1895,power, (M&M MARINE),1979 BASS TRACKER,https://rockford.craigslist.org/bod/5868932107.html,1979
92,new,"['42.098509', '-90.157113']",2016-11-30 11:28,"SCRATCH AND DENT JON BOAT SALE! BRAND NEW BOATS MARKED DOWN! 2016 TWO 1036 -$599 2016 ONE 1442 WITH LIVE WELL -$1,472 2017 TWO 1648 -$1,845 2016 TWO MV1648 SPLIT REAR -$1,968 CALL OR EMAIL FOR MORE INFORMATION THANK YOU -M&M MARINE YOUR ALUMACRAFT DEALER FOR MORE NEW OR USED JON BOATS CHECK OUT OUT WEBSITE http://mmmarineinc.com/",,5868747785,42.098509,16,-90.157113,ALUMACRAFT,"https://maps.google.com/maps/preview/@42.098509,-90.157113,16z",JON BOATS,,power,,SCRATCH AND DENT JON BOAT SALE,https://rockford.craigslist.org/bod/5868747785.html,2016
93,new,"['42.098605', '-90.156555']",2016-11-30 11:28,2017 EXCEL 1754 F4 MAX 4 CAMO 2017 1754 Diamond CITY TRAILER 2017 37 EFI MUD BUDDY MAX 4 CAMO -HEAD LIGHTS -3 SEAT BASES DOWN THE FLOOR -FUEL LINE RAN TO FRONT -RUNNING LIGHTS -FLOOR LIGHTS -GUN BOX -CUP HOLDER - RAIL GRAB HANDLE -TROLLING MOTOR KIT -4 PERSON CAP -55 MAX HP -POWER TRIM -ELECTRIC START M&M MARINE YOUR EXCEL DEALER FOR MORE EXCEL BOATS OR MUD MOTORS CHECK OUT OUR WEBSITE http://mmmarineinc.com/ OR LIKE US ON FACEBOOK FOR NEW INVENTORY UPDATES @MNMMARINE,0,5861393320,42.098605,17,-90.156555,EXCEL,"https://maps.google.com/maps/preview/@42.098605,-90.156555,16z",1754 F4,,power,,2017 1754 EXCEL SWV F4,https://rockford.craigslist.org/bod/5861393320.html,2017
94,good,"['42.329500', '-89.033500']",2016-11-30 09:18,"I have a small 1032 Alumacraft Jon Boat for sale. I have decked and carpeted the boat and added lots of accessories. The trolling motor is a 55lb Minn Kota with autopilot foot pedal. There is an on board charger, bilge pump, and a 31 series deep cycle battery. Small outboard not included. It is on a shore lander tilt trailer (not included) that I may sell as well. This setup works great, but I fish with my brother in law and am in the market for a larger boat. Will consider trades/partial trades for a 14x48 ( or wider) job boat.",,5899050708,42.329500,10,-89.033500,Alumacraft,"https://maps.google.com/maps/preview/@42.329500,-89.033500,16z",1032,$650,power,,One Man Fishing Machine,https://rockford.craigslist.org/boa/5899050708.html,2012
95,,"['41.774100', '-88.439700']",2016-11-30 08:58,"Project boat that comes with all the parts just don't have time to do it. All new seats, pumps electrical,rubber paint for in side the boat lights to much to name. Has 35hp Mec motor for it 1500obo",,5899018761,41.774100,16,-88.439700,,"https://maps.google.com/maps/preview/@41.774100,-88.439700,16z",,$1500,power,,Winter project,https://rockford.craigslist.org/boa/5899018761.html,
96,good,,2016-11-30 08:38,Bayliner w 85hp force outboard & trailer..need gone asap...650 obo.,,5898989046,,17,,Bayliner,,,$650,power, (Dixon),Bayliner w outboard & controls,https://rockford.craigslist.org/boa/5898989046.html,1985
97,,,2016-11-29 16:41,looking for any unwanted out boards mainly non running,,5898261676,,1,,,,,,power,,iso ur unwanted outboards,https://rockford.craigslist.org/boa/5898261676.html,
98,new,[],2016-11-29 11:09,"New 2016 Coach 25RF Pontoon with all the options! Last one in stock and ready to move! Sale price was $60,659.00 Now $46,995! This is the deal you've been waiting for! Contact me for more pictures and information. We have new trailers, or can deliver anywhere.",0,5880828990,,25,,Coach,https://maps.google.com/?q=loc%3A+Grand+Ave+at+Washington+Fox+Lake+IL+US,25RF,$46995,power, (Fox Lake),"2016 Coach 25RF Tri-toon, Honda 200hp",https://rockford.craigslist.org/bod/5880828990.html,2016
99,excellent,"['42.299100', '-89.634500']",2016-11-29 10:02,"24ft cuddy cabin with head, freshly rebuilt 351W with rebuilt OMC Stringer 800.  Set up for depth and radar, just needs the HUD and brain (sold it separately) down rigger mounts, trolling dam on outdrive,  shiny paint, new alternator, voltage regulator, and belts.  Shore power, dual batteries, and a battery tender.  New freeze plugs.  Kicker motor mount.  This boat is the cleanest late 70'a fishing boat you'll ever find. Shiny paint, and everything works.  Even comes with do k lights and life jackets, and the tandem axle EZ load trailer, plus all the coast guard compliant gear.  Ready to go.  Will trade for Harley, or old diesel truck, or jeep wrangler.",476,5897522673,42.299100,24,-89.634500,Slickcraft,"https://maps.google.com/maps/preview/@42.299100,-89.634500,16z",SS240,$1500,power, (Freeport),1978 Slickcraft SS240 by Tiara,https://rockford.craigslist.org/boa/5897522673.html,1978
