,condition,coord_pair,date,description,engine hours (total),id,lat,length overall (LOA),long,make / manufacturer,map_URL,model name / number,price,propulsion type,region,title,url,year manufactured
86,excellent,[],2016-11-29 18:05,"NEW HEAVILY-DISCOUNTED 2016 GEKKO REVO 7.1 DEMO WITH ONLY 5 ENGINE HOURS!  Built for bigger crowds and families, the REVO 7.1 is deeper and longer than the REVO 6.7.  Also born out of aerospace technology, world class performance is in its DNA. Sweeping styling and abundant features are sure to turn heads at the ramp, all while winning over every rider on the water. A 350 hp Indmar Venom inboard direct-drive engine powers this affordable wakeboard boat.  Warranties include:  limited lifetime transferable hull and deck, 5-year bow-to-stern, 3-year engine, and 5-year trailer warranty (excluding wheels and brakes).  Optional equipment includes:  lime green split graphic, deluxe mooring cover w/logo and tower slots, Revo Quick-Fold wake tower including; rotating board racks, integrated bimini top, and SkyLon Vector tower speakers; Concert package 2 (includes; deck, 4 speakers, tower speakers, and Kicker sub w/5-ch amp), Gekko cruise control and Zero-Off wake GPS speed control, Maxwave Plus ballast tank system (1405 lb capacity), pull-up stainless cleats, and dual battery system.  Features include:  full walk-thru windshield, tilt steering wheel, Polk Sirius ready AM/FM stereo w/bluetooth, gauges including; tachometer, oil pressure, engine temp, voltmeter, and fuel; navigation/anchor lights, blower, bilge pump, interior lights, electric horn, 12-volt power outlets, bow seating w/removable cushions and under seat storage, bow filler cushion, bow stainless hand rails, passenger console cooler w/drain, no-slip fiberglass floor w/snap-out carpet, passenger console large storage compartment, U-shaped cockpit seating w/removable cushions and under storage, driver's swivel bucket seat w/slider and flip-up bolster, CIPA 360 Vision tournament rearview mirror, beverage holders, stern ski/tow pylon, large padded stern sundeck, stern port and starboard large capacity storage compartments, (4) stainless pop-up mooring cleats, padded swim platform, fire extinguisher, (2) marine cranking batteries, 37-gallon fuel tank, and 14-person carrying capacity.  Also included is a custom Boat Mate tandem axle bunk trailer including; surge brakes, swing tongue, 14"" aluminum wheels, spare tire w/mounting bracket, padded fender steps, side centering poles, swivel jack, bearing buddies, and Starbrite ratchet tie down straps.  Trades will be considered and delivery is available.  Competitive financing rates and terms are also available.  Approximate payment of $529/mo. w/20% down for 144 mo. (WAC).  Leaders RPM is one of the largest marine and powersports dealers in the Midwest with over 70,000 sq ft of showroom, parts, and service under one roof located in Kalamazoo, MI.  Price is plus freight, prep, and sales tax/fees and is subject to change without notice.  For more information, please call toll free show contact info Additional photos and video are available at www.leadersrpm.com.",5,5876443621,,23,,Gekko,https://maps.google.com/?q=loc%3A+%38%35%30%30+W%2E+Main+Kalamazoo+MI+US,Revo 7.1,$58999,power, (Leaders RPM),2016 Gekko Revo 7.1 Demo With Only 5 Engine Hours! Heavily Discounted!,https://kalamazoo.craigslist.org/bod/5876443621.html,
87,excellent,[],2016-11-29 18:05,"CLEAN 2010 TRACKER 16 PANFISH WITH ONLY 19 ENGINE HOURS!  A 30 hp Mercury 4-stroke EFI outboard with power trim powers this clean aluminum fishing boat.  Features include:  Ezy-Stik II steering, MotorGuide 12v 46lb thrust trolling motor, Lowrance X51 Pro fish/depth finder, bilge pump, navigation lights, bow trolling motor plug, raised bow fishing deck w/storage compartment, aerated livewell w/seat cushion, driver/passenger folding seats w/under storage, port and starboard side rod storage, stern battery storage, welded aluminum hull, 10-gallon fuel tank, marine cranking battery, deep cycle trolling motor battery, (4) stainless mooring cleats, and 4 person carrying capacity.  Also included is a TrailStar bunk trailer including; 13"" wheels, composite fenders w/steps, bearing buddies, tie down straps, and swivel jack.  This package is in excellent condition overall with minimal wear.  There are minor cosmetic scuffs/scratches on the exterior and graphics (see pics/video).  It has been inspected by our factory-trained technicians and is mechanically sound.  Trades will be considered and delivery is available.  Competitive financing rates and terms are also available.  Approximate payment is $177/mo. for 48 mo. with 20% down (WAC).  Leaders RPM is one of the largest marine and powersports dealers in the Midwest with over 70,000 sq ft of showroom, parts, and service under one roof located in Kalamazoo, MI.  Price is plus sales tax/fees and is subject to change without notice.  For more information, please call toll free show contact info Additional photos and video are available at www.leadersrpm.com.",19,5876438717,,16,,Tracker,https://maps.google.com/?q=loc%3A+%38%35%30%30+W%2E+Main+Kalamazoo+MI+US,Panfish 16,$8499,power, (Kalamazoo),CLEAN 2010 TRACKER 16 PANFISH WITH ONLY 19 ENGINE HOURS!,https://kalamazoo.craigslist.org/bod/5876438717.html,2010
88,excellent,[],2016-11-29 18:05,"NICE 2007 SYLVAN 1700 EXPLORER WITH ONLY 48 ENGINE HOURS!  A 75 hp Mercury 4-stroke EFI outboard with power trim powers this aluminum fishing boat.  Features include:  MinnKota Power Drive 55 lb thrust 12-volt trolling motor, Lowrance X52 depth/fish finder, side console w/smoked removable windshield, Faria gauges including; speedometer, tachometer, voltmeter and fuel; 12-volt power outlet, bilge pump, navigation/anchor lights, bow trolling motor plug, cockpit vinyl floor, raised bow fishing deck w/storage compartment, (2) removable swivel fishing chairs, port/starboard stern Cannon rod holders, Panther skeg guard, cockpit port/starboard side rod storage boxes, raised stern fishing deck w/storage compartment, bow aerated divided livewell with manual/auto fill, stern battery storage, (4) stainless mooring cleats, 31-gallon fuel tank, cranking battery, deep cycle trolling motor battery, and 5 person carrying capacity.  Also included is a Shorelandr bunk trailer including; swing tongue, matching spare tire w/mount, composite fenders w/steps, side centering bunks, tie down straps, and swivel jack.  This package is in very good condition overall with minimal wear.  There are some minor cosmetic scuffs on the exterior (see pics/video).  It has been inspected by our factory-trained technicians and is mechanically sound.  Trades will be considered and delivery is available.  Competitive financing rates and terms are also available.  Approximate payment is $159/mo. for 84 mo. with 20% down (WAC).  Leaders RPM is one of the largest marine and powersports dealers in the Midwest with over 70,000 sq ft of showroom, parts, and service under one roof located in Kalamazoo, MI.  Price is plus sales tax/fees and is subject to change without notice.  For more information, please call toll free show contact info Additional photos and video are available at www.leadersrpm.com.",48,5876437944,,17,,Sylvan,https://maps.google.com/?q=loc%3A+%38%35%30%30+W%2E+Main+Kalamazoo+MI+US,1700 explorer,$11999,power, (Kalamazoo),NICE 2007 SYLVAN 1700 EXPLORER WITH ONLY 48 ENGINE HOURS!,https://kalamazoo.craigslist.org/bod/5876437944.html,2007
89,,[],2016-11-29 18:05,"2007 TRACKER 18 TUNDRA!  A 115 hp Mercury Optimax direct-injected outboard with power trim powers this aluminum fishing boat.  Features include:  Mercury Marine Trophy plus stainless prop, MinnKota Power Drive 70 lb thrust 24-volt trolling motor, Lowrance Elite-3X depth/fish finder, on-board battery charger, side console w/smoked windshield, gauges including; speedometer, tachometer, voltmeter and fuel; 12-volt power outlet, bilge pump, navigation/anchor lights, bow trolling motor plug and trim switch, Jensen AM/FM CD stereo w/AUX input, raised bow fishing deck w/storage compartment, center bow rod storage box w/rod tubes, bow/stern baitwells, bow/port rod storage w/tubes, cockpit port/starboard storage, (2) removable swivel fishing chairs, raised stern fishing deck, aerated stern divided livewell with manual/auto fill and recirc, stern battery storage, stern tray storage w/o trays, (4) stainless mooring cleats, courtesy lights, bow traction mat, welded aluminum hull, 40-gallon fuel tank, cranking battery, deep cycle trolling motor battery, and 7 person carrying capacity.  Also included is a TrailStar bunk trailer including; swing tongue, surge brakes, transom saver, 13"" wheels, fenders w/steps, tie down straps, bearing buddies, and swivel jack.  This package is in good condition overall with minimal wear and 241 engine hours.  There are some minor cosmetic scuffs on the exterior (see pics/video).  It has been inspected by our factory-trained technicians and is mechanically sound.  Trades will be considered and delivery is available.  Competitive financing rates and terms are also available.  Approximate payment is $181/mo. for 84 mo. with 20% down (WAC).  Leaders RPM is one of the largest marine and powersports dealers in the Midwest with over 70,000 sq ft of showroom, parts, and service under one roof located in Kalamazoo, MI.  Price is plus sales tax/fees and is subject to change without notice.  For more information, please call toll free show contact info Additional photos and video are available at www.leadersrpm.com.",241,5875919030,,18,,Tracker,https://maps.google.com/?q=loc%3A+%38%35%30%30+W%2E+Main+Kalamazoo+MI+US,18 Tundra,$13999,power, (Kalamazoo),2007 TRACKER 18 TUNDRA,https://kalamazoo.craigslist.org/bod/5875919030.html,2007
90,excellent,[],2016-11-29 18:04,"2012 NITRO 290 SPORT WITH ONLY 22 ENGINE HOURS AND MERCURY PRODUCT PROTECTION ENGINE WARRANTY THROUGH 6-12-2019!  A 200 hp Mercury 200XL OptiMax direct-injected outboard powers this fiberglass fish & ski.  Features include:  Solas stainless prop, SeaStar hydraulic/tilt steering, MinnKota Power Drive V2 24-volt 70 lb thrust trolling motor w/foot pedal, helm Lowrance Mark 5x pro depth/fish finder, bow Lowrance Hook 5x depth/fish finder, strap-on travel cover w/storage bag, cockpit fiberglass non-slip floor, full walk-thru windshield, passenger console glove box, Jensen AM/FM CD stereo w/AUX input, gauges include; speedometer, tachometer, trim, fuel, water pressure, and voltmeter; in-dash Ritchie compass, 12-volt power outlet, electric horn, bilge pump, navigation lights, raised bow casting platform w/removable deck insert and lounge cushions, bow storage compartments, bow aerated livewell w/recirc, bow trim and anchor lights switches, in-floor ski/board/rod storage, movable fishing chairs w/5 in-floor bases, removable table, port/starboard cockpit rod storage w/tubes, stern aerated livewell/baitwell w/recirc, stern flip-up jump seats w/under storage, transom telescoping boarding ladder, transom cooler, removable ski pylon, beverage holders, (4) pop-up stainless mooring cleats, on-board battery charger, deep cycle trolling motor battery, marine cranking battery, fire extinguisher, 47-gallon fuel tank, and 8 person carrying capacity.  Also included is a TrailStar tandem axle bunk trailer including; transom saver, surge brakes, swing tongue, 14"" wheels, tie down straps, diamond plate fender steps, and bearing buddies.  This package is in excellent overall condition with minimal wear and only 22 hours.  The exterior and the interior show minimal signs of wear (see pics/video).  It has been inspected by our factory-trained technicians and is mechanically sound.  Trades will be considered and delivery is available.  Competitive financing rates and terms are also available.  Approximate payment of $281/mo. w/20% down for 144 mo. (WAC).  Leaders RPM is one of the largest marine and powersports dealers in the Midwest with over 70,000 sq ft of showroom, parts, and service under one roof located in Kalamazoo, MI.  Price is plus sales tax/fees and is subject to change without notice.  For more information, please call toll free show contact info Additional photos and video are available at www.leadersrpm.com.",22,5871800228,,19,,Nitro,https://maps.google.com/?q=loc%3A+%38%35%30%30+W%2E+Main+Kalamazoo+MI+US,290 Sport,$31999,power, (Kalamazoo),2012 NITRO 290 SPORT WITH ONLY 22 ENGINE HOURS!,https://kalamazoo.craigslist.org/bod/5871800228.html,2012
91,excellent,[],2016-11-29 18:04,"VERY NICE 2012 BAYLINER 175 BOWRIDER!  A 135 hp Mercruiser 3.0L 4-cylinder I/O with TKS (Turn Key Start) powers this affordable fiberglass bowrider.  Features include:  color coordinated bimini top, full walk-thru windshield, Jensen AM/FM stereo w/AUX input, Faria gauges including; speedometer, tachometer, oil pressure, voltmeter, engine temp, and fuel; blower, bilge pump, electric horn, navigation lights, tilt steering, bow seating w/removable cushions and under storage, driver's swivel seat w/slider, port cockpit back-to-back seat (lays flat to make sunlounger), in-floor ski/board storage, (2) stern jump seats w/removable cushions (starboard side reveals step to transom), passenger safety handles, beverage holders, fiberglass extended swim platform w/telescoping boarding ladder, transom stainless ski/tow hook, (4) stainless mooring cleats, fire extinguisher, marine cranking battery, 21-gallon fuel tank, and 7 person carrying capacity.  Also included is a Karavan bunk trailer including; swing tongue, 13"" wheels, composite fenders w/steps, bearing buddies, and swivel jack.  This boat is in excellent overall condition with minimal wear.  There are minor cosmetic scuffs/scratches on the exterior and decals (see pics/video).  It has been inspected by our factory-trained technicians and is mechanically sound.  Trades will be considered and delivery is available.  Competitive financing rates and terms are also available.  Approximate payment of $194/mo. w/20% down for 84 mo. (WAC).  Leaders RPM is one of the largest marine and powersports dealers in the Midwest with over 70,000 sq ft of showroom, parts, and service under one roof located in Kalamazoo, MI.  Price is plus sales tax/fees and is subject to change without notice.  For more information, please call toll free show contact info Additional photos and video are available at www.leadersrpm.com.",,5871799491,,17,,Bayliner,https://maps.google.com/?q=loc%3A+%38%35%30%30+W%2E+Main+Kalamazoo+MI+US,175 BR,$14999,power, (Kalamazoo),VERY NICE 2012 BAYLINER 175 BOWRIDER!,https://kalamazoo.craigslist.org/bod/5871799491.html,2012
92,excellent,[],2016-11-29 18:04,"NICE 2013 STRATOS 176 VLO WITH ONLY 82 ENGINE HOURS AND MERCURY PRODUCT PROTECTION WARRANTY THRU 8-2-2018!  A 75 hp Mercury Optimax direct-injected outboard with power trim powers this fiberglass fishing boat.  Features include: storage cover, stainless prop, MinnKota Edge 45 lb thrust 12-volt 5-speed trolling motor, MinnKota 106D on-board battery charger, Lowrance HDS 5 lake insight fish/depth finder, bow Humminbird 160 fish finder, side console w/windscreen, gauges including; speedometer, tachometer, trim, and fuel; bilge pump, navigation/anchor lights, electric horn, lighted switches, raised bow and stern fishing platforms, bow recessed trolling motor pedal storage, bow hold-down cords, (2) swivel fishing chairs, bow storage compartments, center rod box w/rod tubes, port cockpit rod storage w/tubes, bow/cockpit/transom traction mats, center folding cockpit seat, port/starboard side storage, stern divided aerated livewell w/timed fill and recirc, transom 2-step boarding ladder, LED courtesy lights, (4) stainless pop-up mooring cleats, beverage holders, cranking battery, deep cycle trolling motor battery, fire extinguisher, 33-gallon fuel capacity, and 4 person carrying capacity.  Also included is a E-Z Loader bunk trailer including; swing tongue, 13"" aluminum wheels, matching spare tire w/mounting bracket, diamond plate fender steps, bearing buddies, tie down straps, and swivel jack.  This boat is in excellent overall condition with minimal wear.  There are minor cosmetic scuffs on the exterior and rubrail (see pics/video).  It has been inspected by our factory-trained technicians and is mechanically sound.  Trades will be considered and delivery is available.  Competitive financing rates and terms are also available.  Approximate payment of $229/mo. w/20% down for 84 mo. (WAC).  Leaders RPM is one of the largest marine and powersports dealers in the Midwest with over 70,000 sq ft of showroom, parts, and service under one roof located in Kalamazoo, MI.  Price is plus sales tax/fees and is subject to change without notice.  For more information, please call toll free show contact info Additional photos and video are available at www.leadersrpm.com.",82,5871798204,,18,,Stratos,https://maps.google.com/?q=loc%3A+%38%35%30%30+W%2E+Main+Kalamazoo+MI+US,176 VLO,$17999,power, (Kalamazoo),NICE 2013 STRATOS 176 VLO WITH ONLY 82 ENGINE HOURS!,https://kalamazoo.craigslist.org/bod/5871798204.html,2013
93,excellent,[],2016-11-29 18:04,"NICE 2015 SUN TRACKER 22 DLX FISHIN BARGE WITH NEW 40 HP MERCURY OUTBOARD AND TRAILER INCLUDED!  A new 2016 Mercury 40 hp Command Thrust 4-stroke EFI outboard with a 3-year factory warranty powers this pontoon boat package.  Features include:  color coordinated bimini top, Jensen AM/FM CD stereo w/AUX-MP3 ports, gauges including; tachometer, fuel and trim; electric horn, 12-volt power outlet, navigation/anchor lights, courtesy lights, side console w/removable windscreen and under storage, drivers swivel bucket seat w/slider and flip-up armrests, bow and stern removable swivel fishing chairs, bow and stern aerated livewells, bow trolling motor plug and battery storage, (4) flush mounted rod holders (2 bow, 2 stern), (2) 2-rod upright racks, composite seat bases and frames, starboard rod storage, wide port side entry/exit door, bow entry/exit door, stern L-group seating w/under storage, removable table w/2 in-floor bases, padded sundeck w/pop-up changing room curtain, stern storage compartment, rear exit w/4-step boarding ladder, full vinyl floor, 24"" diameter pontoons, beverage holders, (4) mooring cleats, fire extinguisher, marine cranking battery, nylon fence rail spacers, aluminum transom, 32.1-gallon transom fuel tank, and 10 person carrying capacity.  Also included is a tandem axle TrailStar float-on bunk trailer including; surge brakes, 13"" wheels, walk-up bow stand, bearing buddies, spare tire mounting bracket (spare tire not included), tie-down straps, and swivel jack.  This boat is in excellent overall condition with minimal wear. There are minor cosmetic dings in the fencing (see pics/video). It has been inspected by our factory-trained technicians and is mechanically sound.  Trades will be considered and delivery is available.  Competitive financing rates and terms are also available.  Approximate payment of $199/mo. w/20% down for 120 mo. (WAC).  Leaders RPM is one the largest marine and powersports dealers in the Midwest with over 70,000 sq ft of showroom, parts, and service under one roof located in Kalamazoo, MI.  Price is plus sales tax/fees and is subject to change without notice.  For more information, please call toll free show contact info Additional photos and video are available at www.leadersrpm.com.",,5869970249,,22,,Sun Tracker,https://maps.google.com/?q=loc%3A+%38%35%30%30+W%2E+Main+Kalamazoo+MI+US,Fishin Barge 22 DLX,$19999,power, (LEADERS RPM),2015 SUN TRACKER 22 DLX FISHIN BARGE W/NEW 40 HP MERCURY OUTBOARD!,https://kalamazoo.craigslist.org/bod/5869970249.html,2015
94,good,[],2016-11-29 18:04,"NICE 2007 LOWE SUNCRUISER 200 TRINIDAD WITH ONLY 118 ENGINE HOURS!  A 60 hp Mercury 4-stroke EFI outboard with power trim powers this nicely equipped pontoon.  Features include:  color coordinated bimini top w/removable vinyl, snap-on mooring cover, fiberglass console w/removable windscreen and storage, Boss AM/FM CD stereo w/AUX-USB ports w/weather guard, (4) marine speakers, gauges including: speedometer, tachometer, fuel, trim and voltmeter; electric horn, anchor/navigation lights, docking lights, courtesy lights, 12-volt power outlet, emergency safety lanyard, circuit breakers, removable table w/beverage holders, driver swivel bucket seat w/slider, port and starboard bow couches w/under storage (starboard couch is a layback),  stern L-shaped couch w/under seat storage, aft padded sundeck, beverage holders, (2) entry/exit doors (port/bow), rear exit w/fold-down 3-step boarding ladder, (4) mooring cleats, 24-gallon fuel tank, fire extinguisher, marine cranking battery, 8'6"" beam, marine carpet, powder-coated railings, nylon rail spacers, M-bracket skirting, all-aluminum transom, 25"" diameter pontoons, and 13 person carrying capacity.  This boat is in good overall condition with minimal wear.  There are minor cosmetic exterior scuffs/scratches and minimal carpet wear (see pics/video).  The trailer shown is not included, however, new and used float-on or scissor trailers are available starting at $1,899.  Trades will be considered and delivery is available.  Competitive financing rates and terms are also available.  Approximate payment is $194/mo. for 84 mo. with 20% down (WAC).  Leaders RPM is one of the largest marine and powersports dealers in the Midwest with over 70,000 sq ft of showroom, parts, and service under one roof located in Kalamazoo, MI.  Price is plus sales tax/fees and is subject to change without notice.  For more information, please call toll free show contact info Additional photos and video are available at www.leadersrpm.com.",118,5869690047,,22,,Lowe Suncruiser,https://maps.google.com/?q=loc%3A+%38%35%30%30+W%2E+Main+Kalamazoo+MI+US,200 Trinidad,$14999,power, (Kalamazoo),NICE 2007 LOWE SUNCRUISER 200 TRINIDAD WITH ONLY 118 ENGINE HOURS!,https://kalamazoo.craigslist.org/bod/5869690047.html,2007
95,excellent,[],2016-11-29 18:04,"NICE 2013 SWEETWATER 2086 SW WITH ONLY 52 ENGINE HOURS!  A 50 hp Honda 4-stroke EFI outboard with power trim powers this nicely equipped pontoon.  Features include:  color coordinated bimini top w/removable vinyl, snap-on mooring cover, fiberglass console w/removable windscreen and storage, Sony AM/FM CD stereo w/AUX port, (4) marine speakers, Humminbird 143 depth/fish finder, Faria gauges including: speedometer, tachometer, fuel, trim and voltmeter; electric horn, anchor/navigation lights, docking lights, courtesy lights, 12-volt power outlet, emergency safety lanyard, circuit breakers, removable table w/beverage holders, driver swivel bucket seat w/slider and flip-up arm rests, port and starboard bow couches w/under storage (starboard couch is a layback),  stern L-shaped couch w/under seat storage, aft padded sundeck, pop-up changing room w/privacy curtain, beverage holders, (2) entry/exit doors (port/bow), rear exit w/fold-down 5-step boarding ladder, (4) mooring cleats, 21-gallon transom fuel tank, fire extinguisher, marine cranking battery, 8'6"" beam, marine carpet, powder-coated railings, nylon rail spacers, M-bracket skirting, all-aluminum transom, 23"" diameter pontoons, and 10 person carrying capacity.  This boat is in excellent overall condition with minimal wear.  There are minor cosmetic exterior scuffs and scratches (see pics/video).  The trailer shown is not included, however new and used float-on or scissor trailers are available starting at $1,899.  Trades will be considered and delivery is available.  Competitive financing rates and terms are also available.  Approximate payment is $189/mo. for 120 mo. with 20% down (WAC).  Leaders RPM is one of the largest marine and powersports dealers in the Midwest with over 70,000 sq ft of showroom, parts, and service under one roof located in Kalamazoo, MI.  Price is plus sales tax/fees and is subject to change without notice.  For more information, please call toll free show contact info Additional photos and video are available at www.leadersmarine.com.",52,5869689178,,20,,Sweetwater,https://maps.google.com/?q=loc%3A+%38%35%30%30+W%2E+Main+Kalamazoo+MI+US,2086 SW,$18999,power, (Kalamazoo),NICE 2013 SWEETWATER 2086 SW WITH ONLY 52 ENGINE HOURS!,https://kalamazoo.craigslist.org/bod/5869689178.html,2013
