,condition,coord_pair,date,description,engine hours (total),id,lat,length overall (LOA),long,make / manufacturer,map_URL,model name / number,price,propulsion type,region,title,url,year manufactured
76,good,[],2016-11-30 09:10,"NICE 2007 MANITOU 24 OASIS TRI-TOON WITH SPORT HANDLING PACKAGE AND ONLY 197 ENGINE HOURS!  A 250 hp Yamaha V-max HPDI direct-injected outboard powers this nicely equipped tri-toon.  Features include:  color-coordinated bimini top w/acrylic-fabric and boot, snap-on mooring cover, ski/tow mini tower, fiberglass molded console w/removable windscreen and storage, Kenwood AM/FM CD stereo w/USB-AUX ports and bluetooth, Kicker speakers, Faria gauges including; fuel, tachometer, speedometer, voltage, hour meter, and trim; Lowrance M68c depth/fish finder, 12-volt power outlet, circuit breakers, lighted helm switches, tilt-steering, courtesy lights, navigation/anchor lights, docking lights, electric horn, removable table, livewell w/table top, bow trolling motor plug, bow highback reclining bucket seats w/flip-up armrests, driver swivel bucket seat w/slider, port and starboard bow couches w/storage (starboard couch is a layback), pop-up changing room w/curtain, stern L-shaped couch w/under storage, aft padded sundeck, beverage holders, 38-gallon transom fuel tank, (4) stainless mooring cleats, marine grade carpet, 12-person capacity, bow/port entry/exit doors (port side has fold down ladder), rear exit w/3-step telescoping boarding ladder, (2) 23"" diameter pontoons, (1) 27"" diameter center pontoon, stainless marine hardware, nylon fence rail spacers, M-bracket skirting, fire extinguisher, battery shut-off switch,  and marine cranking batteries.  Also included is a Genesis float-on tandem axle bunk trailer including; swivel jack, walk-up bow stand, tie-down straps, and electric brakes.  This boat is in very good overall condition with minimal wear and fading (see pics/video).  Trades will be considered and delivery is available.  Competitive financing rates and terms are also available.  Approximate payment is $245/mo. for 144 mo. with 20% down (WAC).  Leaders RPM is one of the largest marine and powersports dealers in the Midwest with over 70,000 sq ft of showroom, parts, and service under one roof located in Kalamazoo, MI.  Price is plus sales tax/fees and is subject to change without notice.  For more information, please call toll free show contact info Additional photos and video are available at www.leadersrpm.com.",197,5898951700,,23,,Manitou,https://maps.google.com/?q=loc%3A+%38%35%30%30+W%2E+Main+Kalamazoo+MI+US,24 Oasis SHP,$27999,power, (LEADERS RPM),NICE 2007 MANITOU 24 OASIS TRI-TOON WITH SPORT HANDLING PACKAGE!,https://kalamazoo.craigslist.org/bod/5898951700.html,2007
77,good,[],2016-11-30 09:08,"NICE 2000 RINKER 242 FIESTA VEE!  A 220 hp Mercruiser 5.0L V8 powers this nicely equipped cruiser.  Features include:  DECK, COCKPIT, and MECHANICAL;  snap-on cockpit cover, bimini top, Standard VHF marine radio, Boss AM/FM CD stereo w/AUX input and weather guard, digital depth gauge, Richie compass, tilt steering, hydraulic trim tabs, gauges including; tachometer, oil pressure, engine temp, trim, fuel, speedometer, and voltmeter; cockpit lights, nav/anchor lights, electric horn, circuit breakers, 12-volt power outlet, bilge pump, full walk-thru windshield w/steps to bow, bow deck w/stainless bow rail, bow pulpit w/anchor and roller, remote spotlight, windshield wiper, double wide back-to-back driver seat w/slider, port cockpit layback couch, aft bench seat w/under storage, beverage holders, non-slip fiberglass floor with snap-out carpet, extended swim platform w/telescoping boarding ladder, transom shower, walk-thru transom w/door, (6) stainless mooring cleats, stainless rubrail, Guest battery shut-off switch, Guest Charge Pro on-board battery charger, dockside water and shore power connection (cord not included); CABIN & FORWARD BERTH;  privacy door, forward berth w/storage and dinette table, 2-piece removable cushion set w/under storage, overhead lighting, deck hatch w/screen, port hull window, wraparound storage shelf, 12-volt power outlet, duplex outlet, hanging locker, and mirror;  AFT BERTH;  aft cabin w/privacy curtain, removable cushion/mattress, window w/screen, and overhead light;  GALLEY;  Norcold refrigerator, Sanyo microwave, Kenyon electric stove, Granulon counter top w/stainless sink, and (2) storage cabinets;  HEAD;  enclosed fiberglass head w/ shower, Jabsco marine toilet w/holding tank, fiberglass molded counter w/stainless sink, window w/screen and privacy curtain, full length door mirror, paper and towel holder cabinet, and stainless towel bar.  Also included is a Venture galvanized tandem-axle roller trailer including; surge brakes, tongue jack, 14"" wheels, composite fenders w/steps, and bearing buddies.  This boat is in nice overall condition with minimal wear.  There are minor scuffs/scratches on the exterior, pulpit is bent, and port side bow rail bent (see pics/video).  Package is sold as-is with no warranty.  Trades will be considered and delivery is available.  Competitive financing rates and terms are also available.  Approximate payment of $259/mo. w/20% down for 84 mo. (WAC).  Leaders RPM is one of the largest marine and powersports dealers in the Midwest with over 70,000 sq ft of showroom, parts, and service under one roof located in Kalamazoo, MI.  Price is plus sales tax/fees and is subject to change without notice.  For more information, please call toll free show contact info Additional photos and video are available at www.leadersrpm.com.",,5888134553,,24,,Rinker,https://maps.google.com/?q=loc%3A+%38%35%30%30+W%2E+Main+Kalamazoo+MI+US,242 Fiesta Vee,$19999,power, (LEADERS RPM),NICE 2000 RINKER 242 FIESTA VEE!,https://kalamazoo.craigslist.org/bod/5888134553.html,2000
78,good,[],2016-11-30 09:08,"NICE 2013 STARCRAFT 220 STARSTEP DECK BOAT WITH ONLY 25 ENGINE HOURS!  A 260 hp Mercruiser 5.0L MPI (multi-port injected) V8 engine with ECT (Emissions Control Technology) powers this loaded fiberglass deckboat.  Features include:  switchable thru-hull exhaust, canvas storage cover, bimini top, keel guard, fiberglass non-slip floor w/snap-in cockpit carpet, stern extended padded fiberglass swim platform w/3-step telescoping boarding ladder, fiberglass helm w/removable windscreen and under storage, fresh water sink w/removable holding tank, gauges include; tachometer, speedometer, fuel, oil pressure, engine temp, trim, and voltmeter; Jensen AM/FM bluetooth stereo w/AUX-USB ports, tilt steering wheel, courtesy lights, navigation/anchor lights, electric horn, 12-volt power outlet, recessed docking lights, bilge pump, blower, circuit breakers, driver swivel bucket seat w/slider and flip-up bolster, bow non-slip swim deck w/3-step telescoping boarding ladder and anchor locker, bow aerated livewell, stainless bow port/starboard hand rails, bow removable table w/in-floor base, starboard bow layback couch w/under seat storage, port side couch w/under storage, removable Igloo cooler, cockpit rod storage w/tubes, stern bench seat w/under storage, walk-thru transom w/aerated livewell, in-floor ski/board storage, lighted beverage holders, aft padded sundeck w/flip-up backrest, transom cooler/storage, stainless ski/tow hook, (4) stainless pop-up mooring cleats, fire extinguisher, marine cranking battery, 51-gallon fuel tank, and 12-person carrying capacity.  Also included is a Shorelandr tandem axle bunk trailer including; surge brakes, 13"" wheels, swing tongue, tie-down straps, bearing buddies, composite fenders w/steps, and swivel jack.  This boat is in very good overall condition with minor wear.  There are minor cosmetic scuffs/scratches on the exterior/graphics and minor interior carpet and upholstery wear (see pics/video).  It has been inspected by our factory-trained technicians and is mechanically sound.  Trades will be considered and delivery is available.  Competitive financing rates and terms are also available.  Approximate payment is $308/mo. for 144 mo. with 20% down (WAC).  Leaders RPM is one of the largest marine and powersports dealers in the Midwest with over 70,000 sq ft of showroom, parts, and service under one roof located in Kalamazoo, MI.  Price is plus sales tax/fees and is subject to change without notice.  For more information, please call toll free show contact info Additional photos and video are available at www.leadersrpm.com.",25,5886990833,,21,,Starcraft,https://maps.google.com/?q=loc%3A+%38%35%30%30+W%2E+Main+Kalamazoo+MI+US,220 Starstep,$35999,power, (LEADERS RPM),NICE 2013 STARCRAFT 220 STARSTEP DECK BOAT WITH ONLY 25 ENGINE HOURS!,https://kalamazoo.craigslist.org/bod/5886990833.html,2013
79,excellent,[],2016-11-30 09:08,"CLEAN 2009 GLASTRON 185 GT!  A 190 hp Volvo 4.3GL V6 engine powers this clean fiberglass bowrider.  Features include:  boat cover, bimini top, full walk-thru windshield, passenger console glove box, Boss AM/FM CD stereo w/Aux input, 12-volt power outlet, tilt steering, gauges including; tachometer, speedometer, fuel, oil pressure, engine temp, trim, and voltmeter; navigation/anchor lights, blower, bilge pump, bow seating w/under storage, removable cushion for step-thru bow, stainless passenger safety handles, fiberglass floor w/snap-out carpet, driver & passenger swivel bucket seats w/sliders (driver has flip-up bolster), in-floor ski/board storage, beverage holders, stern cockpit bench seat w/storage, aft padded sundeck, engine compartment storage, extended fiberglass swim platform w/3-step telescoping boarding ladder, stainless ski-tow hook, (4) stainless mooring cleats, 23-gallon fuel tank, fire extinguisher, marine cranking battery, and 8 person carrying capacity.  Also included is an E-Z Loader bunk trailer including; surge brakes, swing tongue, 14"" wheels, tie-down straps, bearing buddies, and swivel jack.  The package is in excellent overall condition with minimal wear.  There are minor cosmetic scuffs on the exterior and graphics (see pics/video).  It has been inspected by our factory-trained technicians and is mechanically sound.  Trades will be considered and delivery is available.  Competitive financing rates and terms are also available.  Approximate payment is $179/mo. for 120 mo. with 20% down (WAC).  Leaders RPM is one of the largest marine and powersports dealers in the Midwest with over 70,000 sq ft of showroom, parts, and service under one roof located in Kalamazoo, MI.  Price is plus sales tax/fees and is subject to change without notice.  For more information, please call toll free show contact info Additional photos and video are available at www.leadersrpm.com.",,5878041740,,18,,Glastron,https://maps.google.com/?q=loc%3A+%38%35%30%30+W%2E+Main+Kalamazoo+MI+US,185 GT,$17999,power, (LEADERS RPM),CLEAN 2009 GLASTRON 185 GT!,https://kalamazoo.craigslist.org/bod/5878041740.html,2009
80,excellent,[],2016-11-30 09:07,"NICE 2013 VOYAGER 20 SPORT CRUISE DELUXE TRI-TOON WITH ONLY 47 ENGINE HOURS!  A 115 hp Honda 4-stroke EFI outboard powers this nicely equipped tri-toon pontoon.  Features include:  color-coordinated bimini top w/acrylic-fabric and boot, snap-on mooring cover, ski/tow mini tower, fiberglass molded console w/removable windscreen and storage, Jensen AM/FM CD stereo w/USB-AUX ports, (4) marine speakers, Faria gauges include; fuel, tachometer, voltage, and trim; Faria digital depth gauge, 12-volt power outlet, circuit breakers, lighted helm switches, tilt-steering, navigation/anchor lights, docking lights, electric horn, removable table, driver swivel bucket seat w/slider, port and starboard bow couches w/storage (starboard couch is an extended layback), stern L-shaped couch w/under storage and table, aft padded sundeck w/understorage, composite seat bases, beverage holders, 41-gallon transom fuel tank, (4) stainless mooring eyes, marine grade carpet, aft vinyl floor, 11-person capacity, bow/port entry/exit doors, rear exit w/3-step heavy-duty folding boarding ladder, (3) 23"" diameter pontoons w/inboard lifting strakes, aluminum underskin, stainless marine hardware, nylon fence rail spacers, M-bracket skirting, fire extinguisher, and marine cranking battery.  The trailer pictured is NOT included, however, float-on pontoon trailers are available for purchase.  This boat is in excellent overall condition with minimal wear and fading (see pics/video).  Trades will be considered and delivery is available.  Competitive financing rates and terms are also available.  Approximate payment is $212/mo. for 120 mo. with 20% down (WAC).  Leaders RPM is one of the largest marine and powersports dealers in the Midwest with over 70,000 sq ft of showroom, parts, and service under one roof located in Kalamazoo, MI.  Price is plus sales tax/fees and is subject to change without notice.  For more information, please call toll free show contact info Additional photos and video are available at www.leadersrpm.com.",47,5878033614,,20,,Voyager,https://maps.google.com/?q=loc%3A+%38%35%30%30+W%2E+Main+Kalamazoo+MI+US,20 Sport Cruise Deluxe,$23999,power, (Kalamazoo),NICE 2013 VOYAGER 20 SPORT CRUISE DLX TRI-TOON W/ ONLY 47 ENGINE HOURS,https://kalamazoo.craigslist.org/bod/5878033614.html,2013
81,good,[],2016-11-30 09:07,"NICE 2006 AVALON 20 CC FNF!  A 50 hp Honda 4-stroke outboard powers this nice cruise-and-fish pontoon boat package.  Features include:  snap on cover, color coordinated bimini top, fiberglass console w/storage, Clarion AM/FM CD stereo w/weather guard, Humminbird 143 fish/depth finder, gauges including; tachometer, voltmeter, fuel, and trim; 12-volt power outlet, electric horn, navigation lights, (2) bow and (2) stern swivel fishing chairs w/under seat storage, stern aerated livewell, (2) bow and (2) stern rod holders, L-shaped port couch w/under seat storage, swivel drivers chair w/armrests, removable table, padded sundeck, pop-up changing room w/privacy curtain, beverage holders, (4) mooring cleats, fence rail spacers, aluminum transom, fire extinguisher, marine cranking battery, 24-gallon fuel tank, and 9 person carrying capacity.  This boat does not come with a trailer but trailer options are available.  This boat is in very good overall condition with minimal wear.  The interior carpet has minor stains and the exterior has minor cosmetic scuffs/scratches on the exterior as well as a cosmetic dent in the port toon (see pics/video).  It has been inspected by our factory-trained technicians and is mechanically sound.  Trades will be considered and delivery is available.  Competitive financing rates and terms are also available.  Leaders RPM is one of the largest marine and powersports dealers in the Midwest with over 70,000 sq ft of showroom, parts, and service under one roof located in Kalamazoo, MI.  Price is plus sales tax/fees and is subject to change without notice.  For more information, please call toll free show contact info Additional photos and video are available at www.leadersrpm.com.",,5878031161,,20,,Avalon,https://maps.google.com/?q=loc%3A+%38%35%30%30+W%2E+Main+Kalamazoo+MI+US,20 CC FNF,$12499,power, (Kalamazoo),NICE 2006 AVALON 20 CC FNF!,https://kalamazoo.craigslist.org/bod/5878031161.html,2006
82,excellent,[],2016-11-30 09:04,"NICE 2015 CREST 200 I WITH ONLY 94 ENGINE HOURS AND B.E.S.T. FACTORY ENGINE WARRANTY THRU 7-8-2020!  Features include:  bimini top w/acrylic-fabric and boot, factory-installed mooring cover, sea-grass flooring, fiberglass molded console w/storage and removable windscreen, Millenia AM/FM stereo w/MP3-USB port, (4) marine speakers, Faria gauges including; fuel, tachometer, and voltmeter; circuit breakers, lighted helm switches, tilt-steering, navigation/anchor lights, electric horn, driver swivel bucket seat w/slider and armrests, Roto-cast composite seat bases and frames, port and starboard bow couches w/storage compartments (starboard couch is a layback), removable table, port L-shaped layback couch w/under storage, beverage holders, aft padded sundeck w/storage, aft vinyl floor, 28-gallon transom fuel tank, ski/tow bar, (4) stainless mooring cleats, 10 person capacity, bow and port entry/exit doors, rear exit w/4-step heavy-duty boarding ladder, 8'6"" beam, 25"" diameter pontoons, nylon fence rail spacers, M-bracket skirting, fire extinguisher, and marine cranking battery.  Also included is a 2015 Wolverine float-on bunk trailer including; swivel jack, tie-down straps, and 13"" wheels.  Trades will be considered and delivery is available.  Competitive financing rates and terms are also available.  Approximate payment is $199/mo. for 120 mo. with 20% down (WAC).  Leaders RPM is one of the largest marine and powersports dealers in the Midwest with over 70,000 sq ft of showroom, parts, and service under one roof located in Kalamazoo, MI.  For more information, please call toll free show contact info Additional photos and video are available at www.leadersrpm.com.",94,5898945149,,19,,Crest,https://maps.google.com/?q=loc%3A+%38%35%30%30+W%2E+Main+Kalamazoo+MI+US,200 I,$19999,power, (LEADERS RPM),NICE 2015 CREST 200 I WITH ONLY 94 ENGINE HOURS!,https://kalamazoo.craigslist.org/bod/5898945149.html,2015
83,good,,2016-11-30 09:01,1990 Larson 228 International fishing boat....walk around cutty.... newer chevy 350 Vortec engine.... high torque starter motor.... holley carb....30 hours..... duo prop.... volvo out drive.... new shifter cables.... new drive shaft bellows 9.9 Yamaha trolling engine newer trailer.... brakes.... tires.... etc.... swim platform..... new exhaust manifold with .... thur the transom corsa mufflers.... big water boat..... will take hard waves... and big water.... lake Erie or Ocean .... 5 wells... etc....,,5873942264,,23,,,,,$9800,power, (0hio),23 ft larson fishing boat,https://kalamazoo.craigslist.org/bod/5873942264.html,
84,good,[],2016-11-29 18:05,"NICE 2008 TAHOE Q7i BOWRIDER!  A 190 hp Mercruiser 4.3L V6 engine powers this fiberglass bowrider.  Features include:  strap on factory boat cover, color-coordinated bimini top, BOSS AM/FM CD stereo w/AUX input, full walk-thru windshield, passenger console glove box, gauges including; speedometer, tachometer, engine temp, oil pressure, trim, fuel, and voltmeter; in-dash Ritchie compass, 12-volt power outlet, blower, bilge pump, electric horn, courtesy lights, navigation/anchor lights, u-shaped bow seating w/under storage, in-floor ski/board storage, driver/passenger swivel bucket seats (driver's side has slider), fiberglass no-slip floor w/snap-out carpet, port/starboard cockpit storage, beverage holders, stern cockpit bench seat w/under storage, padded stern sundeck, engine compartment storage, walk-thru transom w/slide-away cushion, integrated swim platform w/fold-down 4-step telescoping ladder, transom ski-tow loop/hook, transom cooler, (4) stainless pop-up mooring cleats, stainless rubrail insert and thru-hull fittings, marine cranking battery, 45-gallon fuel tank, fire extinguisher, and 9 person carrying capacity.  Also included is a tandem axle TrailStar bunk trailer including; swing tongue, surge brakes, swivel jack, bearing buddies, 13"" wheels, diamond plate fender steps, and tie down straps.  This package is in very good overall condition with only 426 engine hours.  There are minor scuffs/scratches on the exterior and a minor discolored area in the port side hull (see pics/video).  It has been inspected by our factory-trained technicians and is mechanically sound.  Trades will be considered and delivery is available.  Competitive financing rates and terms are also available.  Approximate payment of $199/mo. w/20% down for 120 mo. (WAC).  Leaders RPM is one of the largest marine and powersports dealers in the Midwest with over 70,000 sq ft of showroom, parts, and service under one roof located in Kalamazoo, MI.  Price is plus sales tax/fees and is subject to change without notice.  For more information, please call toll free show contact info Additional photos and video are available at www.leadersrpm.com.",426,5878026793,,20,,Tahoe,https://maps.google.com/?q=loc%3A+%38%35%30%30+W%2E+Main+Kalamazoo+MI+US,Q7i,$19999,power, (Leaders RPM),NICE 2008 Tahoe Q7i w/190 hp Mercruiser!,https://kalamazoo.craigslist.org/bod/5878026793.html,2008
85,excellent,[],2016-11-29 18:05,"SUPER CLEAN 2013 TRACKER TARGA V-18 COMBO WITH ONLY 54 ENGINE HOURS AND MERCURY PRODUCT PROTECTION WARRANTY THRU 5-8-2018!  A 150 hp Mercury 4-stroke EFI outboard with power trim powers this loaded aluminum deep-V fishing boat!  Features include:  MinnKota PowerDrive V2 70 lb thrust 24-volt trolling motor w/battery condition gauge, Lowrance Mark-5X Pro depth/fish finder, dual consoles w/full walk-thru windshield, passenger console glove box/cooler, Jensen AM/FM/CD w/USB-AUX inputs and (2) marine speakers, tilt steering, gauges including; tachometer, speedometer, fuel, voltmeter, water pressure, and trim; navigation/anchor lights, courtesy lights, bilge pump, electric horn, 12-volt power outlet, raised bow fishing deck w/storage compartment, bow aerated livewell w/manual-auto fill and recirc; bow panel including; outboard trim switch, livewell control switch, trolling motor plug, and 12-volt power outlet; bow glove box w/tackle boxes, port and starboard bow storage nets, removable deck filler, in-floor cockpit rod storage w/rod tubes, vinyl cockpit floor, port and starboard cockpit storage, port/starboard rod storage w/rod tubes, raised stern fishing platform w/storage, (2) stern flip-down jump seats, stern aerated livewell w/auto and manual fill, (2) movable swivel fishing chairs w/5 in-floor bases, driver and passenger swivel seats (driver's side has slider), aft boarding platform w/3-step telescoping ladder,  removable ski/tow pylon, passenger safety handles, beverage holders, (4) stainless mooring cleats, marine cranking battery, (2) deep cycle trolling motor batteries, fire extinguisher, and 6 person carrying capacity.  Also included is a custom TrailStar bunk trailer including; swing tongue, surge brakes, 14"" wheels, diamond plate fender steps, swivel jack, and tie down straps.  This package is in excellent overall condition with minimal wear.  There are minor cosmetic scratches on the exterior and starboard side decals (see pics/video).  The boat has been inspected by our factory-trained technicians and is mechanically sound.  Trades will be considered and delivery and competitive financing rates/terms are available.  Approximate payment is $229/mo. for 144 mo. with 20% down (WAC).  Leaders RPM is one of the largest marine and powersports dealers in the Midwest with over 70,000 sq ft of showroom, parts, and service under one roof located in Kalamazoo, MI.  Price is plus sales tax/fees and is subject to change without notice.  For more information, please call toll free show contact info Additional photos and video are available at www.leadersrpm.com.",54,5878003694,,19,,Tracker,https://maps.google.com/?q=loc%3A+%38%35%30%30+W%2E+Main+Kalamazoo+MI+US,Targa V-18 Combo,$25999,power, (Kalamazoo),SUPER CLEAN 2013 TRACKER TARGA V-18 COMBO!,https://kalamazoo.craigslist.org/bod/5878003694.html,2013
