,condition,coord_pair,date,description,engine hours (total),id,lat,length overall (LOA),long,make / manufacturer,map_URL,model name / number,price,propulsion type,region,title,url,year manufactured
35,like new,"['42.568632', '-83.754272']",2016-12-08 07:43,"Selling a 2013 Glastron GTS 205 with a 4.3 liter v6 220hp motor. This boat is immaculate and well cared for. This is not a GT series. It is the GTS so it has 3 colors and a few extra bells and whistles. It was purchased brand new in spring of 2015 with a Glastron single axle trailer. It also has the premium package so there are chrome and stainless accents. Engine has low hours. The boat had been maintained by the dealership and winterized for the season this year.  Storage has also been taken care of for the winter.   Also, it has always been taken out of the water after each use and stored inside for both the winter and when not being used.    Boat comes with many extras... Call for more information.",75,5910520470,42.568632,21,-83.754272,Glastron,"https://maps.google.com/maps/preview/@42.568632,-83.754272,16z",GTS205,$28500,power, (Brighton),Glastron GTS205,https://annarbor.craigslist.org/boa/5910520470.html,2013
36,,"['42.359400', '-88.842800']",2016-12-08 03:35,"1994 Polaris SL780 Waverunner Runs & drives great fun steady jetski! Pretty fast as well! Has no card but has recent WI sticker. 1993 Polaris SL750 Waverunner It currently needs a stator as we changed the cdi box. This waverunner is in near mint condition! Comes with registration card. I would really like to keep these 2 together. But will separate if needed. $ 1,950.00 Price includes a homemade 2 place trailer. We also have a bunch of polaris waverunner parts. If interested call: show contact info (Calls only) If N/A leave a message. Or text me @ show contact info (Texts only)",,5891131313,42.359400,9,-88.842800,,"https://maps.google.com/maps/preview/@42.359400,-88.842800,16z",,,power,,2 Waverunners & 2 Place Trailer,https://annarbor.craigslist.org/boa/5891131313.html,
37,,"['42.459600', '-83.909900']",2016-12-07 19:41,"FOR SALE: $1,500 Location: SE Michigan Hunt in style with this stealthy boat for the 2016 Duck Season! Built in 2011 from the Two-Man layout boat plans from www.waterfowl-works.com. Boat comes equipped with cowling, props (for the cowling), and trailer. This boat is wood construction overlaid with fiberglass. All bulkheads are sealed on the inside with epoxy. The boat is 12 feet long and 6 feet wide with cleats and bull rings on each end of the boat. The boat weighs approximately 225 lbs. This boat can fit two grown adults. We have put 6'7"" and 6'2"" hunters side by side in the boat comfortably. Boat and trailer are sold as is, which is well maintained used condition. Boat is not registered, but the trailer is registered. This boat has been successfully used in Saginaw Bay, Lake St. Clair and Lake Erie. We have taken many different puddle ducks, divers and sea ducks from the comfort of this spacious boat. Disappear in the open water, only to be seen when you rise up to shoot the unsuspecting ducks. We've killed birds as close as 6' from this boat. It is comfortable and we have hunted in waves up to 3'. Comment for more details or questions.",,5910113858,42.459600,12,-83.909900,,"https://maps.google.com/maps/preview/@42.459600,-83.909900,16z",,$1500,human, (Pinckney),Two Man Lay out boat,https://annarbor.craigslist.org/boa/5910113858.html,2011
38,,"['42.463866', '-83.880615']",2016-12-07 11:32,"Selling my slightly used Wilderness Kayak.  Added a couple of accessories for fishing including a Scotty rod holder, paddle holder, and anchor cleat.  Excellent condition. Detailed info on Wilderness Systems website: http://www.wildernesssystems.com/us/products/pungo-140",,5878389750,42.463866,14,-83.880615,,"https://maps.google.com/maps/preview/@42.463866,-83.880615,16z",,$750,human,,Wilderness Systems Kayak - Pungo 140,https://annarbor.craigslist.org/boa/5878389750.html,
39,,,2016-12-07 09:15,"1991 Wellcraft SPORT 17 TRAILER NOT INCLUDED IN PRICE Excellent condition, fully loaded with custom add-ons, the engine runs great and the boat is ready to go",,5904697280,,17,,,,,$844,power,,1991 Wellcraft SPORT 17 ready to go,https://annarbor.craigslist.org/boa/5904697280.html,
40,,[],2016-12-06 22:19,"Dana 60 iceboat. Sarns runners and new shrouds. Harken blocks. Newer fuselage and plank, will handle 200lbs. Very good sail. Great fun cruising boat. Hell of a ride with a breeze! Bags for sail and boom, mast, mooring cover for cockpit. Leave name and number if I'm not home.",,5908789549,,14,,,https://maps.google.com/?q=loc%3A+N+Christine+Dr+at+Hunter+Brighton+MI+US,,$900,sail, (Brighton),DN Iceboat,https://annarbor.craigslist.org/boa/5908789549.html,
41,,"['42.291000', '-83.465000']",2016-12-06 22:02,This is an inflatable boat with wood floor and 5hp Mercury outboard motor will include 4 life jackets also selling an old Outboard motor 1 hp  for 120 dlls .Have an electric air pump and a Manual Air pump 15 minutes you can inflate it. Use it this summer without no problems.,1000,5908773674,42.291000,12,-83.465000,Mercury,"https://maps.google.com/maps/preview/@42.291000,-83.465000,16z",5hp,$500,power, (Canton Michigan),Inflatable boat with 5 hp Mercury Outboard Motor,https://annarbor.craigslist.org/boa/5908773674.html,1900
42,good,"['42.428900', '-83.782800']",2016-12-06 16:09,"I am selling my 19' aluminum Tracker Deep V fishing boat. This boat seats four people. I am the third owner of the boat. It has a 115hp outboard motor, ship to shore radio, trolling motor, solar panel battery charger, live well, tons of storage, fire extinguisher, radio, speakers, behimi top, down-rigger board, electric down riggers, trailer, new tires, new boat cover. It needs a new fish finder/GPS and one of the seats will need to be re-drilled, but the floor is solid. This boat is good for both the great lakes as well as the inland lakes. Retail on the boat is 12k.  Realistically, these boats blue book for $4,000-$4,500.  With all the extra's and the size of the motor this one is worth at least 5k. I am looking for best offer, or a good trade.  Trades I would consider would be a newer gas golf cart, or I would throw in money for a side by side.  What else do you have?",1000,5871749828,42.428900,19,-83.782800,Tracker,"https://maps.google.com/maps/preview/@42.428900,-83.782800,16z",Magna 19,$5000,power,,Aluminum Tracker Deep V,https://annarbor.craigslist.org/boa/5871749828.html,1993
43,good,"['41.951400', '-83.652200']",2016-12-06 13:06,1986 RINKER 18FT 3.0 140HP MERCRUISER RUNS GREAT BOAT IS IN VERY GOOD CONDITION WITH TRAILER WITH CUSTOM FIT COVER IF YOUR LOOKING FOR A NICE BOAT WITH EVERY THING READY TO GO CALL KEVIN show contact info THANKS,,5878083207,41.951400,18,-83.652200,Rinker,"https://maps.google.com/maps/preview/@41.951400,-83.652200,16z",,$2500,power, (DUNDEE),1986 18FT RINKER 140 MERCRUISER,https://annarbor.craigslist.org/boa/5878083207.html,1986
44,good,,2016-12-06 11:44,"1993 - 26 Foot Thompson Carrera 2600 5.7 L Mercruiser -- Single Engine - 260HP Bimini Top Full Camper Canvas with Windows Mooring Cover No Trailer $7,500.00 OBO or Trade Serious Buyers only.  No Hagglers.  No Solicitors.  No Brokers.",,5907875663,,26,,,,,$7500,power, (Marblehead),1993 - 26 Foot Thompson Carrera 2600,https://annarbor.craigslist.org/boa/5907875663.html,1993
45,good,,2016-12-05 21:34,Fully outfitted and ready for the season when you are! * 115 HP Ficht Evinrude outboard * Hydraulic assisted steering * Sunbrella Bimini Top/full canvas * Fishfinder and Marine Radio * Two electric Cannon Mag 40 extendable downriggers * Dual batteries * Load Rite trailer/power winch * 25 gallon aerated live well * Built-in rod holders * Porta-potty * All cushions - good condition * Non-skid decking/swim ladder * Raw water washdown * Built-in tackle box In-door winter storage and full tank of gas (62 gal) included in price.,,5907214062,,19,,Sea Swirl,,Striper 1851 WA,$12000,power, (Ann Arbor),1851 Striper Walk Around (2001),https://annarbor.craigslist.org/boa/5907214062.html,2001
46,excellent,,2016-12-05 11:59,"Seadoo parts for sale. Came off of a 1997 SPX 787cc when it was nearly new. All parts are in excellent condition. Purchase all for $250 or separately. R&D Intake Grate - $100 - SOLD Cylinder Head - $70 - SOLD Cylinder Head Cover - $30 - SOLD Air Box - $40 Jet Venturi Steering Nozzle - $40 Impeller Housing (needs rebuilt) - $40 Tags: sea doo, jet ski, jetski, spx, xp, gtx, pwc",,5870511008,,1,,,,,$1,power, (Milan),Seadoo Parts,https://annarbor.craigslist.org/boa/5870511008.html,
47,,,2016-12-05 10:44,For sale is a 1978 22' Starcraft Islander with a 1978 Pamco Easy Load Roller Trailer. The boat has not run or seen water in 15 years so it would either need to be fully restored or scrapped. The boat is an aluminum hull boat with a 140HP OMC inboard/outboard. The trailer is a 1978 Pamco easy load roller trailer for aluminum hull boats. The trailer has a spare tire and the wheels hold air. The trailer itself seems to be solid and would be serviceable with some minor fixing up such as lights and paint. Asking $950 for the package.,,5874782272,,22,,,,,$950,power, (Howell),1978 Aluminum Boat and Trailer,https://annarbor.craigslist.org/boa/5874782272.html,1978
48,,"['42.428900', '-83.782800']",2016-12-04 22:51,Price is negotiable. I have a 12ft Jon boat with a trailer for sale. Boat doesn't leak or have any cracks. When I bought the boat I decided to undercoat the whole thing to ensure it wouldn't leak. I have registration.  for boat and trailer. The Boat comes with a mini Kota  trolling motor and deep cycle marine battery. Also have a bilge pump to go with it. I disassembled the bilge pump from the boat because I was going to go through and re convert the boat to a bass boat and ended up not having time. The trailer is in good shape and so is the boat. Shoot me a reasonable offer. The picture of the boat was before I tore the wood off to redo it. It is now just a regular Jon boat. I'm open to trades depending on what u have,,5905783754,42.428900,12,-83.782800,Smokercraft,"https://maps.google.com/maps/preview/@42.428900,-83.782800,16z",,$800,human,,12ft Jon boat and trailer,https://annarbor.craigslist.org/boa/5905783754.html,
49,excellent,[],2016-12-04 22:16,"We have 4 very well reconditioned Chris Craft boats for sale, Call Bob at Second wind restorations in buckeye lake Ohio for pictures an prices.",,5905754416,,23,,Chris craft,https://maps.google.com/?q=loc%3A+%39%39%31%36+Mill+Dam+Rd%2E+Hebron+MI+US,Continental,,power,,Chris craft boats,https://annarbor.craigslist.org/boa/5905754416.html,1956
50,excellent,[],2016-12-03 21:08,"2014 Sylvan Mirage 820 cruise and fishing Pontoon Boat, 25 hp Mercury 4 stroke EFI engine. Genesis Trailer. Great condition. Call or text show contact info",,5895047482,,20,,Sylvan,https://maps.google.com/?q=loc%3A+%31%33%35%32%35+Torrey+Rd+Fenton+MI+US,Mirage 820 cruise & fish,$15999,power," (Fenton, Mi.)",2014 Sylvan Mirage 820 Pontoon Boat,https://annarbor.craigslist.org/boa/5895047482.html,2014
51,excellent,"['42.428900', '-83.782800']",2016-12-03 15:35,"1997 Sea Doo Speedster. Jet Boat is water ready it needs nothing but a new owner. Gelcoat shines and is not faded out.  Recently inspected wear rings in pumps. Recently rebuild drive shaft seals. Newer radio with auxiliary input for smart phone. New brand new trailer tires and brand new spare tire. This set up needs nothing but a new owner. Has original Seadoo cover in with no rips or tears.  This is the cleanest 1997 Speedster jetboat in the area. $5295, come look at it and make me an offer. Phone calls and text only. show contact info",,5870515518,42.428900,15,-83.782800,SeaDoo,"https://maps.google.com/maps/preview/@42.428900,-83.782800,16z",Speedster,$5295,power, (Whitmore Lake),1997 SeaDoo Speedster,https://annarbor.craigslist.org/boa/5870515518.html,1997
52,,"['42.359400', '-88.842800']",2016-12-03 14:47,"1994 Polaris SL780 Waverunner Runs & drives great fun steady jetski! Pretty fast as well! Has no card but have 2 documented previous owners. 1993 Polaris SL750 Waverunner It currently needs a stator as we changed the cdi box. This waverunner is in near mint condition! Comes with registration card. I would really like to keep these 2 together. But will separate if needed. $ 1,950.00 Price includes a homemade 2 place trailer. We also have a bunch of polaris waverunner parts. If interested call: show contact info (Calls only) If N/A leave a message. Or text me @ show contact info (Texts only) MANY MORE ITEMS 4 SALE!",,5896858071,42.359400,9,-88.842800,,"https://maps.google.com/maps/preview/@42.359400,-88.842800,16z",,,power,,2 Waverunners & 2 Place Trailer,https://annarbor.craigslist.org/boa/5896858071.html,
53,,"['42.615900', '-83.924800']",2016-12-03 14:17,"42"" shaft used twice 810-five995nine75",,5903899429,42.615900,42,-83.924800,Minn kota,"https://maps.google.com/maps/preview/@42.615900,-83.924800,16z",Maxxum,$500,power, (Howell),70lb maximum trolling motor,https://annarbor.craigslist.org/boa/5903899429.html,2016
54,,[],2016-12-03 14:04,I am posting this for my grandpa PLEASE CALL FOR INFORMATION WILL NOT RESPOND TO TEXT THIS BOAT MIGHT NEED SOMEREPAIR,,5903876762,,12,,,https://maps.google.com/?q=loc%3A+trebesh+cir+pinckney+MI+US,,$500,sail,,1971 british sail boat with trailer,https://annarbor.craigslist.org/boa/5903876762.html,
55,,,2016-12-03 12:56,Good Condition Trailer ball is 1 7/8 Has a new wench. With Minn Kota Trolling Electric Motor Model 35a - works good. Has motor manual also. Cash only. Call me if you are interested.,,5859753558,,12,,,,,$550,power, (Brighton),12' Blue Fin Aluminum Fishing Boat with Motor and Trailer,https://annarbor.craigslist.org/boa/5859753558.html,
56,good,,2016-12-03 03:59,"This boat has plenty of room, ample, comfortable seating and a nimble agility on the water that's bound to make any excursion a lot more fun. With 5.0 MPI Alpha motor producing 260 horsepower this boat can really take off for any of your skiing and tubing enjoyment.",,5903236179,,20,,Rinker,,212 br,$11500,power,,!!! 2004 %%% Rinker 212 br captive **** Super,https://annarbor.craigslist.org/boa/5903236179.html,2004
57,like new,,2016-12-03 03:51,"This is a perfectly sized boat!  Easy to tow, easy to drive, dependable motor, just the right size for any or all of your friends.  Fish solo or bring the group!  Heck, just take it out for the fun of being on the water at this time of year.",,5903234599,,17,,Godfrey,,Sweetwater 1780,$8100,power,,### 2007 ~~~~ Godfrey Sweetwater 1780 ~~~ Very nice,https://annarbor.craigslist.org/boa/5903234599.html,2007
58,,"['42.320700', '-84.033400']",2016-12-02 07:15,Sea Eagle 9 Motor Mount Inflatable Boat with Motor and Canopy - Purchased last year - used twice!  Excellent Condition! Moving Sale!  Please call Rich at: show contact info,,5901873508,42.320700,11,-84.033400,,"https://maps.google.com/maps/preview/@42.320700,-84.033400,16z",,$599,power, (CHELSEA),SEA EAGLE MOTOR MOUNT BOAT - MOTOR - CANOPY,https://annarbor.craigslist.org/boa/5901873508.html,
59,excellent,"['42.431186', '-83.751698']",2016-12-02 06:28,"25' 2000 Crest Grand Caribbean (does not come with a trailer) -50hp Mercury ""Big Foot"" 4-stroke outboard with power trim -Low hours - 247 at the end of this season -Always maintained by the marina and winterized and shrink-wrapped -Clean interior, especially for it's age, only a few small cracks that could be patched before getting worse. -Has small post table not shown in photos (you can see the mount for it in the back corner) -It is currently shrink wrapped, so be prepared to have cash in hand before I will cut an opening for inspection of the interior. **Photos were all taken day before shrinkwrapped**",247,5879468553,42.431186,25,-83.751698,Crest,"https://maps.google.com/maps/preview/@42.431186,-83.751698,16z",Grand Caribbean,$9500,power, (Whitmore Lake),2000 Crest Grand Caribbean Pontoon Boat 25ft 50HP Mercury 4-stroke,https://annarbor.craigslist.org/boa/5879468553.html,2000
60,excellent,"['42.466160', '-84.071169']",2016-12-01 16:54,"Looking to sell my liquid logic Stinger XP .. It is a great whitewater kayak. This boat will handle any whitewater you want to throw at it and is great for packing on the gear for a self support trip. It does have a drop down skeg for the flats and tracks very well. I am only selling because I want a shorter boat for more river play... has bottom scratches but no deep ones and no oil canning. Has been stored indoor since new. You can view on the Liquid Logic website. I believe it still sells for $1100.00 new, I am asking $850.00. I am only willing to trade for a liquid logic mullet, liquid logic remix 79 , or a comparable river runner or a possible creeker.",,5901261043,42.466160,12,-84.071169,Liquid Logic,"https://maps.google.com/maps/preview/@42.466160,-84.071169,16z",Stinger XP,$850,human,,Liquid Logic Stinger XP Kayak 12.6,https://annarbor.craigslist.org/boa/5901261043.html,2015
61,,"['42.320700', '-84.033400']",2016-12-01 12:07,"looking to trade for a 4x4, raptor or dirt bike 99 yamaha gp760 2 seater jetski I've replaced the wear ring and plugs with in the last week we deleted the oil injection system so it's premix 50:1 security system works all the gauges work the trim works and it's in overall great condition needs the carbs tuned if you have any more questions feel free to text or call show contact info NOT I DO NOT NEED HELP SELLING THIS sale is AS IS",110,5900790911,42.320700,11,-84.033400,yamaha,"https://maps.google.com/maps/preview/@42.320700,-84.033400,16z",gp760,$2000,power, (CHELSEA),yamaha gp760,https://annarbor.craigslist.org/boa/5900790911.html,
62,fair,"['42.408600', '-83.497800']",2016-11-30 18:43,"Selling a 2006 electric Manitou pontoon boat with dock.  Boat runs well, upholstery is worn.  Has new Sears batteries.  It's only been used on a small neighborhood lake. Dock is in great condition, has two platforms.",,5899930534,42.408600,18,-83.497800,Manitou,"https://maps.google.com/maps/preview/@42.408600,-83.497800,16z",,$4500,power, (Northville),Electric Pontoon with Dock,https://annarbor.craigslist.org/boa/5899930534.html,2006
63,excellent,,2016-11-30 16:43,"08 headhunter drift boat.  Oars, boat cover and ancher. Excelent condition  Great boat.",,5899752756,,15,,Clacka craft,,headhunter skiff.,$3500,human, (Dundee mich),Clacka craft headhunter drift boat.,https://annarbor.craigslist.org/boa/5899752756.html,2008
64,good,"['42.459600', '-83.909900']",2016-11-30 11:00,Boat trailer and trolling moter or may trade,0,5886257991,42.459600,12,-83.909900,Aluminum,"https://maps.google.com/maps/preview/@42.459600,-83.909900,16z",Aluminum,$450,human,,Aluminum fishing boat,https://annarbor.craigslist.org/boa/5886257991.html,1970
65,fair,"['42.445483', '-83.891867']",2016-11-29 21:45,"Boat is old and needs work, trailer rust and tires need changing.  Good deal, has crack inside on seat.  No motor",,5898567140,42.445483,11,-83.891867,,"https://maps.google.com/maps/preview/@42.445483,-83.891867,16z",,$150,human, (Pinckney),fishing small motor boat,https://annarbor.craigslist.org/boa/5898567140.html,
66,good,"['42.169800', '-83.784900']",2016-11-29 18:21,"This is one of my kayaks that im selling,  it is a great light agile kayak , easy to carry and paddle,  it is in great condition,  comes with everything you see in the picture,  bungee  cord rear deck , with seal tight compartment ,on the front there is enough room to install extra bungee cord deck or  rod holder comes with half of a paddle  (lost the other half )",,5898319916,42.169800,8,-83.784900,Sun dolphin,"https://maps.google.com/maps/preview/@42.169800,-83.784900,16z",,$160,human, (saline),Kayak sun dolphin great shape,https://annarbor.craigslist.org/boa/5898319916.html,2015
67,,,2016-11-29 17:13,"$1400 ...40 hp Force motor, trolling motor, depth finder, brunswick trailer...great fishing boat...hasn't run for the last couple seasons...have brand new battery for it, not hooked up. Will need new floor soon....",,5874790709,,16,,,,,$2400,power,,Spectrum Fishing Boat 16' PRICE REDUCED!,https://annarbor.craigslist.org/boa/5874790709.html,
68,excellent,"['42.940000', '-83.536900']",2016-11-29 16:47,Handcrafted canoe. Cedar. Over 16 ft. A few minor scratches on the bottom. Fully functional. Waterproof compartments on either ends. Priced to sell. Best offer. Will deliver for a fee. Serious inquires only. Text only. Cash only. Will not sell to persons unseen. Will report PayPal scammers.,,5898175827,42.940000,16,-83.536900,,"https://maps.google.com/maps/preview/@42.940000,-83.536900,16z",,$2500,human,,Handmade Cedar Canoe,https://annarbor.craigslist.org/boa/5898175827.html,
69,,,2016-11-29 12:31,"looking to sell or trade for a ATV quad 4x4 four wheeler can add cash on the right trade, smaller speed boat or flat bottom boat with engine or pontoon boat or other toys with an engine cheetah 180 inboard/outboard 4 cyl new trailer lights boat has been sitting awhile needs some TLC just clicks when you try and start it but can turn crank by hand needs a starter and interior as far as I know got off family friend ran when parked I don't have time to mess with it. extra outboard part of the engine comes with it",,5866993965,,18,,,,cheetah 180,$800,power, (pinckney),boat sell or trade,https://annarbor.craigslist.org/boa/5866993965.html,
70,,[],2016-11-28 17:22,I have for sale a wooden boat 20 feet long good Fort for kids or a fixer-upper to put out on the water it's made out of mahogany wood,,5896598753,,20,,,https://maps.google.com/?q=loc%3A+%32%30%38%35+Twin+Lake+Road+Mancelona+MI+US,,$550,power, (Mancelona),Wooden Boat,https://annarbor.craigslist.org/boa/5896598753.html,
71,,"['42.138200', '-83.217900']",2016-11-28 14:29,"I'm looking for a decent dual console fishing boat with a (75-150hp) yamaha or Honda motor. No older than a 2002 model. Would prefer if to have a adequate electric trolling motor but its not a deal breaker if boat priced well. Condition is of main importance. I would like to stick to these brands but I will consider a few others like Monark or Smokercraft. Please no Lowes, Trackers, or Sylvan.... show contact info ..send pics if responding by email.. Keith",,5863587473,42.138200,18,-83.217900,,"https://maps.google.com/maps/preview/@42.138200,-83.217900,16z",,$12500,power, (Trenton),"17-18ft(Lund, Alumacraft, Polarkraft, Crestliner ) with Yamaha/Honda??",https://annarbor.craigslist.org/boa/5863587473.html,
72,excellent,,2016-11-28 11:57,SWIMMING RAFT FOR SALE.  Alum. about 8'x8' top with new dark blue carpet.  With ladder and chain anchor.,,5895964809,,8,,,,,$1400,human,,SWIMMING RAFT FOR SALE,https://annarbor.craigslist.org/boa/5895964809.html,
73,good,"['42.462103', '-83.816130']",2016-11-28 09:51,Boat trailer 17ft. long adjustable rollers.  $300.00  OBO  Call Mark 313 910 0 FIVE 34 WE LIVE IN WHITMORE LK.,,5895728048,42.462103,17,-83.816130,,"https://maps.google.com/maps/preview/@42.462103,-83.816130,16z",,$300,power, (Whitmore Lake),Boat trailer,https://annarbor.craigslist.org/boa/5895728048.html,
74,excellent,"['42.615900', '-83.924800']",2016-11-28 09:23,"Finished Duck Season Yesterday. I am selling my 14ft  Carstens Canvasback Duck Boat, with 6.5 long-tail mud motor, trailer, and electric winch. I used this boat at Harsens, and Shiawassee this past weekend. The boat has been great. I fit my decoys, dog, and one other person is the boat. The Motor is a predator 6.5hp. It starts every time. I have never had an issue with the boat. If you have any questions please let me know.",,5895688083,42.615900,14,-83.924800,,"https://maps.google.com/maps/preview/@42.615900,-83.924800,16z",,$4000,power,,14ft Carstens Canvasback Duck Boat,https://annarbor.craigslist.org/boa/5895688083.html,
75,good,"['42.459600', '-83.909900']",2016-11-27 09:12,"1987 Fourwinns Sundowner 235 boat for sale.  Boat was kept in pole barn when not in use, except for past year.  Boat engine needs work (800 hours); may need to be replaced and also needs a starter.  Took in to be checked out and marina said there is a crack on the outer part of the motor casing.  Boat interior in good condition.  Comes with trailer.  Has a refrigerator, sink and bathroom in cabin.  Also has a hummingbird depth finder.  All original cushions still in good condition.  Great for large lakes, was used for fishing and skiing in Lake Huron.  5.3 L inboard engine.  Please text or call.  Serious inquiries only,  In one week boat will be donated if not sold.",800,5894246307,42.459600,24,-83.909900,Fourwinns,"https://maps.google.com/maps/preview/@42.459600,-83.909900,16z",Sundowner 235,$1200,power, (Pinckney),1987 Fourwinns Sundowner 235,https://annarbor.craigslist.org/boa/5894246307.html,1987
76,,"['41.995300', '-83.955500']",2016-11-26 15:28,Selling 1995 Jet Boat. I good working condition.  Will trade for 4x4 Quad.  For more info call or text show contact info,,5893433051,41.995300,14,-83.955500,,"https://maps.google.com/maps/preview/@41.995300,-83.955500,16z",,$2500,power, (Tecumseh),1995 Jet Boat,https://annarbor.craigslist.org/boa/5893433051.html,
77,excellent,,2016-11-26 10:35,"Beautiful 1971 Red Correct Craft Mustang with original Chrysler 318. I am the second owner of the boat. The previous owner and myself have kept strict documentation of the boats life. The entire boat is original to the factory production. The boat is in MINT condition. Runs like it's brand new, 50 mph plus!! Asking $10,000 but open to any and all offers. Call or text Nathan for pictures, information, or questions. show contact info",1400,5876166515,,16,,,,,,power,,Correct Craft Mustang,https://annarbor.craigslist.org/boa/5876166515.html,
