,condition,coord_pair,date,description,engine hours (total),id,lat,length overall (LOA),long,make / manufacturer,map_URL,model name / number,price,propulsion type,region,title,url,year manufactured
78,good,"['42.171810', '-83.679278']",2016-11-25 20:48,"great shape open bow v8 5,7 new sterndrive 3 yr warranty new kenwood sterio and Alpine speekers new prop she,s ready big lk,s or inland.",,5892419186,42.171810,20,-83.679278,sea ray,"https://maps.google.com/maps/preview/@42.171810,-83.679278,16z",monaco,$7300,power, (ypsilanti),sea ray  207 monaco,https://annarbor.craigslist.org/boa/5892419186.html,1987
79,,,2016-11-25 20:41,"Recently restored AMF Alcort Sailfish sailboat. This is the pre cursor to the Sunfish and is perfect for beginners or experts. Easy to sail, transport, and rig. Ladies love a man who can sail! I can do deliveries.",,5892412500,,14,,,,,$750,sail, (Chelsea),Sailfish Sailboat,https://annarbor.craigslist.org/boa/5892412500.html,
80,good,,2016-11-25 07:31,"This canoe purchased by me in 1953, and was used sparingly for 12 years after that. The keel has been replaced once, the seat webbing has been replaced, and canoe has been repainted twice. The canoe does have a couple of ribs that have minor cracks in them. The price includes five paddles, a bicycle wheel carrier and the hosting system to hold it upside down inside of a garage or building. It has always been stored indoors upside down since it has been purchased. The canoe carries a serial number of 159015, and was purchased at a boat company in Fenton Michigan.",,5853097729,,16,,Old Town Canoe Co,,OTCA,$1500,human," (Brighton, Michigan)",Wood Canvas Canoe,https://annarbor.craigslist.org/boa/5853097729.html,1953
81,,"['42.467665', '-83.752899']",2016-11-23 10:44,"2016 Yamaha FX SHO Cruiser About 20 hours, IPD graphics. Recent oil change. No motor or hull issues and runs great. Bought in August so still under factory warranty. BUY BEFORE NEW YEAR AND WILL BUY AND THOUGH IN AN ADDITIONAL 3 YEAR WARRANTY FROM YAMAHA !!! Black Karavan Trailer available for extra $500. Thanks Waverunner, seadoo, jetski",,5889332458,42.467665,11,-83.752899,,"https://maps.google.com/maps/preview/@42.467665,-83.752899,16z",,$12999,power," (Brighton, MI)",2016 Yamaha FX SHO Cruiser,https://annarbor.craigslist.org/boa/5889332458.html,
82,excellent,"['41.396400', '-82.003300']",2016-11-22 22:19,"Very clean and well cared for 2002 boat with trailer. Included: 	Custom built Loadmaster galvanized dual axle trailor. 	Yamaha 225 Saltwater Series main engine. 	Yamaha 9.9 fourstroke high output kicker on easy lift & lower bracket. 	Eagle dual GPS/Sonar unit. 	VHF Marine Radio (replaced in 2015) 	Subtroll 900 speed/temp at the ball sensor. 	Danforth anchor, 6-foot rode chain. 	Black Sunbrella mooring cover. 	Isinglass cockpit enclosure. 	Custom made all weather full length boat cover. 	Reupholstered seat cushions (2015). 	Bottom painted (2014) 	4 electric downriggers (2 Cannon, 2 Walker) Other Specs: 	23'11"" overall length, 8'9"" beam 	108 gallon fuel capacity 	Deep cycle and cranking batteries 	Battery selector/ cutoff switch installed",,5853052241,41.396400,24,-82.003300,Hydra Sports,"https://maps.google.com/maps/preview/@41.396400,-82.003300,16z",230 Walkaround,$21500,power, (North Ridgeville),2002 Hydra Sports 230 Walkaround w/ Trailor,https://annarbor.craigslist.org/boa/5853052241.html,2002
83,excellent,,2016-11-21 21:35,"2005 Crestliner 1850 115hp Mercury Optimax 9.9hp Mercury Fourstroke Kicker Shorelandr Aluminum Tandem Axle Roller Trailer with Brakes Included:   Custom captain chairs, Pedistal seats, Power pedestal butt seat, Under console storage area with netting, Front and Rear live wells, Swim platform with ladder, Bimini top with front curtains, Custom side and rear curtains, Turbo Swing for water sports, Barewest fishing tower, Burt's Custom Tackle track system, Burts ratchet rod holders, Lowrance HDS7 with side and down imaging, Lowrance X135, Minn Kota 65 Powerdrive, Electric Walker downriggers, Trollmaster PRO2 on kicker motor, Fish Hawk x4D, 4 new batteries, Onboard charging system, Swing tongue, Much more...  Needs a good home. $25,500",,5887366141,,18,,Crestliner,,Sportfish 1850,$25500,power,,2005 Crestliner Sportfish 1850,https://annarbor.craigslist.org/boa/5887366141.html,2005
84,,,2016-11-21 13:23,"New Price - Final Price drop of the season. I am selling my 2000 18' Sea Ray 185 Bow Rider. The boat is powered with the 190 HP 4.3 L Mercruiser (no meter). The boat has a fish finder, stereo, bimini, cockpit cover, bow cover and an EZ loader custom trailer with brakes. The boat is clean and ready to go!!!! I am the second owner.",,5850105637,,18,,,,,$8900,power, (Port Clinton),2000 Sea Ray 185 Bow Rider,https://annarbor.craigslist.org/boa/5850105637.html,
85,,"['42.459600', '-83.909900']",2016-11-21 09:12,"I have a 25' hoosier crank up trailer available for rent per day or per 4 hours. Trailer is very durable and reliable, hauls smoothly. I also offer hauling if you don't want to haul yourself. Please call with any questions. $60 per day $40 per 4 hours small security deposit required show contact info",,5872863452,42.459600,25,-83.909900,,"https://maps.google.com/maps/preview/@42.459600,-83.909900,16z",,,human,,*Pontoon trailer rentals and Hauling,https://annarbor.craigslist.org/boa/5872863452.html,
86,,"['41.900500', '-84.044600']",2016-11-20 12:05,I have a 1989 four winns boat for sale. 3.0 mercruiser inboard. Interior is clean. Ran great all summer. Motor stalled and now won't start. I'm not sure whats wrong with it. I hate to sell it but i need the money. $1200 OBO I'm taking a big loss.,,5885047619,41.900500,16,-84.044600,Four winns,"https://maps.google.com/maps/preview/@41.900500,-84.044600,16z",Freedom 160,$1200,power, (Adrian),1989 four winns 160 freedom,https://annarbor.craigslist.org/boa/5885047619.html,1989
87,,"['42.459600', '-83.909900']",2016-11-19 14:57,Aluminum canoe. No leaks.,,5884043976,42.459600,16,-83.909900,,"https://maps.google.com/maps/preview/@42.459600,-83.909900,16z",,$200,human,,Canoe,https://annarbor.craigslist.org/boa/5884043976.html,
