,condition,coord_pair,date,description,engine hours (total),id,lat,length overall (LOA),long,make / manufacturer,map_URL,model name / number,price,propulsion type,region,title,url,year manufactured
72,good,"['38.806900', '-90.340100']",2016-12-19 10:09,"19' 2002 Ranger dual console. 200 Yamaha, hotfoot, new Garmin gps/fish finder, 24v trolling motor, 3 bank charging system.",265,5907555966,38.806900,19,-90.340100,Ranger,"https://maps.google.com/maps/preview/@38.806900,-90.340100,16z",518vx Comanche,$17800,power, (Florissant),2002 Ranger 518VX Comanche,https://stlouis.craigslist.org/boa/5907555966.html,2002
73,,"['38.702300', '-90.364400']",2016-12-19 10:06,"I have a very good condition trailer with working lights and good tires. Clean title in hand. 600 cash only. Total length is 21'- 6""  and 64 1/2 "" between fenders. Had a 19'-6"" boat on it. This would make a great utility trailer, motorcycle trailer, or ATV trailer .  Call or text show contact info",,5904766519,38.702300,22,-90.364400,,"https://maps.google.com/maps/preview/@38.702300,-90.364400,16z",,$600,power, (St John 63114),Tandem axel trailer with title,https://stlouis.craigslist.org/boa/5904766519.html,
74,good,"['38.060500', '-92.683100']",2016-12-19 09:43,"For Sale: 1997 Regal Ventura 8.3 SC (Sport Cuddy) Truly a perfect fit for the Lake Ozark water. Deep-V handles the water like a champ, and also has trim tabs for completely smooth rides! 27' 6"" (plus additional 3 ft of custom built swim platform. See attached photo prior to install and once installed) 9' 2"" beam Engine -Volvo Penta Inboard , 454 7.4L V8 (100% rebuilt in February 2016) -Fuel injected, dual prop outdrive -385 hours on boat total, less than 15 hours total on rebuilt engine from 2016. (full papers included) -Trim Tabs on steering column Exterior -White with hunter green -Full green cover included -""Skins"" window covers included, used once in life of boat -Added large 3 ft. swim platform with ladder in 2015. Party Central during cove out time!! -Pop Out cleats along both sides -Transom lockers at the back hold ropes, bumpers, etc Interior -Cuddy (see photo) sleeps 2 -Has enclosed head (never used, great additional storage for bumpers) -Floor storage in center of boat holds skis, full skin covers, used once) -Snap in/out carper in excellent shape -Fiberglass lined storage under all seats -Circle seating -Dual-wide FLIP UP driver's seat -Transom walk thru to swim platform makes life SO MUCH EASIER!  Rear center cushion pops out and seat folds down.  Literally just walk through to the swim platform! Electronics -Dual bluetooth head unit w/AM/FM, and iPod connector -Subwoofer built in under seat with amp -Garmin GPS mounted to dash with lake maps Miscelaneous -Owner's manuals and all service paperwork included since purchase of boat Asking $23,500 or best offer. No trailer included Boat is located/stored on a hyrdo hoist lift in Linn Creek, MO near 28 mile marker Please email all inquiries",385,5925341201,38.060500,28,-92.683100,Regal,"https://maps.google.com/maps/preview/@38.060500,-92.683100,16z",Ventura 8.3 SC,$23500,power, (Linn Creek),1997 Regal Ventura 8.3 SC (Sport Cuddy),https://stlouis.craigslist.org/boa/5925341201.html,1997
75,,[],2016-12-19 09:32,Express Upholstery Services is a locally owned family business specializing in marine upholstery for all makes of marine craft. For more information call show contact info,,5925375351,,1,,,https://maps.google.com/?q=loc%3A+%31%32%31+Algana+dr+St+Peters+MO+US,,,human,,Boat Upholstery St Peters Mo,https://stlouis.craigslist.org/boa/5925375351.html,
76,excellent,"['38.200300', '-92.668400']",2016-12-19 09:32,Excellent condtion New custom cover New custom Bow & Cockpit cover New custom Carpet Bravo 3 outdrive w/ dual stainless props 454 Mag Captains choice Many other options,567,5925374712,38.200300,30,-92.668400,Baja,"https://maps.google.com/maps/preview/@38.200300,-92.668400,16z",Islander,$26500,power, (Lake Ozark),Baja 272 Islander,https://stlouis.craigslist.org/boa/5925374712.html,1995
77,excellent,"['38.738955', '-90.077076']",2016-12-19 09:04,"I HAVE , 55 GAL, BLUE, LIKE NEW,  PLASTIC BARRELS,  WITH BUNG PLUGS, GOOD TO USE FOR, RAIN WATER, OR STORAGE, COMPOSTING, FLOATING DOCKS, OR POOL COVER FLOATS THIS FALL. PH# show contact info FOR ADDRESS, THANKS FOR LOOKING!",,5892834141,38.738955,35,-90.077076,,"https://maps.google.com/maps/preview/@38.738955,-90.077076,16z",,$15,human, (GRANITE CITY IL 62040),55 GALLON PLASTIC  BARRELS FOR BOAT DOCKS,https://stlouis.craigslist.org/boa/5892834141.html,
78,excellent,,2016-12-19 08:18,Just redone 1971 14ft runabout TomSawyer with 40hp Evinrude electric with electric start and electric shift and generator all redone with new paint floor carpet bilge pump and Duracell dual purpose battery.trolling motor trailer with new tires and paint. Can test drive before taking home after purchase.titles for all three,,5925276570,,14,,Tom Sawyer,,40hp 1966 Evinrude electric,$1260,power, (Ste Genevieve),Classic 1971 TomSawyer 14ft runabout 1966Evinrude,https://stlouis.craigslist.org/boa/5925276570.html,1971
79,excellent,,2016-12-19 08:11,"2011 tracker allweld aluminum boat.no rivets.this boat is in excellent condition.it comes set up4bowfishing but can easily be un bolted..has two brand new interstate batteries and a trickle charger on them.no live wells.has a 2000 mercury tracker 40hp motor on it thats in excellent shape and runs perfect..has power trim,electric start.120compression on all4cylinders..motor dnt have a title only boat and trailer..Quincy il two one 7 209 1649",,5920554650,,175,,tracker,,,$4800,power, (Quincy il),2011 tracker allweld 17.5ft v bottom,https://stlouis.craigslist.org/boa/5920554650.html,2011
80,excellent,,2016-12-19 07:59,"'MY SHIP CAME IN, NEED TO MOVE THIS THIS WEEK' SERIOUS FISHERMAN, EVERYTHING YOU NEED IS RIGHT HERE, BE GOOD TO YOURSELF,  PULL CORD N GO!  I'm offering my 1968 MONARK 14' deep-V, (36""),  x 54"" beam heavy duty fishing boat. Four bench seats, two removable swivel folding seats, 5 # fore fluted galvanized anchor, 5 # plastic coated aft. mud anchor,six rod holder attached to seats, personal flotation device, and life jackets.Motor stand as well as a new in the box boat cover. Boat freshly painted inside and out this summer. 1968 strong running Evinrude Eastwin 18 hp outboard two cycle (50-1 ratio), motor, and a 6-gal. plastic gas tank. All this sits atop a 1974 trailer, freshly painted and rewired this past summer has standard 4 prong flat trailer plug, and 1 7/8"" trailer ball hitch, 14"" wheels and a spare to boot! New never used boat cover in box. Life jackets, n PFD. Boat and trailer are in one location,(outdoors),  motor and accessories  (indoors). This is a great river boat that has served me well for over a dozen years. Trails well behind my Sebring and should be no trouble for you. This is an old style boat, heavy duty, and can take anything you can throw at it. Rivets sealed in and out for further water sealing. This is for the hard core fisherman who doesn't want to worry if it can take it! It can and will. Won't last at this price, CASH ONLY, three separate titles ready to be handed over. Everything works like new. Easy start recoil starter, You won't be disappointed. They don't make them like this anymore. Please call for viewing. Motor has stand with it. COME SEE IT TODAY. Thank you for your time and consideration. Rick. show contact info no trades, items will NOT be sold separately! COME GET THIS TODAY AND DRIVE IT AWAY! Thanks.",,5894200413,,17,,Monark aluminum,,Evinrude 18 hp,$3000,power, (Crestwood),"Monark 14'-Deep V 54"" Beam Al. Fishing Boat",https://stlouis.craigslist.org/boa/5894200413.html,
81,,,2016-12-19 07:41,20ft Galaxy runabout tandem axle trailer have titles for boat and trailer. Been sitting. Call show contact info,,5893860371,,20,,,,,$600,power, (St.Charles),20ft Galaxy,https://stlouis.craigslist.org/boa/5893860371.html,
82,good,"['38.907400', '-90.034400']",2016-12-19 05:32,14 ft. johnboat and Haulrite trailer with spare. All in good shape. Motor not included. Clean title for boat and trailer.,,5925164336,38.907400,14,-90.034400,,"https://maps.google.com/maps/preview/@38.907400,-90.034400,16z",,$600,power, (Bethalto),14 Ft. Johnboat and Trailer,https://stlouis.craigslist.org/boa/5925164336.html,
83,excellent,,2016-12-19 01:47,"I am selling out pontton boat that has been garage kept its entire life, I am the 2nd owner, very very clean and in perfect shape, has 70hp 4stroke evinrude motor, I have fixed most of all the interior issues over the past couple years, plastic seat bases, floor is absolutely perfect, brand new batteries, all brand new stereo with kicker speakers and amp this past summer, inside led glow lighting, front underneath slide out ladder, portable side ladder, new led dock lights, just had cover restitched and snaps all snaps fixed that needed fixed, has table and built cool barbecue stand for front left corner have TAYLOR MADE front half canopy also, trailer is 100% ready I installed 4 new tires and bearings in spring, have 2 spares mounted on trailer, I love this boat it has been very good to us I hate to see it go but we purchased a new one this winter, you will not find a cleaner well taken care of boat than this one can give references on boat before coming to look at, can put in water if want or can run boat inside as long as you want, please no trade offers got to sell this boat to help recover money on new one! thanks for looking",300,5925065046,,25,,ODYESSY,,LEXTRA 2505,$10000,power, (15 miles north of cape girardeau mo),2001 25ft odyessy PONTOON 70 HP 4 STROKE,https://stlouis.craigslist.org/boa/5925065046.html,2001
84,good,,2016-12-18 21:52,"I know its a bad time to sell a boat, but I feel like this is cheap enough for someone to buy in the winter otherwise I will just hang on to it fix the interior spots that need fixed for 600 bucks and get 4500 out if in spring,  boat is 100% ready to go, I completely serviced it, rebuilt all 4 carbs, installed new battery, put all new fuel in it, and then went and ran it for over a hour myself, has a 2002 shorelander trailer that I just repacked the wheel bearings,  I do need to find a real pole light for it , and trying to buy a cover it now?  boat ran out great and is very fast and turns on a dime. lol and I mean a dime!!!   please text or call and leave message if I don't answer also can call 573twotwo5-250three  and ask for gage",189,5894985087,,16,,bombardier,,challenger twin,$3900,power, (15 miles north of cape girardeau mo),2001 SEA DOO TWIN ENGINE JET BOAT,https://stlouis.craigslist.org/boa/5894985087.html,2001
85,excellent,,2016-12-18 21:08,"16' x 36"" gigging boat and trailer with a 6hp Mercury Merc 60 motor.  This motor will start on the 1st pull.  Boat has gigging rails and 3 Coleman lanterns across the front (propane system).  Boat is a 1976 Lowe Line boat, motor is a 1965 model.  This was purchased new by my grandfather and has been in the family ever since it was new.  Also comes with an anchor, gas tank, fuel line hook up and 2 boat seats.  Hands down this is the most reliable boat motor I have ever been around. It is dependable and will always start. This boat is ready to hit the river today, you could be catching fish or gigging tonight!",,5924955450,,16,,,,,$1100,power, (Rolla),"Gigging Boat, trailer and Motor",https://stlouis.craigslist.org/boa/5924955450.html,
86,fair,"['38.138000', '-92.666400']",2016-12-18 19:52,"I purchased a boat trailer that came with a 27 ft Century Medien cabin cruiser on it I have the title to the boat its clean, clear and open. There is NO MOTOR or DRIVE UNIT in the boat. It had a big block 460 engine and a OMC drive unit the boat can be converted to a complete Mercruiser system motor and drive which can be found easier. If you want it you have to have the means to get it off the trailer same day...  I can deliver if its close to Lake of the Ozark Mo. This is a good boat project. -- TRAILER IS NOT INCLUDED-- ONLY SERIOUS INQUIRIES PLEASE",,5908683096,38.138000,27,-92.666400,Century,"https://maps.google.com/maps/preview/@38.138000,-92.666400,16z",Medien,$1000,power, (St Louis/Lake Ozark),27 ft CENTURY BOAT,https://stlouis.craigslist.org/boa/5908683096.html,1989
87,,,2016-12-18 18:21,"1950's vintage fiberglass boat with tail fins. Very cool retro look. Needs restoration or use for yard ornament at club house or lake property. $300 or make offer or trade. Phone calls only, will not answer text.",,5917777050,,16,,,,,$300,power," (Waterloo, IL)",Fiberglass Boat with Tail Fins,https://stlouis.craigslist.org/boa/5917777050.html,
88,,,2016-12-18 18:21,"17 foot fiberglass ski boat, needs new interior or use for parts. Has good 120 horse 4 cylinder  Mercruiser. $300 or make offer or trade. Phone calls only, will not answer text.",,5917707941,,17,,Baretta,,,$300,power," (Waterloo, IL)",17 Foot Ski Boat,https://stlouis.craigslist.org/boa/5917707941.html,
89,,"['37.157300', '-90.699000']",2016-12-18 16:50,"2015 7 X 16 Enclosed Toy Hauler Trailer, has 12000 btu. air, Murphy's bed, Jackknife couch that makes out to a bed, Kitchen Cabinets, Sink and Stereo. Fits two Harley's easy..",,5924657943,37.157300,16,-90.699000,,"https://maps.google.com/maps/preview/@37.157300,-90.699000,16z",,,power,,Will Trade Toyhauler for Cabin Cruiser,https://stlouis.craigslist.org/boa/5924657943.html,
90,like new,"['38.780900', '-90.366900']",2016-12-18 16:04,"Selling a hyperlite 144 wakeboard.  Used a few times but great condition.  Comes with boot supports and bag. This was the first series to combine the floaty overall feel of a freeride board with the hard edging characteristics and consistency of multiple-fin boards. Subtle rounded profile gives the board a solid pop with a quick release off the wake. Two 1.9"" Belmont Fins for the strongest edge hold. Four.4"" Deep x 11"" Long Molded-In Fins- two outer molded-in fins on each end help the board edge stronger into and up the wake and stomp landings more consistently. ""V"" Bottom Full Length Tunnel aids tracking and helps cushion landings. 4.75"" Center Fin Placement for a quicker release off the wake and an overall ""floatier"" feel.",,5887066248,38.780900,144,-90.366900,,"https://maps.google.com/maps/preview/@38.780900,-90.366900,16z",,$150,human,,Hyperlite Belmont 144 wakeboard,https://stlouis.craigslist.org/boa/5887066248.html,
91,,"['38.452592', '-90.319153']",2016-12-18 15:53,Runs and works great No title show contact info,,5888218730,38.452592,0,-90.319153,,"https://maps.google.com/maps/preview/@38.452592,-90.319153,16z",,$175,power, (St.louis),Sears outboard,https://stlouis.craigslist.org/boa/5888218730.html,
92,,"['38.451974', '-90.318723']",2016-12-18 15:53,Wave runner needs work motor is apart. No title bill of sale on both 325$ show contact info,,5910055025,38.451974,10,-90.318723,,"https://maps.google.com/maps/preview/@38.451974,-90.318723,16z",,$325,power, (South county),Wave runner and trailer,https://stlouis.craigslist.org/boa/5910055025.html,
93,,,2016-12-18 15:37,"I buy 'Running or Not' Jetskis, Seadoos and Waverunners. Also buying wrecked and damaged. Please call or Text me at 314-8zero8 - 11two4 ultra 150 130 rxp-x 215 255 pwcs sts stx 1300 1200 1100 1050 947 951 900 800 787 717 720 rotax 760 650 600 700 750 ss 550 500 stx1100di 1100di stx1100 stx900 zxi 1100zxi 900zxi 750zxi rx rxp turbo supercharged supercharger super charged charger r-12 r-12x f-12 f-12x x2 sx jh1100 jh1200 ts xi sx rx rxdi rxp sp spi gt hx spx gts gti rfi le gtx lrv 3d rtx sl700 sl750 sl sl780 sl1050 gp1200 gp1300 gp1200r gp1300r gp 1200r 1300r xlt xlt1200 xlt800 xl xlt waveblaster waveraider raider blaster suv aquatrax aqua trax r12x f12x f12 r12 f12-x r12-x f12 r12 x fx fx140 sho cruiser fzr fxsho sho 701 62t 61x fx120 sxi 750sxi 850 sxr sxr800 rx rxp 4tec 4 tec 650sx 750sx sx js550 js650 js750 super superjet, st louis charles peters ofallon ballwin sounth county eureka pacific union washington clair sullivan arnold imperial farmington franklin jefferson city county lonedell robertsville arnold imperial park hills rolla hermann new haven st louis area shop sxr800 sxr 800 yamaha kawasaki bombardier polaris rotax honda pwc seadoo seadoos seado seados seadoos sea do doos dos doo jetski jetskis jet ski skis waverunner waverunners wave runner runners pickup pick up or deliver delivery purchase cash money wtb wtt wts iso must repair fix fixed fixing fixes looking cheap race today mechanic mechanics special buyer personal watercraft water craft pwc standup stand up engine motor part parts parting junk junkyard salvage yard broke broken blown up need needs needing rebuild rebuilt work locked seized crash crashed wreck wrecked drop dropped piston no title fast quick asap pawn barter swap sell sale selling buy buyer buying buys totalled total salvage insurance broker brokerage dealer dealership trade trades trading bad",,5909209960,,1,,,,,$1,power, (union mo),"Buying Seadoos, Jetskis, Waverunner ETC",https://stlouis.craigslist.org/boa/5909209960.html,
94,,"['38.535200', '-90.000600']",2016-12-18 13:17,Runs just fine. Had lower unit rebuilt 2 yrs ago other than that it's been a good boat.  We are going to be moving so that's really the only reason for selling.  Tried to show some imperfections in the pictures.,,5924456785,38.535200,21,-90.000600,,"https://maps.google.com/maps/preview/@38.535200,-90.000600,16z",,$4200,power, (Swansea il),'89 Regal Majestic XL210 Ski Boat,https://stlouis.craigslist.org/boa/5924456785.html,
95,,"['38.746800', '-90.213100']",2016-12-18 13:16,I have a 4 person inflatable raft by Intex for sale. I've never opened the box so it is brand new. There is a pump and oars in the box. Asking 80$ open to offers and maybe trades,,5924455583,38.746800,0,-90.213100,,"https://maps.google.com/maps/preview/@38.746800,-90.213100,16z",,$80,human,,4 Person Intex Raft - brand new in box,https://stlouis.craigslist.org/boa/5924455583.html,
96,,,2016-12-18 13:06,"I have a 18 foot 60"" wide 2012 Phowler Extreme with a 35hp MudBuddy that is pushing around 60hp.  This boat was custom made for me in Clinton, Iowa by Illowa Marine.  The boat is constructed out of .125 thick 5086 grade aluminum not the normal .100 grade that other boat manufactures use.  The motor has 209 hrs but all the internal work was done at 150hrs.  I just had a compression check and leak down test done and they both came out great. $14,500 obo.   Below i will list some of the extras and features of the boat. 2012 1860 Phowler Extreme Boat .125 gauge aluminum 5086 2012 Bear Trailer 35hp Mud Buddy (Pushing out around 60hp now) -mikuni 42 mm carb -marshmellow double barrel exhaust -PVT performance cam -PVT roller rockers -full port job done by Setex Performance in Texas - 1 Hammer Prop - 2 Big Blade Props Custom Bowfishing Light Bar with 6 HPS lights MinnKota Traxxis 80lb Thrust 24 volt trolling motor 2 Cabelas AGM Batteries for trolling motor 1 Starting Battery HID head lights Bilge 8' Gun/Rod Box LED interior lighting LED trailer lights Fulton swing away tongue Xps Dual on board charger (trolling motor) Xps single on board charger (starting battery) New spare tire",,5907130111,,18,,,,,$14500,power, (40 miles east of STL),Very Nice Duck and Bow Fishing Boat With Mud Motor,https://stlouis.craigslist.org/boa/5907130111.html,
97,,,2016-12-18 12:25,hello I'm selling my 1648 Oquawka plate boat. it has an all aluminum roof built on it with a fold down ladder and can be walked on its very sturdy and we  have had three people at a time up there. It gives an excellent veiw point for bow fishing and would be a good duck blind frame. it has a newer wood floor with carpet. it is an old rivet boat and it does leak about 5 gallons a day when in the water. it's rated for 55 horse power and set up for short shaft. the trailer is not very nice but I do have new tires and wheels for it it also has new tail lights. it would only take about ten minutes to put the roof off or on. it comes off fairly easily. the boat has a title the trailer does not. let me know if your interested. show contact info my name is Nick and I am interested in trades just let me know what you have.,,5918266978,,16,,Oquawka,,1648 plate,$1000,power, (imperial),1648 Oquawka plate boat. sell/trade,https://stlouis.craigslist.org/boa/5918266978.html,1978
98,like new,"['38.430211', '-90.571575']",2016-12-18 11:30,"My uncle has a nice 1985 IMP 220baoatPERFECT CONDITION>>>>>.It has been on a lift for 2 years.It has 300 hrs on it and was MINT when put away.350 engine....It has been on a covered lift,winterize...30.000 boat when bought from boat show in 1985......NEED TO GET RID OF!!!!3000 cash....NO TRAILER,,call if interested,,,,, show contact info (pictures are off brochure)",300,5921133417,38.430211,22,-90.571575,IMP,"https://maps.google.com/maps/preview/@38.430211,-90.571575,16z",220,$4000,power, (lake of ozarks),1985 IMP 220 cuddy cabin cruiser,https://stlouis.craigslist.org/boa/5921133417.html,1985
99,,"['38.200300', '-92.668400']",2016-12-18 11:16,Don't Let rough or dated Upholstery keep you boat from looking great. if you just want to replace a cushion or two or need your boat reupholstered we can keep your boat looking its best Get your boat reserved for our fall/winter schedual before it fills up Give us a call at show contact info or visit our website at www.mycleanboat.com Serving the lake since 2006,,5906888909,38.200300,30,-92.668400,,"https://maps.google.com/maps/preview/@38.200300,-92.668400,16z",,,power,,Professional boat upholstering,https://stlouis.craigslist.org/boa/5906888909.html,
