,condition,coord_pair,date,description,engine hours (total),id,lat,length overall (LOA),long,make / manufacturer,map_URL,model name / number,price,propulsion type,region,title,url,year manufactured
95,excellent,"['34.809600', '-90.009500']",2016-12-06 17:13,"1988 Suntracker Tritoon Party Barge Customized to Fishing Perfection!! Cruises like a Cadillac on the Lake!! 2011 Yamaha 70hp Four Stroke motor, Low usage Stainless Steel Prop Ridged Roof Hummingbird Fish Finder 24ft Long Double Axle Trailer Brand new Radio Roof is designed to hold poles 8 Pole holders on the rails Ladder included 2 Live Well Holding Boxes 1 Large Life Jacket Storage Box New Carpet and Floor Solid Boat Great Boat for Family and Fishing!!! $9500 OBO",50,5880998071,34.809600,24,-90.009500,Suntracker,"https://maps.google.com/maps/preview/@34.809600,-90.009500,16z",Party Barge,$9500,power, (Hernando),24ft Fisherman's Dream Custom Suntracker,https://northmiss.craigslist.org/boa/5880998071.html,1988
96,excellent,"['34.809600', '-90.009500']",2016-12-06 17:13,1969 Boston Whaler 14ft Tohatsu 25hp four stroke motor (20hours on the motor) Long tiller handle Elective start Trolling motor 2 chairs Storage box Carpet is in great shape Oversized trailer for easy in and out on the lake New tires plus a spare on the trailer Beautiful Unsinkable Fishing Boat $4250obo,20,5881027372,34.809600,14,-90.009500,Boston Whaler,"https://maps.google.com/maps/preview/@34.809600,-90.009500,16z",,$4250,power, (Hernando),Beautiful Boston Whaler,https://northmiss.craigslist.org/boa/5881027372.html,
97,excellent,"['34.669400', '-88.544300']",2016-12-06 11:24,Boat in excellent condition very low hours,,5907948108,34.669400,18,-88.544300,War  Eagle,"https://maps.google.com/maps/preview/@34.669400,-88.544300,16z",,$6500,power,,War Eagle Boat and Yamaha Motor,https://northmiss.craigslist.org/boa/5907948108.html,2006
98,good,"['33.851029', '-91.027908']",2016-12-05 22:37,"Selling my cab boat, 17 foot polarkraft with a 96 model Yamaha 115, trailer, light bar, radio, cd, speakers, 18 gallon tank.  Everything works and boat runs great.  The inside dome light even works.  Never use it and don't need it.",,5907348865,33.851029,17,-91.027908,Polarkraft,"https://maps.google.com/maps/preview/@33.851029,-91.027908,16z",,$5200,power," (Rosedale,ms)",CAB BOAT.,https://northmiss.craigslist.org/boa/5907348865.html,
99,like new,,2016-12-05 18:38,"LIKE NEW SKI BOAT WITH WAKEBOARD TOWER,RACKS AND BIMINI TOP, STAINLESS PROP, MAROON AND WHITE IN COLOR, LOTS OF EXTRAS. Boat probably doesn't have 50 hrs on it.",,5907108378,,20,,TAHOE,,Q5,$19000,power, (COMO),2011 Q5 TAHOE SKI BOAT,https://northmiss.craigslist.org/boa/5907108378.html,2011
