,condition,coord_pair,date,description,engine hours (total),id,lat,length overall (LOA),long,make / manufacturer,map_URL,model name / number,price,propulsion type,region,title,url,year manufactured
0,,,2016-12-20 19:27,2002 Bayliner Rendezvous 2159DD in excellent condition has the mercruiser 5.0 spot for a cooler and a port a potty on board asking $12000.00,,5904764939,,21,,Bayliner,,Rendezvous 2159DD,$12000,power, (Mexico),2002 Bayliner Rendezvous 2159DD,https://stlouis.craigslist.org/boa/5904764939.html,2002
1,,,2016-12-20 19:15,"48 "" Bottom 70"" Beam 100 Gauge Aluminum Stout All Welded Boat Running Lights Auto Bilge Pump New Led Taillights New Tires & Wheels Always Stored Inside If interested please call-618-3two8-83two5",,5910120169,,14,,,,,$1600,power, (Grafton),14 Ft Roughneck Flatboat & Trailer,https://stlouis.craigslist.org/boa/5910120169.html,
2,,"['38.801400', '-90.506500']",2016-12-20 19:10,"SEADOO  AND OTHER PWC SEATS  RECOVERED!!! $100 2 SEATERS  ---$125 3 SEATERS!!! MARINE GRADE VINYL , STAINLESS STAPLES!!!! show contact info !!!  STRAPS 1$15  FOAM WORK EXTRA DEPENDING ON FOAM DAMAGE.   GOLF CART SEATS WELCOME $100 FRONT BOTTOM AND SEAT BACK!!!",,5927584530,38.801400,102,-90.506500,,"https://maps.google.com/maps/preview/@38.801400,-90.506500,16z",,$100,power, (ST. CHARLES),PWC SEATS RECOVERED!!!,https://stlouis.craigslist.org/boa/5927584530.html,
3,,"['37.273500', '-92.518100']",2016-12-20 18:57,"Various styles and sizes! We have many different sizes and years available, prices starting at $450 and up Our inventory changes frequently, so pictures may not show all of what we have available. Feel free to call for details and availability. Contact Winston at show contact info for details and prices. Phone calls only please, will not respond to texts",,5899900135,37.273500,1,-92.518100,various,"https://maps.google.com/maps/preview/@37.273500,-92.518100,16z",,,power,,BOAT TRAILERS,https://stlouis.craigslist.org/boa/5899900135.html,
4,,"['37.262031', '-92.513123']",2016-12-20 18:56,"2005 Road King aluminum tandem axle boat trailer *27 ft. from coupler to end of bunks-trailer should haul 20 ft. to 24 ft. boat with no problem *Torsion 3500 lb axles with surge disc brakes, combined capacity 7000 lb *Chrome wheels with brand new tires *Heavy duty winch *Heavy duty adjustable bunks *5000 lb jack *2 inch trailer coupler *New LED lights *Trailer was hauling a 22 ft. Rinker *Title in hand $2750 or best reasonable offer phone calls only please anytime @ show contact info will not respond to texts",,5915154415,37.262031,27,-92.513123,ROAD KING,"https://maps.google.com/maps/preview/@37.262031,-92.513123,16z",,$2750,power, (LEBANON MO AREA),ALUMINUM 2005 ROAD KING TANDEM AXLE BOAT TRAILER,https://stlouis.craigslist.org/boa/5915154415.html,2005
5,excellent,"['38.976600', '-91.121100']",2016-12-20 18:36,2006 seadoo txt 215 90 hrs all aftermarket parts on bike great condition. 5500 obo fast has bigger supercharger cold air water box delete steel washers oil catch can. Just put $3000 in it to build it up This is a fast bike you will not be beat. Maintain by a r and d ex seadoo tech.,90,5913112993,38.976600,10,-91.121100,Seadoo,"https://maps.google.com/maps/preview/@38.976600,-91.121100,16z",Rxt,$5500,power,,2006 seadoo txt 215 built up,https://stlouis.craigslist.org/boa/5913112993.html,2006
6,,"['38.823900', '-90.742700']",2016-12-20 18:32,PONTOON BOAT NO TRAILER NO TITLE Deck surface is 4'x16' Pontoons are 20' long $500 firm,,5915040284,38.823900,18,-90.742700,,"https://maps.google.com/maps/preview/@38.823900,-90.742700,16z",,$500,human, (ST CHARLES MO),PONTOON BOAT,https://stlouis.craigslist.org/boa/5915040284.html,
7,,"['38.501500', '-90.468300']",2016-12-20 18:28,"I have a nice 17ft 2012 blazer flat bottom boat with a 2011 4 storke  mercury 60/40 jet. Always garaged. I have a bimini top, stereo, 2 live wells, trolling motor, front storage. Has 4 seats and front/back carpet deck and nice aluminum flooring. Also has spot for fishing seats on the decks. The trailer is a 2012 with spare tire. Runs great. Don't need to sell so no low ballers and no trades.",,5923203499,38.501500,17,-90.468300,Blazer,"https://maps.google.com/maps/preview/@38.501500,-90.468300,16z",,$12000,power,,2012 blazer jet boat,https://stlouis.craigslist.org/boa/5923203499.html,2012
8,,"['38.925900', '-90.386300']",2016-12-20 17:20,"I have for sale a 1976 formula thunderbird , it has a 351 ford, mercruiser lower unit runs good, its in decent shape for its age , has a easy loader trailer ,folding top, may trade for a utv or a gas golf cart,or a Harley?  Need gone '",,5898248576,38.925900,23,-90.386300,Thunderbird,"https://maps.google.com/maps/preview/@38.925900,-90.386300,16z",formula,$1500,power, (portage des sioux),1976 Formula Thunderbird,https://stlouis.craigslist.org/boa/5898248576.html,
9,good,"['38.737800', '-90.623400']",2016-12-20 17:20,This is a great starter boat. 17 foot Nitro with a 2 stroke 90 Mercury. On board charging system for trolling motor and starter battery.Two live wells and plenty of storage. New cover. Newer tires on trailer with a new axle summer of 2016. Fair price at $3000. Check it out on NADA.,,5927468501,38.737800,17,-90.623400,Nitro,"https://maps.google.com/maps/preview/@38.737800,-90.623400,16z",,$3000,power, (St. Charles),1994 Nitro,https://stlouis.craigslist.org/boa/5927468501.html,1994
10,good,,2016-12-20 16:25,"* PRICE REDUCED * Very nice cruisers yacht. Lots of room for whole family and guest. Sleeps 6. Twin 454's, generator, A/c and heat, lots of new parts in last 3 years. Including new starboard engine July 2016. Will consider offers. New batteries for 12v system- Fall 2013 New floor in cabin- Nov 2013 New microwave- Nov 2013 New stereo, amp and speakers- Fall 2013 New toilet- April 2014 New batteries for both engines- Aug 2014 New a/c pump- Spring 2014 New generator impeller, spark plugs, belts and points (total tune up) Sept 2014 New trim tabs- July 23, 2014 New water pumps and all new hoses for both engines- March 2015 New dash, gauges, switches- May 6, 2015 New upholstery on back side pieces- April 11, 2015 New LED lights in arch- June 2015 New FWD bilge pump- Sept 2, 2015 NEW STARDBOARD MOTOR, STARTER, and pressure plates in transmission- JULY 2, 2016 ($7,000) Pulled boat out April of 2014 (pic of it on trailer) inspected bottom, power washed and cleaned bottom. No issues. Bottom was also inspected when out in July for new motor. All was good. Boat could use buff and wax but it still looks good without. Hours on new engine are 7hrs but we use boat almost every weekend from March till December so hours will go up. Port engine has 1268hrs. We stay on boat with our 3 kids and have lots of room still. Very large/roomy boat. NADA says it 33' but in the 80's they didn't count the swim platform or bow pulpit. So it's actually 40' by today's boats. It sits next to a sea ray 400 at the marina and they are same length. Contact me for any questions. Plus I have more pictures. Thanks and have a great day. Pictures were taken Labor Day (except last 3)",,5887617438,,33,,Cruisers Yacht,,Esprit 3370,$15000,power, (LOZ),1987 Cruiser 3370 Esprit,https://stlouis.craigslist.org/boa/5887617438.html,
11,,[],2016-12-20 16:03,"Meet the aluminum bass boat heavyweight champ: the 2017 Stinger 178. Designed with best-in-class features, it delivers more fish-fighting deck space, more fishing features, impressive horsepower and more. The Stinger 178 features a super-wide 94"" beam to provide 75 square feet of fish-fighting space. A top-rated 90 horsepower Mercury outboard gets you to the fish fast and can handle higher speeds, greater stresses, and bigger fishing action than the competitors. A premium fiberglass console with metal flake finish includes a huge storage space for gear and lure trays. Angler centric seats are more usable and comfortable than ever for longer days on the water. This is the serious tournament-style bass boat designed to knock out the competition. Comes with: Standard Features: Metal flake fiberglass console w/ windscreen Lowrance Hook - 3x FishFinder 2 fold down fishing seats Bow aerated livewell w/divider (24 gallon) Built in fuel tank (19 gallon) Stern aerated livewell w/divider (24 gallon) Recirculating Aft Livewell Locking Side Rod locker with rod tubes (1) 7' (4) 8' Recessed trolling motor foot pedal Upgraded Features: Chrome spare tire with backmount Tilt steering Motorguide X5 70# 45"" 24v Trolling Motor Ratchet cover 2 Bank battery charger FINANCING AVAILABLE.......CALL US TODAY!! show contact info AFTER HOURS CALL BRYAN show contact info BRAD show contact info www.AnglersPortMarine.com",,5927356968,,18,,,https://maps.google.com/?q=loc%3A+%31%33%39%37%39+HWY+%37+WARSAW+MO+US,,,power,,Don't miss this one! 2017 Lowe ST178 w/ 90hp Mercury Four Stroke,https://stlouis.craigslist.org/boa/5927356968.html,
12,good,"['38.406900', '-90.438100']",2016-12-20 15:43,"Up for sale is a 2002 Kawasaki jetski stx1100 direct injection.  It is all stock, well maintained with about 130 hours on it.  Front seat reupholstered.  Seats 3 people. Also has 1 year old fitted cover.  I also have a tube and rope to go with it.  Ski is stored indoors in winter and winterized.  In really good shape.  Needs nothing, runs great.  Selling lake lot so no longer need.  Comes with a 2007 haul rite trailer that is in excellent condition.  Have titles for both. Have owners manual and service manual.  Firm on price.  Call for details. Seadoo sea doo jet ski waverunner wave runner",130,5908320528,38.406900,10,-90.438100,kawasaki,"https://maps.google.com/maps/preview/@38.406900,-90.438100,16z",stx 1100di,$2500,power, (imperial),2002 Kawasaki JetSki STX 1100DI,https://stlouis.craigslist.org/boa/5908320528.html,2002
13,excellent,"['38.545900', '-91.019300']",2016-12-20 15:08,"Up for sale is a 2007 Polarkraft 165SC Side Console aluminum V-Bottom fishing boat. This boat is in great shape inside and out and is as described below.   Overall I would rate this boat a 7.5 or 8 on a 10 scale.  I would not waste your time or my own. The boat is equipped with: Side console steering Lowrance XD fishfinder Minn Kota 70# 24 volt power drive trolling motor  (Electric steer!) 4 pedestal fishing seats Aerated livewell/ baitwell with divider Rod Box 3 deep cycle batteries On board battery charger Single axle trailer with spare tire Swing away tongue to save space Boat cover It is powered by a 50hp Yamaha 2-stroke outboard with aluminum prop.  The prop has a small bend/ ding in one of the blades but is in good shape.  The engine pumps water good and has perfect compression.  110#'s on each cylinder.  Runs out good. The boat needs a new livewell pump currently.  (Have not made it to store to buy one is all.) and the horn does not work.  (too cold to diagnose but cannot be too much. The boat has very few minor scratches.  The carpeting and seats are in great shape.  No tears or stains that I can see. Everything else is in good working order as far as I know.   Compare this to new!  SAVE THOUSANDS!  Asking $8,995.00.  Call, text, or email.  Trades considered.  Serious inquiries only please.",,5927297008,38.545900,16,-91.019300,POLARKRAFT,"https://maps.google.com/maps/preview/@38.545900,-91.019300,16z",165SC,$8995,power," (Washington, MO)",2007 Polarkraft 165SC fishing boat CLEAN!,https://stlouis.craigslist.org/boa/5927297008.html,2007
14,excellent,,2016-12-20 15:04,"Original owner, fresh water only, includes trailer that has space saving swing-away tongue, boat has been winterized and oil changed by the dealer, the boat has 272 hours on it right now, stored indoor year round, dealer maintained and will provide all paperwork, full cover included, comfortably seats 9 people, powered by total of 220hp twin 4-stroke engines, swim platform, bimini, anchor locker, front-loading ladder, storage/cooler compartments, table with 2 legs, center bow cushion, middle cushion on engine hatch. Only reason for selling is to upgrade to a larger Yamaha. ONLY SERIOUS INQUIRIES PLEASE. Motivated seller Boat upgrades: -Seadek (storm gray in cockpit) in 2016- also have the original snap in carpet with snaps that will go with purchase -Thrust Vector XL steering enhancement -Both batteries replaced in 2016 -Perko switch for dual batteries -On board battery charger with Thru-Hull Fitting -12"" driver seat pedestal -Clarion M303 radio with water resistant radio shield -Clarion MW1 Watertight Black Face Stainless Steel Bezel Remote -Clarion MF1 Marine RF Remote Control Polk Audio MM651 6.5"" Coax Speaker total of 4 throughout cockpit 10"" ported subwoofer 2 Amps Glove box prop Blue LED's throughout Navy blue Keel Guard New blower in 2016 Trailer upgrades: Boat buckles Stoltz bow stop 5 Hercules Radial tires (spare has never touched ground) Bunk boards and carpet replaced in 2015 Welded bow stop Fulton 2-speed winch 3200-pound load capacity Bearing buddies, seals, and bearings replaced in 2016 Brake pads replaced in 2016 Video of boat running on October 29, 2016 available upon request. The boat is still not winterized so test drives can still be given",,5920010935,,21,,Yamaha,,SX210,$26900,power," (St. Peters, MO)",2011 Yamaha SX210 for sale Motivated seller,https://stlouis.craigslist.org/boa/5920010935.html,2011
15,good,"['38.634600', '-90.191300']",2016-12-20 14:02,"Boat is located in Michigan is a fresh water boat never seen salt Has a brand new crate Chevy 350 with 2 year warranty with 1 hour test an tune New starter New alternater New water pump Rebuilt outdrive merc alpha 1 (all parts replaced) 2 new batteries New hot water tank New pressure pump New aftermarket Sony radio Newer ship to shore Full bathroom with shower Fridge works stove works Newer camper top All lights changed to led Boat is overall great shape for its age I went through this not too to bottom Strong stringers 10,000 obo Text or call will answer any questions show contact info",1,5927182070,38.634600,29,-90.191300,Sea ray,"https://maps.google.com/maps/preview/@38.634600,-90.191300,16z",,$10000,power, (Michigan),1986 sea ray 26 foot,https://stlouis.craigslist.org/boa/5927182070.html,1986
16,,"['38.512700', '-89.984700']",2016-12-20 13:40,Single axle 17 foot trailer used but like new. call show contact info,,5919005870,38.512700,17,-89.984700,,"https://maps.google.com/maps/preview/@38.512700,-89.984700,16z",,$1195,power, (BELLEVILLE),haul rite 17 foot trailer,https://stlouis.craigslist.org/boa/5919005870.html,2009
17,,"['38.512700', '-89.984700']",2016-12-20 13:40,This is a one owner boat has a 50hp. mercury two stroke for the lakes with 50 hp limit. It has full cover troller side image electronics and stainless prop.,,5919000592,38.512700,17,-89.984700,,"https://maps.google.com/maps/preview/@38.512700,-89.984700,16z",,$4995,power, (BELLEVILLE),1996 duracraft,https://stlouis.craigslist.org/boa/5919000592.html,
18,like new,"['38.378200', '-88.359300']",2016-12-20 12:39,"For Sale: Sear Ray 23' Bow Rider with 8'-6"" beam 260HP, Mult. port fuel injected Mercruiser with bravo III out drive and stainless steel props -110 hrs. 2 -axle, custom trailer with surge disc brakes and spare Boat has power steering, factory depth finder, compass, XM radio with disc player, bilge pump, top, battery disconnect switch, Fortress aluminum anchor Accessories Included: Mercury shop manuals custom cover dock bumpers, ropes and bungees life jackets and flotation cushions 3 -person tube with inflator 1-set skis stainless steel skeg guard Boat has always been kept in heated storage and is in show room condition Located in Fairfield, IL Contact me with any questions by call or text  618-five 16 - 474four",110,5927067116,38.378200,23,-88.359300,Sea Ray,"https://maps.google.com/maps/preview/@38.378200,-88.359300,16z",220 Select,$30000,power, (Fairfield),Sea Ray 23' Bow Rider,https://stlouis.craigslist.org/boa/5927067116.html,2003
19,,"['38.617407', '-90.548630']",2016-12-20 11:28,Sevylor motor mount brand new. This mount is designed to hold an electric or gasoline out board motor up to 4 h.p. Make offer,,5926948263,38.617407,0,-90.548630,,"https://maps.google.com/maps/preview/@38.617407,-90.548630,16z",,$1,human, (Chesterfied),Sevylor motor mount New,https://stlouis.craigslist.org/boa/5926948263.html,
20,,,2016-12-20 11:03,"15,000lb boat lift for sale. Lift is in great condition. All rubber tubing was replaced about a month ago. As you can see in the pictures the lift comes with two motors and controls. Lift held a 35' Rinker with 11'5"" Beam on it previously. Lift is located in St Charles Missouri.  636twothreesix168six.",,5886154059,,24,,,,,$6500,human, (St Charles),"15,000lb BOAT LIFT  **REDUCED**",https://stlouis.craigslist.org/boa/5886154059.html,
21,,,2016-12-20 10:54,"15' Flat Stern Grumman Canoe Excellent condition.  Comes with all original papers.  Also, includes 3 hp Evenrude Outboard Motor with trolling motor & stand. $700 OBO",,5905220381,,15,,,,,$700,human, (Ballwin),15' Flat Stern Grumman Canoe,https://stlouis.craigslist.org/boa/5905220381.html,
22,,,2016-12-20 10:52,Rare opportunity for a vintage (1983) Ranger V320 I have title and registration in hand $1800.00 Please call or text show contact info,,5926889913,,15,,,,,$1800,power, (Alton),Ranger Bass Boat,https://stlouis.craigslist.org/boa/5926889913.html,
23,,[],2016-12-20 10:13,"Granite city Auto Upholstery offers a wide selection of marine upholstery products and services for boats, jet skis and wave runners. Our complete line of Marine products includes custom boat covers where we measure your boat and custom-fit a beautiful cover made of the best material available. Our boat covers are built with water-resistant, breathable material to prevent molding and can last up to 15 years. Other boat products we offer include Biminis and boat enclosures. We also specialize in the manufacture and repair of boat seats, boat covers and accessories. We use the best quality material and have a wide selection of material and colors. We can repair any boat or jet ski seat or custom build one specially for you with certain specifications and measurements. Call Granite City AutoUpholstery show contact info",,5926755954,,1,,,https://maps.google.com/?q=loc%3A+%32%32%30%30+madison+ave%2E+granite+city+MO+US,,,human,,Marin Upholstery and Custom  Covers,https://stlouis.craigslist.org/boa/5926755954.html,
24,,,2016-12-20 10:03,"97-AMERICAN OFFSHORE-2600 THIS AMERICAN OFFSHORE BOAT HAS BEEN TOTALLY REDONE NEW-PAINT NEW-INTERIOR NEW CARPET NOT INSTALLED STEREO WITH AMPS AND BATTERIES BRAVO OUT DRIVE WITH UPGRADED GEARS,NOSE CONE,DRIVE SHOWER LATHAN FULL DUAL HYDRAULIC STEERING TO THE HELM NEW 30p PROP NEW BLOWN 540 BOWTIE BLOCK - OHIO PRO CRANK - EAGLE H-BEAM RODS L-19 BOLTS MANLY BLOWER PISTONS -- COMP HYDRAULIC ROLLER CAM SET UP -- EDELBROCK MARINE HEADS 1271 BLOWER - INTER COOLER -- DEMON DOMINATOR CARBS -- BILLET AIR CLEANER PRODUCT ENGINEERING FUEL SYSTEM COMPETE MSD IGNITION HAS FULL BOAT COVER 2004 EXTREME TRIPLE AXLE WITH OIL BATH HUBS NEW TIRES BOAT & ENGINE HAS MAYBE 25 HOURS SINCE WE PUT IT TOGETHER I'M SELLING THIS FOR MY BROTHER IN LAW BOAT IS IN REAL GOOD SHAPE READY FOR THE WATER ONLY REASON HE'S SELLING WE JUST DON'T GET TO USE IT MUCH HE'S HAD IT SINCE 2011 40,000 show contact info",,5894355250,,26,,,,,$40000,power,,97-AMERICAN OFFSHORE-2600,https://stlouis.craigslist.org/boa/5894355250.html,
25,good,"['38.751305', '-90.245690']",2016-12-20 09:56,"Out of an estate. We have a Lowes Line 18 foot Aluminum Canoe - Very good condition. This unit is very heavy. Takes two people to carry it. Maxium passenger capacity is 750 pounds. No leaks. Does show one repair that is a real nice quality. Canoe was made locally in Lebanon, MO. If interested call Michael at show contact info",,5926799182,38.751305,18,-90.245690,Lowe Line,"https://maps.google.com/maps/preview/@38.751305,-90.245690,16z",,$385,human, (Hwy 367 / I-270),Lowes Line 18 foot Aluminum Canoe,https://stlouis.craigslist.org/boa/5926799182.html,
26,good,"['38.751305', '-90.245690']",2016-12-20 09:54,"Out of an estate. We have a Lowes Line 18 foot Aluminum Canoe - Very good condition. This unit is very heavy. Takes two people to carry it. Maxium passenger capacity is 750 pounds. No leaks. Does show one repair that is a real nice quality. Canoe was made locally in Lebanon, MO. If interested call Michael at show contact info",,5926796223,38.751305,18,-90.245690,Lowe Line,"https://maps.google.com/maps/preview/@38.751305,-90.245690,16z",,$385,human, (Hwy 367 / I-270),Lowes Line 18 foot Aluminum Canoe,https://stlouis.craigslist.org/boa/5926796223.html,
27,,,2016-12-20 09:35,inflatable seat. backrest.dry storage hatch.cost $859new. sell $350 show contact info,,5899264523,,13,,,,,$350,human, (st louis),clearwater inuit 13 ft kayak,https://stlouis.craigslist.org/boa/5899264523.html,
28,,,2016-12-20 09:35,beautiful boat. 15 ft. 55 lb show contact info,,5896146945,,15,,,,,$650,human, (st louis),wooden canoe,https://stlouis.craigslist.org/boa/5896146945.html,
29,,,2016-12-20 09:35,beautiful boat. 15 ft. 55 lb show contact info,,5913686780,,15,,,,,$650,human, (st louis),wooden canoe,https://stlouis.craigslist.org/boa/5913686780.html,
30,good,"['38.596000', '-90.007100']",2016-12-20 09:26,2003 stratos 190fs 19ft good condition 150 yamaha vmax stainless prop trolling motor foot controlled two elite7 chirp one at dash oneup front all in working order call 618 550 871one ready to go on lake last week,,5926755807,38.596000,19,-90.007100,stratos,"https://maps.google.com/maps/preview/@38.596000,-90.007100,16z",fs190,$10900,power, (fairview heights),2003 stratos fish & ski,https://stlouis.craigslist.org/boa/5926755807.html,2003
31,,,2016-12-20 09:23,"2015 crestliner VT 19. 2015 Mercury 150 four stroke. with 21 pitch tempest plus pro edition package. hydraulic steering. tilt steering wheel. motor guide 82 lb digital trolling motor with wiring harness. 3 interstate batteries. 3 bank charger. aluminum wheels. trailer brakes. swing tongue. recirculating livewell. automatic bilge. led deck lights. retractable transom straps. hummingbird 899 si at cockpit. hummingbird 859 HD di on bow. lakemaster mapping Loaded. Excellent fishing rig call or text show contact info ranger, crestliner, tracker, lund, nitro, bass cat, aluminum boat",50,5926750741,,19,,crestliner,,VT 19,$23000,power, (crystal city),Crestliner vt 19,https://stlouis.craigslist.org/boa/5926750741.html,2015
32,excellent,"['38.738371', '-90.076647']",2016-12-20 08:38,"I HAVE , 55 GAL, BLUE, LIKE NEW,  PLASTIC BARRELS,  WITH BUNG PLUGS, GOOD TO USE FOR, RAIN WATER, OR STORAGE, COMPOSTING, FLOATING DOCKS, OR POOL COVER FLOATS THIS FALL. PH# show contact info FOR ADDRESS, THANKS FOR LOOKING!",,5922961047,38.738371,35,-90.076647,,"https://maps.google.com/maps/preview/@38.738371,-90.076647,16z",,$15,human, (GRANITE CITY IL 62040),55 GALLON PLASTIC  BARRELS FOR BOAT DOCKS,https://stlouis.craigslist.org/boa/5922961047.html,
33,,,2016-12-20 08:21,"Alumacraft Canoe, Aluminum 17 Ft , Asking $350.00 Email With Ph# If Interested. Thanks For Looking.",,5912134821,,17,,,,,$350,human, (Jeff Co),"Alumacraft Canoe, Aluminum 17 Ft",https://stlouis.craigslist.org/boa/5912134821.html,
34,good,"['38.908700', '-90.156800']",2016-12-20 08:21,"Avon raft boat 20 HP mercury ,, 10 foot, motor runs good , its a fun boat , just like riding a tube , trailer. show contact info",,5926672682,38.908700,10,-90.156800,Avon raft,"https://maps.google.com/maps/preview/@38.908700,-90.156800,16z",,$525,power, (Alton Ill),Avon raft boat 20 HP Mercury,https://stlouis.craigslist.org/boa/5926672682.html,
35,,"['42.053900', '-90.395400']",2016-12-20 07:26,"This is a brand new rig. This is the 1854 extreme center counsel model with trim and forward/reverse all on the new mercury controls ( which is a new option for 2016). The GatorTail extreme hull is designed to be the best performing rig on the market today. The speed and handling of this rig is unbelievable. This rig is loaded with options. It has dual rod boxes that go all the way to front deck so you can fit a lot more stuff than other boat boxes that a deceivingly smaller once they are opened. Enclosed rear deck that is absolutely huge. You can easily fit 5 dozen decoys in this rear deck. A seat base with a very nice tempress brand seat is on top of the enclosed rear deck. 12 gallon fuel tank up front under the extended deck, bilge pump, and even more storage under the front deck. There is literally a spot for everything to be put away. Motor is the new GTR 37EFI. This combo is the best of the best. Boat will run 31mph with single person in it and the most impressive part is that even if you load this up with 4 hunters and all the gear you will still run 27+ mph which is really good numbers for a mudmotor. Boat sits on a very nice Mcclain aluminum trailer. I have this rig discounted down below my dealer price in order to make room for incoming inventory. I also have new 37EFI motors in stock. Call or text for more info.  No emails please. 563-2one2-228one.",,5889487048,42.053900,18,-90.395400,,"https://maps.google.com/maps/preview/@42.053900,-90.395400,16z",,$22500,power, (Preston Iowa),2016 Gator Tail 1854Extreme CC w/37EFI GTR,https://stlouis.craigslist.org/boa/5889487048.html,
36,new,"['38.357300', '-90.649800']",2016-12-20 03:36,"This is a 40 hp Mercury jet motor, a Lowe 1648MT john boat, and a Lowe trailer, that HAVE NEVER been used. The motor is a 2016, the boat and trailer are both 2017. This setup has NEVER been in the water yet. If interested call show contact info or show contact info NO TEXTING........",0,5926520172,38.357300,16,-90.649800,Mercury,"https://maps.google.com/maps/preview/@38.357300,-90.649800,16z",40HP Jet,$12500,power, (cedar hill),Boat,https://stlouis.craigslist.org/boa/5926520172.html,2016
