,condition,coord_pair,date,description,engine hours (total),id,lat,length overall (LOA),long,make / manufacturer,map_URL,model name / number,price,propulsion type,region,title,url,year manufactured
0,like new,,2016-12-20 06:40,1999 Lund 1850 Tyee Boat with 2010 Shorelander Tandem Axle Trailer. New Minkota 80/US2-6. New Three Bank Charging System. 175 hp Yamaha and 8 hp Yamaha kicker. All in like new condition. Lots of Extras.,,5923412989,,19,,Lund/Lund,,Tyee/1850,$19000,power," (McAllister, MT)","Lund 1850 Tyee Boat, 1999",https://greatfalls.craigslist.org/boa/5923412989.html,1999
1,like new,"['47.614300', '-112.001500']",2016-12-19 13:21,"2009 Reinell Boat. One owner. Used maybe 15-20x. In great condition. In board. Low hours. Comes with 2 large (4 person) tubes, a Zup board, ropes, etc! $24,000 OBO. Books for 35k+!",,5925851308,47.614300,20,-112.001500,Reinell Bt,"https://maps.google.com/maps/preview/@47.614300,-112.001500,16z",205 LS,$24000,power, (Fairfield),2009 Reinell boat,https://greatfalls.craigslist.org/boa/5925851308.html,
2,good,"['47.305271', '-111.289198']",2016-12-18 16:01,I have a 1976 baja 14ss boat. 65 hp mercury outboard.  Pretty good condition for its age. As far as I can tell it just needs a coil. Comes with boat cover as well.  1200.00 obo. Call or text aaron @four 0six 799-7530,,5893634575,47.305271,14,-111.289198,Baja,"https://maps.google.com/maps/preview/@47.305271,-111.289198,16z",14ss,$1200,power, (great  falls),1976 baja 14ss,https://greatfalls.craigslist.org/boa/5893634575.html,1976
3,excellent,"['47.305271', '-111.289198']",2016-12-17 20:29,"Looks good, runs good, low operating hours, reliable, 17 ft, runabout, ski or fish, all systems work, has  majority of life stored inside,ski's and / or rod storage,lots of storage, walk through-open bow, 150 hp inboard, trolling plate, trolls to 2 mph and runs 45 mph +, includes anchor and rope, ski's and rope, new travel / storage cover plus complete front to back custom snap on covers ( stern,   side curtains, convertible top and bow )deep v hull, stable, good trailer and tires, led trlr lites, new trailer belt on load winch, 25 gallon gas, weighs only 1100 lbs. ice storage compartmts, seats 7, fold down lounge  seats, foam insul ( non-sink ), lowrance fish / depth locator. Very nice older boat.",100,5911365674,47.305271,17,-111.289198,Glastron,"https://maps.google.com/maps/preview/@47.305271,-111.289198,16z",SSV 179,$4900,power, (Great Falls),pre-owned Glastron boat,https://greatfalls.craigslist.org/boa/5911365674.html,1983
4,excellent,"['47.509800', '-111.340500']",2016-12-17 17:59,"2003 hewes craft 180 sport jet .Boat has full cabin top, 175hp jet, terrova 84 pd trust troll motor, easy loader trailer w/spare tire.Boat was purchased from original owner and I have all original paper work. Boat is all aluminum and in excellent condition, always garaged and well cared for. Has new mooring cover and hummingbird fish finder, pole holder's and storage racks. This boat is very clean and looks like new.this is a great all around boat for river or lakes. Asking  $22,500obo,call(406) seven 8 eight 9 one 6 seven",,5885824344,47.509800,18,-111.340500,Hewes craft,"https://maps.google.com/maps/preview/@47.509800,-111.340500,16z",180 sport jet,$22500,power, (greatfalls),Hewes craft 180 sport jet,https://greatfalls.craigslist.org/boa/5885824344.html,2003
5,excellent,[],2016-12-17 13:36,"Motivated Seller.  Price is listed in USD.  Delivery Options from Can to US available. 5.7 L EFI Kodiak Marine Engine Hamilton 212TI 12 degree hull 80 gal fuel tank 21' length 8' beam .190 x 6' bottom .125 x 34"" sides 15hp merc 4stroke kicker TR-1 Garmin Gold Auto Pilot (Kicker) 1-Rigid LED lighting bar and 2 dually 2's River anchor (rocking chair style) Boat has worked flawless for me as the 2nd owner.  I am moving in a different direction with the next boat and need this one out of the shop.",220,5923418697,,21,,Thunder Jet,https://maps.google.com/?q=loc%3A+%36%30+ranchview+way+NE+Medicine+Hat+MT+US,Alexis Classic,$45000,power, (Medicine Hat),Thunder Jet Alexis Classic 09,https://greatfalls.craigslist.org/boa/5923418697.html,2009
6,fair,,2016-12-17 06:04,"1995 Mirage Jaguar Ski Racer with 175 HP Mercury Outboard. Runs good, 75 to 85 mph. 2 stainless steel props. Ski pole and life jackets. Interior is in good shape and I have a new roll of gray marine grade carpet for it. Needs cosmetic repairs, ( gel coat faded and minor scratches). $6900.00 OBO. Please contact me at show contact info Will consider delivery in the western states.",250,5913559085,,19,,Mirage,,Jaguar Ski Racer,$6900,power, (Great Falls),1995 Mirage Jaguar Ski Racer,https://greatfalls.craigslist.org/boa/5913559085.html,1995
7,good,"['47.509800', '-111.273400']",2016-12-16 22:18,65 hp mercury engine. No title on boat or trailer. Make offer.,,5890017889,47.509800,14,-111.273400,Larson,"https://maps.google.com/maps/preview/@47.509800,-111.273400,16z",,,power,,14 ft Larson,https://greatfalls.craigslist.org/boa/5890017889.html,
8,good,"['47.509800', '-111.273400']",2016-12-15 22:21,I am selling my 1973 sea gull 17 ft boat. It has a 50 hpJohnson. Motor runs good. I put new carpet in and started recovering the seats. The bottoms are done but the backs need to be done. Also comes with minkota trolling motor bow mount. 2 batteries 1 deep cycle and 1 cranking. Trailer has been repainted and retired. It does not have title but easy to obtain one.,,5891924492,47.509800,17,-111.273400,Sea gull,"https://maps.google.com/maps/preview/@47.509800,-111.273400,16z",,$1300,power, (Great Falls),17 ft boat,https://greatfalls.craigslist.org/boa/5891924492.html,1973
9,,"['47.305271', '-111.289198']",2016-12-14 14:55,"Were selling our like new pontoon, we used it 2 times and just don't have time for it.  everything works, has it all including dressing room, nice stereo, lots of storage.  wish we could keep but it just sits there.  20ft, beautiful interior.  paid 34,000  will let go for 28,000  call or text me at show contact info thanks steve",,5879453129,47.305271,20,-111.289198,,"https://maps.google.com/maps/preview/@47.305271,-111.289198,16z",,$28000,power, (Great Falls),2016 sylvan Pontoon,https://greatfalls.craigslist.org/boa/5879453129.html,
10,excellent,"['45.781300', '-108.572700']",2016-12-14 09:01,"2014 Wooldridge Alaskan XL Sport Jet. The boat was custom ordered 18' 10'' long with a 76'' bottom. The 200hp Mercury Sport Jet has around 87 hours and runs excellent. The boat has a folding top with side curtains and a back drop curtain, travel cover, suspension front seats, 42'' bench seats that turn into a bed, wash down pump, two batteries with select able switch, Zolatone paint on top half of boat, stomp grate, 3/4 swim deck with under mount boarding ladder, kicker mount, 3100# torsion axle trailer with electric over hydraulic disk brakes with slick bunks, spare tire, Garmin GPS/depth finder, 52 gallon fuel tank. The boat handles excellent and carries a lot of weight, top speed is around 40 mph depending on the load. Excellent condition, a few scratches but all minor, I wash the boat and flush the motor after each use. The boat new is $60K, asking $47,000. Willing to help with delivery if needed. I am selling because I am upgrading to a different boat.",87,5918993986,45.781300,18,-108.572700,Wooldridge,"https://maps.google.com/maps/preview/@45.781300,-108.572700,16z",Alaskan XL Sport Jet,$47000,power, (Billings),2014 Wooldridge Alaskan XL Sport Jet,https://greatfalls.craigslist.org/boa/5918993986.html,2014
11,excellent,[],2016-12-12 11:24,"We are selling our Ocean Kayak Zest Two tandem kayak. We have had a lot of fun with this boat. It is self bailin, very stable, handles easily, even in rough water. I have it set up for fishing with Scotty removable rod holders . This kayak has every option and I will include the Yakima Hully roller cartop carrier, Features: Two Comfort Plus seat backs Two molded-in seat wells Oversized tank well with bungee Paddle keepers Molded-in cup holders Deck bungee Side mounted carrying handles Skid plate Options: Up to 2 Oval Gaspachi Hatches (center, stern) Up to three 6"" Cam Lock Hatches (bow, center, stern) Specs: LENGTH: 16' 4.5"" | 5 m WIDTH: 30.5"" | 77.5 cm WEIGHT: 75 lbs | 34 kg BOW SEAT WIDTH: 19"" | 48.2 cm STERN SEAT WIDTH: 18"" | 45.7 cm BOW LEG LENGTH: 47"" | 119.4 cm STERN LEG LENGTH: 49"" | 124.5 cm MAX CAPACITY: 500-600 lbs | 226.8-272.2 kg SUGGESTED RETAIL: $1099.99 USD Seating: Tandem Seating Icon - Zest Two Exp Also included in sale Scotty Rod Holders Yakima Kayak Carrier Paddles Life Jackets Scupper Stoppers",,5906463528,,16,,Ocean Kayak,https://maps.google.com/?q=loc%3A+%33%35+Scenic+Valley+Ln+Cascade+MT+US,Zest 2 EXP,$550,human, (Dearborn),Ocean Kayak tandem kayak,https://greatfalls.craigslist.org/boa/5906463528.html,
12,good,,2016-12-11 13:36,"1993 Skeeter Bass Boat 2010 Mercury out Board 225 with Skeeter Trailer 1993 Trolling motor 2 fish finders $10,500.00 OBO or Trade? no texting",325,5879442380,,19,,Skeeter,,200-sx BT,$10500,power, (ST Ignatius MT),1993 Skeeter bass boat,https://greatfalls.craigslist.org/boa/5879442380.html,1993
13,,"['47.509800', '-111.340500']",2016-12-11 07:06,"14' star sport bug solid transom raft. Near perfect condition. 9.9 game fisher motor with new prop and impeller. $1600. Also available 6'x10' custom made trailer with 16"" wheels and tires. All new lights and wiring  $1200 motor propelled",,5914702813,47.509800,14,-111.340500,Star,"https://maps.google.com/maps/preview/@47.509800,-111.340500,16z",Sport bug,$1600,power,,14' star sport solid transom raft,https://greatfalls.craigslist.org/boa/5914702813.html,
14,,"['48.660300', '-112.365400']",2016-12-10 14:02,1986 bass tracker tx-17. 50 hp mercury outboard. Ran when parked in barn. Good trailer with good tires.,,5914025889,48.660300,18,-112.365400,Tracker,"https://maps.google.com/maps/preview/@48.660300,-112.365400,16z",Tx-17,$3750,power, (Cut Bank),Bass tracker,https://greatfalls.craigslist.org/boa/5914025889.html,1986
15,new,"['45.614034', '-108.386684']",2016-12-08 15:28,"Brand new 2015 Axis T23, 5.7L 350 Monsoon, Torque 15 X 12 prop, tower mounted rearview mirror, 1 pair of tower racks, 3 hard tank ballast and plug and play for bags, wedge, depth finder, drop in cooler, dual battery switch, ski pylon, underwater lighting, full warranty, and SURF GATE, Full Warranty.  This boat is a holdover from 2015 and our loss is your gain.  The price was just dropped from $59,900 to $58,990.  You won't find another brand new T23 for this price anywhere. Please email me or call eight6one-three3two2 for more information. Thank you, Tim",0,5911368958,45.614034,23,-108.386684,Axis,"https://maps.google.com/maps/preview/@45.614034,-108.386684,16z",T23,$58990,power," (Billings, MT)",2015 Axis T23 Wakeboard/Wakesurf Boat,https://greatfalls.craigslist.org/bod/5911368958.html,2015
16,like new,"['47.860100', '-111.690000']",2016-12-06 00:08,"2011 reinell ski boat, inboard volvo penta v6 , volvo outdrive. has ski pole, comes with 4 tubes, 9 life jackets, skis , wake board, knee board, gray in color, dont miss out. beautiful boat.much more. please call or text only.",35,5907434663,47.860100,20,-111.690000,reinell,"https://maps.google.com/maps/preview/@47.860100,-111.690000,16z",197 Ls,$19000,power, (dutton),2011 reinell 197 ls,https://greatfalls.craigslist.org/boa/5907434663.html,2011
17,,"['47.509800', '-111.340500']",2016-12-05 23:23,"Bass Pro Shops Pond Prowler 'boat'. 48"" wide and 10' long and weighs about 100 pounds. I just slide it into the back of my truck with the tailgate down and tie it in and off I go. Two seats and rated for 450 pounds or two people. Seat positions are adjustable. Will not sink. Motor no longer available, so boat only now. Cash only. And I am not going to ship it anywhere or any of that scam BS so save your breath and our time. Local, in person, sale only.",,5878166110,47.509800,10,-111.340500,,"https://maps.google.com/maps/preview/@47.509800,-111.340500,16z",,$350,human, (Great Falls),Pond Prowler,https://greatfalls.craigslist.org/boa/5878166110.html,
18,good,,2016-12-05 08:55,"Correct Craft ski boat 19' Barefoot Nautique, trailer has built in trailer brakes. Wake board tower with Dbots speakers mounted on it. Stereo system has CD and auxiliary connection. Sub woofer under front of bow. 351 Cleveland motor. Just refinished wood platform on back. Rear view mirror mounted on dash. 3 blade brass prop. Also have ski pylon for it as well",600,5906247074,,19,,Correct Craft,,Barefoot Nautique,$8500,power, (Great Falls),87' Barefoot Nautique,https://greatfalls.craigslist.org/boa/5906247074.html,1987
19,,"['47.305426', '-111.260433']",2016-12-04 15:36,O.B.O 18ft 140 mercury inboard 50 PD Minn Kota trolling motor 4 rod holder 4 life vest 770C humming bird fish finder Ready for fishing and recreation Runs great,,5905442542,47.305426,18,-111.260433,,"https://maps.google.com/maps/preview/@47.305426,-111.260433,16z",,$2000,power, (Great falls),1985 sea swirl tempo 18ft,https://greatfalls.craigslist.org/boa/5905442542.html,
20,,"['47.305271', '-111.289198']",2016-12-04 08:21,For sale is a Newfound Woodworks wood strip CNC'd kayak form kit and Ladder-LOC strongback. Also have a 12' build table to set the form up and build on. Forms have only been used to build one kayak. Plans and instructions included also. Kit is for following kayak: http://www.newfound.com/osprey.htm Asking for $225,,5874857913,47.305271,16,-111.289198,Newfound Woodworks,"https://maps.google.com/maps/preview/@47.305271,-111.289198,16z",Osprey,$225,human,,WOOD STRIP KAYAK FORM KIT,https://greatfalls.craigslist.org/boa/5874857913.html,
21,,"['42.299100', '-89.634500']",2016-12-02 09:40,"1999 Crestliner with trailer. This unit is ready for your choice of outboard! It is the SUPERHAWK 1700 model Includes 4 swivel Tempest Seats, has a lot storage, two Rod Rack capable of holding 8ft rods, approx 90"" Beam, two Live Wells, The  Galvanized trailer has Goodyear 13"" Tires, Bearing Buddies, Full Roller, The Trailer's tongue folds for ease of storage. $4,200 - cash, MC or Visa Will trade - Call show contact info or email show contact info",,5902188437,42.299100,18,-89.634500,,"https://maps.google.com/maps/preview/@42.299100,-89.634500,16z",,$4200,power, (Freeport),1999 Crestliner SUPERHAWK ALL WELD !,https://greatfalls.craigslist.org/boa/5902188437.html,
22,,,2016-12-02 09:39,2013 Clackacraft 16′ Eddy Lots of extras! Super great shape! Front Seat mount on Yeti 65 Cooler with Seadeck Foam Top Rubber Mats ‌• Motor Mount Front  & back casting braces Back seat with storage compartment Rowers box seat with storage Side storage Side rod holders Anchor & rope New Carlisle Oars 2013 Galvanized Adams Trailer with boat buckles & spare tire,,5902187885,,16,,,,,$7995,human,,2013 Clackacraft 16′ Eddy,https://greatfalls.craigslist.org/boa/5902187885.html,
23,,,2016-12-02 09:23,2007 Clackacraft 15' LP Front  & back casting brace Front & back seat with storage compartment Rowers box seat with storage Side rod holders Anchor & rope Spare Tire 2008 Galvanized Adams Trailer Cataract Oars Price -- $6495,,5902160605,,15,,,,,$6495,human,,2007 Clackacraft 15' LP --,https://greatfalls.craigslist.org/boa/5902160605.html,
24,new,[],2016-11-30 09:53,"Prewired for optional Minn Kota trolling motor. Front casting deck uses sand-infused painted finish to provide skid-resistant footing. Lockable bow under-deck storage, 12 volt receptacle, courtesy light, and bilge pump are just a few a few of the amenities of this""all-season' boat package. Jet boat console is placed forward in order to enhance shallow running capabilities. The open layout behind the console behind the console allows freedom of movement when landing fish. Tunnel hull design for shallow water use. Tunnel directs more water flow to Jet to provide the maximum thrust for engine placed on higher 29' transom. The result is a great shallow draft boat.",,5877811873,,18,,G3,https://maps.google.com/?q=loc%3A+%31%38%33%32+King+Ave+W%2C+%31%35th+Ave+W%2F+King+Ave%2E+W+Billings+MT+US,1860 CCJ,$23995,power, (Billings),2016 1860 CCJ,https://greatfalls.craigslist.org/bod/5877811873.html,2016
25,new,,2016-11-29 13:17,2015 G3 Jet Boat.  Used 3 times.  Rigged and ready to roll.  Loaded with too many options to list.  Call for details.,2,5898020279,,18,,G3,,1860,$25000,power,,2015 G3 Jet Boat,https://greatfalls.craigslist.org/boa/5898020279.html,2015
26,good,,2016-11-29 12:12,"2000,Smokercraft,15ft,1993 15hp Evinrude motor,runs great,comes with 2 seats,rod holders,gas tank.Galvanized Easyloader trailer.",100,5897899697,,15,,Smokercraft,,15ft Alaskin,$2800,power, (Great Falls),"2000 Smokercraft,Alaskin",https://greatfalls.craigslist.org/boa/5897899697.html,2000
27,new,,2016-11-29 11:43,"For this fishing machine save $9264.00, one call to Arie and you save $9264.00 from MSRP. Grab Your Friends and Head for the Water Smoker Craft's 182 Pro Angler XL offers plenty of room for you and your friends to spend the day reeling in the next big catch. With extended rear fishing areas and deluxe, ergonomic, wood-free fishing seats, the 182 Pro Angler XL brings functionality and comfort together for all your days on the lake. Plus, the Pro Angler 182 XL features a large lockable bow center rod storage compartment that lets you safely stow up to 8 rods. Features may include: Floor/Carpet Treated Floor w/ Lifetime Warranty Vinyl Floor Covering Windshield Curved Walk Thru Windshield Dash Tachometer Speedometer Fuel Gauge Volt Meter Trolling Motors Trolling Motor Plug Lighting Navigation Lights Seating Movable Pedestal Seat Bases Fishing Seats Miscellaneous Twice Baked Urethane Paint Livewell 28 Gallon Stern Livewell 18 Gallon Bow Livewell Stereo AM/FM Stereo w/Auxiliary Port for MP3 Player",,5870495882,,18,,,,,,power,,2016 SmokerCraft Pro Angler 182 XL Fishing Machine,https://greatfalls.craigslist.org/bod/5870495882.html,
28,,,2016-11-29 10:19,"2014 White Adipose Sit-Down Model Lockable Lid Latches Features adjustable pedestal seats, rower's seat slider. New Polecat Oars & Anchor 2016 Galvanized Standard Black Dog Standard Trailer  (slightly-used for shows) $8,495 We do offer a full-range of oar selection for an optional upgrade Call us at 406.992.151nine or check out more used boats @ http://adiposeboatworks.com/wordpress/category/used-drift-boats/",,5897672312,,16,,,,,$8495,human,,2014 White Adipose Sit-Down Model,https://greatfalls.craigslist.org/boa/5897672312.html,
29,like new,"['48.155968', '-114.289570']",2016-11-29 09:38,"We don't get in High Performance Ski & Wakeboard board boats very often but we just took in trade this Flawless Blue 2013 Tige 20i, powered by the 342 Horsepower PCM engine with under 60 hours. Includes Bimini Top & Boat Cover. JUST REDUCED $5,000 FOR OUR END OF THE YEAR CLEARANCE EVENT!!!! The Tige shakes up the traditional ski boat with sleek styling and an ultra precise wake. The Tige's incredibly faint, clean wakes have hooked some of the world's best pro skiers. Tige 20i matches the action with a deeper, drier ride and plush creature comforts not usually found in a serious slalom boat. This Tige is priced to sell fast, summer is here, better act fast before it's gone. You must contact Hugh Paris for this Special Internet Pricing @ show contact info If you need more information or photos, just pick up the phone and give me a call. Trades are Welcomed!! Specifications Length: 20 ft. (6.10 m) Beam: 96 in. (243.84 cm) Weight: 3,268 lb. (1,482.33 kg) Fuel: 30 gal. (113.56 L) Seating: 8 persons Overview Deep Freeboard: 32"" freeboard makes Tige the deepest, roomiest towboat. Storage: Looks can be deceiving. The 20i side storage compartments have plenty of room for all of your gear, including skis and wakeboards. Engines: PCM engines are quiet, reliable and vibration-free. You can count on your Tige to start the first time, every time, thanks to PCM's patented Fuel Control Cell providing constant fuel flow to the engine. PCM's reliability rating is the highest in the industry, making it a natural choice for Tige. Serious skiers have heaped praise on this innovative 20 for its clean wakes and creature comforts not usually found in a serious slalom boat. Now the all--new Tige 20i delivers even more with a Tige plush interior, redesigned dash and striking gel coat scheme. But a quick adjustment of TAPS2 and riders in the boat will be grabbing their boards for the impressive ConvexV wake. Those still in the boat will be comfortable and dry with plush seating and the deepest freeboard of any 20--foot direct--drive.",59,5897408983,48.155968,20,-114.289570,Tige,"https://maps.google.com/maps/preview/@48.155968,-114.289570,16z",20i,$34999,power," (Kalispell,Mt)",2013 Blue Tige 20i Ski & Wakeboard Boat-343 HP PCM Engine-59 Hours!!!,https://greatfalls.craigslist.org/bod/5897408983.html,2013
30,like new,,2016-11-28 17:06,2012 Sanger Boats SV 215 (USD53F212) Use the following link to view more information about this vehicle: http://www.fastoysracing.com/lc/2339446 Very clean --- low hour---- extra ballast .... what's not to like.  Call Andy with any questions regarding this Sanger!!!! Vehicle Details Year: 2012 Make: Sanger Boats Model: SV 215 Mileage: 283 Stock #: USD53F212 VIN: SANRX153F212,283,5896754023,,21,,Sanger Boats,,SV 215,$44299,power,,2012 Sanger Boats SV 215 (USD53F212),https://greatfalls.craigslist.org/bod/5896754023.html,
31,like new,,2016-11-28 15:36,"2007 Malibu Wakesetter 23 Ski and Wake board V drive 5.7l 340hp, 12 passengers, with Bimini topand full cover, tower speakers, swim platform. One call saves $6012.00, call Arie for the $6012.00 discount from list.",,5871752652,,23,,,,,,power,,2007 Malibu Wakesetter 23 Ski and Wakeboard,https://greatfalls.craigslist.org/bod/5871752652.html,
32,good,,2016-11-27 18:56,"1993 Skeeter Bass Boat 2010 Mercury out Board 225 with Skeeter Trailer 1993 Trolling motor 2 fish finders $10,500.00 OBO or Trade? no texting",325,5873072015,,19,,Skeeter,,200-sx BT,$10500,power, (ST Ignatius MT),1993 Skeeter bass boat,https://greatfalls.craigslist.org/boa/5873072015.html,1993
33,,,2016-11-27 13:06,"1994 Smoker craft 17 1/2ft with a 1994 Spartan trailer. 2000 90HP Mercury 4 stroke outboard, 22 gallon gas tank, open bow with a  Minnkota 65pounds of trust 24 volt (power drive), Two bank battery charger. Travel cover Rain fly Good floor Good carpet New tires 4 rod holder $6400.00 OBO.  Will consider partial trade. For more info call or email me. Note: I do not do pal-pay or wire transfers. All sales will be in person only..... Thank you for looking, Terry",,5890011483,,17,,,,,$6400,power, (Great Falls),1994 Smaoker craft 17 1/2ft,https://greatfalls.craigslist.org/boa/5890011483.html,
34,excellent,"['47.305271', '-111.289198']",2016-11-26 15:45,16' Smoker Craft with extras. EZ Loader trailer w/new spare tire. All items are in excellent condition. -1996 Yamaha 90HP jet w/power trim (also has extra lower unit) This engine has low hours -Minn Kota 55# thrust trolling motor with independent deep cycle battery -Humming Bird model 597 fish finder w/foot control -live well -life jackets -custom boat cover,,5893633036,47.305271,16,-111.289198,Smoker Craft,"https://maps.google.com/maps/preview/@47.305271,-111.289198,16z",Jon 1660,$8000,power, (Great Falls MT),16' Smoker Craft,https://greatfalls.craigslist.org/boa/5893633036.html,2011
35,fair,,2016-11-25 20:02,"this is a great little boat, has a clean title. Spray painted with flex seal. still needs a little more spray but is is a great .",0,5892485188,,15,,,,,$350,human, (conrad mt),96 fiberglass boat,https://greatfalls.craigslist.org/boa/5892485188.html,1996
36,,,2016-11-24 18:14,"15 foot fishing boat with a 65 hp Johnson outboard. Great boat with lots of room to move around. New water pump impeller and cup, thermostat, wheel bearings and races. I have $1300 into it and am willing to trade towards a smaller aluminum boat, trailer, and motor or an extended cab pickup.",,5891009124,,15,,,,,$1300,power, (great falls),15 ft fishing boat,https://greatfalls.craigslist.org/boa/5891009124.html,
37,excellent,"['48.503700', '-111.839100']",2016-11-24 14:16,"2000 Glastron, 4.3 Volvo Penta, towable and storage cover, excellent shape, buy now and save 1,500.00",,5890900756,48.503700,18,-111.839100,Glastron,"https://maps.google.com/maps/preview/@48.503700,-111.839100,16z",Sx175,,power,,Glastron boat,https://greatfalls.craigslist.org/boa/5890900756.html,2000
38,excellent,"['42.935700', '-112.467900']",2016-11-23 19:53,"I AM LOOKING FOR AN ALUMINUM JET BOAT 18-19 feet in length. It must be at least 100HP. It can be an inboard or outboard. I would prefer not older than 1999. I am willing to pay $18000.00 to $20,000.00 for the right boat. The boat must be in excellent condition. Please call me at show contact info or send me photographs of your boat and your asking price and I will get back with you as soon as possible. Thanks",,5890190633,42.935700,18,-112.467900,,"https://maps.google.com/maps/preview/@42.935700,-112.467900,16z",,$18000,power,,WANT JET BOAT,https://greatfalls.craigslist.org/boa/5890190633.html,
39,like new,"['47.546408', '-111.508141']",2016-11-23 19:26,"Wooldridge Alaskan 16ft absolutely the nicest jet boat used you can find without buying new. Polished hull new top and full transport cover. On step in 1/2 a boat length. Runs 32mph flat out. No issues with anything absolutely perfect. Perfect bottom. Hard to find Yamaha power trim and tilt outboard with 92 original hours most have cheap evinrude/johnson outboards. I know what I have and you will not find anything nicer anywhere. No text, crap emails or any other BS. SOLD!!!!",92,5855480996,47.546408,16,-111.508141,Wooldridge,"https://maps.google.com/maps/preview/@47.546408,-111.508141,16z",Alaskan,$14500,power," (Great Falls,MT)",Wooldridge Alaskan Center Console SOLD!!!,https://greatfalls.craigslist.org/boa/5855480996.html,1988
