,condition,coord_pair,date,description,engine hours (total),id,lat,length overall (LOA),long,make / manufacturer,map_URL,model name / number,price,propulsion type,region,title,url,year manufactured
0,good,,2016-12-20 15:05,"Full roller trailer for up to a 16' boat. New rollers,paint,winch and coupler. Transferable registration. $450",,5915323829,,19,,,,,$450,power, (Lafargeville),Boat trailer for 16 FT.,https://watertown.craigslist.org/boa/5915323829.html,
1,,"['43.974300', '-75.912200']",2016-12-20 13:53,"Works. New battery,title on hand.Cash or trade( show me what u have)",,5901552008,43.974300,15,-75.912200,,"https://maps.google.com/maps/preview/@43.974300,-75.912200,16z",,$1,power,,Nice Boat,https://watertown.craigslist.org/boa/5901552008.html,
2,,,2016-12-20 13:35,"Please don't reply if you don't have $ im sick n tired of peasants trying to low ball. 2016 Kawasaki Ultra LX 2016 Heavy Duty Caravan Trailer with LED Lights and Trailer jack 2016 OEM Kawasaki Jet Ski Cover Brand New in Box Warranty Expires 6/30/2017 (you can also buy up to 4yrs) 2 fresh water hours on this jetski, no time to use it unfortunately Comes with new Anchor, new Ropes, new Bumper Fenders, new Fire Extinguisher Located in Lincoln, RI 02865 Price is VERY FIRM at $10,000 CASH. No Trades",,5912362305,,13,,,,,,power,,2016 Kawasaki Ultra LX w/ Warranty,https://watertown.craigslist.org/boa/5912362305.html,
3,excellent,,2016-12-20 11:49,This 2008 Stuart Marine Mariner 19 is a centerboard day sailor that's as easy to sail and own as it gets. Cabin accommodates 2 adults +2 Children. Boat's displacement is 1300lbs and can be easily towed. Sheets are in a very good condition with small stains. Entire rigging is fully functional and solid. Cushions are tear ans scuff free. Hull is solid w/ no blisters or cracks. This spring all bushings on centerboard and rudder were replaced. All windows and deck vents are sound and tight. Tohatsu 2-stroke 3.5HP with integrated tank is a light weight very efficient yet very capable of pushing the boat with 4 persons on-board. Spare fuel tank (1Gal) in storage compartment under starboard cockpit seat. -Blue gelcoat with white stripe and red bottom paint -Aluminum mast with 1/19 wire rigging and a roller furling headstay -Neil Pryde headsail -Neil Pryde mainsail with lazy jacks and sail bag -Mooring cleats -Jiffy reefing kit -Topping lift kit -Spreader & turnbuckle boots -Light & battery box kit with 12V 1W Solar Panel -Self bailing cockpit -Bulkhead compass -10lb folding anchor with rope -West marine paddle -Folding ladder -Custom cockpit closed-cell cushions -(1) type IV throw able PFD -Adjustable transom bracket for outboard motor -Dock lines and fenders -Transom mounted stainless swimming ladder -4-pc interior cushions -2-pc cockpit cushions -Fire extinguisher -Sanipottie- prortable tolet -Line cleats -Tiller extention -Sail feed slot cover Painted trailer registered as home made is fully functional : -Single axle -Tires and lights in very good condition To get more information on specs please visit: https://stuartmarine.squarespace.com/used-mariner-centerboard/ Asking $19900,,5907545959,,19,,Stuart Marine,,Mariner CB 19,$19900,sail, (Jamesville),08 Mariner 19' Cabin Sailboat w/ Outboard and Trailer,https://watertown.craigslist.org/boa/5907545959.html,2008
4,good,,2016-12-20 11:48,"1996 Wellcraft 19.5' open bow center console fishing boat on a roadworthy trailer. The boat needs some fiberglass work on gunnels and deck above the waterline and some gellcoat work just about the waterline. Otherwise the hull is in a good shape - no blisters and no soft spots. Trailer is roadworthy and in a very good condition, good tires, frame and bearings. Look at the pictures and feel free to contact me with questions about it. Purchased it for restoration project but currently got enough projects and I want to consolidate the space. Boat comes with a title and the trailer needs to be registered as home made. Outboard motor and controls not included. Asking $1499",,5919822003,,19,,wellcraft,,CCF195,$1499,power, (East Syracuse),1996 Wellcraft 195 CCF Boat With Traler,https://watertown.craigslist.org/boa/5919822003.html,1996
5,,"['43.935748', '-76.100345']",2016-12-19 17:36,6hp Johnson great runner use it often. $400 show contact info,,5895188561,43.935748,1,-76.100345,,"https://maps.google.com/maps/preview/@43.935748,-76.100345,16z",,$400,power, (Sackets harbor),6hp johnson,https://watertown.craigslist.org/boa/5895188561.html,
6,,"['44.328300', '-75.465100']",2016-12-19 10:30,"1968 Starcraft aluminum, 16 ft. Open bow.40 horse evinrude engine.comes with trailer.Runs well.",,5907819352,44.328300,16,-75.465100,,"https://maps.google.com/maps/preview/@44.328300,-75.465100,16z",,$600,power, (Gouverneur),16ft. Boat (price reduced),https://watertown.craigslist.org/boa/5907819352.html,
7,good,"['44.315233', '-75.919005']",2016-12-19 09:31,"1994 Cruisers Inc. Rogue 2670 beam 9 1/2 feet wide, Bravo three drive with 454 cu. in. big block great on fuel with this drive Bravo III. Aft. cabin is large, stand up bathroom and shower, full camper canvas, Windlass anchor ( automatic anchor ) Buy now and I will pull out and store it for free!",800,5925292458,44.315233,28,-75.919005,Cruisers inc.,"https://maps.google.com/maps/preview/@44.315233,-75.919005,16z",2670 Rogue,$14500,power, (Alexanadria bay),Nice Cruisers inc. Rogue 2670 Bravo Three Drive,https://watertown.craigslist.org/boa/5925292458.html,1994
8,,"['44.747200', '-74.999200']",2016-12-19 09:16,1984 starcraft boat.trailer for sale boat has a 90hp evenrude and it runs good. recently purchased a pontoon boat and do not use this one need to make some room.,,5925274717,44.747200,18,-74.999200,starcraft,"https://maps.google.com/maps/preview/@44.747200,-74.999200,16z",,$1500,power, (NORWOOD),1984 starcraft boat,https://watertown.craigslist.org/boa/5925274717.html,1984
9,good,"['43.462514', '-76.514733']",2016-12-19 07:59,1967 Penn Yann. 17' fiberglass. Inboard/outboard OMC GM 6 cylinder 155hp. 700 hours on it. No tears in the seats and floor is solid. Has radio and depth finder. Comes with a 1967 Tee Nee trailer. Model 1700. The sale of this boat helps to support our non-profit organization. Don't like our price? Make us an offer.,700,5925207043,43.462514,17,-76.514733,,"https://maps.google.com/maps/preview/@43.462514,-76.514733,16z",,$1500,power," (Oswego, NY)",1967 Penn Yann,https://watertown.craigslist.org/boa/5925207043.html,
10,new,"['44.211300', '-75.801400']",2016-12-19 04:49,"2016 Lund Tyee 1900 for sale.  Bought new from dealer in June 2016, but unfortunately due to being unable to use it and military obligations it is now going up for sale.  150HP Mercury outboard with SeaStar hydraulic steering.  Several upgrades were added to boat due to planning on owning this boat for a very long time no expenses were spared.  Pilots chair upgrade ($565), Extra Pro-Ride Seat and pedestal, front bow cushions make total seating comfortable for up to 8 adults.  In floor rod storage for 10 rods up to 8 feet long.  Ski pole added for tubing and skiing ($295). Poleless travel cover ($1200) that is very easy to remove and install by yourself.  Very nice linked electronics package also added with no expenses spared.  Humminbird Onix 10 CI SI ($3100) for side scan, down scan, and chart plotter capabilities.  It is also NMEA 2K compatible with additional backbone to monitor engine functions on the chart plotter.  This is the touch screen unit that is mounted on an adjustable RAM mount.  Also has Navionics Plus for US and Canada updated with the latest maps.  Minn Kota Ulterra 80LB with IPilot Link ($2100) mounted on a quick release ($120) for ease of removal.  Will pull the boat at almost 3MPH on calm water!  Standard Horizonz VHF radio with 8 foot Shakespear fiberglass antenna that is GPS linked to Chart Plotter for current position distress call (will need to be reset as it has my FCC information currently loaded).  Minn Kota Precision 3 bank charger.  This boat is ready for walleye fishing on Lake Ontario with a smooth ride even is rough water!  I really hate to have to give it up, but it will make someone a great ready to fish boat.  All Coast Guard required equipment is installed along with bumpers and dock lines and anchor.  Also included is a tandem axle ShoreLandr trailer with spare tire and disk brakes and full LED lighting. Almost $57K invested, asking $49000 OBO.  First service has been completed and currently shrink wrapped for winter.",19,5925134843,44.211300,19,-75.801400,Lund,"https://maps.google.com/maps/preview/@44.211300,-75.801400,16z",Tyee 1900,$49000,power, (Theresa),2016 Lund Tyee 1900 -REDUCED,https://watertown.craigslist.org/boa/5925134843.html,2016
11,,,2016-12-18 19:39,In great shape for the year need some TLC on the inside mechanically it's sound it has twin 327 crusaders dual station it is has been wrapped call show contact info,,5924829029,,30,,,,,,power,,Pacemaker,https://watertown.craigslist.org/boa/5924829029.html,
12,excellent,"['43.608532', '-73.278318']",2016-12-18 12:05,"2 Honda Four stroke outboard 225 HP 2003 04 regular and counter rotation 30"" lower unit; for sale, 687/ 867 hours. If you buy one you will purchase the 2004 regular rotation for $3900 It is on the boat, can be viewed and run. . Serious inquiry please. No text/ Call two two 8 8 3 one 3 four five five.in Addison, Vermont.",647,5896381324,43.608532,30,-73.278318,Honda,"https://maps.google.com/maps/preview/@43.608532,-73.278318,16z",225,$3900,power, (Benson),Honda 225 outboard 2004,https://watertown.craigslist.org/boa/5896381324.html,2004
13,good,"['43.707396', '-75.207686']",2016-12-18 09:55,"Have a 1990 cheetah boat, 18 foot, shorelander trailer, new tires, mercruiser 3.0 liter motor, nice shape, radio, has covers, sun tarp, possible trades,needs to go asap, all reasonable offers considered",,5918707547,43.707396,18,-75.207686,,"https://maps.google.com/maps/preview/@43.707396,-75.207686,16z",,$3200,power, (Brantingham),1990 cheetah 18' boat,https://watertown.craigslist.org/boa/5918707547.html,
14,good,,2016-12-18 08:08,"28' long, 10' wide, has been re-powered with newer duo prop drive and a fuel injected 5.7 Volvo. runs good, newer upholstery on bridge, new canvass top, sleeps 6 with queen mid berth, needs minor tinkering and electronics, In storage now. serious replies only. health forces sale. need a boat with flatter decks, easier to move around on for older folks, will consider trade of a houseboat or a motorhome of equal value. no texts please will not answer. Thanks, Walt. note, price is $2000 under book. see nada guide",,5895806688,,28,,Bayliner,,Contessa,$7500,power," (Senaca Lake/Windsor,NY)",28' Bayliner Contessa poss. trade,https://watertown.craigslist.org/boa/5895806688.html,1986
15,good,,2016-12-17 09:08,"16ft. Bluefin aluminum.  6ft. 6in. Beam. High sides. 75hp. Evinrude with trim and tilt. Trailer with 13"" tires and bearing buddies and jack stand. New parts include throttle cable ignition switch lower unit oil deck carpet and trailer lights.. Boat registerd till 2018. $1700",,5896204389,,16,,Bluefin,,Fisherman,$1700,power, (Lafargeville),16ft.Bluefin motor trailer,https://watertown.craigslist.org/boa/5896204389.html,1982
16,good,"['44.235800', '-75.600500']",2016-12-16 17:39,my fiance is deciding to sell her jetski. it is a 96 kawasaki jetski. runs and drives great. just don't use much anymore. comes with a trailer. and has registration for jetski and trailer. was used on private lake for last 6 yrs but is ready to go anywhere. show contact info $1000 obo.,,5895783411,44.235800,8,-75.600500,,"https://maps.google.com/maps/preview/@44.235800,-75.600500,16z",,$1000,power, (Antwerp),96 kawasaki jetski,https://watertown.craigslist.org/boa/5895783411.html,1996
17,,,2016-12-16 11:49,"BOAT 1988 Starcraft 19' Bowrider 90hp Evinrude outboard And Trailer. Mail: ""Copy and paste the link provided into a new mail."" Won't receive your mail otherwise.",,5921765669,,19,,,,,$1400,power, (Three Mile Bay),BOAT 1988 Starcraft 19' Bowrider 90hp Evinrude outboard And Trailer.,https://watertown.craigslist.org/boa/5921765669.html,
18,good,"['44.074600', '-75.840700']",2016-12-16 11:24,"26 Foot Penn Yan Twin 318 Chrysler flying bridge. Late 1970's I think 1978 One Station above. Nice salon below. clean head. Bought last fall on stands, put boat on a 7000 lbs. Performer Trailer and moved to Alexandria Bay in hopes of using it to fish, BUT I found a boat for sale at the location where I am storing this boat that I liked much better and have been looking for some time. SO now I have it for sale. I have never had the boat in the water. The last owner was a charter captain with health issues and could not get up and down the FB anymore. I was told one engine is 4 years old the other 1 1/2.  said they both ran very well.  under the deck is very clean and engines look great. oil clean. Boat all in all looked good. I have three Penn Yan's down south and know what to look for. deck lids are soft but all the Penn's get like that. simple 1/2 day fix. Call me for more info. Trailer included in deal. I am bad at email......CALL IF INTERESTED",318,5880656402,44.074600,26,-75.840700,Penn Yan,"https://maps.google.com/maps/preview/@44.074600,-75.840700,16z",26,$6000,power, (Alexandria Bay),26 Penn Yan Boat Twin Screw,https://watertown.craigslist.org/boa/5880656402.html,
19,,,2016-12-15 21:42,Looking to trade our boat seeing what's out there. We don't use it much anymore p,,5904499285,,11,,,,,$1400,power, (Looking to trade),Boat for trade,https://watertown.craigslist.org/boa/5904499285.html,
20,new,,2016-12-15 13:24,"12 footer Eagle field and stream fishing kayak, the kayak was only use for one summer season. never dropped or damaged. I'm also including ""force"" paddles, brand new kayak cart, seat/leg cushions, a large tackle box full of lures and lines plus other bait and gear, most of it never been used. Two fishing poles with lines, plus extra line. "" obriend"" x-large life saver, brand new "" Cascade 2-ply poly/ rubber b/f chest wader . Trying to sell ASAP, only contact with serious offer, may be able to deliver if not too far from my location. ivan show contact info",,5920591125,,12,,eagle,,field and stream,$650,human, (Sackets Harbor),12 Footer Eagle field and stream fishing kayak plus gear,https://watertown.craigslist.org/boa/5920591125.html,
21,salvage,,2016-12-13 17:02,"Fiberglass project outboard boat - no paperwork, no motor, no trailer, near Fishers Landing Laurel 17 foot, V-hull - white boat with blue bottom",,5918173601,,17,,various,,various,,power,,Free Boat!!!,https://watertown.craigslist.org/boa/5918173601.html,1960
22,,"['44.610268', '-75.173092']",2016-12-13 14:25,"Buying outboard motors for parts, we will pay cash for your parts motors. We also buy excess marine inventory.",,5877204828,44.610268,4,-75.173092,,"https://maps.google.com/maps/preview/@44.610268,-75.173092,16z",,,power,,Buying Parts Condition Outboard Motors,https://watertown.craigslist.org/boa/5877204828.html,
23,fair,"['43.936349', '-76.108131']",2016-12-13 12:20,"1972 Helms 28' Cabin Cruiser. Ready to sail! Comes with: - 8hp Sail Master Outboard w. Extended Shaft - Road ready trailer - Floatation Devices - Latter - 6 Bumpers - 2 sets of sails! - Rudder, Tiller, Etc. - Anchor - Porta-potty Boat is Ready to be sailed! MUST SELL FAST! Price negotiable. Please email with inquiries and for phone number. I am happy to schedule a visit.",,5900749280,43.936349,28,-76.108131,Helms,"https://maps.google.com/maps/preview/@43.936349,-76.108131,16z",,$3000,sail, (Sackets Harbor),28' Sailboat Cabin Cruiser. Ready to sail! With Outboard and Trailer!,https://watertown.craigslist.org/boa/5900749280.html,1972
24,excellent,,2016-12-12 18:00,"Minn Kota trolling moter, in good shape. Works well and comes with a smal transducer",,5916806452,,1,,Minn kota,,Big foot 2,$100,power,,Trolling moter,https://watertown.craigslist.org/boa/5916806452.html,
25,good,"['44.593000', '-75.420300']",2016-12-11 10:43,I have a beautifully restored 18' 1963 lone star holiday aluminum boat. Boat comes with a 1964 mercury 650 . Motor runs great. Bimini top. Mahogany floor. This boat is very light and trailers beautifully . Deep v hull is Perfect for the St. Lawrence . Easy one man launch . Includes load right trailer with new wheels. Also have original aluminum hard top for sale for 250.00 Serious inquiries only.,,5914763119,44.593000,18,-75.420300,Lone star,"https://maps.google.com/maps/preview/@44.593000,-75.420300,16z",Holiday,$2500,power, (Rensalear falls),lonestar holiday rare 1963 Aluminum,https://watertown.craigslist.org/boa/5914763119.html,1963
26,,"['43.974300', '-75.912200']",2016-12-10 11:35,I am looking for full canvas for penn yan 23ft sportsman Must be good to excellent condition,,5886106989,43.974300,23,-75.912200,,"https://maps.google.com/maps/preview/@43.974300,-75.912200,16z",,,power,,full canvas,https://watertown.craigslist.org/boa/5886106989.html,
27,fair,"['44.591690', '-75.643272']",2016-12-10 11:30,"This Renken 18 ft. I-O open bow, has a good hull and the Volvo-Penta 270 appears OK. However it needs the interior upholstry, seats, carpet and canvas redone. There is also a Magic Tilt Trailer included.The boat is free! if you take the trailer. Pay $500. (or any reasonable offer) for the Trailer, and take her home as a project for this winter.",,5913596622,44.591690,18,-75.643272,Renken,"https://maps.google.com/maps/preview/@44.591690,-75.643272,16z",,$500,power, (Morristown),83 Renken open bow 18 ft I-O,https://watertown.craigslist.org/boa/5913596622.html,
28,,"['43.974300', '-75.912200']",2016-12-10 11:16,I am looking for full canvas for penn yan 23ft sportsman Must be good to excellent condition,,5886129035,43.974300,23,-75.912200,,"https://maps.google.com/maps/preview/@43.974300,-75.912200,16z",,,power,,full canvas,https://watertown.craigslist.org/boa/5886129035.html,
29,excellent,,2016-12-10 08:49,"1999 Maxum 3700 SCR (O.A.L.39) Fresh water boat w/ close cooling system (never seen salt water) Twin 7.4Mercruser MPI w/ fresh tune-up/oil changes and water pumps Bridge Enclosure (new 2016) Battery Charger - Dual 10 amp GPS - Fixed Mount Chart plotter Radar Radar Arch Radio / 25 Watt VHF - Fixed Mount Stereo - AM/FM/CD w/ multi disc changer in cabin Stereo - AM/FM/CD on deck T.V. 19"" Color Ice Maker Microwave Oven Pressure Water System Range - Electric Refrigerator / Freezer 10 cu. ft. Water Heater - 6 Gallon 2ea. Air Conditioning / Heating System Batteries - Dual w/Switch Flooring - Snap In/Out Carpet Fresh Water Cooling System Fuel Injection Generator / 6.5 KW - Gas w/ fresh tune-up/oil change Spotlight - Remote Control Trim Tabs / Hydraulic Windlass Asking $68,9500.00 Or Best Offer PHONE CALLS ONLY!  I WILL NOT ANSWER SPAM TEXTS! NO THIRD PARTIES I WILL REMOVE POST WHEN SOLD !!! NO PAY PAL! IN PERSON SALES ONLY!",1018,5890501225,,39,,Maxum,,3700 SCR,$68950,power," (buffalo,ny)",1999 Maxum 3700 SCR,https://watertown.craigslist.org/boa/5890501225.html,
30,,,2016-12-08 18:51,"Project boat - sold as is - needs total rebuild Early seventies vintage Vampire raceboat - sold as boat and trailer - no motor Trailer is rough No paperwork - will provide a bill of sale IIRC, they built 3 or 4 of these tunnel hulls. They were regarded as good marathon boats because they were built heavy - not as competitive on a short course.",,5911452167,,17,,Vampire,,,$1000,power,,Vampire Tunnel Hull Raceboat,https://watertown.craigslist.org/boa/5911452167.html,
31,,,2016-12-08 18:29,"GW Invader 10 foot speedboat Project boat - needs transom, floor, seats, etc. As is No paperwork available - will provide a bill of sale If you know what these boats are, you know what this boat is",,5911435886,,10,,GW Invader,,,$400,power,,GW Invader 10 foot Speedboat,https://watertown.craigslist.org/boa/5911435886.html,
32,fair,,2016-12-08 18:28,"GW Invader 10 foot speedboat Project boat - needs transom, floor, seats, etc. As is No paperwork available - will provide a bill of sale If you know what these boats are, you know what this boat is",,5911432897,,10,,GW Invader,,,$400,power,,GW Invader 10 foot speedboat,https://watertown.craigslist.org/boa/5911432897.html,
33,,"['43.087800', '-75.760200']",2016-12-07 23:02,"2005	17' Center Console Triumph Composite Propylene Hull-50hp Yamaha 4 Stroke EFI-Triumph Trailer-Bow Mount Trolling Motor-Bimini Top-Down Riggers-NEW GPS Fish Finder. . .	$8,550 2009	16' Key Largo Fiberglass Center Console-70hp Johnson O/B Motor PTT-Trailer-Fish Finder-Bimini Top. . .	$6,550 2002	18' Capecraft Fiberglass Center Console-70hp Erude O/B MotorPTT-Trailer-Bimini Top. . .	$3,500 2002	18' Capecraft Fiberglass Center Console-NO Motor-Trailer-Bimini Top. . .	$3,000 2002	18' Capecraft Fiberglass Center Console-NO Motor-Trailer-Bimini Top. . .	$3,250 1990	175 Hydro Sport CC-90hp Mercury-Trailer-Helm Captians Chairs-Fish Finder-Livewell	$4,950 ***BY APPOINTMENT ONLY*** PLEASE Contact (3-one-5) 4-one-5 5-TWO-6-8...for pricing or details - THANKS!!!. . .SERIOUS BUYERS ONLY---NO SOLICITATION OR NO CONSIGNERS---NO TRADES---NO LOW BALL OFFERS--NO TIRE KICKERS. . . NOTE: Due to ALL the SCAMMERS-FLAGGERS-SPAMMERS on this site you should PRINT-COPY-SAVE or EMAIL this post to yourself or a friend, IF interested. . .NO PHONE NUMBER IN RESPONSE IT WILL BE DELETED. . .!!!",,5910265773,43.087800,16,-75.760200,,"https://maps.google.com/maps/preview/@43.087800,-75.760200,16z",,,power,,SEVERAL 16'-17'18' Center Console Boats to choose from...,https://watertown.craigslist.org/boa/5910265773.html,
34,,"['43.846700', '-76.235200']",2016-12-07 19:20,"easy troller trolling plate for 30-45 horse power motor,bought a bigger boat, show contact info 100.00 firm",,5872852482,43.846700,15,-76.235200,,"https://maps.google.com/maps/preview/@43.846700,-76.235200,16z",,$100,power, (henderson),easy troller,https://watertown.craigslist.org/boa/5872852482.html,
35,,,2016-12-07 06:48,boat & trailer all in good condition has 120 omc and outdrive for parts I have no paper work call or text show contact info,,5879758922,,17,,,,,$450,power, (chippewa bay),17ft cobia boat and trailer for parts,https://watertown.craigslist.org/boa/5879758922.html,
36,good,"['43.499108', '-76.385880']",2016-12-06 17:59,2012-  800lb Bunk Trailer with winch and drop down jack.  Like new.  Only 80 road miles on it... $450 NO BOAT...just trailer,,5882231173,43.499108,14,-76.385880,,"https://maps.google.com/maps/preview/@43.499108,-76.385880,16z",,$450,human, (SCRIBA/OSWEGO),BUNK TRAILER,https://watertown.craigslist.org/boa/5882231173.html,
37,good,"['43.966751', '-76.264687']",2016-12-06 17:58,Steel boat lift. Holds approximately 1500 lbs. 7.5' x 10'. $550,,5882235753,43.966751,10,-76.264687,,"https://maps.google.com/maps/preview/@43.966751,-76.264687,16z",,$550,human, (Pt Peninsula/Three Mile Bay),STEEL BOAT LIFT,https://watertown.craigslist.org/boa/5882235753.html,
38,new,"['42.809100', '-73.869300']",2016-12-06 16:22,THIS IS A 1969 MERC 1000 100 HORSE POWER OUTBOARD ENGINE IN EXCELLANT SHAPE! IT HAS ALWAYS BEEN SERVICED AND HAS NEVER HAD ANY DAMAGE. UNIT COMES WITH CONTROLS AND GAS CANS. PICTURES AVAILABLE UPON REQUEST.,,5908350914,42.809100,6,-73.869300,,"https://maps.google.com/maps/preview/@42.809100,-73.869300,16z",,$2200,power, (Niskayuna NY),MERCURY 1000 OUTBOARD ENGINE,https://watertown.craigslist.org/boa/5908350914.html,
39,,"['44.124400', '-76.316400']",2016-12-05 21:14,"I have a 4,500 lbs boat hoist that I bought used from the original owner.  He did not have the book on it so I am unaware of the year of it.  Cable is in great condition.  Has guide rails and canopy top.  Canopy is in good condition.  I have not used the top or canopy since buying the lift to keep the weight lighter when moving in and out.  This is not a vertical lift.  I am selling it because I want a bigger boat, therefore need a higher capacity hoist.  Thanks",,5878166662,44.124400,10,-76.316400,,"https://maps.google.com/maps/preview/@44.124400,-76.316400,16z",,$4000,power, (Cape Vincent),Shore master 4500lbs hoist,https://watertown.craigslist.org/boa/5878166662.html,
40,,"['44.144200', '-76.062000']",2016-12-05 20:15,I have a House boat it floats and it has a nice deck on it $1500 thank you for looking,,5864062318,44.144200,040,-76.062000,,"https://maps.google.com/maps/preview/@44.144200,-76.062000,16z",,$1500,power,,House boat,https://watertown.craigslist.org/boa/5864062318.html,
41,excellent,,2016-12-05 15:44,1987 four winds 21ft with trailer excellent shape complete must see boat is in gorgeous shape real eye-catcher new canvas also looking for a bigger boat 26 to 29 foot  783-0128  David for more pics call or text me boat runs like new. New seats Turn-Key operations mint shape Christmas special must sell found new boat,500,5906771511,,21,,Four winns,,,$5000,power, (Watertown),87 four winds. Mint,https://watertown.craigslist.org/boa/5906771511.html,1987
