,condition,coord_pair,date,description,engine hours (total),id,lat,length overall (LOA),long,make / manufacturer,map_URL,model name / number,price,propulsion type,region,title,url,year manufactured
42,excellent,[],2016-12-05 14:49,"Originally asked $9500 - REDUCED to $5500 or Trade for 15'-18' Bass Boat. MUST GO : 1988 20 Ft. Bayliner Trophy center console boat, 4 seater with trailer in excellent condition. Includes 125 HP Mercury motor, 7.5 HP Mercury trolling motor, Minn Kota Power Drive 55 lb thrust, 2 new batteries, marine ship to shore radio, fish finder, rod holders, Bimini Top, center console cover, cover for 125 HP Merc. and a full winter Storage cover. Boat has been winterized and covered all winter. Clean title and registered until 2017. Selling because of health issues - 100% Disabled Veteran - Can no longer handle this boat alone. $5500 or will consider TRADE FOR SMALLER BASS BOAT in good condition. Will also consider trade for pontoon boat in good condition.",,5906678072,,20,,Bayliner,https://maps.google.com/?q=loc%3A+%31%37%35%33%32+County+Rte+%37%35+Sackets+Harbor+NY+US,Trophy Center Console,$5500,power, (Sackets Harbor),TRADE FOR SMALLER BASS BOAT or,https://watertown.craigslist.org/boa/5906678072.html,1988
43,,,2016-12-05 14:11,I have a pretty decent stratos bass boat only needs a battery n the on board charger replaced has rod lockers n gear holders has new Johnson 150 on back looking for a 4 seater ranger or rzr side by side let me know what you have really looking for a sled,,5867160554,,17,,,,,,power,,17ft stratos,https://watertown.craigslist.org/boa/5867160554.html,
44,good,,2016-12-05 12:48,"Here is a real nice 2009 angler 204FX with a 140 hp Suzuki for stroke outboard. It has the Larance HDS seven side scan sonar and GPS/fishfinder. It handles the water well. I also have put on 2 Cannon  downrigger outlets and two cannon down Riggers. . This boat has very very low hours. T top, rocket launchers, and set up with the reels for pulling big planer boards. Has a bait well ,freshwater wash down ,dual on board battery charger all that I have added on.  It sits on a single axle galvanized tidewater trailer. Not that I have to sell this unit but I simply do not get it on the water enough to justify keeping it! Runs real quiet and easy on gas. Any questions please contact me. Has a spare tire. Asking $26,500 for the package !",,5865894462,,20,,Angler,,204FX,$26500,power, (1000 islands),2009 Angler 204FX,https://watertown.craigslist.org/boa/5865894462.html,2009
45,new,"['43.651700', '-76.126400']",2016-12-04 13:53,All aluminum canoe/kayak rack will hold 4 boats. New. If interested call show contact info will build to suit your requirements any size any configuration-we do welding repairs on any aluminum product trailers pontoon boats etc,,5905143519,43.651700,1,-76.126400,,"https://maps.google.com/maps/preview/@43.651700,-76.126400,16z",,$479,human," (Sandy Creek, NY)",Kayak Rack,https://watertown.craigslist.org/boa/5905143519.html,
46,,"['43.651700', '-76.126400']",2016-12-03 18:53,"Wheel Kit with adjustable screw leg. Heavy Duty adjustable screw legs1600 lb capacity, Poly Wheels with center hub. Wheels shown will raise the boat lift 26"". Much better quality than the smart wheels. Wheels are 24"" diameter. Fits most Boat Lifts. The wheel kit makes it much easier to install and remove lift. Set includes 2 wheels, 2 brackets and hardware for mounting. If interested call. Thank you.",,5904286738,43.651700,30,-76.126400,,"https://maps.google.com/maps/preview/@43.651700,-76.126400,16z",,$469,human," (Sandy Creek, NY)",Wheel Kit with Adjustable Screw Leg,https://watertown.craigslist.org/boa/5904286738.html,
47,,[],2016-12-03 13:28,"16' aluminum smokercraft, no title. Has a nice running 80hp mercury outboard. Will sell motor and controls for $1000.  Could easily be installed on another boat and hull could be scrapped or find another boat with title and recycle title to this boat.",,5903814940,,16,,,https://maps.google.com/?q=loc%3A+%31%34%38%32%38+county+route+Clayton+NY+US,,$1500,power, (Clayton),Aluminum boat/ 80hp mercury,https://watertown.craigslist.org/boa/5903814940.html,
48,,"['43.935748', '-76.100345']",2016-12-03 07:52,6hp Johnson great runner use it often. $400 show contact info,,5888597970,43.935748,1,-76.100345,,"https://maps.google.com/maps/preview/@43.935748,-76.100345,16z",,$400,power, (Sackets harbor),6hp johnson,https://watertown.craigslist.org/boa/5888597970.html,
49,like new,,2016-12-03 02:53,"""BUILT FOR ALL WEATHER COMFORT AND YEAR ROUND USE IN ANY AREA!!"" The words that best describe what the Parker Sport Cabin is all about. It is truly the gentlemen's classic with superior history in performance. Equipped with a cabin heater/blower, brand new MerCruiser 7.4 Litre Bravo motor with 0 hours, Large Pilot House with 6'4"" headroom with more than ample storage, Garmin GPSMAP 220, Furuno marine radar model 1721 Mark-2, Horizon DS40 digital depth reader, Guest model 22200 toggle switch controlled spotlight, twin v-berths and a portable marine toilet ALL in EXCELLENT condition. This is, THE boat for leisure/sport. Must see! $25,000 O.B.O.... Six1zero 9six zero six5 nine5 Engine(s):   MerCruiser 7.4 litre Bravo Length: 25'4"" Beam: 9'6"" Draft: 12"" Fuel Capacity: 126 gallons Waste Capacity: 5 gallons Sleep Capacity: two Displacement: 3750 lbs.",0,5860619447,,25,,Parker,,Sport Cabin,$25000,power," (Alexandria Bay, NY)",92 Parker sport cabin,https://watertown.craigslist.org/boa/5860619447.html,1992
50,excellent,"['43.651700', '-76.126400']",2016-12-02 15:21,"Engine:Twin Mercury 454, Sea Star Hydraulic Steering, Westerbeke Generator 7K, Windlass with 200' Chain, Garmin Chart Plotter/Depth Finder,Garmin Radar and Auto Pilot, Halon System, VHF Radio, Compass, Power Windshield Vent, Power Spotlight, Floor lifts hydraulically to access engine compartment,Stereo and Amplifier with remote control at helm, Docking Fenders, Flag at Stern, Sink and Refrigerator in Cockpit Area and Storable Table, Large Swim Platform with snap in marine carpet, and Marine carpet throughout cockpit and helm areas, Deck Lounge with pads,Transom Shower, Bimini Top, Cockpit Cover and Full Canvas, Cherry Interior, Galley is equipped with Refrigerator/Freezer, Corian Counters throughout, 3 Burner Stove, Microwave Oven,Sink with sprayer, Plenty of Cabinets and Storage, Carpeted throughout with Snap In Carpet Protector, Height Adjustable Salon Table, Large Power Couch in Salon that converts into a bed with the push of a button, Large King Bed in Master Stateroom with New(2016) Custom Latex Mattress, Bunk Beds in Second Stateroom with privacy door, Roomy Head, large shower with built in seat, Vac-U-Flush Head and Sink, 2 AC/Heat Systems, 2 TVs, Central Vac System with Attachments. This boat has been kept inside a covered boathouse, no sun or rain damage to topside gel finish. Routine maintenance always kept current, All systems are in proper working order. Pristine condition.Motivated seller",541,5896701937,43.651700,456,-76.126400,Searay,"https://maps.google.com/maps/preview/@43.651700,-76.126400,16z",Express Cruiser,$119900,power," (Sandy Creek,NY)",2000 Searay 410 Express Cruiser,https://watertown.craigslist.org/boa/5896701937.html,2000
51,,"['43.651700', '-76.126400']",2016-12-02 15:18,"Extreme Max 12 Volt - 110 volt Boat Lift Winch. Mounting Kits for RGC, Shoremaster, Hewitt, Shore Station lifts are $120. Fits All Lifts - Easy Install - New in Box.",,5896719347,43.651700,0,-76.126400,,"https://maps.google.com/maps/preview/@43.651700,-76.126400,16z",,$725,power," (Sandy Creek,NY)",Boat Lift Drive Units,https://watertown.craigslist.org/boa/5896719347.html,
52,,"['43.651700', '-76.126400']",2016-12-02 15:15,Used  RGC Aluminum PWC Lift 48 inch lift height... Excellent condition new carpeting on bunks.All stainless hardware. Articulated pad feet ..legs 18 inches long..for easier install and removal. If interested contact Bob..,,5896786079,43.651700,1,-76.126400,,"https://maps.google.com/maps/preview/@43.651700,-76.126400,16z",,$850,human," (Sandy Creek,NY)",800 lb. Cantilever PWC Lift,https://watertown.craigslist.org/boa/5896786079.html,
53,,,2016-12-02 15:15,4' x 20' Steel Dock with Wheels. Decking not included sold seperately. If interested call show contact info must go-best offer..!,,5896791365,,20,,,,,$750,human," (Sandy Creek, NY)",HD Steel Dock,https://watertown.craigslist.org/boa/5896791365.html,
54,,"['44.006900', '-76.065000']",2016-12-02 11:10,"Heavy duty steel docks built to your specifications. Any size, shape or length.  All docks include a 5 year warranty on all welds.   Optional delivery and installation available if needed.   We paint all our docks with top grade bed liner for years of protection.  Different styles of decking are available.  Also offering custom made extensions for your existing docks.  I also make rail systems and rail extentions to add onto your existing rail systems.  Great pricing, free estimates.  Please call Jon for more information. Thanks Jon 315-48six-88four2",,5902138575,44.006900,30,-76.065000,,"https://maps.google.com/maps/preview/@44.006900,-76.065000,16z",,,human,,custom made docks,https://watertown.craigslist.org/boa/5902138575.html,
55,,"['44.006900', '-76.065000']",2016-12-02 11:09,"Heavy duty steel docks built to your specifications. Any size, shape or length.  All docks include a 5 year warranty on all welds.   Optional delivery and installation available if needed.   We paint all our docks with top grade bed liner for years of protection.  Different styles of decking are available.  Also offering custom made extensions for your existing docks.  I also make rail systems and rail extentions to add onto your existing rail systems.  Great pricing, free estimates.  Please call Jon for more information. Thanks Jon 315-48six-88four2",,5902136890,44.006900,30,-76.065000,,"https://maps.google.com/maps/preview/@44.006900,-76.065000,16z",,,human,,custom made docks,https://watertown.craigslist.org/boa/5902136890.html,
56,like new,"['43.974300', '-75.912200']",2016-12-02 08:56,"Beautiful wood canvas canoe , 16' long, Canadian built early 1950's excellent shape ready to paddle or display, $1600.00",,5901950638,43.974300,16,-75.912200,Canadian,"https://maps.google.com/maps/preview/@43.974300,-75.912200,16z",,$1600,human, (Watertown),Wood Canvas canoe,https://watertown.craigslist.org/boa/5901950638.html,1950
57,good,[],2016-11-30 20:08,"Fresh water Motor just removed from a Pontoon boat that one of our customers owns and is re powering with a Yamaha 4/stroke. The Model # is E60TLCEA and the serial number is G02843721. Motor includes the control box and cables and is priced to sell for $1,095.00. Call the Clayton Marina and ask for Darin or Dennis.",,5865059644,,20,,Evinrude,https://maps.google.com/?q=loc%3A+%35%30+State+St+Clayton+NY+US,E60TLCEA,$1095,power, (Clayton NY),1989 Evinrude 60 HP VRO outboard,https://watertown.craigslist.org/bod/5865059644.html,1989
58,good,[],2016-11-30 20:08,"2003 Yamaha F50TLRB 4/stroke 20 inch shaft length carbureted with a brand new complete lower unit and priced to sell for $2,700.00. No controls cables harness gauges or key switch included. Call Dennis or Darin at the Clayton Marina Sales & Service Inc.",,5865059054,,20,,Yamaha,https://maps.google.com/?q=loc%3A+%35%30+State+St+Clayton+NY+US,F50TLRB,$2700,power, (Clayton),2003 Yamaha F50TLRB 4/stroke,https://watertown.craigslist.org/bod/5865059054.html,2003
59,,"['44.144200', '-76.062000']",2016-11-30 19:06,"1981 Proline center console with a Mercury 115. Engine had a full tune up this summer & many new parts & ready to go! Single axle trailer included. Cushions & seats all in great shape. Two brand new batteries, new lines & fenders included!  Overall, boat is in excellent condition for its age, great buy!  Looking to get this boat sold! Inquire by email.",,5855496474,44.144200,20,-76.062000,,"https://maps.google.com/maps/preview/@44.144200,-76.062000,16z",,$3000,power,,1981 Proline 20' center console,https://watertown.craigslist.org/boa/5855496474.html,
60,new,,2016-11-30 11:14,For Sale Grumman 16 ft Canoe Aluminum (Super Light) and  life jackets ete $475.00 OBO or trade Call Me at My Cell Phone show contact info no email no texts please only calling ONLY EXCEPT CASH OR LOCAL AREA CASHIERS CHECKS ANYTHING ELSE DONT BOTHER WAISTING OUR TIME!!!,,5868619838,,16,,,,,$495,human, (Watertown NY),Grumman 16 ft Canoe Aluminum,https://watertown.craigslist.org/boa/5868619838.html,
61,excellent,"['44.328637', '-75.942993']",2016-11-30 10:14,"Antique Thompson Brothers  14 foot TVT Lake model boat built in Cortland N,Y; Compressed seam hull; 5 Ft cedar deck; Includes 1957 5 1/2 hp Johnson motor with pressure tank.",,5899043148,44.328637,14,-75.942993,Thompson Brothers,"https://maps.google.com/maps/preview/@44.328637,-75.942993,16z",TVT lake,$1200,power, (Wellesley Island),Thompson Brothers TVT Lake model,https://watertown.craigslist.org/boa/5899043148.html,1939
62,excellent,"['42.077100', '-76.011800']",2016-11-30 09:55,"14 ft deep V Starcraft with nice wooden floor, two bench seats loots of room in the middle. Boat is in great shape new transom. Trailer is a good teailer brand new LED lights. I do have a motor but it come at a separate price 2013 evenrude Ask for pics I'll text them. $1500 Cash buyers only. show contact info",,5899013836,42.077100,14,-76.011800,Starcraft,"https://maps.google.com/maps/preview/@42.077100,-76.011800,16z",,$1500,human,,14 ft deep V Starcraft I'll text pics,https://watertown.craigslist.org/boa/5899013836.html,
63,new,[],2016-11-30 09:10,"C AND S TRUCK IS NOW A HUSTLER AND CHECKMATE POWERBOAT DEALER AND HAVE IN STOCK A 2017 HUSTLER MID CABIN OPEN BOW WITH A 540 MERCURY RACING ENGINE,BRAVO ITS DRIVE,FLY BY WIRE CONTROLS (NO CABLES),GARMIN GPS WITH INTEGRATED MECURY SMARTCRAFT,LIVORSI CONTROLS AND GAUGES,CARBON FIBER DASH,SONY BLUETOOTH STEREO WITH JL600 WATT AMP. PORTA POTTI,REFRIGERATOR,SS CLEATS,THRU HULL EXHAUST,AUTO FIRE EXTINGUISHING SYS.,CARBON FIBER DASH,SNAP OUT CARPET,WATER PSI GUAGE,FRESH WATER FLUSH,INTERIOR MOOD LIGHTING,COCKPIT COVER,FULL COVER,HAS RACEBOAT CONSTRUCTION WITH HAND LAY UP FIBERGLASS HULL, KEVLAR RESINS............. WWW.CSTRUCKSHOPPE.COM",6,5854865518,,29,,HUSTLER,https://maps.google.com/?q=loc%3A+%37+Ferry+Street+Nanticoke+NY+US,ROCKET 29',,power,,2017 HUSTLER ROCKET 29' MC,https://watertown.craigslist.org/bod/5854865518.html,2017
64,fair,,2016-11-29 21:43,Looking for a cheap outboard in the 60-90hp range. Minor repairs ok as long as compression checks out. Call txt or email,,5898564948,,20,,,,,$1,power, (Carthage),Wanted 60-90hp outboard,https://watertown.craigslist.org/boa/5898564948.html,
65,new,,2016-11-29 17:10,"2017 HUSTLER 29 ROCKIT MC HIGH PERFORMANCE IN ALEXANDRIA BAY, NEW YORK STOCK #117321 Hustler boats have been a leading force in the high-performance boats since 1979. The 2017 Hustler 29 Rocket MC is a boat like you never seen before. In her class, the 29 Rockit MC has the largest cockpit. Taking a ride on this beautiful boat , you will never want to ride in another boat again. She comes equipped with everything you need to have fun with friends and family on the open water. She provides plenty of power with a mercury 540. This vessel comes equipped with: - Garmin 7' touch screen - Snap in carpet - Dash mounted stereo remote - Cabin interior lights - DC panel - Windscreen - Rub Rail - one year hull warranty which is transferable - 2 year Mercruiser Drive Line warranty - new integrated ITS steering system and fly-by-wire controls, no cables And much more, She will not last long!!!! Bring offers INFORMATION ON CONDITION This vessel is Bristol condition. There are no condition issues at all. This is a brand new boat at a price that you cannot beat. All the information was provided directly by the seller and I believe it to be true and accurate",6,5881468666,,29,,HUSTLER,,29 ROCKIT MC,$215000,power,,2017 HUSTLER 29 ROCKIT MC,https://watertown.craigslist.org/bod/5881468666.html,2017
66,good,,2016-11-29 12:18,"Duracraft 14 foot aluminum decked runabout Mid- 1950s Five foot beam Metal is in great condition Needs transom (wood) Needs refinishing, clean-up, detailing, etc Sold as is No trailer, no motor No paperwork Located near Fishers Landing, NY",,5897670401,,14,,Duracraft,,,$400,power,,Classic Aluminum Runabout,https://watertown.craigslist.org/boa/5897670401.html,
67,fair,,2016-11-28 18:55,"19 ft. water tight, runs well, new cover, 4 cyl volvo, marine radio,safety gear,brier hill.$2900.00",,5896738049,,19,,bayliner,,cuddy,$2750,power, (brier hill),1986 bayliner,https://watertown.craigslist.org/boa/5896738049.html,
68,good,"['44.084800', '-76.123200']",2016-11-28 14:38,"Beautiful 1963 all teak Wirth Munroe off shore 30. Decks, interior  and planks are all teak. Fresh bottom paint this year In the water currently being sailed and lived on part time. Decks were resealed last season, large seams below waterline were recaulked  and had new seam compound added this season before launch. Interior is very comfortable 6'6"" standing head room all new cushions Electric windless All hardware is original and bronze opening ports and solid bronze stanchions. Would polish right up but I prefer to keep the patina Boat has an almost new westerbeke 35b deisel auxiliary Less than 100 hours, starts right up and rust great. Motor was $9000 in 1999 and I have  all of the original paperwork from the install, receipts, owner's manuals and parts books. Stands are included New main sail Original main sail New 100 head sail New 160 head sail Original head sail spinnaker Self tending jib with track Boat need some paint in places inside and out and a few fixes but would be breath taking when finished. $4000 OBO Will sell for less without auxiliary Make offer Call or text Trades of equal value welcome",99,5896246536,44.084800,30,-76.123200,,"https://maps.google.com/maps/preview/@44.084800,-76.123200,16z",off shore 30,$4500,sail, (chaumont bay),Off shore 30' Teak Sloop TRADE,https://watertown.craigslist.org/boa/5896246536.html,1963
69,good,,2016-11-28 13:03,Carp boat for sale. This boat is set up for success three marine batteries to run. A trolling motor and 8 led lights on the front stand a mercury on the back that has always ran great always put etonol free gas through it. The three batteries I rigged with a top of the line marine charger so all you have to do is get home from fishing and plug it in with a extension cord. Feel free to shoot a Tex 7838887 some extra s with the boat for the right price,,5896104844,,16,,tryhull,,not sure,$2500,power, (Mexico ny),carp boat,https://watertown.craigslist.org/boa/5896104844.html,1990
70,,,2016-11-28 12:28,"Johnson 15HP Short shaft tiller with tank. Just ran it last weekend, I'd be happy to test it for you. Newer coil, new plugs. I ran it on my 1654 duck boat and it pushed it great!! priced for fast sale. These motors bring good money, they are simple, easy and inexpensive compared to new.",,5854513597,,1,,,,,$450,power, (Glenfield),Attention Duck Hunters and fishermen 15 hp Johnson short tiller,https://watertown.craigslist.org/boa/5854513597.html,
71,,[],2016-11-28 10:58,2013 CHAPARRAL 31' CABIN CRUISER WITH TWIN MERCRUISER 5.0L ENGINES. BOAT IS FULLY LOADED WITH VERY LOW HOURS. PLEASE CALL GARY @ show contact info,,5867247274,,31,,,https://maps.google.com/?q=loc%3A+%35%33%36%34+E+LAKE+RD+CONESUS+NY+US,,$139995,power, (CONESUS/FINGER LAKES),2013 CHAPARRAL 310 SIGNATURE,https://watertown.craigslist.org/bod/5867247274.html,
72,,,2016-11-28 01:11,"i am selling this boat cheap it has set along time since 2011 but if u r good with tools u can get it running again,,it have nice,,,,trailer E,Z Loader just the traler is worth 500,call me show contact info i have no time for it i hope to sell it and someone fix it,,or Parts is up to u",,5895439634,,18,,,,,$250,power, (watertown ny),1987 Cobia 130 hp,https://watertown.craigslist.org/boa/5895439634.html,
73,new,,2016-11-28 00:27,"WHOLESALE PRICES NEW 2017 aluminum boat trailers custom made to your boat . BUILT IN JUST 3 HRS. TRAILERS WILL BE SET UP TO YOUR BOAT WO ANY WORK FROM YOU. AXLES ARE POSITIONED TO THE CENTER GRAVITY OF YOUR BOAT. WE BEND THE I-BEAMS ACCORDINGLY AND CUT THE BUNKS TO THE RIGHT ANGLES. JUST NEED MAKE MODEL YEAR O RUST PROOF!!!!!! EACH TRAILER GETS FREE GIDE POLES WITH IT DEPENDING ON THE GVW price varies FROM 2800 GVW TO 24000 GVW The lowest prices ever bc I am in the factory selling straight to you. SINGLE AXLES TANDEM AXLES TRI AXLES QUAD AXLES GOOSNECK OPTIONS ON ALL TRAILERS Our standard trailer is the competitions upgrades... WE ARE THE TRI AXLE HEADQUARTERS UP TO 50 FT LED lights torsion axles 2 speed winch stainless hardware 3 year warranty roadside assistance walk on fenders No middle man we are factory!!! Make your self feel good and get a new o Catamaran trailers call So many cool options Salt water brakes, electric brakes, hydro brakes all Kodiak disc MAG WHEELS 10 to choose from 35 YEARS BUILDING FOR MORE INFO AND PRICING CALL OR TEXT DAVID NOW TRI AXLE BOAT TRAILER  TANDEM TRAILER DUAL AXLE  SINGLE AXLE  BOAT",,5891194238,,45,,,,,,human,,WHOLESALE TRI AXLE BOAT  TRAILERS,https://watertown.craigslist.org/bod/5891194238.html,
74,,"['43.935748', '-76.100345']",2016-11-27 20:17,6hp Johnson great runner use it often. $400 show contact info,,5880365531,43.935748,1,-76.100345,,"https://maps.google.com/maps/preview/@43.935748,-76.100345,16z",,$400,power, (Sackets harbor),6hp johnson,https://watertown.craigslist.org/boa/5880365531.html,
75,,"['44.063000', '-75.503900']",2016-11-27 09:26,Hello I have a couple old boat motors in beautiful condition they are also both kinda rare the first one is a Sears and roebuck Ted Williams edition 5.5 HP air cooled motor the other one is a Chrysler 3.5 HP also an air cooled motor both need a little work but are complete and have good compression 250 obo,,5894260762,44.063000,1,-75.503900,,"https://maps.google.com/maps/preview/@44.063000,-75.503900,16z",,$250,power, (natural bridge),2 antique boat motors,https://watertown.craigslist.org/boa/5894260762.html,
76,,,2016-11-26 22:52,"Looking to buy an aluminum deep V boat between 16 and 18 feet. Looking for something 2000 and newer. Preferably outfitted for fishing. Looking for lund, sylvan, lowe, alumacraft, crestliner and G3. Show me what you have, worst i can say is no thank you.",,5893947024,,17,,,,,,power,,Want to buy a 16 to 18 foot aluminum deep V boat,https://watertown.craigslist.org/boa/5893947024.html,
77,,,2016-11-26 19:14,****Reduced**** DUCK BOAT 18 ft Alaskan Smoker Craft DEEP V bottom. 75hp Mercury. Aluminum custom welded duck blind w/heavy wall canvas that snaps on and off! Custom painted with shore pattern. Tons of storage for duck decoys in compartments along both sides. High side walls with canvas let's you hunt in all kinds of weather. Do not contact me to help me sell my boat! I am not interested in trading! Legit offers only! Call or text 315-408-49 eight four,,5858520425,,18,,Smoker Craft,,Alaskan,$6000,power, (Watertown ny),BOAT DUCK HUNTING,https://watertown.craigslist.org/boa/5858520425.html,
78,good,[],2016-11-26 19:13,"1981 Hunter H22 sailboat fully equipped. Honda 4 stroke outboard. Main sail, Genoa and 2 spinnakers. Sleeps 4. With tandem axle trailer.",,5857441116,,22,,HUNTER,https://maps.google.com/?q=loc%3A+%38%34%34+mill+st+watertown+NY+US,H22,$4000,sail, (WATERTOWN),SAILBOAT FOR SALE,https://watertown.craigslist.org/boa/5857441116.html,1981
79,good,"['43.733400', '-76.054300']",2016-11-26 16:09,This is a homemade layout/sneak boat that has a built in 9.5hp outboard that runs and drives. Motor was used in the water all summer. The trailer does not have paperwork but I have paperwork for the boat. This boat fits two people and gear. It has a cover that will go with the boat and a built in anchor. Hunted from this boat many times. Very stable in the water.,,5893496356,43.733400,15,-76.054300,,"https://maps.google.com/maps/preview/@43.733400,-76.054300,16z",,$500,power, (pierrepont manor),homemade layout/sneak boat,https://watertown.craigslist.org/boa/5893496356.html,
80,,,2016-11-26 11:47,"1989 Ocean Super Sport 35ft Sport Fisher Yacht.  Twin Detroit 8.2 turbo diesels, hardtop fly bridge, radar, A/C.  5KW diesel generator.  Needs interior put back together.  Have many parts to complete including balanced drive shafts and new props, engines were pulled and serviced with new gaskets.  Has been out of water for several years.  Documented vessel.  Have records and receipts from the past 10 or so years of everything that's been touched on this boat. 19,500 Call/Text",,5851636310,,35,,Ocean,,SS,$19500,power, (Chaumont),Ocean SS 35 Super Sport Twin Detroit 8.2,https://watertown.craigslist.org/boa/5851636310.html,1989
81,,,2016-11-26 11:47,"Sea Ray 36ft fly bridge, twin screw.  Project boat, needs total restoration.  Engines have been pulled and hull has had extensive repair.  Have twin 7.4l gas engines and drives included.  As is condition, buyer must transport.  $10,000 obo Call/Text",,5851636611,,36,,Sea Ray,,360,$10000,power, (Chaumont),1982 Sea Ray 360 36ft,https://watertown.craigslist.org/boa/5851636611.html,1982
82,,"['43.806200', '-76.049000']",2016-11-25 23:47,Have a trailer ez loader trailer great shape have paper work. Has hydralic braking . Roller are great. Trailer is with more than what I'm asking . I have my boat on it right now  which in a 25 ft stamas fishing cuddly I used the trailer to take it to the lake for the season then back out. I will make a deal just cause I'm to busy to use it. Add another 1100 and you can have it all and any gear. I have all the paper work for it all. Or you can make me an offer.,,5892538552,43.806200,26,-76.049000,,"https://maps.google.com/maps/preview/@43.806200,-76.049000,16z",,$1900,power, (Adams),22-25 ft ez load trailer dual axle 5800lbs,https://watertown.craigslist.org/boa/5892538552.html,
