,condition,coord_pair,date,description,engine hours (total),id,lat,length overall (LOA),long,make / manufacturer,map_URL,model name / number,price,propulsion type,region,title,url,year manufactured
77,good,"['35.159846', '-79.234943']",2016-12-08 02:11,1973 glastron  with title 40 hp mercury force 95 model engine runs strong but does need some adjustments and a seal witch I have ordered and do have. Boat has new floors and a 4000 lumen light bar up front new carpet and four rod holders also has a fairly new deep cycle battery for cranking and also runs fish finder. The engine has a new power pack new thermostat new impeller new plugs new fuel filter new exaust gasket .the seal it needs is for the gear oil it is mixing with water and will take about an hr or two if you know your way around a set of tools. The trailer is in perfect condition but does not have a title but will include a bill of sale. It probably can be obtained but is not promised. It is also a tilting trailer.perfect for cat fishing  I have removed all seats because we used boat for night fishing and we sit on coolers and buckets with swivel seats to save room. Two stroke engine also needs the neutral forward reverse adjusted.will accept trades on big John boats guns or atvs,00,5867616735,35.159846,15,-79.234943,glastron,"https://maps.google.com/maps/preview/@35.159846,-79.234943,16z",,$1500,power, (vass nc),best deal you will find,https://fayetteville.craigslist.org/boa/5867616735.html,1973
78,fair,"['35.058300', '-79.008000']",2016-12-07 14:14,Looking to trade my 12' dear jon boat for a 16'+ boat for the family. Boat works fine no leaks has casting deck and storage along with a 7hp sear outboard motor. Could use a tune up. Clean title for both trailer and boat.,1,5909643125,35.058300,12,-79.008000,,"https://maps.google.com/maps/preview/@35.058300,-79.008000,16z",,$12345,power, (Fayetteville),12' jon boat for trade only,https://fayetteville.craigslist.org/boa/5909643125.html,
79,good,"['35.280317', '-79.168485']",2016-12-07 14:01,"Nice 1997 18' Stingray 180 RS with a 3.0 Mercruiser that runs great ! The engine and outdrive have been serviced by us (DT's Marine) and all the electrical on the boat has been tested. This is a great boat to spend the day on the lake with family and friends skiing, tubing or just cruising around. Included with Boat : 1. Rear Entry Ladder 2. Brand New Battery 3. Spare Wheel and Tire 4. Bimini Top 5. In Dash Depthfinder NADA is $4380.00 and only asking $3995.00 . CASH ONLY ! Call Donny show contact info Thanks",0,5909619685,35.280317,18,-79.168485,Stingray,"https://maps.google.com/maps/preview/@35.280317,-79.168485,16z",180 RS,$3995,power, (Cameron),Stingray 180 RS,https://fayetteville.craigslist.org/boa/5909619685.html,1997
80,excellent,"['34.939277', '-78.323489']",2016-12-07 13:18,I bought this Seadoo from Wilmington Powersports near the end of the summer and barley had time to ride it. It's in excellent condition and was a wonderful toy to have around but I'm looking to get rid of it due to the lack of ride time I will be able to have on it this upcoming season. It's a 2016 seadoo GTI 130 SE with 19 hours on it.,19,5909545514,34.939277,11,-78.323489,Seadoo,"https://maps.google.com/maps/preview/@34.939277,-78.323489,16z",GTI 130 SE,$8900,power," (Clinton, NC)",Seadoo GTI 130 SE,https://fayetteville.craigslist.org/boa/5909545514.html,2016
81,,"['36.210000', '-78.700100']",2016-12-06 16:05,John Boat   The SS Noodle 16ft.6 in long 7ft. 6in Wide 1996 Johnson 70 HP motor (module number J70TLEOR) 	Two stroke motor 	 Electric start 	 Power Trim Motor guide tracker 	40  LB thrust trolling motor 	Foot control Two batteries 	Starting battery 	One battery dedicated for the trolling motor Two 6 gallon gas tanks Electric bilge pump Navigation lights Docking lights Top Speed approximately 45 MPH Galvanized trailer 1 7/8 in receiver Solid wide john boat Includes o	Hand held flares o	Throw able device (type IV) o	Two PFD o	One sound signaling device o	Fire extinguisher o	First aid kit o	Fish finder o	12 Volt DC power outlet Have title,,5908200143,36.210000,16,-78.700100,,"https://maps.google.com/maps/preview/@36.210000,-78.700100,16z",,$6000,power, (Stem),John Boat,https://fayetteville.craigslist.org/boa/5908200143.html,
82,fair,"['35.058300', '-79.008000']",2016-12-06 13:59,"I have an 81 Toyota pickup. It is lifted 12"" on 38"" super swampers with a 350 small block motor. Needs lots of little things to be perfect. Motor does run and it does drive But must be towed currently. I have put a lot into this build but don't have time to finish. It has a clean title. Not in hurry to get rid of. Price will go up the more I get fixed. Serious people only. Asking $3500 obo. Trade for good family boat",,5908117722,35.058300,10,-79.008000,,"https://maps.google.com/maps/preview/@35.058300,-79.008000,16z",,$3500,human, (Fayetteville),81 toyota pickup 4x4 project trade,https://fayetteville.craigslist.org/boa/5908117722.html,
83,like new,,2016-12-06 12:58,1978 Nauticat Moter Sailer 80 horse Ford Diesel 1400 hundred hrs 160 fuel 60 water dual helm stations separate head full shower total refit 015 tru 016 WAY TO MUCH TO LIST!!!!,1400,5908009340,,33,,Nauticat Motersailer,,Nauticat,$45000,power, (Key West),Nauticat 1978,https://fayetteville.craigslist.org/boa/5908009340.html,1978
84,,,2016-12-06 09:09,"I have a 1992 stingray 556zp boat for sale, it is a 19' Everything works and it is water ready. Engine has been rebuilt, outdrive has been replaced, the rear seats have new sealed wood. Trailer is in decent shape. The only reason I'm selling it is because I will be moving to Alaska in the next couple of months. Boat is in pretty good shape for its age but it could use a good cleaning. I can send more pics upon request asking 3500 obo, I have title for boat and trailer in hand. I also might me interested in trading for an suv or ATV Keywords: trade boat suv camper trailer atv dirtbike RV 4runner Tacoma",,5886129936,,19,,,,,$3500,power, (Fayetteville),19ft stingray boat,https://fayetteville.craigslist.org/boa/5886129936.html,
85,excellent,,2016-12-05 20:56,"Very nice Tahoe Q6 with less than 12 hours on new 190 HP V6 Mercruiser motor, Wake Board Tower, and Stereo with 4 speakers.    Never been exposed to salt water.  Very well taken care of.  Comes with plenty of play equipment, wake board, knee boards, ski's and tube ect...",12,5907197124,,20,,Tracker,,Tahoe Q6,$18500,power, (Fayetteville),Tahoe Q6 Ski Boat,https://fayetteville.craigslist.org/boa/5907197124.html,2008
86,,"['35.074200', '-78.965000']",2016-12-05 18:59,"96 Lowe 16ft Big Jon, factory aluminum floor with carpet, life jackets, fire extinguisher, bilge pump, new battery, bimini top, 97 johnson 30 hp outboard, new water pump, lower unit serviced, new plugs, 97 galvanized trailer, new tires and galvanized rims, new and repacked wheel bearings and seals, and boat loading guides. Thanks for looking !",,5907060797,35.074200,16,-78.965000,,"https://maps.google.com/maps/preview/@35.074200,-78.965000,16z",,$3250,power, (Fayetteville),16ft Lowe Big Jon,https://fayetteville.craigslist.org/boa/5907060797.html,
87,good,,2016-12-05 15:28,For sale is a 2000 Fisher Avenger Pro Sport with a 135 HP Mercury Optimax.  It is set up as a great catfish or striper boat but can be used as a great boat for families and weekend getaways at the lake.  Included with the boat is as follows: bimini top bow enclosure trolling motor (Minn Kota Powerdrive V1) Lowrance LMS 520c color sonar/gps (gps not included) 4 seats plus one casting seat for the front Two docking bumpers two trolling motor batteries one cranking battery 12 Fishbite dual position rod holders Boat cover Trailer with spare Please no low ball offers!  NADA low value is $8500 so it is priced to go.,,5906744797,,20,,Fisher,,Avenger Pro Sport,$6500,power, (Lumberton),Fisher Avenger Sport,https://fayetteville.craigslist.org/boa/5906744797.html,2000
88,good,[],2016-12-05 11:34,1977 16 foot chincoteague scow for sale. It has a 25 hp 1996 Suzuki engine and trailer. The boat is grey and has an Avery pop up blind on it. It has been lightly used for duck hunting and stored inside its entire life. I am the original owner. If interested call show contact info,100,5899442675,,16,,Jester Craft,https://maps.google.com/?q=loc%3A+%39%33%34+Cambridge+Street+Fayetteville+NC+US,16 foot Scow,$3500,power, (934 Cambridge Street),Chincoteague Scow Duck Boat,https://fayetteville.craigslist.org/boa/5899442675.html,1977
89,excellent,"['35.189900', '-78.648300']",2016-12-05 01:02,"1997 Boston Whaler Dauntless 13 in Excellent Condition.  Boat has a new gas tank, battery & trailer tires.  40hp Evinrude that runs great.  Fresh tune-up last month.  Boat has been taken care of and has no damage or problems.  Hull in excellent shape.  Includes fish/depth finder, all original paperwork, safety vests & vest bag.   Also have a MK 56 thrust 12/24 trolling motor with foot control available.",,5905862624,35.189900,14,-78.648300,Boston Whaler,"https://maps.google.com/maps/preview/@35.189900,-78.648300,16z",Dauntless 13,$5500,power,,!!!!CHRISTMAS SPECIAL!!!!   1997 BOSTON WHALER,https://fayetteville.craigslist.org/boa/5905862624.html,1997
90,good,,2016-12-04 20:37,"I have for sale a 1994 hydra sport 2000dc.  It has a 200hp Johnson ocean runner on it.   It has new tires, new top, and new battery.  It was in the water every weekend.  Runs good, nice boat.  Only thing it needs is windshields replaced can be done at local glass shop.",,5885802027,,20,,hydra sport,,,$4500,power, (St Pauls),1994 hydra-sport,https://fayetteville.craigslist.org/boa/5885802027.html,1994
91,good,"['35.242723', '-79.200928']",2016-12-04 17:21,"Selling a 1983 Prindle 16.  16 foot catamaran.  Owned it for a year and a half and am moving so I cannot take it with me.  It has been a fun boat to learn to sail with.  Replaced the trampoline and running rigging.  Also the trailer is completely refurbished having put over $700 into the trailer to include new bearings, new axle, new lights,  new hardware and rust resistant paint.  Currently there are 2 outstanding issues, the main cleat is broken.  I have a new one, just have not had the time to replace it.  Also, it is currently without a jib which could go for $250-$300 dollars.  The main is in decent shape but may need some battens replaced soon.  Otherwise, the boat is sea worthy.  Please send any offers my way.",,5905437688,35.242723,16,-79.200928,Prindle,"https://maps.google.com/maps/preview/@35.242723,-79.200928,16z",Prindle 16,$1100,sail, (Vass),1983 Prindle 16,https://fayetteville.craigslist.org/boa/5905437688.html,1983
92,like new,,2016-12-04 16:30,"Brand new John boat, have the certificate of origin etc. I bought his brand new this summer. It has a new troll motor, two oars, and a life jacket that's comes with it. Pickup only.",,5869438231,,10,,,,Honda 450r,$749,human," (Red Springs,Nc)",New 10ft John boat much more!,https://fayetteville.craigslist.org/boa/5869438231.html,
93,like new,"['34.324100', '-78.716000']",2016-12-03 19:50,2000 procraft 180 combo Runs and looks great! Call or text for more information. show contact info,,5864163194,34.324100,18,-78.716000,PROCRAFT,"https://maps.google.com/maps/preview/@34.324100,-78.716000,16z",180 combo,$8000,power,,Procraft 180 combo - Garage kept,https://fayetteville.craigslist.org/boa/5864163194.html,2000
94,good,,2016-12-03 17:38,"Selling my x2, it's a 750 swap with a fresh big bore top end and also have a bin full of extra 750 and 650 parts included.",2,5904199227,,8,,Kawasaki,,X2,$1200,power, (Fayetteville),Kawasaki X2,https://fayetteville.craigslist.org/boa/5904199227.html,1992
95,,,2016-12-03 17:33,"1989 18ft Fish and Ski Bass boat w/ 150hp Black Maxx motor. Comes with everything as seen in the pic. I have some extra accessories that I can pass on. If interested call or text at 9I5-667-22O4. Cash only and you will have to pick up in person (no scams). $3,500.00 OBO Thanks Daniel",,5890968217,,18,,,,,$3500,power, (Sanford),Bass Boat,https://fayetteville.craigslist.org/boa/5890968217.html,1989
96,like new,[],2016-12-03 12:13,1990 6 hp. johnson outboard 2 stroke tiller style short shaft new plugs points condsors clean carb. reset float new fuel pump low hours for more inf. call tom show contact info asking 500.00,,5903684556,,19,,,https://maps.google.com/?q=loc%3A+%31%34%35%31greenockave+fayetteville+NC+US,,$1,power, (fayetteville),outboardmotor,https://fayetteville.craigslist.org/boa/5903684556.html,
97,,"['35.058300', '-79.008000']",2016-12-03 11:57,1998 sun bird boat engine and trailer runs great ready for fishing this is a fiberglass 20 foot boat no wood or carpet there is nothing wrong with the boat or the trailer or engine low ball price will not be return so don't offer if you looking for great boat it has 2 wash down systems live well 2 fish storage up front of the boat new depth finder call when ready to buy call show contact info,,5865489678,35.058300,20,-79.008000,sunbird,"https://maps.google.com/maps/preview/@35.058300,-79.008000,16z",200,$5500,power, (fayetteville nc hope mills),1998 boat trailer sun bird best offer must sell,https://fayetteville.craigslist.org/boa/5865489678.html,1998
98,like new,"['34.989000', '-79.222800']",2016-12-03 09:54,"Teton fishing belly boat. Only used 5 times on a trip to Indiana, great for camping.",,5903470016,34.989000,3,-79.222800,Teton,"https://maps.google.com/maps/preview/@34.989000,-79.222800,16z",,$200,human, (McDougal Downs),Teton belly boat,https://fayetteville.craigslist.org/boa/5903470016.html,2012
99,excellent,,2016-12-02 20:39,"POWERED BY THE POWERFUL 5.0 GXI 270 HP VOLVO PENTA, IT RUNS PERFECTLY AND WILL PULL YOU SKIING,TUBING OR WAKE BOARDING EASILY AND CRUISE AT TOP END OF 45-50+- MPH! JUMPS OUT OF THE WATER AND COMES ON PLANE EFFORTLESSLY! RIDES SMOOTH EVEN IN ROUGH CHOP. GREAT ON FUEL..30 GALLONS WILL GO FOR THE WHOLE DAY! LOTS OF ROOM IN THE 8'4"" WIDE BEAM AND LOTS OF STORAGE! ALL UPHOLSTERY IS IN EXCELLENT CONDITION! CHECK OUT PHOTOS OF ENGINE AND ENGINE COMPARTMENT.",,5902881847,,24,,,,,$14100,power, (Swannanoa),"2008- FOUR WINNS**** GREAT SKI, PLEASURE OR FISHING BOAT!",https://fayetteville.craigslist.org/boa/5902881847.html,2008
