,condition,coord_pair,date,description,engine hours (total),id,lat,length overall (LOA),long,make / manufacturer,map_URL,model name / number,price,propulsion type,region,title,url,year manufactured
0,,"['33.737700', '-78.978700']",2016-12-20 20:51,"2008 RINKER 192 FRESHWATER USE THIS IS THE PERFECT SIZE BOAT, LOTS OF ROOM, EASY TO LOAD PLENTY OF POWER TO TUBE OR SKI BOAT GETS UP ON PLANE QUICKLY MERC 4.3 MOTOR UPGRADED MOTOR LIKE NEW TRAILER INCLUDED LOTS OF ROOM LARGE SWIM PLATFORM 4 BLADE STAINLESS PROP WRAP AROUND SEATING BOW SEATING AREA WITH FILL IN CUSHION SNAP DOWN CARPET LIKE NEW SNAP DOWN BOW AND COCKPIT COVERS LIKE NEW BIMINI TOP LIKE NEW REAR WALK THRU (no climbing over seats) CAPTAIN AND PASSENGER SEATS WITH BOLSTERS CD STEREO MP3 GEL COAT IS PERFECT VERY NICE GRAPHICS BOAT RUNS AND LOOKS LIKE NEW CALL ME TO SEE show contact info",,5921227269,33.737700,19,-78.978700,,"https://maps.google.com/maps/preview/@33.737700,-78.978700,16z",,$13900,power, (Myrtle Beach),2008 RINKER 192 EXCELLENT CONDITION,https://charlotte.craigslist.org/boa/5921227269.html,
1,excellent,"['35.069760', '-81.071334']",2016-12-20 20:18,"*** Christmas BOAT Sale! *** Christmas Fishing Boat Sale! 2000 22' Offshore Triton Center Console Fishing boat with Mercury Optimax 225HP with trailer for $14000! Boat Valued at $18,500. Boat just serviced on 7/16/15 at Marine Service Center. 227 engine hours, per MSC computer diagnostics. My Boat service records come with boat. Boat & Trailer Valued at $18,500. Runs great. Just serviced. This boat would cost $50,000+ new. NADA value - $17530. Boat price is $14000! Please see website & buy boat online at: http://hhihomerentals.com/Boat/BoatSale.html 2000 22' Offshore Triton Center Console fishing boat with 225HP Mercury Optimax XL -2000 Engine serial #0T019515 for sale by owner for $14000 with EZ loader trailer. 2000 225XL OP 227 Engine Hours, as per MSC computer diagnostics. Just serviced on 7/16/15! 50mph! Max rpm - 5750 Boat weight - ~ 3000 lbs. Beam - 8' Hull Material - Fiberglass $18,000 boat value. Trailer Tire size - ST205/75R14 Commodore steel belted radials New - 7/15/14 installed at Brian's Tire. $500 value Tandem Al Trailer - 2000 EZ Loader Weight - ~ 1000 Lbs. $2500 value VHF RADIO - SI-Tex ultimate (Not CB radio) Lowrance LMS-480m (GPS, depth, speedometer, fish & bottom finder) Has a external gas filter added to boat. Batteries: 2 new - 7/16/15 Interstate deep cycle marine batteres - 1000 cold cranking amps Buy boat online: http://hhihomerentals.com/Boat/BoatSale.html",227,5911934820,35.069760,22,-81.071334,Offshore center console / Triton,"https://maps.google.com/maps/preview/@35.069760,-81.071334,16z",Center console fishing boat,$14000,power, (Lake Wylie),"XMas Sale 22' center consol fishingboat, trailer, 225Hp outbrd",https://charlotte.craigslist.org/boa/5911934820.html,2000
2,,"['34.749000', '-80.761600']",2016-12-20 20:02,"I have a 1996 sea doo ran great during the summer, took it out winterrised it and messed around and got a new one. This one is a 3 seater and with 3 larger people 175-200 lbs will run 55mph and by my self will run 65-70. Have the tittle for both boat and the trailer and the trailer alone is with 400$. It does not have stickers it's been in a private  pond/lake sence 2007 and didn't need stickers Bc I owned the property. But all taxes are payed and you just got to pay 11$ to get the new ones. I need it gone! I have 2 newer tires on it there not the ones in the picture! 800 obo Seadoo, jetski, jet ski, boat, summer, xp",,5927576612,34.749000,10,-80.761600,,"https://maps.google.com/maps/preview/@34.749000,-80.761600,16z",,$800,power, (Lancaster),jet ski,https://charlotte.craigslist.org/boa/5927576612.html,
3,excellent,[],2016-12-20 19:42,"Selling my two sea do sparks, one has 25-30 hours, the other one has 30-35 hours, not sure, they are 2015, we bought them new in lake norman, they have covers, double trailer, really fun and a gas tank will go for the entire weekend, the fill up with 15 dollars, awesome. Price is firm and serious inquires only please, they are in a storage in Huntersville and we can take them to the water if needed.",35,5927556805,,9,,Sea Doo,https://maps.google.com/?q=loc%3A+Stonemarsh+Ct+Charlotte+NC+US,Spark,$9800,power, (Charlotte),Sea Doo Spark,https://charlotte.craigslist.org/boa/5927556805.html,2015
4,,"['34.925100', '-80.727800']",2016-12-20 19:37,This kayak seat for people with disabilities can be used for a kayak or canoe. I purchased it directly from the owner several years ago and have never used it. His website is www.creatingability.com There are no prices on the website for some reason - you have to call to get pricing.,,5927551816,34.925100,1,-80.727800,,"https://maps.google.com/maps/preview/@34.925100,-80.727800,16z",,$275,human, (Waxhaw),Kayak seat for disabilities,https://charlotte.craigslist.org/boa/5927551816.html,
5,,,2016-12-20 19:35,2013 Load Rite  Aluminum Trailer Model 5S-AC25T6000102LTB1 No Help Needed To Sell No Scamers Load Rite Venture Road King Magic Tilt Loadmaster EZ Loader Aluminum Trailer Boat Trailer,,5918466432,,27,,Load Rite,,,$2650,power, (Matthews),Load Rite Trailer,https://charlotte.craigslist.org/boa/5918466432.html,2013
6,good,"['35.401100', '-80.869500']",2016-12-20 19:10,"2005 Bayliner 249SD with Trailer.  Great for water sports. Runs great!! Seats 11-13 people. Key Features Enclosed head compartment allows plenty of privacy and lets you stay out playing longer Ski / wakeboard locker Meets or exceeds all applicable U.S. Coast Guard safety standards Dash panel: custom form brow, non-glare Center entry transom: with molded fiberglass entry Transom platform: integrated, with 3-step retractable ladder",,5904710270,35.401100,25,-80.869500,Bayliner,"https://maps.google.com/maps/preview/@35.401100,-80.869500,16z",249SD,$13500,power, (Huntersville),2005 BAYLINER 249SD,https://charlotte.craigslist.org/boa/5904710270.html,2005
7,good,,2016-12-20 18:58,1997 Allison craft copy 1984 85 xs power trim fun and fast have papers on boat and trailer,60,5892664660,,135,,Allison copy,,13.5,$3100,power, (Mooresville),1997 13' Allison copy,https://charlotte.craigslist.org/boa/5892664660.html,1997
8,excellent,"['34.636900', '-82.740600']",2016-12-20 18:29,"1998 Regal 22 foot Deck Boat, New Vortex V-6 Engine, Snap out Carpets, Full cover for the boat, More Storage than I ever saw in a boat, Raymarine Fish Finder, GPS, and many other Electronics, CB Radio.Aluminum Dual Axle Trailer. Mercruiser Alpha I Gen II Outdrive. 205 HP. $11,500 OBO.   BEAUTIFUL BOAT, RUNS GREAT!",0,5901463091,34.636900,22,-82.740600,Regal,"https://maps.google.com/maps/preview/@34.636900,-82.740600,16z",,,power,,"1998 Regal Deck Boat, with a new engine",https://charlotte.craigslist.org/boa/5901463091.html,1998
9,like new,,2016-12-20 18:27,"Excellent condition, only used a handful of times. Paid 1200 new without the paddle, life jacket, and rod/cooler holder. Asking 800 obo",,5927476848,,115,,wilderness systems,,ride 11.5,$800,human, (concord nc),kayak wilderness system,https://charlotte.craigslist.org/boa/5927476848.html,2014
10,good,"['35.401084', '-80.759983']",2016-12-20 18:25,"Kawasaki Stand-up Jet Ski, 1989, good condition, runs well, no defects. Needs battery. Have repair manual and other documentation. Please pick up where shown on map (10050 Edison Square Dr, Concord) with cash. Title already prepared for transfer. Jet Ski is available when you read this ad as I delete the ad immediately after sale",,5927475336,35.401084,7,-80.759983,Kawasaki,"https://maps.google.com/maps/preview/@35.401084,-80.759983,16z",HID KAW006691889,$800,power, (Huntersville/C),Kawasaki Stand-up Jet Ski - 440 cc,https://charlotte.craigslist.org/boa/5927475336.html,1989
11,excellent,"['35.737400', '-80.711300']",2016-12-20 18:25,2005 grizzly 1860 with lots of extras. 50hp mercury two stroke engine.  New 11 gallon fuel tank and fuel lines. New batteries. New camo paint. 2 year old hummingbird gps fish finder. Also included 2dozen foam filled higdon goose decoys rigged and ready to use. 2 dozen foam filled higdon battleship mallard decoys rigged and ready to use. Nice foot operated trolling motor. Complete set of rod holders for catfishing. Also included one of a kind duck blind that keeps you hidden till the birds are landing right in front of you. Awesome setup i just need to sell to purchase an SUV. Will trade for a nice Tahoe.,,5927474847,35.737400,18,-80.711300,Grizzly,"https://maps.google.com/maps/preview/@35.737400,-80.711300,16z",,$7900,power, (Cleveland),2005 grizzly 1860 duck boat,https://charlotte.craigslist.org/boa/5927474847.html,2005
12,like new,,2016-12-20 17:54,"This is a great example of a used 2012 Hurricane 188 Sundeck Sport powered by a Yamaha F115 engine with 106 hours. Boat has the upgraded yellow hull and it shines great. This 188 Sundeck is in great condition and Upholstery is fresh and looks like the boat was very well maintained by previous owner. CALL ROBERT show contact info SunDeck Sport SS 188 OB with a Yamaha 115 Length (L.O.A.)18'10"" Beam8'5"" Maximum HP200 Draft, Drive Up13Approximate Wet Weight3793Approximate Dry Weight260Fuel Capacity36 Person Capacity10",,5903500108,,19,,HURRICANE,,188 SUNDECK,,power,,2012 Hurricane 188 Sundeck Sport with Yamaha F115,https://charlotte.craigslist.org/boa/5903500108.html,2012
13,like new,,2016-12-20 17:54,"2011 SWEETWATER SW 2286  W/ YAMAHA 115HP Cast the day away with the 2286 , , and a comfortable chaise lounge for the rest of the family. - 2012 SWEETWATER SW 2286  W/ YAMAHA 115HP CALL ROBERT show contact info The mission of the Sweetwater SW 2286 is to provide a cost-effective pontoon boat that maximizes open deck space and provides easy access to the water. Onboard she offers comfort from chaise lounges and a plush helm seat. This twin-toon vessel has plenty of room aboard for guests to move around when entertaining. We particularly like the wheel-chair accessible bow gate and large foredeck platform that aids anchoring.",150,5920830193,,22,,SWEETWATER,,2286,,power,,**************$$$$$ HUGE PRICE DROP 2011 SWEETWATER 2286 W 115 YAMAHA,https://charlotte.craigslist.org/boa/5920830193.html,2011
14,new,,2016-12-20 17:11,"Shift/throttle cables, call. If you see one that will work for you, give me a call or text...most are Teleflex unless noted...price  $20 ea, mercury cables $30 ea . Will take Trades/offers for all the cables. One of the cables itself is priced @ over $100.00 from the dealership. They are New Old stock mainly for older boats but may interchange for your motor 60's-90's. I will need to know what type ends are on your cables, the boxes have gotten wet but the cables were covered and new. Contact Marty @ show contact info prefer text before 3:00 pm. During the week. I will get back with you ASAP....I also have some used cables that the dealer took off and had for sale, but function properly and will sell cheap$10.00 each. I have a list noting how many cables that I have on each cable if not sold already.....Give an offer that I can't refuse on all or will consider trades for the lot.(new & used) Thanks  Marty show contact info 11202913r...., 1134555a11....,12,13,14,,16,18, cc17010 10'...., cc17012 12'...., cc17014...., cc17015....., cc17016....., cc17013...., cc17211...., cc17212...., cc17216...., cc19912....., cc20511...., cc20514...., cc20515...., cc20516....., cc21014...., cc21016...., cc21314....,cc21315...., cc21316...., cc202818....,18-2157...., 18-2190...., 18-2158...., 18-2245-1....,- 18-2248....,- 18-2600....,- 032377-003-0144.0...., 168.0, 0204.0, 0120.0, 0132.0, 0252.0, 301947-003-0144.0...., 30202918-2161 n, teleflex 36', 10', morse 11432967, 1153732015(km63732-0), quicksilver 850716 a20, 853951 a12,",,5892475759,,10,,Teleflex/Mercury/etc,,,$20,power, (Belmont),New old stock Boat Shifter/Throttle Cables,https://charlotte.craigslist.org/boa/5892475759.html,
15,,,2016-12-20 16:28,"If you have a Boston Whaler sitting around, taking up space, collecting leaves, dust, etc -- sell it to me! - For a quick, cash transaction tell me exactly what you have (year and model of boat, motor and trailer) and your PRICE.  (i do not respond to no price emails) Thanks, I look forward to hearing from you.",,5899036345,,12,,boston whaler,,,,power,,Sell me your Whaler!,https://charlotte.craigslist.org/boa/5899036345.html,
16,,,2016-12-20 15:56,"2006 Sugar Sand Tango with only 30 hours on the boat. You wont find a boat that you can have more fun with. It has a mercury 210 will get you down the lake quickly! The boat comes with a trailer also. Its very similar to the sea doo jet boats.  I just purchased a new cover for the boat also. I will consider some trades. Jet ski, Sea Doo, Jet boat, larson, regal, cruiser, wake board",30,5911596060,,17,,Sugar Sand,,Tango,$11500,power, (Lake Norman),Sugar Sand Tango only 30 Hours jet boat,https://charlotte.craigslist.org/boa/5911596060.html,2006
17,,"['34.926613', '-80.558545']",2016-12-20 15:48,"Unexpected need to find an electric golf cart or utv for hunting land I just signed a lease on.  I am seeking to trade my 16 ft Grizzly Tracker with older but running 20 hp mercury tiller steer.  Boat has pedestal seats for rear bench and front platform.  Boat is welded & rigged for bass or crappy fishing including new foot controlled trolling motor. Also has 2 fish finders and a couple rod holders, but my plans were to use open floor to rig for duck hunting. Seeking an electric golf cart, Bad Boy or Stealth with heavy torque. Prefer basket racks and camo, but I will consider without if rigged good for hunting.  We may talk if you have a nice tractor as I am needing one for home and deer tract. (NO help needed for selling & I know my boat's value so save both of us time)",200,5907194762,34.926613,16,-80.558545,Tracker,"https://maps.google.com/maps/preview/@34.926613,-80.558545,16z",1648,$4000,power, (Monroe),16' Jon for Trade for Hunting Cart,https://charlotte.craigslist.org/boa/5907194762.html,2000
18,excellent,,2016-12-20 15:23,2014 Mud Motor 20 hours Excellent Condition $5000.00 or possible trade,,5927230971,,1,,,,,$5000,power, (Matthews),2014 Mud Motor,https://charlotte.craigslist.org/boa/5927230971.html,
19,like new,,2016-12-20 15:15,2015 Sea Doo Spark 3up 900 H.O. ACE IBR 2003 trailer - good tires Cover included I don't really want to sale it but i have no time for it!,38,5893387267,,120,,seadoo,,spark,$7500,power,,Seadoo,https://charlotte.craigslist.org/boa/5893387267.html,2015
20,good,,2016-12-20 15:06,"This is a great 22' Hurricane deckboat with tons of interior space and a huge swim platform.  This great all-around boat is powered by a 270 hp Volvo Penta motor with a stainless steel propeller and 767 hours.  It's been well maintained and is in good condition.  There is a flip up bolster seat on the captain's chair, huge ski locker, head area with space for a porta potty, oversized bimini top, custom bow and cockpit cover, battery switch with 2 batteries, electric engine hatch and much more.  Call or email for more information. Similar to:  deck boat, bowrider, open bow, chaparral, regal, sea-ray, sun deck, deckboat, mercruiser, tahoe, cobalt, sterndrive, io, i/o, 4-stroke, four stroke",767,5927162297,,23,,Hurricane,,2200 SunDeck,$29995,sail, (Lake Norman),2013 Hurricane 2200 SunDeck,https://charlotte.craigslist.org/boa/5927162297.html,2013
21,like new,,2016-12-20 14:52,"This beautiful 24' bowrider is loaded.  It has a wakeboard tower with wakeboard racks and integrated bimini top, huge extended swim platform, sun lounge area with flip up seat to allow passage into the boat without stepping on the seats, twin sport bucket seats with flip up bolsters, removable cooler with dedicated storage spot and much more.  It's powered by a 300 hp Volvo Penta motor with Duo Prop outdrive and two stainless steel propellers.  It has 703 hours.  Call or email for more information.",703,5927120392,,24,,Rinker,,Captiva 236,$34995,power, (Cornelius),2014 Rinker Captiva 236 - 24' Bowrider with Wakeboard Tower,https://charlotte.craigslist.org/boa/5927120392.html,2014
22,like new,,2016-12-20 14:50,"This is a beautiful 24' Hurricane deck boat with tons of seating and a fantastic looking sport arch, great for towing wakeboarders and tubes.  There is a galley area with sink and trashcan, twin sport bucket seats with flip up bolsters, bow and cockpit cover, huge swim platform, L-shaped rear seating, removable table, battery switch with two batteries, electric engine hatch and more.  It is powered by a 300 hp Volvo Penta motor with Duo Prop and two stainless steel propellers.  It has 842 hours.  Call or email for more information.",842,5927138805,,25,,Hurricane,,2400 SunDeck,$35995,sail, (Lake Norman),2013 Hurricane 2400 SunDeck,https://charlotte.craigslist.org/boa/5927138805.html,2013
23,excellent,"['35.203719', '-80.669789']",2016-12-20 14:22,"I have a used in great shape 17' wilderness systems kayak with rudder. one man sit in not hardly used. Been in dry storage and covered. New was over $1500. Will let it go for $725. call, text or email: show contact info",,5927136623,35.203719,17,-80.669789,Wilderness Systems,"https://maps.google.com/maps/preview/@35.203719,-80.669789,16z",Epic 170,$725,human, (Mint Hill),Wilderness Systems 170 Kayak w/Rudder,https://charlotte.craigslist.org/boa/5927136623.html,
24,like new,,2016-12-20 13:52,"This is a very nice and well maintained 20' bowrider with wakeboard tower and integrated bimini top.  It's powered by a 270 hp Volvo Penta outdrive with 5 blade stainless steel propeller with 475 hours.  It has the huge extended swim platform, upgraded stereo, bow and cockpit cover, wakeboard racks, huge ski locker and more.  It's in great shape and priced to sell.",475,5927088016,,21,,Rinker,,196,$27995,power, (Lake Norman),2014 Rinker 20' Bowrider with Wakeboard Tower,https://charlotte.craigslist.org/boa/5927088016.html,2014
25,like new,"['35.473300', '-80.872600']",2016-12-20 13:44,"This is a beautiful 24' luxury bowrider from Regal that is loaded.  It has the sport arch with power tower raising and lowering option.  It has a huge swim platform with rear active seating so you can adjust the seats to your preference.  It is set up so that you can relax by the water when at anchor.  It has a spacious interior with tons of upgrades.  Powered by a 270 hp Volvo Penta motor with Duo Prop outdrive and 2 stainless steel propellers, it has the speed for all your watersports needs.  With a huge ski locker, you can stow the skis and wakeboards easily when not in use.  There is a very nice head area with sink that has space for a porta-potty if wanted.  It includes a custom Sunbrella bow and cockpit cover.  The motor has 490 hours.",490,5927075868,35.473300,25,-80.872600,Regal,"https://maps.google.com/maps/preview/@35.473300,-80.872600,16z",24 Fasdeck,$59995,power, (Lake Norman),2016 Regal 24 Fasdeck,https://charlotte.craigslist.org/boa/5927075868.html,2016
26,like new,,2016-12-20 13:34,"This is a beautiful 24' Regal bowrider with sport arch.  Save thousands over a new price with this almost new boat.  It has a power tower so you can raise and lower the tower at the push of a button, huge swim platform, bow and cockpit cover, 270 hp Volvo Penta with Duo Prop outdrive, 2 stainless steel props, active seating in the stern that can be adjusting to suit your needs.  It's the perfect setup for hanging out when at anchor.  Huge ski locker for skis or wakeboards.  Great stereo system.  It is loaded.  It has 2 batteries and a battery switch.  Loaded! Call or text Jeff for more info show contact info",456,5927059384,,24,,Regal,,2300,$59995,power, (Cornelius - LKN),2016 Regal 2300 Bowrider - Save thousands over new,https://charlotte.craigslist.org/boa/5927059384.html,2016
27,,"['34.915100', '-81.012900']",2016-12-20 13:20,1978 COBRA JET JET BOAT... BERKLEY DRIVE WITH THE JETOVATOR ! NEEDS RESTORATION... OLDS MOTOR... GOT IT RUNNING BY POURING GAS IN CARB. GOOD TRAILER so-car,,5898457188,34.915100,18,-81.012900,,"https://maps.google.com/maps/preview/@34.915100,-81.012900,16z",,$2600,power, (ROCK HILL),BIG BLOCK JET BOAT,https://charlotte.craigslist.org/boa/5898457188.html,
28,,,2016-12-20 12:48,1989 Bayliner.  19ft  Includes trailer.  Was running before parked.  Has been sitting for a few years.  I have clean title for trailer and boat.  Pickup only.  $500 CASH FIRM!!!!  Call show contact info,,5926982496,,19,,,,,$500,power, (Rock Hill),1989 Bayliner Boat and trailer,https://charlotte.craigslist.org/boa/5926982496.html,
29,good,"['35.304383', '-80.943704']",2016-12-20 12:21,"19.5 ft Bayliner Capri 3.0 l mercuiser just been tuned up this summer plug,cap,rotor button oil filter water separator. Needs interior finished . Comes with matching trailer.",,5919250148,35.304383,19,-80.943704,Bayliner,"https://maps.google.com/maps/preview/@35.304383,-80.943704,16z",Capri,$2000,power, (Charlotte),1996 Bayliner Capri 19.5ft,https://charlotte.craigslist.org/boa/5919250148.html,1996
30,,"['35.688400', '-81.361200']",2016-12-20 12:19,I am selling my 86 ranger bass boat its an extreemly rare inboard 4.3 l boat with duel axl trailer trolling motor fish finder depth finder foot pedals cd player live wells ect . looks great needs motor work but i have anothet 4.3 to go with if wanted ... Price is firm will trade for corvette only also have a cruiser bike for the right deal ....,,5926933463,35.688400,19,-81.361200,,"https://maps.google.com/maps/preview/@35.688400,-81.361200,16z",,$2500,power, (Hickory),86 ranger bass boat inboard,https://charlotte.craigslist.org/boa/5926933463.html,
31,,,2016-12-20 12:16,"Nice little 14.5  ft jon boat with good running 25 hp Mecury motor. 43"" wide at bottom, 63"" wide at top No titles $2200 obo",,5903383611,,14,,,,,$2200,power, (charlotte),Aluminum jon Boat w/ Mercury motor,https://charlotte.craigslist.org/boa/5903383611.html,
32,good,"['35.201431', '-80.869527']",2016-12-20 12:03,"12' Saturn sd365 inflatable boat  This thing is a blast and can go where a lot of boats can't. It's for sale for $1200 as pictured(NO MOTOR/SOLD). Tow n go trailer, boat . since the photo I have added the Bimini top, cushioned bench pad with storage,running lights, seat, and seat frame. it is registered till 2018. The boat weighs only 110 lbs, and can easily be deflated and carried in a trunk of a car. It will hold 4 people. I will also sell separately, Tags Zodiac Avon, Dinghy, fishing boat john boat",,5926906608,35.201431,12,-80.869527,saturn,"https://maps.google.com/maps/preview/@35.201431,-80.869527,16z",SD365,$1200,power, (southend),12' Inflatable boat,https://charlotte.craigslist.org/boa/5926906608.html,
33,excellent,"['35.324700', '-80.659400']",2016-12-20 11:35,Jackson big rig kayak in excellent condition. Bought brand new and only used a handful of times. Comes with a factory installed rudder and I installed a lowrance elite 4x HDI fish finder.,,5926859985,35.324700,14,-80.659400,Jackson,"https://maps.google.com/maps/preview/@35.324700,-80.659400,16z",Big Rig,$1699,human,,Jackson Big Rig kayak,https://charlotte.craigslist.org/boa/5926859985.html,2014
34,,"['35.131600', '-80.857700']",2016-12-20 11:31,Gullsweep... Keep Birds off your boat...brand new...bought it and never used...The is Two in package...paid 48.00...price is still on it...asking 20.00...Please TEXT 310 nine two four 1786...I can meet at McDonalds Carolina Pavilion 9505 South Blvd off485,,5926853532,35.131600,1,-80.857700,,"https://maps.google.com/maps/preview/@35.131600,-80.857700,16z",,$20,human, (South Charlotte),Gullsweep,https://charlotte.craigslist.org/boa/5926853532.html,
35,excellent,"['35.213200', '-80.823100']",2016-12-20 11:09,"Custom Kevlar Nigel Dennis Kayaks Pilgrim Expedition I need to sell the Great White, a beautiful and sleek boat for the small or slim paddler. It handles really well, and packs enough for an expedition of many days. This model costs $5,575 new, plus the custom features below: Custom Bulkhead placement, with foam footrest White hull over White deck with White seam Small sized cockpit Hard pan seat, adjustable forward and aft I added: Custom Seals spray-skirt Custom nylon cockpit cover Custom nylon hatch covers Under-deck bungee for pump and paddle float",,5898382570,35.213200,17,-80.823100,Nigel Dennis Kayaks,"https://maps.google.com/maps/preview/@35.213200,-80.823100,16z",Pilgrim Expedition,$3600,human, (Charlotte),Custom Kevlar Pilgrim Expedition,https://charlotte.craigslist.org/boa/5898382570.html,2014
36,good,"['35.593669', '-80.859718']",2016-12-20 11:08,Must Sale this week !!!GTX Bombardier Seadoo's .  Both need work . Priced to sale !!!  $ 750.00 each  . Mooresville Area ... Trailer not included in sale . But can be purchased from third party .,,5926818765,35.593669,0,-80.859718,,"https://maps.google.com/maps/preview/@35.593669,-80.859718,16z",,,power,,Seadoo's For Sale,https://charlotte.craigslist.org/boa/5926818765.html,
37,excellent,[],2016-12-20 10:55,"2015 cataraft pontoon 14ft. 22inch tubes. new seats, battery, troll motor, lights and wiring, tires and wheels. comes with frame and floor. also trailer. great on river, floating or fishing. very easy to manver and to load. trailer has rollers for easy loading. questions, call show contact info no texts, no help to sell. willconsider a trade, no junk.",,5926777347,,14,,maxxon tubes,https://maps.google.com/?q=loc%3A+%35%38%37%37+Huff+Creek+Highay+Davin+NC+US,cataraft pontoon,$2900,power," (davin,wva.)",cataraft pontoon 14 ft. possible trade,https://charlotte.craigslist.org/boa/5926777347.html,2015
