,condition,coord_pair,date,description,engine hours (total),id,lat,length overall (LOA),long,make / manufacturer,map_URL,model name / number,price,propulsion type,region,title,url,year manufactured
0,good,"['34.746500', '-78.813400']",2016-12-20 18:13,"I have a 20 foot marine fisher boat that is powered by a 70hp 2 stroke johnson outboard sitting on a 2000 model 20ft trailer. Boat has new carpet, new paint job this year, new blind, new max 5 seats, new light bar, and powered winch. Boat is 54 inches across the bottom and 74 across the top with not leaks at all. Motor is a 70 johnson that runs. I take it out almost every weekend. This is a big boat and is very strong on the water.",,5927425384,34.746500,20,-78.813400,Fisher marine,"https://maps.google.com/maps/preview/@34.746500,-78.813400,16z",Matthew Jordan Futrell,$3500,power, (Tar Heel NC),20 Foot center Console,https://fayetteville.craigslist.org/boa/5927425384.html,1988
1,,"['35.114900', '-80.705000']",2016-12-20 15:55,"18 foot Rankin boat, galvanize trailer, no motor, no leaks, it needs a new floor and carpet, title for both in hand ready to be signed over by new owners, 400 or best offer, cash only or open to tools trade Tools I'm looking for-spindle Sander, tablesaw, lathe, lathe tools, 1/2 inch router in table, 14 or 17 inch bandsaw,a I am willing to drive it to location, however money in hand first. Cash only. It takes a 2 inch ball. There are also other things that could go with it i.e. a trolling motor. (Bow or transom) Sold seperately Please call show contact info",,5927278019,35.114900,18,-80.705000,,"https://maps.google.com/maps/preview/@35.114900,-80.705000,16z",,$400,power," (Matthews, NC)","18ft boat, galvanized trailer, titles for both( OPEN TO TOOLS TRADE)",https://fayetteville.craigslist.org/boa/5927278019.html,
2,new,[],2016-12-20 13:02,"New 2017 Galvanized Pontoon Trailers by LoadRite Don't settle for a painted trailer!! All Trailers are in stock, and ready for your boat! New Single Axle Trailer up to 20ft - $1595 New Single Axle Trailer up to 23ft - $1695 New Dual Axle Trailer up to 25ft - $2195 New Dual Axle Trailer up to 25ft with Brakes - $2595 ***All Trailers are equipped with front boarding ladder*** Twin Lakes Marine in NC Call/Text/Email for more info",0,5927006143,,0,,LoadRite,https://maps.google.com/?q=loc%3A+Satterwhite+Point+Road+at+Wortham+CT+Henderson+NC+US,,$1595,power, (Kerr Lake/Lake Gaston),New 2017 LoadRite Galvanized Pontoon Trailers,https://fayetteville.craigslist.org/bod/5927006143.html,2017
3,good,,2016-12-20 12:13,I have a 1987 17ft Swann point skiff and trailer for p obo OR TRADE Also have a Bimini top a 75hp outboard motor with controls and center console FOR RIGHT PRICE OR TRADE GUNS ATVS MAN STUFF DURAMAX STUFF FISHING HUNTING OUTDOOR SPORTSMAN GOLF CART BOAT TRAILER,,5926885417,,17,,Swann Point,,skiff,$1700,power, (kinston),17ft Skiff Trade or Sale,https://fayetteville.craigslist.org/boa/5926885417.html,1987
4,,,2016-12-20 08:47,"THIS IS A LONG GALVANIZED TRAILER THAT WOULD CARRY A 10,12,OR 14FT JON BOAT. IN GOOD CONDITION. NO TITLE. BILL OF SALE ONLY. CALL show contact info CAN TEXT PIC BY PHONE.",,5919385093,,14,,,,,$175,power, (DUNN),GALVANIZED LONG TRAILER,https://fayetteville.craigslist.org/boa/5919385093.html,
5,good,"['34.647100', '-78.574700']",2016-12-20 02:31,I am selling my 2004 Yamaha Waverunner and 2004 Polaris MSX 110 turbo on a double trailer. Have titles for both Jetskis. The Yamaha runs like a champ (135HRS)  and the Polaris (35HRS) is on Limp mode ( safe mode) for something minor. Yamaha will go upwards around 55mph or so and the Polaris also ( When out of limp mode). The trailer is in great condition. Priced to sell. No hurry to sell.,,5926481721,34.647100,11,-78.574700,,"https://maps.google.com/maps/preview/@34.647100,-78.574700,16z",,$4200,power," (Elizabethtown, NC)",Jetskis,https://fayetteville.craigslist.org/boa/5926481721.html,
6,excellent,,2016-12-19 21:43,"Toller Hellcat ducking Boat for sale, $14000  (checkout the Toller website to see this model and his other boats) 21 ft., 90 horsepower 2 stroke motor, approx. 100 hours run time, just had maintenance done,  runs extremely well,  top speed 35 mph, trailer in good shape, tires and bearing good This boat is hand built one of a kind,  does extremely well in Pamlico Sound, NC  when other flat bottoms had to stay in because of Chop, this boat handles no problem.  Great for use as a tender with Layout boats,  I'm including 2 set-up complete bags of gang line rigs. (approx. 5 dozen decoys with all rigging) this boat is ready to go at the coast or any lake.  drafts next to nothing,  better than any Jon boat set-up,  the high sides work well to hide shooters and enables you take-on any storm please call/text me for questions show contact info calvin",100,5926310862,,21,,toller,,hellcat,$14000,power," (jackson springs, nc)",21 ft. Duck Hunting Boat,https://fayetteville.craigslist.org/boa/5926310862.html,2007
7,,"['34.746500', '-78.813400']",2016-12-19 19:43,"1989 Capri 17 ft, 85 hp engine, this boat has hardly been used. It belonged to an older gentleman and he passed away. It is clean and in great shape. 2 fish finders, canopy, tubes, ropes, anchor. New battery. The seats on the very back are cracking on the very top, but the rest of the seats look great. Sell or trade. Make an offer or trade, please be reasonable, what I have is not junk. If you have a trade please send pics and a detailed information of what you have. Thanks show contact info",,5921108303,34.746500,17,-78.813400,Bayliner,"https://maps.google.com/maps/preview/@34.746500,-78.813400,16z",,$3200,power, (Tar Heel),1989 Bayliner Capri,https://fayetteville.craigslist.org/boa/5921108303.html,1989
8,excellent,,2016-12-19 19:20,"All original except extended ride plate 1998 Kawasaki 650 sx Standup Jet Ski! * Runs perfect! * OEM fitted Cover. * Oil and gas mix through gas tank. (avoids issues, with the oil pump from shutting down) * New Battery * 650 has plenty of power, will max out around 38 mph, depending on water weight of rider. * Fresh water only. At Lake Gaston, can bring to Raleigh though. Asking $2,175 OBO. Great Ski! AWESOME HOLIDAY CHRISTMAS GIFT!! Most fun you can have on water, ready to ride!",50,5907122272,,6,,Kawasaki,,650 sx,,power,,"Kawasaki 650 Standup Jet Ski! Excellent, ** Great Gift!1",https://fayetteville.craigslist.org/boa/5907122272.html,1989
9,,"['35.032245', '-78.877029']",2016-12-19 15:34,2008 Tracker Pro Team TXW 175 with 2008 Mercury 50 ELPTO 2 Stroke 2008 Tracker boat Trailer Lowrance HDS 5 with Lake Insight Lowrance Elite-5 DSI with HotSpots Pro USA Freshwater Charts Motorguide 46 lb Thrust Trolling Motor 2 bank onboard battery Charger Powerpole Micro Pro style seat up front Jensen CPM150 Gauge Style Radio with Bluetooth -- Installed New tires/rims in March 2015 Title for Boat and Trailer in Hand! 8000 OBO Blue interior compartment lights,,5925836468,35.032245,17,-78.877029,,"https://maps.google.com/maps/preview/@35.032245,-78.877029,16z",,$8000,power, (Fayetteville),2008 Tracker PT 175 TXW,https://fayetteville.craigslist.org/boa/5925836468.html,
10,new,"['34.262182', '-77.835732']",2016-12-19 14:06,"Up for sale is my 2015 Seadoo Spark. It has the HO engine with the convenience package. Sits on a 2015 Triton Aluminum trailer. Purchased from Wilmington Power Sports and have all the paperwork since day. Long story short, life got in the way of using this ski and it has literally never been in the water. There is 01 minute on the cluster. I just replaced the battery since the original one wouldn't hold a charge after sitting for a year. It is covered under warranty until 10/2018. If you have any questions, shoot me a call at show contact info Located in Wilmington,NC",0,5925624403,34.262182,9,-77.835732,SeaDoo,"https://maps.google.com/maps/preview/@34.262182,-77.835732,16z",Spark 2up,$6200,power, (Ogden),2015 SeaDoo Spark 2up,https://fayetteville.craigslist.org/boa/5925624403.html,2015
11,good,"['34.733400', '-79.309700']",2016-12-19 12:56,Boat in great condition. Has a 2014 Mercury Pro XS w/55-60 hrs on it. Warranty is good til Dec. 2018.Minn Kota Fortrex 101. 8ft Minn Kota Talon. Comes with 2 Lowrance HDS depth finders with structure scan.,60,5925601499,34.733400,20,-79.309700,Nitro,"https://maps.google.com/maps/preview/@34.733400,-79.309700,16z",NX 898,$24000,power," (Maxton,NC)",2006 NX 898 w/ 2014 Mercury Pro XS,https://fayetteville.craigslist.org/boa/5925601499.html,2006
12,,"['34.734808', '-79.508091']",2016-12-19 12:15,"Selling our 1987 Bayliner boat, approx 16 ft long, with 85 hp Force engine. Downsizing outside items due to working out of state. $800 OBO. Serious offers only! No holds.",,5925542850,34.734808,16,-79.508091,,"https://maps.google.com/maps/preview/@34.734808,-79.508091,16z",,$800,power, (Laurinburg),1987 Bayliner 16' Boat,https://fayetteville.craigslist.org/boa/5925542850.html,
13,,"['35.058300', '-79.008000']",2016-12-19 07:34,1998 sun bird boat engine and trailer runs great ready for fishing this is a fiberglass 20 foot boat no wood or carpet there is nothing wrong with the boat or the trailer or engine low ball price will not be return so don't offer if you looking for great boat it has 2 wash down systems live well 2 fish storage up front of the boat new depth finder call when ready to buy call show contact info,,5917338763,35.058300,20,-79.008000,sunbird,"https://maps.google.com/maps/preview/@35.058300,-79.008000,16z",200,$5500,power, (fayetteville nc hope mills),1998 boat trailer sun bird best offer must sell,https://fayetteville.craigslist.org/boa/5917338763.html,1998
14,like new,,2016-12-19 07:26,1998 Sunbird boat motor and trailer runs good excellent condition ready to fish boat need nothing but a new owner must sell 6500 or best offer show contact info,,5921534506,,20,,sunbird,,200,$5500,power, (Fayetteville),1998 Sunbird boat 20 foot need gone best offer,https://fayetteville.craigslist.org/boa/5921534506.html,1998
15,good,,2016-12-18 21:59,"Selling or trade would rather trade. This is a 240 sportsman 25.5' long plus motor bracket I've spend tons of money on this boat to have it where it is, re power with a 225 ox66 Yamaha 1998, It had a mercury 225 that work but I did not trust for a 50 offshore trip. Things done. Water pump Stater Oil tank and pump Gas filters New canvas Neon lights Nav lights anchor lights New anchor New plugs And the list goes on. It's got a 144 gas tank live we'll coolers and a nice Lorance hds7 tuch, with wade points. Reason for selling. Moving to Maryland and no offshore fishing there so I would only trade for a Carolina skiff. Up or down on money. We can take to water and run it.",247,5904260505,,255,,Sportsman,,240 proline,$18000,power, (Fayetteville),Trade or sale Pro Line 240,https://fayetteville.craigslist.org/boa/5904260505.html,1998
16,,,2016-12-18 21:48,"Got a 12' job boat with two seat,battery, trolling motor need outta my building.  Asking 450.00 Call show contact info before 9pm no texts. And I do have the paper work for boat.",,5884102664,,12,,,,,$450,power, (Raeford),12' Jon boat John aluminum flat bottom.,https://fayetteville.craigslist.org/boa/5884102664.html,
17,good,,2016-12-18 21:16,I have a Jon Boat and a Canoe for sale $200 each or buy both for $375.  Call show contact info,,5924914653,,12,,,,,$200,human, (Sanford),Jon Boat $200 also Canoe $200 each,https://fayetteville.craigslist.org/boa/5924914653.html,
18,fair,"['35.015100', '-78.326000']",2016-12-18 19:36,"1000 obo Second owner bought in 2004 Custom paint.... only used in fresh water.... runs strong needs cards cleaned... batteries dead butt cracks first time ... small crack on hood, does not interfere with operations!!",,5924826323,35.015100,8,-78.326000,Yamaha,"https://maps.google.com/maps/preview/@35.015100,-78.326000,16z",Wave raidee,$1000,power, (Clinton),Jetski wave raider,https://fayetteville.craigslist.org/boa/5924826323.html,1995
19,,"['34.954900', '-78.740800']",2016-12-18 19:26,REBUILT CARB---NEW WATER PUMP---NEW PLUGS---NEW LOWER UNIT OIL--NEW SEALS---WILL TAKE ANYTHING ON TRADE WITH OR EVEN---RUN IN TANK IF NEEDED----CASH PRICE ONLY LISTED FIRM--CONTACT ME ON TRADES OF ANY TYPE AND TELL IF URE DOING CASH AND TRADE OR JUST TRADE--NEEDS TO GO BY WEDNESDAY OF THIS WEEK,,5924807111,34.954900,1,-78.740800,,"https://maps.google.com/maps/preview/@34.954900,-78.740800,16z",,$300,power,,3.5 HP CLINTON,https://fayetteville.craigslist.org/boa/5924807111.html,
20,,"['34.954900', '-78.740800']",2016-12-18 19:26,NEWER REBUILT POWERHEAD----NEW SEALS---NEW CARB---NEWER ELECTRICAL---NEW COMPLETE WATER PUMP---NEW LOWER UNIT OIL----NEW PLUGS----WILL TAKE ANYTHING ON TRADE WITH CASH NO  EVEN TRADES --WILL TEST RUN IN TANK IF NEEDED---CASH PRICE ONLY LISTED FIRM--CONTACT ME ON TRADES ---- NEEDS TO GO BY WEDNESDAY OF THIS WEEK,,5904123466,34.954900,1,-78.740800,,"https://maps.google.com/maps/preview/@34.954900,-78.740800,16z",,$550,power,,20 HP MERCURY,https://fayetteville.craigslist.org/boa/5904123466.html,
21,,"['34.954900', '-78.740800']",2016-12-18 19:26,2016 MODEL --HASNT BEEN USED I TOOK IT OFF BOAT WHEN NEW--RETAILS FOR 700 LOOKING FOR REASONABLE OFFERS,,5904142822,34.954900,1,-78.740800,,"https://maps.google.com/maps/preview/@34.954900,-78.740800,16z",,,power,,24 VOLT 70 PD TRUST TROLLING MOTOR,https://fayetteville.craigslist.org/boa/5904142822.html,
22,good,,2016-12-18 18:00,Key largo boat I purchased new in 2001 but it is a 2000 model. One owner with 90 HP Johnson that runs good. Going to purchase a new boat.  I'm 70 years old and down sizing to skiff. New fish finder ($200) and battery recently installed and full cover for boat and motor that's in good shape.,200,5914195765,,17,,key largo,,170,$5900,power, (Pembroke NC),17 ft Center Console fishing boat,https://fayetteville.craigslist.org/boa/5914195765.html,2000
23,excellent,"['35.316500', '-78.615100']",2016-12-18 15:24,"2015 Carolina skiff, sea foam green, 2015 115 Suzuki motor. Comes with depth finder, gps, cushions, live well and lots of storage.",0,5924543664,35.316500,21,-78.615100,Carolina skiff,"https://maps.google.com/maps/preview/@35.316500,-78.615100,16z",Reid Wood,$26500,power, (Dunn),2015 Carolina skiff dlv,https://fayetteville.craigslist.org/boa/5924543664.html,2015
24,,"['34.495400', '-77.555000']",2016-12-18 10:13,"I hate to sale it but moving. august it is registered in tell Oct. 2017 please don't text and waste my time this something I don't want to have to sale. but forced to. this bay liner is not your everyday boat I have spent thousand dollars to update this boat I made it into a fishing/pleasure boat. all new stuff. rebuilt motor never been in the salt since rebuilt only cape fear. river replaced everything on motor. added inline hp fuel filters. added a sensor both temp and water on block for telltale water.rebuilt lower unit. lower gear and all new water pump ass. new fuel tanks. and replaced lines . added brand new serrria gauges. never had gauges since new. on broad battery charger added trolling motor. wired to switch and fused all new wiring and everything fused. added fire system all new safety on broad. brand new kill switch and added very nice digital panel. switch panel with built in battery volt warning. and volt reading. added expensive front in bow area a adjustable fishing seat. swivel. can remove seat to have more seating. when pleasure riding. added 2nd battery. added extra compartments that have latches. new tie downs. new carpet. added side glass's fishing pole holders front and rear. brand new allowance 4 fish finder new gear ready nothing to do, also the trailer updated' bearing wiring running lights/ new winch rope. added a wheel around jack on this trailer are boat was bought from Sanford NC I have kept in covered and garaged",,5894123094,34.495400,17,-77.555000,,"https://maps.google.com/maps/preview/@34.495400,-77.555000,16z",force 50 hp,,power,,1991 bayliner capri boat out broad,https://fayetteville.craigslist.org/boa/5894123094.html,1991
25,like new,,2016-12-18 09:16,1998 Sunbird boat motor and trailer runs good excellent condition ready to fish boat need nothing but a new owner must sell 6500 or best offer show contact info,,5920139212,,20,,sunbird,,200,$5500,power, (Fayetteville),1998 Sunbird boat 20 foot need gone best offer,https://fayetteville.craigslist.org/boa/5920139212.html,1998
26,excellent,"['34.953600', '-78.935400']",2016-12-18 09:15,2009 Key West Bay Boat with 150 Optimax Low hrs.,,5924104160,34.953600,20,-78.935400,Key West,"https://maps.google.com/maps/preview/@34.953600,-78.935400,16z",,$16000,power, (Hope Mills),2009 Key West Bay Boat,https://fayetteville.craigslist.org/boa/5924104160.html,2009
27,,"['35.058300', '-79.008000']",2016-12-18 08:59,1998 sun bird boat engine and trailer runs great ready for fishing this is a fiberglass 20 foot boat no wood or carpet there is nothing wrong with the boat or the trailer or engine low ball price will not be return so don't offer if you looking for great boat it has 2 wash down systems live well 2 fish storage up front of the boat new depth finder call when ready to buy call show contact info,,5906910333,35.058300,20,-79.008000,sunbird,"https://maps.google.com/maps/preview/@35.058300,-79.008000,16z",200,$5500,power, (fayetteville nc hope mills),1998 boat trailer sun bird best offer must sell,https://fayetteville.craigslist.org/boa/5906910333.html,1998
28,excellent,"['35.058300', '-79.008000']",2016-12-18 08:53,1998 sun bird boat engine and trailer runs great ready for fishing this is a fiberglass 20 foot boat no wood or carpet there is nothing wrong with the boat  or the trailer or engine low ball price will not be return so don't offer if you looking for great boat it has to wash down systems live well 2 fish storage up front of the boat new depth finder   call when ready to buy call show contact info,,5903644528,35.058300,20,-79.008000,,"https://maps.google.com/maps/preview/@35.058300,-79.008000,16z",,$5500,power, (fayetteville nc hope mills),1998 boat trailer sun bird best offer must sell,https://fayetteville.craigslist.org/boa/5903644528.html,
29,good,,2016-12-18 04:44,"17 ft Alumacraft center console with a 60 hp mercury motor on it. Runs great, mainly used for duck hunting and bass fishing. Has bilge pump, aerator, running lights and also lights for driving to the blind at night. Trailer works good, new springs, just brought to NY on fishing trip. I also have a duck blind that can go with it that I've used for years. Selling to finance new camper. Emails only. Boat located in Wilmington NC",,5899919608,,17,,Alumacraft,,Alumacraft,$7000,power, (SE North Carolina),2004 ALUMACRAFT,https://fayetteville.craigslist.org/boa/5899919608.html,2004
30,,"['34.629300', '-79.008300']",2016-12-18 00:28,"09 wave runner Super High Output, very fast! Runs great never had any problems with it just got it serviced first of this year. Comes with cover also. If you would like to check it out please give me a call or text. Trying to get a certain car so I am just trying to sale it for what I can.",,5923897950,34.629300,10,-79.008300,,"https://maps.google.com/maps/preview/@34.629300,-79.008300,16z",,$6600,power, (Lumberton),09 waverunner SHO,https://fayetteville.craigslist.org/boa/5923897950.html,
31,,,2016-12-17 20:01,22  foot cabin cruiser. 115 hp  Johnson outboard motor.  Need to sell.  Come give it a look.,,5923716932,,22,,,,,$1500,power, (pembroke),1989 Larson cabin cruiser,https://fayetteville.craigslist.org/boa/5923716932.html,
32,,"['34.056300', '-79.246400']",2016-12-17 13:16,"16' MONARCH, 48"" WIDE AT THE BOTTOM, ITS A FLAT BOTTOM, ALUMINUM. JON BOAT, FACTORY SIDE CONSOLE, WITH A STEERING WHEEL, 25 MERCURY ELECTRIC START, STERN MOUNT MINKOTA 55# THRUST TROLLING MOTOR, EXC. COND.! RUNS PERFECT! I HAVE THE TITLES FOR BOTH. JUST IN TIME FOR DUCK SEASON!!! $3,200 CASH ! PLEASE SERIOUS INQUIRES ONLY REPLY...------NO TRADES ------ BEST WAY TO GET UP WITH ME IS SEND A NUMBER I CAN GET YOU AT AFTER 6 Pm.",,5892009729,34.056300,16,-79.246400,,"https://maps.google.com/maps/preview/@34.056300,-79.246400,16z",,$3200,power,,16 Ft -- JON/DUCK BOAT -- 25 MERC -- SIDE CONSOLE,https://fayetteville.craigslist.org/boa/5892009729.html,
33,like new,"['35.160600', '-78.724900']",2016-12-17 08:45,Like new barely used low hours on a 2014 90 Yamaha 4 stroke. Boat is a 2014 but bought it new in March 2015. Yamaha warranty good until 3-14-2018. Onboard dual battery charger. Trolling motor  down imaging depth finder with GPS. Radio. Rod locker and plenty of storage. Ready for fishing call Dallas with questions show contact info,5,5922834924,35.160600,17,-78.724900,Xpress,"https://maps.google.com/maps/preview/@35.160600,-78.724900,16z",H 17 Pro,$15500,power, (Wade),Xpress bass boat,https://fayetteville.craigslist.org/boa/5922834924.html,2014
34,,"['34.989000', '-79.222800']",2016-12-17 08:31,"12 ft Jon boat for sale, trailer and trolling motor are Not included. Just the boat and a paddle.  180 OBO. show contact info Anthony",,5922837730,34.989000,12,-79.222800,,"https://maps.google.com/maps/preview/@34.989000,-79.222800,16z",,$180,human, (Raeford),Jon boat,https://fayetteville.craigslist.org/boa/5922837730.html,
35,,,2016-12-17 07:10,"We have the kayak you're looking for at Riverside Bait and Tackle.  Come check out the Vibe Sea Ghost 130.  It's 13 ft. of fish catching machine and it comes with paddle, comfortable hi/low Hero seat and installed rudder. There is just no better value out there in kayak fishing. We are also proud to announce we have received our first shipment of the Vibe Yellowfin 100 kayaks.  Where else can you get a 10 ft. kayak, 57lbs with Hero seat for just $649.  Whether you use it for fishing or just paddling our waters, this is a great kayak.  But don't take my word for it.  Go to the Vibe Kayaks Owners Group on Facebook and see what over 3300 owners have to say about our kayaks.  Then we invite you to join our Vibe family.  Come see us at 1122 Person Rd in Fayetteville, on the beautiful Cape Fear River.",,5922791610,,13,,Vibe Kayaks,,"Sea Ghost, Yellowfin",$824,human, (Fayetteville),Vibe Fishing Kayak Line-up:  Sea Ghost 130 and Yellowfin 100,https://fayetteville.craigslist.org/bod/5922791610.html,
36,,,2016-12-16 14:46,I have a Ascend F128T sit on top angler kayak for sale. This is a very stable kayak. It's base is wide enough so that you can also stand on it while you fish. I have also stand on this as I paddle to track reds out at the coast in North Carolina. It comes with 4 flush mount rod holders and well as a adjusting folding chair that can rotate. It comes with a handle strap to help with standing and sitting while on the water. It has multiple storage compartments to store your gear to keep them dry. I have caught some huge fish out of this kayak when I was stationed in Alaska. I will include a free ascend paddle. Serious inquires only.,,5922051103,,12,,Ascend,,FS128T,$550,human,,Ascend F128T Sit on Top Angler Kayak,https://fayetteville.craigslist.org/boa/5922051103.html,
37,,,2016-12-16 14:32,"I have a Ascend FS12T sit on top angler kayak for sale. This is a great kayak. It is very stable and tracks really well. It comes with a comfy adjustable folding sit as well with two flush rod holders. It has a nice spacious compartment to keep your things dry. I have used this kayak in salt water, brackish water, and lakes with no issues. I will include a Ascend paddle for free. Serious inquires only.",,5922029584,,12,,Ascend,,FS12T,$400,human,,Ascend FS12T Sit on Top Angler Kayak,https://fayetteville.craigslist.org/boa/5922029584.html,
38,good,"['35.108887', '-79.466277']",2016-12-16 08:32,"16 ft fiberglass fishing boat with 25 hp Evinrude 2 stroke and electric trolling motor. Not pretty, but a good riding boat. My grandpa gave it to me a few years ago and I'm selling it now because I got a new aluminum boat. New trailer tires a couple years ago with less than 500 miles on them. Does have some rough spots on the hull that have been patched. Has a soft spot up front inside that I have patched over. Needs new carpet or just rip it all out. It is what the title says, a simple, cheap fishing boat that has served myself and my grandpa well. Boat and Trailer title in hand. Call or text Matt show contact info",,5906446351,35.108887,16,-79.466277,Ouachita,"https://maps.google.com/maps/preview/@35.108887,-79.466277,16z",,$1050,power, (Pinebluff),16ft Fishing Boat 25 HP Evinrude and Trolling Motor,https://fayetteville.craigslist.org/boa/5906446351.html,
39,like new,"['34.889400', '-79.702200']",2016-12-15 20:01,"14 ft Jon boat like new. Fresh paint not spray canned,new seats, new lights,wiring harness,straps on trailer, 4.0 Johnson motor another bigger Johnson motor comes with it, trolling motor, titled and ready for water.",,5921124617,34.889400,14,-79.702200,Lowe,"https://maps.google.com/maps/preview/@34.889400,-79.702200,16z",,$2000,power, (Hamlet nc),14 ft lowe jon boat,https://fayetteville.craigslist.org/boa/5921124617.html,2000
40,like new,[],2016-12-15 19:35,Nice like new 2006 Polaris jet ski. Runs like new. Strong 150 turbo charged motor will ride 2 and pull skier. Maybe trade for 4 wheeler or something of equal value.,,5921098841,,10,,Polaris,https://maps.google.com/?q=loc%3A+%34%36%31%31+lumberton+NC+US,,$2500,power, (Lumberton),Polaris Jet Ski,https://fayetteville.craigslist.org/boa/5921098841.html,2006
