,condition,coord_pair,date,description,engine hours (total),id,lat,length overall (LOA),long,make / manufacturer,map_URL,model name / number,price,propulsion type,region,title,url,year manufactured
41,new,[],2016-12-15 12:26,"The new Xpress Xplorer Camo 18 foot center console package is a great boat for fresh or saltwater use as well as going after those ducks. It is powered by a Yamaha F70 LA four stroke motor with tilt and trim. The trailer is an all aluminum heavy duty trailer made by Back Track trailers. The boat is equipped with a Humminbird Helix 5 GPS, Minn Kota 55 edge bow mount foot control trolling motor, two Deka marine batteries as well as a Fuel Water Separator. This boat is ready to hit the WATER!! A.K's price $19,999.00 If you have any questions contact A.K. McCallum (8006822628) A.K. stocks 0ver 150 different jon boats from 10 to 24 foot in length Come check out what we have in stock. Xpress Features: * Full Xpress Camo Duck Boat Package * Xtreme-coat Spray-in Interior * All-Welded Hull * Longitudinal Rib Construction * Unibody Pressure Injected Level Foam Flotation * HD Gunnel System (tough) * Fiberglass Captain's Console * Full Tinted Windshield * Full Gauge Package (Speed, Tachometer, and Fuel Gauge) * Integrated Floor Drains * Bilge Pump with Console Switch * Lockable Front Deck Storage * Large Aerated Livewell in rear deck * 18 Gallon built-in Fuel Tank * (2) Stainless Steel Seat Bases * Heavy Duty 8 Gauge Trolling Motor Harness * Integrated Trolling Motor Bracket * Covered Fuel Tank Area * Flush Rear Deck * Running Light / Navigational Light Package * Xpress limited L I F E T I M E Hull Warranty",,5920497472,,18,,Xpress,https://maps.google.com/?q=loc%3A+%37%31%35+Ramsey+St+Fayetteville+NC+US,Xplorer 18 CC,$19999,power, (A.K. McCallum),2017 Xpress Xplorer 18 Center Console,https://fayetteville.craigslist.org/bod/5920497472.html,2017
42,,,2016-12-15 11:21,"2016 homemade pontoon boat built in cooler (will include for full asking price) can install umbrella all you need is oars or a trolling motor Moving, Need gone by sunday, make offers",,5893306676,,12,,,,,$150,human, (raeford),pontoon boat,https://fayetteville.craigslist.org/boa/5893306676.html,
43,good,[],2016-12-15 10:07,"For sale is one 1996 Javelin bass boat with a 225 Johnson motor. Boat and motor in good condition. It has a Lowrance 7 fish finder GPS on console and a Humminbird Helix 5 on front. It has a 82lb thrust motor guide trolling motor. Carpet and seats in new condition. Garaged kept. Has a few stress marks in fiberglass but nothing major. Boat is 20 years old but still looks and runs great. Will consider trades, what u got. No junk.",,5920206288,,20,,Javelin,https://maps.google.com/?q=loc%3A+%34%36%31%31+Lumberton+NC+US,400T,$8600,power, (Lumberton),Javelin Bass Boat,https://fayetteville.craigslist.org/boa/5920206288.html,1996
44,excellent,"['34.808300', '-79.163600']",2016-12-15 09:15,2008 Triton Explorer Bass Boat 17' 70lbs Minn Kota Trolling Motor (Both Trolling Batteries recently replaced) 90 HP 4 Stroke Mercury Outboard GPS mounted in Console along with memory card Custom Fit Triton Boat Cover Brand New 4-Blade Stainless Steel Trophy II Propeller Single Axle Trailer (Both tires in Great Condition) Comes with Spare Tire Bow and Stern Triton seats included All electronics function properly Lowrance Fish Finder If interested I will send more detailed pictures.,,5920195710,34.808300,17,-79.163600,Triton,"https://maps.google.com/maps/preview/@34.808300,-79.163600,16z",17,$13500,power, (Red Springs),2008 Triton 17 Explorer,https://fayetteville.craigslist.org/boa/5920195710.html,2008
45,excellent,,2016-12-14 20:10,"Hi!  If you're looking for the most affordable, most fun, and one of the FASTEST skis on the water...This is the one for YOU! (I know, I have Two!)  Considered to be one of the fastest straight-line skis ever built, the Yamaha 1100 triple Waveraider is highly sought after by go-fast folks everywhere!  Dollar for dollar, this is THE fastest ski for the money..PERIOD!  I have seen 70 MPH on this ski, and I weigh close to 200 pounds! Run in fresh water only, (Jordan Lake) This particular ski is mostly stock, which means parts are available, should you need them!  It's been very dependable, and FUN, but I have other things that need attention, so it's up for sale!  I'm only asking $1500.00 for it and an aluminum Triton trailer!  Don't miss your chance!  Call, DO NOT TEXT: show contact info anytime!  Skis like this one easily bring $2000.00 to $2500.00 in this shape, but I need to move it, so my loss is your gain!  Don't wait, or you'll be too late!  Bring CASH, and talk some trash!  Then head for the LAKE!  ***May take Radial R/C Airplane engine or Cab-Over Truck as trade or part-trade, depending on condition and engine.***  Thanks!  Keywords:  Waverunner, Seedoo, Polaris, Rotax, Kawasaki, Honda, Jet, Boat.",120,5919781062,,11,,Yamaha,,Waveraider 1100,$1500,power, (Sanford),***Super-Fast Yamaha 1100 WaveRaider  Jetski!  May Trade!***,https://fayetteville.craigslist.org/boa/5919781062.html,1996
46,fair,,2016-12-14 16:02,North American S-22 Fiberglass Boat (fair condition) and 2004 Johnson 175 HP outboard now needs a little work to use.  Approximately 8-10 year old  aluminum trailer. Paint on Hull.Some cleaning of boat and re-conditioning of gas engine to do,650,5919449839,,22,,Johnson,,Outboard,$2450,power, (Shallotte),North American S-22 and 175 OB,https://fayetteville.craigslist.org/boa/5919449839.html,2004
47,excellent,"['35.058300', '-79.008000']",2016-12-14 14:20,1998 sun bird boat engine and trailer runs great ready for fishing this is a fiberglass 20 foot boat no wood or carpet there is nothing wrong with the boat  or the trailer or engine low ball price will not be return so don't offer if you looking for great boat it has to wash down systems live well 2 fish storage up front of the boat new depth finder   call when ready to buy call show contact info,,5878737876,35.058300,20,-79.008000,,"https://maps.google.com/maps/preview/@35.058300,-79.008000,16z",,$5500,power, (fayetteville nc hope mills),1998 boat trailer sun bird best offer must sell,https://fayetteville.craigslist.org/boa/5878737876.html,
48,fair,[],2016-12-14 08:37,"show contact info OR show contact info NO TEXT PLEASE(HOME PHONE) '86 Glasstream Bass boat, '81 outboard Mariner 80 horsepower. The engine and wiring, cables, ignition box, lock box, water pump, trigger, stater, gas line, tank, trim and starter... everything gone through and fixed or replaced. Comes with Minn Kota 45lb thrust bow mounted foot controlled trolling motor with it's own battery. Garmin fish/depth/temp/speed finder both only used one season, motor has no hours since went through.Have title for boat but not trailer, never have and I was pulled once for a flat on the trailer and the H.P. didn't mention no tag on trailer. $2800",,5890989256,,15,,GLASSTREAM,https://maps.google.com/?q=loc%3A+%32%31%39%32%31+KATAWBA+DRIVE+LAUREL+HILL+NC+US,,$2450,power, (LAUREL HILL),1986 GLASSTREAM BASS BOAT,https://fayetteville.craigslist.org/boa/5890989256.html,1986
49,good,,2016-12-14 07:23,"1997 Yamaha Exciter 220. Cranks and runs great. Used very little, Interior discolored slightly but has no tears. Has Bimini Top and Cover. Only selling due to upgrading to larger boat. This boat pulls skiers and tubers great. Asking $3,200 or best offer. show contact info",,5894726417,,17,,Yamaha,,Exciter 220,$3200,power, (Lumerton),1997 Yamaha Exciter 220,https://fayetteville.craigslist.org/boa/5894726417.html,1997
50,,,2016-12-13 18:11,"Super Sale Price 1963 Evinrude 5.5hp. $300. Has not been repainted shows scratches on outside. Under hood is very clean. Short shaft recoil start. This is newer style with fuel pump. Takes single line tank. Motor has been fully serviced, new water pump and oil. Carburetor rebuilt, new spark plugs. Starts easy runs great. Also have several Vintage Duel line tanks that have been fully refurbished with new hoses and seals and gaskets.  $100. each. Also have several lower units for 15hp Evinrude Johnson 1974 thru 1985. Also lower units for 20 & 25hp motors. Plus Many new parts, Impellers Carburetor Kits, Seals, Points, condensers coils and spark plugs. Also bulk spark plug wire and motor gasket sets. Recoil starters for Evinrude Johnsons. (3) Electric starter brackets for converting motors to electric start. (2) New electric starters. PLUS many more to numerous to list. Everything will be sold below retail. Call daily noon until 5pm and Sunday afternoons Until 5pm. show contact info NO TEXT",,5882216720,,14,,,,,,power,,OUTBOARDS Closeout ONLY (1) Left,https://fayetteville.craigslist.org/boa/5882216720.html,
51,excellent,[],2016-12-13 17:36,Yamaha 40 HP 2000 20 inch  shaft tilt trim 3 cylinder low hour motor run great 2 stroke,50,5918221739,,20,,Yamaha 40,https://maps.google.com/?q=loc%3A+%31%33%30+bypass+Fairmont+NC+US,,$4000,power,,Yamaha 40hp,https://fayetteville.craigslist.org/boa/5918221739.html,2000
52,,"['35.001900', '-78.936400']",2016-12-13 13:45,like new motor new power head 0 time 25'' call wayne show contact info,,5913103085,35.001900,25,-78.936400,,"https://maps.google.com/maps/preview/@35.001900,-78.936400,16z",,$8500,power, (fayetteville nc),2010 etec 150 hp,https://fayetteville.craigslist.org/boa/5913103085.html,
53,like new,"['35.001900', '-78.936400']",2016-12-13 13:40,1754 allweld cc boat 60 hp tilt&trim troiling motor gps depth finder  call wayne waynes boat & motor show contact info or show contact info,20,5917850499,35.001900,17,-78.936400,allweld,"https://maps.google.com/maps/preview/@35.001900,-78.936400,16z",1754,$7500,power, (fay nc),2013 allweld boat,https://fayetteville.craigslist.org/boa/5917850499.html,2013
54,like new,"['35.001900', '-78.936400']",2016-12-13 13:39,1754 allweld cc boat 60 hp tilt&trim troiling motor gps depth finder  call wayne waynes boat & motor show contact info or show contact info,20,5917849462,35.001900,17,-78.936400,allweld,"https://maps.google.com/maps/preview/@35.001900,-78.936400,16z",1754,$7500,power, (fay nc),2013 allweld boat,https://fayetteville.craigslist.org/boa/5917849462.html,2013
55,like new,"['34.629300', '-79.008300']",2016-12-13 13:03,Selling my boat due to divorce. Call or text with any questions. Thanks,,5917785780,34.629300,12,-79.008300,Crow,"https://maps.google.com/maps/preview/@34.629300,-79.008300,16z",,$900,power,,2 man crow boat,https://fayetteville.craigslist.org/boa/5917785780.html,
56,,[],2016-12-13 10:08,"I hate to sale it but my wife wants a camper will trade for nice camper no fifth wheels please.  august it is registered in tell Oct. 2017  please don't text and waste my time this something I don't want to have to sale. but forced to. this bay liner is not your everyday boat I have spent thousand dollars to update this boat I made it into a fishing/pleasure boat. all new stuff. rebuilt motor never been in the salt since rebuilt only cape fear. river replaced everything on motor. added inline hp fuel filters. added a sensor  both temp and water on block for telltale water.rebuilt lower unit. lower gear and all new water pump ass. new fuel tanks. and replaced lines . added brand new serrria gauges. never had gauges since new. on broad battery charger added trolling motor. wired to switch and fused all new wiring and everything fused. added fire system all new safety on broad. brand new kill switch and added very nice  digital panel. switch panel with built in battery volt warning. and volt reading. added expensive front in bow area a adjustable fishing seat. swivel. can remove seat to have more seating. when pleasure riding. added 2nd battery. added extra compartments that have latches. new tie downs. new carpet. added side glass's fishing pole holders front and rear. brand new allowance 4 fish finder new gear ready nothing to do, also the trailer updated' bearing wiring running lights/ new winch rope. added a wheel around jack on this trailer are boat was bought from Sanford NC I have kept in covered and garaged",14,5875734621,,16,,bayliner capri,https://maps.google.com/?q=loc%3A+old+folkestone+rd+Holly+Ridge+NC+US,,$2800,power,,1991 bayliner capri boat out broad,https://fayetteville.craigslist.org/boa/5875734621.html,1991
57,excellent,"['34.953600', '-78.935400']",2016-12-12 18:36,"Center Console Palm Beach 171 17FT, New Lowrance Hook 5 GPS Fish Finder, VHF Radio w/4 ft whip, 115 Mercury, Tops out about 43 MPH on GPS. All Coast Guard required equipment included.",,5916853361,34.953600,17,-78.935400,Palm Beach,"https://maps.google.com/maps/preview/@34.953600,-78.935400,16z",171,$5000,power, (Hope Mills),1999 PALM BEACH 171,https://fayetteville.craigslist.org/boa/5916853361.html,1999
58,,"['35.160600', '-78.724900']",2016-12-12 13:43,10 FT ALUMINUM FLAT BOTTOM JOHN BOAT WITH YOUR CHOICE OF EITHER NEW TROLLING MOTOR AND NEW PADDLES $250 PLEASE CALL MAC AT show contact info ANYTIME . DO NOT ANSWER TEXT OF EMAIL PHONE CALLS ONLY THANK YOU,,5910250938,35.160600,10,-78.724900,,"https://maps.google.com/maps/preview/@35.160600,-78.724900,16z",,,human,,10ft JOHN BOAT,https://fayetteville.craigslist.org/boa/5910250938.html,
59,excellent,,2016-12-12 11:46,1995 Godfrey Conversion(Sweetwater)24 ft. Pontoon Boat for sale.It has an 85 HP Yamaha motor and a Motor Guide trolling motor.The upholstery and carpet have been replaced.This would make a fantastic Christmas gift!,,5916182781,,24,,Godfrey Conversion,,,$6500,power,,1995 Godfrey Conversion(Sweet Water) Pontoon boat,https://fayetteville.craigslist.org/boa/5916182781.html,1995
60,good,"['35.017864', '-78.614130']",2016-12-11 22:17,great boat ss prop many extras,,5915629683,35.017864,17,-78.614130,triton,"https://maps.google.com/maps/preview/@35.017864,-78.614130,16z",170,$5500,power, (autryville),2001 triton 170,https://fayetteville.craigslist.org/boa/5915629683.html,2001
61,good,"['35.062583', '-78.834641']",2016-12-11 21:23,"2005 carolina skiff 178dlx, new trailer. 24.7 hours on motor, 2011 90hp  suzuki 4 stroke",247,5881517000,35.062583,17,-78.834641,carolina skiff,"https://maps.google.com/maps/preview/@35.062583,-78.834641,16z",178DLX,$9000,power, (Eastover),carolina skiff,https://fayetteville.craigslist.org/boa/5881517000.html,2005
62,like new,"['34.629300', '-79.008300']",2016-12-11 09:42,"2015 year model less than one year old War Eagle Stick steer model****total length is 17'7"" long****2016 Evinrude E-tec 60 HP motor with 5 year warranty still remaining on the motor**** Minn Kota Edge 45 lb. thrust trolling motor****Humming Bird Depth finder with water temp gauge***on board battery charger****storage and storage and more storage****the pictures speak for themselves****its $18000.00 or the BEST OFFER I get****NO calls after 9pm at night.",60,5877517122,34.629300,18,-79.008300,War Eagle,"https://maps.google.com/maps/preview/@34.629300,-79.008300,16z",DU 1754,$18000,power, (Lumberton),2015 War Eagle 1754 Ducks Unlimited Edition,https://fayetteville.craigslist.org/boa/5877517122.html,2015
63,excellent,"['35.025700', '-78.970500']",2016-12-10 16:03,"I have a 1986 Dixie Super Skier 199 boat, with a 350 chevy car motor in it for sale. It has brand new interior and seats, also comes with multiple lifevests, a two man tube and two boggie boards. Installed cd sterio player. Asking 3800.00or best offer.cash only no trades, need sold asap. Thank you and have a great day.",,5908992425,35.025700,199,-78.970500,Dixie,"https://maps.google.com/maps/preview/@35.025700,-78.970500,16z",199,$3800,power, (fayetteville nc),1986 Dixie Super Skier 199,https://fayetteville.craigslist.org/boa/5908992425.html,1986
64,salvage,"['35.013363', '-78.917704']",2016-12-10 15:45,Up load photos,,5914000832,35.013363,21,-78.917704,,"https://maps.google.com/maps/preview/@35.013363,-78.917704,16z",,$400,power, (Fayetteville),Boat for sale,https://fayetteville.craigslist.org/boa/5914000832.html,
65,like new,,2016-12-10 12:09,Need this inflatable boat gone ASAP.  I just don't have space for it anymore. I've used it maybe 5 times.  purchased for 200.,,5913658167,,7,,,,,$150,human, (Fort Bragg),Intex mariner 4.  Inflatable boat.,https://fayetteville.craigslist.org/boa/5913658167.html,
66,fair,,2016-12-10 01:52,Boat is well structured has some issues. Don't have enough time to work with it anymore. Text or call me at show contact info,,5913226935,,22,,,,,$2000,human,,1982 cabinet cruiser,https://fayetteville.craigslist.org/boa/5913226935.html,1982
67,,,2016-12-09 22:25,good shape call show contact info,,5913103417,,1,,,,,$500,power, (fayetteville nc),Yamaha out drive 4.3,https://fayetteville.craigslist.org/boa/5913103417.html,
68,good,"['33.965400', '-78.035900']",2016-12-09 20:14,1977 Bertram 264 FLYBRIDGE A RARE find ! Bertram 264 Flybridge cruiser in great condition. The hull shell shines nicely as it did many years ago. The upholstery is just fine too. Twin Mercruiser Fresh Water Cooled 165hp 6 cyl engines Low Hour. Custom Hardtop at Fly Bridge.Forward V berths are 6'4''. Port side settee and table also converts to a berth. Raymarine electronics including radar at both the lower helm and bridge. Underwater lights. She is in great condition both cosmetically and mechanically. Recent New 115 Gal stainless steel fuel Tank. Make Offer! Willing to trade for a bay boat of equal value. Call and let's make a deal!,,5912988897,33.965400,26,-78.035900,,"https://maps.google.com/maps/preview/@33.965400,-78.035900,16z",,$26900,power, (southport),1977 Bertram 264 FLYBRIDGE,https://fayetteville.craigslist.org/boa/5912988897.html,
69,,,2016-12-09 16:00,"I have a nice 21ft Malibu Sunsetter open bow for sale! Has the 350 mercrusier in it, runs really well, new water pump and carb has been rebuild. The enterior is in good shape and about 95% reupholstered, only lacking the engine cover! Has new carpet and new floor! Wakeboard tower with 4 wake speakers! Thanks for looking! $8,300obo",,5871743939,,21,,,,,$8300,power, (Fayetteville),1987 MALIBU SUNSETTER,https://fayetteville.craigslist.org/boa/5871743939.html,
70,,[],2016-12-09 09:13,A.K. has a new 2015 model Alweld 1648 LA equipped with a Yamaha F25 rope start long shaft four stroke outboard as well as a Load Rite galvanized trailer with tongue jack and drive on guides. This is a special closeout price with this package. A.K's Special Price $6399 If you have any questions contact A.K. McCallum Fayetteville NC (8006822628) A.K. also stocks over 150 different model Jon boats from 10 to 24 foot in length.,,5912010412,,16,,Alweld,https://maps.google.com/?q=loc%3A+%37%31%35+Ramsey+St+Fayetteville+NC+US,1648,$6399,power, (A.K. McCallum),2015 Alweld 1648 LA,https://fayetteville.craigslist.org/bod/5912010412.html,2015
71,excellent,[],2016-12-09 08:43,"9.9 evinrude 2 stroke tiller new points, plugs, condsors clesn carb. reset float new water pump new seals oil in lower uint comao for duck hunting starts easy runs strong call tom for inf. show contact info asking 560.00",,5911979060,,19,,,https://maps.google.com/?q=loc%3A+%31%34%35%31greenockave+fayetteville+NC+US,,$1,power, (fayetteville),outboardmotor,https://fayetteville.craigslist.org/boa/5911979060.html,
72,new,,2016-12-08 20:58,Brand new never been opened blue bimini boat top with hardware from a 195 lx Stingray boat.,,5911609849,,8,,,,,$200,power, (fayetteville nc),2013 195 lx Stingray Bimini top,https://fayetteville.craigslist.org/boa/5911609849.html,
73,like new,,2016-12-08 16:06,"PRICE LOWERED TO SELL!! Located in Sanford, North Carolina, this 23-foot used Centurion ENZO SS230 is a great wake/ski boat. Centurion are sleek, stylish and powerful, charting a new course, or launching riders off legendary wakes. Powered by a 343hp PCM EX 343 engine, this Centurion boat can get you to your favorite spot, or help you discover a new one. Expect clean, rampy wakes for wakeboarding with long transitions and huge landing zones. Surfers should look for Centurion's trademark swell with long pockets, plenty of power and size, and that just-right angle that works well for anything from popping airs on a surf-style board to surface spins on a skim board. From the Gladiator tower to the Clarion head unit with Wet Sounds speakers and the new, zero-learning-curve Micro Touch Screen and with only 73 hours, you will have the peace of mind that comes with a PCM in great condition. Only had 1 owner and it's easy to tell how well she has been cared for. This Centurion boat comes with a BoatMate double axle trailer, included in the price of the boat sale. The SS230 has lots of space for your family and friends, and all your boating gear. This boat boasts a cool CD stereo with rear platform controls (see pic). This boat is in GREAT condition and systems are working well! Priced to sell. See attached NADA appraisal and see just how easy it could be for you too to own an amazing boat like this and financing was super easy through USAA!",73,5911143771,,23,,Centurion,,SS230,$61000,power, (Sanford),PRICE LOWERED 2014 Centurion SS230 SURF Boat with ONLY 73 HOURS!!,https://fayetteville.craigslist.org/boa/5911143771.html,2014
74,like new,,2016-12-08 16:00,"PRICE LOWERED TO SELL!! Located in Sanford, North Carolina, this 23-foot used Centurion ENZO SS230 is a great wake/ski boat. Centurion are sleek, stylish and powerful, charting a new course, or launching riders off legendary wakes. Powered by a 343hp PCM EX 343 engine, this Centurion boat can get you to your favorite spot, or help you discover a new one. Expect clean, rampy wakes for wakeboarding with long transitions and huge landing zones. Surfers should look for Centurion's trademark swell with long pockets, plenty of power and size, and that just-right angle that works well for anything from popping airs on a surf-style board to surface spins on a skim board. From the Gladiator tower to the Clarion head unit with Wet Sounds speakers and the new, zero-learning-curve Micro Touch Screen and with only 73 hours, you will have the peace of mind that comes with a PCM in great condition. Only had 1 owner and it's easy to tell how well she has been cared for. This Centurion boat comes with a BoatMate double axle trailer, included in the price of the boat sale. The SS230 has lots of space for your family and friends, and all your boating gear. This boat boasts a cool CD stereo with rear platform controls (see pic). This boat is in GREAT condition and systems are working well! Priced to sell. See attached NADA appraisal and see just how easy it could be for you too to own an amazing boat like this and financing was super easy through USAA!",73,5911144046,,23,,Centurion,,SS230,$61000,power, (Sanford),PRICE LOWERED 2014 Centurion SS230 SURF Boat with ONLY 73 HOURS!!,https://fayetteville.craigslist.org/boa/5911144046.html,2014
75,like new,,2016-12-08 15:40,"PRICE LOWERED TO SELL!! Located in Sanford, North Carolina, this 23-foot used Centurion ENZO SS230 is a great wake/ski boat. Centurion are sleek, stylish and powerful, charting a new course, or launching riders off legendary wakes. Powered by a 343hp PCM EX 343 engine, this Centurion boat can get you to your favorite spot, or help you discover a new one. Expect clean, rampy wakes for wakeboarding with long transitions and huge landing zones. Surfers should look for Centurion's trademark swell with long pockets, plenty of power and size, and that just-right angle that works well for anything from popping airs on a surf-style board to surface spins on a skim board. From the Gladiator tower to the Clarion head unit with Wet Sounds speakers and the new, zero-learning-curve Micro Touch Screen and with only 73 hours, you will have the peace of mind that comes with a PCM in great condition. Only had 1 owner and it's easy to tell how well she has been cared for. This Centurion boat comes with a BoatMate double axle trailer, included in the price of the boat sale. The SS230 has lots of space for your family and friends, and all your boating gear. This boat boasts a cool CD stereo with rear platform controls (see pic). This boat is in GREAT condition and systems are working well! Priced to sell. See attached NADA appraisal and see just how easy it could be for you too to own an amazing boat like this and financing was super easy through USAA!",73,5901621150,,23,,Centurion,,SS230,$61000,power, (Sanford),PRICE LOWERED 2014 Centurion SS230 SURF Boat with ONLY 73 HOURS!!,https://fayetteville.craigslist.org/boa/5901621150.html,2014
76,good,,2016-12-08 09:58,cabin cruiser for sale runs good needs a little TLC to make right dose not have a trailer the trailer that's under it now is a used trailer and is rusted,,5888568311,,26,,bayliner,,,$2000,power, (Parkton nc),Bayliner,https://fayetteville.craigslist.org/boa/5888568311.html,
