,condition,coord_pair,date,description,engine hours (total),id,lat,length overall (LOA),long,make / manufacturer,map_URL,model name / number,price,propulsion type,region,title,url,year manufactured
38,good,"['35.207200', '-80.956800']",2016-12-20 10:42,We have two arm rest that are up for sale. They will need some re upholstering but other than that in great shape. Really can be used as they are if you choose to. Only asking $20.00 Call or Text show contact info Troy,,5923566383,35.207200,28,-80.956800,,"https://maps.google.com/maps/preview/@35.207200,-80.956800,16z",,$20,human, (Charlotte),Boat Arm Rests (2 total),https://charlotte.craigslist.org/boa/5923566383.html,
39,excellent,"['35.106500', '-81.220100']",2016-12-20 10:40,"Boat is a 1988 34' Avanti, a special model made by Bayliner. Boat has a 13 foot beam, largest in the market for a 34'. It was sold new on Lake Wylie and has been docked in a covered slip since new. Twin 454 engines low hours, mechanically good condition, with recent tune ups and oil changes. Has great shine, just buffed and waxed. Boat features central heat and air, bathroom, stove, refrigerator, ice maker, 32"" tv in salon, 19"" tv in master bedroom and central vacuum. A covered slip is available for a qualified buyer. The best season for big boat weekend getaways, is after Labor Day and throughout the winter.",500,5907711488,35.106500,34,-81.220100,Bayliner,"https://maps.google.com/maps/preview/@35.106500,-81.220100,16z",Avanti,$27000,power, (Lake Wylie),34' Avanti Cruiser Reduced price,https://charlotte.craigslist.org/boa/5907711488.html,
40,,,2016-12-20 09:57,"73 Evinrude tiller 9.5 hp, $ 350, come hear it run, show contact info",,5926716370,,1,,,,,$350,power, (Cornelius),Evinrude 9.5 hp,https://charlotte.craigslist.org/boa/5926716370.html,
41,,[],2016-12-20 09:50,2012 215 HP Supercharged 4-Stroke Engine Digital dash and gauges Swim platform with 2-step ladder Walk-through to swim platform Dual rearstorage Removable cooler understern seat Full wraparound glass windshield Dual covers Trailer Very Low Hours!!! Call Paul with any questions show contact info,,5895938012,,18,,Sea Doo,https://maps.google.com/?q=loc%3A+%35%35+Hudson+Ave+Freeport+NC+US,Challenger 180,$17500,power, (Freeport),Sea Doo 18' Challenger,https://charlotte.craigslist.org/boa/5895938012.html,2012
42,,"['36.318900', '-80.148400']",2016-12-20 09:33,i have 1 aluminum single axle torsion  will hold atleast 19 ft boat no title came from south carolina 825  2nd trailer will hold 18ft need 1 fender tire have title  650     alan show contact info,,5906055023,36.318900,22,-80.148400,,"https://maps.google.com/maps/preview/@36.318900,-80.148400,16z",,,power,,two aluminum trailers for see hold 18 ft 19 ft boats,https://charlotte.craigslist.org/boa/5906055023.html,
43,,"['36.318900', '-80.148400']",2016-12-20 09:32,have nice aluminum trailer will hold up to 28 ft boat tandem with galvanized wheel in great shape still has boat on it rite now should have off tommorow have title in hand alan show contact info,,5918781444,36.318900,30,-80.148400,,"https://maps.google.com/maps/preview/@36.318900,-80.148400,16z",,$2600,power, (walnut cove),have nice aluminum trailer will hold up to 28 ft boat,https://charlotte.craigslist.org/boa/5918781444.html,
44,like new,"['35.483700', '-80.989800']",2016-12-20 09:28,BEAUTIFUL LIKE NEW! 2015 Bennington Pontoon Boat.  Only 41 hours. a 2015 EZ Loader trailer is included in the price.   115 hp four stroke yamaha motor. All aluminum under decking for smoother ride. Please call for more details show contact info Located in Denver NC. This is BY OWNER not dealer.,417,5903748071,35.483700,24,-80.989800,Bennington,"https://maps.google.com/maps/preview/@35.483700,-80.989800,16z",24 SCWX,$35000,power, (Denver),2015 Bennington Pontoon Boat 24ft  w/trailer,https://charlotte.craigslist.org/boa/5903748071.html,2015
45,,"['35.017800', '-80.537200']",2016-12-20 09:24,Excellent Christmas gift for next season! 1997 Seadoo SPX 787 jetski - excellent condition with nice cover and custom seat cover - compression 150/cyl - no trailer-  $1000/obo - contact Mike show contact info Jetski jet ski Seadoo sea doo sea-doo wave runner waverunner pwc,,5913474206,35.017800,10,-80.537200,,"https://maps.google.com/maps/preview/@35.017800,-80.537200,16z",Mike Hall,$1000,power, (Weddington),1997 Seadoo SPX jet ski - Christmas Deal,https://charlotte.craigslist.org/boa/5913474206.html,1997
46,excellent,"['35.106500', '-81.220100']",2016-12-20 09:13,2006 Triton DS 1756 garage kept Gun box Minn Kota foot controlled 55lb 2 batteries 3 seats Lowrance depth finder Mossy oak factory camo paint 2006 mercury 50 hp 2006 trail star,75,5926662981,35.106500,17,-81.220100,Mercury,"https://maps.google.com/maps/preview/@35.106500,-81.220100,16z",50,$8000,power, (Lake Wylie),2006 triton duck special,https://charlotte.craigslist.org/boa/5926662981.html,2006
47,,"['35.584000', '-80.868500']",2016-12-20 09:08,"custom sunbrella cover, 2010 galvanized bunk trailer, 60hp evinrude, bimini top, very good condition always stored and covered. need gone asap, please text or call, 980- seven two two- 9366 $15900 OBO- best offer takes it with cash!",,5926658132,35.584000,24,-80.868500,,"https://maps.google.com/maps/preview/@35.584000,-80.868500,16z",,$15900,power, (mooresville),"Bennington 2004 2575rl Pontoon $15,900 OBO",https://charlotte.craigslist.org/boa/5926658132.html,
48,,"['35.584000', '-80.868500']",2016-12-20 09:08,"comes with the wheel dolly as well, great condition, need gone asap,$2300 OBO 980- seven two two- 9366",,5926657865,35.584000,1,-80.868500,,"https://maps.google.com/maps/preview/@35.584000,-80.868500,16z",,$2300,human, (mooresville),HOBIE MIRAGE OASIS KAYAK $2300 OBO,https://charlotte.craigslist.org/boa/5926657865.html,
49,excellent,,2016-12-20 09:07,"HULL GREAT SHAPE,STORAGE,LIVE-WELL,TROLLINGMOTOR,CLEAN SEATS,YES NEW FLOORS&CARPET,1991 FORCE 70HP MOTOR JUST REBUILT-NEW PISTONS RUNS EXCELLENT GOT PAPERS MY NEIGHBOR IS THE MECHANIC FOR 36YRS,1985 TRAILER NEW TIRES,ALL LITES WORK,CALL RONNIE show contact info",,5926656994,,16,,SUNBIRD,,FIBERGLASS,$2700,power, (CHARLOTTE),$$$ REDUCED 1985 SUNBIRD FIBERGLASS 16FT W/70HP $$$,https://charlotte.craigslist.org/boa/5926656994.html,1985
50,good,,2016-12-20 08:42,"Great blue sit on top Wilderness Systems Tarpon 160 Kayak 16 ft. for fun and fishing including paddle! $890 OBO Great boat for using in large open waters, ocean and also for river. The Kayak has: - 2 great dry storage - very comfortable seating - rod holders - only garage kept Please send me an email or TEXT me show contact info I only take cash! tags: kayak, sit on top, fishing kayak, wilderness systems, tarpon, fishing, bass, bass yak bassyak, bassyaks, trolling motor, electric motor, kayak motor",,5920484278,,16,,Wilderness System,,Tarpon 160,$890,human, (Charlotte),Wilderness System Tarpon 160 Kayak,https://charlotte.craigslist.org/boa/5920484278.html,
51,excellent,[],2016-12-20 08:42,"Great blue sit on top Wilderness Systems Tarpon 140 Kayak 14 ft. for fishing! $2100 OBO With Bass Yak Systems trolling motor for very comfortable fishing and new GARMIN depth finder! Great boat for fishing in large open waters, ocean and also for river. - Bassyaks Systems are the most Adjustable and Maneuverable, and quietest Trolling Motor systems in the world! - NO PADDLING, PERFECT for fishing. - no more hitting the line with the paddle. - No longer is the paddle in the way while landing a fish. - Bass Yak systems motors can be removed in 10 seconds, great for transporting or if you wish to paddle. - Bass Yak systems are truly ""hand free"" there is no need to keep a hand on the rudder lever; you steer with your feet. - a battery takes about 4-6 hours - It has a vertical adjustment which will allow you to run the motor above the keel or to a depth of 20″, your keel will drag before our motor will. - With a horizontal adjustment 90 degrees, which allows you to run the motor straight down or as a surface prop with 9 positions in between. - It also allow you to raise and lower the motor from the seat, whether to clear off weeds or to glide up onto the beach, you'll have full control of the motor. The motor will ""kick up"" if an underwater object is struck, pull the lever and the motor will drop back down. The Kayak has: - great dry storage for stuff and battery - very comfortable seating - 4 rod holders - only garage kept Please send me an email or TEXT me show contact info I only take cash! you can view videos of the Bass Yak Systems on you tube: https://www.youtube.com/watch?v=jd3ViKZKlt8 tags: kayak, sit on top, fishing kayak, wilderness systems, tarpon, fishing, bass, bass yak bassyak, bassyaks, trolling motor, electric motor, kayak motor",,5920485869,,14,,Wilderness System,https://maps.google.com/?q=loc%3A+%39%36%32%30+Charlotte+NC+US,Tarpon 140,$2100,power, (Charlotte Ballantyne),Wilderness System Tarpon 140 Kayak + Bass Yak elec. motor,https://charlotte.craigslist.org/boa/5920485869.html,
52,excellent,,2016-12-20 08:42,"For Sale awesome Mariah Shabah 180 with 4.3 V6 Mercruser, excellent condition and ready for water. Clear title in hand. Asking $8700 OBO Very clean, excellent condition! Perfect for water ski, tubing, fishing or relax. Matching custom trailer with good tires. Selling because we are looking at purchasing a bigger boat. It has been maintained (new oil, oil filter, fuel filter, power steering oil, hydraulic oil, etc.) Details: White with green accents Length: 18' 4.3 Mercruiser Alpha one gen 2 Upholstery like new Fast boat (40 mph +), great handling Lots of storage compartments Custom trailer with good tires. Cash and Carry - please email or text only show contact info tags: boat, boot, fishing, water, water ski, tubing, ski, mariah, maria, shabah, shaba",,5918824966,,18,,Mariah,,Shabah 180,$8700,power, (Charlotte),RARE-Mariah Shabah 4.3 Mercruiser with trailer ready for water!,https://charlotte.craigslist.org/boa/5918824966.html,1996
53,,"['36.369800', '-80.710100']",2016-12-20 08:15,"I am renting my boat slip located at Mid-Way Mariner off hwy 150. I am moving my boat to Southport and no longer need this slip. Electric and water available, my lease expires in April. Rental is $875 for 5 months. My boat is a 28' cabin cruiser thanks Richard would entertain a reasonable offer",,5923679254,36.369800,28,-80.710100,,"https://maps.google.com/maps/preview/@36.369800,-80.710100,16z",,,power,,Boat slip rental,https://charlotte.craigslist.org/boa/5923679254.html,
54,,"['35.017800', '-80.537200']",2016-12-20 08:07,2004 Seadoo GTI - excellent condition inside and out - 3 passenger ski - 2 stroke 720 engine with perfect compression -  looks and runs perfect - includes factory Seadoo cover - always stored indoors and freshwater use only - no trailer included but have Single or Double available for separate purchase - valid title in hand $2000 firm - no trades - contact Mike show contact info Jetski jet ski Seadoo sea doo waverunner wave runner pwc Kawasaki,,5923066594,35.017800,11,-80.537200,,"https://maps.google.com/maps/preview/@35.017800,-80.537200,16z",Mike,$2000,power, (Weddington),2004 Seadoo GTI Excellent Condition,https://charlotte.craigslist.org/boa/5923066594.html,2004
55,,"['35.249500', '-81.133000']",2016-12-20 08:03,"***NOTICE*** When you contact me, please include where you are located, and the soonest you can pickup the item. All transactions will take place in a public place, cash only, no checks or wires. Item locations may vary, extra images and information can be provided within 24 hours (generally) of contacting me. Aqua Patio Pontoon. 20' Boat, motor is good, but it needs a foot. Includes a trailer. Has some cosmetic defects, but nothing a little TLC can't fix. If you are interested make me an offer, if it is reasonable I will contact you and discuss it further!",,5926601027,35.249500,20,-81.133000,,"https://maps.google.com/maps/preview/@35.249500,-81.133000,16z",,,power,,Aqua Patio,https://charlotte.craigslist.org/boa/5926601027.html,
56,,"['35.249500', '-81.133000']",2016-12-20 08:03,"***NOTICE*** When you contact me, please include where you are located, and the soonest you can pickup the item. All transactions will take place in a public place, cash only, no checks or wires. Item locations may vary, extra images and information can be provided within 24 hours (generally) of contacting me. 1975 Glastron Sportster. 6 Cylinder Chevy inline motor, motor runs well but has a leak in the outdrive. Boat could use some cosmetic fixes, but is in ""OK"" condition. Does include a trailer. If you are interested make me an offer, if it is reasonable I will contact you and discuss it further!",,5926600903,35.249500,21,-81.133000,,"https://maps.google.com/maps/preview/@35.249500,-81.133000,16z",,,power,,1975 Sportster,https://charlotte.craigslist.org/boa/5926600903.html,
57,,,2016-12-20 08:02,"BAJA 18' Bass Boat , 150 H.P. Mariner outboard engine , power tilt and trim , 2 live wells , rod holders , Humminbird Super Sixty depth finder , Minn Kota auto pilot 42 lb. thrust trolling motor ,  Galaxy trailer with new tires and wheels , new boat winch . $ 3200. or possible trade . call show contact info",,5895559761,,18,,BAJA,,,,power,,18' BAJA Bass Boat,https://charlotte.craigslist.org/boa/5895559761.html,
58,,"['35.249500', '-81.133000']",2016-12-20 07:55,"***NOTICE*** When you contact me, please include where you are located, and the soonest you can pickup the item. All transactions will take place in a public place, cash only, no checks or wires. Item locations may vary, extra images and information can be provided within 24 hours (generally) of contacting me. Kayat 20' Pontoon. Has a 75HP Mercury motor on it, but the motor is shot and may or may not be repairable. Does not have a trailer, but we can provide delivery if you cannot find a trailer to haul it out with. If you are interested make me an offer, if it is reasonable I will contact you and discuss it further!",,5926596106,35.249500,20,-81.133000,,"https://maps.google.com/maps/preview/@35.249500,-81.133000,16z",,,power,,Kayat Pontoon,https://charlotte.craigslist.org/boa/5926596106.html,
59,,"['35.249500', '-81.133000']",2016-12-20 07:55,"***NOTICE*** When you contact me, please include where you are located, and the soonest you can pickup the item. All transactions will take place in a public place, cash only, no checks or wires. Item locations may vary, extra images and information can be provided within 24 hours (generally) of contacting me. 24"" Pontoon, unknown make/model. Has a 75HP motor, but it is shot and may or may not be repairable. Does not have a trailer, but we can deliver it if need be. If you are interested make me an offer, if it is reasonable I will contact you and discuss it further!",,5926596087,35.249500,24,-81.133000,,"https://maps.google.com/maps/preview/@35.249500,-81.133000,16z",,,power,,24' Pontoon,https://charlotte.craigslist.org/boa/5926596087.html,
60,,"['35.249500', '-81.133000']",2016-12-20 07:55,"***NOTICE*** When you contact me, please include where you are located, and the soonest you can pickup the item. All transactions will take place in a public place, cash only, no checks or wires. Item locations may vary, extra images and information can be provided within 24 hours (generally) of contacting me. 1996 SeaDoo for parts. Engine is locked up, but the ski has alot of aftermarket high performance parts on it that can easily be salvaged and used on other skis. Does include a decent trailer. If you are interested make me an offer, if it is reasonable I will contact you and discuss it further!",,5926596070,35.249500,12,-81.133000,,"https://maps.google.com/maps/preview/@35.249500,-81.133000,16z",,,power,,96 Sea Doo,https://charlotte.craigslist.org/boa/5926596070.html,
61,,"['35.249500', '-81.133000']",2016-12-20 07:55,"***NOTICE*** When you contact me, please include where you are located, and the soonest you can pickup the item. All transactions will take place in a public place, cash only, no checks or wires. Item locations may vary, extra images and information can be provided within 24 hours (generally) of contacting me. 1996 Polaris SL750. Ran well before it was put into storage, but has a good bit of cosmetic defects from sitting outside at the boat yard for a while. Does not currently have a trailer, but we can find one for an increase in price, or deliver it, if need be. If you are interested make me an offer, if it is reasonable I will contact you and discuss it further!",,5926596054,35.249500,12,-81.133000,,"https://maps.google.com/maps/preview/@35.249500,-81.133000,16z",,,power,,96 Polaris Jet Ski,https://charlotte.craigslist.org/boa/5926596054.html,
62,,"['35.249500', '-81.133000']",2016-12-20 07:46,"***NOTICE*** When you contact me, please include where you are located, and the soonest you can pickup the item. All transactions will take place in a public place, cash only, no checks or wires. Item locations may vary, extra images and information can be provided within 24 hours (generally) of contacting me. 74 Starcraft Ski boat. Boat does not have a motor, but does have a trailer. The boat is in ""OK"" condition, with a few areas that could use a little bit of work to get it back up to ready to go status. If you are interested make me an offer, if it is reasonable I will contact you and discuss it further!",,5926589885,35.249500,21,-81.133000,,"https://maps.google.com/maps/preview/@35.249500,-81.133000,16z",,,power,,74 Starcraft Ski boat,https://charlotte.craigslist.org/boa/5926589885.html,
63,fair,"['35.249500', '-81.133000']",2016-12-20 07:44,"***NOTICE*** When you contact me, please include where you are located, and the soonest you can pickup the item. All transactions will take place in a public place, cash only, no checks or wires. Item locations may vary, extra images and information can be provided within 24 hours (generally) of contacting me. Catfish boat, fondly known as the ""Chicken Boat"". It is a 24' Pontoon, with a 15' Cabin. It is set on 4 full length aluminum pontoons. Has a dual coated fiberglass floor, that will not rot or break. It is set on a massive, custom built pontoon trailer, set on metal girders. It has a 75HP outboard, that was running when it was put into storage, a little TLC and it should run. If you are interested, make me an offer, if it is reasonable I will get in contact with you to discuss it further and to answer any question you might have.",,5926588638,35.249500,24,-81.133000,,"https://maps.google.com/maps/preview/@35.249500,-81.133000,16z",,,power,,"""Catfish"" Pontoon Boat",https://charlotte.craigslist.org/boa/5926588638.html,
64,good,,2016-12-20 07:10,1990 Donzi Black Widow Z24. Sleek fast and beautiful. Locked up 454. Trim tabs. Through hull captain's call exhaust. OMC King Cobra out drive. Sony sound. Cool V berth. Full cover.,,5906471444,,24,,Donzi,,Black Widow,$5000,power, (Gastonia),Donzi Black Widow,https://charlotte.craigslist.org/boa/5906471444.html,1990
65,good,,2016-12-20 06:02,"Nice 1995 wave runner jet ski $750.   $900 with trailer. Runs great. Goes about 35 mph. I have Title for Ski but no Title for trailer. Cash or trade for a motorcycle, or Jon boat. Call or text. show contact info",,5926543724,,1,,,,,$750,power, (Belmont),WAVE-RUNNER JET-SKI,https://charlotte.craigslist.org/boa/5926543724.html,1995
66,fair,,2016-12-20 05:54,Has a repair but no leaks.,,5926541331,,12,,Perception,,Dancer,$125,human, (midland),kayak,https://charlotte.craigslist.org/boa/5926541331.html,
67,excellent,"['35.604566', '-80.904465']",2016-12-20 05:02,"This boat is in great shape the interior is in excellent shape, I am the second owner it spent all it's life in dry stack storage! 190hp Mercruiser with new starter installed today! two batteries with off switch, Brand new bimini top, cover and wesco trailer. Everything works, this boat has been very well taken care of. WILL NOT RESPOND TO ""IS IT STILL AVAILABLE""!",,5898847812,35.604566,18,-80.904465,,"https://maps.google.com/maps/preview/@35.604566,-80.904465,16z",,$2900,power, (Mooresville),87 Regal Sebring & Trailer,https://charlotte.craigslist.org/boa/5898847812.html,
68,,"['34.851100', '-80.002500']",2016-12-20 04:30,"1973 14ft fiberglass Jon Boat with running (needs carb cleaned) 15hp a chrysler motor and foot controlled trolling motor with batteries and clear titles boat, trying to locate trailer title. No title for motor as NC doesn't require/issue them. Make a realistic offer and I will get back with you.",,5897006400,34.851100,14,-80.002500,,"https://maps.google.com/maps/preview/@34.851100,-80.002500,16z",,,power,,14' John Boat with Trailer and Motors,https://charlotte.craigslist.org/boa/5897006400.html,
69,excellent,"['34.522600', '-82.896300']",2016-12-20 01:45,I have a lower unit for a 25 hp four stroke mercury and Yamaha 2003 model 20 inch shaft ready to use excellent condition will fit other hp also call show contact info or show contact info,,5926468184,34.522600,20,-82.896300,,"https://maps.google.com/maps/preview/@34.522600,-82.896300,16z",,$400,power, (townville),25 hp mercury yamaha four stroke lower unit,https://charlotte.craigslist.org/boa/5926468184.html,2003
70,like new,"['34.522600', '-82.896300']",2016-12-20 01:37,I have a lower unit for 40 hp Yamaha great condition ready to use 20 inch shaft call show contact info or show contact info,,5926464866,34.522600,20,-82.896300,,"https://maps.google.com/maps/preview/@34.522600,-82.896300,16z",,$400,power, (townville),40 hp yamaha lower unit clean ready to use,https://charlotte.craigslist.org/boa/5926464866.html,
71,,"['35.270400', '-80.421100']",2016-12-20 01:06,"Has tralier, Yamaha 25 horse motor, and mini koda 40 pound thrust trolling motor with 5 speeds.",,5909618119,35.270400,14,-80.421100,,"https://maps.google.com/maps/preview/@35.270400,-80.421100,16z",,$1500,power, (Locust),14ft flat bottom john boat,https://charlotte.craigslist.org/boa/5909618119.html,
72,excellent,,2016-12-20 01:00,"2003 Triton 170V Magnum II 2003 Mercury 75 HP Four Stroke (Just tuned up, starts and runs like new), New SS prop (This is a Yamaha 4-stroke made for Mercury) 2003 Triton custom boat trailer w/spare, stainless boat buckles 2003 Minnkota foot pedal trolling motor NEW In dash Humminbird 688 HD GPS/depth finder NEW on board battery charger NEW Bimini Top NEW batteries, (Marine Cranking and deep cycle) OVERSIZED road storage (holds 8 Â½ foot rods) Oversized Live well 18 Gallon Fuel tank New Carpet and New top of the line bench seat Built in tackle storage, lots of storage compartments The boat is turnkey perfect and everything works as new. Garage stored, freshwater used, would make a nice Bay Boat as well as a Bass Boat. The Magnum II series was Tritons top of the line aluminum bass boat. 170 Mag II features Triton's proven Pad-Vee hull design for breathtaking performance. And unlike the competition's flimsy ""entry level"" boats, this all-welded, wood-free rig has a .100-gauge hull and comes loaded. I can e-mail more photos upon request. $8,900 firm. show contact info",,5909403345,,17,,Triton,,170V Mag II,$8900,power," (Hendersonville, NC)","2003 Triton 170V Mag II Bass Boat, 75HP 4-Stroke",https://charlotte.craigslist.org/boa/5909403345.html,2003
73,excellent,"['34.522600', '-82.896300']",2016-12-20 00:58,I have a 2006 model four stroke mercury Yamaha block powerhead with crank rods and pistons ready to install like new very low hours will fit all four stroke mercury Yamaha 4 cylinder 75 80 90 100 115 hp call show contact info or show contact info,,5926440184,34.522600,20,-82.896300,,"https://maps.google.com/maps/preview/@34.522600,-82.896300,16z",,$800,power, (townville),115 mercury yamaha four stroke powerhead low hours,https://charlotte.craigslist.org/boa/5926440184.html,2006
74,like new,"['34.522600', '-82.896300']",2016-12-20 00:37,I have mercury four stroke lower unit fits all mercury and Yamaha 75 80 90 100 and 115 hp this one is a 2006 year model original paint mint condition like new 20 inch shaft call show contact info or show contact info,,5926428494,34.522600,20,-82.896300,mercury mariner,"https://maps.google.com/maps/preview/@34.522600,-82.896300,16z",75-115 hp,$800,power, (townville),mercury yamaha four stroke 90 115 lower unit mint condition,https://charlotte.craigslist.org/boa/5926428494.html,2006
75,like new,"['34.522600', '-82.896300']",2016-12-20 00:32,I have a Honda four stroke lower unit fits all years 40 45 50 hp this one is a 2008 model original paint like new call show contact info or show contact info,,5926432619,34.522600,20,-82.896300,honda 40 45 50 hp,"https://maps.google.com/maps/preview/@34.522600,-82.896300,16z",40 45 50 hp,$700,power, (townville),40 45 50 hp honda four stroke lower unit original paint 2008 model,https://charlotte.craigslist.org/boa/5926432619.html,2008
