,condition,coord_pair,date,description,engine hours (total),id,lat,length overall (LOA),long,make / manufacturer,map_URL,model name / number,price,propulsion type,region,title,url,year manufactured
76,good,"['34.522600', '-82.896300']",2016-12-20 00:13,"hello I have a 234 glastron ultra closed bow speedboat has racing shifter dual lever this past spring the boat had a new 350 v8 engine installed a rebuilt mercruiser outdrive new bellows kit gimbal bearing and shift cable has 4 inch through the transom exhaust has electric engine hatch I had the 2 wraparound racing seats recovered back seat has a couple of tears the engine hatch needs to be recovered boat has fiberglass floor with snap in carpet the boat is red and white needs to buffed and waxed hull is in good condition all of the gauges work installed all new switches in the dash this summer boat sets on dual axle galvanized trailer I just put four new galvanized wheels and tires new wheel bearing has buddy bearings the wheels and tires are 2 months old also has surge brakes with all of the work I have done so far I have over $10,000.00 in this boat engine and trailer package I bought a offshore center console boat and this one has to go my loss is your gain this boat runs great just do the things I said and you will have a very nice speedboat call call show contact info or show contact info I do have pics tonight but I will get pics tomorrow",,5921305786,34.522600,24,-82.896300,,"https://maps.google.com/maps/preview/@34.522600,-82.896300,16z",,$3500,power, (townville),WOW christmas gift glastron 234 ultra speedboat new motor outdrive v8,https://charlotte.craigslist.org/boa/5921305786.html,1989
77,excellent,"['34.522600', '-82.896300']",2016-12-20 00:13,I have a omc cobra upper outdrive for 4 and v6 has been pressure and vacuum checked gears and bearings are in perfect condition came off of a boat with bad transom and stringers have hour meter boat had 400 hours u joints have been changed they have grease fittings has original paint,,5921324940,34.522600,20,-82.896300,omc cobra,"https://maps.google.com/maps/preview/@34.522600,-82.896300,16z",,$500,power, (townville),omc cobra upper outdrive great condition ready to bolt on,https://charlotte.craigslist.org/boa/5921324940.html,
78,fair,,2016-12-19 22:35,"Twin inboard Detroit Diesel Engines (8 Cylinders) in good condition only 2650 hours on the engines. Horsepower: 560 each The hull, and engines are in good shape. The interior could be taken on as a rehab project! Boat is being sold as is- contact me for more details!",2650,5926321349,,50,,Sea Ray,,Express Cruiser 460,$15000,power,,Sea Ray 1988 Express Cruiser,https://charlotte.craigslist.org/boa/5926321349.html,1988
79,,"['34.925100', '-80.727800']",2016-12-19 21:39,2 kayaks #1 -  18 feet long x 24 wide with open cockpit. It is a Chesapeake 18 that has been modified. I have builtnear 20 wooden boats and thought I'd give this a try rowing.   38 pounds and fast. $750.00 #2  -  20 feet long x 30 wide with open cockpit. This boat is designed as a double. Built from plans. I tried this as a rowing shell as well. 50 pounds and easy to handle. $750.00 Both boats are in great condition. Barely used. The 20 footer has not been varnished yet and will need that done. The drop in rowing wing is an old Alden is great condition.  $275.00 The oars are Concept 2 in great condition. $275.00 Selling all to buy equipment for my work.,,5926307551,34.925100,18,-80.727800,,"https://maps.google.com/maps/preview/@34.925100,-80.727800,16z",,$275,human, (Waxhaw),kayak rowing shell rowing wing oars,https://charlotte.craigslist.org/boa/5926307551.html,
80,,"['35.384712', '-80.584867']",2016-12-19 21:30,"Classic style great for those that like the retro scene on the water. Boat needs some work, floor is solid, transom is solid, needs a good cleaning and some interior work. Motor is a classic Evinrude 80hp. Trailer in decent shape, may need some tlc on the lighting wires. no title for boat or trailer. May be interested in trade just let me know what you got.",,5926299389,35.384712,16,-80.584867,Cacci Craft,"https://maps.google.com/maps/preview/@35.384712,-80.584867,16z",,$1300,power, (Concord),classic Cacci Craft boat,https://charlotte.craigslist.org/boa/5926299389.html,
81,fair,"['34.915100', '-81.012900']",2016-12-19 21:17,"This is a 1990 bumblebee bass boat has 150 Hp Johnson clean title on boat and motor needs some TLC motor turns over and has good compression this bot needs a little work , asking $1500 obo",150,5905541638,34.915100,16,-81.012900,16,"https://maps.google.com/maps/preview/@34.915100,-81.012900,16z",Bumblebee,,power,,16 foot bass boat,https://charlotte.craigslist.org/boa/5905541638.html,1990
82,excellent,"['35.247700', '-80.531900']",2016-12-19 20:48,These are used and are in great condition.  They come equipped with rollers and Mako saddles. Retail $550 Yakima Locker boat cable for boat and paddles has never been used and is brand new in package! CALL OR TEXT ANDREW,,5905203465,35.247700,55,-80.531900,Yakima / Maco,"https://maps.google.com/maps/preview/@35.247700,-80.531900,16z",,$350,human, (Midland),Yakima Boat Kayak Roof Rack System Plus NEW LOCK retail $550,https://charlotte.craigslist.org/boa/5905203465.html,
83,like new,"['34.522600', '-82.896300']",2016-12-19 20:37,hello I have a 4.5 hp mercury original paint and decals has some scratches from setting in the building this motor is a one owner almost no hours has new water pump gear oil carb cleaned new spark plug runs like new shifts perfect the prop is not on the motor in the pics but I do have the prop and is perfect tiller handle in perfect condition has forward neutral and reverse condition as you can see how clean the motor is under the cover very low hours always been kept inside thanks call show contact info 864-556-5898,,5921288593,34.522600,20,-82.896300,,"https://maps.google.com/maps/preview/@34.522600,-82.896300,16z",,$500,power, (townville),4.5 5 hp mercury outboard forward neutral reverse near mint condition,https://charlotte.craigslist.org/boa/5921288593.html,
84,,"['35.486764', '-80.904553']",2016-12-19 20:25,"1996 Sea Ray sundeck 240. 350 merCruiser. It has 305 hours as of yesterday. Everything works. Factory trim tabs. Trailer has new wheels, tires and brakes.",,5917434951,35.486764,24,-80.904553,,"https://maps.google.com/maps/preview/@35.486764,-80.904553,16z",,$11000,power,,1996 Sea Ray Sundeck 240,https://charlotte.craigslist.org/boa/5917434951.html,
85,,"['35.485100', '-81.181800']",2016-12-19 20:19,"14ft, 35hp evenrude, 2 live wells, 3 gas tanks, 4 life vests, inspections up to date, $500 obo, herb show contact info thanks for watching.",,5926231863,35.485100,14,-81.181800,,"https://maps.google.com/maps/preview/@35.485100,-81.181800,16z",,$500,power," (lincolnton, nc)","14ft, 35hp evenrude,",https://charlotte.craigslist.org/boa/5926231863.html,
86,,"['41.050300', '-80.541600']",2016-12-19 19:32,"BBC JET BOAT- 1979 Eliminator all original gel coat, original interior, Beautiful shape, new motor, new jet drive too much to list, serious inquiries contact me at show contact info",,5905436764,41.050300,19,-80.541600,,"https://maps.google.com/maps/preview/@41.050300,-80.541600,16z",,$1,power,,BBC JET BOAT-** TRADE,https://charlotte.craigslist.org/boa/5905436764.html,1979
87,,"['34.881706', '-80.592957']",2016-12-19 19:32,Runs needs carb cleand,,5926183663,34.881706,10,-80.592957,,"https://maps.google.com/maps/preview/@34.881706,-80.592957,16z",,,power,,Johnson boat motor,https://charlotte.craigslist.org/boa/5926183663.html,
88,excellent,,2016-12-19 19:21,"All original except extended ride plate 1998 Kawasaki 650 sx Standup Jet Ski! * Runs perfect! * OEM fitted Cover. * Oil and gas mix through gas tank. (avoids issues, with the oil pump from shutting down) * New Battery * 650 has plenty of power, will max out around 38 mph, depending on water weight of rider. * Fresh water only. At Lake Gaston, can bring to Raleigh though. Asking $2,175 OBO. Great Ski! AWESOME HOLIDAY CHRISTMAS GIFT!! Most fun you can have on water, ready to ride!",50,5907126154,,6,,Kawasaki,,650 SX,,power,,Kawasaki Standup Jet Ski 650sx Tons of power GREAT GIFT!,https://charlotte.craigslist.org/boa/5907126154.html,1989
89,excellent,"['34.898181', '-80.703678']",2016-12-19 19:14,15 ft pelican canoe with dry bottom. Has minn kota 35lb thrust trolling motor. Only  15hrs on motor. Comes with 2 stadium seats and 1 oar.,15,5926163958,34.898181,15,-80.703678,Pelican,"https://maps.google.com/maps/preview/@34.898181,-80.703678,16z",A15,$500,power,,canoe,https://charlotte.craigslist.org/boa/5926163958.html,
90,good,"['35.596200', '-81.033900']",2016-12-19 19:11,FOR SALE - REDUCED! 1985 30' S2  9.1 Yanmar Diesel Engine (15hp) MAKE AN OFFER!!!! MUST GO NOW!!!!!!! *Call for additional details* (704) six zero nine 9600,,5926161020,35.596200,30,-81.033900,S2,"https://maps.google.com/maps/preview/@35.596200,-81.033900,16z",S2,$8000,sail, (Lake Norman),SAILBOAT - S2 30' 1985,https://charlotte.craigslist.org/boa/5926161020.html,
91,good,,2016-12-19 19:08,30 ft Hunter call show contact info,,5892992905,,30,,Hunter,,,$6000,sail, (Newbern),30ft hunter,https://charlotte.craigslist.org/boa/5892992905.html,1982
92,good,,2016-12-19 19:05,30 ft Hunter call show contact info,,5892819039,,30,,Hunter,,,$6000,sail, (Newbern),30ft hunter,https://charlotte.craigslist.org/boa/5892819039.html,1982
93,good,,2016-12-19 19:05,30 ft Hunter call show contact info,,5903377405,,30,,Hunter,,,$6000,sail, (Newbern),30ft hunter,https://charlotte.craigslist.org/boa/5903377405.html,1982
94,,"['35.734600', '-81.704200']",2016-12-19 18:51,"1970 aluminum Petrel, mast, sails, keel, boom, rudder, no trailer for this price, ready to sail , also ready to be restored. delivery possible.  check out this little boat sailing on youtube on Nov 3rd. its under sail Lake James $450 obo show contact info",,5884770953,35.734600,12,-81.704200,,"https://maps.google.com/maps/preview/@35.734600,-81.704200,16z",,$450,sail, (Morganton),"12ft Sail boat, Petrel, aluminum",https://charlotte.craigslist.org/boa/5884770953.html,
95,,"['35.181026', '-81.486083']",2016-12-19 18:37,NO TEXT NO TEXT 1982 ranger 350  with a 1996 tohatsu 140 hp very solid boat  or boat and trailer only for 1200 dollars 24 volt trolling motor 135 lowrance fish finder calls only,,5914892935,35.181026,18,-81.486083,,"https://maps.google.com/maps/preview/@35.181026,-81.486083,16z",,$3000,power, (grover nc),Ranger bass boat,https://charlotte.craigslist.org/boa/5914892935.html,
96,,"['35.734600', '-81.704200']",2016-12-19 18:30,"2001 13ft Boston Whaler sport with a 40 hp 2 stroke Mercury with power trim, bimini top, runs good looks good, 2006 aluminum trailer, I can  deliver show contact info if you rather have 4 stroke, I will sell without motor. may take a good 2 axel car trailer in on trade. will sell with out trailer also, $5800",,5911439971,35.734600,13,-81.704200,,"https://maps.google.com/maps/preview/@35.734600,-81.704200,16z",,$5800,power, (Morganton),2001 13ft Boston Whaler sport/ trade,https://charlotte.craigslist.org/boa/5911439971.html,
97,good,"['34.851100', '-80.002500']",2016-12-19 18:12,"IF YOU ARE READING THIS ADD, YES, IT IS AVAILABLE!! 14"" Fiberglass Jon Boat with 15hp Chrysler motor, and foot controlled trolling motor, installed new last year. New seats, new batteries last year. Selling because it gets no use. Last time out, carbs appeared to be in need of cleaning/rebuild. Clear title for boat and I just sent off for lost title for trailer. Trailer has a slight bend at the tongue, but I have used it that way for several years. Would prefer cash, but will consider trades. Make a realistic offer and I will get back to you,",,5911383225,34.851100,14,-80.002500,Richlands,"https://maps.google.com/maps/preview/@34.851100,-80.002500,16z",,,power,,14' Jon Boat with Motor,https://charlotte.craigslist.org/boa/5911383225.html,1973
98,,,2016-12-19 18:11,"Are you the type of person that likes to stand out from the crowd? If so, these boots are made just for you. Nice cool color that has a unique design. The crowd will definitely notice you for sure!",,5926092552,,8,,,,,,sail,,Air Force ones Boots,https://charlotte.craigslist.org/boa/5926092552.html,
99,,,2016-12-19 18:06,"**DO NOT HAVE TEXT**   1997 Kawasaki Jet Ski STS 750cc, 2 Stroke, 2 Carburetor, 2 people can ride and it have plenty of power to pull a skier, overall good condition, real clean for the year.  May trade for a car or truck.  Price is $2,050.00 CASH ONLY - NO CHECKS, No calls before 9:00AM or after 9:00PM.  **DO NOT HAVE TEXT**",,5922987470,,10,,KAWASAKI,,STS,$2050,power, (GASTON COUNTY),1997 KAWASAKI JET SKI STS 750cc,https://charlotte.craigslist.org/boa/5922987470.html,1997
