,condition,coord_pair,date,description,engine hours (total),id,lat,length overall (LOA),long,make / manufacturer,map_URL,model name / number,price,propulsion type,region,title,url,year manufactured
79,like new,"['44.100500', '-123.133400']",2016-12-05 10:56,"YOU WILL NOT FIND ONE NICER!!!!! This is a pristine 1988 Mastercraft Tri Star 190. This is a rare model with more room than the Pro Star 190. It has been garaged for it's whole life. Always maintained by professionals. This boat has been a member of the family. It has 800 hours on the perfect 351 Ford motor. The interior is also in perfect shape as well. It has a hot water shower, a factory heater for those cold days, and surge brakes on the tandem axel trailer. Any other questions please contact, Ron.",800,5882951108,44.100500,20,-123.133400,MASTERCRAFT,"https://maps.google.com/maps/preview/@44.100500,-123.133400,16z",TRI START 190,$8000,power, (Eugene/Springfield +),1988 Master Craft Tri Star 190,https://bend.craigslist.org/boa/5882951108.html,1988
80,,[],2016-12-05 10:32,"2016 Alumaweld Intruder 20' AWB25803 Mercury 150 EFI 4 Stroke Mercury 9.9 Pro kicker Premium Appearance Package Interior Color Coat Dura Frame Sport Top Rail Package (Stern Rails w/downrigger brackets) Port & Starboard Wipers Between Console Storage Under Console, Under Floor Storage Offshore Platform 2 Deluxe Comfort Bench Seats w/Storage 2 Trail Boss Suspension Seats w/Swivels Side/Back Curtains Bilge Pump Hydraulic Steering Transom Fish Box Bow Anchor Compartment Diamond Plate Bow Guard Four Interior Lights Priced @	$56,393.00 Discount	($3,000.00) Final Price	$53,393.00 For More Details Call Mike 503-704-8675 Financing Available OAC Stevensmarine18023seaddiestmilor97267DA#4222 Key Words: Alumaweld, Hewes Craft, Hewescraft, North River, Northriver, Northwest Jet Boats, Northwest Jet, Northwest Boats, Smokercraft, Smoker Craft, Thunder Jet, Thunderjet, Boulton, Jetcraft, Weldcraft, Lund, Lowe, Rogue Jet, Rogue Marine, Pro-Steelheader, Pro Steelheader, Aluminum, Used Boat, Used Boats, Kicker, Fourstroke, Four Stroke, 4-Stroke, Fishing Boat, Fishing Boats, Outboard, Rogue, Kingfisher, Harbercraft, Harber Craft, Sylvan, Customweld, Willie, Willie Boats, Drift Boat, Sled, Flat Bottom, Klamath, Gregor, Motion Marine, Stryker, Intruder, Wooldridge, Arima, Sportsman, Searunner, Sea Runner, Ocean Pro, Commander, Seahawk, Scout, OS, Offshore, Offshore Bracket, T9.9, Raider, Osprey, C-Dory, SeaSport, Sea Sport, Trophy, Stryper, Allied, Defiance, Riverhawk, River Hawk, Riverwild, River Wild, E-Tec, Verado, SHO, Columbia, Super Vee, Talon? do NOT contact me with unsolicited services or offers",,5906538734,,22,,,https://maps.google.com/?q=loc%3A+%31%38%30%32%33+SE+Addie+St+Milwaukie+OR+US,,$53393,power, (Fish in Style (Ready to go)),2016 Alumaweld Intruder 20'  Offshore Bracket,https://bend.craigslist.org/bod/5906538734.html,
81,like new,"['42.191900', '-121.724100']",2016-12-04 19:39,"2011 16 1/2 foot Smoker Craft. Less than 50hrs. 60 horse mercury, 6 horse mercury kicker. Custom bra, full curtains, custom anchor system, full cover, fish finder, ez loader trailer, 4 seats, live well, bumpers, pole holders and 4 life jackets. Pristine with all the extras.   $18,500",50,5905773350,42.191900,16,-121.724100,Smoker Craft,"https://maps.google.com/maps/preview/@42.191900,-121.724100,16z",Tracer,$18500,power, (Klamath Falls),2011 Smoker Craft Tracer,https://bend.craigslist.org/boa/5905773350.html,2011
82,,"['44.092800', '-121.293600']",2016-12-04 14:15,Koffler driftboat 16 by 48 great condition brand new seats and rhino guard on the interior two pole holders and an anchor diamond plate on the floor text preferred Oars included No title bill of sale,,5888920150,44.092800,16,-121.293600,,"https://maps.google.com/maps/preview/@44.092800,-121.293600,16z",,$3200,human, (Bend),Koffler driftboat,https://bend.craigslist.org/boa/5888920150.html,
83,,"['44.092800', '-121.293600']",2016-12-04 14:14,Brigs and Stratton 5hp motor Runs but needs a carb clean comes with gas tank,,5885587771,44.092800,0,-121.293600,,"https://maps.google.com/maps/preview/@44.092800,-121.293600,16z",,$200,power,,5hp motor brigs and Stratton,https://bend.craigslist.org/boa/5885587771.html,
84,like new,,2016-12-04 13:15,"Maxum Bowrider 2007 Model 1800 MX Great Boat ,Excellent condition , Very Powerfull , Snap on Carpet , 100% working Boat , 4 Blade Propeller,New Starter , New Bimini Top , New Fuse Box ,New Am/Fm CD,Mp3 ,Sat Ready, Jensen Stereo ,This is a Turn Key Boat just Ready For the Water , Comes With a 2007 Galvanized Trailer in Excellent condition with almost New Tires. Cockpit: AM/FM/CD MP3-Sat Ready Capable Stereo: Jensen w/Weatherproof Speakers Beverage Holders: Stainless Steel Fiberglass Engine Cover: Hinged w/Gas Struts Fiberglass Liner Lockable Glove Box: Port Console Padded Side Storage Panels: w/Shelves Helm Buckets Seats w/Suspension, Swivel & Slide Bow Seating w/Back Cushions & Storage Below Customed-Contoured Port Sleeper Seat - Converts to Sunlounger w/Fore & Aft Slide Vented In-Floor Storage Vinyl Grab Handles",,5896012465,,18,,,,,$9000,power, (Salem),Maxum 1800mx 2007 Bowrider Excellent Boat !!,https://bend.craigslist.org/boa/5896012465.html,2007
85,good,,2016-12-04 10:30,"If not sold SOON...I am going to take things off and make more than what I am asking for it now. cuz  in a few months I will have to sell my assets. and if the parts ARE NOT THERE I won't be taking as much of a loss after all. If you see something you want I will sell it and start scraping now! or you take and scrap. ****************NO I WILL NOT TAKE LESS*************Trades LOG SPLITTER/Snow Blower? Man stuff defense I had her listed earlier this summer for 3,000.00.....Pine needles where from where I was helping people evacuate at the cultus fire a few years back. 225 buick v-6 power plant.....I have done nothing with her for a few years she needs carb work, oil change, She always ran really nice fired right up and idled great just had a hesitation when idle to full throttle, so there is nothing wrong with her internally and has been under a shed covered all this time. THIS PRICE IS ....""AS IS"" I had her at Parr engine repair for quite awhile and he couldn't figure its hesitation problem So I took it while he was working on it...HE WAS PISSED OH WELL so was I... and he let my NEW top get damaged.....But Mark at Davis n Clark knows how to fix the carb. But if YOU know this is a awesome deal for you.... I have LOST the Title but she IS in my name. I Customized this girl for me, now I am downsizing, and she can be yours. She's a Closed bow, GPS/Finder, New 22 gallon Bow fuel tank, Inline fuel separator system all New fuel lines through out, she is set up for duel batteries but don't have a battery in her, All New cables with Perco selection Switch, Ski Pole, Engine cover carpeted and vinyl, New white back to back seats, Nice Powerful CD/Mp3 stereo system and amp four Pioneer speakers, Carb rebuilt, New coil, New Aquatic custom dash, I removed back seats opening deck space The engine cover I made has doors (Carpeted) attached to each side that close up the space to the fuel system and perco switch and batteries. The top of cover is hinged to open for access to the top of engine. The whole cover can be taken off instantly for any kind of inspection. Really cool actually. Side panels have been vinyled as well. Trailer is good as well tires, bearings, fenders, lights all good.. Just putting this out there for now. She also has a storage top $1,700.00 CASH ONLY lost title but she is in my name. I will provide a legal BOS. Thanks..... BTW I have put over 3000.00 into her. Possible trade for a GOOD Bigger Log splitter. 25 ton and portable. fivefouronefouezero8 thanks zero2sevinsix.",,5898695553,,18,,,,Silverline,$1750,power, (DRW),1500.00 LAST CHANCE.........1971 18' I/O Silverline W/225 V-6,https://bend.craigslist.org/boa/5898695553.html,1971
86,fair,,2016-12-04 10:28,"****UPDATE**** I will sell this trailer with the boat 420.00 NEW Tires and rims-New trailer crank I will trade for something as well I need the room LAST 5 PICTURES ARE AS SHE SITS NOW. I truly hate to see this girl go, what a great project, she needs to be in a shop. The trailer pictured (first two pics) is NOT what she is on now.... She's on the trailer that's in the (last five pics) This trailer is NOT rusted out she's a Tilt with two NEW TIRES AND RIMS, New lights, New tongue crank, bed, bow rest, keel rollers, are fully adjustable, new winch good rope, 2'' ball flat connector. Spare is not new but great shape. Fenders need sanded and painted but good shape. *****five4onefourzero8zerotwoseven6 This girl needs restoration floor ribs and transom replaced.. Split the top from bottom real easy stainless fasteners in GREAT shape...As usual I bought to customize but NOW need the room for my boat. so am taking another loss..... buy all of it for 350.00 FIRM FIRM FIRM... Think the trailer is for a 16' 18' Harvey on her is a 15' ... BOS only There are no number on boat so sheriff would have to inspect to get title. A pain yes a little but worth the time.",,5889706996,,15,,HARVEY,,,$150,power, (bend),1959 Harvey project BOS ONLY....W/Trailer $350.00,https://bend.craigslist.org/boa/5889706996.html,1959
87,good,,2016-12-04 10:28,"About Trailer: Not rusty, Sturdy trailer good fenders five lug straight axel, (One Bad) Keel & Hull roller system (Adjustable) as is the Bow rest, miss matched rims one tire is good Port side rim a little surface rust, other tire starboard side is tread worn but nice rim, Also have a New tire mounted I will throw in for you its a little smaller but NEW 4.80 x 12 but neither are cracking just tread. lights are good except parking lights dim but turn signals work great without the lights being on. lenses should be replaced $6.00, has non adjustable guide arms, has Bearing buddys. Price is going up when I fix things... The last 7 pictures are as she sat before I put her on a trailer today.(LAST 6 PICTURES SHOW TRAILER she is on now)... If you want trailer too 400.00 OR bring your own. If you bring your own trailer I will let you have her for 175.00 CASH She fits perfect on this trailer.... I am really at a loss no one has had interest in her, she really is a good little boat... I am taking a loss I would like to get this girl indoors, to someone that wants a small project for the winter... I just can't do it and don't want to leave this girl outside. Also I will haul to your location bend FREE outside bend 25.00/Prineville 35.00 NO FURTHER THAN PRINEVILLE to cover gas n time.. CLASSIC 1964 Harvey solid new floor not glassed in. Good old classic needs a little work.. GELCOAT is really great She Has a NEW FLOOR not glassed in yet.. The bow lite lenses are missing and a small crack in window. Hence the price drop but a great easy project. (BILL OF SALE ONLY).. ....as you can see she's NOT a piece of crap. Very solid hull and transom, NO DELAMINATION (SEATS ARE SOLD) willing to barter (boat only) for a good running 9.9 outboard...PAY PAL ACCEPTED.",,5889656803,,14,,HARVEY,,Starwiz,$200,power, (bend or),HARVEY STAR WIZ**REDUCED (LAST TIME) 200.00 W/Trailer 400.00,https://bend.craigslist.org/boa/5889656803.html,1964
88,good,,2016-12-04 10:27,I fiber glassed her but She needs repainted on bottom but she's water tight now. I think this is for a more advanced Kayaker. Her bottom is rounded and a little tight for me to get in and out of. I weigh 195 6 foot tall. I bought her from a guy that had her duck taped for the pole/pedal/paddle. Being a fiber glass person.... I ripped that off and made her water tight and stronger. I'm firm on price. trades welcomed. If your the kind of person that does not have to keep up with the Joneses then this is for you.,,5876919954,,13,,HyperForm,,,$75,human, (Bend),13'3'' Hyperform Kayak Reduced to 75.00,https://bend.craigslist.org/boa/5876919954.html,
89,excellent,"['42.336300', '-122.839800']",2016-12-04 09:29,"Renegade 8' 6"" J. W. Outfitters pontoon boat with tons of equipment: 1). Trolling Motor and Welded Bracket, Fins, Striping Basket, Rod Holders, Aluminum Cargo Deck, Anchor System With Anchor, Fish Finder Holder, Oar Holders, Padded Seat, Adjustable Foot Pegs, Double Action Barrel Pump, Water Proof Dry Bags. Sale: $350.00",0,5905021911,42.336300,8,-122.839800,J. W. Outfitters,"https://maps.google.com/maps/preview/@42.336300,-122.839800,16z",Renegade,$350,human, (East Medford),"J. W. Outfitters Renegade 8' 6"" Pontoon Boat",https://bend.craigslist.org/boa/5905021911.html,
90,excellent,,2016-12-04 07:55,"Outcast Pac 1200 2 man Pontoon Boat. Rarely used. 2 years old. Optional equipment that is included: Anchor, motor mount, rear oarsman deck plate, 4 saddle bags and high output DC air pump. This boat can be broken down easily for transport in smaller vehicles. This is a great boat for smaller lakes and rivers.",,5904892304,,13,,Outcast,,Pac 1200,$2500,human, (Klamath Falls),Pontoon Boat- 2 man,https://bend.craigslist.org/boa/5904892304.html,2015
91,good,,2016-12-03 21:50,"I had her listed earlier this summer for 3,000.00.....Pine needles where from where I was helping people evacuate at the cultus fire a few years back. Possibly partial TRADE for Log Splitter/Snow blower Man Stuff Defense 225 buick v-6 power plant.....I have done nothing with her for a few years she needs carb work, oil change, She always ran really nice fired right up and idled great just had a hesitation when idle to full throttle, so there is nothing wrong with here internally and has been under a shed covered. THIS PRICE IS ....""AS IS"" I had her at Parr engine repair for quite awhile and he couldn't figure its hesitation problem So I took it while he was working on it...HE WAS PISSED OH WELL so was I... and he let my NEW top get damaged.....But Mark at Davis n Clark knows how to fix the carb. But if YOU know this is a awesome deal for you.... I have LOST the Title but she IS in my name. I Customized this girl for me, now I am downsizing, and she can be yours. She's a Closed bow, GPS/Finder was $550.00 alone, New 22 gallon Bow fuel tank, Inline fuel separator system all New fuel lines through out, she is set up for duel batteries but don't have a battery in her, All New cables with Perco selection Switch, Ski Pole, Engine cover carpeted and vinyl, New white back to back seats, Nice Powerful CD/Mp3 stereo system and amp four Pioneer speakers, Carb rebuilt, New coil, New Aquatic custom dash, I removed back seats opening deck space The engine cover I made has doors (Carpeted) attached to each side that close up the space to the fuel system and perco switch and batteries. The top of cover is hinged to open for access to the top of engine. The whole cover can be taken off instantly for any kind of inspection. Really cool actually. Side panels have been vinyled as well. Trailer is good as well tires, bearings, fenders, lights all good.. Just putting this out there for now. She also has a storage top $1,700.00 CASH ONLY lost title but she is in my name. I will provide a legal BOS. Thanks..... BTW I have put over 3000.00 into her. Possible trade for a GOOD Bigger Log splitter. 25 ton and portable. I have put a lot of time and money in this girl, so you low ball offers are not appreciated.. No one has even looked at her. Believe me your missing s great deal.",,5901699719,,18,,,,Silverline,$1500,power, (DRW),1971 18' I/O Silverline W/225 V-6,https://bend.craigslist.org/boa/5901699719.html,1971
92,good,[],2016-12-03 21:49,"T**************SHE REALLY IS A SWEET BOAT AND TRAILER*******I am reducing her for a SHORT TIME..SUNDAY***FIRST COME WITH CASH OR TRADE.... you wont see her cheaper than she is right now.. When snow is here I will remove till springtime then it's 2,000.00 Water ready Classic 1964 Hydro Swift Runabout...Great Boat....1130 NE 8th Bend............Turn Key Ready and SCREAMS!..85 Hrsp Evinrude W/Happy Troller, Recently gone through at Central Lakes Marine...Fish finder, New Stereo mp3 n Amp w/four speakers, Good fold down back to back seats, Plumbed in Bilge pump, Good Bimini top W/Storage Sleeve, Good and intact Windshield, Adjustable Aux motor mount, Duel batteries with Perko Selection Switch, Multiple pole holders, Two roped side bumpers, Anchor and 100' line in a bucket, all lights work and horn, also has Cannon outrigger W/line counter 100' wire and weight..  **Trailer good shape too, New tires and rims including spare as well, New Submergible lights, New Metal fenders, I'm taking a loss on her already. Title should be here any day... Still waiting for the marine board (Checks in the Mail). It's been almost 6 months but can call them to verify in my name before purchase. I could sell this engine alone for 1000.00 AND WILL....This is my Baby! I Hate to part with here...Might be willing to do (TRADE+CASH DEAL)  Picture where taken out on Cultus a month ago... Had the lake to myself Best Camp trip I have ever had.....If not sold by first snow I will take off list and you'll see her in the spring for $2,000.00",,5866086709,,14,,HYDRO/SWIFT,https://maps.google.com/?q=loc%3A+%31%31%33%30+NE+%38TH+at+LAFAYETTE+Bend+OR+US,Runabout,$1700,power, (bend),"REDUCED too $1,500 only..TURN KEY**14' HydroSwift 85hrsp Evinrude",https://bend.craigslist.org/boa/5866086709.html,1964
93,like new,"['43.019800', '-119.069600']",2016-12-03 14:13,"Dave Scadden Outlaw Challenger XXX 2016 model. Been on the water three times, two sets of oars , stripper basket, Double action hand pump. Has an anchor purchased separately. Was delivered with a small hole which I repaired. Can possibly meet for delivery already set up. It is a little bit more than I really needed. $2,500.00 OBO. Retails for $3,700.00 Sale price $2,699.00 Location is near Burns Oregon",,5904167094,43.019800,12,-119.069600,Dave Scadden,"https://maps.google.com/maps/preview/@43.019800,-119.069600,16z",Outlaw Challenger XXX,$2500,human, (Princeton),Christmas gift Framed Series  Fishing or white water Pontoon Craft,https://bend.craigslist.org/boa/5904167094.html,2016
94,new,,2016-12-03 12:01,Montgomery Wards 5 HP boat motor runs and works. $100 CALL show contact info,,5895302455,,1,,,,,$100,power, (Bend/LP),Vintage boat motor 5HP,https://bend.craigslist.org/boa/5895302455.html,
95,good,,2016-12-03 12:00,"12' Blue Fin wide body boat with 10 HP Johnson and Shoreline trailer. Good tires with brand new spare. Anchor, rod holers and oars. $1000 obo. Possible trade for quad. CALLS ONLY show contact info",,5895744222,,12,,,,,$1000,power, (La Pine),12' BLUE FIN 10HP JOHNSON and trailer,https://bend.craigslist.org/boa/5895744222.html,
96,good,,2016-12-02 19:59,Selling my fiber glass canoe because of bills. # 543 four08 zero276.. she leaks NOT A DROP. Think she's around 16' or so never had seats comes with a paddle too. She not a lite one handed canoe. Best with two people. I can pack her and I'm 60 but I am pretty strong. I will get some pics soon.,,5887190512,,16,,,,,$200,human, (bend),145.00 16' canoe fiberglass wood reinforced cap rails,https://bend.craigslist.org/boa/5887190512.html,
97,,,2016-12-02 16:26,nice larson boat need a motor its a v6 chevy it has a nice trolling motor and a nice top on it new tires on trailer 1000 obo,,5894486715,,17,,,,,$1000,power, (bend),1969 larson,https://bend.craigslist.org/boa/5894486715.html,
98,good,,2016-12-02 16:26,1979 sunrunner 19ft boat runs very good has a 470 mercruser nice trailer good tires have title to the boat moving need to sell comes with a tube and life vests please text scott at show contact info,,5894485829,,19,,,,,$2800,power, (bend),1979 sunrunner,https://bend.craigslist.org/boa/5894485829.html,
99,good,"['44.022300', '-121.298500']",2016-12-02 15:25,Nice aluminum 16x48 drift boat with high sides.  Includes a set of oars and Dierks anchor set up.  Trailer has new wiring and LED lights.  Tires on trailer are in good shape.  Bottom was coated last summer and no damage or dents.  Clean clear title.  This is a nice set up for not much $.  Firm on price.  Call Thad at show contact info,0,5902846967,44.022300,16,-121.298500,Aluminum,"https://maps.google.com/maps/preview/@44.022300,-121.298500,16z",16x48,$1950,human, (Bend),16x48 Drift Boat,https://bend.craigslist.org/boa/5902846967.html,1980
