,condition,coord_pair,date,description,engine hours (total),id,lat,length overall (LOA),long,make / manufacturer,map_URL,model name / number,price,propulsion type,region,title,url,year manufactured
33,good,,2016-12-15 15:04,"2002 MAXUM SR 1800, GOOD CONDITION THROUGH-OUT,  NO TIME ENGINE, COMPLEMENT OF A FREEZE BREAK, TOP, TRAILER HAS BRAKES, The Maxum 1800 SR has a MerCruiser sterndrive that is as powerful as it is quiet, providing a pleasant ride while offering more seating space. This model is also available with flip-down seating that easily converts into a sunlounge.  CALL show contact info Powered by Mercruiser 4.3L Alpha 190HP Includes: Sun Top, Stereo, (2) Mooring Covers, Galvanized Trailer",,5879567503,,18,,,,,$7999,power, (PORTLAND),2002 MAXUM 1800,https://bend.craigslist.org/boa/5879567503.html,2002
34,like new,[],2016-12-15 09:46,"These components provide a very inexpensive means for transporting kayaks, canoes, or paddle boards. We have used them on several occasions and found them to work very well. We have now graduated to a Yakima system and no longer use thes. Two complete sets for 1/3 the price of one set.",,5897868482,,12,,,https://maps.google.com/?q=loc%3A+NW+%31%39th+at+NW+Maple+Redmond+OR+US,,$10,human, (Redmond),Kayak rooftop carriers,https://bend.craigslist.org/boa/5897868482.html,
35,good,,2016-12-14 19:18,"2000 procraft 180 combo. 125 mercury 2stroke outboard. Seats 5 adults (per the sticker) or 725 lbs. 18' long and about 22' with breakaway trailer hitch.  Has room for 7 if some are small children.  Can pull a tube, knee board easily. We haven't used it to ski. We are the only owners.  Has 2 trolling motors-1 upfront with foot controls for ease of fishing and one in back mounted above the main motor, great for trolling.  We haven't taken it out this year, but new battery and we have started it right up.  Only used about twice per yr for last several years- it needs a home to use it.",,5916772148,,18,,,,,$9900,power, (Bend),2000 Procraft fish/ski combo,https://bend.craigslist.org/boa/5916772148.html,
36,new,"['44.025286', '-121.317043']",2016-12-14 16:33,McKenzie River Double Ender with a transom. New. Built with plans from Roger Fletchers book: Drift Boats and River Dories by The Northwest School of Wooden Boatbuilding in 2015. Build with Marine grade Okoume Plywood with Sapele trim. Bottom and sides are covered in fiberglass/epoxy. Heavy NRS oarlocks with Sitka spruce leathered oars. New EZ Loader trailer.,,5919757095,44.025286,15,-121.317043,NW School of Wooden Boatbuilding,"https://maps.google.com/maps/preview/@44.025286,-121.317043,16z",McKenzie River Double Ender w/Tn,$6950,human," (Bend,Oregon)",Drift Boat w/Trailer,https://bend.craigslist.org/boa/5919757095.html,2015
37,,,2016-12-14 12:10,Aluminum fishing boat with tilt trailer. 1-40 pound anchor and 1-10 pound anchor. 9.5 horse Johnson motor and a brand new 30 pound thrust Minn Kota electric motor. 2 padded swivel seats. 3 gas tanks. And cover. Will throw in a bunch of fishing rods and reels to the right buyer. $1000,,5896653937,,12,,,,,$1000,power,,12' GRUMMAN Fishing Boat,https://bend.craigslist.org/boa/5896653937.html,
38,,"['44.287210', '-121.503058']",2016-12-14 10:29,Large '17 white water canoe.,,5879411336,44.287210,17,-121.503058,,"https://maps.google.com/maps/preview/@44.287210,-121.503058,16z",,$200,human, (Bend/Sisters),CANOE sell or trade,https://bend.craigslist.org/boa/5879411336.html,
39,good,,2016-12-13 20:52,2 person Inflatable Canoe w/paddles. Great for river or lake. $50.00 OBO,,5896236218,,10,,Sevylor,,,$50,human, (Bend),Sevylor inflatable canoe w/paddles,https://bend.craigslist.org/boa/5896236218.html,
40,,"['43.709100', '-121.519400']",2016-12-13 20:21,"21' 8"" Custom Made Wood Lex Boat by Lex Fromm. It has a 90 inch beam. Great fishing and crabbing boat. (02) 25 hp Yamaha, (01) 9.9 Merc kicker just had carb cleaned by certified mechanic April 2016 Runs great. Galvanized E-Z load trailer with spare tire. May 2015 Les Schwab replaced and packed bearings on trailer. Boat is in my garage in La Pine Oregon. Boat is titled in Mt. and have it in my hand. 5four1 215 seven9one8",,5880091436,43.709100,21,-121.519400,Wedderburn,"https://maps.google.com/maps/preview/@43.709100,-121.519400,16z",Jet sled 21,$4500,power, (La Pine),21' Lex Fromm Rouge River,https://bend.craigslist.org/boa/5880091436.html,1992
41,,"['43.709100', '-121.519400']",2016-12-13 20:21,"21' 8"" Custom Made Wood Lex Boat by Lex Fromm. It has a 90 inch beam. Great fishing and crabbing boat. (02) 25 hp Yamaha, (01) 9.9 Merc kicker just had carb cleaned by certified mechanic April 2016 Runs great. Galvanized E-Z load trailer with spare tire. May 2015 Les Schwab replaced and packed bearings on trailer. Boat is in my garage in La Pine Oregon. Boat is titled in Mt. and have it in my hand. 5four1 215 seven9one8",,5880087502,43.709100,21,-121.519400,Wedderburn,"https://maps.google.com/maps/preview/@43.709100,-121.519400,16z",Jet sled 21,$4500,power, (La Pine),21' Lex Fromm Rouge River,https://bend.craigslist.org/boa/5880087502.html,1992
42,,,2016-12-13 16:42,"This is a nice 20ft inboard/outboard ski boat with a 350 sbc Chevy and a Volvo pentadrive. I bought this boat as a project a little while back it had a cracked block due to not being winterized properly but otherwise in good shape. I swapped in a nice low mile 350 Chevy, it has all new seals, flywheel, oil pump, newly rebuilt heads, lifters, pushrods, brass freeze plugs, edelbrock intake and carb. It has new oil with break in additive in it. I just recently got it all together and I haven't started it yet due to the cold weather and I don't want to deal with winterizing it again with the cold temps. It will need a battery and to be started and ran through its break in cycle I do have a battery to show everything works. I have titles for both the boat and trailer. I need the storage space it is occupying and my interest have changed. I'm asking $1800 for it. Call, text, or email me if interested. Thanks.",0,5908346283,,20,,Baretta,,,$1750,power, (Sisters),1988 20ft Baretta Ski Boat New Motor,https://bend.craigslist.org/boa/5908346283.html,1988
43,fair,,2016-12-13 09:38,Great boat! Solid hull good trailer and tires motor runs great but won't start due to the electric if connected to another starter system it'd fire up great includes brand new fish finder as well as a vhf radio life jackets anchor swim ladder towable tube it's a great deal easily 1500 worth of stuff call or txt no email show contact info MUST GO SOON !!!,,5917741265,,16,,Glaspar,,Tucker Portlock,$500,power, (Toledo/Newport),1972 glaspar Trihull PRICE DROP!,https://bend.craigslist.org/boa/5917741265.html,1972
44,excellent,,2016-12-13 09:31,"1979 SUNDANCE DRAG BOAT FOR SALE BY OWNER: Custom built Chevy 350 V-8 with aluminum high rise intake, Holley 650 double pumper carberator, water cooled chrome headers, chrome valve covers, Holley high pressure fuel pump, new battery, new boat cover, new anchor, new rugs, trailer is tandem axle with aluminum wheels, and bearing buddies. 2 New front seat upholstery($400), floor accelerator pedal, Mercruiser out drive, 5 blade staineless steel prop, great on fuel, and will do 0 to 50 in about a second. boat is mechanically sound, retro and runs great, orange and rootbeer brown metallic paint. $1000s of dollars in upgrades and parts. $7500.00 OBO 541 233-8sevenzerosix, no scams, soliciting, or advertisers, calls preferred, rarely check e-mails.",,5917707073,,17,,SUNDANCE,,,$7500,power, (PRINEVILLE),1979 SUNDANCE DRAG BOAT,https://bend.craigslist.org/boa/5917707073.html,1979
45,excellent,[],2016-12-13 09:08,I am selling my bike for $100 bucks and will consider reasonable best offers or trades. The bike is a Genesis GS29. It's color scheme is bright green black and white. I purchased it new about 3 months ago but sadly I don't really have a need to ride it. I'm sure there is someone who could use this bike more than I  so please call meat any time if you are interesred :),,5917687265,,4,,,https://maps.google.com/?q=loc%3A+%32%33%33%32+NE+Ocker+Dr+Bend+OR+US,,$100,human, (Bend),Bike (Genesis GS29) for sale in great condition,https://bend.craigslist.org/boa/5917687265.html,
46,,"['44.276700', '-121.189600']",2016-12-13 02:21,Beautiful wood and very functional ...never been used,,5874633002,44.276700,8,-121.189600,,"https://maps.google.com/maps/preview/@44.276700,-121.189600,16z",,$79,human, (great christmas gift),canada kayak paddle,https://bend.craigslist.org/boa/5874633002.html,
47,good,"['44.370471', '-120.676231']",2016-12-12 16:29,19.8 marlin great fish and ski runs needs motor work.Trailers needs title lost it. show contact info,,5909857577,44.370471,19,-120.676231,Marlin,"https://maps.google.com/maps/preview/@44.370471,-120.676231,16z",,$1000,power, (Prineville),Marlin,https://bend.craigslist.org/boa/5909857577.html,
48,fair,,2016-12-12 01:55,"Great Boat, everything is great on this boat, all it needs is a started and you will be goin on the lake in no time. Asking $999. just need it gone asap.",,5915816588,,16,,Larson,,4,$250,power, (Bend/sisters),1982 larson inboard/outboad,https://bend.craigslist.org/boa/5915816588.html,1982
49,like new,,2016-12-12 00:44,I have a super clean The Creek Company ODC Sport only taken out a few times no leaks or cracks or rust on the frame  has been stored inside its hole life. Come by and grab this sweet little boat for fishing season this year. asking $200 Monday thru Friday is the best time to get ahold of me show contact info r just shoot me a email.,,5884894423,,8,,The Creek Company,,ODC Sport,$200,human, (Madras),The Creek Company ODC Sport,https://bend.craigslist.org/boa/5884894423.html,
50,,"['44.297291', '-121.141090']",2016-12-11 15:10,"adjustable ...will grab onto you factory racks 48"" bars",,5874152544,44.297291,48,-121.141090,,"https://maps.google.com/maps/preview/@44.297291,-121.141090,16z",,$99,human,,complete yakima rack system,https://bend.craigslist.org/boa/5874152544.html,
51,,"['44.035002', '-121.290272']",2016-12-11 14:30,good Merc 4.5 ....needs small plastic connector between throttle and carb....was running when stopped.....includes gas tank.    75.00.......trades.,,5897833364,44.035002,2,-121.290272,,"https://maps.google.com/maps/preview/@44.035002,-121.290272,16z",,$75,power, (BEND),mercury 4.5,https://bend.craigslist.org/boa/5897833364.html,
52,,"['44.390900', '-121.237900']",2016-12-11 11:30,"Good condition. Brand new motor and lower seals. Just don't have time for it. CD player with 4 speakers, cover, tube, skis and spare tire. Wakeboards and asessories.",,5880232937,44.390900,18,-121.237900,,"https://maps.google.com/maps/preview/@44.390900,-121.237900,16z",,$6500,power, (Terrebonne),"2005 Bayliner 175, 135hp",https://bend.craigslist.org/boa/5880232937.html,
53,good,"['44.092800', '-121.293600']",2016-12-11 07:16,"Easy to use removable roof racks that hold 2 boats  $35 Great shape, hardly used. Cash only",,5873375529,44.092800,10,-121.293600,,"https://maps.google.com/maps/preview/@44.092800,-121.293600,16z",,$35,human, (Bend),Swiss cargo car racks for kayaks,https://bend.craigslist.org/boa/5873375529.html,
54,new,"['44.637600', '-121.134900']",2016-12-11 00:14,2 bumpers and replica key float. Never used,,5914567787,44.637600,2,-121.134900,,"https://maps.google.com/maps/preview/@44.637600,-121.134900,16z",,$35,human, (Madras),OSU bumpers,https://bend.craigslist.org/boa/5914567787.html,
55,good,"['44.022300', '-121.298500']",2016-12-10 19:32,18 foot apollo boat great boat neads mortor comes with parts for two vol vo penta 170 motors and trailer great boat but     I dont have money to fix call show contact info and two 280 out drives *+ other parts,,5885739828,44.022300,18,-121.298500,apolllo,"https://maps.google.com/maps/preview/@44.022300,-121.298500,16z",,$700,power, (drw),18 foot boat,https://bend.craigslist.org/boa/5885739828.html,
56,good,,2016-12-10 19:12,laser in Sparkletts green color. complete with galvanized trailer and launching dolly. Has been garaged for last 14 years. has a small chip in the fiberglass on the bow that can be easily fixed. Has a carbon fiber boom. built in storage plug. tows easily behind a compact vehicle.trailer has 1 7/8 inch coupler. trailer has lights all in working order.,,5914414908,,14,,Laser,,14 ft,$900,sail, (La Pine),laser sailboat,https://bend.craigslist.org/boa/5914414908.html,
57,excellent,[],2016-12-10 15:48,"THIS HENRY'S FORK DAVE SCADDON BOAT IS IN GREAT SHAPE WITH CARRY BAGS AND XTRA OAR. THIS BOAT SOLD FOR 1,500 NEW AND IS IN GREAT CONDITION. FIRST COME FIRST SERVE! METAL CARRIER AND COMFORTABLE SEAT. THIS BOAT IS TOUGH AND BUILT WITH QUALITY MATERIALS AND WILL BE FISHED FOR YEARS.",,5879602361,,9,,HENRY'S FORK,https://maps.google.com/?q=loc%3A+%31%36%31%37%34+FOOTHILL+LOOP+S+SISTERS+OR+US,SCADDON SIGNATURE,$675,human, (SISTERS),9' PONTOON BOAT DAVE SCADDON SIGNATURE SERIES,https://bend.craigslist.org/boa/5879602361.html,
58,,"['45.603200', '-122.513300']",2016-12-10 12:38,"Hello I am selling some beautiful custom made Diamond Plate Seat boxes. These are the finest out there made and with all stainless steel hardware. The boxes measure 18""x18""x12"". There made from top quality materials with the finest of craftsmanship. They have very strong quality wire which holds the lids open and top quality locking mechanisms which will not ware out like rubber ones which dry and crack. These boxes are made to be used in saltwater or anywhere your boat will take you! Thanks Jeff columbia river, columbia, hiking, clackacraft, clacka craft, lamiglas, gloomis, g loomis, fishing, fish, salmon, trout, steelhead, steel head, guide, guided, washington, oregon, floating, pump, yamaha, mercury, johnson, boat, sled, trailer, rogue, ez loader, ezloader, lure, daiwa, reel, antique, tackle, tackle box, plug, prop, koffler, drift boat, drift boat, wilson, trask, alumaweld, seat box, seat, diamond plate, float fishing, float, raft, pontoon, side drifting, back trolling, river wild, riverwild, northwest, northwest jet, stevens marine, stevensmarine.",,5913991148,45.603200,18,-122.513300,,"https://maps.google.com/maps/preview/@45.603200,-122.513300,16z",,$220,human,,Diamond Plate Seat Boxes,https://bend.craigslist.org/boa/5913991148.html,
59,good,"['44.637600', '-121.134900']",2016-12-10 06:54,"12ft aluminum boat and trailer, with seats, paddles, anchor,and trailer. No motor.  O.B.O.",,5899328533,44.637600,12,-121.134900,,"https://maps.google.com/maps/preview/@44.637600,-121.134900,16z",,$400,power, (Madras),12ft Aluminum Boat,https://bend.craigslist.org/boa/5899328533.html,
60,,,2016-12-09 17:26,"12' alumacraft boat and trailer Great running 4.5 HP Mercury Includes oars, anchor, spare tire, fuel tank and 2 seats. This has been a great little boat but my family has outgrown it. $750",,5913000737,,12,,Alumacraft,,,$750,power, (Bend),12' alumacraft boat,https://bend.craigslist.org/boa/5913000737.html,1976
61,,"['44.056999', '-121.333694']",2016-12-09 16:35,"Boat is set up for lake trolling with penn downriggers, troll motor, depth finder, and a lot of open space to fish. Also a great boat for someone looking to restore an old classic. This boat is for the guy looking for a inexpensive boat to get out on our lakes and catch big trout.. Boat fishes 3 comfortably, and runs great. Great boat, I am now upgrading in size to allow for ocean access. This is a very roomy boat for the size which was very appalling to me for fishing. . Let me know if you would like to see it. . .. If your looking for a way to fish the lakes around here for the big ones this is a great option for low cost. obo",,5912948817,44.056999,15,-121.333694,glasspar,"https://maps.google.com/maps/preview/@44.056999,-121.333694,16z",,$1000,power,,15' Glasspar 1955 30 hp,https://bend.craigslist.org/boa/5912948817.html,
62,good,"['43.666059', '-121.507888']",2016-12-09 14:42,I have an 11 FT livingston with trailer for $800 and a 18ft canoe for $100 email for pics ONLY serious inquiries please,,5912813159,43.666059,11,-121.507888,,"https://maps.google.com/maps/preview/@43.666059,-121.507888,16z",,$800,power, (La Pine),11 FT Livingston,https://bend.craigslist.org/boa/5912813159.html,
63,excellent,"['44.092800', '-121.293600']",2016-12-09 11:36,"We just got in this 2004 Ski Supreme Sky Supreme 220 SP 22 Ft. Ski/Wakeboard boat equipped with a Mercury Mercruiser 350 MAG MPI 300 HP Engine with 264 Hours, Tower, Wakeboard Racks, Bimini Top, Sony Stereo with CD, Center Ballast, Teak Swim Platform, Rear View Mirror, Heater, and Supreme Tandem Trailer with Brand New ST205/75R14 Tires and Swing Away Tongue. As you can see in my pictures this boat has been well cared for by its previous Owner. We also have compression test results for your review. We have it priced for quick sale at 18,995.00. Call Pat Andersch at 541-419-2811, Bend OR. Auto Network Group NW, INC. is located at 63227 Service Road, Bend OR 97701 OR Dealer #8692",264,5912532507,44.092800,22,-121.293600,Sky Supreme,"https://maps.google.com/maps/preview/@44.092800,-121.293600,16z",220 SP,$18995,power, (Bend OR),2004 Ski Supreme Sky Supreme 220 SP Ski/Wakeboard Boat,https://bend.craigslist.org/bod/5912532507.html,2004
64,,"['43.843100', '-121.576400']",2016-12-09 10:25,Coho salmon cleaning station for hooking on side of boat New Will sell for $20.00,0,5873352176,43.843100,30,-121.576400,coho,"https://maps.google.com/maps/preview/@43.843100,-121.576400,16z",cleaning,$20,human, (Bend),Coho cleaning station for boat g unnal,https://bend.craigslist.org/boa/5873352176.html,0
65,,"['44.022300', '-121.298500']",2016-12-09 08:44,Jackson 4 fun kayak excellent cond. Whitewater kayak,,5912234036,44.022300,7,-121.298500,,"https://maps.google.com/maps/preview/@44.022300,-121.298500,16z",,$500,human, (Bend),Jackson 4 fun kayak excellent cond.,https://bend.craigslist.org/boa/5912234036.html,
66,excellent,[],2016-12-08 18:50,Will discount $1700 off price for a Christmas gift sale at $4500.00 this is a 1992 blue water cuddy cabin. New starter! We just had mechanic put a new GM 4.3 6 cyl. engine in it. Used the boat for only a day and runs great. All weatherized through winter. This is a 4 sleeper ski and fishing boat with like new sleeper! New alpha Generation 2 Sterndrive kit installed! Lubed and ready to go. Fish finder and stereo are good. Sale Price $6200! Engine cost $4400 installed. Have all engine install records. All fiberglass. EZ loader trailer goes with sale and new trailer lights plus all new up to date tags and registration. Clean titles for both trailer and boat. 541-58 zero-733four. OBO.,9,5911656906,,19,,Blue Water,https://maps.google.com/?q=loc%3A+Seagull+dr%2E+Bonanza+OR+US,Mercruiser,$6200,power, (Bonanza OR.),Fishing or ski boat with New Engine great Discount for Christmas gift!,https://bend.craigslist.org/boa/5911656906.html,
67,excellent,,2016-12-08 11:36,"Excellent condition Current Designs Extreme (Nomad) for sale. Kayak has watertight fore and aft fiberglass hatches, a deployable foot-controlled rudder, and provides a dry and stable ride. This kayak is very fast and tracks like an arrow. Specs are 18' 10"" long, 21.25"" beam, soft chine, fish form. CD still makes this kayak but has re-branded it as the ""Nomad"". For the past three years it has only been used as a guest boat. Always stored inside, meticulously cleaned and maintained, safely transported, never dragged or scraped on rocks, and in nearly flawless condition with no damage or repairs. Please email if interested.",,5911110310,,19,,Current Designs,,Extreme (Nomad),$1600,human, (SE Bend),Current Designs Extreme Kayak,https://bend.craigslist.org/boa/5911110310.html,2004
68,like new,,2016-12-08 07:53,"2007 Specialty Marine Double end 16' 4"" foot alum. drift boat. Seats 4 people, 9 foot Carlisle Oars, 1994  8hp long shaft 2 stroke Mercury outboard motor, runs good, low hours. Bottom spray coated with Black Polyurea, complete inside spray coated with Gray Polyurea, used for lake fishing.  $6,000 show contact info",,5910734074,,17,,Alum.,,,$6000,power," (Redmond, Ore)","2007  16'4"" ft. Alum. Drift Boat",https://bend.craigslist.org/boa/5910734074.html,2007
69,good,,2016-12-07 18:50,"Looking to sell my Drift Boat. Comes with a trailer that is valued at $1200. Only thing left to do is the finish work and putting your Logo on the side of the boat. Comes with the oars, storage box, new tires. Any questions??? Text or call!! Thanks for looking 541-325-one six five one",,5875445162,,12,,,,,$750,human, (Sunriver),Drift boat $750 OBO,https://bend.craigslist.org/boa/5875445162.html,
70,fair,,2016-12-07 15:15,"14 foot maravia williwaw self bailer,old lots of patches needs to be topped off with air in the mornings on multi day trips,boat still keeps going,i own other boats but we still use this raft quite a bit,one of my favorite boats ive owned but need the room now so sadly time to sell it, boat only does not include frame or oars $800 obo ......update i will sell a whole package for $1700 nrs frame,cooler,2 brand new sawyer polecat oars 1 carlisle oar for spare,would also consider decent snowmobile  trade",,5910011190,,14,,maravia,,williwaw,$1700,human, (bend),maravia raft,https://bend.craigslist.org/boa/5910011190.html,1993
71,good,"['44.258970', '-121.209412']",2016-12-07 05:21,Sea King 1981 12' 8 Horse Pwr Suzuki Motor 2 Stroke,,5876132606,44.258970,12,-121.209412,Sea King,"https://maps.google.com/maps/preview/@44.258970,-121.209412,16z",,,power,,12' Boat $1500 OBO,https://bend.craigslist.org/boa/5876132606.html,1981
72,like new,"['46.213360', '-119.299464']",2016-12-06 15:18,"JUST REDUCED FOR A GREAT CHRISTMAS GIFT !!!!! Brand new (never in water) Fish Cat 4-LCS float tube, including hand pump and emergency paddle. Online value is around $260. Will sell for $165.00 obo",,5871349844,46.213360,54,-119.299464,Outdoor Sporting Gear,"https://maps.google.com/maps/preview/@46.213360,-119.299464,16z",Fish Cat 4-LCS,$165,human," (Kennewick, WA)",Fish Cat 4-LCS Float-Tube,https://bend.craigslist.org/boa/5871349844.html,
73,,,2016-12-06 12:48,"14 ft. aluminum flat bottom boat w/trailer and 15hp 2-stroke Mercury motor. Bilge pump, side consol, horn, lights, 2 down riggers, 2 anchors. $2000 or best. Calls only.",,5874417920,,14,,,,,$2000,power, (La Pine),14ft aluminum flat bottom,https://bend.craigslist.org/boa/5874417920.html,
74,,,2016-12-06 11:35,"1984 18 foot Seaswirl.  There is a crack in the block so is unusable. V6 omc stern drive engine. Features a Lowrance 2460 depth sounder and z-7200 liquid crystal graph sonar display. Includes shade protection canvas with storage.  Trailer is also 1984, unladen weight of 500 lbs, self braking class AJ carrier type.  price is $1000",,5868404911,,18,,Seaswirl,,,$800,power, (Redmond),1984 18 ft. Seaswirl boat with trailer- cracked engine head,https://bend.craigslist.org/boa/5868404911.html,1984
75,good,,2016-12-06 09:33,1998 seadoo gtx bombardier comes with trailer. Reason for the price being a little low is that it has a charge problem but not to expensive to fix. Has a newer engine and starts  right up with no problems has no issues other than the one stated above.,,5892134294,,12,,,,,$1350,power, (Sisters),Seadoo,https://bend.craigslist.org/boa/5892134294.html,
76,,"['43.709100', '-121.519400']",2016-12-05 22:19,"I need a older boat large 14ft prefer tri hull as I am not to steady, needs cleaning ok must have serviceable trailer, tiller steering ok. I am 85 years and like to fish so need boat easy to launch and recover, no projects don't have time for them Have larger boat but wife unable to help so I will be fishing solo. Thanks for reading please do not delete. Also I do not text please no texts.",,5907412679,43.709100,14,-121.519400,,"https://maps.google.com/maps/preview/@43.709100,-121.519400,16z",,$350,power, (lapine),boat wanted,https://bend.craigslist.org/boa/5907412679.html,
77,fair,,2016-12-05 16:00,I have for sale a 19.5ft Seaswirll boat that need some work. the engine is in good condition but need a riser (have) and elbow (have) steering good seats sun destroyed engine the same. Structurally the boat is sound on a calcans trailer. I cannot do the work any more and need the room. cash only,500,5907062276,,19,,seaswirll,,?,$700,power," (Madras, Or.)",19.5 seaswirll project boat,https://bend.craigslist.org/boa/5907062276.html,1976
78,good,"['44.188605', '-121.223145']",2016-12-05 12:05,"I have up for sale my boat with a 48hp Johnson and an electric trolling motor.  All the ""expensive"" and hard work has been done.  Johnson motor has been completely gone through by a mechanic, all trailer wiring has been updated, boat wiring has been gone through and updated.  All that is left is the cosmetic stuff. The boat is very solid and if you have a little time and some sandpaper and paint could be a great boat for next spring and summer.  Only selling because need work done on our other vehicles.  Asking $999.00 or open to possible trade for mechanical work on a 1973 Chevy truck and a 1984 K5 Blazer. Thank you...",,5864690530,44.188605,16,-121.223145,,"https://maps.google.com/maps/preview/@44.188605,-121.223145,16z",,$999,power, (Redmond),1972 16' Fiberglass w/ 48hp Johnson,https://bend.craigslist.org/boa/5864690530.html,1972
