,condition,coord_pair,date,description,engine hours (total),id,lat,length overall (LOA),long,make / manufacturer,map_URL,model name / number,price,propulsion type,region,title,url,year manufactured
87,,"['40.432200', '-80.102100']",2016-12-15 09:57,"Remodeled 95% inside,,, 2 engines,, 1 engines runs,,,, nice boat to have... will take $1000 cash down,, and you get title... then you can pay me other $1000 in march when you launch the boat on river to  see how she Runs,,, .MUST SELL....I really Have no time to enjoy it....will be showing it all weekend,, will have it on the river running near Oakmont,,, first come with cash gets it Why I'm selling It ? I only bought the Boat on July 2nd this year,, Just so i could enjoy the 4th of July Firework in Pittsburgh on the river,, however,, once we launched the Boat to began our journey,, the engine kept stalling,,, so we anchored it near Marina and went exploring why the engine kept stalling,, we changed spark plugs,, rotary and distributor cap, plug wires etc,, yet,, the engine kept stalling,,, after a few days we located the problem,, see last 3 pics below,,,, the fuel and water filter had rust in it and was polluting the carburetor,, so,, i removed it and ran a straight line to engine,, and the problem was solved,, so I have a new filter I have yet to install back on boat,,, to be honest,, I havnt been back up to the boat in 2 months,, i have no time,, so the boat just sat tied to shore for 7 weeks,, the marina owner took it upon himself to pull it out of the water for me and placed it in drydock,,, where it now sits,,,, I just do not have time for it..... https://youtu.be/h6aSXkU41eM Copy and just paste these links for a video inside boat https://www.youtube.com/watch?v=h6aSXkU41eM&feature=youtu.be NO LEAKS !!!! show contact info See Inside boat Video here >>> https://youtu.be/h6aSXkU41eM boat is at Logan's marina. 7 Coxcomb Hill Rd New Kensington, Pennsylvania",,5920177959,40.432200,40,-80.102100,,"https://maps.google.com/maps/preview/@40.432200,-80.102100,16z",,,power,,"1966--40 ft HouseBoat, 2 ~413 Chrysler Engines",https://pittsburgh.craigslist.org/boa/5920177959.html,
88,,,2016-12-15 02:53,"I spent last winter/spring/summer restoring this great boat. I received a number of compliments and questions about it every time I took it out. I'm looking to get a pontoon instead which is why we are selling it. Upgrades include: - Reinforced/re-fiberglassed Stringers - New Floor - New Carpeting - New Wiring, new 2 battery (1,2,both) system - New Bluetooth Gauge style stereo - New Seats - Freshly painted interior The boat is powered by a 115HP Mercury ""Tower of Power"" inline 6 cylinder outboard. I know it's the end of the season, and I need my garage back for the winter. $1,500 is as low as I can go. Comes with titled trailer in good condition and boat extras as well (some ropes, vests, skis, etc) Feel free to reach out with any questions. Thanks,",,5901852488,,19,,Thunderbird,,Falcon,$1500,power,,Classic Runabout - Thunderbird Falcon,https://pittsburgh.craigslist.org/boa/5901852488.html,1969
89,,"['40.185500', '-77.411400']",2016-12-14 22:37,"1985 14' double wide v-bottom Gruman. Solid boat, but could use a paint job. Comes with 2 anchors, life vests, gas tank, 2 aluminum oars, and steps for off the back. 1991 Johnson 15 in pristine shape. Outboard was found earlier this year with original owner's son. It had only been used a handful of times and has been sitting in his garage! Like new! Was gone over completely, and fuel pump was replaced. 1993 Calk Trailer with new wiring. Boat and trailer both have titles. Looking to trade for most anything of equal or greater value. No junk please. Some definite interests would be; Vintage camper (in good condition, small size), utility four wheeler, jeep wrangler, gas golf cart, etc. But text me other offers. Thanks for looking.",,5904835065,40.185500,14,-77.411400,,"https://maps.google.com/maps/preview/@40.185500,-77.411400,16z",,,power,,14' Aluminum Boat & Trailer TRADE!!,https://pittsburgh.craigslist.org/boa/5904835065.html,
90,,"['40.098615', '-79.656007']",2016-12-14 21:44,"Posting for a friend,please contact Jake at show contact info for details and showing of pontoon boat,thnx! Pontoon boat with double axle trailer,Evinrude 95 HP motor,only 38 hours! Extras: pole n anchor,ladder,life vests,and canopy! $8600.00 please cal number listed, show contact info Jake,thanks!",,5881497362,40.098615,24,-79.656007,,"https://maps.google.com/maps/preview/@40.098615,-79.656007,16z",,$8600,power, (Scottdale),Pontoon boat+ trailer,https://pittsburgh.craigslist.org/boa/5881497362.html,
91,excellent,,2016-12-14 20:52,"1996 Sea Ray Express Cruiser 215                                                                                                       $13,000.00 This 1996 Sea Ray Express Cruiser is the perfect all around boat. It boasts a deep hull, which allows for a large cuddy cabin and also a smooth ride through rough water. It's large enough to spend a weekend on the water and overnight stays, small enough to trailer and perfect for an all-day fishing trip. This is a very clean and professionally maintained boat. Title in hand for both trailer and boat. Fully loaded with options, lots of extras and runs perfectly! 5.7L Magnum/250hp Mercruiser engine (rebuilt in 2014) w/Alpha One Gen II Outdrive NEW starter put on last year Four blade prop for a better hole-shot and a NEW extra four blade prop included for back up Corsa thru-hull exhaust system Bottom paint Newly upholstered cushions and trim in cuddy area NEW 15amp electrical outlet in cuddy area NEW HD TV antenna and cable routing Ship to shore radio Cock-pit table set up Cock-pit lighting Cock-pit cover, bimini top and slant-back camper enclosure NEW cock-pit snap in rug NEW Premium 5 speaker Boss Marine Stereo system w/10"" subwoofer and 1000 watt amplifier Depth gauge On-board compass Bennet hydraulic trim tabs 8 gallon fresh water holding tank NEW pressurized on-demand freshwater system NEW transom Shower NEW 5-gallon self-contained toilet w/pump out option NEW 15amp on-board shore power NEW dual marine deep cycle batteries w/Perko battery switch NEW dual marine battery charger Transom rod-holders Lines, 4 extra-large fenders, life jackets, fire extinguisher, 2 anchors, 2 PFD's, oar, 2 telescoping boat hooks, all included! No Trades! Please email back with a phone number and you will be contacted directly. Thank you for your interest in this beautiful vessel!",,5919762761,,22,,Sea Ray,,Express Cruiser 215,$13000,power, (White Oak),1996 Sea Ray Express Cruiser,https://pittsburgh.craigslist.org/boa/5919762761.html,1996
92,fair,,2016-12-14 20:14,"17' fiberglass fishing boat, out board motor, and trailer. No title Last registered in 2004 Evinrude outboard  motor included. $600 cash or cash and trade. What have you? Looking for a crossbow and cash",,5919798846,,17,,Larson,,,$600,power, (WILKINSBURG),"BOAT,MOTOR, AND TRAILER",https://pittsburgh.craigslist.org/boa/5919798846.html,
93,good,"['40.513669', '-79.687443']",2016-12-14 18:19,Selling 198818 ft Sea Ray open bow. It has 3.0 mercruiser motor which is 4 cylinder. Don't let that fool you the boat has plenty of pick up and is quick. Comes with a 2003 completely galvanized trailer in great shape. The boat is in good shape in its own right. This is a great beginner boat. Comes with full cover and also bow cover. The trailer itself is worth $1500. Only reason I'm selling it is that my family and I have not used it as much as I thought we would. Only once this past summer and 3 times the summer before. will trade for the right enclosed 7x12 trailer with extra height. Text Andrew with any questions. I DO NOT need help selling this boat,,5919673432,40.513669,18,-79.687443,Sea Ray,"https://maps.google.com/maps/preview/@40.513669,-79.687443,16z",,$2600,power, (Upper Burrell),1988 18ft Sea Ray 4sale or trade 7x12 enclosed trailer,https://pittsburgh.craigslist.org/boa/5919673432.html,1988
94,good,"['40.849600', '-80.138100']",2016-12-14 15:01,"16' Grumman Aluminum Fishing/ Recreational Boat, Wide Beam, 10 H.P. motor, Steering Console, Built-in Fuel Tank, Rated Max Capacities of 8 people or 1130 LBS., Built-in Live Well, Trolling Motor, Garmin ""Fishfinder 140"", New Seats, Night Running Lights, Two  custom rod holders, Used only at Lake Arthur,  Boat in very good shape, Trailmaster Trailer needs sanding and painting, Fairly new cover, Boat has been kept in storage shed out of weather but has not been on water for two years.",,5919396093,40.849600,16,-80.138100,Grumman Boat Co,"https://maps.google.com/maps/preview/@40.849600,-80.138100,16z",16 SIDE CNSL,$4700,power, (Harmony),Grumman 16' Fishing/Recreation,https://pittsburgh.craigslist.org/boa/5919396093.html,1984
95,,"['40.024800', '-79.080800']",2016-12-14 12:04,"Hello, I am selling my 1990 Monark fish and ski boat. It has an 88 Evinrude outboard  motor with some work done to it, will do about 40 mph. It also has two live wells, built in cooler,  rod storage, ski storage, 25 gallon fuel tank and runs great. I just don't have the time to use it anymore. I am asking $3800 o.b.o. Please call or text me if your interested, have any questions or would like more pictures. show contact info Thanks",,5919099913,40.024800,19,-79.080800,,"https://maps.google.com/maps/preview/@40.024800,-79.080800,16z",,$3800,power, (Somerset PA),1990 Monark Fish and Ski,https://pittsburgh.craigslist.org/boa/5919099913.html,
96,,"['40.786300', '-79.521300']",2016-12-14 12:01,"reasonably priced parts,power trim and tilt,no controls,motor ran,but wrist pins are bad ,sold switchbox, has 4 year old electronics,selling parts only,thanks for your time",,5919093603,40.786300,10,-79.521300,,"https://maps.google.com/maps/preview/@40.786300,-79.521300,16z",,,power,,PARTS-1986 70 hp mercury parts only,https://pittsburgh.craigslist.org/boa/5919093603.html,
97,,,2016-12-14 09:49,"Up for sale is my 1990 Baka sk 190. It has a mercruiser 350 v8 with a velvet drive transmission that shifts flawlessly. The interior was redone 5 years ago with all new upholstery and carpet. Wakeboard tower is made by joystick towers and I have receipts for 3k in stereo equipment. Has a two battery setup for music. Trailer is in awesome shape with brand new tires and led lighting. This is by far the cleanest 1990 boat you will look at. It shines like new. The boat is currently indoor for winter. I will consider trades on this boat but please be realistic. I understand it is winter but I do not need to give the boat away. If you have any other questions please contact me. Thanks for looking! Keywords: mastercraft, nautique, supra moomba air wakesetter, cuddy, go fast, formula",,5918889151,,19,,,,,$7500,power, (Pittsburgh),Baja wakeboard/ski boat,https://pittsburgh.craigslist.org/boa/5918889151.html,
98,,,2016-12-14 08:15,"Retrofit Keel lifting kit replacement for Catalina 22.  Stainless cable and all parts,,  brand new still in package..",,5892024863,,22,,,,Catalina 22,$76,sail, (Wexford),Keel lifting kit for catalina 22 sailboat,https://pittsburgh.craigslist.org/boa/5892024863.html,
99,good,"['40.625200', '-79.944300']",2016-12-14 08:10,I have for sale a fish hunter inflatable boat. Boats in good condition has a patch on the underside. Only thing this needs is a patch on the inside floor and it will be good to go. Has battery pouch for trolling motor. Looking for 125 obo just need it out of my garage.,,5918787476,40.625200,12,-79.944300,,"https://maps.google.com/maps/preview/@40.625200,-79.944300,16z",,$125,human, (Gibsonia),Sevylor 360 fish hunter inflatable boat,https://pittsburgh.craigslist.org/boa/5918787476.html,
