,condition,coord_pair,date,description,engine hours (total),id,lat,length overall (LOA),long,make / manufacturer,map_URL,model name / number,price,propulsion type,region,title,url,year manufactured
0,excellent,,2016-12-20 15:01,"1995 Sea Ray 290. Boat is in outstanding condition. Low hours. Twin 4.3 V-6's. The cleanest 290 you will find. Boat stored inside in the winters. Trailer stored inside all year. The trailer is a 1996 Aluminum  tri axle with brand new brakes on all the axles. Newer frig. Life jackets,lines,fenders with covers,rugs and lots more included. $24,900.In Storage now. show contact info",500,5901644595,,29,,Sea Ray,,290,$24900,power, (Bentleyville),Sea Ray 290,https://pittsburgh.craigslist.org/boa/5901644595.html,
1,,"['40.561600', '-79.712900']",2016-12-20 14:36,"17' Aluminum Canoe With Minkota Tolling Motor and Bracket,Oars,Life Jackets,Anchor,and Car Carrying Kit  $650.00 show contact info",,5924401823,40.561600,17,-79.712900,,"https://maps.google.com/maps/preview/@40.561600,-79.712900,16z",,$650,human, (NEW KEN. PA.),17' Aluminum Canoe and Accessories,https://pittsburgh.craigslist.org/boa/5924401823.html,
2,good,"['42.721500', '-78.932700']",2016-12-20 13:33,16' Cherokee aluminum boat No leaks. Solid fishing platform. 3 seats. 2 batteries. 12 gallon gas tank.  Rod holder. 50 hp Johnson 2 stroke Runs perfect. 2003 6 hp mercury 4 stroke kicker. 55 lb. Thrust bow mount. All paperwork water ready. Trailer. Tom 71622nine-nine909.,,5916522262,42.721500,16,-78.932700,,"https://maps.google.com/maps/preview/@42.721500,-78.932700,16z",,$2750,power, (Lake view NY),16' Aluminum,https://pittsburgh.craigslist.org/boa/5916522262.html,
3,good,[],2016-12-20 13:07,"1988 Mach 1 Condur 27 foot boat with a 454-330 HP Mercruiser Bravo 1.  Stainless steel prop, new bellows, all fluids changed, new distributor cap, complete tune-up, new blower, new bilge, new interior, new carpeting, new trailer lights, safety chains, and wheel bearings.  Lots of trim on this boat with teak.  Beautiful cuddy with sleeping area and expandable cushions for a bigger sleeping area.  Refrigerator with fresh water sink.  also new starter .new cover.1988 Mach 1 Condur 27 foot boat with a 454-330 HP Mercruiser Bravo 1.  Stainless steel prop, new bellows, all fluids changed, new distributor cap, complete tune-up, new blower, new bilge, new interior, new carpeting, new trailer lights, safety chains, and wheel bearings.  Lots of trim on this boat with teak.  Beautiful cuddy with sleeping area and expandable cushions for a bigger sleeping area.  Refrigerator with fresh water sink.  also new starter .new cover.1988 Mach 1 Condur 27 foot boat with a 454-330 HP Mercruiser Bravo 1.  Stainless steel prop, new bellows, all fluids changed, new distributor cap, complete tune-up, new blower, new bilge, new interior, new carpeting, new trailer lights, safety chains, and wheel bearings.  Lots of trim on this boat with teak.  Beautiful cuddy with sleeping area and expandable cushions for a bigger sleeping area.  Refrigerator with fresh water sink.  also new starter .new cover.1988 Mach 1 Condur 27 foot boat with a 454-330 HP Mercruiser Bravo 1.  Stainless steel prop, new bellows, all fluids changed, new distributor cap, complete tune-up, new blower, new bilge, new interior, new carpeting, new trailer lights, safety chains, and wheel bearings.  Lots of trim on this boat with teak.  Beautiful cuddy with sleeping area and expandable cushions for a bigger sleeping area.  Refrigerator with fresh water sink.  also new starter .new cover.",,5927015023,,27,,MACH 1,https://maps.google.com/?q=loc%3A+%34%30%33+OLD+NATIONAL+PIKE+BROWNSVILLE+PA+US,,$12500,power, (BROWNSVILLE),1988 Mach 1 Condur boat and trailer,https://pittsburgh.craigslist.org/boa/5927015023.html,1988
4,good,"['40.219200', '-79.609500']",2016-12-20 12:45,"2000, 17' fisher bass boat. Has 9.9 Johnson on it, was never used much so low hours. Bow mount trolling motor with foot controls. Everything works and runs excellent. Titles for both in hand. Everything you need to get onto the water now for some walleye or musky fishing or for spring.",,5892551067,40.219200,17,-79.609500,,"https://maps.google.com/maps/preview/@40.219200,-79.609500,16z",,$6500,power,,17' bass boat,https://pittsburgh.craigslist.org/boa/5892551067.html,2000
5,,"['40.634400', '-79.620100']",2016-12-20 10:58,305 Chevy. Runs good. Just put motor in. New fuel pump. New starter. New impeller. Boat goes 35mph on gps. Bimini top. trailer needs work (no trailer title)  Can haul boat on my trailer and deliver or you can bring tires for trailer & haul yourself. Will consider trades,,5926802879,40.634400,21,-79.620100,,"https://maps.google.com/maps/preview/@40.634400,-79.620100,16z",,$3500,power, (Leechburg),83 210 sea ray cuddy,https://pittsburgh.craigslist.org/boa/5926802879.html,
6,,"['40.294715', '-79.545479']",2016-12-20 09:32,Boat Molds / Bass Boat Heavy Molds with bracing. Complete with all patterns. All tooling and patterns to build boats. Delivery available. START YOUR OWN BOAT BUSINESS.,,5926685625,40.294715,17,-79.545479,,"https://maps.google.com/maps/preview/@40.294715,-79.545479,16z",,$4500,power, (Greensburg),Boat Molds / Bass Boat,https://pittsburgh.craigslist.org/boa/5926685625.html,
7,,,2016-12-20 08:30,"1989 Evinrude 25hp motor. electric start, tiller control, short shaft. $700obo",,5926621858,,1,,,,,$700,power, (Poland),Evinrude 25hp,https://pittsburgh.craigslist.org/boa/5926621858.html,
8,like new,"['40.259300', '-79.975300']",2016-12-20 08:14,Minn Kota trolling motor new in box 28lbs thrust,0,5923246579,40.259300,28,-79.975300,Minn kota,"https://maps.google.com/maps/preview/@40.259300,-79.975300,16z",Classic,$80,power, (Finleyville),Minn Kota trolling motor,https://pittsburgh.craigslist.org/boa/5923246579.html,2012
9,good,"['40.307400', '-79.542400']",2016-12-20 06:49,"I have a sprint 255 bass boat 15' with a 50hp evinrude motor as well as a trolling motor,2 new battery's , engine fully serviced 2 weeks ago by donegal marina. I put over $2200 in this boat. Runs awesome,looks awesome. New tires and new custom made charcoal cover. Have clean title for boat and trailer. 724::four5four////six53six too has life jackets,2 live wells and fish finder. MAY TRADE.",50,5920314968,40.307400,15,-79.542400,Sprint,"https://maps.google.com/maps/preview/@40.307400,-79.542400,16z",255,$4999,power, (GREENSBURG),94 SPRINT 255 50HP EVINRUDE BASS BOAT NICE!!!!,https://pittsburgh.craigslist.org/boa/5920314968.html,
10,,"['40.458400', '-80.264900']",2016-12-20 05:16,winter boat storage $35 a month show contact info joe,,5926530496,40.458400,13,-80.264900,,"https://maps.google.com/maps/preview/@40.458400,-80.264900,16z",,$35,human, (AIRPORT),WINTER  STROAGE,https://pittsburgh.craigslist.org/boa/5926530496.html,
11,good,"['40.402900', '-80.091500']",2016-12-19 21:58,Hi I have a 1988 Volvo Penta Sunrunner 27 1/2 foot cabin cruiser  many new parts on it rebuild the outdrive new gauges tuneup on the motor  runs very great The boat is in the water waiting for you  I am asking 8000or best offer,,5919820579,40.402900,27,-80.091500,Volvo Penta,"https://maps.google.com/maps/preview/@40.402900,-80.091500,16z",Sunrunner,$9,power, (Scott Town),Volvo Penta Sunrunner,https://pittsburgh.craigslist.org/boa/5919820579.html,1988
12,good,"['40.402900', '-80.091500']",2016-12-19 21:55,Hi I have a 1988 Volvo Penta Sunrunner 27 1/2 foot cabin cruiser  many new parts on it rebuild the outdrive new gauges tuneup on the motor  runs very great The boat is in the water waiting for you  I am asking 9K or best offer,,5923608518,40.402900,27,-80.091500,Volvo Penta,"https://maps.google.com/maps/preview/@40.402900,-80.091500,16z",Sunrunner,$9,power, (Scott Town),Volvo Penta Sunrunner,https://pittsburgh.craigslist.org/boa/5923608518.html,1988
13,good,"['40.407200', '-79.983900']",2016-12-19 21:40,978 SeaRay V-220 22' with Cuddy Chevy 350 SS prop Nice Heavy Duty Tandem Axle Trailer Has Surge Brakes Good solid Boat. Needs a few odds and ends... Call 4122eight7073eight,,5912137034,40.407200,22,-79.983900,Sea Ray,"https://maps.google.com/maps/preview/@40.407200,-79.983900,16z",V-220,$2150,power,,Sea Ray V 220  With Cuddy $2150.00,https://pittsburgh.craigslist.org/boa/5912137034.html,
14,,"['40.385700', '-79.722300']",2016-12-19 19:19,Kawasaki is in good condition and runs. Needs only a battery. The polaris has a good motor but a melted wire harness needs replaced. Titles for both. The trailer has new hubs and bearings and needs nothing.,,5926169681,40.385700,8,-79.722300,,"https://maps.google.com/maps/preview/@40.385700,-79.722300,16z",,$1450,power,,"Kawasaki 1100STX, Polaris 750",https://pittsburgh.craigslist.org/boa/5926169681.html,
15,good,"['41.002200', '-79.716000']",2016-12-19 18:26,"14' classic Glen l  ""zip"" boat, wooden kit. 14' long, plastic windshield, spun aluminum gas tank, redone top edges, marine cleared, painted white on sides.........price is without motor & controls, obo.....sits on old Montgomery Wards trailer, new tires & wheels, lights.........boat has title, trailer does not.",,5903663615,41.002200,14,-79.716000,glen L,"https://maps.google.com/maps/preview/@41.002200,-79.716000,16z",zip,$1000,power, (karns city),1960 Glen L zip kit wood boat,https://pittsburgh.craigslist.org/boa/5903663615.html,
16,,"['41.002200', '-79.716000']",2016-12-19 18:21,"1964 Buehler Turbocraft Contessa......slant 6 Chrysler out of 64 truck, comes with original slant aswell from boat, Hamilton Jet drive, boat re gelcoated and metal flaked on top, redone chrome, bucket seats, new floor on passenger side.....needs wired under dash, it's all there-needs hooked up to gauges etc......also twin 2 bbl intake set up w/ holly 94s jet boat, Buehler, turbocraft, vintage boat, slant 6, mopar, runabout, fiberglass boat",,5926104524,41.002200,16,-79.716000,,"https://maps.google.com/maps/preview/@41.002200,-79.716000,16z",,$2000,power, (karn city),1964 Buehler Turbocraft Contessa,https://pittsburgh.craigslist.org/boa/5926104524.html,
17,,"['40.431887', '-80.056778']",2016-12-19 17:40,"1997 Kawasaki ZXI 750 with Clean and Clear PA title for Hull, no title for the trailer. Motorcycle is not for sale, I just don't have any individual pictures of the jet-ski itself. Top and needs rebuilt and with my current job/hours, I do not have time and when I do get the time, it is the least of my concerns since I have lost interest. Many extras that go with it.... spend a couple hundred bucks on parts plus your labor this winter and have a bad ass, reliable jet ski next spring  for just under a grand!!",,5907610103,40.431887,8,-80.056778,,"https://maps.google.com/maps/preview/@40.431887,-80.056778,16z",,$700,power, (clarion),Kawasaki ZXI-750 Jet Ski,https://pittsburgh.craigslist.org/boa/5907610103.html,
18,,"['40.604700', '-80.100803']",2016-12-19 17:25,ready to go! trades? show contact info,,5900684198,40.604700,20,-80.100803,,"https://maps.google.com/maps/preview/@40.604700,-80.100803,16z",,$1500,power,,89 chapparel 198 cxl  TRADE? SPECIAL! $1500 FIRM!,https://pittsburgh.craigslist.org/boa/5900684198.html,
19,excellent,"['40.505100', '-80.115500']",2016-12-19 16:53,"Beautiful boat, clean, low hours, call text or email with any questions. Below book value for winter pricing. show contact info",224,5925922996,40.505100,23,-80.115500,glastron,"https://maps.google.com/maps/preview/@40.505100,-80.115500,16z",,$24500,power, (Neville Island),2009 Glastron 225GT Wake,https://pittsburgh.craigslist.org/boa/5925922996.html,
20,good,,2016-12-19 16:48,"1997 SYLVAN DEEP V ,has live well,fish finder,trolling motor,3 seats,new boat cover,25hp Mercury electric start,drive on trailer with spare, boat is in nice condition...asking $2500 or best offer.. will post pics later.please call show contact info",,5925981572,,15,,,,,,power,,15ft  SYLVAN DEEP V 25hp MERCURY,https://pittsburgh.craigslist.org/boa/5925981572.html,
21,good,"['40.762300', '-82.525400']",2016-12-19 14:53,Fishing boat with an Evinrude 9.9 HP outboard engine that runs like new! Equipped with a custom side console with steering wheel and controls. A large open area with carpeted flooring. No Trailer but comes with a boat ramp as shown. Call me for more details and thanks for looking!,,5925807908,40.762300,13,-82.525400,SeaNymph,"https://maps.google.com/maps/preview/@40.762300,-82.525400,16z",,$2500,power,,SeaNymph 13ft fishing boat,https://pittsburgh.craigslist.org/boa/5925807908.html,1976
22,excellent,"['41.476300', '-81.334200']",2016-12-19 14:50,Fully restored 1958 Crestliner Voyager (16ft) with a 1968 Mercury 500 (50hp) outboard and trailer. Before and After photos as shown. Please contact me for further details.,,5925802759,41.476300,16,-81.334200,Crestliner,"https://maps.google.com/maps/preview/@41.476300,-81.334200,16z",Voyager,$6000,power,,Crestliner Voyager Boat - 1958,https://pittsburgh.craigslist.org/boa/5925802759.html,1958
23,,"['40.259300', '-79.975300']",2016-12-19 13:57,Good condition titles for all 3 haven't been ran in 2 years well taken care of 2000 firm both run might need carbs cleaned from sitting but getc ready for summer now please enter email me and I will get back to you sorry but to much spam thank you,,5925717156,40.259300,8,-79.975300,,"https://maps.google.com/maps/preview/@40.259300,-79.975300,16z",,$2000,power,,96 seadoo spx 96 gsx double trailer,https://pittsburgh.craigslist.org/boa/5925717156.html,
24,,,2016-12-19 13:36,"1986 deep v fishing boat.  On a 1989 trailer. Comes with motor, oars, life jackets & fish finder. $1200 Obo call Michael show contact info",,5900567048,,14,,,,,$1200,power, (Ligonier),Deep v fishing boat,https://pittsburgh.craigslist.org/boa/5900567048.html,1986
25,fair,,2016-12-19 10:33,Have a older boat not sure of the exzact name on it its 18ft needs a little restoring but floats last time we had it in the water comes with trailor and everything 600 obo,,5925376455,,18,,,,,$600,power,,Older 18ft boat,https://pittsburgh.craigslist.org/boa/5925376455.html,
26,,"['40.504800', '-79.913800']",2016-12-19 10:03,Looking to upgrade so gotta sell fast. Runs good for an old girl. I take her out 2-3 times a week so she isn't a float home. I used it a lot this summer. Great first boat! Email with any questions. Has a merc260 only 300 hours on the new motor.,,5909030270,40.504800,28,-79.913800,Bayliner Victoria,"https://maps.google.com/maps/preview/@40.504800,-79.913800,16z",,$4900,power, (Pittsburgh),1980 bayliner 270,https://pittsburgh.craigslist.org/boa/5909030270.html,
27,new,[],2016-12-19 10:01,"We are lucky enough to have one of these highly anticipated kayaks in our possession, most dealers are selling out of them right and we are off season! We are an authorized dealer so you will receive full factory warranty a well as customer service and backing from a trusted dealer of nearly 80 years. With the purchase of this kayak you will receive a free Carlisle 250 cm Predator angler paddle worth 110.00 as well as 10% off of your other paddlesports accessories. Give us a call for more information or just stop by our little shop to check out our vast inventory from over 9 quality brands of canoes and kayaks. The PDL we have in stock is Brown Camo, we are also taking orders for Winter and Spring. Phone: Eight 1 four 51Eight 5 Five zero 9",,5925297739,,13,,Old Town,https://maps.google.com/?q=loc%3A+%32%31%35+%37th+St+FRANKLIN+PA+US,Predator PDL,$2799,human, (FRANKLIN),OLD TOWN PREDATOR PDL PEDAL DRIVE FISHING KAYAK ALL NEW SOUGHT AFTER!!,https://pittsburgh.craigslist.org/boa/5925297739.html,2017
28,good,"['40.321000', '-80.039800']",2016-12-19 09:26,"30 Foot Silverton, Nice Boat, Sealed V8 Engines, could use new carpeting, carpet in it now is pink. Twin Inboard Engines. Selling cheap for the winter, after the boat show in February I will raise the price if I still have it. Text/call 412-537-907three, No Trailer, Beam is 10'10"" I believe, it weighs 9100 lbs",,5922423316,40.321000,30,-80.039800,Silverton,"https://maps.google.com/maps/preview/@40.321000,-80.039800,16z",,$7500,power, (Pittsburgh),"30 Foot Silverton, Twin V8's, Inboard, Sealed Units",https://pittsburgh.craigslist.org/boa/5922423316.html,1988
29,good,"['40.780800', '-80.059200']",2016-12-19 08:06,"I have TWO  vintage AS450 Aquascooters with carrying case.  $575 FOR BOTH I will trade for 20 HP  outboard motor The amazing Aqua Scooter is the worlds only totally portable, submersible, 2 CYCLE  GASOLINE  powered personal water craft that can propel you quietly through the water at up to 5 mph. You can dive to the depth of the air intake snorkel which is about 3-4 feet The Aqua Scooter is very lightweight (15 lbs). Under typical conditions this water scooter can tow it's user over 10 miles on just one tank of fuel. Both of  these aquascooters run.  The carbs should be rebuilt at some point. Operators manual included . I repaired one of the gas tanks as seen in the pic. Both for $575",,5886369988,40.780800,1,-80.059200,Aquascooter,"https://maps.google.com/maps/preview/@40.780800,-80.059200,16z",AS450,$575,power, (Cranberry),"TWO Aquascooters  AS450 ..TRADE""??",https://pittsburgh.craigslist.org/boa/5886369988.html,
30,excellent,[],2016-12-19 07:51,"This is a beautiful mahogany plywood, stitch & glue kayak from the illustrious Pygmy Boat Company. A 17' Queen Charlotte: the first of all Pygmy's models. -It is used but in very good condition. Pygmy kayaks are only offered as kits and yet the boats when completed are among the best you can buy. -This one is newly recoated with the same West System Epoxy as is used to build it, and also partially finished with Z-Spar Flagship UV resistant marine varnish, always the final step after new epoxy. -A skeg has been added to this most maneuverable of Pygmy models to increase straight-line tracking for touring purposes. It would be very easy to remove or modify it, for maximum playfulness in surf. -This is a kayak with a very spacious entrance and interior. There are no storage hatches (Pygmy sells kits to add them if desired) or bulkheads (one thing this means is, if you are flexible enough, you can actually lay flat and sleep in the boat...). Very beautifully & intelligently styled, completely solid and leak free, and very tough and durable. This is a hard-chined boat with very flat deck for immunity to high winds. Most amazing however, is this 17 footer weighs in at about 37 pounds: the only other place to find this type lightness is with a kevlar boat costing several thousand dollars or more. ALSO INCLUDED: 1. Two full size flotation bags for emergency buoyancy if desired, to compensate for the lack of bulkheads. 2. The remainder of the new quart of Z-spar Flagship varnish bought specifically for this boat. After the new coat of epoxy some of it was applied to the deck for UV protection. I believe enough remains to easily give the entire hull a second coat, desirable in the long run. Overall condition excellent with some evidence of use and normal signs of kit boat construction. No paddle included. Sorry: no ""test rides"". Much additional info available about this and all Pygmy models online, including much nicer images than are provided here. Price firm. Thanks for viewing.",,5902682201,,17,,Pygmy,https://maps.google.com/?q=loc%3A+Penn+Ave%2E+at+Millvale+Ave%2E+Pittsburgh+PA+US,Queen Charlotte,$800,human, (Pittsburgh),"Excellent 17' Pygmy ""Queen Charlotte"" Ocean Kayak",https://pittsburgh.craigslist.org/boa/5902682201.html,
31,,,2016-12-19 07:42,"this is a kneeboard from the late 70s,in good condition show contact info",,5917092341,,4,,,,,$55,human, (elizabeth),hydroslide kneeboard,https://pittsburgh.craigslist.org/boa/5917092341.html,
32,good,"['40.319100', '-79.720500']",2016-12-19 07:30,"Hi - We are looking to sell our 83 Sundancer 260. Boat is in great condition for its age and has lots of recent work to it. All of the exterior upholstery has been replaced in 2014 as well as a complete engine rebuild in 2012. Since then, we have only put 12 hours on the engine. It has a Merc 260 hp engine and runs really strong. The engine is currently winterized. Interior is in fantastic shape, and spacious. It sleeps 6 people. There is two bedrooms along with a kitchen area, shower/bathroom. It has hookups for a hot water tank, refrigerator, sinks, stove and plenty more. Trailer is included. Items that will need attention. Trailer lights work intermittently and the trailer brakes will need to be serviced. Also, the battery for the boat is getting weak, I would suggest replacing for the new season. I have all the paperwork ready for transfer. If you have any questions, please let me know. Asking $8,500 or best offer will consider trades! I know its winter and I am willing to do some negotiation. If you need me to deliver, I can do that if you are local. Thanks! Rick - show contact info",,5918999591,40.319100,26,-79.720500,Sea Ray,"https://maps.google.com/maps/preview/@40.319100,-79.720500,16z",Sundancer 260,$8500,power, (North Huntingdon),1983 Sea Ray Sundancer 260,https://pittsburgh.craigslist.org/boa/5918999591.html,1982
33,good,"['40.885900', '-79.934000']",2016-12-18 23:02,"Special edition Jazz Jet Boat.Boat is in good condition.95 HP motor with jet propulsion unit .This is a fast boat .2 speeds High and fly.Be the envy of all your friends with this Steeler boat.I also will give you my mechanic s phone number ,He only charges 30 an hour .plus he knows the history of this engine and boat.Not perfect .does need some work ,Trailer also included with new wheels and tires.1100 it's off season so I have to low price it, but it's the right time to buy one.",200,5914692673,40.885900,14,-79.934000,Baha jazz jet boat,"https://maps.google.com/maps/preview/@40.885900,-79.934000,16z",Jet boat,$1100,power, (Butler),1994 Jazz  Jet Boat,https://pittsburgh.craigslist.org/boa/5914692673.html,1994
34,,,2016-12-18 20:16,Car undercoating for both cars and trucks. Helps prevent rust from starting and helps slow the rust that already may be developed. All vehicles will be cleaned before undercoating is applied. The undercoating that is being used is more of an oil based product. Shoots clean and sticks to all metal surfaces. The salt that the state uses now is a liquid based product that finds ways to get inside of the little corners and pockets of the underneath of your car that you can't see. Price may vary per vehicle. An average price is $150 per vehicle. Call or text and make a appointment at 724 eight four one 4 zero eight six. This is a great way to help your car survive the PA winters.,,5904765114,,0,,,,,$150,human," (Butler, saxonburg)",Saxonburg car specialist,https://pittsburgh.craigslist.org/boa/5904765114.html,
35,like new,"['40.570000', '-79.966500']",2016-12-18 20:11,Feelfree Lure 11.5. show contact info 1000$.  Comes with a feelfree paddle,,5887935723,40.570000,11,-79.966500,Feelfree,"https://maps.google.com/maps/preview/@40.570000,-79.966500,16z",Lure 11.5,$1000,human,,Feelfree Lure 11.5 Kayak,https://pittsburgh.craigslist.org/boa/5887935723.html,
36,,,2016-12-18 20:05,"Century Boat. Has trailer with it, don't have time for it. Is an amazing boat, 188 HP, V8 Mercruiser engine.  if you have time to get a few things touched up, great buy. Needs 1 bearing, small electrical wiring fixed, and a steering cable, interior seats / etc.. Boat will go 55 MPH on water which is fast, is used for rafting, ski, tubing. $500 reduced Call / Text show contact info Trailer is included with it",,5924852677,,18,,,,,$500,power, (Gibsonia),Century 18' Boat ( NEED GONE ),https://pittsburgh.craigslist.org/boa/5924852677.html,
37,good,,2016-12-18 20:03,"This is a great ski. Professionally reconditioned mechanically and cosmetically . Cruise the water all day on one tank of fuel! Enjoy the reliability of a good old fashioned mechanical air /fuel intake system cleaned, adjusted and fine tuned for optimum performance. Completely remanufactured Fuji 3 cyl commercial grade engine. Also has a new battery and electrical system upgrades. New fuel and water hoses. Repacked jet pump bearings, new steering nozzle bushings and drive shaft seal was just serviced. Custom color that get everyone's attention. New seat, handle bar cover, foot well pads and steering grips offer comfort and control. One of the legendary Polaris skis of all times updated and upgraded and ready to use. Comes with an easy to manage single aluminum trailer. Perfect first ski for a youth or new rider. Is light weight, tows easily and can even be maneuvered on trailer by hand! Text works best as e mails get lost in junk mail sometimes!",25,5924824432,,10,,Polaris,,SLT750,$2595,power, (Greensburg),Jet ski,https://pittsburgh.craigslist.org/boa/5924824432.html,1995
