,condition,coord_pair,date,description,engine hours (total),id,lat,length overall (LOA),long,make / manufacturer,map_URL,model name / number,price,propulsion type,region,title,url,year manufactured
40,like new,"['41.364287', '-76.059208']",2016-12-06 08:18,"-1998 Sugar Sand Heat XRS 120 HP Mercury Jet Boat -NEW battery and both Carburetors were JUST REBUILT this year -Fresh water boat, runs well and very nimble -Lots of fun for tubing and water skiing---2 person tube, ropes, and 2 life jackets INCLUDED -BRAND NEW cover this year -WINTERIZED and ready to go Priced to sell out of season $4000 (negotiable), includes trailer.",,5877867899,41.364287,13,-76.059208,Sugar Sand,"https://maps.google.com/maps/preview/@41.364287,-76.059208,16z",XRS 120 HP Mercury Jet Boat,$4000,power, (Harveys Lake),Boat DEAL $$$,https://scranton.craigslist.org/boa/5877867899.html,1998
41,,,2016-12-04 16:51,Wooden 1929sailboat newer 1994 trailer with all paperwork title .....has mast and sail in good shape for its age I think don't know that much about sail boats everything you need to sail is with it,,5905359742,,16,,,,,$4800,sail, (clarksummit),1929 wooden sailboat,https://scranton.craigslist.org/boa/5905359742.html,1920
42,excellent,"['41.389817', '-75.397282']",2016-12-04 10:43,2013 LUND WC14 9.9 YAMAHA  LUND TRAILER EXCELLENT SHAPE,,5904878287,41.389817,14,-75.397282,LUND,"https://maps.google.com/maps/preview/@41.389817,-75.397282,16z",WC14,$5700,power, (Lake Ariel),2013 LUND WC14,https://scranton.craigslist.org/boa/5904878287.html,2013
43,good,,2016-12-03 15:23,14 ft 32 in wide syvan flat bottom row boat comes with electric motor and ores. $ 425.00 or best offer.,,5904005954,,14,,Syvan,,1432,$375,human, (Scranton PA),boat for sale 14 ft john boat,https://scranton.craigslist.org/boa/5904005954.html,1995
44,,[],2016-12-03 14:45,2 Kayaks priced to move. Both sell for 300 total. Good condition. Comes with paddles.,,5903945330,,10,,Emotion,https://maps.google.com/?q=loc%3A+%34%38%38%35+State+Route+%34%30%35+Milton+PA+US,Kayak,$300,human, (Milton),2 Emotion Kayaks,https://scranton.craigslist.org/boa/5903945330.html,2005
45,,,2016-12-03 13:21,"- 3 seater cover, SLIPPERY, (Excellent condition, NEW in box).) Gray & Black! Originally for '96 to '04 SEADOO GTX but may fit many other models as well!   $95 * Please call show contact info - Thank You!",,5903803019,,10,,,,,$95,power, (Dickson City),"JETSKI / PWC COVER - SEADOO, YAMAHA, KAWASAKI!!!!!",https://scranton.craigslist.org/boa/5903803019.html,
46,,"['41.322800', '-74.882400']",2016-12-03 09:05,"14 foot aluminum boat sea nymph & trailer, trailer has new tires & rims. Very good condition. Also have trolling motor. Maybe trade for ATV.",,5881628339,41.322800,14,-74.882400,,"https://maps.google.com/maps/preview/@41.322800,-74.882400,16z",,$1200,power,,14 foot aluminum boat & trailer,https://scranton.craigslist.org/boa/5881628339.html,
47,excellent,"['41.319700', '-75.854100']",2016-12-03 08:53,Minimally used Old Town Discovery 164 with two paddles and two seats included.,,5873857406,41.319700,164,-75.854100,Old Town,"https://maps.google.com/maps/preview/@41.319700,-75.854100,16z",Discovery,$975,human, (Wyoming),Canoe - Old Town Discovery 164,https://scranton.craigslist.org/boa/5873857406.html,1998
48,good,"['41.272259', '-75.860381']",2016-12-02 15:42,"SINGLE SCULL RECREATIONAL  INCLUDES 2 SET OARS, SEAT, NEED TLC I NEED TO MOVE THIS ITEM  FIRST 500 TAKES IT",,5902608164,41.272259,25,-75.860381,PRO AM 25,"https://maps.google.com/maps/preview/@41.272259,-75.860381,16z",PRO AM 25,$500,human,,SCULL-SINGLE   price reduced,https://scranton.craigslist.org/boa/5902608164.html,
49,good,"['40.066400', '-76.564500']",2016-12-02 09:48,"engine hours (total): 325 length overall (LOA): 22 make / manufacturer: Seaark model name / number: Predator propulsion type: power year manufactured: 2012 Selling my 2012 22 ft sea ark predator . It is a 200 hp inboard sport jet. It has the upgraded .190 bottom with k5 Polly spray on it . price will include everything , Minn kota ipolit trolling motor with remote, Anchor wizard , Rod rack with 10 Driftmaster pro duos. onboard 24 volt charger and system will include all lifejackets everything is turn key ready!!! It has 40 gallonlive well in back deck and 13 gallon Bait well attached to console",325,5879621809,40.066400,22,-76.564500,Seaark,"https://maps.google.com/maps/preview/@40.066400,-76.564500,16z",Predator,$28500,power, (Marietta),2012 sea ark predator,https://scranton.craigslist.org/boa/5879621809.html,2012
50,,"['41.465499', '-75.620098']",2016-12-02 05:55,"27 outboard motors and fuel tanks ranging from1949 to 1963. johnson,westbend,mercury,wizzard,firestone,evenrude,scott,mculloch,and martin call Ken at show contact info",,5901841532,41.465499,20,-75.620098,,"https://maps.google.com/maps/preview/@41.465499,-75.620098,16z",,$50,power, (1097 carmalt st),OUTBOARD MOTORS,https://scranton.craigslist.org/boa/5901841532.html,
51,excellent,,2016-12-01 16:39,"Loaded with standard features, bow cushions, anchor locker, changing room with pump out head, console storage.  Walk through windshield.  In floor storage.  Sink, Cup Holders, built in coolers, aft fill-in cushions to make a sunpad.  Swim platform with storage pod and with drop down SS ladder.Loaded with standard features, bow cushions, anchor locker, changing room with pump out head, console storage.  Walk through windshield.  In floor storage.  Sink, Cup Holders, built in coolers, aft fill-in cushions to make a sunpad.  Swim platform with storage pod and with drop down SS ladder.",140,5889508487,,25,,Stingray,,Mercruiser,$14000,power, (Latrobe),Stingray 250 LR w/5 L Mercruiser,https://scranton.craigslist.org/boa/5889508487.html,2007
52,like new,,2016-12-01 16:32,"This is a great family boat with plenty of power to pull a wakeboard or the kids on a tube. You won't find another fresh water boat with this low of hours and this nice of condition, absolutely NO fading whatsoever. The boat has really nice grey snap-in carpets that I never use, hence the reason they are NOT pictured. They are in like NEW condition with NO stains or tears.",57,5889485351,,23,,Yamaha,,SX-230,$17900,power, (Altoona),2008 Yamaha SX-230... (High Output 320 HP ),https://scranton.craigslist.org/boa/5889485351.html,2008
53,excellent,,2016-12-01 16:25,"CLEAN 2004 SEARAY SUNDECK, MERCURSIER   V8 5.0 MPI FUEL INJECTED WITH ONLY 290 HOURS, JUST SERVICED, BOAT IS WATER READY, COMES WITH BIMINI TOP, FULL CAMPER CANVAS W /SCREENS. HAS HEAD, WET BAR REAR WASH DOWN, THESE ARE VERY HARD TO FIND WITH LOW HOURS.",290,5889460377,,24,,Huntingdon,,,$13690,power, (Huntingdon),SEARAY SUNDECK 240 SUNDECK MERCURSIER V8 MPI,https://scranton.craigslist.org/boa/5889460377.html,2004
54,good,,2016-12-01 08:48,"I have a vintage Alcort Sailfish. Boat is 14'. It's in great shape for the age and everything works. All parts included. Sail has a small tear, but can be easily replaced. $100 If interested 570three5one4468",,5900498209,,14,,Alcort,,Sailfish,$100,sail,,Alcort Sailfish 14' Sailboat,https://scranton.craigslist.org/boa/5900498209.html,
55,excellent,"['41.839600', '-75.882100']",2016-12-01 06:46,2003 nitro. Excellent condition. Only 91 hrs on the boat and Mercury motor. Seats are excellent and everything works great. Comes w two fish finder and one God tracker. New bilge pump and tires on trailer and paperwork and maintenance all done by Snake Creek Marine.,91,5900414371,41.839600,17,-75.882100,Nitro,"https://maps.google.com/maps/preview/@41.839600,-75.882100,16z",Bass tracker,$6500,power, (Montrose),2000Nitro Bass Boat,https://scranton.craigslist.org/boa/5900414371.html,2000
56,,"['41.437965', '-75.631428']",2016-12-01 00:22,Need gone asap,,5900275329,41.437965,8,-75.631428,,"https://maps.google.com/maps/preview/@41.437965,-75.631428,16z",,$375,human, (Scranton),Pond boat $375,https://scranton.craigslist.org/boa/5900275329.html,
57,good,,2016-11-30 21:18,1996 Kawasaki TS jetski Runs great Used all summer Got a boat for the kid Text for pictures they won't load on here.,200,5876796415,,9,,Kawasaki,,TS jetski,$550,power, (Sugar notch),Kawasaki ts jetski,https://scranton.craigslist.org/boa/5876796415.html,1996
58,fair,,2016-11-30 16:04,"I'm selling this because I just don't have the time to fix it up anymore since starting a new job. The boat just needs some finishing up. I've done most of the wood work,  just need to put some back on, I  have almost everything to finish it. There's a 5.0 mercury in/out board, hot water heater, 100 gal gas tank, toilet, stove, fridge, 2 sinks, 3 places to sleep. There isn't any major work needed, just a lot of small stuff. It comes with the trailer which is worth 2500 alone.  Like I said I just don't have the time and I need cash, thank you.",10000,5878054399,,27,,Sea ray,,Sundancee,$3300,power, (Zion Grove),27 ft. Sea Ray Sundancer & galvanized trailer,https://scranton.craigslist.org/boa/5878054399.html,1987
59,new,[],2016-11-30 09:10,"C AND S TRUCK IS NOW A HUSTLER AND CHECKMATE POWERBOAT DEALER AND HAVE IN STOCK A 2017 HUSTLER MID CABIN OPEN BOW WITH A 540 MERCURY RACING ENGINE,BRAVO ITS DRIVE,FLY BY WIRE CONTROLS (NO CABLES),GARMIN GPS WITH INTEGRATED MECURY SMARTCRAFT,LIVORSI CONTROLS AND GAUGES,CARBON FIBER DASH,SONY BLUETOOTH STEREO WITH JL600 WATT AMP. PORTA POTTI,REFRIGERATOR,SS CLEATS,THRU HULL EXHAUST,AUTO FIRE EXTINGUISHING SYS.,CARBON FIBER DASH,SNAP OUT CARPET,WATER PSI GUAGE,FRESH WATER FLUSH,INTERIOR MOOD LIGHTING,COCKPIT COVER,FULL COVER,HAS RACEBOAT CONSTRUCTION WITH HAND LAY UP FIBERGLASS HULL, KEVLAR RESINS............. WWW.CSTRUCKSHOPPE.COM",6,5854716367,,29,,HUSTLER,https://maps.google.com/?q=loc%3A+%37+Ferry+Street+NANTICOKE+PA+US,ROCKET 29',,power,,2017 HUSTLER ROCKET 29' MC OPEN BOW,https://scranton.craigslist.org/bod/5854716367.html,2017
60,,"['41.306600', '-76.133900']",2016-11-29 14:12,new carpet 24 volt 46lbs thrust motor guide trolling motor 90 hp inboard jet fish finder new tires on trailer ready to go electric winch swivel seats 15 gallon live well rod holders extra storage current registration new tags electric anchor river anchor new batteries clean title many extras show contact info can't get texts on land line must see sweet valley pa 18656 make offer,,5857410080,41.306600,18,-76.133900,,"https://maps.google.com/maps/preview/@41.306600,-76.133900,16z",,$1,power, (sweet valley),bass tracker pro jet 18,https://scranton.craigslist.org/boa/5857410080.html,
61,fair,,2016-11-29 12:48,"Plain ole jon boat from the 1970s. Nothing special. Pretty stable. No major leaks but occasionally seeps around the rivets. No big whoop, you ain't no fashion princess. Good for duck hunting or just leaving at some pond. No trailer. No oars. Just boat.",0,5897732874,,10,,Sully Sullenberger,,Sir Rows-A-Lot,$160,human, (South Scranton),10' aluminum jon boat,https://scranton.craigslist.org/boa/5897732874.html,1970
62,excellent,"['41.299800', '-75.971100']",2016-11-29 12:09,"This beauty comes with the following;  7.5 HP Mercury motor that was just serviced. electric trolling motor with 2 batteries. fish finder, 2 anchors, 3 life jackets. new fuel tank and lines and a boat cover. The boat has fresh paint and carpet. The trailer has also been updated with new hubs, wheels and tires. Boat and trailer both have new wiring and lights. The photo was before the trailer was updated. More pictures can be sent upon request. Thanks for looking",,5897652233,41.299800,14,-75.971100,,"https://maps.google.com/maps/preview/@41.299800,-75.971100,16z",,$1200,power, (Shavertown),14' V-Bottom,https://scranton.craigslist.org/boa/5897652233.html,
63,excellent,"['41.355400', '-75.680500']",2016-11-29 11:46,Hi for sale or trade I have a 1996 Yamaha waveventure 3 seater 700cc twin 2 stroke jet ski in extremely good condition . The whole jet drive was replaced along with a oil injection delete kit . Seats were just re wrapped in yellow marine vynil . Currently registered until 2018 I have title for ski not for trailer unfortunately . Ski has 250 original hours on it  . It has a digital dash display and is also equipped with tow leads to tube or ski . It's also equipped with reverse . Ski is about 10 ft long and about 3.5 feet wide so it's very stable on the water even in rough conditions . I'll consider all trade or cash offers so don't be afraid to ask .text preferred but you can email or call anytime . Thanks,250,5854296112,41.355400,10,-75.680500,Yamaha,"https://maps.google.com/maps/preview/@41.355400,-75.680500,16z",Waveventure,$1800,power, (Scranton),1996 Yamaha waveventure 700cc 3 seater jet ski for sale or trade,https://scranton.craigslist.org/boa/5854296112.html,1996
64,,,2016-11-29 08:32,"88 fiberglass Cajun bass boat in good shape lots of work done and new parts 92 force 40hp with tilt trim with new prop impeller rebuilt fuel pump new thermostat gasket head gasket plugs motor runs excellent compressions are at a good level after fixing new fuel lines and bulb and fuel filter two new removable seats on swivel eeze post 88 Dixie craft trailer has new tires boats solid and is in good shape for its age, with normal wear n tear. has minn kota 40lb trust bow mounted trolling motor hummingbird fish finder and two interstate deepcycle batteries bilge pump dual livewells rod locker and 2 storage compartments.all gauges work and has lights inside, navigation lights I also have a small seat with no back rest and a pole for tubing and has a ladder on back. Looking for trades trucks jeeps quads ect.",,5897303156,,16,,cajun,,devo,$2750,power, (drums),88 Cajun bass boat,https://scranton.craigslist.org/boa/5897303156.html,
65,fair,,2016-11-28 13:03,Crestliner boat. Im a manager at a company that removes property from foreclosed Homessage.   This boat is from a house we cleared out. So I have no paperwork. My research shows its a 1961. I'D tag on back shows 930-3221H   I'm sure you'd be able to get a title or bill of some sort.  Boat sold as is. With trailer. Firm !!!  Text show contact info,,5856258178,,16,,,,,$300,power, (Local),1961 Crestline.  Very cheap.,https://scranton.craigslist.org/boa/5856258178.html,1961
66,excellent,,2016-11-28 11:56,"1995 LARSON 28' CABRIO ON A 2008 ALUMINUM THREE AXLE TRAILER WITH DISK BRAKES BY ABT TRAILERS.  BOAT IS SET UP FOR FISHING AND DIVING. IT HAS A 454 ENGINE FROM ADVANCED MARINE ENGINE OF CASPER, WY.",,5895838256,,1,,,,,$9500,power, (Pennsylvania),Larson CABRIO -Best deal -3,https://scranton.craigslist.org/boa/5895838256.html,
67,fair,"['41.606709', '-75.566501']",2016-11-28 10:14,79' grady white. Runs but needs work. Title for boat. No title for trailer,,5895766448,41.606709,20,-75.566501,Grady white,"https://maps.google.com/maps/preview/@41.606709,-75.566501,16z",,$1000,power, (Greenfield Twp.),1979  20'grady white,https://scranton.craigslist.org/boa/5895766448.html,1979
68,like new,[],2016-11-28 09:32,"2013 Suzuki 20HP 4 Stroke, very low hours! New motor trade-in. Serviced and ready to go. Dealer 60 Day warranty available.",,5854503707,,20,,Suzuki,https://maps.google.com/?q=loc%3A+Hamlin+Highway+at+C%2E+Bidwell+Road+Lake+Ariel+PA+US,Four Stroke,$3625,power, (lake Ariel),Used Outboard,https://scranton.craigslist.org/bod/5854503707.html,2013
69,good,[],2016-11-28 09:32,"2003 Yamaha 50HP  4 Stroke outboard, new motor trade. Winterized and stored. Well maintained, serviced, with controls included.  Power tilt and trim electric start.",0,5854530341,,50,,Yamaha,https://maps.google.com/?q=loc%3A+Hamlin+Highway+at+C%2EBidwell+Road+Lake+Ariel+PA+US,T50TLRL,$3250,power, (Lake Ariel),Used Outboard,https://scranton.craigslist.org/bod/5854530341.html,2003
70,,"['40.863900', '-76.556900']",2016-11-26 15:13,16.5ft Xpress Jet Boat. Yamaha 50/35 Outboard Jet. Brand new powerhead in 2012. Boat runs great. Great for fishing. Has trolling motor and gps depth finder. Additionally led lighting for night fishing. Has galvanized trailer. New impeller and liner installed in the spring. Comes with extra impeller. $6500.00. Email with questions.,,5884200170,40.863900,16,-76.556900,,"https://maps.google.com/maps/preview/@40.863900,-76.556900,16z",,,power,,Xpress Jet Boat,https://scranton.craigslist.org/boa/5884200170.html,
71,excellent,,2016-11-26 12:58,"s V fD S 2002 Crestliner Fish Hawk 1850 Sport fisherman 125 h.p. Mercury (carbs not EFI). 18ft boat in great condition with lots of extras. Hull material:	Aluminum Boat is in great condition and ready to fish. Crestliner Trailor good tires, with spare. Starting battery, and also two trolling batteries. Its has Motorguide PTSV 24 Volt Trolling motor 60"" ,Hummingbird 596 Color fish  finder Underwar, new Bimini Top, Gentron GT-9 Fish Finder, For more pic's with the boat please look here: http://mainalbum.us/?album=waQT N pm eP Z   R MG rp Y Ux R RV",45,5893053104,,18,,Crestliner,,Fish Hawk 1850,$1400,power, (altoona-johnstown),2002 Crestliner Fish Hawk 1850 Sport fisherman fL F L ZU O Boat Fishing,https://scranton.craigslist.org/boa/5893053104.html,
72,,"['40.798300', '-75.973500']",2016-11-26 12:28,12 ft kayak.holds up to 350lbs.very stable.registered until the end of 2017.needs a new seat.comes with 2 paddles,,5893119045,40.798300,12,-75.973500,,"https://maps.google.com/maps/preview/@40.798300,-75.973500,16z",,$450,human, (Tamaqua),Future beach fishing kayak,https://scranton.craigslist.org/boa/5893119045.html,
73,new,"['41.360975', '-76.033502']",2016-11-26 09:46,"HEWITT CANTILEVER STYLE PWC LIFT HOLDS 1150 LBS. BRAND NEW WITH TEFLON BUNKS END OF SEASON SPECIAL!!! YOU BUY IT, WE STORE IT FOR THE 2016-17 WINTER SEASON!! RETAILS FOR $1,200 ASKING $1,000 CALL TODAY FOR MORE DETAILS !",,5892861407,41.360975,72,-76.033502,HEWITT,"https://maps.google.com/maps/preview/@41.360975,-76.033502,16z",CANTILEVER,$1000,human, (HARVEYS LAKE),HEWITT PWC LIFT,https://scranton.craigslist.org/bod/5892861407.html,2016
74,,,2016-11-26 08:40,"Green in color pelican maverick kayak, in great shape just don't use it enough. It is hanging in my garage so don't have any actual photos. Will take photos upon request. Price is $225 obo Call/text anytime show contact info",,5892791981,,10,,,,,$225,human, (Clarks summit),Pelican maverick kayak,https://scranton.craigslist.org/boa/5892791981.html,
75,,,2016-11-26 00:54,"Fiberglass rowboat, sturdy in water.",,5892602784,,13,,,,sportskraft,$100,human,,13 1/2 ft boat,https://scranton.craigslist.org/boa/5892602784.html,
76,fair,,2016-11-26 00:49,"15' runabout boat, sportskraft, has oarlocks,  with Boat trailer.  Boat leaks, trailer needs lights, wiring.  Good project for inclined person .  Neither is registered.  If you are interested, call, please.  I dont do texts.",,5892599916,,15,,homemade,,homemade,$250,human,,boat and boat trailer,https://scranton.craigslist.org/boa/5892599916.html,
77,,"['41.579200', '-75.252800']",2016-11-25 22:41,"750ss Kawasaki Jet Ski and Trailer. Jet ski needs motor, other one was scrapped. I just do not have time to put one in. Package deal will not sell separate. I have Registration. $400 OBO.",,5854016167,41.579200,8,-75.252800,,"https://maps.google.com/maps/preview/@41.579200,-75.252800,16z",,$400,power, (Honesdale),750ss Kawasaki Jet Ski,https://scranton.craigslist.org/boa/5854016167.html,
78,fair,"['39.991838', '-78.358216']",2016-11-25 16:13,"Triton Tr21 Bassboat 175 Evinrude Intruder  motor runs fine, has some dock rash but is still a very sound rig, replaced starter,rectifier,bendix recently. Has Minn Kota Maxxum 24v trolling motor, 4 good batteries, all pumps work, newer carpet and seats. 54 Gallon fuel cell. Trailer has 4 brand new tires, all lights work. Boat will run mid to upper 50''s with full tournament load (2 guys,full livewells, 25 gallons of gas ect) Great starter boat. Call or Text show contact info for details or pictures.",,5892087479,39.991838,21,-78.358216,Triton,"https://maps.google.com/maps/preview/@39.991838,-78.358216,16z",Tr21,$4000,power, (Everett PA),Triton Tr21 Bass Boat,https://scranton.craigslist.org/boa/5892087479.html,1999
79,,,2016-11-24 11:09,Older mercury 6 hp.runs good I just don't need it because I got a bigger motor. $140 obo. Clarks summit. Call or text. 57O 9Othree 592O,,5890599792,,0,,,,,$140,power, (S. Abington Twp),Mercury 6 hp outboard.,https://scranton.craigslist.org/boa/5890599792.html,1964
80,,"['41.268900', '-75.845300']",2016-11-23 18:17,SELLING MY MANUAL RIVIERA DOWN RIGGER  WITH THE ORIGINAL 10 LB WEIGHT AND MOUNTING BRACKET. WORKS 100% WITH  NO ISSUES570-8ONE 4 6 THREE 2 THREE   ASKING 45.00,,5890006731,41.268900,10,-75.845300,,"https://maps.google.com/maps/preview/@41.268900,-75.845300,16z",,$45,human,,RIVIERA DOWNRIGGER RIVIERA COMPLETE,https://scranton.craigslist.org/boa/5890006731.html,
81,like new,,2016-11-23 11:11,"5 years old. Great condition. Can take a gas or trolling motor. Room for 2: Measures 12'l. x 3'8""w. x 1'3""d., holds 1-2 hunters (NOTE: the Stealth 2000 only includes one seat, but you can find additional seats on our site) Cockpit measures a generous 8'l. x 3'w. x 10""d. Made from 100% custom-compounded polyethylene for exceptional durability Two gun racks and shell holders 360° swiveling, cushioned seat with folding backrest Storage compartment under seat to store marine battery Cup and thermos holder Handles on both ends Water-tight storage compartment in back, dog platform in front Tie-down slots front and rear Backed by a 5-yr. mfr. limited warranty 460-lb. weight capacity Rated for a 2HP motor Weighs 130 lbs. Proudly made in the USA - See more at: http://www.sportsmansguide.com/product/index/beavertail-stealth-2000-sneak-boat?a=1524650&pm2d=CSE-SPG-15-PLA&utm_medium=PLA&utm_source=Google&utm_campaign=CI&gclid=CjwKEAiAmdXBBRD0hZCVkYHTl20SJACWsZj9mARf6H9oe8AZ3ZXHFAJhGmzt8FgB0XKXXTNaGjmubRoC8UPw_wcB#sthash.gur7ExMr.dpuf",,5889375284,,12,,Stealth,,Beaver Tail 2000,$700,human, (Susquehanna),Beaver tail Stealth 2000 boat,https://scranton.craigslist.org/boa/5889375284.html,2011
82,fair,"['41.574400', '-75.588100']",2016-11-22 22:35,"Four classic outboards for sale for parts or repair. 1956 7.5hp ScottAtwater, 1975 Johnson 4hp, 1975 SeaKing 7.5hp, and 1976 Clinton 3.5hp. All turn freely with compression. $125 for all four.",0,5888880313,41.574400,4,-75.588100,"Scott, Johnson, Sea King, Clinto","https://maps.google.com/maps/preview/@41.574400,-75.588100,16z","7.5, 7.5, 3.5, 4",$125,power," (Scott Twp., PA)",Four Classic Outboards for Sale Package Deal,https://scranton.craigslist.org/boa/5888880313.html,1956
83,,,2016-11-22 14:10,Trailer has title boat has title no leaks motor ran last year might need a tune up fisherman finder oars and trolling motor 800 firm as is,,5877753469,,14,,,,,$600,power,,1981 14 ft deep fisherman,https://scranton.craigslist.org/boa/5877753469.html,
84,,,2016-11-22 12:02,2013 Crownline 185SS 2013 Crownline Bowrider 185 SS,,5887885951,,18,,,,,$19000,power,,2013 Crownline 185SS,https://scranton.craigslist.org/boa/5887885951.html,
85,,,2016-11-22 11:32,1998 Baja 302 One owner Low Hours 1998 Baja 302,,5887884848,,30,,,,,$27000,power,,1998 Baja 302,https://scranton.craigslist.org/boa/5887884848.html,
86,,"['34.830500', '-87.656000']",2016-11-21 09:56,We offer high quality products at great prices with a great warranty. Please check out our website for our full line of products. Thanks for your interest.,,5844071392,34.830500,24,-87.656000,,"https://maps.google.com/maps/preview/@34.830500,-87.656000,16z",,$70,power, (AL),VORTEX BOAT COVERS - CANOE/KAYAK COVERS AND MORE,https://scranton.craigslist.org/bod/5844071392.html,
87,,"['41.427400', '-75.646500']",2016-11-21 01:31,$500 obo nothing wrong with it no paper work not sure how to get it 3 seater plastic boat need gone asap,,5885980760,41.427400,10,-75.646500,,"https://maps.google.com/maps/preview/@41.427400,-75.646500,16z",,$500,human, (Scranton),Flat bottom boat,https://scranton.craigslist.org/boa/5885980760.html,
88,,,2016-11-20 02:22,"For sale 18 foot 1992 Sunbird corsair with a v6 4.3L OMC cobra engine, comes with trailer and yes i have titles for both. Boat still needs some work like interior put back together and motor needing a starter, other than that the hull is in great shape, trailers straight and rides straight even at 65mph. I have the fuel tank, its just not pictured in the pictures because i took it out to replace the floor. New trailer lights and valve cover gaskets. (pics posted are how it currently sits and yes its being garage kept) located in forty fort pa 18704, asking $1000 or best reasonable offer, accepting trades and lowballers please keep those offers to yourselves as ill simply ignore you because im in no rush to get rid of, just have other projects that need finishing, serious inquires only. Call or text me 570534165four - Mike",,5884688040,,18,,,,,$1000,power, (Forty fort),1992 18 foot Sunbird corsair boat with a v6 inboard motor for sale or,https://scranton.craigslist.org/boa/5884688040.html,
89,good,"['41.355165', '-76.036377']",2016-11-19 17:51,"1992 Sunbird Corsair. Bought new in 1995 nice boat, runs well. 175hp I/O. Teal/ white, used only at Harveys Lake (fresh water) galvanized trailer included $3,900.00 obo. Cash only!!!! Winterized and free in door storage for the winter.",,5884296501,41.355165,18,-76.036377,Sunbird,"https://maps.google.com/maps/preview/@41.355165,-76.036377,16z",Corsair 185SL,$3900,power, (Harveys Lake),1992 Sunbird Corsair 185SL,https://scranton.craigslist.org/boa/5884296501.html,1992
