,condition,coord_pair,date,description,engine hours (total),id,lat,length overall (LOA),long,make / manufacturer,map_URL,model name / number,price,propulsion type,region,title,url,year manufactured
38,,"['39.794300', '-76.981200']",2016-12-18 19:08,"Featured Venture Model: 2016, Venture, Mdl., VATB-5225, Aluminum, Tandem Axel, Surge/Disc Brakes on 1 Axle, Alloy Mag Wheels, Bunks, carrys 5225 lbs. of Boat. and up to a 24' Boat. 25' w/ext. Tongue $2599 ....one of our most popular mdl.'s.......all sizes available. Email only, we do not do quotes over the phone. Contact us via email now, to make the next shipment to your area. In your Email include; make, model, year, length, and total weight of boat and we will get back to you in a timely manner with a price and a delivery date. Killer Prices on all size Venture Trailers. Visit us online at emimarine dot com We are located/based in Baltimore Md./Hanover Pa. 17331 However we travel up and down the East Coast, Me. to Fl., to the Great Lakes, New England, Carolinas, SW Florida areas, with deliveries on a regular basis. Average delivery price is $295 !! To learn more about us....visit our website. Also see our adds on ebay, under ebay user name, ""onlinetrailers"" We are an Authorized Dealer/Distributor for Venture Boat Trailers.......All sizes available, for Boats 18' to 38'.....specializing in Trailers for Boats 23'-32'......up to 18,000 lbs.....Single, Tandem & Tri-Axel, ...Trailers for; V-Bttms., Flat Bttms., Skiffs, Pontoons, Tri-Toons, and more",,5924799819,39.794300,25,-76.981200,,"https://maps.google.com/maps/preview/@39.794300,-76.981200,16z",,$2599,human, (Del. to W-Pa),"Venture Boat Trailers, New, Delivered to P-burg",https://pittsburgh.craigslist.org/bod/5924799819.html,
39,good,"['40.374800', '-80.073100']",2016-12-18 17:05,"OBrien Slalom Ski Case. Fits a 70"" ski. Made of vinal with a heavy duty plastic zipper. Cash Only",,5897747554,40.374800,70,-80.073100,,"https://maps.google.com/maps/preview/@40.374800,-80.073100,16z",,$25,power, (Scott Twp),Slalom Ski Case,https://pittsburgh.craigslist.org/boa/5897747554.html,
40,excellent,"['40.407200', '-79.983900']",2016-12-18 16:36,"2001Suntracker 21 foot Pontoon Fishing Barge with 2002 Suntracker Trailer Carpeted aluminum deck 75 HP 2 cycle outboard Mercury engine Music Sound System (Radio AM/FM and CD player) Hummingbird Fishfinder 570 series installed---  Live fishing well New Tumac custom moring cover and new boot for bimini top Bow mount foot control Mini-Kota power drive Trolling motor Anchor-Buoys-Life Jackets- 4 Scotty Power lock rod holders 2 Batteries Asking $11,000 for everything",,5901605990,40.407200,21,-79.983900,,"https://maps.google.com/maps/preview/@40.407200,-79.983900,16z",,$11000,power, (Pittsburgh),2001 Suntracker 21 foot Pontoon,https://pittsburgh.craigslist.org/boa/5901605990.html,
41,,,2016-12-18 16:06,"Sent from my iPhoneDock made from mobile home frame and plastic boards Needs some work  decking 5x 42 walk way 4x20 made of 5"" channel and expanded medal. Dock needs new axel or trailer= Would make a great Christmas gift please call show contact info",,5911608312,,42,,,,,$2000,human, (karns city),dock,https://pittsburgh.craigslist.org/boa/5911608312.html,
42,good,,2016-12-18 15:25,1990 Larson 228 International fishing boat....walk around cutty.... newer chevy 350 Vortec engine.... high torque starter motor.... holley carb....30 hours..... duo prop.... volvo out drive.... new shifter cables.... new drive shaft bellows 9.9 Yamaha trolling engine newer trailer.... brakes.... tires.... etc.... swim platform..... new exhaust manifold with .... thur the transom corsa mufflers.... big water boat..... will take hard waves... and big water.... lake Erie or Ocean .... 5 wells... etc....,50,5893889393,,23,,larson,,,$9900,power, (0hio),Walk Around Fishing Boat,https://pittsburgh.craigslist.org/boa/5893889393.html,1990
43,excellent,,2016-12-18 14:36,Selling 2006 bayliner 21 foot 5.0 v 8 engine.  Complete brand new out drive.  Kids getting older and don't use it enough anymore.  Really good boat stored inside every winter.  Winter storage covered this year.  If interested call or text me.  Can make arrangements to see it at Brady's bend underground storage.  Price negotiable.,,5924482488,,21,,Bayliner,,,$14500,power, (Belle vernon),2006 bayliner 21 foot,https://pittsburgh.craigslist.org/boa/5924482488.html,2006
44,good,,2016-12-18 13:17,Gen 1 Mercruiser outdrive 4 cylinder.  Engine was 3.7 mercruiser.  Outdrive in good shape no damage or water in oil.  Complete top and bottom and prop.,100,5884980191,,17,,Mercruiser,,,$500,power, (Fairmont wv),Mercruiser outdrive,https://pittsburgh.craigslist.org/boa/5884980191.html,1988
45,excellent,"['40.327700', '-78.392800']",2016-12-18 09:34,SEADOO GTX WITH DOUBLE TRAILER. BOTH ARE IN GREAT CONDITION NEED TO SELL ASAP WAS ASKING $2500 FOR BOTH BUT THEY NEED SOLD SO MAKE ME A OFFER,,5924096436,40.327700,11,-78.392800,SEADOO,"https://maps.google.com/maps/preview/@40.327700,-78.392800,16z",GTX,,power,,SEADOO GTX WITH DOUBLE TRAILER,https://pittsburgh.craigslist.org/boa/5924096436.html,
46,,"['40.739300', '-80.297200']",2016-12-18 09:07,Looking for a 24-28 foot pontoon boat.  If you got one and looking to sell send me some pics and a price!!!!,,5907842508,40.739300,24,-80.297200,,"https://maps.google.com/maps/preview/@40.739300,-80.297200,16z",,$5000,power, (Beaver County),PONTOON BOAT WANTED!!! 24-28 foot,https://pittsburgh.craigslist.org/boa/5907842508.html,
47,,"['40.458400', '-80.264900']",2016-12-18 08:45,winter boat storage $35 a month show contact info joe,,5884791827,40.458400,13,-80.264900,,"https://maps.google.com/maps/preview/@40.458400,-80.264900,16z",,$35,human, (AIRPORT),WINTER  STROAGE,https://pittsburgh.craigslist.org/boa/5884791827.html,
48,,,2016-12-18 08:20,show contact info South hills,,5924066011,,10,,,,,$200,human,,Boat,https://pittsburgh.craigslist.org/boa/5924066011.html,
49,excellent,"['40.368800', '-80.022400']",2016-12-18 06:40,*****************************    S    O    L    D   **************************************,40,5924011119,40.368800,27,-80.022400,HARRISFLOTE,"https://maps.google.com/maps/preview/@40.368800,-80.022400,16z",200 CRUISER,$17000,power, (MT. LEBANON),2015. HARRIS FLOTE. PONTOON BOAT 20 FT.  WITH MERCURY 20 HP,https://pittsburgh.craigslist.org/boa/5924011119.html,2015
50,,"['40.398856', '-79.769497']",2016-12-17 22:47,Helping a friend sell his fishing boat. Asking 600 or best offer. Could use a new cover and a new battery. With a little tlc this would make someone a great fishing boat. 5hp Johnson from the 1950s runs well and fires right up. I have video of that and the trolling motor running. He has both titles in hand.,,5894989210,40.398856,12,-79.769497,,"https://maps.google.com/maps/preview/@40.398856,-79.769497,16z",,$600,power, (Monroeville),12ft fishing boat and trailer,https://pittsburgh.craigslist.org/boa/5894989210.html,
51,excellent,"['41.224500', '-79.519400']",2016-12-17 21:00,"Lincoln Invertec V300 Pro- Arc welding, constant current or constant voltage (CC/CV) with 30 foot of quick disconnect leads, ground clamp & stinger 230 single phase or 480 volt three phase operation. MIG, TIG, or Stick welding process capable. Like new physical and working condition. $1500.00 Firm, CASH ONLY",,5923747013,41.224500,2,-79.519400,Lincoln,"https://maps.google.com/maps/preview/@41.224500,-79.519400,16z",Invertec V-300 Pro,$1500,power," (Knox, Pa.)",Lincoln Welder: Invertec V300 Pro,https://pittsburgh.craigslist.org/boa/5923747013.html,
52,like new,[],2016-12-17 20:49,"OLD TOWN SARANAC CANOE,146  I bought the canoe new in 2015. I only had it in the water one time at North Park Lake.  There are a few scratches on the bottom, but other than that It's just like new.  I'm 74 years old and it weighs 78#.  I found after buying it it's too heavy for my old body to handle.  There is a center storage well(waterproof) and a home made mounting bracket for a trolling motor. The canoe has been kept inside since new. I also have a minnkota 30# thrust trolling motor which I will sell if you're interested.(new, never been in the water)  Price for canoe $400.00",0,5923756862,,15,,OLD TOWN,https://maps.google.com/?q=loc%3A+%33%30%31+Delberta+Rd%2E+LowerBurrell+PA+US,SARANAC 146,$400,human, (301 Delberta Rd. Lower Burrell),CANOE OLD TOWN SARANAC 146,https://pittsburgh.craigslist.org/boa/5923756862.html,2015
53,like new,"['40.327700', '-78.392800']",2016-12-17 19:44,"2015 EME MICRO HULL (72 POUNDS) 718 RIVA YAMAHA MOTOR APROX 15HRS RIVA INTAKE 44MM MIKUNI CARBS FACTORY B PIPE 2 GALLON KART TANK X SCREAM HAND POLE WITH BLOWSION STEERING SOLAS 9/15 IMPELLER , TRIM SYSTEM 1000 GPH BILGE PUMP WITH WATER PROOF SWITCH ON BARS , NEW LIGHTWEIGHT BATTERY HAVE TITLE IN HAND SKI IS IN GREAT CONDITION IT HAS A FEW SCRATCHES NEED TO SELL AS SOON AS I CAN I'M OPEN TO PARTIAL TRADE OFFERS",15,5923702603,40.327700,6,-78.392800,EME,"https://maps.google.com/maps/preview/@40.327700,-78.392800,16z",MICRO,,power,,EME MICRO YAMAHA STAND UP JETSKI MAKE OFFERS PRICE REDUCED,https://pittsburgh.craigslist.org/boa/5923702603.html,2015
54,like new,"['40.171700', '-80.256000']",2016-12-17 19:32,"2014 Tracker Marine Topper 1542LW, 15 foot Jon Boat with Live Well, Minkota Endura C2 Trolling Motor, 40 lb Thrust w/36"" Shaft, 12V Marine Battery and Case with Marine Charger, 2014 Tracker Marine Boat Trailer TXXU1648P, and Mushroom Anchor.  All included. Like new condition.",,5923691608,40.171700,15,-80.256000,Tracker,"https://maps.google.com/maps/preview/@40.171700,-80.256000,16z",Marine Topper 1542LW,$2200,power," (Washington, PA)","2014 Tracker Marine Topper 1542LW, 15 Foot Jon Boat w/Trailer",https://pittsburgh.craigslist.org/boa/5923691608.html,2014
55,,,2016-12-17 17:42,TWO 5'X 20' ALUMINUM BOAT DOCKS.,,5917772651,,20,,,,,$600,human," (Parkersburg , WV)",5'x20' solid aluminum boat dock,https://pittsburgh.craigslist.org/boa/5917772651.html,
56,,"['40.697200', '-80.336500']",2016-12-17 13:37,"Selling a New 2500 lb. 2-speed Winch / with 2""x20' Strap. Thanks!",,5919554335,40.697200,20,-80.336500,,"https://maps.google.com/maps/preview/@40.697200,-80.336500,16z",,$75,human," (Beaver, PA.)",New 2500 lb. Winch,https://pittsburgh.craigslist.org/boa/5919554335.html,
57,new,,2016-12-17 13:35,20% off almost every thing when donating $10 to make a wish,,5923148790,,10,,,,,$178,human, (Lawrenceville),"Very merry Santa sale , December 15th through the 24th save an additional 20% of",https://pittsburgh.craigslist.org/boa/5923148790.html,
58,,"['40.458400', '-80.264900']",2016-12-17 12:05,winter boat storage $35 a month show contact info joe,,5881863070,40.458400,13,-80.264900,,"https://maps.google.com/maps/preview/@40.458400,-80.264900,16z",,$35,human, (AIRPORT),WINTER  STROAGE,https://pittsburgh.craigslist.org/boa/5881863070.html,
59,,,2016-12-17 11:49,"This boat has been a ton of fun !! EASY to use. For the family. For the children / kids. For the adults. 8ft x 4ft We sailed with 4 on board, rowed with 5. Excellent Condition, stored inside. This is the size of one sheet of plywood, so it fits in pickup truck, or minivan when seats are removed. We have car topped it for short distances. It is a Puddle Duck Racer, or PDRacer / PD Racer It is a handmade boat. (some photos are included from the build) This is boat no. 600 Attach oars to it and you have a comfortable row boat. (I am selling oars separate, see ""more ads by this user"") Some PuddleDuckers have even attached small motors to this. Low beach chairs easily fit in it for comfortable sitting. This boat is completely ready to rig and sail. Comes with 2 masts, one longer than the other. Comes with 2 sails, one 3-sided, one 4-sided. (the 3-sided yellow sail has some damage, but duct tape will fix it! And I will supply extra yellow tarp for the repair, just ask) Comes with rudder / tiller, lee board (like a  dagger / center board, but on the side of the boat) Check out the PD Racer website: www.pdracer.com Don't yet know how to sail? No prob.  Check out this local sailing club for lessons: www.morainesailingclub.org",,5923073835,,8,,,,,$100,sail, (Wexford),8ft Sailboat Puddle Duck or Rowboat or just-for-fun-boat,https://pittsburgh.craigslist.org/boa/5923073835.html,
60,,"['40.363400', '-79.866400']",2016-12-17 11:34,"Im selling my Hobie Revolution, the hull has a crack in it near where the mirage drive is locked into place.  I repaired it with a marine epoxy a few years ago and  I tested it briefly (less than 10 minutes) and it didn't leak but I'm not making any promises hence the low price.  The mirage drive on the side that had the leak doesn't lock into place because of the epoxy on the crack.  The other still locks and its functional.  The kayak comes with everything it originally came with.  The rudder seems to need some adjustments as well, it will turn left and right and pull up but will not go down.  I think the inside cables need tightened.  I also mounted and wired a fish finder that runs on a 12v battery that will also be included.  Price is firm as i believe even with all the issues the mirage drive by itself is worth $500.  Please text or email for a faster response.  Any questions just ask.  Thanks.",,5904218113,40.363400,13,-79.866400,,"https://maps.google.com/maps/preview/@40.363400,-79.866400,16z",,$500,human, (West Mifflin),Hobie Revolution,https://pittsburgh.craigslist.org/boa/5904218113.html,
61,,,2016-12-17 10:25,"The wind will make this boat move. Here's a boat kids can ""sail"" while they go boating with you. smoke-free pet-free",,5922954623,,1,,,,,$10,sail, (Wexford),Sailboat toy playmobil,https://pittsburgh.craigslist.org/boa/5922954623.html,
62,excellent,"['40.319100', '-79.720500']",2016-12-17 09:50,18 ft. Micro Bootlegger design by Nick Shade.  Hand built of white cedar with oak trim.  The craft was hand made with cedar strips then covered with fiberglass and epoxy to create an extremely strong and relatively light structure; (hasn't been weighted but around 50 pounds.)  Outfitted with folding cane seats with backs.  Two paddles included.,,5891573923,40.319100,18,-79.720500,Home Built,"https://maps.google.com/maps/preview/@40.319100,-79.720500,16z",Micro Bootlegger,$899,human, (Irwin),Kayak - Wooden - Handbuilt,https://pittsburgh.craigslist.org/boa/5891573923.html,
63,,"['40.159500', '-79.061600']",2016-12-17 09:09,"Does need work/restoration on some wood. But very open to offers of Barter Always open to a wide variety of interests, let me know what you have in mind. All Rights Reserved, Private & by appointment only. show contact info",,5906694273,40.159500,16,-79.061600,,"https://maps.google.com/maps/preview/@40.159500,-79.061600,16z",,,human,,Vintage Canoe,https://pittsburgh.craigslist.org/boa/5906694273.html,
64,excellent,,2016-12-16 22:14,"For sale is a 2005 Sea Ray 280 Sundancer with twin 5.0 bravo III Engines with 2013 yacht club triaxle aluminum trailer. All in excellent condition. Has Koehler generator, with two sets of full enclosures and full cockpit cover. Sleeps 4 adults and two kids on dinette or  1 adult on the dinette. 9' 5"" beam. Professionally taken care by local boat shop each seaman and anything needed it was replaced. Turn key boat ready for new owner. Any questions please ask and if add is still posted boat is still available. Don't need help selling so please don't ask. Thanks for looking.",230,5914322667,,280,,Sea Ray sundancer,,Sundancer,$60000,power, (Bridgewater),Sea Ray 280 sundancer,https://pittsburgh.craigslist.org/boa/5914322667.html,2005
65,excellent,,2016-12-16 22:13,"For sale is a 2005 Sea Ray 280 Sundancer with twin 5.0 bravo III Engines with 2013 yacht club triaxle aluminum trailer. All in excellent condition. Has Koehler generator, with two sets of full enclosures and full cockpit cover. Sleeps 4 adults and two kids on dinette or  1 adult on the dinette. 9' 5"" beam. Professionally taken care by local boat shop each seaman and anything needed it was replaced. Turn key boat ready for new owner. Any questions please ask and if add is still posted boat is still available. Don't need help selling so please don't ask. Thanks for looking.",230,5914321846,,280,,Sea Ray sundancer,,Sundancer,$60000,power, (Bridgewater),Sea Ray 280 sundancer,https://pittsburgh.craigslist.org/boa/5914321846.html,2005
66,good,,2016-12-16 21:30,"1988 Cris Craft Scorpion  19' Cutty Cabin,  Rebuilt Outdrive, 4.3 Motor,  Mooring Cover. RUNS GREAT!!!! Trailer is a 1988 Boyer; New Bearings  & Good Tires Lost our dock space so we are selling.  Will consider a good offer, barter or trade.",,5896942149,,19,,Cris Craft,,Scorpion,$4500,power," (Confluence, PA)",1988  CRISCRAFT SCORPION,https://pittsburgh.craigslist.org/boa/5896942149.html,1988
67,,"['40.677400', '-80.600600']",2016-12-16 19:45,15 foot flat bottom boat needs a little work floats well still..work is above the water line No reasonable offer will be refused,,5903543380,40.677400,15,-80.600600,,"https://maps.google.com/maps/preview/@40.677400,-80.600600,16z",,$1111111,human, (calcutta oh),15 ft flat bottom,https://pittsburgh.craigslist.org/boa/5903543380.html,
68,,"['40.775878', '-79.450786']",2016-12-16 19:37,Out of room for large boats.if you're boat will fit through a 9x9 door I got space.as low as$39 a month call show contact info,,5922430432,40.775878,20,-79.450786,,"https://maps.google.com/maps/preview/@40.775878,-79.450786,16z",,,power,,Don't let your boat outside this winter,https://pittsburgh.craigslist.org/boa/5922430432.html,
69,,"['40.458400', '-80.264900']",2016-12-16 19:11,winter boat storage $35 a month show contact info joe,,5881298330,40.458400,13,-80.264900,,"https://maps.google.com/maps/preview/@40.458400,-80.264900,16z",,$35,human, (AIRPORT),WINTER  STROAGE,https://pittsburgh.craigslist.org/boa/5881298330.html,
70,fair,"['40.008400', '-79.840400']",2016-12-16 19:04,"in decent shape, trolling motor works, tires on trailer are a little dry rotted",,5922395876,40.008400,14,-79.840400,,"https://maps.google.com/maps/preview/@40.008400,-79.840400,16z",,$650,power, (grindstone),14' smokercraft boat trailer and trolling motor plus title,https://pittsburgh.craigslist.org/boa/5922395876.html,
71,,"['40.259300', '-79.975300']",2016-12-16 17:05,"Antique Perkin navigation light. I believe it was kerosene but was converted to electric for lamp. Thick lens but has a crack but does not take away from the beauty of this. It stands 23"" high and 33"" diameter",,5882416266,40.259300,23,-79.975300,,"https://maps.google.com/maps/preview/@40.259300,-79.975300,16z",,$110,human, (Finleyville),Perkins maritime navigation light,https://pittsburgh.craigslist.org/boa/5882416266.html,
72,fair,,2016-12-16 11:45,Pretty sure it's their 15 foot model. No engine. Trailer included. Could be a good winter project! No title. Call or text with any questions.,,5907137697,,15,,,,,$175,power," (Sarver, PA)",Thunder Craft 15' Boat and TeeNee Trailer,https://pittsburgh.craigslist.org/boa/5907137697.html,
73,,,2016-12-16 11:27,Nice Boat... I need my boat gone soon from my parents back yard. I have had it in there yard all summer. I never had time this summer to use it. It's a 1987 Bayliner.  I can be reached at show contact info Ask for Dan.,,5880781750,,17,,,,,$2000,power, (Turtle Creek),Nice Boat....,https://pittsburgh.craigslist.org/boa/5880781750.html,
74,good,,2016-12-16 11:20,All parts here only thing missing is fuel bowl. has not ran in many years.,,5921719282,,0,,,,,$500,power,,western auto wizard outboard Motor 3.5 hp,https://pittsburgh.craigslist.org/boa/5921719282.html,
75,good,"['40.568100', '-79.841000']",2016-12-16 11:12,CLEARWATER AFFINITY 8.6 $150 cash only Custom wood accessory deck and factory foot braces. Comes with a double ended paddle. $150 cash only. Blue one is SOLD,,5912442276,40.568100,102,-79.841000,CLEARWATER,"https://maps.google.com/maps/preview/@40.568100,-79.841000,16z",AFFINITY 8.6,$150,human, (Cheswick),Kayak (recreational),https://pittsburgh.craigslist.org/boa/5912442276.html,
76,excellent,,2016-12-16 10:59,"Perception Acadia 11.5 with dry hatch and air-cushion backrest...inflates and deflates with ease to suit your needs. Asking $400 obo with a good bit of wiggle room. Great boat, just happened to win a new kayak that is a bit of an upgrade. No need to have two hybrids in nearly identical sizes. Great reviews: https://www.google.com/url?sa=t&source=web&rct=j&url=http://www.paddling.net/Reviews/showReviews.html%3Fprod%3D1577&ved=0ahUKEwiY_6TUperQAhVllVQKHZJfDUEQFggwMAA&usg=AFQjCNH_9CVHCwU1pymIDvHmICyHNxxXMw&sig2=6-8hM_4hskChmrzJX0EGOQ Was garage stored until 3 months ago.",,5913831889,,12,,Perception,,Acadia 11.5,$350,human, (Friendship),Perception Acadia 11.5 Kayak,https://pittsburgh.craigslist.org/boa/5913831889.html,
77,excellent,"['40.447700', '-79.993300']",2016-12-16 10:38,"Extremely well maintained 2004 Carver 366 Motor Yacht! Call, text or email to schedule an appointment to see. DETAILS: *Volvo 8.1 GI Inboards *Never in saltwater *Very well maintained *Only 450 hours *7.3 kW Kohler generator with 581 hours *Savannah (Neutral) countertops *2 burner ceramic stove *Microwave oven *Stainless sink *Fridge/Freezer combo *Sleeps 6 comfortably *2 staterooms *2 heads - Each have separate 35 gallon holding tanks *Convertible sofa *Master head has separate shower stall *Tons of storage *Beige carpet throughout *Cherry woodwork *Vacu-Flush heads *3 TVs with DVD players *Brisa Silk Ultraleather upholstery *New Strata Glass and canvas in 2012 *New carpet throughout in 2014 *Remote windlass with chain/line *Starboard wing door to aft deck *Remote search light *Fresh water monitor *Hot/Cold transom shower *Ice maker on bridge *VHF and depth sounder/temp/speed/range device. *Lots of seating and room for entertaining guests! $94,000 OBO",450,5921633548,40.447700,37,-79.993300,Carver,"https://maps.google.com/maps/preview/@40.447700,-79.993300,16z",366,$94000,power, (Pittsburgh),2004 Carver 366 Motor Yacht,https://pittsburgh.craigslist.org/boa/5921633548.html,2004
78,new,,2016-12-16 10:00,"Great Gift package for the Kayak, Canoe, Camping and Fishing enthusiast in Western Pennsylvania. TOPOGRAPHIC MAPS TENT CAMP SITES WATER HAZARDS MILEAGE MARKERS ACCESS / LAUNCH SITES RIVER HISTORY BOATING SAFETY INFO W/PA HISTORY WATERPROOF PAGES 10% OFF and Free Shipping. Call show contact info or click on the photo for email.",0,5884877185,,0,,,,,$36,human, (Tidioute),Kayak and Canoe River Guide books,https://pittsburgh.craigslist.org/boa/5884877185.html,
79,,"['40.634400', '-79.620100']",2016-12-16 09:14,"72 sidewinder jet boat. 355 small Chevy. 300hp. Berkley drive,  New steering helm to drive. Black carpet no seats.  Good winter project for next year. Boat runs and drives.     Very fun. Pulls tubes well. Trade for mopar stuff, Honda trikes,",,5903711204,40.634400,16,-79.620100,,"https://maps.google.com/maps/preview/@40.634400,-79.620100,16z",,$2500,power,,Sidewinder jet,https://pittsburgh.craigslist.org/boa/5903711204.html,
80,,"['40.458400', '-80.264900']",2016-12-16 05:45,winter boat storage $35 a month show contact info joe,,5879791191,40.458400,13,-80.264900,,"https://maps.google.com/maps/preview/@40.458400,-80.264900,16z",,$35,human, (AIRPORT),WINTER  STROAGE,https://pittsburgh.craigslist.org/boa/5879791191.html,
81,,,2016-12-15 19:40,"TRY HAUL???? What is that? try to haul. Dumbass must mean Tri Hull. Don't buy here, obviously a hillbilly",,5921103501,,11,,,,,,human,,RE:make an offer,https://pittsburgh.craigslist.org/boa/5921103501.html,
82,,,2016-12-15 17:13,Try haul show contact info,,5920931846,,14,,not sure,,,,power,,make an offer,https://pittsburgh.craigslist.org/boa/5920931846.html,
83,,,2016-12-15 17:12,Try haul show contact info,,5920931365,,14,,not sure,,,,power,,make an offer,https://pittsburgh.craigslist.org/boa/5920931365.html,
84,excellent,,2016-12-15 11:03,"1962 Lonestar Malibu 14' boat for sale, the boat was redone this spring, it was stripped and painted, cream color on the bottom and a burgundy on the top. 4 seats on swivels that match the paint color. the motor is a 1959 Johnson 35 super seahorse, the lower end of the motor was rebuilt with new seals and has fresh oil. the motor runs perfectly and is hands free to operate, on the dash in front of the drivers seat is the steering wheel, a key start, electric choke, switch for lights and a switch for the bilge pump that is in the rear of the boat. the boat was seam sealed before painting. it sits on a refinished trailer that has new bearings, tires and rolers. this boat is in almost perfect shape an goes through the water well. it can be used as a cruiser or also a fishing boat because of the swiveling seats. i am asking 2200$ OBO, call or text with any questions or for more pictures",,5920365839,,14,,Lonestar,,Malibu,$2200,power, (PENFIELD),1962 Lonestar Malibu 14',https://pittsburgh.craigslist.org/boa/5920365839.html,1962
85,,"['40.768700', '-80.359200']",2016-12-15 10:55,For sale a handmade cedar strip  tandem canoe. Will entertain a reasonable offer.,,5920353084,40.768700,16,-80.359200,,"https://maps.google.com/maps/preview/@40.768700,-80.359200,16z",,$1500,human,,Handmade cedar strip canoe,https://pittsburgh.craigslist.org/boa/5920353084.html,
86,,"['40.715700', '-80.260300']",2016-12-15 10:32,Just bought in September. Only used a few times. Fishing kayak. With paddle,20,5920320161,40.715700,9,-80.260300,Ggh,"https://maps.google.com/maps/preview/@40.715700,-80.260300,16z",Gggg,$500,human, (Rochester),Kayak,https://pittsburgh.craigslist.org/boa/5920320161.html,2016
