,condition,coord_pair,date,description,engine hours (total),id,lat,length overall (LOA),long,make / manufacturer,map_URL,model name / number,price,propulsion type,region,title,url,year manufactured
90,,,2016-11-18 22:31,"For Sale- 2 Sea Doo jet ski's... The first one is a 2004 GTX 3 seater, supercharged 185 hp with 189 hrs, good condition, runs great with reverse. The other Ski is a 2006 RXP 2 seater, supercharged with intercooler 215 hp with 71 hrs, good condition and also runs great with reverse. both ski's have covers and coast guard packages. The trailer is a 2 ski 2006 Karavan galvanized trailer with a spare tire. $8000.00 for the package or will split up. Call with any questions show contact info",,5883129240,,6,,,,,$8000,power,,Pair of Sea Doo jetski's w/Trailer,https://scranton.craigslist.org/boa/5883129240.html,
91,,"['41.343200', '-75.530100']",2016-11-18 20:20,"1986 16 FT. OPEN BOW 90 HP FIBERGLASS BOAT WITH 1988 Load Rite TRAILER. 90 hp Evinrude motor, Loadrite trailer, extra fuel tank perfect for water skiing! Well maintained, runs good!",,5883008722,41.343200,16,-75.530100,EBB TIDE,"https://maps.google.com/maps/preview/@41.343200,-75.530100,16z",,$5300,power,,EBBTIDE 16 FT. FIBERGLASS BOAT and TRAILER,https://scranton.craigslist.org/boa/5883008722.html,
92,,,2016-11-18 16:04,PROJECT BOAT!! THIS IS A 2003 SUNTRACKER PARTY HUT 30ft PONTOON WITH TRAILER. I ONLY HAVE A BILL OF SALE FOR THIS BOAT AND TRAILER. I PURCHASED AT A SALVAGE AUCTION. NEEDS WELDING  WORK ON PONTOONS AND WORK ON INTERIOR AND SIDE PANELS . MERCURY OPTIMAX V6 MOTOR RUNS GOOD. MOTOR IS WORTH THE MONEY. TRAILER IS IN GOOD SHAPE ALSO . THIS IS A PROJECT BOAT. NEEDS ALOT OF TLC. I DONT HAVE THE TIME TO DO IT . SERIOUS INQUIRIES ONLY. PLEASE TEXT OR CALL I DONT CHECK MY EMAIL OFTEN.,,5850762665,,30,,,,,$6000,power, (Moosic),2003 suntracker party hut 30ft pontoon with trailer,https://scranton.craigslist.org/boa/5850762665.html,
93,good,"['41.317500', '-75.788500']",2016-11-18 09:07,IF YOU NEED USED TIRES MAYBE IT YOUR OPPORTUNITY....call me anytime 2 tires  $50,,5881913290,41.317500,1,-75.788500,goodyeat,"https://maps.google.com/maps/preview/@41.317500,-75.788500,16z",,$50,power, (Pittston),tires,https://scranton.craigslist.org/boa/5881913290.html,
94,,"['41.438900', '-75.662500']",2016-11-18 07:40,"Boat,trailer and accessories",,5836011435,41.438900,14,-75.662500,,"https://maps.google.com/maps/preview/@41.438900,-75.662500,16z",,$1500,human, (Clark's Summit),14' Grumman aluminum boat with trailer,https://scranton.craigslist.org/boa/5836011435.html,
95,excellent,,2016-11-17 16:24,2013 Sea Ray 190 SPORT You are looking at a 2013 Sea Ray 190 Sport with only 177 hours.  The boat comes equipped with a trailer.  The boat is immaculate and has the attitude.  She looks like a high end sports car in the water!  The boat is powered with a 4.3 MPI V6 Mercruiser and is propelled with a Alpha One outdrive.,,5881074995,,19,,,,,$15500,power, (Pennsylvania),2013 Sea Ray-New price-82,https://scranton.craigslist.org/boa/5881074995.html,
96,,"['41.435000', '-75.610300']",2016-11-16 21:01,Sears Ted Williams 5.5 hp with portable gas tank. $100,,5880018712,41.435000,1,-75.610300,sears,"https://maps.google.com/maps/preview/@41.435000,-75.610300,16z",ted williams 5.5,$100,power,,outboard motor 5.5hp,https://scranton.craigslist.org/boa/5880018712.html,
97,good,,2016-11-16 17:06,Canoe is in great shape giving it away at this price 2 paddles 2 flotation seat have registration thanks for lookibg,,5875022543,,17,,Blue hole,,,$300,human, (Hunlock creek),17.5 blue hole canoe,https://scranton.craigslist.org/boa/5875022543.html,
98,good,,2016-11-16 10:01,"19 ft Tahoe Q5 for sale. Low hours, strong engine, all seating but captains chairs recently refurbished.",,5878965133,,19,,Tahoe,,Q5,$4500,power," (Greenfield Twp, PA)",1999 Tahoe Q5,https://scranton.craigslist.org/boa/5878965133.html,1999
99,good,"['41.366500', '-75.836200']",2016-11-16 06:30,"This boat is a Landau fishing boat semi v alum. hull with a 35hp mercury auto oil injection outboard motor two live wells one air rated two fish finders 35 lb thrust front mounted electric trolling motor with a load rite trailer this boat has been stored for several years ,sold as is.Asking 2500 or best offer.",,5878767466,41.366500,16,-75.836200,Landau,"https://maps.google.com/maps/preview/@41.366500,-75.836200,16z",,$2000,power, (Pittston pa.),landau fishing boat,https://scranton.craigslist.org/boa/5878767466.html,1986
