,condition,coord_pair,date,description,engine hours (total),id,lat,length overall (LOA),long,make / manufacturer,map_URL,model name / number,price,propulsion type,region,title,url,year manufactured
0,,"['34.851100', '-80.002500']",2016-12-20 19:01,"IF YOU ARE READING THIS ADD, YES, IT IS STILL AVAILABLE!! 1973 14ft fiberglass Jon Boat with running (needs carb cleaned) 15hp a chrysler motor and foot controlled trolling motor with batteries and clear titles boat, sent off for lost title on trailer. No title for motor as NC doesn't require/issue them. Make a offer and I will get back to you.",,5918322732,34.851100,14,-80.002500,,"https://maps.google.com/maps/preview/@34.851100,-80.002500,16z",,,power,,14' Fiberglass Jon Boat 15hp,https://florencesc.craigslist.org/boa/5918322732.html,
1,excellent,,2016-12-20 18:04,"Xpress XP 180 powered by a Yamaha F90. At 60"" wide and 18' long this boat is very stable. I purchased brand new from Marshalls Marine in August of 2013. All scheduled maintenance has been performed at the Lake City location. Motor has 2 years remaining on warranty. This boat has been meticulously maintained and always garage kept. Boat has fewer than 50 hours of use! Boat has the following accessories plus more: Hummingbird gps/fish finder minn kota 55lb thrust trolling motor powertech SS prop Jenson marine radio +2 speakers CMC breakaway jack plate custom duck blind Will consider trades for equivalent value mud motor boat. Text or email are preferred. Tags: xpress, havoc, edge, excel, ambush, war eagle, triton, Gator Trax, Gator Tail, Duck Boat, mud motor, yamaha",50,5902216239,,18,,Xpress,,xp 180,$17500,power, (Hartsville),Xpress XP 180,https://florencesc.craigslist.org/boa/5902216239.html,2013
2,like new,,2016-12-20 15:58,Comes with galvanized trailer and 1998 15hp Johnson motor. Runs great!,,5927282518,,15,,Duracraft,,,$3600,power, (Lake City),1998 Duracraft,https://florencesc.craigslist.org/boa/5927282518.html,1998
3,,,2016-12-20 14:14,I have started for 25 30 horse Evinrude and johnson also have a lower unit for a 40 and 50 johnson also have mercury and Yamaha parts and repairs please just give me a call for more info show contact info,,5906675795,,1,,,,,$1,power, (nickels),used boat motor parts,https://florencesc.craigslist.org/boa/5906675795.html,
4,good,"['34.021300', '-84.310400']",2016-12-20 11:30,27hp pro drive with manual reverse. Newish control box and prop(10hrs on them both). $1800 cash will trade for a 40hp motor,90,5926841256,34.021300,20,-84.310400,Pro drive,"https://maps.google.com/maps/preview/@34.021300,-84.310400,16z",27hp,$1800,power, (Atlanta),Pro drive 27hp mud motor,https://florencesc.craigslist.org/boa/5926841256.html,
5,good,"['34.094600', '-79.791800']",2016-12-19 19:20,"1986 EAGLE WITH 70 EVINRUDE.TITLE,NEW FLOOR,CARPET SEATS FUEL PUMP,BATTERY AND NEW TRAILER TIRES.CALL REPLY NUMBER.NO EMAILS ANSWERED.",,5926171272,34.094600,15,-79.791800,,"https://maps.google.com/maps/preview/@34.094600,-79.791800,16z",,,power,,1986 Eagle Fish & Ski Boat Trailer New Interior not Pictured,https://florencesc.craigslist.org/boa/5926171272.html,
6,excellent,,2016-12-19 17:00,"17'6"" Triton with 90 horse two stroke Mercury motor. Has been garage kept since the day I bought it. It has a 40 lb thrust trolling motor with one live well in the rear.",,5925997702,,18,,Triton,,176 Sport,$10000,power, (Florence),2004 Triton 176 Sport,https://florencesc.craigslist.org/boa/5925997702.html,2004
7,good,"['34.110300', '-81.196600']",2016-12-19 11:17,"Purchases a few months ago, really great and outstanding boat, just not as into it as I'd thought I'd be, I am also trying to move(relocate) so the extra cash would help, anyways, 1990 16ft Commander Center Console with a 1989 90HP Evinrude on the back, engine in great shape for its age, a couple of cranks and your off, tunes great at high speeds as well, probably tops 35-40 mph fully open. I'm also open to offers and possible trades for a motorcycle or other boat. Boat: New radio with new speakers, all new switches with new breakers, new dual battery switch with new 4 gauge wire, new seat cushions, new paint, Bimini top. Motor: just serviced, carburetor cleaning, new thermostat. Runs great. Will need a new starter in the upcoming future. Clean titles for boat and motor in hand. Would also be willing to meet. Thanks for looking and give me a call if interested, text would be better because never know when I'm working. Chris show contact info",,5902871329,34.110300,16,-81.196600,,"https://maps.google.com/maps/preview/@34.110300,-81.196600,16z",,$2500,power,,1990 Center Console,https://florencesc.craigslist.org/boa/5902871329.html,
8,,"['33.782700', '-79.147300']",2016-12-18 19:01,"2005 Sun Tracker Party Barge 24' Coastal Series w/60hp Meecury 4-stroke, tandem galvanized trailer, stereo, depth finder, changing station, upholstery in good condition, going to need new canvas on Bimini top, has already been bottom painted so ready to go in water!!! $6,995 Call show contact info",,5912751075,33.782700,24,-79.147300,,"https://maps.google.com/maps/preview/@33.782700,-79.147300,16z",,$6995,power," (Conway, SC)",2005 Sun Tracker Party Barge 24' Coastal Series w/60hp Mercury,https://florencesc.craigslist.org/boa/5912751075.html,
9,,"['34.101200', '-79.937800']",2016-12-18 13:24,"21 ft cuddy cabin Bayliner Trophy forsale. Has 225 Evinrude motor. 2 stroke. Can sleep 3 adults in cabin and has porter potty. Great weekend boat. Boat in great shape and runs great. Only reason for sale, it doesn't fit my needs any longer. Trailer in great shape, news tires, hubs and breaks last year. Serious buyers only, no low ball offers and I don't need help selling this boat.",,5900735684,34.101200,21,-79.937800,,"https://maps.google.com/maps/preview/@34.101200,-79.937800,16z",,$5700,power, (Timmonsville),21 ft Cuddy cabin,https://florencesc.craigslist.org/boa/5900735684.html,
10,fair,,2016-12-18 11:42,"2004 mercury 150 optimax 25 inch shaft,  stainless sked, mercury mirage stainless prop, new 175 pro xs decals. motor in great cosmetic shape.  great for  Parts or Repair.  I was running engine an engine made a rattling noise and shut off and would not restart. never had it check just assumed it blew up.  motor is now mounted  on a pallet. ****** motor does not run ****** I have  motor title ***** contact : prefer text or call show contact info $1650.00 obo.",,5924255293,,150,,mercury,,outboad motor,$1650,power,,mercury outboard engine,https://florencesc.craigslist.org/boa/5924255293.html,2004
11,,"['34.056300', '-79.246400']",2016-12-18 08:59,"-----NO TRADES---- I HAVE A 16' MONARK 48"" WIDE AT THE BOTTOM, ITS A FLAT BOTTOM, ALUMINUM. JON BOAT, FACTORY SIDE CONSOLE, WITH A STEERING WHEEL, 25 MERCURY ELECTRIC START, STERN MOUNT MINKOTA 55# THRUST TROLLING MOTOR, EVERYTHING IS IN EXC. COND.! RUNS PERFECT! ALL LIGHTS WORK. ELDERLY OWNED. ITS NOT ALL BEAT UP AND DENTED! LESS THAN 50 hrs ON THE WHOLE RIG. I HAVE THE TITLES FOR BOTH. READY FOR DUCK SEASON!!! $3,200 CA$H ***Best way to get up with me is leave a number I can call you back in the evening.***",,5924079082,34.056300,16,-79.246400,,"https://maps.google.com/maps/preview/@34.056300,-79.246400,16z",,$3200,power,,Flat Bottom 16' Aluminum Jon Boat,https://florencesc.craigslist.org/boa/5924079082.html,
12,,"['33.450800', '-79.134100']",2016-12-17 20:22,Diesel powered 3126 Catapillar 11/2 - 1 Reduction gear Diesel Generator Kohler 11kw Coast Guard Inspected cruises at 16 knots Heat and air Fully loaded too much to list call the phone number listed for more information thanks,,5923734723,33.450800,35,-79.134100,,"https://maps.google.com/maps/preview/@33.450800,-79.134100,16z",,$55000,power, (georgetown sc),35 foot Bruno Stillman Custom Fishing Boat,https://florencesc.craigslist.org/boa/5923734723.html,
13,excellent,"['34.094600', '-79.791800']",2016-12-17 18:32,"1986 EAGLE WITH 70 EVINRUDE.NEW INTERIOR NOT PICTURED,NEW FLOOR,CARPET SEATS,FUEL PUMP,BATTERY AND NEW TRAILER TIRES.A REAL WOMEN MAGNET ! CALL REPLY NUMBER.NO EMAILS ANSWERED.",,5923634473,34.094600,15,-79.791800,,"https://maps.google.com/maps/preview/@34.094600,-79.791800,16z",,,power,,"1986 Eagle Fish & Ski Boat Trailer with Title,Priced to Sale",https://florencesc.craigslist.org/boa/5923634473.html,
14,excellent,"['34.229600', '-80.714700']",2016-12-17 17:25,"28 Foot SanPan Pontoon Boat Party Barge, Originally 1964 model Fully Restored, 30' dual-axle Wesco Bunk Trailer with lights, brand new sand-colored vinyl flooring, treated Bennington seats in great condition with dual recliners in front with storage, rear wrap around with storage, reclining/swivel captain seat, fiberglass helm with separate 12V battery for accessories and trickle charger, 1992 60 HP Evinrude Motor with electric trim and separate 12V starting battery, 3/4 length aluminum hard top with storage, anchor and rope, life-vests, AM/FM/MP3 radio with surround-sound, full LED floor lighting, full LED ceiling lighting, anchor/navigation lighting, newly painted railing walls, LED front landing lights, horn, seat covers and tarp with tie downs, dual 5 gallon fuel tanks with additional 20 gallon tank, pier side bumpers, in use now and ready for the water! Will consider trade for newer model dual jet skis with trailer ONLY or BEST OFFER. Call 803-408-856(six) before 9 PM. Leave a message-Email preferred.",,5923560835,34.229600,28,-80.714700,SanPan,"https://maps.google.com/maps/preview/@34.229600,-80.714700,16z",Pontoon,$7800,power, (Lugoff),28' San Pan Party Barge Pontoon with aluminum top,https://florencesc.craigslist.org/boa/5923560835.html,
15,excellent,"['34.375600', '-80.084200']",2016-12-17 14:30,boat runs out good in the water it has a Yamaha 150 4 stroke motor the motor has 250 hours on it,250,5923323719,34.375600,22,-80.084200,bennington 2250rl,"https://maps.google.com/maps/preview/@34.375600,-80.084200,16z",,$24995,power, (Hartsville),2006 bennington tri toon,https://florencesc.craigslist.org/bod/5923323719.html,2006
16,,"['34.375600', '-80.084200']",2016-12-17 12:35,"1987 Riverboat Flare 14ft. 6in,, 1978 mercury 50 horse, runs and drives good in water, very clean",,5923146099,34.375600,14,-80.084200,Flare,"https://maps.google.com/maps/preview/@34.375600,-80.084200,16z",,$995,power, (hartsville),1987 Riverboat Flare 14ft. 6in,https://florencesc.craigslist.org/bod/5923146099.html,1987
17,,"['34.375600', '-80.084200']",2016-12-17 12:32,this boat has a supercharged mercury 150 it runs out very good on the water and very powerful its on a brand new galvanized trailer all it needs is a drivers seat contact marcus at 843-307-3620,,5923139803,34.375600,20,-80.084200,kenner,"https://maps.google.com/maps/preview/@34.375600,-80.084200,16z",vision boat,$9995,power," (Hartsville, SC)",2006 kenner vision boat,https://florencesc.craigslist.org/bod/5923139803.html,2006
18,,"['34.375600', '-80.084200']",2016-12-17 12:30,01 party hut 30 foot long ghas an all aluminum deck has all the furniture that goes with it including sink and stove furniture needs re covering it has a mercury black max 150 and it runs out very good in the water,,5923136667,34.375600,30,-80.084200,sun tracker,"https://maps.google.com/maps/preview/@34.375600,-80.084200,16z",party hut,$7500,power," (Hartsville, SC)",2001 sun tracker party hut,https://florencesc.craigslist.org/bod/5923136667.html,2001
19,excellent,"['34.375600', '-80.084200']",2016-12-17 09:41,"2003 Bass Tracker Anniversary Edition in great condition. Has new trolling motor and new depth finder with GPS. Will sell for $5700 with old trolling motor and depth finder that is still in great condition. Everything on this boat works as it should. show contact info call or text.Will trade for center console, key west,sea pro or something like, 17-18 ft.",,5913384296,34.375600,17,-80.084200,Mercury 40hp,"https://maps.google.com/maps/preview/@34.375600,-80.084200,16z",,$6200,power, (Hartsville),2003 Bass Tracker Anniversary Edition,https://florencesc.craigslist.org/boa/5913384296.html,
20,,"['34.056300', '-79.246400']",2016-12-17 06:43,"-----NO TRADES---- I HAVE A 16' MONARK 48"" WIDE AT THE BOTTOM, ITS A FLAT BOTTOM, ALUMINUM. JON BOAT, FACTORY SIDE CONSOLE, WITH A STEERING WHEEL, 25 MERCURY ELECTRIC START, STERN MOUNT MINKOTA 55# THRUST TROLLING MOTOR, EVERYTHING IS IN EXC. COND.! RUNS PERFECT! ALL LIGHTS WORK. ELDERLY OWNED. ITS NOT ALL BEAT UP AND DENTED! LESS THAN 50 hrs ON THE WHOLE RIG. I HAVE THE TITLES FOR BOTH. READY FOR DUCK SEASON!!! $3,200 CA$H ***Best way to get up with me is leave a number I can call you back in the evening.***",50,5917425250,34.056300,16,-79.246400,,"https://maps.google.com/maps/preview/@34.056300,-79.246400,16z",,$3200,power,,Flat Bottom - 16' Jon boat - Side Console - 25HP - Ready 4 ducks!!,https://florencesc.craigslist.org/boa/5917425250.html,
21,like new,"['34.183800', '-79.772800']",2016-12-16 16:46,"Make your friends jealous this year on the water. Completely redone 1987 Fisher Marine 16', all new carpet, seats, lights, speakers, marine CD player, trolling motor, too much stuff to list. A rebuilt 1984 Evinrude 60, cranks up on first turn everytime. Trailer has new carpet and all new tires and rims including spare. A great boat ready for a new owner. $4995.00OBO. A perfect Christmas gift.",,5922225810,34.183800,16,-79.772800,Fisher Marine,"https://maps.google.com/maps/preview/@34.183800,-79.772800,16z",Evinrude,$4995,power, (Florence),Completely redone boat and motor,https://florencesc.craigslist.org/boa/5922225810.html,1987
22,fair,"['33.829900', '-79.478300']",2016-12-16 16:44,"Good condition 85 stratos bass boat hot foot jack plate and 87 mariner 150 with 4 blade stainless prop needs bench seat at console ,power pack on motor clear coat is faded a little bit. would like to trade for another boat and motor. text me for pic 800 obro",,5915722827,33.829900,17,-79.478300,stratos,"https://maps.google.com/maps/preview/@33.829900,-79.478300,16z",,$800,power,,stratos 17 foot with 150 mariner,https://florencesc.craigslist.org/boa/5915722827.html,1985
23,,"['34.056300', '-79.246400']",2016-12-16 10:14,"PLEASE SERIOUS INQUIRES ONLY REPLY. SEND A NUMBER, I'LL CALL YOU AFTER WORK IN THE EVENING. SORRY, NO TRADES.................. I HAVE A 16' MONARK 48"" WIDE AT THE BOTTOM, ITS A FLAT BOTTOM, ALUMINUM. JON BOAT, FACTORY SIDE CONSOLE, WITH A STEERING WHEEL, 25 MERCURY ELECTRIC START, STERN MOUNT MINKOTA 55# THRUST TROLLING MOTOR, W/OPTIMA BATTERY. EVERYTHING IS IN EXC. COND.! RUNS PERFECT! ALL LIGHTS WORK. ELDERLY OWNED. ITS NOT ALL BEAT UP AND DENTED! I HAVE THE TITLES FOR BOTH. JUST IN TIME FOR DUCK SEASON!!! $3,200 CA$H",,5909504011,34.056300,16,-79.246400,,"https://maps.google.com/maps/preview/@34.056300,-79.246400,16z",,$3200,power,,--- FLAT BOTTOM 16 ft Side Console Jon Boat-Ready 4 Ducks,https://florencesc.craigslist.org/boa/5909504011.html,
24,,"['34.056300', '-79.246400']",2016-12-16 08:47,"SIXTEEN FOOT MONARK, 48"" WIDE AT THE BOTTOM, ITS A FLAT BOTTOM, ALUMINUM. JON BOAT, FACTORY SIDE CONSOLE, WITH A STEERING WHEEL, QUICK SILVER CONTROLS, 25HP MERCURY, ELECTRIC START, MINKOTA 55 POUND THRUST STERN MOUNT TROLLING MOTOR. OPTIMA BATTERY. EXCELLENT CONDITION!! RUNS PERFECT! ALL LIGHTS WORK. REGISTERED TILL 6/18 ELDERLY OWNED, NOT DENTED OR BEAT UP! SUPER CLEAN AS YOU SEE IN PICS! TITLES FOR BOTH IN MY NAME! READY TO DROP SOME DUCKS!!! THE 1st - $3,200 IN CASH ! GETS IT --------BEST WAY TO GET ME IS EMAIL A NUMBER I CAN GET YOU AT AFTER 6PM----------",,5911064794,34.056300,16,-79.246400,,"https://maps.google.com/maps/preview/@34.056300,-79.246400,16z",,$3200,power,,** 16' - 25 hp - Side Console - Jon/Duck Boat - Flat Bottom Alum.,https://florencesc.craigslist.org/boa/5911064794.html,
25,good,[],2016-12-15 20:59,two 14 foot boats one has trolling motor. one boat has 45  hp jhonson motor the other has a 45 hp mercury. both boats have trailers. each boat is 1500.00 each.,,5921178706,,14,,,https://maps.google.com/?q=loc%3A+alderman+camp+rd+at+%33%30%31+alcolu+SC+US,,$1500,power, (alcolu),boats,https://florencesc.craigslist.org/boa/5921178706.html,
26,good,"['34.094600', '-79.791800']",2016-12-15 10:11,"1986 EAGLE WITH 70 EVINRUDE.TITLE,NEW FLOOR,CARPET SEATS FUEL PUMP,BATTERY AND NEW TRAILER TIRES.CALL REPLY NUMBER.NO EMAILS ANSWERED.",,5920291194,34.094600,15,-79.791800,,"https://maps.google.com/maps/preview/@34.094600,-79.791800,16z",,,power,,1986 Model Eagle Fish & Ski Boat Trailer New Interior not Pictured,https://florencesc.craigslist.org/boa/5920291194.html,
27,new,"['33.878600', '-79.985200']",2016-12-14 21:15,"For sale: 2016 Xpress 180XP Camoflauge Fishing Aluminum Boat 18FT Pretty much brand new; Side console; 2016 90HP Yamaha Four Stroke Outboard Motor with less than 20 hours; Stainless steel prop; 3 batteries; Minnkota on board charger; 70lb Minnkota Maxxum Trolling Motor 24 volt; Has 2 of the Humminbird Helix 5DS depthfinder/GPS; Aluminum trailer with rims; This boat is in immaculate condition and has only been used about 4 times.6 years of Extended Warranty comes with engine. Asking Payoff $22,000.00",20,5919856225,33.878600,18,-79.985200,Xpress,"https://maps.google.com/maps/preview/@33.878600,-79.985200,16z",180XP,$22000,power," (Turbeville, SC)",2016 Xpress 180XP,https://florencesc.craigslist.org/boa/5919856225.html,2016
28,excellent,"['34.451200', '-79.886500']",2016-12-14 16:19,1999 mckee  craft 17.4 ft long 6.25 ft wide with 70 hp 4 stroke Suzuki also a 1999 great boat for inlet fishing lakes or rivers reason for selling just does not get enough use to keep asking 6200 obo contact james at show contact info,200,5893447070,34.451200,17,-79.886500,mckee,"https://maps.google.com/maps/preview/@34.451200,-79.886500,16z",,$6200,power,,boat,https://florencesc.craigslist.org/boa/5893447070.html,1999
29,,,2016-12-13 21:17,"2017 havoc 653 dbst with 2002 Mercury 2 stroke 50. The motor is in great shape and has electric start and tilt/trim. Boat has only been in the water maybe 3 times. Has led lights inside and out, led light bar, 4 JL audio 7.7"" speakers, 4000/4 Polk audio amp, nvx equalizer and Bluetooth, ($1,000 in the stereo setup), bilge pump, os handle, cleats, optima battery and more. The trailer is a 2017 aluminum trailer with all LED lights and upgraded 14"" wheels. Not interested trades. $15,000 Havoc duck boat edge Waco titan excel xpress Mercury Yamaha 40 50 60 2 stroke outboard tiller handle",,5918471960,,16,,,,,,power,,2017 havoc dbst,https://florencesc.craigslist.org/boa/5918471960.html,
30,good,[],2016-12-13 20:36,"1992 Grumman Tracker - 17' 50HP Johnson VRO 2 stroke - Nice! Trolling motor, great cond! Perfect sized Bass Boat - Aluminum side console, runs excellent. electric start, CRC Jack plate/power trim, New gauges/fusebox/wiring, Fishfinder, 2 batts, Live well, new carpet and seats, good trailer. Everything in great condition and turn key. Compression is perfect at 150PSI x 2. Needs nothing. Freshwater boat. This boat has just been fully inspected and serviced by Buckhorn Boat Doc in Lucama and is 100% ready for the water. The trailer was also just serviced and has good tires, lights and bearings serviced. This rig looks and drives great, runs about 35MPH! $4950 OBO. Boat can be seen at Buckhorn Boat Doc, 7027 Hwy 42W Lucama NC 27851. WWW.BUCKHORNBOATDOC.COM Give Keith a call or text 9196022876 to setup a showing.",,5918432541,,17,,Grumman,https://maps.google.com/?q=loc%3A+%37%30%32%37+Hwy+%34%32+Lucama+SC+US,17 Tracker,$4500,power, (Lucama),1992 Grumman Tracker - 17' 50HP Johnson VRO 2 stroke - Nice!,https://florencesc.craigslist.org/bod/5918432541.html,1992
31,,,2016-12-13 19:52,"'96 Kawasaki and '96 Polaris Both ran this summer, but could use a tune up. - New batteries - Dual trailer (galvanized) - New lights and wiring - New hubs",,5918386267,,11,,,,,$1750,power, (Effingham),2 PWC and Trailer,https://florencesc.craigslist.org/boa/5918386267.html,
32,excellent,[],2016-12-13 19:06,"REDUCED! 2001 Sundance Skiff f19 with 2004 Mercury 75HP. Excellent condition! Boat and trailer are 2001. Motor is a 2004 75HP oil injected Mercury 2 stroke with stainless steel prop. Boat, motor and trailer are all in excellent condition. Motor Guide 24V trolling motor with 2 batteries and built in on board charger. 3 batteries total in boat. New large cooler/seat just installed. On board live well with circulating pump. Bilge pump. Boarding/swim ladder/step stern mounted. UHF radio and antenna. New Garmin color GPS/Fish finder. New 12 gallon gas tank installed with new fuel lines. New Mercury tachometer. 4 trolling pole holders stern mounted. Wesco galvanized trailer with new tires and newly installed LED lighting. Everything you need for the water included; anchor, vests, throwable cushion, fire extinguisher, ropes, nav light poles and whistle. Boat/trailer has been fully serviced and inspected by Buckhorn Boat Doc and is 100% turn key. This is a really nice rig that can get you on the lakes, rivers and sound...very solid well build skiff. Boat can be seen at Buckhorn Boat Doc, 7027 Hwy 42W Lucama NC 27851. WWW.BUCKHORNBOATDOC.COM Give Keith a call or text at 9196022876",,5918335070,,20,,Sundance,https://maps.google.com/?q=loc%3A+%37%30%32%37+Hwy+%34%32+Lucama+SC+US,F 19,$6950,power, (Lucama),REDUCED! 2001 Sundance Skiff f19 with 2004 Mercury 75HP. Excellent!,https://florencesc.craigslist.org/bod/5918335070.html,2001
33,like new,"['34.375600', '-80.084200']",2016-12-13 18:39,"Bought brand new less than a year ago. Like new condition. Very stable and has done great for duck hunting and fishing. Has dry storage up front and cargo area with net on back, anchor trolley, paddle holder, very comfortable seat, and removable rod holder not pictured that goes beside cup holder. Please call or text. No emails",,5918302810,34.375600,12,-80.084200,Ascend,"https://maps.google.com/maps/preview/@34.375600,-80.084200,16z",Fs 12,$675,human, (Hartsville),Ascend fs 12 camo kayak,https://florencesc.craigslist.org/boa/5918302810.html,2015
34,,,2016-12-13 16:54,"I have for sale a 1993 ski and fish boat with a 70hp evinrude on back also has trolling motor and fishfinder. I have titles to boat,motor,and trailor all 1993. This boat came off showroom floor and is ready for fishing for more infor and pics I can be reach at show contact info",,5918161535,,16,,,,,$4500,sail, (mytrle beach),1993 ski and fish,https://florencesc.craigslist.org/boa/5918161535.html,
35,,"['34.375600', '-80.084200']",2016-12-13 14:46,"2016 13'6"" cypress stripboat. Just built it and set it up. Has a 40 Omc on it would sell package. Boat trailer $1500 or best offer. Call or text for pics show contact info",,5917961317,34.375600,14,-80.084200,,"https://maps.google.com/maps/preview/@34.375600,-80.084200,16z",,$1500,power, (Hartsville),2016 Stripboat,https://florencesc.craigslist.org/boa/5917961317.html,
36,good,"['33.913200', '-81.459800']",2016-12-13 13:12,"Ever get tired of trying to keep the seats and carpet clean. I did, so I took them out, and put down a non skid product called dock revive, (expensive). Looks great and easy to clean. I setup this package to use in the wet cool months after I store my summer boat, and have used it every weekend since October. It runs great and has worked fine for me, but now I have found another speed boat I want, and need to sell this one. If you compare prices with other boats listed, you will see this is a great deal. It is in the water for serious buyers to test. Here's the details: 1990 Lowe tritoon with the bottom under skinned. The top and side curtains pictured do not go with the boat, but a good bimini top in blue does. Dual batteries (1 year old) and switch. 23 gallon fuel tank. All gauges work except speedometer. I sanded and painted the outside fencing the gray color and it looks nice. Nice captains chair, and a chair I made from a cooler for some dry storage. I use bag chairs for additional seating. 2003 Johnson 115 hp motor. Runs great. One aluminum and one stainless prop. Good water pump and fresh lube in lower. 2000 Wesco pontoon trailer with built in ladder. New wood and carpet bunks. Tires good and lights work.",,5917640478,33.913200,24,-81.459800,Lowe,"https://maps.google.com/maps/preview/@33.913200,-81.459800,16z",,$7000,power," (Gilbert, SC)","24' Tritoon, 115 hp, trailer",https://florencesc.craigslist.org/boa/5917640478.html,1990
37,,,2016-12-13 10:12,13' Boston Whaler with 25hp Honda 4stroke motor. Runs like new and has trailer.  I have owned this boat for years and the reason I am selling is I have purchased a new 13' Boston Whaler. For more info or to view please call. No E-Mails!!!!! 4800.00 OBO Rickey show contact info,,5917498071,,13,,Boston Whaler,,,$4800,power, (Florence),13' Boston Whaler/With Honda,https://florencesc.craigslist.org/boa/5917498071.html,
38,excellent,,2016-12-12 21:45,"1995 Duracraft jon boat, 14 ft; motor is 2012 Yamaha four-stroke, 25hp, under 30 engine hours, stainless steel prop; 2004 easy-loader galvanized trailer; $4500",,5917061837,,14,,,,,$4500,power, (Effingham),Duracraft Jon Boat,https://florencesc.craigslist.org/boa/5917061837.html,
