,condition,coord_pair,date,description,engine hours (total),id,lat,length overall (LOA),long,make / manufacturer,map_URL,model name / number,price,propulsion type,region,title,url,year manufactured
0,,"['37.178400', '-79.652100']",2016-12-20 15:55,almost new pontoon supports and brackets less than one year old bought a different kind of boat no longer needed.,,5904994072,37.178400,14,-79.652100,,"https://maps.google.com/maps/preview/@37.178400,-79.652100,16z",,$175,human, (moneta),almost new pontoon suports and brackets,https://roanoke.craigslist.org/boa/5904994072.html,
1,good,,2016-12-20 15:03,looking into selling my 12 foot John boat does not take on any water only thing that need to be done is some cosmetic stuff asking 200 for it if interested I will throw in a 25p thrust trolling motor for a extra 30 call or text Josh show contact info really good John boat just can't use it does not come with trailer nice boat just don't use it anymore,,5920989195,,12,,john boat,,john boat,$200,human, (new castle),12 foot v haul John boat,https://roanoke.craigslist.org/boa/5920989195.html,
2,new,,2016-12-20 14:02,"New 2017 Galvanized Pontoon Trailers by LoadRite Don't settle for a painted trailer!! All Trailers are in stock, and ready for your boat! New Single Axle Trailer up to 20ft - $1595 New Single Axle Trailer up to 23ft - $1695 New Dual Axle Trailer up to 25ft - $2195 New Dual Axle Trailer up to 25ft with Brakes - $2595 ***All Trailers are equipped with front boarding ladder*** Twin Lakes Marine Call/Email for more info",0,5927104055,,0,,LoadRite,,,$1595,power, (Lake Gaston/BuggsIsland/Kerr Lake),New 2017 LoadRite Galvanized Pontoon Trailers,https://roanoke.craigslist.org/bod/5927104055.html,2017
3,,,2016-12-20 12:35,Pelican Flash - 5 Passenger Pedal Boat 2 adult + 3 Child /775-lb capacity Adjustable seat backs Back to back seating On dock at Smith Mountain Lake Between Lake Marker R26 & R27 ...near Hales Ford Bridge,,5914698894,,6,,Pelican,,Flash,$300,human, (Smith Mountain Lake),Pelican Flash 5 Passenger Pedal Boat,https://roanoke.craigslist.org/boa/5914698894.html,
4,fair,,2016-12-20 10:28,"Selling my kayak before I move.  This is a great, stable kayak for fishing or for the beginning kayaker.  I consider myself a beginner and the only time I ever flipped this is when I did it on purpose (to see how much it takes to flip it), and I'm 6'1"" and 300lbs.  It has a huge cockpit and was very comfortable even for a dude my size.  Also includes a paddle and a nice adjustable life jacket. Note - there is a small hole on the keel on the stern.  I have and will include a patch I bought at Back Country in Salem.  It's a really cool patch kit that is activated by UV light.  I've used it on another kayak and it works great.  The patch is $30 I think.  This is a great deal for a good spare or starter kayak.  Price is FIRM. Will post pics of the actual boat soon, but this is what it looks like: http://www.oldtowncanoe.com/kayaks/fishing/vapor_10_angler/ Text is preferred. 5-four-O 5-two-5 O-ate-3-8",,5926758165,,10,,,,,$150,human,,Old Town Angler 10 Fishing Kayak,https://roanoke.craigslist.org/boa/5926758165.html,
5,excellent,"['37.260651', '-79.925564']",2016-12-20 04:58,I HAVE A 17' BASS TRACKER  ALUMINUM  CANOE ITS HAS HEAVY  GAGE ALUMINUM ITS IN EXCELLENCE  CONDITION . IT HAS NO LEAKS OR DENTS.ITS A 2 -SEATS  WITH PLENTY OF ROOM. COMES WITH 2 OARS MAKE CONSIDER TRADE. GIVE ME A CALL IF YOU HAVE ANY QUESTION show contact info ROBERT. WILL POST PICTURE THIS WEEK.,,5902689467,37.260651,17,-79.925564,BASS TRACKER,"https://maps.google.com/maps/preview/@37.260651,-79.925564,16z",BASS TRACKER,$450,human, (roanoke),BASS TRACKER 17' CANOE,https://roanoke.craigslist.org/boa/5902689467.html,1987
6,,"['36.142800', '-80.306900']",2016-12-19 21:45,"wanted your old boat if 1990 or newer your old jet ski 97 or newer your old  truck          camper etc      buy sell  trade  call steve own run roofing co,   const co do a  lot trading  steve show contact info",,5886168016,36.142800,20,-80.306900,,"https://maps.google.com/maps/preview/@36.142800,-80.306900,16z",,$777,power, (ANYWHERE),"wanted your old jet ski,,,boat,,,truck",https://roanoke.craigslist.org/boa/5886168016.html,
7,excellent,,2016-12-19 18:26,"Up for sale is my 2013 Seadoo GTI Limited 155 in great condition with only 75 hours. Always garage kept with the cover installed. Regularly serviced and winterized every year with Webster Marine where it was purchased. The trailer's pulley and strap were upgraded last fall before it was stored in my garage.  The Seadoo is currently financed through Member One FCU. Asking $8,500 OBO For Sale Only No Trades. Perfect time to buy right before the season starts! Below is a list of specs for the seadoo. Thanks for looking. Seadoo GTI Limited 155 Specs: Length	132.6 inches Beam	48.5 inches Curb Weight	755 lbs Engine	Naturally Aspirated Three-cylinder Displacement	1,494 cc Bore and Stroke	100 mm x 63.4 mm Compression Ratio	10.6:1 Fuel Capacity	15.9 gal. Combined Stowage Capacity	30.8 gal. Color	Anthracite Grey",75,5926110457,,11,,Sea-Doo/BRP,,GTI 155 Limited,$8500,power, (Fincastle),2013 Seadoo GTI Limited 155 w/trailer,https://roanoke.craigslist.org/boa/5926110457.html,2013
8,excellent,,2016-12-19 17:57,Boat in great shape with 1982 35hp Johnson Motorguide trolling motor  contact by phone,,5903425516,,15,,Terry,,,$1800,power,,1978 Terry Bass Boat,https://roanoke.craigslist.org/boa/5903425516.html,1978
9,good,"['36.687100', '-79.869100']",2016-12-19 13:51,1975 model 110 9 1/2 horsepower mercury motor and stand with gas tank. 20 hours used total. Electric trolling motor. Engine alone is worth $1000 or best offer,20,5908331900,36.687100,12,-79.869100,,"https://maps.google.com/maps/preview/@36.687100,-79.869100,16z",,$1000,power, (Martinsville),12 ft flat bottom aluminum boat,https://roanoke.craigslist.org/boa/5908331900.html,
10,,,2016-12-19 12:17,"Well kept boat with very clean interior, 90 HP Johnson in excellent condition, very fast!  Galvanized trailer, marine battery, two portable gas tanks, and a nice full size boat cover, all included and all in excellent condition. It does not need anything and is ready for the water today!",,5889738796,,17,,,,,$5500,power, (Roanoke),Larson Citation 165,https://roanoke.craigslist.org/boa/5889738796.html,
11,excellent,"['35.017800', '-80.537200']",2016-12-19 09:42,"GREAT BASS / FISHING BOAT Dyna-Trak made by Ebbtide. Great Bass boat with everything you need to catch the fish of a lifetime. Motor Guide 82lb thrust trolling Motor 200HP Mercury, Trailer with spare tire, 24V charging system, livewell, Lowrance Wide Eye fish finder. Exceptionally clean, you don't find them like this everyday, seats look like new! Ailing health forces sale or we wouldn't let it go

Call show contact info for more information. Monroe, NC 28110 show contact info Triton, Nitro, Ranger,",,5920217503,35.017800,20,-80.537200,Dyna-Trak by Ebbtide,"https://maps.google.com/maps/preview/@35.017800,-80.537200,16z",194 DC STE,,power,,Bass Boat / Dynatrak by Ebbtide,https://roanoke.craigslist.org/boa/5920217503.html,
12,excellent,"['37.060716', '-79.396353']",2016-12-18 19:35,25 foot Aqua Patio tritoon - pontoon boat for 15 people w/ Yamaha F225 4 stroke motor. 2010 in excellent condition with Snap-On cover. w/ Lowrance HDS-8 Fishfinder/GPS Chartplotter w/ Ram Mount. w/ Lowrance Structure Scan. w/ Minn Kota 80 Riptide trolling motor. w/ Live Well. w/ privacy changing stall. See it at Leesville Lake Marina. Price reduced again.,259,5917354284,37.060716,25,-79.396353,Aqua Patio,"https://maps.google.com/maps/preview/@37.060716,-79.396353,16z",24TT-25,$25900,power, (Gretna),"2010 Aqua Patio tritoon, 25 ft. 225HP Yamaha 4 stroke",https://roanoke.craigslist.org/boa/5917354284.html,2010
13,,,2016-12-18 18:26,"For sale is my clean 2001 Sea Ray 185BR Bow Rider. 298 hours on the 4.3L Fuel Injected Mercruiser which makes 220hp. This boat spent the first 12 years of its life in freshwater lakes of New Mexico. I've had it for three where I've used it in and around the coastal areas in ILM and lakes of VA, cruising/wakeboarding. Each and every use was followed by a proper flush and a wash from keel to topside. You will not find an early 2000s Bow rider in better condition, period. Coastal or inland. The gel coat is professionally waxed and cleaned yearly. The boat never spent the night in the water or outside. The trailer has a breakaway tongue which allows it to stay in my temp controlled garage. See photos. Vinyl is nearly perfect, as is the gel coat. Everything works, the boat is ready for the water. Engine oil and gear oil freshly changed as they are yearly. Brand new battery. Vengeance prop and original are included. Full custom cover in good condition. Bimini top also included. Price includes skis, life jackets, pull rope, fishing pole attachments, trailer. See attached NADA guide putting this boat in average condition at $10,500. Please call or text with questions and thanks for looking! Similar searches: Chaparral, bowrider, cobalt, Monterey, Bayliner, Maxum, Searay, Criss Craft, Regal.",298,5924714320,,185,,Sea Ray,,185 BR,$10100,power, (Wilmington),2001 Sea Ray 185 BR Bow Ride,https://roanoke.craigslist.org/boa/5924714320.html,2001
14,,"['37.275700', '-79.877500']",2016-12-18 18:25,"In excellent condition forest green canoe. Old Town 17' . Name discover on side. With molded plastic seats. Not sure of style. Maybe 169 . Seat 2 -3 . We have put a third person in the middle or use for storage. Great canoe. We are moving out of town and can't take with us. Still hanging in our garage but will take down if you want to look at it. Original cost over $1,000. Includes 2 paddles.",,5924756809,37.275700,17,-79.877500,Old Town,"https://maps.google.com/maps/preview/@37.275700,-79.877500,16z",,$500,human,,Old Town Canoe Discover,https://roanoke.craigslist.org/boa/5924756809.html,
15,good,"['36.989100', '-79.884000']",2016-12-18 18:21,"Zuma Alcort Sailboat 12 ft includes main sail with sail bag mahogany dagger board and rudder rigging kit.  Boards and sail are in excellent, like-new condition because they have always been stored inside of house.  Cox Trailer with tires and light kit replaced 3 years ago.  Trailer is registered in VA.  Fun day sailer that is easy to rig and sail!  Accept Visa and Mastercard via Square with photo ID.  Serious inquires... MUST PICK UP.  SCAMMERS DO NOT CONTACT ME.",,5884007592,36.989100,12,-79.884000,Alcort Zuma,"https://maps.google.com/maps/preview/@36.989100,-79.884000,16z",,$1500,sail, (Rocky Mount),FUN! Zuma Sailboat with Cox Trailer,https://roanoke.craigslist.org/boa/5884007592.html,1986
16,fair,"['37.076408', '-79.933434']",2016-12-18 18:20,"AMF Trac 14 ft Catamaran includes sails with sail bag, rigging kit. Everything is in good condition including trailer except a trampoline is needed.  Highlander Trailer has sail box to carry sail and rigging gear and is registered in VA.  Definitely a fun boat!  Accept Mastercard and Visa via Square with photo ID.  Serious Inquires....MUST PICK UP....SCAMMERS DO NOT CONTACT ME!",,5884004236,37.076408,14,-79.933434,AMF,"https://maps.google.com/maps/preview/@37.076408,-79.933434,16z",,$1100,sail, (Rocky Mount),AMF Trac 14 ft Catamaran with Trailer,https://roanoke.craigslist.org/boa/5884004236.html,
17,good,,2016-12-18 18:00,"1989 Ranger 374V Bass Boat(Dealers, would love to trade in on a newer boat. Make me a deal I cant refuse?) 1992 Evinrude 175HP Outboard Engine, Runs great. 2 Lowrance 7 Chirp (new in 2015) 17' 10"" hull length Single Axle Ranger trailer, recent new bearings and repack. This is a working boat. Not a garage queen. I have used it about once or twice a month during spring to fall weather permitting. Owned it for 2 years. Previous owner had it most of its life on Smith Mountain Lake. Always garaged inside. Currently in my shop in Manassas. Call Mike Gardner seven oh 3 six seven 5 four four 7 nine",,5924730591,,17,,,,,$7500,power, (Manassas),Ranger Bass Boat,https://roanoke.craigslist.org/boa/5924730591.html,
18,good,"['36.916800', '-80.034900']",2016-12-18 16:02,"2002 Marada fish/ski boat 18ft 4in with mercruiser 3.0 475hrs. Inboard/outboard 210 horsepower 40mph 2002 moonshine trailer Trade for atv / sidexside, jeep, 4x4 pickup Around $4000 trade value or will take $3700 cash.",475,5886676202,36.916800,18,-80.034900,MARADA,"https://maps.google.com/maps/preview/@36.916800,-80.034900,16z",,$3700,power, (Ferrum),02 marada with trailer,https://roanoke.craigslist.org/boa/5886676202.html,2002
19,,"['37.232700', '-79.946300']",2016-12-18 15:04,Deluxe Waco 12' Jon Boat for sale. Comes with padded seats and Oars..,,5889982776,37.232700,12,-79.946300,,"https://maps.google.com/maps/preview/@37.232700,-79.946300,16z",,$750,human,,Waco Jon Boat,https://roanoke.craigslist.org/boa/5889982776.html,
20,good,,2016-12-18 12:54,This is a great restoration starter project. The boat has great foundation. Have all parts to complete. 327 AMC V8 trailer included.,,5924346290,,18,,,,,$2700,power, (Moneta),1964 Centery Resortor,https://roanoke.craigslist.org/boa/5924346290.html,1964
21,,"['37.487100', '-80.170400']",2016-12-18 11:28,I have a 12ft aluminum john boat with minn kota trolling motor 50 lb thrust 5speed asking $500 if interested call or text. Thanks for looking.,,5924238195,37.487100,12,-80.170400,,"https://maps.google.com/maps/preview/@37.487100,-80.170400,16z",,$500,power, (New Castle),12ft Jon Boat,https://roanoke.craigslist.org/boa/5924238195.html,
22,excellent,"['37.081800', '-79.757300']",2016-12-18 11:02,"I have for sale in great condition a 2007 Nitro 591 19ft bass boat $14,000.00 FIRM.  The Mercury 150 has approximately 280hrs on it and runs like a top. The boat has all the extras you could want including 6"" manual jackplate, tempest 24p prop, led black lights and led bow lights installed into the rubrail. A lowrance hds 7 Gen 2 touch at the bow with HD downscan and a lowrance elite TS 7 at the console with full structure scan, side and down imaging WIFI etc. There is also a Lowrance 5"" GPS fish finder in the dash from factory. carpet and seats are in good condition. Motorguide digital tour 24v trolling motor. 3 bank charger. Hot foot pedal and pro trim on the steering column. Matching Nitro trailer with swing away tounge. The boat trailer currently has a remote trailer moving system installed on it so that I can move the boat in and out of my garage or around my driveway without being connected to my truck. This system came from Australia and was $2500 and is NOT included in the sale unless you want to pay an extra $2k so a total of $16k. This is a 1 owner boat and has always been garage kept and well taken care of. The boat has been winterized and I will take the boat out on the lake for a demo for a serious buyer with cash in hand. There will be NO free joyrides and I will not start it up unless the buyer is serious with cash in hand. Sorry but I'm not going through the process of winterizing every time someone looks at it. Please call or text for more info and to setup a time to view the boat. Serious inquires only and NO trades so please don't ask. Once buyer purchases the boat I will pay off the loan and title will be received in 2 weeks.",280,5917600385,37.081800,19,-79.757300,Nitro Tracker Marine,"https://maps.google.com/maps/preview/@37.081800,-79.757300,16z",591,$14000,power, (Smith Mountain Lake),2007 Nitro 591 bass boat,https://roanoke.craigslist.org/boa/5917600385.html,2007
23,good,"['37.643000', '-79.459000']",2016-12-18 10:35,"14 ft Newport Daysailer Sailboat w Trailer. Good little boat to day cruise or learn to sail on. Boat is in good condition with new halyards.Could use a new hull paint job but it's in fair condition.  Has full compliment with rudder, swing keel, mooring cover, sail covers and ready to sail. Sails are in OK / serviceable condition. It has the main sail and hank jib forward.  Have title for trailer. Boat was never motorized so no title to that but it has the original boat number on it if someone wanted to put an engine on it and register it. Asking 600.00 OBO Five Four Zero - Seven Eight Four - Zero Four Three Two ( text call or email is fine )",,5924178737,37.643000,14,-79.459000,,"https://maps.google.com/maps/preview/@37.643000,-79.459000,16z",,$600,sail, (Lexington VA),14 Ft Newport Daysailer Sailboat,https://roanoke.craigslist.org/boa/5924178737.html,
24,,,2016-12-18 09:48,"This is a cool little custom light weight boat. Composite hull with lots of nicely done wood accents. Bronze hardware, powered by I very nice 18 hp 4 stroke nissan. I call her my Popeye boat. Will consider trades for nice vehicles ,inboard ski boat or fishing boat center consoles or bass. But as always cash is great.so please feel free to make a cash offer. show contact info",,5885328333,,16,,,,,,power,,Custom Boat $9500 ob cash / May Trade,https://roanoke.craigslist.org/boa/5885328333.html,
25,like new,"['36.920100', '-79.664500']",2016-12-18 09:44,2015 Avalon Quadlounger Tritoon with 115 HP E-TEC Evinrude Engine. EXCELLENT CONDITION...Virtually Brand New...less than 50 hours. Located at Smith Mountain Lake. Ready for a test drive.,50,5924128709,36.920100,22,-79.664500,Avalon,"https://maps.google.com/maps/preview/@36.920100,-79.664500,16z",Quadlounger,$30000,power, (SML),Avalon Quadlounger Tri Toon,https://roanoke.craigslist.org/boa/5924128709.html,2015
26,excellent,"['38.157400', '-79.065100']",2016-12-18 08:31,"2004 Palmer Tiderunner 190/WA by Defiance boats. Has a 115 yamaha 2 stroke engine. Runs and looks great. Great boat for fishing or recreation. Has a Bimini top and a cuddy cabin for shade. Garage kept. NADA is 13,845 asking 10,000 Obo. Call or text for more information. Thanks",,5917725062,38.157400,19,-79.065100,Defiance,"https://maps.google.com/maps/preview/@38.157400,-79.065100,16z",tiderunner 190/WA,$10000,power, (Staunton),2004 Palmer Tiderunner 190,https://roanoke.craigslist.org/boa/5917725062.html,
27,good,,2016-12-18 04:34,"18ft aluminum skeeter with yamaha 90/65 jet Boat has been completly customized an set up for running the river. Tunneled hull, raised transom, an 3/16 reenforced bottom put on by James river jets. UHMW bottom cover.Boat is set up stick steer an hot foot throttle. 1998 yamaha 90/65 jet, motor is in excellent shape an very dependable an just completly serviced. Minn kota fortrex 101, 36volt, 3 brand new deep cells. Live well, 20 gal gas tank, lots of storage, front an back fishing decks. Trailer is in good shape almost new tires. Boat runs an performs awesome. Runs in just inches of water an plans out great. Title for both asking $12,000 Call/text show contact info",,5909152347,,18,,Skeeter,,,$12000,power, (Henrico),River jet boat,https://roanoke.craigslist.org/boa/5909152347.html,1998
28,good,"['37.401900', '-79.878600']",2016-12-17 20:22,"For sale a nice 2007 Sea Chaser 2400 offshore Series Center Console. Boat has new Lowrance HDS7 GEN 3 with 50/200 transducer,new Lenco trim tabs,new trim tab switches with led indicators,new live well pump,new gauges,new polk speakers,new lighted compass,new deep cycle battery,new Perko battery switch,new water separator filter and HDS7 is networked with the Suzuki DF250 for engine instrumentation on the fish finder.The boat had original 2007 Suzuki DF250 four stroke on it when i purchased it with 749 hours but had a blown head gasket so i purchased another 2007 DF250 with only 154 hours and installed in May of this year and have only used it 2 days in May.I just buffed,polished and hand waxed the hull .New water pump and lower gear oil in may.Engine had new fuel filter,spark plugs and thermostats in May .Trailer is aluminum Road King and in good condition.",169,5923734661,37.401900,24,-79.878600,Carolina Skiff,"https://maps.google.com/maps/preview/@37.401900,-79.878600,16z",Sea Chaser 2400,$29500,power, (Troutville VA),2007 Sea Chaser 2400 Offshore Series Center Console,https://roanoke.craigslist.org/boa/5923734661.html,2007
29,,"['37.178400', '-79.652100']",2016-12-17 19:13,79 mercruiser for sale.Outboard motor  350 small block engine with built in intercooler. This boat will get up and go on the water. Perfect boat for tubing with plenty of seating asking $1500 OBO. Open for trades as well. Looking for a seadoo or a atv. Call or text Zac at show contact info,,5900059466,37.178400,19,-79.652100,,"https://maps.google.com/maps/preview/@37.178400,-79.652100,16z",,$1500,power, (Sml),Great mercruiser for sale,https://roanoke.craigslist.org/boa/5900059466.html,
30,,,2016-12-17 15:56,"This kayak is fast and turns on a dime has upgraded st fins paddle anchor trolley insert hobie buckets and rod holder Asking $1700 obo this kayak new is around 2,500 Call or text show contact info for pics or info thanks",,5905031447,,13,,,,,$1700,human, (rockymount va),hobie outback kayak,https://roanoke.craigslist.org/boa/5905031447.html,
31,,,2016-12-17 15:56,This kayak is new bought back in April asking $1600 obo my loss I have over $2000 in this great yak Call or text show contact info for more pics and info thanks,,5905032472,,15,,,,,,human,,jackson kraken elite 15.5 kayak,https://roanoke.craigslist.org/boa/5905032472.html,
32,,,2016-12-17 15:56,Asking $750 call or text show contact info,,5905033761,,14,,,,,,human,,Mata ray 14 kayak,https://roanoke.craigslist.org/boa/5905033761.html,
33,like new,"['36.920100', '-79.664500']",2016-12-17 10:54,"24ft Avalon Catalina Entertainer, Tri-toon, 250hp SHO yamaha, seats 15 double bimini top, burgundy/white, 4 stool bar, stored in Pehook out of water, a great Family fun tri-toon... not really certain about engine hours but should be close, professionaly maintained by SML boat and tackle nearly a $70,000 beauty your Family will be proud to own... any reasonable offer will be considered",163,5887236097,36.920100,26,-79.664500,avalon/ catalina,"https://maps.google.com/maps/preview/@36.920100,-79.664500,16z",entertainer,$41500,power, (Smith Mountain Lake),2014 pontoon 24 ft,https://roanoke.craigslist.org/boa/5887236097.html,2014
34,like new,"['36.920100', '-79.664500']",2016-12-17 10:54,"24ft Avalon Catalina Entertainer, Tri-toon, 250hp SHO yamaha, seats 15 double bimini top, burgundy/white, 4 stool bar, stored in Pehook out of water, a great Family fun tri-toon... not really certain about engine hours but should be close, professionaly maintained by SML boat and tackle nearly a $70,000 beauty your Family will be proud to own... any reasonable offer will be considered",163,5887235346,36.920100,26,-79.664500,avalon/ catalina,"https://maps.google.com/maps/preview/@36.920100,-79.664500,16z",entertainer,$41500,power, (Smith Mountain Lake),2014 pontoon 24 ft,https://roanoke.craigslist.org/boa/5887235346.html,2014
35,like new,[],2016-12-16 15:16,"cataraft 14ft. comes with trailer, troll motor, battery, seats, has floor, frame, new tires rims, lights wiring. call show contact info asking 2900.oo .",,5922095851,,14,,maxxon tubes,https://maps.google.com/?q=loc%3A+%35%38%37%37+Huff+Creek+Highay+Davin+VA+US,cataraft pontoon,$2900,power, (Davin),2015 cataraft pontoon 14 ft. possible trade,https://roanoke.craigslist.org/boa/5922095851.html,2015
36,like new,[],2016-12-16 15:07,2015 bass tracker pro170. 60/40 mercury jet. only 15 gas used. questions call show contact info no texts. no help selling.,12,5922058455,,17,,bass tracker,https://maps.google.com/?q=loc%3A+%35%38%37%37+Huff+Creek+Highay+Davin+VA+US,pro-170,$12995,power, (Davin),2015 bass tracker pro 170 jet reduce price,https://roanoke.craigslist.org/boa/5922058455.html,2015
37,excellent,[],2016-12-16 14:49,"forsale 2015 bass boat. price reduced to 12,900. mercury 60/40 jet. have questions, call show contact info no selling help. no texts.",15,5912423374,,17,,tracker,https://maps.google.com/?q=loc%3A+%35%38%37%37+Huff+Creek+Highay+Davin+VA+US,pro170,$12995,power, (Davin),2015 bass tracker pro 170 jet reduce price,https://roanoke.craigslist.org/boa/5912423374.html,2015
38,,"['37.226638', '-79.926739']",2016-12-16 14:16,"Jon boat for sale has depth fish finder, trolling motor,and 5 hp motor. Comes with trailer have all the paper work. Caught a lot of fish in this boat text call thanks",,5922003515,37.226638,11,-79.926739,Sears,"https://maps.google.com/maps/preview/@37.226638,-79.926739,16z",,$1000,power,,Jon boat,https://roanoke.craigslist.org/boa/5922003515.html,
39,fair,[],2016-12-16 07:34,"have a triton boat trailor that fits my 22ft tritonbass   boat.  the good/ new seals newbrake line new calibers and new pads tandem axle/the bad.has some rust has been welded needs bunks master cyl,lights and tires clear title a new one is about 4 grand.",,5921471137,,20,,,https://maps.google.com/?q=loc%3A+crestland+dr%2C+at+plantation+rke%2E+county+VA+US,triton,$500,power, (roanoke),boat trailer,https://roanoke.craigslist.org/boa/5921471137.html,1999
40,good,,2016-12-16 01:06,"I have two jet skis, one is 1993 yamaha 600cc. In great shape with a new starter and solenoid. This one just needs small wiring repair. I do not know anything about the wiring but its all there. The other is a 1997 kawasaki 1100. This thing was fast but right now it won't crank. You can hear the motor try to start but won't turn over. I'm not sure what it needs but in amazing shape. The trailer is a double jetski trailer with good bunks. It has new lights and good to go. If you are interested email me for pictures. I don't think it would take anyone who knows what they are doing to fix these. The trailer and 1997 ski is worth a lot more. I think this is fair. I would consider trades for a 4x4 truck or 4 wheeler. Don't be afraid to offer. Open to many ideas. I have the title to all 3 of them also.",,5921347738,,10,,,,,$1500,power, (Radford),2 Jet Skis & Double Trailer,https://roanoke.craigslist.org/boa/5921347738.html,
