,condition,coord_pair,date,description,engine hours (total),id,lat,length overall (LOA),long,make / manufacturer,map_URL,model name / number,price,propulsion type,region,title,url,year manufactured
82,excellent,"['37.269000', '-79.942000']",2016-12-08 11:58,Very Good condition polyethylene canoe. 12 feet long .,,5910841573,37.269000,12,-79.942000,,"https://maps.google.com/maps/preview/@37.269000,-79.942000,16z",,$395,human, (Roanoke),12 ft Canoe,https://roanoke.craigslist.org/boa/5910841573.html,
83,,"['36.920100', '-79.664500']",2016-12-08 11:35,"Smokercraft 17' Pro Bass with Honda 75 HP Four stroke, includes matching trailer, trolling motor and Lowrance HDS 7. Very stabile boat and runs great. Give us a call for our best price. Smith Mountain Boat",,5910803274,36.920100,17,-79.664500,,"https://maps.google.com/maps/preview/@36.920100,-79.664500,16z",,$9495,power, (Penhook),2009 Smokercraft 171 Pro Bass,https://roanoke.craigslist.org/bod/5910803274.html,
84,,"['37.013100', '-79.686400']",2016-12-08 11:02,"Have a Glastron 1978 CVX Jet Boat, already been restored by previous owner. I purchased boat without motor, planned on installing LS1 or BBC over winter. Dad gifted me a inboard ski boat, so not going to have much time for this boat. Asking $2500 will consider a trade for Gas powered Golf Cart, 400cc or larger ATV. Boat is at Smith Mountain Lake VA If interested send me a message or text Will I do not need assistance selling!",,5910747792,37.013100,21,-79.686400,Glastron,"https://maps.google.com/maps/preview/@37.013100,-79.686400,16z",CVX 20,$2500,power, (SML),Jet Boat CVX Glastron 1978,https://roanoke.craigslist.org/boa/5910747792.html,1978
85,,"['37.081800', '-79.757300']",2016-12-08 10:23,Looking for used 4 cycle outboard 50 - 90 hp.,,5910687760,37.081800,0,-79.757300,,"https://maps.google.com/maps/preview/@37.081800,-79.757300,16z",,$1,power, (Smith Mountain Lake),Four cycle outboard wanted,https://roanoke.craigslist.org/boa/5910687760.html,
86,,,2016-12-08 02:27,"For sale is my old town predator 13 ft fishing kayak. Bought it new in February and only used 3 times on Smith mountain lake. Includes new lowrance hook 4x fish finder and 9v battery. Also comes with paddle and three rod holders. This is a very comfortable kayak,can fish in it all day. Very stabel,can easily stand up and fish in it. Only selling because work too much and don't get to use it as much as I would like. Prefer text as I work on call and sleep wierd hours. Text me with any questions.",,5910415415,,13,,,,,$1300,human, (vinton),Old town predator fishing kayak,https://roanoke.craigslist.org/boa/5910415415.html,
87,like new,[],2016-12-08 00:47,"I PURCHASED THIS NEW OFF EBAY FOR OVER $300.00 PLUS SHIPPING. ALSO INCLUDING MATCHING 4 PERSON STRENGTH TOW LINE, ALSO PURCHASED OFF EBAY FOR OVER $50.00. NOTE: THE ONE I HAVE IS A DIFFERENT COLOR. TO HEAVY FOR ME TO LAY OUT AND TAKE AN ACTUAL PICTURE. PURCHASED FOR MY THREE GRANDDAUGHTERS, PUT IT IN THE WATER ONE TIME AND IT SCARED THEM TO DEATH. ALSO HAVE A ONE PERSON ROUND TUBE WITH MATCHING TWO PERSON TOW LINE. WOULD SELL ALL FOR $225.00",,5884373822,,9,,,https://maps.google.com/?q=loc%3A+BANDY+MILL+ROAD+at+HARDY+ROAD+HARDY+VA+US,,$180,power, (SMITH MTN. LAKE),NEW 3 PERSON TOWABLE TUBE WITH TOW LINE,https://roanoke.craigslist.org/boa/5884373822.html,
88,good,"['37.072259', '-79.709715']",2016-12-07 17:49,12 foot jon boat 50 pound thrust Minn Kota motor new deep cycle battery both used 3 times trailer has permanent tag no title for boat $875 OBO,3,5909977066,37.072259,12,-79.709715,,"https://maps.google.com/maps/preview/@37.072259,-79.709715,16z",,$875,power, (Wirtz),12ft jon boat,https://roanoke.craigslist.org/boa/5909977066.html,
89,good,"['37.358560', '-79.902878']",2016-12-07 15:14,Includes trailer with break-away tongue. Price is reduced as it is in need of a new engine and some cleaning - except for those two items it is in good condition. I do not have the time to deal with it as well as to boat any more. Makes a great family boat for tubing and skiing and it fits in garage. Let me know if you are interested.,250,5909744460,37.358560,19,-79.902878,Sea Ray,"https://maps.google.com/maps/preview/@37.358560,-79.902878,16z",182 Bow Rider,$3700,power, (Cloverdale),2001 Sea Ray 182 Bow Rider,https://roanoke.craigslist.org/boa/5909744460.html,2001
90,,"['37.212300', '-79.742900']",2016-12-07 09:45,Something came up and I need money but I'm not going togive it a way Have 18 ft with trolling motor and 150 v6 outboards the motor that run and motor  good compression test a lone is  has good title for boat and trailer need power trim and tilt motor $120 but I move it by hand also moved seats to install new ones really don't have the money right now or time I have another boat but interested show contact info or 2068336 tools was asking 2300  will take 1500 today mon goes back up trade for doom buggy rail buggy,,5871795720,37.212300,18,-79.742900,,"https://maps.google.com/maps/preview/@37.212300,-79.742900,16z",,$1500,power, (Goodview),"Bass boat,trade possible TODAY 1500",https://roanoke.craigslist.org/boa/5871795720.html,
91,excellent,"['36.706068', '-79.940257']",2016-12-07 06:55,"1976 Grumman canoe for sale. 17 feet long, Very dependable and durable, heavy gage aluminum, great condition for its age, does not leak , 500.obo cash  call after 5, 2seven6-3four0-53four7. Cash ,no pay-pal, no trades.",,5877213957,36.706068,17,-79.940257,Grumman,"https://maps.google.com/maps/preview/@36.706068,-79.940257,16z",17' canoe,$500,human,,canoe for sale,https://roanoke.craigslist.org/boa/5877213957.html,1976
92,,,2016-12-06 12:45,This is my baja boss 232. It has a 7.4 merc. 454. Boat is clean as a pin and been very well maintained!  Also comes with a all aluminum tandem axle trailer. Boat has around 600 hrs on it. Any other questions feel free to call or text. NO SCAMS!!!!,600,5907985451,,23,,Baja,,Boss 232,$14900,power, (Rocky Mount),1997 Baja Boss 232,https://roanoke.craigslist.org/boa/5907985451.html,
93,,"['37.407000', '-79.717500']",2016-12-05 12:56,"This is a very nice boat but it does have a little wear to it. It has everything you will need to start wake boarding. On board ballast system, tower with speakers and racks, amp, boat plug light, wedge to give you a bigger wake, full Malibu boat cover and Bimini top, and matching trailer. There is more but to many to list so for more info call or text. $33500.00.",,5906472659,37.407000,21,-79.717500,,"https://maps.google.com/maps/preview/@37.407000,-79.717500,16z",,,power,,2003 Malibu,https://roanoke.craigslist.org/boa/5906472659.html,
94,,"['37.285300', '-80.069200']",2016-12-05 09:46,12 foot boat 2 swivel seats fishing pole holders come with trolling motor and 3hp ted williams gas motor 350 obo or trade,,5863616725,37.285300,12,-80.069200,,"https://maps.google.com/maps/preview/@37.285300,-80.069200,16z",,$350,human, (Salem),12 john boat flat bottom,https://roanoke.craigslist.org/boa/5863616725.html,
95,,"['37.214500', '-79.812700']",2016-12-04 22:30,"Larson Cabin Cruiser with trailer. Runs great, low miles on a new motor. Seats recovered, nice top and cover. At a marina at SML SERIOUS INQUIRIES  !!!  Trade is possible !!!   Call or Text May consider trade for small SUV...Blazer, Jeep Grand Cherokee, XTerra, Sidekick, Tracker ect..... Call or text Rick for more details and location. 540-three five three-80 three 6",,5880097311,37.214500,23,-79.812700,,"https://maps.google.com/maps/preview/@37.214500,-79.812700,16z",,$5500,power, (Hardy),Larson Cabin Cruiser,https://roanoke.craigslist.org/boa/5880097311.html,
96,excellent,"['37.357590', '-80.050582']",2016-12-04 15:09,Awesome kayak can easly maintain 3.5mph with easy steady stroke.  Great condition with very few nicks and no major skuffs.  Comes with Dragonfly-4 Pro fish/depth finder.  Has map pack installed.  Kayak has round 4 inch hatch installed in forward compartment.  Lights and switch installed mid ship.,0,5905256561,37.357590,14,-80.050582,Wilderness,"https://maps.google.com/maps/preview/@37.357590,-80.050582,16z",Atak 140,$1350,human, (SALEM),Kayak Wilderness Atak 140 / Dragon Fly / Lights,https://roanoke.craigslist.org/boa/5905256561.html,2016
97,excellent,"['37.178400', '-79.652100']",2016-12-04 12:15,lake deicer machine for the lake to keep water from freezing around your dock and boat used one season works up to 70 feet circle and keeps water from freezing at our dock protecting your boat from busting. I no longer need this unit. Item is like new,,5873792393,37.178400,15,-79.652100,,"https://maps.google.com/maps/preview/@37.178400,-79.652100,16z",,$325,power, (Smith mountain lake),lake deicer machine pump,https://roanoke.craigslist.org/boa/5873792393.html,
98,,"['37.135300', '-80.418800']",2016-12-03 17:34,"For Sale: 1994 Ranger Sport Bass Boat R70 with Johnson 115HP, Viper Stainless Steel prop, 2 new batteries, 2 live wells, front and back removable front deck for third seat, 2 fish finders (1st Lowrance elite 5 with maps and console front Lowrance X96, Trolling motor, Motor guide, Brute 48 thrust, chrome wheels, tires new Excellent Condition Clean Title $6000.00 If is still listed it is still for sale No scammers I will report you.",,5865156014,37.135300,17,-80.418800,,"https://maps.google.com/maps/preview/@37.135300,-80.418800,16z",,$6000,power," (Riner, VA)",1994 Ranger Sport Bass Boat R70,https://roanoke.craigslist.org/boa/5865156014.html,
99,good,[],2016-12-03 10:47,"This is a great trailer-sailor boat for the the family that wants to be on the water but doesn't want the hefty slip fees that most sailboats come with.  Sleeps 4, has a pop-up companionway top for standing headroom (even underway sail).  Has an OB motor mount (no motor), swing keel for pulling up to shore.  Comes with trailer.  Travels 5mph on water;  55mph on trailer.  Essentially a RV trailer that floats.",,5903531817,,20,,RK Industries,https://maps.google.com/?q=loc%3A+%32%30%35%32+Diamond+Hill+Rd%2E+Moneta+VA+US,RK20,$1000,sail, (Moneta),20' RK20 sailboat for sale,https://roanoke.craigslist.org/boa/5903531817.html,1977
