,condition,coord_pair,date,description,engine hours (total),id,lat,length overall (LOA),long,make / manufacturer,map_URL,model name / number,price,propulsion type,region,title,url,year manufactured
40,good,[],2016-12-06 11:47,"1972 Larson Speed/Fishing Boat, new electric sapphire blue paint, new wiring, new lights, new horn, new bilge pump, new carpet, new seats, new steering assembly, new floor, new transom, new 12 gallon gas tank, new trailer tires and spare, new trailer winch with two new rollers.  MUST SEE  14 FT. 65 HP.Trailer also has new paint, wiring and a double wheeled trailer jack",,5907989018,,14,,Evinrude,https://maps.google.com/?q=loc%3A+Hulda+Drive+at+%39%33+rd+street+sturtevant+WI+US,,$1500,power, (Sturtevant),Boat For Sale,https://racine.craigslist.org/boa/5907989018.html,1972
41,good,"['42.714921', '-88.282828']",2016-12-06 08:03,"PADDLE BOAT VARY GOOD CONDITION ,FUN,  easy to use no gas needed ,Just a  life jacket and away you go . Kids can drive ,,,,FUN ,FUN ,FUN call show contact info",,5907628463,42.714921,6,-88.282828,ontour,"https://maps.google.com/maps/preview/@42.714921,-88.282828,16z",,$325,human, (burlington),PADDLE BOAT,https://racine.craigslist.org/boa/5907628463.html,
42,good,,2016-12-04 06:01,"Serious, knowledgeable private buyer looking to purchase a clean 3480 or 360 Sundancer, 2000-2006. Cash buyer, no games, prefer no dealers unless it is the right boat. Not interested in I/O's, or boats with more than 500-600 hrs. I'm ready to purchase even if boat is stored. No Salt Water Boats. Please don't contact me with a four winds, or a cruisers, I am very picky and ideal seller will have treated their boat as precious as I will.  I am not a low baller, I will for sure be willing to pay greater than a dealer will offer. My purchase is for personal use, not resale, I am not a dealer. Prefer a Lake Michigan boat to make logistics easy but open to anything within a few hundred miles of Milwaukee. Text/email will get the quickest response. Thanks for your consideration.",1,5875161332,,36,,Sea Ray,,Sundancer,,power,,WANTED! 340 or 360 Sundancer,https://racine.craigslist.org/boa/5875161332.html,2003
43,,,2016-12-03 07:40,Looking for used Evinrude outboard motors ranging from 40HP up to 300HP. Also looking for lower units that fit E-Tec 250,,5863592826,,25,,,,,,power,,WANTED: Evinrude outboards 40HP thru 300HP,https://racine.craigslist.org/boa/5863592826.html,
44,good,"['42.716100', '-87.823300']",2016-12-02 23:13,"For sale is a 00' Lund WC Adventure 16'. It is powered by a johnson 25hp and comes on a shorelander trailer. Has a floor, removable bimini top, lights and a bilge pump. Perfect boat for rivers or inland lakes. Doesnt come with seats, fishfinder or rod holders. Contact me with any questions. No trades, cash only. Serious inquiries only please. 2,900 OBO Don't miss out, I'll be putting the boat away for winter shortly",,5859988331,42.716100,16,-87.823300,Lund,"https://maps.google.com/maps/preview/@42.716100,-87.823300,16z",WC-Adventure,$2900,power," (racine,wi)",Lund WC 16',https://racine.craigslist.org/boa/5859988331.html,2000
45,excellent,[],2016-11-30 22:17,"Here's a boat the whole family can enjoy! This used 2002 Bryant 196 has been checked out by an award winning team of marine technicians and professionally detailed. Features include a convertible top, bow cover, cockpit cover, mooring cover, stereo with remote, compass, depth sounder, swim ladder bow storage, walk-through windshield, bow anchor storage, flip-up driver's bolster seat, ski tow ring, launching trailer and Merc. 4.3 v-6. Call, email or stop by Lakeside Marina in Oshkosh, Wisconsin to learn more about this great used boat!",301,5900226951,,19,,Bryant,https://maps.google.com/?q=loc%3A+%39%30%32+Taft+Ave%2E+Oshkosh+WI+US,196,,power,,2002 Bryant 196 Bowrider,https://racine.craigslist.org/bod/5900226951.html,2002
46,excellent,[],2016-11-30 21:43,"Here's a classic boat in great condition! Sure to impress, we just took in this used 1996 VIP 1760 Vision bow rider. Features include a super pro ID Eagle, am/fm stereo, full gauges, carpet, glovebox, windshield, launching trailer, mooring cover and a Merc. 3.0L motor. Call, email or stop by Lakeside Marina in Oshkosh, Wisconsin to take advantage of our great seasonal prices on used boats just like this one!",0,5900198481,,17,,VIP,https://maps.google.com/?q=loc%3A+%39%30%32+Taft+Ave%2E+Oshkosh+WI+US,1760 Vision,,power,,1996 VIP 1760 Vision,https://racine.craigslist.org/bod/5900198481.html,1996
47,like new,[],2016-11-30 20:57,"Just in on trade, 2015 Recon 985 Walk Through with a 4-Stroke 150 HP Mercury, Ez-Loader Custom Trailer and this boat is loaded.   Standard features are, 21 position 9' rod locker,Retractable cleats, 35 Gallon fuel tank, 52"" Rear live well, 16"" Forward live well, Live well timers, LED courtesy lights, Dry tube storage, Locking compartment latches, Hydraulic steering, Bow trim switch. Options on this bad girl are, Electric start Mercury 9.9 Pro Kicker with speed control trollmaster, USB charging port at passenger console, Terrova 36 volt I-Pilot linked to a Hummingbird 1199 CI HD SI, Hummingbird 999 CI HD SI, ConTrollKing speed control, Panther transom saver, Shurflo pro wash down, Swim ladder, 4 Bank battery charger, Radio/MP3 player, VHF radio & antenna, Full windshield, Full ratchet cover. This boat has very little use, was NOT A GUIDE BOAT !!!! He is trading this on a new order out 2185.  This boat shows just like new in every way.   Call or stop by Lakeside Marina in Oshkosh, Wisconsin for more details.",0,5900155244,,19,,Recon,https://maps.google.com/?q=loc%3A+%39%30%32+Taft+Ave%2E+Oshkosh+WI+US,985DCX,,power,,PRICE REDUCED - 2015 Recon 985 DCX Pro Fishing Boat,https://racine.craigslist.org/bod/5900155244.html,2015
48,new,[],2016-11-30 20:32,"2016 Alumacraft Classic 165CS in blue/silver with a Evinrude ETEC 75h.p., 1 extra seat, 2 alumaclamps, flip-bench seating, side guides, and ratchet tie downs.Listed price includes freight and prep charges.",0,5900130479,,16,,Alumacraft,https://maps.google.com/?q=loc%3A+One+Cabela+Way+Richfield+WI+US,Classic 165,$21899,power, (Richfield Cabela's),2016 Alumacraft Classic 165,https://racine.craigslist.org/bod/5900130479.html,2016
49,excellent,[],2016-11-30 20:10,"Clean boat with a great layout! This 2004 Tracker Nitro is fully equipped and ready for a serious angler. Features include an incredible amount of storage, bench seating, pedestal seat, butt seat, Lowrance X135, Lowrance 4800 M Fish and Depth Finder, hot foot, GPS, 2 livewells, 12 position rod storage, Minnkota Maxxum trolling motor, Tracker trailer with surge breaks, spare tire, tilt/trim and a 200 HP Mercury Motor. Call, email or stop by for more info and price on this great used fishing boat!",0,5900107350,,19,,Tracker,https://maps.google.com/?q=loc%3A+%39%30%32+Taft+Ave%2E+Oshkosh+WI+US,Nitro 901,,power,,2004 Tracker Nitro 901 Fishing Boat,https://racine.craigslist.org/bod/5900107350.html,2004
50,excellent,[],2016-11-30 16:26,"This 1996 Mariah 2255 Shabah is in fantastic shape! With room for the whole family to spread out, and even lay down for a nap if you wanted, this is a used boat that will make all of your summer dreams come true. Features include an hour meter, trailer, porta potti, cockpit cover, stereo/speakers, dual batteries, VHF Radio, digital depth finder, hydraulic trim tabs, windshield wipers, fire extinguisher, horn and a Merc. 7.4L motor. Call, email or stop by Lakeside Marina in Oshkosh, Wisconsin for more information on this great family boat!",465,5899820745,,25,,Mariah,https://maps.google.com/?q=loc%3A+%39%30%32+Taft+Ave%2E+Oshkosh+WI+US,2255 Shabah,,power,,1996 Mariah Shabah Cuddy,https://racine.craigslist.org/bod/5899820745.html,1996
51,new,"['43.387211', '-88.635979']",2016-11-30 15:48,"2017 SeaArk MV2072 20' Jon boat with a 72"" Bottom, 92"" Beam and 1/8"" Hull. This boat has an 1/8"" Floor, and removable bowfishing deck. This deck has a door for your trolling motor, and is easily removable. Also comes with an Aluminum flat top center console with forward box, that can be installed where you want, or use the boat as a tiller. We can rig the boat for you with your choice of outboards as well. We deal with Mercury, Suzuki, and Evinrude. Financing is available with as little as Zero Down!  Contact Tanner with any questions",,5858402093,43.387211,20,-88.635979,SeaArk,"https://maps.google.com/maps/preview/@43.387211,-88.635979,16z",MV2072,,power,,SeaArk MV2072 Bowfishing Boat,https://racine.craigslist.org/bod/5858402093.html,2017
52,good,"['42.617968', '-88.613805']",2016-11-30 14:09,1994 Four Winns 190 Horizon FAMILY FUN BOWRIDER WITH LOTS OF POWER OPTIONS: •Single axle trailer •Stereo with speakers •Convertible top •Bow and cockpit covers •Anchor storage •Swim ladder •In floor ski locker Also have a power Boat lift that could go as a package deal $2000 additional,,5899591650,42.617968,19,-88.613805,Four Winns,"https://maps.google.com/maps/preview/@42.617968,-88.613805,16z",190 Horizon,$5000,power, (Delavan),1994 Four Winns 19' open bow,https://racine.craigslist.org/boa/5899591650.html,1994
53,good,"['42.352400', '-88.054500']",2016-11-30 12:57,This boat had damage to the front and the mast got damaged. My father who recently passed did all the fiberglass repairs and as always was anal about everything he ever did the mast needs repair it is dented in 2 places and need a new or used roller fulring I have all parts located otherwise the boat is in beautiful shape. My father had the boat dropped in at Waukegan and motored it to Racine Harbor with I was told a Yanmar Diesiel motor that had just been replaced. The mast needs repair and some rigging up front but the boat is nice will have at my home in Grayslake in 2 weeks or less. Cash deal only offers welcome within reason.It comes with the triple axle trailer and tiltles for boat and trailer.,,5899460546,42.352400,35,-88.054500,Hunter,"https://maps.google.com/maps/preview/@42.352400,-88.054500,16z",Legend,$3500,sail, (Grayslake),1990 Hunter Legend 35.5 Sailboat,https://racine.craigslist.org/boa/5899460546.html,1990
54,excellent,,2016-11-30 12:11,"1997 Sea Ray 17.5 ft Bow Rider boat and accessories for sale. Re-built 3.0 liter Mercury inboard motor with Power Steering installed last year, new Marine Battery. Includes Shore Lander dual axle easy on trailer with winch.  Includes Cabela's Ratchet Support System trailerable boat cover.  Includes Electronic Hummingbird 600 Series GPS fish locator and depth finder.  Built-in 20 gallon fuel tank, Convertible Bimini Top, AM/FM/CD player.  Also includes dock/boat bumpers,  life jacket, Fire extinguisher, emergency throw rope, first aid kit, 2 paddles, 2 anchors and dock lines. Have Clean Title for both trailer and boat. All for $8,000.00. Free indoor storage until April 1, 2017.",30,5882319726,,175,,Sea Ray,,Bow Rider,$8000,power," (Winthrop Harbor,IL)",1997 Sea Ray 17.5 ft Bow Rider Boat for sale,https://racine.craigslist.org/boa/5882319726.html,1997
55,good,"['42.596818', '-88.710136']",2016-11-29 20:17,"Hi I am just putting my boat out there was planning on selling it in the spring but in Lou of needing some money for my winter guide season I figured I'd test the waters I have a place to store it this winter for free so no need for drastic loss on my end. . .. $3500 obo 14ft deep v mirrocraft 1988 mercury 25hp 2stroke Regular bunk trailer. Not sure what brand? 30lb thrust transum trolling motor 40lb thrust bow mount trolling motor both Minn Kota Rear swivel seat for tiller Front mounted chair on casting deck with storage areas underneath 5gallon gas can Anchor mate with I believe 20lb anchor up front and willing to throw in 15lb rear anchor for rear at right price Did the floor and casting deck last year with all new wood and has always been stored inside any questions that you might have just let me know otherwise thanks for looking! Here is a video of me running wide open last year with all the batteries and gear she ran right around 22-23mph but I feel with a new prop could have hit 25-28mph https://youtu.be/5nGXaB8esSw Also looking at possibly trading for a good running 04 or newer Honda 4X4 ATV must not be junk mine runs good and is reliable yours needs to be the same and if its worth more I have lots of other things to throw in on my end to make it worth the trade. call or text  6O8-four four nine-7five3one Keywords: Fishing Boat,Mirrocraft,Alumacraft,Tracker,Smokercraft,Skeeter,Triton,Rowboat,Mercury,Evenrude, Johnson,Yamaha,Marcum,Vexlar,Humminbird,Lorance,Auger,Four Wheeler,4X4,Snowmobile,Ice Fishing,Tip Up,Fishing Poll,Trolling Motor,Minn Kota,Motor Guide,Flasher,Fish Finder,Rapala,Strikemaster,Eskimo,Honda,Otter,Clam,Frabill",,5898537108,42.596818,14,-88.710136,Mirrocraft,"https://maps.google.com/maps/preview/@42.596818,-88.710136,16z",,$3500,power, (Darian),14ft Mirrocraft complete fishing setup,https://racine.craigslist.org/boa/5898537108.html,
56,,"['42.230043', '-88.173351']",2016-11-29 17:36,"1984 searay 270da. Very nice condition. all interior is in great shape, bimini top included Twin 4cyl mercruiser motors with alpha drives. Has a 10' beam making this a very nice comfortable stable boat. Top speed of 35mph new batteries new bellows.  All seats in great condition. Everything works as it should. swim plat form needs replacing or fixing. brand New cockpit cover. No trailer but have access to one for transport if needed. boat is in the water for viewing. 4900 or best offer trades considered",,5898341583,42.230043,28,-88.173351,searay,"https://maps.google.com/maps/preview/@42.230043,-88.173351,16z",,$4900,power, (Barringotn),84 Searay 270DA  10' beam with twins,https://racine.craigslist.org/boa/5898341583.html,1984
57,good,[],2016-11-29 16:59,1985- 14' MirrorCraft Deep V fishing boat. Good condition well taken care of. 15HP Johnson motor and EZ loader trailer included. Also include Hummingbird Depth Finder Priced low to sell-$2000 or best offer ask for Tom show contact info,,5898288842,,14,,MirrorCraft,https://maps.google.com/?q=loc%3A+%35%37TH+St+at+%33%36%38+Ave+Burlington+WI+US,DeepFisherman,$2000,power," (Burlington,Wi)",MirrorCraft 1985 14' Deep V Fisherman Fishing Boat,https://racine.craigslist.org/boa/5898288842.html,1985
58,good,[],2016-11-29 16:23,"16' Lowe with 60 hp Evinrude. Bow mounted OMC trolling motor, 3 folding seats plus one casting seat, AM FM stereo, bow and stern Anchormates with anchors, 2 bank battery charger, livewell. Motor runs great and has a stainless steel prop. Only 564 hours on the motor. Kept in garage except when I take it out fishing.",564,5857452517,,16,,Lowe,https://maps.google.com/?q=loc%3A+%32%30%37%36+WALBURG+RD%2E+BURLINGTON+WI+US,1620V,$3999,power, (BURLINGTON),1991 LOWE 1620V,https://racine.craigslist.org/boa/5857452517.html,1991
59,excellent,,2016-11-29 14:25,"12' Starcraft Sea Scamp boat. Motor works well, throttle is a bit sloppy but works. Nice boat overall. I dont fish and havent took it out scince last summer so just dont need it. Have had it out though to run the motor and clean it up a bit. Registered into 2018!! Hull Material - Aluminum Beam - 4'4"" Length - 12' Net Weight (lbs) - 130 7.5hp Sears Gamefisher motor Oars, fishing pole holders 1 7/8 receiver Asking $700 Email with any questions or if interested. Phone # is text only.",,5898035188,,12,,Starcraft,,Sea Scamp,$700,power,,Starcraft 12Ft Boat,https://racine.craigslist.org/boa/5898035188.html,1973
60,good,"['42.464800', '-88.117800']",2016-11-29 12:01,"1979 manatee open bow 19' with a 1988 120 evinrude VRO looper outboard motor with power trim, Bimini top, galvanized stainless steel trailer. Brand new carpet and boat cover, needs seats and interior to be finished. Boat is very clean for its age. Motor has low compression in one cylinder but still runs good. Also comes with extra stuff like depth finder, 2 props and other misc stuff. Old lady is pregnant and wont let me keep has to go asking $750.00 OBO",,5885160498,42.464800,19,-88.117800,,"https://maps.google.com/maps/preview/@42.464800,-88.117800,16z",,$750,power," (Antioch,il)",1979 Manatee open bow 19' with trailer and motor $900 OBO,https://racine.craigslist.org/boa/5885160498.html,
61,excellent,"['41.945300', '-87.747400']",2016-11-29 11:50,Up for sale is my 1990 fourwinns freedom.it has the cobra eng and drive.the boat is in almost new Condition for its yr. the picture of the boat will show the condition is almost new. Must sell asap NO LOW BALLERS PLZ. Ask for Joe show contact info Will not ship or do pay pal so don't even ask. CASH IS KING asking $4400.obo Ps needs head gasket which I can do or if you wanna save a little money you can repair.,,5897704827,41.945300,170,-87.747400,Fourwinns,"https://maps.google.com/maps/preview/@41.945300,-87.747400,16z",Freedom / 180 hp,$4400,power, (Il/wis),Very clean great running fourwinns 170 freedom,https://racine.craigslist.org/boa/5897704827.html,1990
62,fair,,2016-11-28 14:15,"Boat is ready to fish. Auto pilot, Radar, Fish finder, Gps, Rod holders and downriggers included",2000,5896371332,,32,,Trojan,,F32,$7500,power, (Kenosha),Trojan F32,https://racine.craigslist.org/boa/5896371332.html,1974
63,excellent,[],2016-11-28 12:52,"Here's a classic boat in great condition! Sure to impress, we just took in this used 1996 VIP 1760 Vision bow rider. Features include a super pro ID Eagle, am/fm stereo, full gauges, carpet, glovebox, windshield, launching trailer, mooring cover and a Merc. 3.0L motor. Call, email or stop by Lakeside Marina in Oshkosh, Wisconsin to take advantage of our great seasonal prices on used boats just like this one!",0,5896205134,,17,,VIP,https://maps.google.com/?q=loc%3A+%39%30%32+Taft+Ave%2E+Oshkosh+WI+US,1760 Vision,,power,,1996 VIP 1760 Vision,https://racine.craigslist.org/bod/5896205134.html,1996
64,excellent,[],2016-11-28 12:22,"This used 2011 Sea Ray 175 Sport is in fantastic shape and is the perfect bowrider for the whole family. Features include full gauges, am/fm CD stereo, bow cushions, bimini top, full mooring cover, launching trailer, swim ladder and  a Merc 3.0L motor. Call, email or stop by Lakeside Marina in Oshkosh, Wisconsin today to see this super clean used bowrider!",0,5896143141,,18,,Sea Ray,https://maps.google.com/?q=loc%3A+%39%30%32+Taft+Ave%2E+Oshkosh+WI+US,175 Sport,,power,,Sea Ray 175 Sport,https://racine.craigslist.org/bod/5896143141.html,2011
65,,[],2016-11-28 12:04,"For more information visit: www.dellsboatshow.com The Wisconsin Dells Boat Show is the western most, true boat show in the state of Wisconsin.  The show features boat dealers who display premiere boat lines ranging from very affordable to exceptionally luxurious.  Other vendors and entertainment are present to add to the experience.  The Wisconsin Dells area is the perfect winter destination with its indoor waterparks and outdoor ski resorts. Location: Woodside Wisconsin Dells Center Dates: Friday, February 3rd, 2017 through Sunday, February 5th, 2017 Friday: 3pm - 9pm Saturday: 9am - 7pm Sunday: 9am - 4pm Admission: Adults = $8.00, Children 12 & Under = Free, Parking = Free",,5896061705,,3,,,https://maps.google.com/?q=loc%3A+%32%31%30%30+River+Rd+Wisconsin+Dells+WI+US,,,human,,"WISCONSIN DELLS BOAT SHOW FEB. 3-5, 2017",https://racine.craigslist.org/bod/5896061705.html,
66,,"['42.605800', '-87.876200']",2016-11-28 11:50,"Hurricane 188 w/Mercruiser 4.3. Has cover, fish finder, bimini Price includes shipping. Call show contact info or show contact info",,5868850322,42.605800,19,-87.876200,,"https://maps.google.com/maps/preview/@42.605800,-87.876200,16z",,$11500,power," (Naples, FL)",2005 Hurricane 188 - REDUCED!,https://racine.craigslist.org/bod/5868850322.html,
67,good,[],2016-11-28 11:33,"This 1988 Lakeland 1578 Pro fishing boat is a little bit older but in FANTASTIC condition and very well maintained. Perfect for the angler in your family. Features include live well, 2 pedestal seats, carpet, rod holders, Hummingbird 541 Sonar, Minnkota Powerdrive Trolling motor, launching trailer and a 40 HP Mariner motor. Call, email or stop by Lakeside Marina in Oshkosh, Wisconsin for more details and price on this great used fishing boat!",0,5896041675,,16,,LakeLand,https://maps.google.com/?q=loc%3A+%39%30%32+Taft+Ave%2E+Oshkosh+WI+US,1578 Pro,,power,,1988 LakeLand 1578 Pro Fishing Boat,https://racine.craigslist.org/bod/5896041675.html,1988
68,,[],2016-11-28 10:21,"The storage accessory you don't want to be without ~ Don't damage your pontoon boat tubes by storing them on cement or wooden blocks ~ Toon Jacks support your boat without damaging your tubes Each pontoon jack block is rated for 3000# so you can safely store any size pontoon boat Made from strong co-polymer plastic that is UV and temperature stable 13""W X 13"" D X 9"" H Proper placement of your Toon Jack storage blocks: place rear storage block at end of each tube and in front under the main weld line where the bow tube is attached to the main pontoon tube Light weight, convenient, stack-able and easy to use; Comes in a set of 4 ~ $115.00 plus tax. Pick up in Pewaukee, WI 53072 If interested contact Ken at show contact info",,5866922394,,1,,,https://maps.google.com/?q=loc%3A+Hickory+Street+at+Forest+Grove+Drive+Pewaukee+WI+US,,$115,human, (Pewaukee),Pontoon Jack / Boat Storage Blocks,https://racine.craigslist.org/bod/5866922394.html,
69,new,[],2016-11-28 10:21,"Yacht Club Single axle ~ bunk style ~ 18'-21' ~ 2310# capacity ~ ST145/R12 tires ~ carpeted bunks ~ winch stand ~ tongue jack ~ Model# P2023 $1,950.00 Call for availability Single axle ~ bunk style ~ 20'-23' ~ 2310# capacity ~ ST145/R12 tires ~ carpeted bunks ~ winch stand/steps ~ tongue jack ~ Model# P2223 $2,150.00 Call for availability Tandem axle with brakes ~ bunk style ~ 20'-23' ~ 4500# capacity ~ ST145/R12 tires ~ carpeted bunks ~ winch stand/steps ~ centering guides ~ tongue jack ~ Model# PTB2245T $3,100.00 Call for availability Tri toon kit an additional $250.00 Tandem axle with brakes ~ bunk style ~ 23'-25' ~ 4500# capacity ~ ST145/R12 tires ~ carpeted bunks ~ deluxe winch stand/steps ~ centering guides ~ tongue jack ~ Model# PTB2445T $3,350.00 In Stock Tri toon kit $250.00 Tandem axle with brakes ~ bunk style ~ 22'-25' ~ 4400# capacity ~ ST175/80D13C tires ~ carpeted bunks ~ deluxe winch stand/steps ~ centering guides  ~ tongue jack ~ Model# PB2444T $3,500.00 Call for availability Tri toon kit an additional $250.00 Tandem axle with brakes ~ bunk style ~ 24'-26' ~ 5600# capacity ~ ST185/80D13C tires ~ carpeted bunks ~ deluxe winch stand/steps ~ centering guides  ~ tongue jack ~ Model# PB2656T $3,750.00 Call for availability Tri toon kit an additional $250.00 Powder coated paint finish ~ 8' - 8'6"" adjustable width ~ bearing buddy/greasable hubs ~ dual safety chains ~ 2"" coupler/4 prong flat wiring ~ front entry steps with hand rail The fun can't start until your boat is in the water! You need a trailer you can depend on for the long haul. Rely on Yacht Club trailers-built to deliver your fun year after year. From their welded steel tubular full-radius frames to their high quality powder coated finish, their trailers are engineered for dependability and reliable service. Call to check stock and availability today! Ken show contact info We also sell Karavan, Shoreland'r, Triton, Trophy and Yacht Club Keywords: Triton, ShoreLand'r, Karavan, Trinity, Trophy, Hoosier, Bunk, Cantilever, Scissor, Pontoon trailer, Trailer, Pwc trailer, Jet ski, Tri-toon, Pontoon, Float on, Yacht club trailers, Boat trailer, Crank-up Pontoon Trailer, Smart Hauler, Nationwide, Wolverine, Sea doo, Tracker, Speedboat, Benington, Crestliner, Premier, Yamaha, Kawasaki, Sureline, Bill-Bar, Magic Tilt, Tom, Trail-rite, easy docks, Max Docks, Superior, Air-Dock, Tom's, trailer Contact Ken @ show contact info for more information and pricing. Trailers are ready for viewing/pick up in Pewaukee, Wi Keywords: Triton, ShoreLand'r, Karavan, Trinity, Trophy, Hoosier, Bunk, Cantilever, Scissor, Pontoon trailer, Trailer, Pwc trailer, Jet ski, Tri-toon, Pontoon, Float on, Yacht club trailers, Boat trailer, Crank-up Pontoon Trailer, Smart Hauler, Nationwide, Wolverine, Sea doo, Tracker, Speedboat, Benington, Crestliner, Premier, Yamaha, Kawasaki, Sureline, Bill-Bar, Magic Tilt, Tom, Trail-rite, easy docks, Max Docks, Superior, Air-Dock, Tom's.",,5856026956,,1,,Yacht Club,https://maps.google.com/?q=loc%3A+%31%31%35%31+Hickory+Street+P+WI+US,Various,,human,,Pontoon Trailers For Sale,https://racine.craigslist.org/bod/5856026956.html,2017
70,good,"['44.022000', '-88.543600']",2016-11-27 19:18,"factory rebuilt 2,3 cobra jet io with low hours,professionally done transom.new starter installad.runs great. would like sold by 11-29 needs clean up",,5895187837,44.022000,17,-88.543600,,"https://maps.google.com/maps/preview/@44.022000,-88.543600,16z",freedom,$1500,power, (oshkosh),1995 four winns freedom and trailer,https://racine.craigslist.org/boa/5895187837.html,1995
71,salvage,"['42.815055', '-87.815292']",2016-11-27 12:49,1960 era hydrodyne boat volvo engine penta outdrive dont know much about it trying to sell for my mom it needs work has all parts does not run comes with trailer make offer does not have title,,5894637584,42.815055,18,-87.815292,Hydrodyne,"https://maps.google.com/maps/preview/@42.815055,-87.815292,16z",,,power,,1960? Classic Hydrodyne boat for sale,https://racine.craigslist.org/boa/5894637584.html,1960
72,,,2016-11-26 11:55,"1992 Lakeland 16 foot. 60 mariner outboard.  Boat is in great shape. Set up great for all inland fishing, bow mount trolling motor.  Minkota 40 lb thrust.  Locators both  council. Pedestal seat in bow and stern deck.  Rod storage    And more.",,5890701109,,16,,,,,$3800,power,,Lakeland fishing boat,https://racine.craigslist.org/boa/5890701109.html,
