,condition,coord_pair,date,description,engine hours (total),id,lat,length overall (LOA),long,make / manufacturer,map_URL,model name / number,price,propulsion type,region,title,url,year manufactured
0,good,,2016-12-20 16:42,"EAGAL 2 FISH FINDER. INSTRUCTIONS INCLUDED. B4 7 PM, I will only sell locally no shipping.",,5927422232,,66,,,,EAGLAL 2,$45,human, (ZION),EAGALE 2 FISH FINDER,https://racine.craigslist.org/boa/5927422232.html,
1,good,,2016-12-20 16:36,Classic 16 foot Ski boat with trailer and 35 horse Mercury motor very good shape or best offer any questions call me,,5916983628,,16,,,,,$1650,power, (Bristol),16ft ski boat today...,https://racine.craigslist.org/boa/5916983628.html,
2,new,,2016-12-20 15:31,clean 1998 sl 780 carbs $50 and stater and flywheel $50 also have air cleaner and air box cover,,5927314221,,7,,,,,$40,power, (sewi),1998 sl780 carbs sold craft polaris,https://racine.craigslist.org/boa/5927314221.html,
3,like new,"['42.666000', '-88.274900']",2016-12-20 14:44,"like new 2013 Zodiac Wave inflatable boat with Mercury 8 hp motor, stand and fuel tank",50,5898769317,42.666000,1,-88.274900,ZODIAC,"https://maps.google.com/maps/preview/@42.666000,-88.274900,16z",WAVE,$2390,power, (burlington),2013 Zodiac Wave with 8 hp Mercury Motor,https://racine.craigslist.org/boa/5898769317.html,2013
4,excellent,,2016-12-20 12:21,"Awesome boat. Like new. Stored for over 6 years in garage by previous owner. Completely set up for inland panfish, Walleye trolling or Lake Michigan trolling. 4 Downriggers, brand new fish finder Hummingbird 688. Ship to shore radio. Yacht Club Trailer. 9.9 Mariner 4 stroke kicker motor and Mercury 115 2 stroke has just had new impellers and pumps. Swim ladder. Bimimi top, electric anchor. Radio. Swing tongue trailer hitch. 2 travel covers. 4 like new seats. MY DREAM BOAT TOTALLY READY FOR ANYTHING BUT HAS TO SELL. Health problems. 12,500 OBO . Has to Go!!!! show contact info",,5917270455,,17,,Lund 1700,,ProSport Adventure,$12500,power,,Lund 1700 Pro Sport Avdenture 2000,https://racine.craigslist.org/boa/5917270455.html,2000
5,new,"['42.605200', '-87.829900']",2016-12-20 10:59,"Don't miss out! Explorer's Guide Maritime Academy is offering a USCG-Approved OUPV (6 Pack) Captains Course in Kenosha over two weeks this January. Class dates/times are: Jan. 11 (5:30-9:30 pm), 13 (5:30-9:30 pm), 14-15 (8 am-5:30 pm), 19-20 (5:30-9:30 pm), and 21-22 (8 am-5:30 pm). Location is at the Merry Yacht Inn, 4815 7th Ave., Kenosha, WI  53140. Explorer's Guide has experienced instructors, small class sizes, one-on-one mentoring, and high pass rate on exams. We also provide valuable (and Free) advice and assistance with your license application. This license is needed to operate vessels carrying paying passengers on US Coast Guard waters. The class covers topics that are important to mariners, with an emphasis on practical insight and safety, including communications, aids to navigation, weather, knot tying, chart plotting, navigational Rules, emergencies, vessel maneuvering and handling, and many others. Course: OUPV (6 Pack) Inland/Great Lakes (all inland waters in the US) - $645 Instructor: Capt. Don Doggett This is a unique opportunity to get the training you need in the Racine/Kenosha area. Enroll today for the Kenosha class by calling show contact info or enroll online at: https://www.explorersguidellc.com/class-schedule/event/281/OUPV-Inland-Great-Lakes-Kenosha--WI- Have questions? Drop me an email message.",1,5926901327,42.605200,1,-87.829900,Explorers Guide,"https://maps.google.com/maps/preview/@42.605200,-87.829900,16z",Maritime Academy,$645,human, (Kenosha),6 Pack Captains Class,https://racine.craigslist.org/boa/5926901327.html,2017
6,good,"['42.388828', '-88.215580']",2016-12-20 09:31,"1986 SYLVAN 17' FISHING BOAT W/150HP EVINRUDE..$1700 WI DNR#: WS 3180BK (sticker good through 2018)-- Engine: 1986 Evinrude XP 150 hp -- Trailer: Shorelander - 2"" Ball Hitch -- Batteries: 1 -- Humminbird 571 HD Fish Finder..like new. -- MinnKota 55PD Trolling Motor -- Accessories: Spare tire; (3) Life preservers; anchor; Schumacher on board battery charger & lights for night use. The carpet is shot and should be replaced, it doesn't have a battery in it to power motor...if seriously interested bring a battery when you come to see and we can fire it up. I have title to boat but being from wi there is no title for trailer. Price is firm as I'm pretty sure the motor alone is worth about over my asking price.",,5917704872,42.388828,17,-88.215580,Sylvan,"https://maps.google.com/maps/preview/@42.388828,-88.215580,16z",,$1800,power, (Wi/il border),**OUT OF SEASON SPECIAL**17' SYLVAN FISHING BOAT WITH 150hp EVINRUDE,https://racine.craigslist.org/boa/5917704872.html,1986
7,excellent,,2016-12-19 21:21,"1999 1650v rebel, tiller,16.6ft, 76in beam. 1996,40 hp tilt and trim outboard. runs 28-30mph with 2 people and full livewell. each seat has air ride shocks. livewell,  roller trailer , spare tire. swing tongue on trailer, anchor. boat,motor,trailer in excellent condition,obo, cash, local pickup.no texts.no emails,if ad is on craigs list boat is still for sale, phone calls only",,5885505652,,16,,lund,,1650v rebel,$5650,power," (Niles,il)",1999Lund 1650v rebel tiller,https://racine.craigslist.org/boa/5885505652.html,1999
8,good,"['42.733888', '-87.780333']",2016-12-19 16:15,"Selling 1982 Cruiser Yacht 26' Chalet Vee 260HP Mercruiser engine. Included 2 Cannon Magnum 10STX down riggers, Lowrance unit fish/depth finder.... Trailer also included. Boat is stored and available to see in Pugh marina, Racine, WI. Please see pictures for more details. Contact me via email for more information.",,5901225524,42.733888,26,-87.780333,Cruiser,"https://maps.google.com/maps/preview/@42.733888,-87.780333,16z",260 Chalet Vee,$6700,power," (racine, Wi)",Selling 1982 Cruiser Yacht 26' Chalet Vee,https://racine.craigslist.org/boa/5901225524.html,
9,,"['43.078800', '-88.272900']",2016-12-19 12:43,"New 2017 pontoon trailers fall clearance. We have Yacht Club, Karavan, Trophy, and Triton Trailers available in stock for pick up in Pewaukee. If we do not have your specific size in stock we can get it within a couple of days. Give us a call Lakeside Solutions LLC. @ show contact info",,5908329928,43.078800,20,-88.272900,,"https://maps.google.com/maps/preview/@43.078800,-88.272900,16z",,$2000,human, (Pewaukee),New Potoon Trailers Fall Clearnce,https://racine.craigslist.org/boa/5908329928.html,
10,,"['42.605200', '-87.829900']",2016-12-19 10:34,1963 MODEL 10302D SERIAL E12814 SEE IN KENOSHA AT 4121-7TH. AVE. RUSS show contact info DOES NOT INCLUDE FUEL TANK OR LINE. DOES INCLUDE STAND SHOWN ON. ESTATE FIND HAS NOT RUN SINCE 2012,,5925474314,42.605200,10,-87.829900,,"https://maps.google.com/maps/preview/@42.605200,-87.829900,16z",,$549,power, (KENOSHA),EVINRUDE OUTBOARD 10HP,https://racine.craigslist.org/boa/5925474314.html,
11,,"['42.605200', '-87.829900']",2016-12-19 10:33,1961 MODEL QD-22 SERIAL 2153798 ESTATE FIND SEE IN KENOSHA AT 4121-7TH. AVE. RUSS show contact info DOES NOT INCLUDE FUEL TANK OR LINE. INCLUDES STAND SHOWN ON. HAS NOT BEEN RUN SINCE 2012,,5925472769,42.605200,10,-87.829900,,"https://maps.google.com/maps/preview/@42.605200,-87.829900,16z",,$495,power, (KENOSHA),JOHNSON OUTBOARD 10HP,https://racine.craigslist.org/boa/5925472769.html,
12,like new,,2016-12-19 08:26,Under 60 hours on outboard....Stored indoors when not being used....one of the finest fishing boats on the market...70 miles per hour top speed....Mike at show contact info,,5902810568,,20,,Skeeter,,TZX200,$20900,power, (Racine Wi),2004 Skeeter TZX200/Yamaha 200 hp HPDI,https://racine.craigslist.org/boa/5902810568.html,
13,,,2016-12-19 07:58,1990 Chris Craft Come pick it up today Sitting on the trailer Questions let me know It's in my heated shop right now Please only inquire if your serious about the boat Thanks,,5919862449,,21,,,,,$5000,power, (Lake Geneva),Chris Craft For Sale $3000 Today,https://racine.craigslist.org/boa/5919862449.html,
14,,"['42.692403', '-87.898511']",2016-12-18 19:45,Hello looking to sell my tracker 10 ft it's in almost new condition it self the motor was used as a emergency kicker on a diff boat of mine and has virtually no hrs on it at all and practicaly new as u can tell from pics the trolling motors a minn cota tht works good just lil older but looking to get 900 sorry no trailer I always just put boat in bed of my truck n got out there but call or txt show contact info,,5893784247,42.692403,10,-87.898511,,"https://maps.google.com/maps/preview/@42.692403,-87.898511,16z",,$900,power, (Sturtevant),"10 ft flat bottom tracker,97 Yamaha 4hp ,trolling motor",https://racine.craigslist.org/boa/5893784247.html,
15,,,2016-12-18 15:35,1941 Johnson DT10 outboard motor For parts or restore. Missing half the motor shroud and spark plugs. Motor turns freely Make offer .,,5924595761,,194,,,,,,power,,Antique Outboard Motor Johnson DT10 1941,https://racine.craigslist.org/boa/5924595761.html,
16,good,"['42.274200', '-88.192600']",2016-12-18 14:28,Run great. Comes with GPS locator system and trolling motor.,100,5924548899,42.274200,18,-88.192600,Ranger,"https://maps.google.com/maps/preview/@42.274200,-88.192600,16z",Comanche,$4500,power," (Island Lake, IL)",Comanche ranger for sale,https://racine.craigslist.org/boa/5924548899.html,1997
17,,"['42.729739', '-87.887020']",2016-12-18 12:05,"89 Cajun Armorcraft center console 74 Evinrude 135hp runs fantastic Composite over aluminum grid transom. No Rot ever and super strong. 10"" jack plate brand new this year 11 speaker alpine stereo brand new this year 20a 3 bank onboard battery charger brand new this year 3 new batteries this year Minnkota bow mounted trolling motor older but it works great 02 eagle 2 depth/fish finder New bilge pump New livewell pump Led lights on deck and in cooler For sale or trade Snowmobile motorcycle truck diesel skidsteer car cash",,5886388466,42.729739,17,-87.887020,Cajun,"https://maps.google.com/maps/preview/@42.729739,-87.887020,16z",Armorcraft   17cc,$4500,power, (Mt. Pleasant),Cajun Armorcraft 17cc 135hp Evinrude,https://racine.craigslist.org/boa/5886388466.html,
18,good,"['42.381300', '-87.999100']",2016-12-18 08:53,"For sale is a 1994 16' Mirrocraft 1628 Troller aluminum fishing boat.  Below are the details: -1994 40hp Mercury outboard with power trim/tilt and oil injection.  Comes with Michigan Wheel Apollo Solas SS prop and spare aluminum prop.  This is a powerful 40hp as its 4 cylinders.  I've had this boat at 35mph on the gps.  It's no slug.for a 40hp -1994 3.3hp kicker trolling motor -Power-lift 6"" setback jackplate -12 gallon gas tank (under rear seat) -Garmin ecoMAP 50dv main fishfinder.  It has everything....down imaging, chartplotter, ect. -Minn Kota Power Drive V2 50# thrust with copilot.  In addition a Garmin Striker 4DV color front fishfinder.  That had CHIRP down imaging as well. -2 new batteries. -2 spare tires. -covers for the bow and stern (not much life left though) -3 RAM rod holders -LED lighting in the boat. -EZ Loader trailer.  No title, cause it's a WI boat.  All info is on the trailer though for title and plating, if needed. -brand new trailer jack The only reason I'm selling the boat is because I have 2 boys and we need a bigger boat. This is a great starter boat, that is low maintenance and has everything you need to start fishing immediately.",,5884469758,42.381300,16,-87.999100,Mirrocraft,"https://maps.google.com/maps/preview/@42.381300,-87.999100,16z",1628 Troller,$5000,power, (Lindenhurst),1994 Mirrocraft 1628 Troller fishing boat,https://racine.craigslist.org/boa/5884469758.html,1994
19,excellent,,2016-12-17 11:34,1990 Alumacraft T 12 fishing boat. Small enough to carry on top of your vehicle. Excellent condition. Very clean. No leaks. Great Christmas Gift!! Trailer and motor are not available.,,5881931554,,12,,Alumacraft,,T 12,$375,power, (Il/Wi State Line),Alumacraft T12 Excellent Condition,https://racine.craigslist.org/boa/5881931554.html,1990
20,,,2016-12-17 11:34,Johnson 5 1/2 hp Runs great. Great Christmas gift for the fisherman/fisherwoman!!,,5883406079,,12,,Johnson,,5 1/2 hp,$425,power, (Il/Wi State Line),Johnson Outboard 5 1/2hp -,https://racine.craigslist.org/boa/5883406079.html,
21,,,2016-12-17 11:34,"Great Christmas Gift. Northwood Model 1452 (14') Aluminum fishing boat in very good condition. At this price it wont be around long.  Motor is available under a different posting ""Johnson Outboard 5 1/2hp"".  Trailer is not available.  Thanks",,5883410822,,15,,Northwood,,1452,$390,power, (Il/Wi State Line),Northwood Aluminum Boat,https://racine.craigslist.org/boa/5883410822.html,
22,good,"['42.532500', '-88.047800']",2016-12-16 12:46,24' Aqua Patio 35 HP Johnson outboard Captains chair and 2 front folding chairs. Carpet is in good condition. Pontoons are in good condition. Transom is good. Overall excellent shape. Text with questions. *Troling motor and battery not included.  No trailer but delivery available.,000,5880394071,42.532500,24,-88.047800,Aqua Patio,"https://maps.google.com/maps/preview/@42.532500,-88.047800,16z",Fishing,$1600,power, (Bristol),"Pontoon Boat, bowfishing boat, John boat,",https://racine.craigslist.org/boa/5880394071.html,1988
23,,,2016-12-15 06:32,I have my 1930/40s Palmer ice boat for sale $1000,,5877630834,,16,,,,,,sail,,Palmer Ice boat,https://racine.craigslist.org/boa/5877630834.html,
24,,"['42.363618', '-88.086662']",2016-12-14 13:10,NICE LONG 13' GALVANIZED TRAILER ORIGINALLY FOR A SMALL BOAT AND HAS TILT PERFECT FOR A 3 SEATER WAVE RUNNER OR EVEN A 2 SEATER WITH ROOM ON THE FRONT FOR A STORAGE BOX OR GAS CANS WITH EITHER ONE. I USED IT TO TOW A 3 SEATER SEA DOO GTI 10' WAVE RUNNER NEW LIGHTS NEW WOOD BUNKS NEW CARPET $300 CASH FIRM - NO TITLE,,5912500905,42.363618,13,-88.086662,,"https://maps.google.com/maps/preview/@42.363618,-88.086662,16z",,$300,power," (ROUND LAKE BEACH, IL)","Small boat trailer, jet ski, wave runner 13' long galvanized",https://racine.craigslist.org/boa/5912500905.html,
25,,"['42.493428', '-87.805309']",2016-12-14 11:13,"Looking for a new marina? Tired of looking at trash? Dirty bathrooms? Rotten dock boards? Weeds in the water? Prairie Harbor Yacht Club is the premier marina on Lake Michigan! - We dredge our channel every year. - We spray for weeds in the harbor every year. - We are a gated facility: your family, your boat, and your vehicles are safe here. - Clean bathrooms, clean docks, clean facility. - We pump out your boat in its slip FOR FREE once a week. - We offer grills at every dock, and we provide the propane. - Our staff are friendly and detail oriented. We'll take care of you! PHYC show contact info 12800 Lakeshore Dr Pleasant Prairie, WI www.PrairieHarborYachtClub.com",,5908052565,42.493428,40,-87.805309,,"https://maps.google.com/maps/preview/@42.493428,-87.805309,16z",,$3400,power," (Pleasant Prairie, WI)",BOAT SLIPS,https://racine.craigslist.org/boa/5908052565.html,
26,,,2016-12-14 06:01,"***Boat has been winterized and stored. 87 four-winns 160 freedom 16' boat with  3.0 mercruiser i/o Just had the outdrive rebuilt, new seals impeller, engine tune up, new plug wires, carb cleaned, new belt, new battery, brand new tires on the trailer, packed the bearings, changed all bulbs, boat has custom very nice cover, I took the back to back seats out and put helm chairs in for more room. I took the speakers out because they were blown. The boat is water ready, Ive had it out many times this year, and will drop it in the water for a serious buyer with cash in hand. I went thru everything on this boat with the intention on keeping it for a while, had an opportunity to buy a fishing boat from a relative, so this ones got to go!! Don't waste my time with low-ball offers, look what people are selling non water ready boats for... Call/text show contact info $3000firm I will trade trades for a polaris ATV or snowmobile sportsman scrambler Boat will need the exhaust bellows changes at the end of the season, its fine now, and still runs great. fish ski boat fish/ski bowrider bow rider open bow runabout 4winns 4 winns rinker marriah wellcraft marada chaparral bayliner stratos larson celebrity cobalt",,5918747881,,16,,,,,$3000,power, (Waukegan),1987 Four Winns 160 freedom  PRICE REDUCED,https://racine.craigslist.org/boa/5918747881.html,
27,excellent,"['42.230800', '-88.332400']",2016-12-13 21:18,"RESCUE  1988 14' ACHILLES INFLATABLE COLOR - RED MODEL SK-140 FIRE RESCUE BOAT, WITH ALUMINUM FLOOR with 30- HP EVINRUDE MOTOR , and trailer hull # ACH00270K788 WILL POST PHOTOS SOON    $4000.00 now 2900",,5877256478,42.230800,14,-88.332400,ACHILLES,"https://maps.google.com/maps/preview/@42.230800,-88.332400,16z",SK-140,$2900,power, (CRYSTAL LAKE IL),RESCUE  1988 14' ACHILLES INFLATABLE,https://racine.craigslist.org/boa/5877256478.html,1988
28,,"['42.640182', '-88.288087']",2016-12-13 11:31,"1994 Lowe 20 Foot Pontoon Boat with 50HP Johnson Outboard with tilt and trim.  Premix gas and oil.  Clean interior with lots of storage space.  AM/FM and CD stereo.  TRAILER NOT INCLUDED.  If sold this fall, winterize, shrink wrap and storage included for winter of 2016/2017 at asking price.  Asking $3995.00 OBO.  Call show contact info The Pontoon Boat has been Winterized, Shrinkwrapped and is currently being stored outside, But it is Still For Sale. This is a Fall Sale Price. The price will increase come spring. Thanks",,5917728791,42.640182,20,-88.288087,,"https://maps.google.com/maps/preview/@42.640182,-88.288087,16z",,$3995,power, (Burlington),1994 Lowe 20 Foot Pontoon Boat,https://racine.craigslist.org/boa/5917728791.html,
29,good,"['41.352600', '-88.841600']",2016-12-12 00:52,"Great Christmas gift for the whole family. A lot of boat for the money. Twin 350 v-drive with 900 hours. Full size fridge, oven with 3 burner range (rare), wet bar, master suite with full size bed and closet. 1 bath with separate shower, power head and waste gauge. Pull-out couch and dinette both turn into beds to sleep 6 total. Nice spacious salon for entertainment, with and new Sony stereo with remote for bridge control. New depth finder, 15 mile radar, standard VHF radio and Hailer. New Captains chair, new rear bench, and new interior carpeting. Also recent bolster pads in the after and all new teak steps. Interior redone a few years ago, and new carpet being installed. Inside storage paid for this winter.",900,5905264629,41.352600,32,-88.841600,Carver,"https://maps.google.com/maps/preview/@41.352600,-88.841600,16z",3297,$25900,power, (Ottawa),1988 Carver Mariner 3297,https://racine.craigslist.org/boa/5905264629.html,1988
30,,"['42.724200', '-87.855100']",2016-12-11 21:51,18 1/2' ft Aluminum Crestliner 125 HP Mecury Motorguide trolling motor 2 brand new Lowrance fish locators * Just had boat completely  serviced/inspected,,5905612881,42.724200,18,-87.855100,,"https://maps.google.com/maps/preview/@42.724200,-87.855100,16z",,$10495,power,,Crestliner Fishing Boat,https://racine.craigslist.org/boa/5905612881.html,
31,,,2016-12-11 12:43,"I have a 88 hydrostream V-King YT fore sale this boat has new balsa core stringers floor carpet all new custom interior hot foot and shifter new gauges (gps speedo) no cracks in windscreen boat only has 20 hours on it since restoration  has original gel that shines great have a 10"" Manuel jack plate that comes with boat is rigged for Mercury trailer has all new led lights new bunks and carpet also has full cover (not the best but still usable) this boat is ready for your power and hit the lake asking $5500 OBO  must sell have to many boats any questions call or text Brady show contact info",,5915038027,,18,,Hydrostream,,V-king YT,$5500,power, (Salem),1988 hydrostream V-King YT,https://racine.craigslist.org/boa/5915038027.html,1988
32,good,,2016-12-10 11:52,"** Price Reduced **Would be an AWESOME Christmas Gift under the tree!!  Sunfish in excellent condition with Title! One of the few around of this age and vintage that has been well cared for and in exceptional condition. Wood dagger and tiller and original sail in very good condition. 1986 Model with aft cuddy. The trailer is not available. If you're looking for a great Sunfish, this would be it!! I just took these pics and the hull would look even better with a coat of marine wax.",,5873334023,,14,,AMF Alcort,,,$1450,sail, (Il/Wi State Line),Sunfish Sailboat (Great Christmas Gift!!),https://racine.craigslist.org/boa/5873334023.html,
33,,"['45.821900', '-88.068300']",2016-12-09 19:26,"1998 Crestliner Eagle 2450 in EXCELLENT condition Seating for 6 Hard top with rod holders Recently rebuilt Chevy V-6 engine block Stainless steel dual Bravo prop for added power and maneuverability Yamaha 9.9 hp kicker with electric start, power trim New TrollMaster Pro 2 for precise trolling speed control Lowrance HD-7 GPS Dual Cannon electric downriggers Fish Hawk digital speed/temp system New marine radio Sony sound system Porta Potti and sink in cabin 110v AC hook up New LED deck and docking lights Like new full canvas system Heavy duty galvanized trailer with new radial tires Heavy duty electric winch with battery and remote control Two new starting batteries New wash down system ON ALERT FOR SCAMS.",,5913000880,45.821900,24,-88.068300,Crestliner,"https://maps.google.com/maps/preview/@45.821900,-88.068300,16z",2450 Eagle,$16900,power,,Crestliner 2450 Eagle,https://racine.craigslist.org/boa/5913000880.html,1998
34,,,2016-12-08 21:23,"Up for sale or possible trade is my 32 foot (11'11"" beam) 1979 Bayliner Yachts Conquest 3150 dual station (bridge inside and another up top). I got the boat last year on a trade and loved every moment with it. As did the rest of my family.  While i would love to keep her and like we did last year take her out every weekend it's just not in the cards for me right now. So i thought i'd put it here and see what happens. I did set the price a bit low from the NADA guide suggested price cause there are 3 relative issues that i understand affect such things. Those are.... 1.) She is still in winter storage with a $975 balance to put her back in the water and would need a slip. 2.) The port starter has a dead spot. So while it can be rotated and made to work it could use to be replaced or at least rebuilt 3.) The previous owner took apart the fresh water system for whatever reason... He said it was all there and just needed to be put back together and it looked like it was there but i always just brought water out with me to use for me and the kids and never worried about it. I did start cleaning it up last year and did even add 4 large solar panels to the front and a setup of 8 batteries that are tied to the bilge system but i put a sort of fuse panel on it with additional spots the plan had been to move the fridge and radio and lighting to those so i could leave the house batteries (which i did add 2 and replaced one bad one) purely for starting and running. Like i said we used it nearly every weekend right up until the end of October. Just dont have the time or cash or motivation for it right now and with health issues is kinda been put on the back burner. So i will entertain any reasonable offer. Like i said i have already come down quite a bit from what NADA suggested. Will also consider trades or partial trades for things like a camper, atv(s), or smaller boat and wave-runner, or just about anything my kids could enjoy that can be a little easier for me to manage. Again thank you for looking and since i guess i must note this no i'm not looking for help selling and will not ship it to your 3rd world country. (never thought i'd have to say that for for a 32ft boat lol)",,5874757414,,32,,Bayliner,,Conquest 3150,$4500,power, (Racine),1979 Conquest 3150 *PRICE DROP*,https://racine.craigslist.org/boa/5874757414.html,1979
35,like new,"['42.570900', '-88.128700']",2016-12-08 19:07,Just like title says great condition $700 will consider trades,,5911559360,42.570900,17,-88.128700,,"https://maps.google.com/maps/preview/@42.570900,-88.128700,16z",,,human,,17'grumman canoe like new,https://racine.craigslist.org/boa/5911559360.html,
36,,,2016-12-07 18:19,"For sale I've got my bass boat it's got a 150 johnson. It's one fast boat! Motor has been gone over top to bottom cleaned and tuned. I've got new seats for it, new batteries, and all accessories go with the boat. Boat runs great had it out all summer long. I would trade for a atv.",,5910089145,,1,,Stratos,,,$4900,power, (racine),Stratos bass boat,https://racine.craigslist.org/boa/5910089145.html,
37,,"['42.745373', '-88.014565']",2016-12-07 17:10,Large INDOOR storage Please see ad for more information Or call show contact info Chopper / show contact info Bryan,,5869834657,42.745373,25,-88.014565,,"https://maps.google.com/maps/preview/@42.745373,-88.014565,16z",,,power,,INDOOR STORAGE,https://racine.craigslist.org/boa/5869834657.html,
38,good,"['42.523200', '-88.257300']",2016-12-07 10:11,14 foot deep v extra wide. Has 25 hp Erin rude electric start. Has removable duck blind. Fish locator and 30 lb thrust trolling motor,,5886592872,42.523200,14,-88.257300,Landau,"https://maps.google.com/maps/preview/@42.523200,-88.257300,16z",,$2000,power, (TWIN LAKES),Hunting boat,https://racine.craigslist.org/boa/5886592872.html,
39,fair,,2016-12-06 17:14,"1984 vc200 newly rebuilt motor, new (not professionally done) upholstery, newer prop, trailer wiring and ignition. needs a little more technical but is a good boat. floats no problem and bilge pump works like a charm 1500 obo. willing to negotiate. no lowballers or tire kickers. serious buyers only please. I'm not in a hurry to sell just one to many projects right now and she's at the lower end of the list.",,5866166149,,20,,imperial,,vc200,$1300,power, (kenosha),1984 vc200,https://racine.craigslist.org/boa/5866166149.html,1984
